name,status_id,created_at,text,is_quote,is_retweet,reply_to_user_id,hashtags
Adam Elster,1177225351489085440,2019-09-26T14:16:10Z,"Breaking: @Majesco_Inc Once Again Named a Leader in @Gartner_inc Magic Quadrant for P&C Core Insurance Platforms, North America!//t.co/rmLA4909LG #MQ//t.co/BmokTQX9Ed",FALSE,TRUE,NA,NA
Adam Elster,1176543143115808770,2019-09-24T17:05:19Z,InsurTech Innovator @AvinewInsurance will leverage @Majesco_Inc's cutting-edge capabilities to fuel the future of car insurance! See how://t.co/Vbs2XR3Sx6 #futureofinsurance #ITC2019//t.co/M1CvylN85M,FALSE,TRUE,NA,NA
Adam Elster,1176536216042446865,2019-09-24T16:37:47Z,"YES! It's not science fiction and needs to happen....we have to disrupt ourselves! We have smart, hard-working people but we all need InsureTechs to lead the way. @Allstate President Glenn Shapiro #ITC2019//t.co/W2A6Y1GnDh",FALSE,FALSE,NA,ITC2019
Adam Elster,1176535563186376712,2019-09-24T16:35:11Z,Small adoption across the industry of modern technology to change and disrupt the industry. @Allstate Personal Lines President Glenn Shapiro at #ITC2019//t.co/nNYGzumAwQ,FALSE,FALSE,NA,ITC2019
Adam Elster,1176534954605522944,2019-09-24T16:32:46Z,10 days and still no repair to the car...we really haven't changed the fundamental problem in our business in 20 years. @Allstate Personal Lines President Glenn Shapiro at #ITC2019//t.co/1deRhzEIXE,FALSE,FALSE,NA,ITC2019
Adam Elster,1176532038297489409,2019-09-24T16:21:11Z,President of @Allstate personal lines talking insurance #disruption we need to think differently as an industry #itc2019//t.co/U1zqEsgVZu,FALSE,TRUE,NA,disruption
Adam Elster,1176532038297489409,2019-09-24T16:21:11Z,President of @Allstate personal lines talking insurance #disruption we need to think differently as an industry #itc2019//t.co/U1zqEsgVZu,FALSE,TRUE,NA,itc2019
Adam Elster,1176531502416445445,2019-09-24T16:19:03Z,We in the insurance industry have been in a bubble that has to burst and we need to think differently. @Allstate President Glenn Shapiro at #ITC2019//t.co/yoQFr4LyqH,FALSE,FALSE,NA,ITC2019
Adam Elster,1176530736347865091,2019-09-24T16:16:01Z,"Live From #ITC2019: At @insuretechnow main stage session, @ChrisColborn of our creative consultancy @Lippincottbrand asks insurers: ""What business are we in?"" & challenges #insurance providers to reexamine how they add value to the market.//t.co/6aE59c3fl3 #OWInsurTech//t.co/OkI6rTiMr6",FALSE,TRUE,NA,ITC2019
Adam Elster,1176529933339955206,2019-09-24T16:12:49Z,"We're not in the insurance business. People don't want insurance; they want what it does for them #ITC2019 @lippincottbrand Chris Colborn Customers don't want a sales agent. They want to relate, connect, feel protected, ushered, cared for @HearsaySystems//t.co/OeCUvonujS//t.co/qgW2jqTMb6",FALSE,TRUE,NA,ITC2019
Adam Elster,1176524387262111749,2019-09-24T15:50:47Z,Happening onstage at #ITC2019 now: @caribou101: I am obsessed with APIs. Good thing @Majesco_Inc platforms come prebuilt with more than 800 insurance APIs!//t.co/08c9VFf2C3,FALSE,FALSE,NA,ITC2019
Adam Elster,1176490997427007489,2019-09-24T13:38:06Z,"Top 10 Plays of the week @LivLancers07039 @elijah_elster @MatchFitAcademy Livingston's Elster is down, but never out: Livingston goalkeeper Elijah Elster made this terrific one-handed save in the waning minutes of regulation as Livingston defeated Verona //t.co/9iImzTFQBo",FALSE,FALSE,NA,NA
Adam Elster,1176484939963031552,2019-09-24T13:14:02Z,And you can catch @AvinewInsurance's @DannyPeate on stage at #ITC2019 for @Majesco_Inc's panel with @safesitetech's Emilio Figueroa and @HtfdSteamBoiler's Raja Manickavasagam! Hear from true insurance disruptors who are making the #futureofinsurance real ! #ITC2019//t.co/cAvo5tVctD,TRUE,FALSE,NA,ITC2019
Adam Elster,1176484939963031552,2019-09-24T13:14:02Z,And you can catch @AvinewInsurance's @DannyPeate on stage at #ITC2019 for @Majesco_Inc's panel with @safesitetech's Emilio Figueroa and @HtfdSteamBoiler's Raja Manickavasagam! Hear from true insurance disruptors who are making the #futureofinsurance real ! #ITC2019//t.co/cAvo5tVctD,TRUE,FALSE,NA,futureofinsurance
Adam Elster,1176484939963031552,2019-09-24T13:14:02Z,And you can catch @AvinewInsurance's @DannyPeate on stage at #ITC2019 for @Majesco_Inc's panel with @safesitetech's Emilio Figueroa and @HtfdSteamBoiler's Raja Manickavasagam! Hear from true insurance disruptors who are making the #futureofinsurance real ! #ITC2019//t.co/cAvo5tVctD,TRUE,FALSE,NA,ITC2019
Adam Elster,1176483995892076544,2019-09-24T13:10:17Z,InsurTech Innovator Avinew Selects Majesco P&C Core Suite on Majesco CloudInsurer as Its Platfor...//t.co/k8skudHZ5q via @YahooFinance,FALSE,FALSE,NA,NA
Adam Elster,1176482871378423808,2019-09-24T13:05:49Z,"It was a great discussion on how rating and regulation can influence innovation with @denisegarth, Majesco and Edin Imsirovic, A.M. BEST EUROPE - INFORMATION SERVICES LIMITED. #InsureTechConnect2019//t.co/y9GXoO5ZeD",FALSE,TRUE,NA,NA
Adam Elster,1176262053155049472,2019-09-23T22:28:22Z,"Speed to Market...Majesco has the 3 F's ! Fast, Flexible and Fun #ITC2019 now: @MunichRe_US's Srinivas Pulijala and @AvinewInsurance's @DannyPeate talk to @majesco_inc//t.co/hB0sFowN8I",FALSE,FALSE,NA,ITC2019
Adam Elster,1176255172135096320,2019-09-23T22:01:01Z,Happening onstage at #ITC2019 now: @MunichRe_US's Srinivas Pulijala and @AvinewInsurance's @DannyPeate talk to @majesco_inc about creating insurance for a new generation !//t.co/OjFhTVTChF,FALSE,FALSE,NA,ITC2019
Adam Elster,1176236791780847621,2019-09-23T20:47:59Z,Awesome lineup of industry influencers on stage with @Majesco_Inc at #ITC2019! @Aon_plc's Michael Roe; @AmCapInsurance's Danielle Andrew; and @MMGInsurance's Jason Ennis get real about shaping the #futureofinsurance !//t.co/i4CQvcZKS3,FALSE,FALSE,NA,ITC2019
Adam Elster,1176236791780847621,2019-09-23T20:47:59Z,Awesome lineup of industry influencers on stage with @Majesco_Inc at #ITC2019! @Aon_plc's Michael Roe; @AmCapInsurance's Danielle Andrew; and @MMGInsurance's Jason Ennis get real about shaping the #futureofinsurance !//t.co/i4CQvcZKS3,FALSE,FALSE,NA,futureofinsurance
Adam Elster,1176234755563507712,2019-09-23T20:39:53Z,"#ITC2019 @insuretechnow @Majesco_Inc amazing panel with AMcap, MMG, and AON if we did it the old way it would take us over 10 years to do what we need to do in 1//t.co/qItkWBsbv8",FALSE,FALSE,NA,ITC2019
Adam Elster,1176234618393153537,2019-09-23T20:39:21Z,I'm excited to talk about how to talk to #regulators & #test in a #regulated world. #business #customer #innovation #risk//t.co/AOy6EbASUt,FALSE,TRUE,NA,regulators
Adam Elster,1176234618393153537,2019-09-23T20:39:21Z,I'm excited to talk about how to talk to #regulators & #test in a #regulated world. #business #customer #innovation #risk//t.co/AOy6EbASUt,FALSE,TRUE,NA,test
Adam Elster,1176234618393153537,2019-09-23T20:39:21Z,I'm excited to talk about how to talk to #regulators & #test in a #regulated world. #business #customer #innovation #risk//t.co/AOy6EbASUt,FALSE,TRUE,NA,regulated
Adam Elster,1176234618393153537,2019-09-23T20:39:21Z,I'm excited to talk about how to talk to #regulators & #test in a #regulated world. #business #customer #innovation #risk//t.co/AOy6EbASUt,FALSE,TRUE,NA,business
Adam Elster,1176234618393153537,2019-09-23T20:39:21Z,I'm excited to talk about how to talk to #regulators & #test in a #regulated world. #business #customer #innovation #risk//t.co/AOy6EbASUt,FALSE,TRUE,NA,customer
Adam Elster,1176234618393153537,2019-09-23T20:39:21Z,I'm excited to talk about how to talk to #regulators & #test in a #regulated world. #business #customer #innovation #risk//t.co/AOy6EbASUt,FALSE,TRUE,NA,innovation
Adam Elster,1176232253774426112,2019-09-23T20:29:57Z,#ITC2019 @Majesco_Inc @insuretechnow 2 Speed model is critical to execute and support ops and innovation//t.co/SQe8YyRXuj,FALSE,FALSE,NA,ITC2019
Adam Elster,1176231584023736320,2019-09-23T20:27:17Z,#ITC2019 @insuretechnow @Majesco_Inc Manish Shah Insurance Platforms are being reimagined the future is here...//t.co/9FIYkKHZWp,FALSE,FALSE,NA,ITC2019
Adam Elster,1176227301647736833,2019-09-23T20:10:16Z,@Majesco_Inc @insuretechnow Innovation is a strategic priority for all insurance companies @denisegarth//t.co/tdZVtNHysQ,FALSE,FALSE,NA,NA
Adam Elster,1176188359846301699,2019-09-23T17:35:32Z,"You'll only see this panel together at @insuretechnow: @denisegarth moderating @avinewinsurance's @dannypeate, @safesitetech's Emilio Figueroa and @HtfdSteamBoiler's Raja Manickavasagam! #ITC2019//t.co/40urhz7gU0",FALSE,TRUE,NA,NA
Adam Elster,1176188295585390593,2019-09-23T17:35:16Z,We are excited to join @Majesco in driving the convo on insurance innovation at #ITC2019. Make sure to stop by @DannyPeate discussion panel Wednesday Sept. 25 at 10:30 am! See you in Vegas! //t.co/H1OgXA9UH4 via @YahooFinance,FALSE,TRUE,NA,ITC2019
Adam Elster,1175249245743583232,2019-09-21T03:23:49Z,@LivLancers07039//t.co/0ObgD4Ug57,FALSE,FALSE,781148399567511552,NA
Adam Elster,1175230035894120448,2019-09-21T02:07:29Z,@sfaytok78 Thanks !,FALSE,FALSE,19550644,NA
Adam Elster,1175229721682096131,2019-09-21T02:06:15Z,@sfaytok78 goalie is senior Captain Elijah Elster//t.co/vavNdvHpbM,FALSE,FALSE,19550644,NA
Adam Elster,1175223068979077120,2019-09-21T01:39:48Z,@sfaytok78 the goalies names is Elijah Elster//t.co/WntLrxwJ6S,FALSE,FALSE,19550644,NA
Adam Elster,1175217109938376705,2019-09-21T01:16:08Z,Elster with a huge one-handed save for Livingston to keep it 1-1 in the 75th #njsoccer//t.co/3OMWqTpWAg,FALSE,TRUE,NA,njsoccer
Adam Elster,1175187680872808449,2019-09-20T23:19:11Z,Awesome save !!! Great win !//t.co/eVRZYxSXEW,TRUE,FALSE,NA,NA
Adam Elster,1175187299719700480,2019-09-20T23:17:40Z,Here is a look at Phillip Rodrigues' game-winner for Livingston #njsoccer//t.co/CTtAVauSxZ,FALSE,TRUE,NA,njsoccer
Adam Elster,1174752548458287108,2019-09-19T18:30:08Z,Would you? Could you? Buy a house? Buy a car? Buy and manage insurance...online and on-demand? So would I. The #futureofinsurance starts with @Majesco_Inc. Watch://t.co/08c9VFf2C3,FALSE,FALSE,NA,futureofinsurance
Adam Elster,1172185444668387328,2019-09-12T16:29:22Z,New Story: Boys Varsity Soccer beats Newark Academy 2 - 1//t.co/knW0BFQFMI,FALSE,TRUE,NA,NA
Adam Elster,1172133350045376512,2019-09-12T13:02:22Z,@LivLancers07039 nice win...and check out the save even with the kick to the neck !//t.co/ki5Wwg054L,FALSE,FALSE,781148399567511552,NA
Adam Elster,1171851239954558977,2019-09-11T18:21:22Z,It's hard to believe its been 18 Years since my personal front row seats at 140 Broadway to 9-11. Sounds of Silence Tribute by Steve A. (Disturbed)//t.co/SqjJol0Vr5 via @YouTube May the memory of all the victums be a blessing to their families and friends,FALSE,FALSE,NA,NA
Adam Elster,1171421466543480832,2019-09-10T13:53:36Z,Super excited to welcome Carolyn to our Board of Directors and look forward to the value she will bring as @Majesco_Inc executes its vision for the #futureofinsurance and lays a path of innovation and transformation for the industry! #CorpGov #boardmembers #board//t.co/QNNBG4KFtW,TRUE,FALSE,NA,futureofinsurance
Adam Elster,1171421466543480832,2019-09-10T13:53:36Z,Super excited to welcome Carolyn to our Board of Directors and look forward to the value she will bring as @Majesco_Inc executes its vision for the #futureofinsurance and lays a path of innovation and transformation for the industry! #CorpGov #boardmembers #board//t.co/QNNBG4KFtW,TRUE,FALSE,NA,CorpGov
Adam Elster,1171421466543480832,2019-09-10T13:53:36Z,Super excited to welcome Carolyn to our Board of Directors and look forward to the value she will bring as @Majesco_Inc executes its vision for the #futureofinsurance and lays a path of innovation and transformation for the industry! #CorpGov #boardmembers #board//t.co/QNNBG4KFtW,TRUE,FALSE,NA,boardmembers
Adam Elster,1171421466543480832,2019-09-10T13:53:36Z,Super excited to welcome Carolyn to our Board of Directors and look forward to the value she will bring as @Majesco_Inc executes its vision for the #futureofinsurance and lays a path of innovation and transformation for the industry! #CorpGov #boardmembers #board//t.co/QNNBG4KFtW,TRUE,FALSE,NA,board
Adam Elster,1169466023277285376,2019-09-05T04:23:22Z,Boys Soccer: Livingston Ties Millburn in 2019 Season Opener//t.co/n59T9xwfMa @LivLancers07039,FALSE,FALSE,NA,NA
Adam Elster,1167078442355089408,2019-08-29T14:15:58Z,Boys Soccer Preview: Goalkeepers to watch in North 1: Elijah Elster @LivLancers07039//t.co/9YblkoHiuI,FALSE,FALSE,NA,NA
Adam Elster,1166815340514484224,2019-08-28T20:50:30Z,Worth a watch: Great video from @Westfield1848's @cdwelsh on the challenges and opportunities in insurance today//t.co/RjTVS784db #futureofinsurance @Majesco_Inc,FALSE,FALSE,NA,futureofinsurance
Adam Elster,1166721042221543424,2019-08-28T14:35:47Z,"Thanks to all that came out today @InsCanada to listen to @denisegarth as she shared insights on how to modernize, optimize and create your path to the future of insurance! # Majesco #ICXF2019//t.co/Gb7BalcSPw",FALSE,TRUE,NA,NA
Adam Elster,1166704685039915008,2019-08-28T13:30:47Z,"BREAKING: @Majesco_inc Positioned as a Visionary in Gartner 2019 Magic Quadrant for Life Insurance Policy Administration Systems, North America #lifeinsurance #gartnermq//t.co/uRmT8idNno",FALSE,TRUE,NA,NA
Adam Elster,1166329019886899200,2019-08-27T12:38:02Z,"What if insurance was as easy, seamless and powerful as any business or personal service we expect? If you don't know about @Majesco Digital1st Insurance, watch this://t.co/08c9VFf2C3 #futureofinsurance #PaaS #microservices",FALSE,FALSE,NA,futureofinsurance
Adam Elster,1166329019886899200,2019-08-27T12:38:02Z,"What if insurance was as easy, seamless and powerful as any business or personal service we expect? If you don't know about @Majesco Digital1st Insurance, watch this://t.co/08c9VFf2C3 #futureofinsurance #PaaS #microservices",FALSE,FALSE,NA,PaaS
Adam Elster,1166329019886899200,2019-08-27T12:38:02Z,"What if insurance was as easy, seamless and powerful as any business or personal service we expect? If you don't know about @Majesco Digital1st Insurance, watch this://t.co/08c9VFf2C3 #futureofinsurance #PaaS #microservices",FALSE,FALSE,NA,microservices
Adam Elster,1163867489496780805,2019-08-20T17:36:47Z,Join the Majesco Team at #Insurtech.//t.co/dHiw04cSwQ #ITC2019 #majesco//t.co/Zs2wi6Ubjy,FALSE,TRUE,NA,Insurtech
Adam Elster,1163867489496780805,2019-08-20T17:36:47Z,Join the Majesco Team at #Insurtech.//t.co/dHiw04cSwQ #ITC2019 #majesco//t.co/Zs2wi6Ubjy,FALSE,TRUE,NA,ITC2019
Adam Elster,1163867489496780805,2019-08-20T17:36:47Z,Join the Majesco Team at #Insurtech.//t.co/dHiw04cSwQ #ITC2019 #majesco//t.co/Zs2wi6Ubjy,FALSE,TRUE,NA,majesco
Adam Elster,1159460161125269505,2019-08-08T13:43:38Z,Majesco To Present At SVIA's Digital Insurance Leadership Series: On Demand InsuranceWorkshop//t.co/nqvjQQpFV0,FALSE,TRUE,NA,NA
Adam Elster,1159453754716016640,2019-08-08T13:18:11Z,Help Ajinkya (14 years age) to Fight Back His Relapsed Blood cancer//t.co/QTUkMABEJ4,FALSE,FALSE,NA,NA
Adam Elster,1159203261766914048,2019-08-07T20:42:49Z,BREAKING: @majesco_inc Reports Another Strong Quarter of Growth! #cloud #futureofinsurance//t.co/DHxS62fX7V//t.co/LrjKGNAyt8,FALSE,TRUE,NA,cloud
Adam Elster,1159203261766914048,2019-08-07T20:42:49Z,BREAKING: @majesco_inc Reports Another Strong Quarter of Growth! #cloud #futureofinsurance//t.co/DHxS62fX7V//t.co/LrjKGNAyt8,FALSE,TRUE,NA,futureofinsurance
Adam Elster,1158817718944112640,2019-08-06T19:10:48Z,Join @denisegarth of @Majesco_Inc at Our #OnDemand #Insurance Workshop | Find Out More//t.co/J7lYpQR3vI | #SVIAEvents | #InsurTech #Insurance #Innovators #BusinessDrivers #InsuranceBusiness #TechTrends #TechGrowth//t.co/1G3IyodBt2,FALSE,TRUE,NA,OnDemand
Adam Elster,1158817718944112640,2019-08-06T19:10:48Z,Join @denisegarth of @Majesco_Inc at Our #OnDemand #Insurance Workshop | Find Out More//t.co/J7lYpQR3vI | #SVIAEvents | #InsurTech #Insurance #Innovators #BusinessDrivers #InsuranceBusiness #TechTrends #TechGrowth//t.co/1G3IyodBt2,FALSE,TRUE,NA,Insurance
Adam Elster,1154127675612651520,2019-07-24T20:34:15Z,Millers Mutual Insurance is Live with @Majesco_Inc Insurance Data and Analytics Platform as a Foundation to their Data-Driven Strategy #bigdata #datadriveninsurance//t.co/dIr0JaJd3r//t.co/vfwHuBVg4f,FALSE,TRUE,NA,NA
Adam Elster,1154127640556638208,2019-07-24T20:34:06Z,"How we learn from failure, how we talk to each other, and advance the dialogue...that has to underpin any transformation. @Westfield1848's @cdwelsh #wednesdaywisdom",FALSE,TRUE,NA,NA
Adam Elster,1152248998318804998,2019-07-19T16:09:03Z,Great listen for your morning commute: @Majesco_Inc Announces Future of Insurance: Industry Influencers Podcast//t.co/vHT086VOtk #futureofinsurance #podcast//t.co/Lkb7r9fxuv,FALSE,FALSE,NA,futureofinsurance
Adam Elster,1152248998318804998,2019-07-19T16:09:03Z,Great listen for your morning commute: @Majesco_Inc Announces Future of Insurance: Industry Influencers Podcast//t.co/vHT086VOtk #futureofinsurance #podcast//t.co/Lkb7r9fxuv,FALSE,FALSE,NA,podcast
Adam Elster,1151103062058123265,2019-07-16T12:15:31Z,"HIRING: @Majesco_Inc is looking for Client Partners - high-performance, results-driven enterprise software sales leaders who are ready to do the best work of their lives and shape the future of an entire industry in the process! Interested?//t.co/WjTYrt5NfQ #salescareers//t.co/0PGkaw8B0m",FALSE,FALSE,NA,salescareers
Adam Elster,1148575748523012096,2019-07-09T12:52:52Z,"MMG wins 2019 Overall Award in Innovation from @NAMIC for work on talent attraction, retention and development in the workforce. #InsuranceCareers #Innovation//t.co/MQW78U5OfJ//t.co/fnxVhivwWW",FALSE,TRUE,NA,NA
Adam Elster,1143930165619298304,2019-06-26T17:12:59Z,"How can you position your company as a leader in the Future of Insurance? Read our thought leadership, which highlights the need for the insurance industry to digitalize their business to grow and succeed in a new era.//t.co/OYlYP0xW68 #digitalinsurance #majesco//t.co/NJ16TbDlW6",FALSE,TRUE,NA,NA
Adam Elster,1141903643811225600,2019-06-21T03:00:18Z,"@denisegarth giving a Blueprint for Insurance 3.0: Customer Centric, Speed, and Digital Leadership at #insurtechfusion2019 for Silicon Valley Insurance Accelerator Generational shift - Within 6 years Millenials and Gen Z will be the largest group of cons//t.co/8he9dwIiB9",FALSE,TRUE,NA,NA
Adam Elster,1141903542061555712,2019-06-21T02:59:54Z,Meet @Denisegarth of @_Majesco #InsurTechFUSION #Majesco//t.co/iftT5TTw8j,FALSE,TRUE,NA,NA
Adam Elster,1141690747659460608,2019-06-20T12:54:20Z,Meet the #DigitalGeneration of #CoreSystems 4 #insurance. Reg.//t.co/ar9DyCpslR | See @sarzenaitegroup ( Jay Sarzen ) of @AiteGroup @AJGrosso of @EISGroupLtd Manish Shah of @Majesco_Inc Euan King of @instandaF2X at #InsurTechFUSION 2019 | #InsurTech #DigitalInsurance//t.co/bQjd2HqdQ8,FALSE,TRUE,NA,DigitalGeneration
Adam Elster,1141690747659460608,2019-06-20T12:54:20Z,Meet the #DigitalGeneration of #CoreSystems 4 #insurance. Reg.//t.co/ar9DyCpslR | See @sarzenaitegroup ( Jay Sarzen ) of @AiteGroup @AJGrosso of @EISGroupLtd Manish Shah of @Majesco_Inc Euan King of @instandaF2X at #InsurTechFUSION 2019 | #InsurTech #DigitalInsurance//t.co/bQjd2HqdQ8,FALSE,TRUE,NA,CoreSystems
Adam Elster,1141690747659460608,2019-06-20T12:54:20Z,Meet the #DigitalGeneration of #CoreSystems 4 #insurance. Reg.//t.co/ar9DyCpslR | See @sarzenaitegroup ( Jay Sarzen ) of @AiteGroup @AJGrosso of @EISGroupLtd Manish Shah of @Majesco_Inc Euan King of @instandaF2X at #InsurTechFUSION 2019 | #InsurTech #DigitalInsurance//t.co/bQjd2HqdQ8,FALSE,TRUE,NA,insurance
Adam Elster,1140957404831670273,2019-06-18T12:20:17Z,Check out Manish Shah from @Majesco_Inc at Silicon Valley Insurance Accelerator//t.co/QHoKtU8wqw,TRUE,FALSE,NA,NA
Adam Elster,1140956847475712006,2019-06-18T12:18:05Z,Meet @Majesco_Inc at the SVIA InsurTech FUSION Summit 2019. The Future of Insurance Starts at Table #2! #Majesco #InsurTechFUSION,FALSE,TRUE,NA,Majesco
Adam Elster,1140679107241549836,2019-06-17T17:54:26Z,"There's still time, lock your spot!//t.co/JAw3y4eWSC//t.co/VBsUMLZhyH",FALSE,TRUE,NA,NA
Adam Elster,1140057161902501889,2019-06-16T00:43:03Z,Coolest Birthday gift from my son cameo from Kyle J Guy #cameofameo//t.co/8BP4uwBxUw via @bookcameo,FALSE,FALSE,NA,cameofameo
Adam Elster,1139496068595560449,2019-06-14T11:33:28Z,Innovation + Regulation = Opportunities to Shape the Future of Insurance by @denisegarth//t.co/At2jU0pVAF,FALSE,TRUE,NA,NA
Adam Elster,1136962944208723969,2019-06-07T11:47:44Z,"French President Macron, speaking in English, honors the #DDay veterans: ""On behalf of my nation, I just want to say thank you.""//t.co/TZoh1Sj8p5",FALSE,TRUE,NA,DDay
Adam Elster,1134808022545358848,2019-06-01T13:04:50Z,"This is a tragic day for Virginia Beach and our entire Commonwealth. My heart breaks for the victims of this devastating shooting, their families, and all who loved them. I am on my way to Virginia Beach now and will be there within the hour.",FALSE,TRUE,NA,NA
Adam Elster,1133357307188961280,2019-05-28T13:00:13Z,Celebrate. Honor. Remember.Wishing everyone safe and wonderful holiday!//t.co/L2H0qa6X7F,FALSE,TRUE,NA,NA
Adam Elster,1132970677953343488,2019-05-27T11:23:53Z,"This #MemorialDay, we remember the fallen heroes of our nation.//t.co/V5NAtLHwaT",FALSE,TRUE,NA,MemorialDay
Adam Elster,1129078003487559680,2019-05-16T17:35:47Z,"Thank you to the more than 150 investors, shareholder and analysts today in Mumbai ! The Future of insurance is here @Majesco_Inc//t.co/XCXYMysH6E",FALSE,FALSE,NA,NA
Adam Elster,1126275988718018562,2019-05-09T00:01:35Z,The #futureofinsurance is now. And it's @Majesco_Inc.//t.co/2adgl90YkI,FALSE,FALSE,NA,futureofinsurance
Adam Elster,1126137874796228610,2019-05-08T14:52:46Z,@elonmusk only one completely API/Microservices cloud based insurance platform. Its//t.co/Bp6QfKNu9h. As CEO of Majesco I can tell you that it would get you to market in weeks.,FALSE,FALSE,44196397,NA
Adam Elster,1126128581111943168,2019-05-08T14:15:50Z,"We are live at @Nasdaq's new #MarketSite in #TimesSquare New York, getting ready for @Majesco_Inc's Investor Day 2019! The #futureofinsurance has never been more real. Join us starting at 1pm EDT://t.co/XhV4WbrJyr//t.co/dwJJhygBaE",FALSE,FALSE,NA,MarketSite
Adam Elster,1126128581111943168,2019-05-08T14:15:50Z,"We are live at @Nasdaq's new #MarketSite in #TimesSquare New York, getting ready for @Majesco_Inc's Investor Day 2019! The #futureofinsurance has never been more real. Join us starting at 1pm EDT://t.co/XhV4WbrJyr//t.co/dwJJhygBaE",FALSE,FALSE,NA,TimesSquare
Adam Elster,1126128581111943168,2019-05-08T14:15:50Z,"We are live at @Nasdaq's new #MarketSite in #TimesSquare New York, getting ready for @Majesco_Inc's Investor Day 2019! The #futureofinsurance has never been more real. Join us starting at 1pm EDT://t.co/XhV4WbrJyr//t.co/dwJJhygBaE",FALSE,FALSE,NA,futureofinsurance
Adam Elster,1125863796638195717,2019-05-07T20:43:41Z,"BIG WEEK: @Majesco_Inc just reported RECORD fourth quarter and full fiscal 2019 results, announced a strategic alliance with @Capgemini_ins, and tomorrow we host our Investor Day from Nasdaq's new #MarketSite in Times Square!//t.co/ID2vJa7tvv #futureofinsurance #earnings//t.co/y4rf0BAVew",FALSE,FALSE,NA,MarketSite
Adam Elster,1125863796638195717,2019-05-07T20:43:41Z,"BIG WEEK: @Majesco_Inc just reported RECORD fourth quarter and full fiscal 2019 results, announced a strategic alliance with @Capgemini_ins, and tomorrow we host our Investor Day from Nasdaq's new #MarketSite in Times Square!//t.co/ID2vJa7tvv #futureofinsurance #earnings//t.co/y4rf0BAVew",FALSE,FALSE,NA,futureofinsurance
Adam Elster,1125863796638195717,2019-05-07T20:43:41Z,"BIG WEEK: @Majesco_Inc just reported RECORD fourth quarter and full fiscal 2019 results, announced a strategic alliance with @Capgemini_ins, and tomorrow we host our Investor Day from Nasdaq's new #MarketSite in Times Square!//t.co/ID2vJa7tvv #futureofinsurance #earnings//t.co/y4rf0BAVew",FALSE,FALSE,NA,earnings
Adam Elster,1125821262868164614,2019-05-07T17:54:40Z,Cloud is now a mature and fast-growing technology that's reached the tipping point in terms of use by insurers.//t.co/KdDfr7p8dA #cloud #digitaltransformation #futureofinsurance,FALSE,TRUE,NA,NA
Adam Elster,1125821184384409601,2019-05-07T17:54:21Z,BIG NEWS: @Capgemini_ins and @majesco_inc are partnering to bring insurance innovation and business transformation to the Life & Annuity and Group insurance market!//t.co/pt5CiPuUvK #futureofinsurance #lifeinsurance//t.co/C8PYkb5Ihz,FALSE,TRUE,NA,NA
Adam Elster,1124657584697425922,2019-05-04T12:50:37Z,Majesco to Announce Three-Year Strategic Plan at May 8th Investor Day at Nasdaq//t.co/0ldlnmgnXO via @YahooFinance,FALSE,FALSE,NA,NA
Adam Elster,1121496582866837505,2019-04-25T19:29:56Z,The Future and Insurance Meet in Savannah by @denisegarth//t.co/PJLIH8HakS,FALSE,TRUE,NA,NA
Adam Elster,1121405075728084992,2019-04-25T13:26:19Z,.@Majesco_inc is excited to announce that we will be one of the FIRST companies to host an Investor Day at @Nasdaq's new #MarketSite in Times Square New York! The #futureofinsurance starts here!//t.co/xw0WIdZU96//t.co/B9lA2fLT8j,FALSE,TRUE,NA,NA
Adam Elster,1119229357870993409,2019-04-19T13:20:47Z,More news from #Convergence19: @Majesco_Inc Announces Ready-To-Use Partner Apps in the Majesco Digital1st EcoExchange!//t.co/JUGaZZrmeB #futureofinsurance//t.co/X2Z7qKbLCJ,FALSE,TRUE,NA,Convergence19
Adam Elster,1119229230410235906,2019-04-19T13:20:17Z,"Just in: @Majesco_Inc Crushes Attendance Records at #Convergence19, Unveils New Brand and Strategy for the #FutureofInsurance, and Announces Major Product Enhancements and Strategic Partnerships://t.co/8VKCdPdGx3//t.co/8mkcynfjuM",FALSE,TRUE,NA,Convergence19
