name,status_id,created_at,text,is_quote,is_retweet,reply_to_user_id,hashtags
Alex Irune,699366343703949313,2016-02-15T22:55:04Z,"The 2016 Range Rover HSE TD6 is big car that thinks it's small, and that can be a good thing//t.co/2LNtFCXtrJ//t.co/3HSjknma1O",FALSE,TRUE,NA,NA
Alex Irune,698694922388504576,2016-02-14T02:27:05Z,Truly inspiring if you get a moment . . . #beyou #befree //t.co/i7Bmhz4gXu,TRUE,FALSE,NA,beyou
Alex Irune,698694922388504576,2016-02-14T02:27:05Z,Truly inspiring if you get a moment . . . #beyou #befree //t.co/i7Bmhz4gXu,TRUE,FALSE,NA,befree
Alex Irune,698461862015459328,2016-02-13T11:00:59Z,Can't compete #Spain! #Nigeriaisthewinner on that P. #ghostworkers they never showed up in the first place #beatthat//t.co/Fo2UnHaVwS,TRUE,FALSE,NA,Spain
Alex Irune,698461862015459328,2016-02-13T11:00:59Z,Can't compete #Spain! #Nigeriaisthewinner on that P. #ghostworkers they never showed up in the first place #beatthat//t.co/Fo2UnHaVwS,TRUE,FALSE,NA,Nigeriaisthewinner
Alex Irune,698461862015459328,2016-02-13T11:00:59Z,Can't compete #Spain! #Nigeriaisthewinner on that P. #ghostworkers they never showed up in the first place #beatthat//t.co/Fo2UnHaVwS,TRUE,FALSE,NA,ghostworkers
Alex Irune,698461862015459328,2016-02-13T11:00:59Z,Can't compete #Spain! #Nigeriaisthewinner on that P. #ghostworkers they never showed up in the first place #beatthat//t.co/Fo2UnHaVwS,TRUE,FALSE,NA,beatthat
Alex Irune,698080633927659520,2016-02-12T09:46:07Z,Everyone loves to see you grow . . . Until you begin to out grow them #watchout #watchthem,FALSE,FALSE,NA,watchout
Alex Irune,698080633927659520,2016-02-12T09:46:07Z,Everyone loves to see you grow . . . Until you begin to out grow them #watchout #watchthem,FALSE,FALSE,NA,watchthem
Alex Irune,698073468613615616,2016-02-12T09:17:39Z,@officialdaddymo or indeed your patience when you have everything and your attitude when you have nothing//t.co/JOj9o5H2M2,FALSE,FALSE,228332540,NA
Alex Irune,697803007258402817,2016-02-11T15:22:56Z,"""The real challenge is our perspective on oil prices. Is today's price a reflection of the commodities true value?"" -@AdewaleTinubu #IPWeek",FALSE,TRUE,NA,NA
Alex Irune,692614173952458752,2016-01-28T07:44:21Z,When your brother tells on you.//t.co/frQI7uAJc2,FALSE,TRUE,NA,NA
Alex Irune,686808312625643521,2016-01-12T07:13:56Z,The Gulf Intelligence UAE Energy Forum holds tomorrow in Abu Dhabi! Our GCE @AdewaleTinubu will be amongst the speakers #giforum,FALSE,TRUE,NA,NA
Alex Irune,682915635479900160,2016-01-01T13:25:50Z,Happy New Year people #2016herewecome,FALSE,FALSE,NA,2016herewecome
Alex Irune,681027281393946624,2015-12-27T08:22:11Z,@OlufemiAkinbode Same to you and yours. Wishing you a prosperous New Year too.,FALSE,FALSE,4612221388,NA
Alex Irune,681025591118819328,2015-12-27T08:15:28Z,#7 of our 2015 top ten charts: America's ethnic composition//t.co/MwlnjEZqML//t.co/pq1NiMT5Ie,FALSE,TRUE,NA,NA
Alex Irune,680802231176790016,2015-12-26T17:27:55Z,Merry Christmas everyone #Christmas,FALSE,FALSE,NA,Christmas
Alex Irune,676891752075272192,2015-12-15T22:29:04Z,noooo! //t.co/tIDPmGZxrA,FALSE,TRUE,NA,NA
Alex Irune,669879845048983552,2015-11-26T14:06:15Z,@AshiruT lol,FALSE,FALSE,546278705,NA
Alex Irune,669568464072392704,2015-11-25T17:28:56Z,@AshiruT is everything alright?,FALSE,FALSE,546278705,NA
Alex Irune,668762951860551680,2015-11-23T12:08:07Z,//t.co/5JCCAUYZqE,FALSE,TRUE,NA,NA
Alex Irune,668735877280104448,2015-11-23T10:20:32Z,Formal education will make you a living; self-education will make you a fortune. - Jim Rohn #BeAudacious,FALSE,TRUE,NA,BeAudacious
Alex Irune,668193007523491840,2015-11-21T22:23:22Z,@officialdaddymo @qatarairways there is no one else on the plane! Erm . . .,FALSE,FALSE,228332540,NA
Alex Irune,668192172525621248,2015-11-21T22:20:02Z,A must read #leadership //t.co/dp36piIfaX,FALSE,FALSE,NA,leadership
Alex Irune,667730555128164352,2015-11-20T15:45:44Z,Follow our leaders to stay up to date with industry trends @ayotolajagun @ajimnaija @PosiWilliams #FollowFriday//t.co/khXPxTwClw,FALSE,TRUE,NA,FollowFriday
Alex Irune,666986752448585729,2015-11-18T14:30:08Z,Our thoughts and prayers are with everyone impacted by the tragedy in Yola. #PrayForYola #PrayForNigeria,FALSE,TRUE,NA,PrayForYola
Alex Irune,666986752448585729,2015-11-18T14:30:08Z,Our thoughts and prayers are with everyone impacted by the tragedy in Yola. #PrayForYola #PrayForNigeria,FALSE,TRUE,NA,PrayForNigeria
Alex Irune,666047644737929219,2015-11-16T00:18:27Z,Danny Amendola: 82 yards of daylight and about to score... Until he got tripped up by one of his teammates #NEvsNYG//t.co/QZ8T8eymNK,FALSE,TRUE,NA,NEvsNYG
Alex Irune,665687040663658496,2015-11-15T00:25:33Z,The latest on the #Paris attacks://t.co/hoNPj3qACr//t.co/PBoGwghBmy,FALSE,TRUE,NA,Paris
Alex Irune,665683647119368192,2015-11-15T00:12:03Z,My prayers are with everyone in Paris.The evil of terrorism will never triumph over humanity's love&selflessness #PrayForParis,FALSE,TRUE,NA,NA
Alex Irune,665586678921342977,2015-11-14T17:46:44Z,#PrayForParis//t.co/gNFA8JsVff,FALSE,TRUE,NA,PrayForParis
Alex Irune,665586666359422976,2015-11-14T17:46:41Z,"When the City of Lights goes dark, the rest of the world lights up in support #PrayForParis",FALSE,TRUE,NA,PrayForParis
Alex Irune,665586664669118464,2015-11-14T17:46:41Z,Our thoughts and prayers are with everyone affected by the sordid attacks in Paris. The only way to combat hate is with love. #PrayForParis,FALSE,TRUE,NA,NA
Alex Irune,665541725356707841,2015-11-14T14:48:07Z,"The acts of cowards are forgotten in time, but the wounds they leave behind cause inextricable pain and a life time of hurt #PrayForParis",FALSE,FALSE,NA,PrayForParis
Alex Irune,664945640091308033,2015-11-12T23:19:29Z,RIP to the greatest racing mind ever #AyrtonSenna//t.co/jDUoC5179m,FALSE,FALSE,NA,AyrtonSenna
Alex Irune,664902326797266948,2015-11-12T20:27:22Z,"Today marks the last day of #ADIPEC2015, it has been a great learning experience and we look forward to future events.",FALSE,TRUE,NA,ADIPEC2015
Alex Irune,664595611115773952,2015-11-12T00:08:35Z,Travel first class in the #RangeRover #SVAutobiography. #MYLAND #LandRoverMENA #luxury//t.co/eFx8t243Xp,FALSE,TRUE,NA,RangeRover
Alex Irune,664595611115773952,2015-11-12T00:08:35Z,Travel first class in the #RangeRover #SVAutobiography. #MYLAND #LandRoverMENA #luxury//t.co/eFx8t243Xp,FALSE,TRUE,NA,SVAutobiography
Alex Irune,664595611115773952,2015-11-12T00:08:35Z,Travel first class in the #RangeRover #SVAutobiography. #MYLAND #LandRoverMENA #luxury//t.co/eFx8t243Xp,FALSE,TRUE,NA,MYLAND
Alex Irune,664595611115773952,2015-11-12T00:08:35Z,Travel first class in the #RangeRover #SVAutobiography. #MYLAND #LandRoverMENA #luxury//t.co/eFx8t243Xp,FALSE,TRUE,NA,LandRoverMENA
Alex Irune,664595611115773952,2015-11-12T00:08:35Z,Travel first class in the #RangeRover #SVAutobiography. #MYLAND #LandRoverMENA #luxury//t.co/eFx8t243Xp,FALSE,TRUE,NA,luxury
Alex Irune,664347120070193152,2015-11-11T07:41:11Z,"Ngozi Okonkwo, CLO receiving the award for best In-House Team of the Year at the Law Digest Africa Awards '15//t.co/g34LhamMPi",FALSE,TRUE,NA,NA
Alex Irune,664347108913381376,2015-11-11T07:41:08Z,Congratulations to our legal team on winning the award for the best In-House Team at the Law Digest Africa Award '15//t.co/dxqrYEoyVt,FALSE,TRUE,NA,NA
Alex Irune,663857146413621248,2015-11-09T23:14:12Z,"An ant is only as strong as its colony, a company only as strong as its people #BeAudacious//t.co/sL48VFVfVj//t.co/sr7tsgKiK4",FALSE,TRUE,NA,BeAudacious
Alex Irune,663483306252623872,2015-11-08T22:28:41Z,The most wasted of all days is one without laughter #TBT//t.co/6kOIDDDvWN,FALSE,TRUE,NA,TBT
Alex Irune,663330273904435200,2015-11-08T12:20:36Z,@Laraba811 @supersanusi clearly a symptom of our limited capacity #beinghuman #reducingtounderstand,FALSE,FALSE,54730916,beinghuman
Alex Irune,663330273904435200,2015-11-08T12:20:36Z,@Laraba811 @supersanusi clearly a symptom of our limited capacity #beinghuman #reducingtounderstand,FALSE,FALSE,54730916,reducingtounderstand
Alex Irune,663329470758129664,2015-11-08T12:17:24Z,@Laraba811 Is this what girls go through? There is implicit and there is explicit. . . No need for the latter #justrude,FALSE,FALSE,54730916,justrude
Alex Irune,663299479605522432,2015-11-08T10:18:14Z,"@Laraba811 @vivalabada A really familiar security guard said to a colleague of mine - ""Oga, (grinning) you have added"". . . Sorry??",FALSE,FALSE,54730916,NA
Alex Irune,662938393471524864,2015-11-07T10:23:24Z,"On Wednesday, Oando GCE @AdewaleTinubu will be on a panel discussing Africa's potential opportunities for foreign investors. #ADIPEC2015",FALSE,TRUE,NA,NA
Alex Irune,662935320023998464,2015-11-07T10:11:11Z,"#Nigeria's #Buhari takes ministers on retreat, still no news on their jobs //t.co/tKwpsWVJn1//t.co/Wtb8ZRPQnW",FALSE,TRUE,NA,Nigeria
Alex Irune,662935320023998464,2015-11-07T10:11:11Z,"#Nigeria's #Buhari takes ministers on retreat, still no news on their jobs //t.co/tKwpsWVJn1//t.co/Wtb8ZRPQnW",FALSE,TRUE,NA,Buhari
Alex Irune,662278319812005889,2015-11-05T14:40:30Z,Oando Energy Resources' impairments in comparison to other Independents and IOCs//t.co/XhHpMrY53g,FALSE,TRUE,NA,NA
Alex Irune,662037175085740033,2015-11-04T22:42:17Z,"Nigeria could do with this, self-healing asphalt #nomorepotholes //t.co/4FxPyhjxG2",FALSE,FALSE,NA,nomorepotholes
Alex Irune,661960815768182784,2015-11-04T17:38:51Z,"OER's net debt position is $500M as of October 26, 2015, down 44% from $900M outstanding at the completion of the COP acquisition",FALSE,TRUE,NA,NA
Alex Irune,661960788769431552,2015-11-04T17:38:45Z,of the value realized from the resetting of our hedge instruments - OER CEO @pdurotoye 2/2,FALSE,TRUE,NA,NA
Alex Irune,661960780108210176,2015-11-04T17:38:43Z,"""The cashflows from these assets have continued to pay down the Company's post acquisition debt with the assistance 1/2",FALSE,TRUE,NA,NA
Alex Irune,661960774156468224,2015-11-04T17:38:41Z,"The upsizing of the RBL loan is a true testament to the quality of the assets we acquired in July 2014."" - OER CEO @pdurotoye",FALSE,TRUE,NA,NA
Alex Irune,661144612950687745,2015-11-02T11:35:33Z,A good day starts with a positive attitude! #BeAudacious//t.co/vtYmGbrasR,FALSE,TRUE,NA,BeAudacious
Alex Irune,660745634937458688,2015-11-01T09:10:10Z,@business hard to comment on this as it is factually inaccurate. #betterreaearch #lessjudgement,FALSE,FALSE,34713362,betterreaearch
Alex Irune,660745634937458688,2015-11-01T09:10:10Z,@business hard to comment on this as it is factually inaccurate. #betterreaearch #lessjudgement,FALSE,FALSE,34713362,lessjudgement
Alex Irune,660494527262756864,2015-10-31T16:32:21Z,Great work by the @Oando_PLC communications team #BeAudacious #AOW2015 #AfricaOilWeek//t.co/XxSj0UbwbM,FALSE,TRUE,NA,BeAudacious
Alex Irune,660494527262756864,2015-10-31T16:32:21Z,Great work by the @Oando_PLC communications team #BeAudacious #AOW2015 #AfricaOilWeek//t.co/XxSj0UbwbM,FALSE,TRUE,NA,AOW2015
Alex Irune,660494527262756864,2015-10-31T16:32:21Z,Great work by the @Oando_PLC communications team #BeAudacious #AOW2015 #AfricaOilWeek//t.co/XxSj0UbwbM,FALSE,TRUE,NA,AfricaOilWeek
Alex Irune,660494329874657280,2015-10-31T16:31:34Z,#TeamOando supporting the fight against breast cancer. #OandoPinkFriday #WearItPink #OandoCares//t.co/hnGbvprwbB,FALSE,TRUE,NA,TeamOando
Alex Irune,660494329874657280,2015-10-31T16:31:34Z,#TeamOando supporting the fight against breast cancer. #OandoPinkFriday #WearItPink #OandoCares//t.co/hnGbvprwbB,FALSE,TRUE,NA,OandoPinkFriday
Alex Irune,660494329874657280,2015-10-31T16:31:34Z,#TeamOando supporting the fight against breast cancer. #OandoPinkFriday #WearItPink #OandoCares//t.co/hnGbvprwbB,FALSE,TRUE,NA,WearItPink
Alex Irune,660494329874657280,2015-10-31T16:31:34Z,#TeamOando supporting the fight against breast cancer. #OandoPinkFriday #WearItPink #OandoCares//t.co/hnGbvprwbB,FALSE,TRUE,NA,OandoCares
Alex Irune,660420071475531777,2015-10-31T11:36:29Z,"""Our prosperity is no longer prosperity as long as it is pinned to other people's pain.""//t.co/9LIlvR1YjR",FALSE,TRUE,NA,NA
Alex Irune,660361912287436800,2015-10-31T07:45:23Z,Thinking Nigeria! Not sure this is a great idea #bailup #oyalookthismachime//t.co/kDQ8wRxpsk,FALSE,FALSE,NA,bailup
Alex Irune,660361912287436800,2015-10-31T07:45:23Z,Thinking Nigeria! Not sure this is a great idea #bailup #oyalookthismachime//t.co/kDQ8wRxpsk,FALSE,FALSE,NA,oyalookthismachime
Alex Irune,660137766802628608,2015-10-30T16:54:43Z,That's it from #AfricaOilWeek. Thank you to the AOW team and all the participants for a truly insightful week. #AOW2015,FALSE,TRUE,NA,AfricaOilWeek
Alex Irune,660137766802628608,2015-10-30T16:54:43Z,That's it from #AfricaOilWeek. Thank you to the AOW team and all the participants for a truly insightful week. #AOW2015,FALSE,TRUE,NA,AOW2015
Alex Irune,660137556856725504,2015-10-30T16:53:52Z,Support the fight against breast cancer! #OandoPinkFriday #WearItPink//t.co/Qi6a2Ipkh6,FALSE,TRUE,NA,OandoPinkFriday
Alex Irune,660137556856725504,2015-10-30T16:53:52Z,Support the fight against breast cancer! #OandoPinkFriday #WearItPink//t.co/Qi6a2Ipkh6,FALSE,TRUE,NA,WearItPink
Alex Irune,659895275515944960,2015-10-30T00:51:08Z,Proudly African at #AfricaOilWeek #AOW2015 #TeamOando//t.co/gWCY3syJaI,FALSE,TRUE,NA,AfricaOilWeek
Alex Irune,659895275515944960,2015-10-30T00:51:08Z,Proudly African at #AfricaOilWeek #AOW2015 #TeamOando//t.co/gWCY3syJaI,FALSE,TRUE,NA,AOW2015
Alex Irune,659895275515944960,2015-10-30T00:51:08Z,Proudly African at #AfricaOilWeek #AOW2015 #TeamOando//t.co/gWCY3syJaI,FALSE,TRUE,NA,TeamOando
Alex Irune,659789519017914368,2015-10-29T17:50:54Z,CONGRATS once again to our amazing winners! Thanks to all who participated in our #PerformanceInMotion #photocontest//t.co/eN5YLk0K2C,FALSE,TRUE,NA,PerformanceInMotion
Alex Irune,659789519017914368,2015-10-29T17:50:54Z,CONGRATS once again to our amazing winners! Thanks to all who participated in our #PerformanceInMotion #photocontest//t.co/eN5YLk0K2C,FALSE,TRUE,NA,photocontest
Alex Irune,659635813710479360,2015-10-29T07:40:08Z,"@Oando_PLC in this context, may be our social commentators may get it. #oilpricedrop #impairment//t.co/KMORkWIYNp",FALSE,FALSE,138510846,oilpricedrop
Alex Irune,659635813710479360,2015-10-29T07:40:08Z,"@Oando_PLC in this context, may be our social commentators may get it. #oilpricedrop #impairment//t.co/KMORkWIYNp",FALSE,FALSE,138510846,impairment
Alex Irune,659633813019054080,2015-10-29T07:32:11Z,This is very important: @Shell has cut its long-term #oil and #gas price outlook (no details on new prices)//t.co/D1SSkcEpmg,FALSE,TRUE,NA,oil
Alex Irune,659633813019054080,2015-10-29T07:32:11Z,This is very important: @Shell has cut its long-term #oil and #gas price outlook (no details on new prices)//t.co/D1SSkcEpmg,FALSE,TRUE,NA,gas
Alex Irune,659382423898214400,2015-10-28T14:53:15Z,We had a good time with you all yesterday at our #OTLAfrica2015 exhibition booth. #perfomanceinmotion//t.co/Xnl6XDuUeo,FALSE,TRUE,NA,OTLAfrica2015
Alex Irune,659382423898214400,2015-10-28T14:53:15Z,We had a good time with you all yesterday at our #OTLAfrica2015 exhibition booth. #perfomanceinmotion//t.co/Xnl6XDuUeo,FALSE,TRUE,NA,perfomanceinmotion
Alex Irune,659079570239393792,2015-10-27T18:49:49Z,"Exclusive - CEO @AdewaleTinubu comments on @Oando_PLC's record loss, future of the local oil giant.//t.co/XQs2JR9mnu @cnbcafrica",FALSE,TRUE,NA,NA
Alex Irune,659079545698525184,2015-10-27T18:49:43Z,"We are proud to be a sponsor of the Oil Trading & Logistics Africa Downstream Expo taking place at Oriental Hotel, VI, Lagos #OTLAfrica2015",FALSE,TRUE,NA,NA
Alex Irune,658933395314094080,2015-10-27T09:08:58Z,The Low Oil Price Reality.#AOW2015#OER# Oando#//t.co/IlRLtoadb3,FALSE,TRUE,NA,NA
Alex Irune,658898182160666624,2015-10-27T06:49:03Z,Explanation of G&A in 2014 FYE - Other G&A//t.co/Y7Rm56ozP3,FALSE,TRUE,NA,NA
Alex Irune,658898177874112516,2015-10-27T06:49:01Z,Explanation of G&A in 2014 FYE - Impairments//t.co/wPioXxampw,FALSE,TRUE,NA,NA
Alex Irune,658895325965504512,2015-10-27T06:37:42Z,"The new realities of lower oil prices needs to be reflected in the valuation of companies, Oando's CEO,Wale Tinubu, say #nigeriamagazine",FALSE,TRUE,NA,NA
Alex Irune,658703479461040128,2015-10-26T17:55:22Z,'We apologise profusely for the delay in publishing our financials. We thought it better to be thorough than risk inconsistencies.',FALSE,TRUE,NA,NA
Alex Irune,658703433554337793,2015-10-26T17:55:11Z,'The company is well positioned to return to profitability within a short period of time.' - @AdewaleTinubu,FALSE,TRUE,NA,NA
Alex Irune,658572785590095872,2015-10-26T09:16:02Z,Understanding the FYE 2014 figures//t.co/8fynva3dYd,FALSE,TRUE,NA,NA
Alex Irune,658567912068894720,2015-10-26T08:56:40Z,VIDEO: Oando FY loss shock market//t.co/KxUHVwzVm9,FALSE,TRUE,NA,NA
Alex Irune,658567670481166336,2015-10-26T08:55:42Z,VIDEO: Oando reports FY loss of N183bn//t.co/FIP26Or3ro,FALSE,TRUE,NA,NA
Alex Irune,658414963447480320,2015-10-25T22:48:54Z,We will present the Facts Behind the Figures tomorrow at the NSE.,FALSE,TRUE,NA,NA
Alex Irune,658346687971373056,2015-10-25T18:17:36Z,We dissociate ourselves from all communication that do not originate from the company.,FALSE,TRUE,NA,NA
Alex Irune,657900988108533760,2015-10-24T12:46:33Z,Click for the press releases on our results for FYE 2014//t.co/mOTI2cxQ9W and H1 2015//t.co/JTfMxmtTDj,FALSE,TRUE,NA,NA
Alex Irune,655843366203211780,2015-10-18T20:30:18Z,Happy #NationalBossDay to the best bosses in the world @airune & @lerustix !//t.co/eyFc8mdjl8,FALSE,TRUE,NA,NationalBossDay
Alex Irune,655843238050439168,2015-10-18T20:29:47Z,Photoshopping men out of the world stage makes for pretty depressing pictures//t.co/eiBRQYkFtN//t.co/qIxRPMZRT2,FALSE,TRUE,NA,NA
Alex Irune,655490018010648576,2015-10-17T21:06:13Z,What are your plans this weekend? Have you chosen to #BeAudacious? #TGIF,FALSE,TRUE,NA,BeAudacious
Alex Irune,655490018010648576,2015-10-17T21:06:13Z,What are your plans this weekend? Have you chosen to #BeAudacious? #TGIF,FALSE,TRUE,NA,TGIF
Alex Irune,654947402206588928,2015-10-16T09:10:03Z,Why Earth is the best planet #mondaymotivation//t.co/4MAd0gfnSs,FALSE,TRUE,NA,mondaymotivation
Alex Irune,654734865061965824,2015-10-15T19:05:30Z,#GlobalHandwashingDay #ItStartsWithMe #OandoCares @drasatrust//t.co/HJXqyNQyI5,FALSE,TRUE,NA,GlobalHandwashingDay
Alex Irune,654734865061965824,2015-10-15T19:05:30Z,#GlobalHandwashingDay #ItStartsWithMe #OandoCares @drasatrust//t.co/HJXqyNQyI5,FALSE,TRUE,NA,ItStartsWithMe
Alex Irune,654734865061965824,2015-10-15T19:05:30Z,#GlobalHandwashingDay #ItStartsWithMe #OandoCares @drasatrust//t.co/HJXqyNQyI5,FALSE,TRUE,NA,OandoCares
Alex Irune,654611694434521088,2015-10-15T10:56:04Z,.@airune and I at The Oil Council Africa Assembly #TBT #TeamOando//t.co/E5pwpLxUTk,FALSE,TRUE,NA,TBT
Alex Irune,654611694434521088,2015-10-15T10:56:04Z,.@airune and I at The Oil Council Africa Assembly #TBT #TeamOando//t.co/E5pwpLxUTk,FALSE,TRUE,NA,TeamOando
Alex Irune,652276244399161344,2015-10-09T00:15:50Z,Meet the next generation of real entrepreneurs//t.co/LWxFJCmHZ0,FALSE,FALSE,NA,NA
Alex Irune,651052860298424321,2015-10-05T15:14:32Z,October is Sustainability month! We are thinking #GasToPower,FALSE,TRUE,NA,GasToPower
Alex Irune,650969158629330944,2015-10-05T09:41:56Z,"Today at the #FTAfrica Summit, I shall be speaking on the ""Managing the Commodity Cycle"" panel. #BeAudacious @ftlive",FALSE,TRUE,NA,FTAfrica
Alex Irune,650969158629330944,2015-10-05T09:41:56Z,"Today at the #FTAfrica Summit, I shall be speaking on the ""Managing the Commodity Cycle"" panel. #BeAudacious @ftlive",FALSE,TRUE,NA,BeAudacious
Alex Irune,650379471720218628,2015-10-03T18:38:44Z,"Death toll in Afghan hospital air strike rises to 19, including 12 staff from medical charity MSF//t.co/WNsUWaYEKU",FALSE,TRUE,NA,NA
Alex Irune,650378709367672832,2015-10-03T18:35:42Z,It is the first Friday of the October! What are your audacious goals/plans for the month? #BeAudacious,FALSE,TRUE,NA,BeAudacious
Alex Irune,650362796362887168,2015-10-03T17:32:28Z,Watch the 'Lion King' cast surprise subway riders with an a cappella performance of The Circle of Life'//t.co/NpHWbLDOXp,FALSE,TRUE,NA,NA
Alex Irune,650360039295832064,2015-10-03T17:21:31Z,Handcrafted the same as yesterday and the day before that. #BeautifullyPredictable//t.co/9wm0MVjG1A,FALSE,TRUE,NA,BeautifullyPredictable
Alex Irune,649569785303404544,2015-10-01T13:01:19Z,We celebrate our Country's Independence with all Nigerians. #NigeriaAt55 #Nigeria55//t.co/UERmZF15vf,FALSE,TRUE,NA,NigeriaAt55
Alex Irune,649569785303404544,2015-10-01T13:01:19Z,We celebrate our Country's Independence with all Nigerians. #NigeriaAt55 #Nigeria55//t.co/UERmZF15vf,FALSE,TRUE,NA,Nigeria55
Alex Irune,649526964160753664,2015-10-01T10:11:10Z,Happy Independence Day people! Let's create the future we deserve #IndependenceDay #Nigeria #changeishere #BeAudacious,FALSE,FALSE,NA,IndependenceDay
Alex Irune,649526964160753664,2015-10-01T10:11:10Z,Happy Independence Day people! Let's create the future we deserve #IndependenceDay #Nigeria #changeishere #BeAudacious,FALSE,FALSE,NA,Nigeria
Alex Irune,649526964160753664,2015-10-01T10:11:10Z,Happy Independence Day people! Let's create the future we deserve #IndependenceDay #Nigeria #changeishere #BeAudacious,FALSE,FALSE,NA,changeishere
Alex Irune,649526964160753664,2015-10-01T10:11:10Z,Happy Independence Day people! Let's create the future we deserve #IndependenceDay #Nigeria #changeishere #BeAudacious,FALSE,FALSE,NA,BeAudacious
Alex Irune,647800601468755968,2015-09-26T15:51:13Z,@AfDB_Group - New Deal for Energy in Africa critical to sustainable development in Africa. Energy required for entire production lifecycle.,FALSE,TRUE,NA,NA
Alex Irune,641659944589225984,2015-09-09T17:10:26Z,"Take risks: if you win, you will be happy; and if you lose, you will be wise. #WisdomWednesday",FALSE,TRUE,NA,WisdomWednesday
Alex Irune,639278481885523968,2015-09-03T03:27:21Z,7 habits of people who age well//t.co/y3WUSj62H2,FALSE,TRUE,NA,NA
Alex Irune,638488377902387200,2015-08-31T23:07:46Z,Lauren Hill #fugees #justhowmusicshouldbe,FALSE,FALSE,50676989,fugees
Alex Irune,638488377902387200,2015-08-31T23:07:46Z,Lauren Hill #fugees #justhowmusicshouldbe,FALSE,FALSE,50676989,justhowmusicshouldbe
Alex Irune,638487920098340864,2015-08-31T23:05:57Z,#Supernatural #supertalented #readyornot//t.co/398FPXfmJM,FALSE,FALSE,NA,Supernatural
Alex Irune,638487920098340864,2015-08-31T23:05:57Z,#Supernatural #supertalented #readyornot//t.co/398FPXfmJM,FALSE,FALSE,NA,supertalented
Alex Irune,638487920098340864,2015-08-31T23:05:57Z,#Supernatural #supertalented #readyornot//t.co/398FPXfmJM,FALSE,FALSE,NA,readyornot
Alex Irune,636318408775192576,2015-08-25T23:25:05Z,Super useful ! #didntknowithadanexpirationdate//t.co/3kp4K8kUdu,FALSE,FALSE,NA,didntknowithadanexpirationdate
Alex Irune,636315632854822912,2015-08-25T23:14:03Z,#OandoCNG is at the forefront of providing the energy to drive change in the economy #GasFact//t.co/NzLWsVO2ff,FALSE,TRUE,NA,OandoCNG
Alex Irune,636315632854822912,2015-08-25T23:14:03Z,#OandoCNG is at the forefront of providing the energy to drive change in the economy #GasFact//t.co/NzLWsVO2ff,FALSE,TRUE,NA,GasFact
Alex Irune,635959001415483392,2015-08-24T23:36:56Z,12 billionaires lost more than $1 billion each on Friday//t.co/yRR2xkyYUH//t.co/6sCXWkR4pL,FALSE,TRUE,NA,NA
Alex Irune,635955629136457728,2015-08-24T23:23:32Z,You won't believe these unexpected uses for Vaseline://t.co/FB6sEl3Qd9//t.co/IDbbakmRmU,FALSE,TRUE,NA,NA
Alex Irune,635954779534049284,2015-08-24T23:20:09Z,Still on-going: Share pictures of an Oando CNG truck with tags #Spotted #CNGtruck #OGP to win great prizes.,FALSE,TRUE,NA,Spotted
Alex Irune,635954779534049284,2015-08-24T23:20:09Z,Still on-going: Share pictures of an Oando CNG truck with tags #Spotted #CNGtruck #OGP to win great prizes.,FALSE,TRUE,NA,CNGtruck
Alex Irune,635954779534049284,2015-08-24T23:20:09Z,Still on-going: Share pictures of an Oando CNG truck with tags #Spotted #CNGtruck #OGP to win great prizes.,FALSE,TRUE,NA,OGP
Alex Irune,635747209745711104,2015-08-24T09:35:21Z,Not sure how I should feel . . . #confused//t.co/tO4Gkpfgcd,FALSE,FALSE,NA,confused
Alex Irune,635477862196346880,2015-08-23T15:45:03Z,There is only one #Bolt//t.co/6SH6SFXBvL,FALSE,FALSE,NA,Bolt
Alex Irune,634848946737836032,2015-08-21T22:05:58Z,This summers must have!//t.co/qArZePulmm #techfest #overmonitor #WearableTech,FALSE,FALSE,NA,techfest
Alex Irune,634848946737836032,2015-08-21T22:05:58Z,This summers must have!//t.co/qArZePulmm #techfest #overmonitor #WearableTech,FALSE,FALSE,NA,overmonitor
Alex Irune,634848946737836032,2015-08-21T22:05:58Z,This summers must have!//t.co/qArZePulmm #techfest #overmonitor #WearableTech,FALSE,FALSE,NA,WearableTech
Alex Irune,634847958874370052,2015-08-21T22:02:02Z,Watch what happens when a guy turned Chatroulette into a zombie-killing experience//t.co/RcKRCs8tOf,FALSE,TRUE,NA,NA
Alex Irune,633346423107493888,2015-08-17T18:35:28Z,@koye10 @officialdaddymo I'm telling u! I'm afraid to play these days just in case I'm shit now. . . @koye10 help!!!,FALSE,FALSE,73418978,NA
Alex Irune,633046124413222913,2015-08-16T22:42:12Z,Why did China do it? The WSJ explains China's currency devaluation//t.co/1TIbPtgcEq//t.co/AAL7BXMFXS,FALSE,TRUE,NA,NA
Alex Irune,633042473326125057,2015-08-16T22:27:41Z,"@officialdaddymo @KevinJAzuara the best part is whilst he speaks, the stats shown contradict him lol #gonebunkers//t.co/LNbcRN3pqv",FALSE,FALSE,228332540,gonebunkers
Alex Irune,632605089115602944,2015-08-15T17:29:41Z,Great read! What side of the fence do you sit? //t.co/4e5OAyWkpP,TRUE,FALSE,NA,NA
Alex Irune,631859880920485889,2015-08-13T16:08:29Z,...Just remember that all the people in this world haven't had the advantages that you've had. - F. Scott Fitzgerald #ThankfulThursday,FALSE,TRUE,NA,NA
