name,status_id,created_at,text,is_quote,is_retweet,reply_to_user_id,hashtags
Alan Trefler,1162398866718806018,2019-08-16T16:21:00Z,"A big thank you to our 2019 @pega summer interns, you brought tremendous energy and value to the company. A special congratulations to The Bobble Bunch for winning our intern presentation competition. Great ideas come from everywhere. #PegaInterns #LifeAtPega//t.co/gESQkVTuWC",FALSE,FALSE,NA,PegaInterns
Alan Trefler,1162398866718806018,2019-08-16T16:21:00Z,"A big thank you to our 2019 @pega summer interns, you brought tremendous energy and value to the company. A special congratulations to The Bobble Bunch for winning our intern presentation competition. Great ideas come from everywhere. #PegaInterns #LifeAtPega//t.co/gESQkVTuWC",FALSE,FALSE,NA,LifeAtPega
Alan Trefler,1139518672521900033,2019-06-14T13:03:17Z,"@mims These types of legacy systems can be wrapped with a model-driven, low-code architecture that keeps their usability nimble and built for the future. It's what we do at @Pega.",FALSE,FALSE,1769191,NA
Alan Trefler,1136056286691377154,2019-06-04T23:45:00Z,And that's a wrap on another outstanding #PegaWorld. Thanks to the entire extended Pega community for making our vision a reality. See you in Boston!//t.co/08U0J8zBuX,FALSE,FALSE,NA,PegaWorld
Alan Trefler,1135984568908099584,2019-06-04T19:00:01Z,"Thank you to all our clients and partners for sharing their stories of digital transformation at #PegaWorld. The keynotes, sessions, and Tech Pavilion have been inspiring.",FALSE,FALSE,NA,PegaWorld
Alan Trefler,1135977015872503809,2019-06-04T18:30:00Z,"Incredible Day 2 keynotes at #PegaWorld. A big thanks to Vaishal Gariwala of @ING_news, Robert Skinner of @FordDirect, and Jeanne Ross of @MIT_CISR for bringing your insights and stories to life.",FALSE,FALSE,NA,PegaWorld
Alan Trefler,1135652378055565312,2019-06-03T21:00:00Z,One of my favorite parts of PegaWorld is the Tech Pavilion. It's amazing seeing such powerful technology in one place. #PegaWorld,FALSE,FALSE,NA,PegaWorld
Alan Trefler,1135622179930984448,2019-06-03T19:00:01Z,Congratulations to the 2019 #DXHeroes! Read all about them here://t.co/E7E52sEmUd,FALSE,FALSE,NA,DXHeroes
Alan Trefler,1135614627721764865,2019-06-03T18:30:00Z,The best part of #PegaWorld is hearing our amazing clients share their success stories. Thank you to Nicole Verburg of @VodafoneZiggo and Moshe Pridan of @SIRIUSXM for sharing your digital transformation stories.,FALSE,FALSE,NA,PegaWorld
Alan Trefler,1135608335686885376,2019-06-03T18:05:00Z,We @Pega are proud to support @GirlsinTech. Thank you Adriana Gascoigne for sharing the incredible work that you and your organization do. #PegaWorld,FALSE,FALSE,NA,PegaWorld
Alan Trefler,1135584341185064961,2019-06-03T16:29:39Z,@TamaraMcCleary @pega @ThuliumCo It was great meeting you. Have a fantastic time at #PegaWorld!,FALSE,FALSE,2307675307,PegaWorld
Alan Trefler,1135546678696644611,2019-06-03T14:00:00Z,Had a great time at the welcome reception last night. Looking forward to kicking off another incredible #PegaWorld with our clients and partners.,FALSE,FALSE,NA,PegaWorld
Alan Trefler,1135333112672444416,2019-06-02T23:51:22Z,Congratulations to Ivan Glinka of @PWC for a great game! A well deserved win. #PegaWorld//t.co/gH71p9HhBp,FALSE,FALSE,NA,PegaWorld
Alan Trefler,1135282437477601282,2019-06-02T20:30:00Z,Getting ready for 20 rounds of simultaneous chess. Come by level 3 of the Conference Center and say hi. #PegaWorld,FALSE,FALSE,NA,PegaWorld
Alan Trefler,1110649648274984966,2019-03-26T21:08:05Z,"Had a terrific conversation with @jimcramer last night on @MadMoneyOnCNBC talking about Pega's success, our world-class clients, and our cloud growth. //t.co/f6bGUZHoHm",FALSE,FALSE,NA,NA
Alan Trefler,1093187233656508416,2019-02-06T16:38:41Z,@JohnGladwyn @bevelson @michael_saylor since 1983!,FALSE,FALSE,2860404735,NA
Alan Trefler,1082356246882254849,2019-01-07T19:20:13Z,@jacobm Looking forward to it!,FALSE,FALSE,8481222,NA
Alan Trefler,1060965452816568320,2018-11-09T18:40:50Z,Thrilled to be at game 1 of the Chess World Championship in London! @theworldchess #londonplayschess #worldchessChampionship2018//t.co/6TnMXlSzkC,FALSE,FALSE,NA,londonplayschess
Alan Trefler,1060965452816568320,2018-11-09T18:40:50Z,Thrilled to be at game 1 of the Chess World Championship in London! @theworldchess #londonplayschess #worldchessChampionship2018//t.co/6TnMXlSzkC,FALSE,FALSE,NA,worldchessChampionship2018
Alan Trefler,1058055833559425025,2018-11-01T17:59:03Z,Thank you @NathanLatka for having me on your podcast. I had a great time sharing Pega's history with you.//t.co/FdoIU1MUFQ,TRUE,FALSE,NA,NA
Alan Trefler,1055113039173873665,2018-10-24T15:05:26Z,"Are you at #Sibos? Visit Pega at stand I02 to learn how a unified, AI powered, build for change platform can supercharge your digital transformation.//t.co/WSqjl2fkGS",FALSE,TRUE,NA,Sibos
Alan Trefler,1054411790774398976,2018-10-22T16:38:55Z,Hanging out with #RegTech superstar Reetu Khosla at #Sibos. Learn more about how she's driving @Pega's onboarding and #KYC expertise here//t.co/49AXXPg8xz .//t.co/SkQ1KwSc30,FALSE,FALSE,NA,RegTech
Alan Trefler,1054411790774398976,2018-10-22T16:38:55Z,Hanging out with #RegTech superstar Reetu Khosla at #Sibos. Learn more about how she's driving @Pega's onboarding and #KYC expertise here//t.co/49AXXPg8xz .//t.co/SkQ1KwSc30,FALSE,FALSE,NA,Sibos
Alan Trefler,1054411790774398976,2018-10-22T16:38:55Z,Hanging out with #RegTech superstar Reetu Khosla at #Sibos. Learn more about how she's driving @Pega's onboarding and #KYC expertise here//t.co/49AXXPg8xz .//t.co/SkQ1KwSc30,FALSE,FALSE,NA,KYC
Alan Trefler,1006209022662533120,2018-06-11T16:18:20Z,Appreciate all the clients who made this event so tremendous - Thanks!!//t.co/rqanJdXinI//t.co/wBytLm8L8S,FALSE,FALSE,NA,NA
Alan Trefler,1004139554163617794,2018-06-05T23:15:00Z,I am in awe of the power of #PegaWorld this year. Thanks tothe entire extendedPega community for making our vision a reality. See you at Hakkasan!,FALSE,FALSE,NA,PegaWorld
Alan Trefler,1003999884112850945,2018-06-05T14:00:00Z,"Thank you to all our customers and partners for sharing their stories of digital transformation at #PegaWorld. The keynotes, sessions, and Tech Pavilion have been inspiring.",FALSE,FALSE,NA,PegaWorld
Alan Trefler,1003818689441873920,2018-06-05T02:00:00Z,"Day 1 of #PegaWorld wasincredible. Excited to hear from @Chase, @AnthemInc, @CommBank tomorrow.",FALSE,FALSE,NA,PegaWorld
Alan Trefler,1003705443628093443,2018-06-04T18:30:00Z,"I always enjoy celebrating our customer successes. This morning at #PegaWorld was no different. Thank you @Aflac, @Google, and @libertyglobal for sharing your stories.",FALSE,FALSE,NA,PegaWorld
Alan Trefler,1003690848314449922,2018-06-04T17:32:00Z,Excited to finally share #PegaInfinity with all of you.We're rocketingdigital transformation to a whole new level//t.co/RtqPMUWFwP #PegaWorld.,FALSE,FALSE,NA,PegaInfinity
Alan Trefler,1003690848314449922,2018-06-04T17:32:00Z,Excited to finally share #PegaInfinity with all of you.We're rocketingdigital transformation to a whole new level//t.co/RtqPMUWFwP #PegaWorld.,FALSE,FALSE,NA,PegaWorld
Alan Trefler,1003637509346287622,2018-06-04T14:00:03Z,So happy to be at #PegaWorld with our incredible customers and partners. Here's to a terrific event in Vegas!,FALSE,FALSE,NA,PegaWorld
Alan Trefler,1003435012916572160,2018-06-04T00:35:24Z,Amazing chess match against 15 players at #PegaWorld. Congratulations to John Ngujen from @Jabil a well earned win! Rematch next year.,FALSE,FALSE,NA,PegaWorld
Alan Trefler,1003384076911325184,2018-06-03T21:13:00Z,"Kicking off the chess tournament. #PegaWorld attendees, you can join me in the conference center or tune in on Facebook Live//t.co/0ZbwNntFge.//t.co/KabXcsXpm6",FALSE,FALSE,NA,PegaWorld
Alan Trefler,1003374078713925634,2018-06-03T20:33:16Z,"Each year I think may be the last, but I can't stay away. Kicking off 15 simultaneous #PegaWorld chess matches at 2 pm. Come by and say hi.",FALSE,FALSE,NA,PegaWorld
Alan Trefler,992044606526230528,2018-05-03T14:14:00Z,"I had a great conversation with @JacobM on his #futureofwork podcast. We discussed the skills gap, the future of leadership and chess.//t.co/zxBkhleN9d",FALSE,FALSE,NA,futureofwork
Alan Trefler,992043975849775104,2018-05-03T14:11:29Z,"@jacobm @pega Thanks for having me on your podcast. I had a great time talking about the skills gap, the future of leadership, and chess.",FALSE,FALSE,8481222,NA
Alan Trefler,982281781222297601,2018-04-06T15:40:01Z,Had a great time accepting a Wallabies jumper from Australian rugby legend @Davidcampese11 during the Hong Kong Sevens.//t.co/Cu2j0AdJno,FALSE,FALSE,NA,NA
Alan Trefler,974326105221066753,2018-03-15T16:47:00Z,Well Done Brad !//t.co/mibB3Yu432,FALSE,FALSE,NA,NA
Alan Trefler,971147461631840256,2018-03-06T22:16:12Z,Enjoyed the conversation this evening with @jimcramer on @MadMoneyOnCNBC to talk about how Pega is winning. Always a fun and thought-provoking interview.//t.co/CTzOf5HJeq,FALSE,FALSE,NA,NA
Alan Trefler,966741949880430592,2018-02-22T18:30:16Z,"Congratulations @JohnCUrschel on your new journey and welcome to the neighborhood! Consider this an open invitation to meet up and play a match. Pega is in MIT's back yard, and I'm all about math and chess.//t.co/3SOZyE52K6",FALSE,FALSE,NA,NA
Alan Trefler,966413431338360833,2018-02-21T20:44:51Z,Congratulations to @LiatBenZur and @Philips for an outstanding @WSJ feature. So proud of the work we do together.//t.co/Xy5P2yEcBJ,FALSE,FALSE,NA,NA
Alan Trefler,960875948445962240,2018-02-06T14:00:52Z,Thank you so much to all our customers and partners for making the London Customer Engagement Summit such a great event. #PegaRoadshow//t.co/8itu72OMI9,TRUE,FALSE,NA,PegaRoadshow
Alan Trefler,955906856739835904,2018-01-23T20:55:29Z,"This morning at the World Economic Forum's annual meeting, @Pega joined other global IT industry leaders to announce a new initiative to help train workers with the skills to succeed in an increasingly digital workplace. Read more//t.co/JAfUg05upF.",FALSE,FALSE,NA,NA
Alan Trefler,955839537573482498,2018-01-23T16:27:59Z,Pega is proud to be part of this important global initiative - helping to build the workforce of the future. //t.co/l7kLqNBmu5,FALSE,TRUE,NA,NA
Alan Trefler,931559044883664897,2017-11-17T16:25:58Z,"Thanks @chessinschools for inviting me to meet your incredible teachers and kids! Great afternoon talking about life, careers, and chess.//t.co/gxlJ6oKPU7",FALSE,FALSE,NA,NA
Alan Trefler,903799986525175808,2017-09-02T02:01:23Z,Proud of the work client @GM @Onstar is doing to support Houston and to be the software helping make it happen//t.co/LateuyprYF,FALSE,FALSE,NA,NA
Alan Trefler,882259827849920512,2017-07-04T15:28:29Z,"At the heart of the ""story"": ""Watson in reality, was a set of technologies that needed to be stitched together at t//t.co/fFs5Yv6gdj",FALSE,FALSE,NA,NA
Alan Trefler,871021594197602304,2017-06-03T15:11:45Z,Then I think we're going to need a bigger screen!!//t.co/tc7gaM8S0a,TRUE,FALSE,NA,NA
Alan Trefler,866700970880897024,2017-05-22T17:03:08Z,@BlakeMichelleM Congratulations and thanks for including me with such great company.//t.co/sW5b6558Zw,TRUE,FALSE,15426896,NA
Alan Trefler,856754567098253315,2017-04-25T06:19:41Z,@DanBeck_LTD @SiliconHBO @pega @Brogers825 Thanks Dan - Starting w the middle aligns channel specialization and ugly back ends!,FALSE,FALSE,40937610,NA
Alan Trefler,846449977517838337,2017-03-27T19:52:55Z,.@Sprint CEO @MarceloClaure to Keynote @Pega's #PegaWorld 2017//t.co/9HKTyHGWJc//t.co/jnj1rD8J1a,FALSE,TRUE,NA,PegaWorld
Alan Trefler,846405942103228418,2017-03-27T16:57:56Z,Break through the hype of #AI & #robotics at #PegaWorld 2017//t.co/z9v0YnTgTd,FALSE,FALSE,NA,AI
Alan Trefler,846405942103228418,2017-03-27T16:57:56Z,Break through the hype of #AI & #robotics at #PegaWorld 2017//t.co/z9v0YnTgTd,FALSE,FALSE,NA,robotics
Alan Trefler,846405942103228418,2017-03-27T16:57:56Z,Break through the hype of #AI & #robotics at #PegaWorld 2017//t.co/z9v0YnTgTd,FALSE,FALSE,NA,PegaWorld
Alan Trefler,846405223753170946,2017-03-27T16:55:05Z,Great story on @60minutes about chess to inspire kids//t.co/6RRkFxKh5d,FALSE,FALSE,NA,NA
Alan Trefler,840415796983545856,2017-03-11T04:15:14Z,Quite a birthday chorus!//t.co/Q2W4hvo4o0,FALSE,FALSE,NA,NA
Alan Trefler,838633393428406272,2017-03-06T06:12:36Z,@ACSOAustralia @pega A great privilege to support this important cause that helps so many become productive members of the community,FALSE,FALSE,321794315,NA
Alan Trefler,837869312798908416,2017-03-04T03:36:25Z,Manhattan beach sure beats Manhattan...//t.co/v6YeeJijrL,FALSE,FALSE,NA,NA
Alan Trefler,826222760233992193,2017-01-31T00:17:11Z,A note I sent to @Pega global staff today in response to recent news.//t.co/qWNOAFw4ed,FALSE,FALSE,NA,NA
