name,status_id,created_at,text,is_quote,is_retweet,reply_to_user_id,hashtags
Brian Peccarelli,1179388100293869569,2019-10-02T13:30:09Z,AI Gets Real in Professional Services - my new blog for @cfo//t.co/GwK9rjdHHP,FALSE,FALSE,NA,NA
Brian Peccarelli,1163782810542530560,2019-08-20T12:00:18Z,"Risk on the Road ahead for Smart Cities, my latest @Forbes column://t.co/1fxAnn1U0M",FALSE,FALSE,NA,NA
Brian Peccarelli,1159826937466036224,2019-08-09T14:01:05Z,Great to speak to David Wilkins @HLS_CLP for his feature in The Practice.//t.co/64KQCHclRQ,FALSE,FALSE,NA,NA
Brian Peccarelli,1151855444283002880,2019-07-18T14:05:13Z,"Exciting News! @thomsonreuters has acquired @HighQ, a leading provider of collaboration tools for the legal and regulatory market. #legaltech//t.co/6l0ewSfbAg",FALSE,FALSE,NA,legaltech
Brian Peccarelli,1144364860114972672,2019-06-27T22:00:18Z,Are Smart Cities the Next Great Disruptor?//t.co/TgkdQcVOtC,FALSE,FALSE,NA,NA
Brian Peccarelli,1130823119910973440,2019-05-21T13:10:16Z,"Does Brexit matter? While the impacts will vary for different types of businesses, for large multinational companies, the bulk of its impact has already been felt.//t.co/MpIBXbdmRD//t.co/GpEZyYhVkl",FALSE,FALSE,NA,NA
Brian Peccarelli,1130821153231134720,2019-05-21T13:02:27Z,"Today, we announce a new strategic alliance with @thomsonreuters that brings together ONESOURCE global #tax technology with EY Tax Technology and Transformation services. Read the details.//t.co/AJ8ScLDg4H",FALSE,TRUE,NA,tax
Brian Peccarelli,1104087066504294400,2019-03-08T18:30:44Z,"Women currently represent 36% of our senior executives at TR, a sustained increase year on year but still more work needs to be done to reach our 40% goal. #balanceforbetter #workingatTR #IWD2019 #dallasIWD2019",FALSE,FALSE,NA,balanceforbetter
Brian Peccarelli,1104087066504294400,2019-03-08T18:30:44Z,"Women currently represent 36% of our senior executives at TR, a sustained increase year on year but still more work needs to be done to reach our 40% goal. #balanceforbetter #workingatTR #IWD2019 #dallasIWD2019",FALSE,FALSE,NA,workingatTR
Brian Peccarelli,1104087066504294400,2019-03-08T18:30:44Z,"Women currently represent 36% of our senior executives at TR, a sustained increase year on year but still more work needs to be done to reach our 40% goal. #balanceforbetter #workingatTR #IWD2019 #dallasIWD2019",FALSE,FALSE,NA,IWD2019
Brian Peccarelli,1104087066504294400,2019-03-08T18:30:44Z,"Women currently represent 36% of our senior executives at TR, a sustained increase year on year but still more work needs to be done to reach our 40% goal. #balanceforbetter #workingatTR #IWD2019 #dallasIWD2019",FALSE,FALSE,NA,dallasIWD2019
Brian Peccarelli,1103195038065012736,2019-03-06T07:26:08Z,A big thank you to all the speakers and panelist participating at the Legal Executive Briefing Asia Pacific 2019 in Hong Kong this week.//t.co/hZO5EsOdk7,FALSE,FALSE,NA,NA
Brian Peccarelli,1096146234132385792,2019-02-14T20:36:42Z,My latest piece for @cfo Waning Trust in Corporate Leadership Brings a New Urgency to Transparency//t.co/tcDQWlZJUW,FALSE,FALSE,NA,NA
Brian Peccarelli,1095699201386795008,2019-02-13T15:00:21Z,Why Global Tax Authorities Are Obsessed with Bird Box @Forbes//t.co/9NKUhgEJGO,FALSE,FALSE,NA,NA
Brian Peccarelli,1088881243599585281,2019-01-25T19:28:13Z,"At #WEF19 @Axelthrelfall asks @Mark_Weinberger, @EYnews and @BPeccarelli, Thomson Reuters how investing in #AI impacts business.//t.co/epjwgqqZKM",FALSE,TRUE,NA,WEF19
Brian Peccarelli,1088881243599585281,2019-01-25T19:28:13Z,"At #WEF19 @Axelthrelfall asks @Mark_Weinberger, @EYnews and @BPeccarelli, Thomson Reuters how investing in #AI impacts business.//t.co/epjwgqqZKM",FALSE,TRUE,NA,AI
Brian Peccarelli,1088835593331712000,2019-01-25T16:26:49Z,"Technology's going to change everything. It's the single biggest thing that governments should be focused on,' former UK PM Tony Blair says on Davos Today. See our #ReutersDavos poll on the impact of artificial intelligence://t.co/jiRl2ZHSB7 #WEF19//t.co/GU5V5XmVqG",FALSE,TRUE,NA,NA
Brian Peccarelli,1088798727647707136,2019-01-25T14:00:20Z,"Ending on a high. My last interview for Answers On with Mark Weinberger and Axel Threlfall, thank you for making it a good one! #davos #wef19 @Mark_Weinberger @axelthrelfall//t.co/Ihw82NzcTg",FALSE,FALSE,NA,davos
Brian Peccarelli,1088798727647707136,2019-01-25T14:00:20Z,"Ending on a high. My last interview for Answers On with Mark Weinberger and Axel Threlfall, thank you for making it a good one! #davos #wef19 @Mark_Weinberger @axelthrelfall//t.co/Ihw82NzcTg",FALSE,FALSE,NA,wef19
Brian Peccarelli,1088727676729335810,2019-01-25T09:18:00Z,"Watch @AxelThrelfall quiz Gideon Moore, @LinklatersLLP and @BPeccarelli about the impact of #Brexit on clients; #AI in the legal industry and the progress being made in creating a more diverse workforce.//t.co/KExoBiaiRX",FALSE,TRUE,NA,Brexit
Brian Peccarelli,1088727676729335810,2019-01-25T09:18:00Z,"Watch @AxelThrelfall quiz Gideon Moore, @LinklatersLLP and @BPeccarelli about the impact of #Brexit on clients; #AI in the legal industry and the progress being made in creating a more diverse workforce.//t.co/KExoBiaiRX",FALSE,TRUE,NA,AI
Brian Peccarelli,1088483529397362689,2019-01-24T17:07:51Z,"CEO of the @AtlanticCouncil, @FredKempe, and @BPeccarelli, COO, Thomson Reuters discuss the starring role #AI is playing at #Davos19 with editor at large for @Reuters, @AxelThrelfall. #wef19//t.co/ZZyg6IQ9hu",FALSE,TRUE,NA,AI
Brian Peccarelli,1088482873760464897,2019-01-24T17:05:14Z,"What matters to you in 2019? Hot topics Gideon Moore and I discussed with @axelthrelfall for Answers On at Davos; Brexit, AI, workforce reform and D&I #davos #wef19 @LinklatersLLP//t.co/52HDq4tvUz",FALSE,FALSE,NA,davos
Brian Peccarelli,1088482873760464897,2019-01-24T17:05:14Z,"What matters to you in 2019? Hot topics Gideon Moore and I discussed with @axelthrelfall for Answers On at Davos; Brexit, AI, workforce reform and D&I #davos #wef19 @LinklatersLLP//t.co/52HDq4tvUz",FALSE,FALSE,NA,wef19
Brian Peccarelli,1088480445354962945,2019-01-24T16:55:35Z,THREAD: See my @Davos presentation here on the #Geopolitics of the #FourthIndustrialRevolution. (And why China is on track to win the #ArtificialIntelligence Race) #WEF2019//t.co/QbvyJLMtvz,FALSE,TRUE,NA,Geopolitics
Brian Peccarelli,1088480445354962945,2019-01-24T16:55:35Z,THREAD: See my @Davos presentation here on the #Geopolitics of the #FourthIndustrialRevolution. (And why China is on track to win the #ArtificialIntelligence Race) #WEF2019//t.co/QbvyJLMtvz,FALSE,TRUE,NA,FourthIndustrialRevolution
Brian Peccarelli,1088102155821682689,2019-01-23T15:52:24Z,"Watch this year's inaugural Answers On interview series in #Davos, featuring @SAP's @AdaireFoxMartin and @BPeccarelli. @Axelthrelfall asked the guests about caution in business, #AI's future role in the workforce and what we can learn in the west from China. #wef19//t.co/rtnbsURjAl",FALSE,TRUE,NA,Davos
Brian Peccarelli,1088047479541678081,2019-01-23T12:15:08Z,Is #AI the star of Davos? Great to chat with Fred Kempe during an Answers On' video interview with @axelthrelfall this morning at #wef19 #davos @FredKempe//t.co/SKD4F9ty5L,FALSE,FALSE,NA,AI
Brian Peccarelli,1088047479541678081,2019-01-23T12:15:08Z,Is #AI the star of Davos? Great to chat with Fred Kempe during an Answers On' video interview with @axelthrelfall this morning at #wef19 #davos @FredKempe//t.co/SKD4F9ty5L,FALSE,FALSE,NA,wef19
Brian Peccarelli,1088047479541678081,2019-01-23T12:15:08Z,Is #AI the star of Davos? Great to chat with Fred Kempe during an Answers On' video interview with @axelthrelfall this morning at #wef19 #davos @FredKempe//t.co/SKD4F9ty5L,FALSE,FALSE,NA,davos
Brian Peccarelli,1087729144232923136,2019-01-22T15:10:11Z,Great to be part of such a thought provoking panel this morning at #davos #wef19 on restoring trust at the leadership level. @wef//t.co/hyd3lAVXvf,FALSE,FALSE,NA,davos
Brian Peccarelli,1087729144232923136,2019-01-22T15:10:11Z,Great to be part of such a thought provoking panel this morning at #davos #wef19 on restoring trust at the leadership level. @wef//t.co/hyd3lAVXvf,FALSE,FALSE,NA,wef19
Brian Peccarelli,1087726806160023556,2019-01-22T15:00:54Z,"Davos is extremely chilly, but the conversations are energetic and highly interesting. Great chat this morning with @axelthrelfall and @BPeccarelli of Thomson Reuters on building business trust at the leadership level. Thank you both for your time today.//t.co/nDQPjhGuyW",FALSE,TRUE,NA,NA
Brian Peccarelli,1086408053862346753,2019-01-18T23:40:39Z,"Glad I was able to attend the Dallas Regional Chamber's 2019 Annual Meeting to hear Jim Lentz, CEO of Toyota North America, speak on Toyota's move to Dallas, mobility and Toyota's role in the community.//t.co/YUBAF7YXXj",FALSE,FALSE,NA,NA
Brian Peccarelli,1085210037914615809,2019-01-15T16:20:09Z,My latest article for @wef on AI and the future of workforce://t.co/mP4iy10WEd #wef19//t.co/NQngU5WKkm,FALSE,FALSE,NA,wef19
Brian Peccarelli,1074876952668971008,2018-12-18T04:00:10Z,I stand in support of @Reuters jounalists Wa Lone and Kyaw Soe Oo who were arrested in Myanmar a year ago today and still remain in jail. #FreeWaLoneKyawSoeOo//t.co/xSgdnDyoiC,FALSE,TRUE,NA,NA
Brian Peccarelli,1073609859881406464,2018-12-14T16:05:11Z,Read my latest article for @Forbes - New Winners In Global Trade Wars.//t.co/LGPYhAihbQ,FALSE,FALSE,NA,NA
Brian Peccarelli,1057695867128479744,2018-10-31T18:08:40Z,"In my recent Forbes article, I examine how the UK approaches taxes in the digital economy. //t.co/CDFRdOrwNL",FALSE,FALSE,NA,NA
Brian Peccarelli,1055966308817403911,2018-10-26T23:36:01Z,@TaxSutracom @ZeeBusiness @ameyakunte @arungiri Congratulations! Well done.,FALSE,FALSE,423360917,NA
Brian Peccarelli,1051830418671054848,2018-10-15T13:41:28Z,My new article for @cfo examines the need for supply-chain vigilance in a time of changing tariffs. //t.co/WiBOT8rGy3,FALSE,FALSE,NA,NA
Brian Peccarelli,1050428679246028800,2018-10-11T16:51:27Z,Great to meet former UK Prime Minister Tony Blair in London at our @Reuters Newsmaker. #ReutersLive//t.co/X48jTk6Rcs//t.co/VLW1P5yTHu,FALSE,FALSE,NA,ReutersLive
Brian Peccarelli,1044606136299794432,2018-09-25T15:14:45Z,My latest for @Forbes: Tech Companies About To Feel Full Weight Of Supreme Court Internet Sales Tax Decision.//t.co/YnAd6EcWFz,FALSE,FALSE,NA,NA
Brian Peccarelli,1042442886489559040,2018-09-19T15:58:46Z,My latest article for @Forbes - Trade Deal Or No Deal: What Businesses Need To Do Now To Insulate Themselves From Trade Wars.//t.co/Lk7RmJFxdC,FALSE,FALSE,NA,NA
Brian Peccarelli,1042050494229884928,2018-09-18T13:59:32Z,The #DigitalEconomy is the Fourth Industrial Revolution. Explore five key facts on #digitaltransformation here://t.co/S1n4IK4WKY,FALSE,FALSE,NA,DigitalEconomy
Brian Peccarelli,1042050494229884928,2018-09-18T13:59:32Z,The #DigitalEconomy is the Fourth Industrial Revolution. Explore five key facts on #digitaltransformation here://t.co/S1n4IK4WKY,FALSE,FALSE,NA,digitaltransformation
Brian Peccarelli,1037386685250772993,2018-09-05T17:07:14Z,"The #Wayfair decision has left us with 10,000 state and location jurisdictions in the U.S. where sales tax could be demanded. See what this complex situation means for your business in my latest piece for @ThomsonReuters://t.co/konKL4RIjr//t.co/yi7ppxnvkZ",FALSE,FALSE,NA,Wayfair
Brian Peccarelli,1035222932564463616,2018-08-30T17:49:15Z,Are there more twists to come in the online sales tax saga? Check out my latest article for @ThomsonReuters to learn more://t.co/konKL4RIjr,FALSE,FALSE,NA,NA
Brian Peccarelli,1019946559767810048,2018-07-19T14:06:24Z,European in-house counsel share their Brexit perspectives in our new survey.//t.co/h3Jk47yil2//t.co/IGxLfBM5fi,FALSE,FALSE,NA,NA
Brian Peccarelli,1019203002127798272,2018-07-17T12:51:46Z,FRC fines jump a further 23% to 17.96 million as regulator cracks down on auditing firms.//t.co/w0SEk4sYb6//t.co/aY63YKkDug,FALSE,FALSE,NA,NA
Brian Peccarelli,1017816685313654785,2018-07-13T17:03:02Z,My most recent article for CFO.//t.co/tDIXQxnkJQ,FALSE,FALSE,NA,NA
Brian Peccarelli,995381894459154432,2018-05-12T19:15:11Z,"Tariffs, trade wars, and technology -- the only certainty in the current economy is that everything is in a state of constant change.//t.co/0dj6HqaWKI",FALSE,FALSE,NA,NA
Brian Peccarelli,994644267128811525,2018-05-10T18:24:07Z,"In @BPeccarellis latest piece for @cfo, he discusses the impact of the US and China's trade war and gives tips to get out in front of the unpredictable swings in global trade and tax regulation.//t.co/ID6yjPKC8E",FALSE,TRUE,NA,NA
Brian Peccarelli,994208364963024896,2018-05-09T13:32:00Z,Navigating the U.S./China trade war How to adjust course when your raw supply costs are suddenly 25% higher overnight.//t.co/BoyDMQBGjd,FALSE,FALSE,NA,NA
Brian Peccarelli,993868823483813889,2018-05-08T15:02:47Z,"As the U.S. and China dive into a trade war to the tune of $200 billion in tariffs and retaliatory tariffs, CFOs brace for impact.//t.co/vcqJCxn4dh",FALSE,FALSE,NA,NA
Brian Peccarelli,992792340254380035,2018-05-05T15:45:13Z,25% of CFOs believe Transfer Pricing functions to be impacted because of Brexit.//t.co/S1STnt6VAm//t.co/dE0AdLVxvS,FALSE,FALSE,NA,NA
Brian Peccarelli,992477753483161601,2018-05-04T18:55:10Z,"31% of companies to relocate UK staff because of Brexit however, 90% of CFOs don't anticipate relocating UK headquarters Thomson Reuters survey reveals //t.co/S1STnt6VAm",FALSE,FALSE,NA,NA
Brian Peccarelli,992375833854652416,2018-05-04T12:10:10Z,60% of CFOs say Brexit hasn't affected their strategic investment decisions in the UK/Europe Thomson Reuters survey reveals. //t.co/S1STnt6VAm//t.co/GHKDst5cff,FALSE,FALSE,NA,NA
Brian Peccarelli,990476134784610304,2018-04-29T06:21:27Z,Great night at the White House Correspondents dinner celebrating the great work journalist do everyday.//t.co/BTM7rZsq7U,FALSE,FALSE,NA,NA
Brian Peccarelli,943949006501240836,2017-12-21T20:59:15Z,"Understand how the Tax Cuts & Jobs Act affects estate and gift taxes, including the increased exemption amount for the estate and gift tax, the new rates and brackets, and modification of the kiddie tax.//t.co/NzMqmC1ceN #TCJA #TaxReform//t.co/HZOz7VmSxt",FALSE,TRUE,NA,NA
Brian Peccarelli,917453106413260800,2017-10-09T18:14:00Z,Join webinar on #modernslavery 19th Oct at 10am BST/11am CEST w@ethicaltrade Register now://t.co/gP4s90RDfB//t.co/N76vqFbXoU,FALSE,FALSE,NA,modernslavery
Brian Peccarelli,917452599317671937,2017-10-09T18:11:59Z,"Mr. @BPeccarelli said - Technology will play a pivotal role in ushering transparency in tax administration"" #TaxsutraConclave2017//t.co/FKuWFjn05u",FALSE,TRUE,NA,NA
Brian Peccarelli,916045194151321600,2017-10-05T20:59:28Z,My latest blog on//t.co/sjrG6It7Nq -//t.co/lQnohI4DAd,FALSE,FALSE,NA,NA
Brian Peccarelli,915271594410434560,2017-10-03T17:45:27Z,US Navy Admiral Grace Hopper was one of the first programmers in computing history and paved the way for women in tech. #GHC17 #WorkingAtTR//t.co/da1jQVytLb,FALSE,TRUE,NA,NA
Brian Peccarelli,915271514387357696,2017-10-03T17:45:08Z,"GM promises more electric vehicles, paid for by SUVs//t.co/AtZ3NKbhjf",FALSE,FALSE,NA,NA
Brian Peccarelli,912781983260037120,2017-09-26T20:52:38Z,Materials Sector Giant DuPont Weighs In On Tax Reform via @forbes//t.co/acle3ZENmr,FALSE,FALSE,NA,NA
Brian Peccarelli,911250632593551361,2017-09-22T15:27:35Z,Disruption for dinner (and data for dessert) at the IFA Congress | Thomson Reuters//t.co/QRSnz8DOLf,FALSE,FALSE,NA,NA
Brian Peccarelli,910868500222238720,2017-09-21T14:09:08Z,The big reveal is almost here. The 2017 #PublicSectorChampions will be announced during tonight's #SYNERGYGov awards banquet.,FALSE,TRUE,NA,PublicSectorChampions
Brian Peccarelli,910868500222238720,2017-09-21T14:09:08Z,The big reveal is almost here. The 2017 #PublicSectorChampions will be announced during tonight's #SYNERGYGov awards banquet.,FALSE,TRUE,NA,SYNERGYGov
Brian Peccarelli,910868406500560896,2017-09-21T14:08:45Z,Some great articles from my colleagues - a lot to chose from - check it out via @forbes//t.co/gabisGa8zC,FALSE,FALSE,NA,NA
Brian Peccarelli,910520413104439298,2017-09-20T15:05:57Z,Where to go to find trusted answers ...//t.co/DKIPwiqfrn,FALSE,FALSE,NA,NA
Brian Peccarelli,908043871673884673,2017-09-13T19:05:04Z,What makes Thomson Reuters The Answer Company?//t.co/Lccqu5a7Mk via @YouTube,FALSE,FALSE,NA,NA
Brian Peccarelli,908036773967736845,2017-09-13T18:36:52Z,The Business Lessons We Can Learn From Taylor Swift via @forbes//t.co/XrSsEfy8kd,FALSE,FALSE,NA,NA
Brian Peccarelli,908002622568792064,2017-09-13T16:21:09Z,Kicking off our #spark2017 event today in Carrollton for Thomson Reuters Tax & Accounting - looking forward to seeing our attendees,FALSE,FALSE,NA,spark2017
Brian Peccarelli,906244712255848449,2017-09-08T19:55:51Z,"My latest column from//t.co/sjrG6It7Nq ... ""Auto Industry CFOs Buckle Up for Disruption""//t.co/DrhSGDgy0I",FALSE,FALSE,NA,NA
Brian Peccarelli,906218070766735360,2017-09-08T18:09:59Z,"@thomsonreuters @davidwicraig I especially enjoyed @davidwicraig 's interview with Dr. Birkinshaw - with disruption, it's the human element that is the key differentiator",FALSE,FALSE,14412844,NA
Brian Peccarelli,906171107346006017,2017-09-08T15:03:22Z,Is NAFTA still relevant in 2017? | Thomson Reuters//t.co/V7gPSX5A5e,FALSE,FALSE,NA,NA
Brian Peccarelli,905522727049678851,2017-09-06T20:06:56Z,Where globalization will affect tomorrow's auto industry//t.co/rdCUNYLbbp,FALSE,FALSE,NA,NA
Brian Peccarelli,905071425937170432,2017-09-05T14:13:38Z,I was pleased to be interviewed by Tax Sutra during last week's IFA Congress -//t.co/N08VxV0pNT,FALSE,FALSE,NA,NA
Brian Peccarelli,903655353770024960,2017-09-01T16:26:40Z,"Very pleased to be recognized - it's a testament to the great work of TRTA -//t.co/LoJeuB3ePB{""issue_id"":434487,""page"":0}",FALSE,FALSE,NA,NA
Brian Peccarelli,903366132928835588,2017-08-31T21:17:24Z,The Thomson Reuters Tax & Accounting team enjoying the successful conclusion of IFA Congress 2017 in Brazil//t.co/JVyldGjY2o,FALSE,FALSE,NA,NA
Brian Peccarelli,902872164008906752,2017-08-30T12:34:33Z,@axelthrelfall great interviews with the incoming and outgoing presidents of IFA and Pascal Saint-Amans of the OECD //t.co/5GRaCxVlfp,FALSE,FALSE,237277150,NA
Brian Peccarelli,902647523512344576,2017-08-29T21:41:54Z,At the IFA Congress this week in Brazil - check out my interview with Reuters @axelthrelfall -//t.co/w6qXa3t7wQ,FALSE,FALSE,NA,NA
Brian Peccarelli,901168975832387584,2017-08-25T19:46:41Z,Excellent report...//t.co/1j1coaDJQN,FALSE,FALSE,NA,NA
Brian Peccarelli,900470615982972929,2017-08-23T21:31:39Z,Check out this cool infographic on best practices for organizing trade compliance teams//t.co/Y4DtS42yEK//t.co/5q5GXGBHFw,FALSE,TRUE,NA,NA
Brian Peccarelli,900470500723503105,2017-08-23T21:31:11Z,Major report from @WEF on innovation and financial services//t.co/hZXrVhkCNi Read my take in @CityAM//t.co/zkh0p2ERUh//t.co/WRulCvsQyn,FALSE,TRUE,NA,NA
Brian Peccarelli,900470467827560448,2017-08-23T21:31:04Z,Did you know you can have our experts assess your global trade operations at no cost and no strings attached?//t.co/2YyogGGnae//t.co/PrduHvUW8S,FALSE,TRUE,NA,NA
Brian Peccarelli,898242999817302016,2017-08-17T17:59:54Z,This DFW CEO almost didn't go into tech. Here's why his plans changed//t.co/f9YpGgh7Ly via @DallasBizNews,FALSE,FALSE,NA,NA
Brian Peccarelli,898210887345025024,2017-08-17T15:52:18Z,Very humbled and proud to represent Thomson Reuters...//t.co/uPmuo7wqBb,TRUE,FALSE,NA,NA
Brian Peccarelli,898192306838360064,2017-08-17T14:38:28Z,Most businesses have not changed strategic planning due to Brexit: Thomson Reuters CFO survey//t.co/y77rbXCX4M,FALSE,FALSE,NA,NA
Brian Peccarelli,897937411325415424,2017-08-16T21:45:36Z,Blockchain: Buzz Word or Game Changer? @scmendelsohn//t.co/uzQujbigQC via @Inc,FALSE,FALSE,NA,NA
Brian Peccarelli,897902716919226370,2017-08-16T19:27:44Z,"Moving to Dallas is the right career move for millennials, according to Mark Cuban//t.co/fDC2GAlmyY//t.co/KZVdUQHqe8",FALSE,TRUE,NA,NA
Brian Peccarelli,897454906080210945,2017-08-15T13:48:18Z,Hamilton star & Tony winner @ReneeGoldsberry's kicking off the best tax tech event of the yr in Music City! Join me @ SYNERGY 2017 11/12-15!//t.co/IPfXR7dpvW,FALSE,TRUE,NA,NA
Brian Peccarelli,897454792167088128,2017-08-15T13:47:51Z,"U.S. tax change proposals anger builders, realtors, charities//t.co/0icQnYDHnB",FALSE,FALSE,NA,NA
Brian Peccarelli,897099535440388096,2017-08-14T14:16:11Z,6 ways to make sure AI creates jobs for all and not the few//t.co/XyfxGYZj3S//t.co/cl5AbWJBPx,FALSE,TRUE,NA,NA
Brian Peccarelli,896061264798994432,2017-08-11T17:30:28Z,A terrific honor and I'm very humbled by it... Thomson Reuters' Brian Peccarelli chosen for Corporate CEO Award://t.co/2y5BqqOqHo,FALSE,FALSE,NA,NA
Brian Peccarelli,895648761858342913,2017-08-10T14:11:19Z,That's a sweet ride... Dutch students grow their own biodegradable car//t.co/VhgQqykAyC,FALSE,FALSE,NA,NA
Brian Peccarelli,895024441431863296,2017-08-08T20:50:30Z,@taneliruda//t.co/cmZZlv1n4g,FALSE,FALSE,5270591,NA
Brian Peccarelli,894601495630536705,2017-08-07T16:49:52Z,@joeharpaz in Forbes: Cloud = Massive Disruption//t.co/nzGkKjz6SG,FALSE,FALSE,249632657,NA
Brian Peccarelli,894593717566410753,2017-08-07T16:18:57Z,How can you understand jurisdictional tax requirements under BEPs Actions://t.co/2leivZM3LO,FALSE,TRUE,NA,NA
Brian Peccarelli,894588541694611456,2017-08-07T15:58:23Z,"My latest column on//t.co/sjrG6It7Nq - ""Much Ado About Blockchain""//t.co/tSrg9LFfFA",FALSE,FALSE,NA,NA
Brian Peccarelli,892847632393043968,2017-08-02T20:40:38Z,"I agree - tech doesn't replace humans, it augments - ""Wesurvived spreadsheets, and we'll survive AI"" //t.co/8bA8mOuijl via @WSJ",FALSE,FALSE,NA,NA
Brian Peccarelli,892772994145243136,2017-08-02T15:44:03Z,"""Has the government gotten too good at collecting taxes?""//t.co/YmIn8mX1Km via @Inc",FALSE,FALSE,NA,NA
Brian Peccarelli,892506662568906752,2017-08-01T22:05:44Z,//t.co/dsaHF3jCU1 Musk-Zuckerberg I,FALSE,FALSE,NA,NA
Brian Peccarelli,892504317458075649,2017-08-01T21:56:25Z,AI's develop their own language #skynet//t.co/VFHVjKVQR2,FALSE,FALSE,NA,skynet
Brian Peccarelli,892502954896445440,2017-08-01T21:51:01Z,@verdeye Smart social media tips for firms -//t.co/Jt0Ynxw4vg,FALSE,FALSE,104653270,NA
Brian Peccarelli,892501838599258112,2017-08-01T21:46:34Z,Thomson Reuters earnings are out today -//t.co/eRqZGx6Q2U,FALSE,FALSE,NA,NA
Brian Peccarelli,890650727273582592,2017-07-27T19:10:55Z,"New column from TR's Karla Sanchez on Brexit appearing on @OilnGasInvestor, @MidStreamBiz, @Hart_EPMag -//t.co/6NpcB4rTTx",FALSE,FALSE,NA,NA
Brian Peccarelli,889957513902387205,2017-07-25T21:16:20Z,Listening in today at the Diversity & Inclusion Panel moderated by @patsydoerr and featuring a great panel led by Peter Warwick//t.co/guyHFALdvn,FALSE,FALSE,NA,NA
Brian Peccarelli,889933611192942597,2017-07-25T19:41:21Z,@Kgmanuel in the latest edition of Innovators magazine -//t.co/iGyWHMsMhr,FALSE,FALSE,33748647,NA
Brian Peccarelli,889933455571775492,2017-07-25T19:40:44Z,"As archivist for 30+ years, John Entwisle earned a special spot in Reuters rich history. Rest in peace, John.//t.co/JOMMePuvDO.",FALSE,TRUE,NA,NA
Brian Peccarelli,887829656954601473,2017-07-20T00:20:59Z,"Follow @sayyestodallas on FB, IG, Twitter, and LinkedIn for featured jobs each day in the Dallas Region. #DallasJobOfTheDay #SayYesToDallas//t.co/pW83aaNMxy",FALSE,TRUE,NA,NA
Brian Peccarelli,887829593255706625,2017-07-20T00:20:44Z,Thanks to Jes Staley & @MQMcLane of @Barclays for a thoughtful discussion on #LGBT inclusion in the workplace. #OutNEXT #LGBTProgress//t.co/Ic8KpYEBvk,FALSE,TRUE,NA,LGBT
Brian Peccarelli,887829593255706625,2017-07-20T00:20:44Z,Thanks to Jes Staley & @MQMcLane of @Barclays for a thoughtful discussion on #LGBT inclusion in the workplace. #OutNEXT #LGBTProgress//t.co/Ic8KpYEBvk,FALSE,TRUE,NA,OutNEXT
Brian Peccarelli,887829409360736256,2017-07-20T00:20:00Z,Love that #RivetingSTEM is captured in this exciting moment for TR!//t.co/cHidoSX6vG,FALSE,TRUE,NA,RivetingSTEM
Brian Peccarelli,886971975465402368,2017-07-17T15:32:52Z,I was interviewed by Tax Sutra as part of my trip to India last month - talked about disruption in the industry -//t.co/LOLmIoukfG,FALSE,FALSE,NA,NA
Brian Peccarelli,885963994783199232,2017-07-14T20:47:31Z,Home to one of TR's major Tax & Accounting corporate offices - Ann Arbor as a Driverless-Car Hub//t.co/naiJF95EBB,FALSE,FALSE,NA,NA
Brian Peccarelli,885963173240729600,2017-07-14T20:44:15Z,Tesla's sales stall in Hong Kong as tax breaks end. Could the U.S. be next?//t.co/SW27njSvdx,FALSE,FALSE,NA,NA
Brian Peccarelli,885563704410025987,2017-07-13T18:16:54Z,@jonbaron goes Back to the Future in his latest post on @AccountingWEB//t.co/UJOWstSyTS,FALSE,FALSE,20992366,NA
Brian Peccarelli,885152946731847681,2017-07-12T15:04:42Z,Our 3rd and final AICPA round table discussion (this from Singapore) is now available for your reading pleasure -//t.co/0xceTS14oK,FALSE,FALSE,NA,NA
Brian Peccarelli,884879006839046144,2017-07-11T20:56:10Z,Add taxation to the list...//t.co/RjLNwyJb4W,TRUE,FALSE,NA,NA
Brian Peccarelli,884877503986360321,2017-07-11T20:50:11Z,"@jonbaron on GBLA - accountants, ignore GBLA at your peril -//t.co/dvd0T79y4I",FALSE,FALSE,20992366,NA
Brian Peccarelli,884877028968759296,2017-07-11T20:48:18Z,@taneliruda takes us through two sides of the border adjustment tax debate -//t.co/k6bTRd722B,FALSE,FALSE,5270591,NA
Brian Peccarelli,882656838063448065,2017-07-05T17:46:03Z,Just published my second column in a series on//t.co/sjrG6It7Nq regarding the Great Wealth Transfer -//t.co/FVJloZQZEh,FALSE,FALSE,NA,NA
Brian Peccarelli,882654915700690944,2017-07-05T17:38:25Z,@joeharpaz strikes a power chord in his latest Forbes blog - //t.co/UGcCMbpndS,FALSE,FALSE,249632657,NA
