name,status_id,created_at,text,is_quote,is_retweet,reply_to_user_id,hashtags
Bas Burger,1181531276970463234,2019-10-08T11:26:22Z,Super proud to be part of this!//t.co/R875AYiDiW,TRUE,FALSE,NA,NA
Bas Burger,1177599088210169856,2019-09-27T15:01:16Z,"Fantastic to be in Brasil this week @bt_global . So proud of the work our teams are doing in Sao Paulo and Hortolandia for Brasil, the Latin American region and the World. All customers I met are clear, the region is thriving and we are helping them progress the opportunities.//t.co/buBmWMXtKL",FALSE,FALSE,NA,NA
Bas Burger,1176141177789255680,2019-09-23T14:28:03Z,"Very excited that now the latest evolution of our @bt_global #CyberSecurity Operations Centres is ready! The Madrid SOC is now ready for business, helping our customers combat #cybercrime://t.co/MEL0YVjhGJ",FALSE,FALSE,NA,CyberSecurity
Bas Burger,1176141177789255680,2019-09-23T14:28:03Z,"Very excited that now the latest evolution of our @bt_global #CyberSecurity Operations Centres is ready! The Madrid SOC is now ready for business, helping our customers combat #cybercrime://t.co/MEL0YVjhGJ",FALSE,FALSE,NA,cybercrime
Bas Burger,1173953464369655811,2019-09-17T13:34:51Z,"We spend today with our @bt_global teams in Paris, France. I am super proud of our teams and the energy to grow and use innovation to serve our customers in this important market.//t.co/U4p6YLhk9f",FALSE,FALSE,NA,NA
Bas Burger,1173607468959707137,2019-09-16T14:39:59Z,"IT leaders dealing with complex IoT set-ups are faced with many moving parts. To adequately address every component, @networkworld recommends taking a step back and rating endpoints by delay tolerance, data throughput and processing power. Good steer!//t.co/VbYCCbarNk",FALSE,FALSE,NA,NA
Bas Burger,1173266035060989953,2019-09-15T16:03:15Z,"A recent @techrepublic survey shows IT budgets are growing in fiscal 2020, demonstrating strong investment in innovation and performance. The main drivers? #Security and #cloud, followed by digital transformation and training. Details here://t.co/mjG5EJl3Bk @ZDNet",FALSE,FALSE,NA,Security
Bas Burger,1173266035060989953,2019-09-15T16:03:15Z,"A recent @techrepublic survey shows IT budgets are growing in fiscal 2020, demonstrating strong investment in innovation and performance. The main drivers? #Security and #cloud, followed by digital transformation and training. Details here://t.co/mjG5EJl3Bk @ZDNet",FALSE,FALSE,NA,cloud
Bas Burger,1172493284100530176,2019-09-13T12:52:37Z,"Welcome to the next batch of @bt_global graduates! We had a great panel yesterday moderated by our CEO, Philip Jansen. It was great I could join the team @btsport studio from Cape Town. I look forward to the new perspectives this next generation of leaders.//t.co/Zus1FYJ4Ny",FALSE,FALSE,NA,NA
Bas Burger,1172177269533609984,2019-09-12T15:56:53Z,This afternoon we spend time with the @bt_global team on Robben Island. Under the insperational guidance of @christobrand60 . A very humbling experience. #myprisonermyfriend//t.co/nWgJOJgQYt,FALSE,FALSE,NA,myprisonermyfriend
Bas Burger,1171723301972008960,2019-09-11T09:52:59Z,"Excellent visit with our teams in Johannesburg, South Africa this week. A great @bt_global team focussed on bringing outcome based Networks to Africa and the rest of the World.//t.co/zAZujdp02Y",FALSE,FALSE,NA,NA
Bas Burger,1171667432202743809,2019-09-11T06:10:59Z,@reubenmorgan It was my pleasure! Great to see all of you.,FALSE,FALSE,17803498,NA
Bas Burger,1170295684957949952,2019-09-07T11:20:08Z,Discover how we're creating job opportunities and enhancing lives in Africa through our #CSR work. @bwightma shares highlights from her recent visit://t.co/sZoQtOnUzY//t.co/LfuXnB1B9g,FALSE,TRUE,NA,CSR
Bas Burger,1169622079546757120,2019-09-05T14:43:28Z,I'm proud to announce that BT is providing @icareNSW with a #cybersecurity solution that protects the agency's insurance and care operations. Find out more about @bt_global's cloud #SIEM solution://t.co/bAjqCcTABz,FALSE,FALSE,NA,cybersecurity
Bas Burger,1169622079546757120,2019-09-05T14:43:28Z,I'm proud to announce that BT is providing @icareNSW with a #cybersecurity solution that protects the agency's insurance and care operations. Find out more about @bt_global's cloud #SIEM solution://t.co/bAjqCcTABz,FALSE,FALSE,NA,SIEM
Bas Burger,1169301457335701507,2019-09-04T17:29:26Z,"Great to meet our teams @bt_global in Leeds, UK today. Excellent energy and drive around improving for our customers at a high pace. I learned a lot! Thanks everyone involved.//t.co/UHoBXB326J",FALSE,FALSE,NA,NA
Bas Burger,1168913534576672768,2019-09-03T15:47:58Z,"Big businesses' failure to adopt disruptive technologies could be costing the UK economy up to 100bn according to @oracle and @CBItweets. This @ITProPortal piece explores the importance of automation, a crucial stepping stone for #digitaltransformation://t.co/KuH4BkiNar",FALSE,FALSE,NA,digitaltransformation
Bas Burger,1166592372634992641,2019-08-28T06:04:30Z,"AI has quickly gone mainstream in tech and non-tech workplaces. A survey from @Genesys shows over the next three years, 6 out of 10 employers foresee having #AI or advanced automation tools in place. Details here on what we can expect://t.co/IlUs0iVA2V @CIOdive",FALSE,FALSE,NA,AI
Bas Burger,1165151031149432832,2019-08-24T06:37:07Z,"Networks are the beating heart of any growth company, as every growth company relies on digital technology. Investment in IT infrastructure has become crucial in today's fast-paced world of tech. @Entrepreneur looks at the complexities://t.co/yZ7DAickJC",FALSE,FALSE,NA,NA
Bas Burger,1164416802811719681,2019-08-22T05:59:34Z,"Clearly new technology isn't just driving efficiencies in business, it's creating new markets within the #tech sector. A new @Frost_Sullivan report shows cyberattacks could increase the IT/OT security services market to $897M by 2022://t.co/bImiFoIt2E via @ET_CIO",FALSE,FALSE,NA,tech
Bas Burger,1163033364070305792,2019-08-18T10:22:16Z,Fascinating Sunday morning reading Definitely something to thing about today to protect your information in the future. #qkd #CyberSecurity @bt_global//t.co/Gjz6cCmMIz,TRUE,FALSE,NA,qkd
Bas Burger,1163033364070305792,2019-08-18T10:22:16Z,Fascinating Sunday morning reading Definitely something to thing about today to protect your information in the future. #qkd #CyberSecurity @bt_global//t.co/Gjz6cCmMIz,TRUE,FALSE,NA,CyberSecurity
Bas Burger,1159426743440199681,2019-08-08T11:30:51Z,"From machine learning and #AI, to IoT projects and more, businesses' new #tech capabilities are creating storage challenges at the edge. Companies need a solution. That's where #computationalstorage comes in.//t.co/bp2JvxALEY @networkworld",FALSE,FALSE,NA,AI
Bas Burger,1159426743440199681,2019-08-08T11:30:51Z,"From machine learning and #AI, to IoT projects and more, businesses' new #tech capabilities are creating storage challenges at the edge. Companies need a solution. That's where #computationalstorage comes in.//t.co/bp2JvxALEY @networkworld",FALSE,FALSE,NA,tech
Bas Burger,1159426743440199681,2019-08-08T11:30:51Z,"From machine learning and #AI, to IoT projects and more, businesses' new #tech capabilities are creating storage challenges at the edge. Companies need a solution. That's where #computationalstorage comes in.//t.co/bp2JvxALEY @networkworld",FALSE,FALSE,NA,computationalstorage
Bas Burger,1156950811445989377,2019-08-01T15:32:23Z,"As our very own brilliant CTIO @BTGlobal, Hriday shares the importance of using technological #innovation for business transformation in this @insightssuccess feature article://t.co/sgHUod9tdL",FALSE,FALSE,NA,innovation
Bas Burger,1156654799275929601,2019-07-31T19:56:08Z,"""#IoT Needs a Business Model and here it is!!"" Interesting piece from @HarvardHBS professor, Rajiv Lal, outlines how it's continuing to grow. @HBSWK://t.co/m9OWCIF5zD",FALSE,FALSE,NA,IoT
Bas Burger,1154697416035196928,2019-07-26T10:18:11Z,@VDP_Pericard @mrjakehumphrey @bt_global @Redknapp Any time Vincent! Just make sure I am on your team,FALSE,FALSE,394385993,NA
Bas Burger,1154403268321304576,2019-07-25T14:49:21Z,Robin van Persie was a goal scoring machine //t.co/TYL5pjwLih,FALSE,TRUE,NA,NA
Bas Burger,1154403174784143360,2019-07-25T14:48:59Z,Excellent to see Robin van Persie join @btsport !//t.co/eNK0sJ0o6f,TRUE,FALSE,NA,NA
Bas Burger,1154073893344358405,2019-07-24T17:00:32Z,"With @Gartner_inc reporting almost 60% of organizations benefit from #artificialintelligence, I'm eager to see how it continues to streamline business functions and reduce workloads. @ZDNet has more on the ways AI is transforming innovation for businesses://t.co/I1DuTZprXT",FALSE,FALSE,NA,artificialintelligence
Bas Burger,1151769326699122693,2019-07-18T08:23:00Z,They move over 1 billion people a day!!I am proud @bt_global has been chosen by @schindlergroup to support its #digitaltransformation journey. Enabling connectivity across global #networks is at the heart of what we do//t.co/yeupV2sK2R,FALSE,FALSE,NA,digitaltransformation
Bas Burger,1151769326699122693,2019-07-18T08:23:00Z,They move over 1 billion people a day!!I am proud @bt_global has been chosen by @schindlergroup to support its #digitaltransformation journey. Enabling connectivity across global #networks is at the heart of what we do//t.co/yeupV2sK2R,FALSE,FALSE,NA,networks
Bas Burger,1151141107419537408,2019-07-16T14:46:41Z,"To reap the best return on experience for investing in #digitaltransformation, businesses have to bring business and technology teams together. @Forbes explores four ways an integrated approach to decision-making can improve business performance://t.co/82f7oVM7bz",FALSE,FALSE,NA,digitaltransformation
Bas Burger,1150811707800993793,2019-07-15T16:57:46Z,I'm very pleased to announce @BT_Global has been named one of the first partners of the new @Azure Networking Managed Services Provider programme! Details here on our continued plans to help customers deploy cloud services without barriers://t.co/jwiV6FJZgw @mg_pecorari,FALSE,FALSE,NA,NA
Bas Burger,1149616172972642305,2019-07-12T09:47:09Z,"When deploying SD-WAN technology, security and network integrity should be top priorities. @BT_Global's very own, @kevinbrown5, outlines ways to customize networks based on location, data transmission & more://t.co/227PkzhHOd @SCMagazine9",FALSE,FALSE,NA,NA
Bas Burger,1148620189250011139,2019-07-09T15:49:28Z,Companies are under pressure to transform into digital businesses but the path isn't always straightforward. @MITSloan offers five building blocks required for successful #digitization to streamline the process://t.co/HQadw7652f,FALSE,FALSE,NA,digitization
Bas Burger,1146788788628271104,2019-07-04T14:32:08Z,"Proudly announcing our brand new BT India Research Centre in Bengaluru in collaboration with @iiscbangalore. Focusing on #AI, mobile and #software engineering, it will help us deliver cutting edge innovation globally://t.co/UPY09a0quw",FALSE,FALSE,NA,AI
Bas Burger,1146788788628271104,2019-07-04T14:32:08Z,"Proudly announcing our brand new BT India Research Centre in Bengaluru in collaboration with @iiscbangalore. Focusing on #AI, mobile and #software engineering, it will help us deliver cutting edge innovation globally://t.co/UPY09a0quw",FALSE,FALSE,NA,software
Bas Burger,1146766759946543104,2019-07-04T13:04:36Z,"Great panel discussion yesterday on #digitaldisruption with Infosys Chairman @NandanNilekani, Andy Maguire from HSBC and BBC's @ChiyoRobertson. @infosys has an amazing new Agile space, it was the perfect venue to discuss the latest trends and innovations affecting our industries.//t.co/yqJ31X8gPe",FALSE,FALSE,NA,digitaldisruption
Bas Burger,1146533293384450048,2019-07-03T21:36:53Z,"#5G offers speed and opportunities to innovate. In a UK first, @BT_Global demonstrated an ultrasound using 5G haptic touch over a live public network to West Midlands Mayor and WMCA chair @Andy4wm. It's a great example of how 5G can transform healthcare://t.co/Q1TWPlMkBJ",FALSE,FALSE,NA,5G
Bas Burger,1144107775917809664,2019-06-27T04:58:44Z,"Businesses succeeding in the digital era are better, faster & stronger than competitors. These companies, including many of @BT_Global's customers, embrace #digitaltransformation by quickly & effectively implementing high-tech solutions. More via @forbes://t.co/G1uW6r7VOt",FALSE,FALSE,NA,digitaltransformation
Bas Burger,1143619641169842176,2019-06-25T20:39:04Z,"When it comes to SD-WAN and other emerging technologies, @BT_Global works as a trusted advisor so our customers can make smart and informed decisions. Our very own Adrian Comley spoke with @sdxcentral about the application and its benefits://t.co/HtuUViCIlS",FALSE,FALSE,NA,NA
Bas Burger,1142813806684495872,2019-06-23T15:16:58Z,@anurag17yadav04 Indeed !!,FALSE,FALSE,2859665292,NA
Bas Burger,1141790529899945984,2019-06-20T19:30:50Z,"Very proud of us @bt_global opening our next SOC, in Paris. Customers will benefit from real-time intelligence sharing across BT's global network of SOCs, coupled with in-country capabilities.//t.co/GSmZoEQl93",FALSE,FALSE,NA,NA
Bas Burger,1141788615091138564,2019-06-20T19:23:13Z,"A rise in #cloud adoption, without an increase in automation, can hinder businesses' success. @NetworkWorld explores how manual processes can hold businesses back and the need for #IT to focus their efforts on automation://t.co/jzdS3296yT",FALSE,FALSE,NA,cloud
Bas Burger,1141788615091138564,2019-06-20T19:23:13Z,"A rise in #cloud adoption, without an increase in automation, can hinder businesses' success. @NetworkWorld explores how manual processes can hold businesses back and the need for #IT to focus their efforts on automation://t.co/jzdS3296yT",FALSE,FALSE,NA,IT
Bas Burger,1141005080860221442,2019-06-18T15:29:44Z,"The top five requirements for creating an #artificialintelligence and data driven company include fostering data-minded employees, something that I've seen firsthand play a central role in businesses' success. See @forbes here://t.co/StYnpKsRJM #AI",FALSE,FALSE,NA,artificialintelligence
Bas Burger,1141005080860221442,2019-06-18T15:29:44Z,"The top five requirements for creating an #artificialintelligence and data driven company include fostering data-minded employees, something that I've seen firsthand play a central role in businesses' success. See @forbes here://t.co/StYnpKsRJM #AI",FALSE,FALSE,NA,AI
Bas Burger,1139590864072839168,2019-06-14T17:50:09Z,I absolutely love curious people in my team! Turns out that organizations that encourage curiosity and allow employees to suggest new ideas are often more innovative. @Forbes outlines six foundational requirements for businesses to truly be innovative://t.co/Zmd1ibSL2x,FALSE,FALSE,NA,NA
Bas Burger,1139275328109645825,2019-06-13T20:56:19Z,"Today's businesses usually have multiple #cloud service providers and therefore, need to have a plan in place to keep tabs on their networks. @NetworkWorld explores. Interesting fast moving space we @bt_global feel right at home!//t.co/voi0F16l5Q",FALSE,FALSE,NA,cloud
Bas Burger,1138532618268545029,2019-06-11T19:45:03Z,"Some things just get better with age. You could say the same about @BT_Global's 30 year partnership with @Cisco. Our experts are at #CLUS19 this week, where they're focused on how multi-cloud environments & #AI are benefitting business. @ChuckRobbins //t.co/0odo2fbffp",FALSE,FALSE,NA,CLUS19
Bas Burger,1138532618268545029,2019-06-11T19:45:03Z,"Some things just get better with age. You could say the same about @BT_Global's 30 year partnership with @Cisco. Our experts are at #CLUS19 this week, where they're focused on how multi-cloud environments & #AI are benefitting business. @ChuckRobbins //t.co/0odo2fbffp",FALSE,FALSE,NA,AI
Bas Burger,1136328601857642498,2019-06-05T17:47:05Z,#DidYouKnow: Diverse workplaces generate 19% more revenue than less inclusive work environments one of the many reasons why @BT_global is committed to promoting equal opportunities in every aspect of our business. More via @entrepreneur://t.co/pjb9FrVwWL,FALSE,FALSE,NA,DidYouKnow
Bas Burger,1135981499650629632,2019-06-04T18:47:49Z,"Well done piece! From promoting new values & practices to giving employees the chance to make an impact, @mitsmr looks at the steps companies can take to successfully embrace digital-ready culture without sacrificing integrity or heritage.//t.co/zGSR1sHB0D",FALSE,FALSE,NA,NA
Bas Burger,1135146546545250305,2019-06-02T11:30:01Z,Our Digital Impact and Sustainability report sets out our new strategy on digital impact and sustainability and the progress we've made this year. Thank you @BT_Global and @BTGroup for all your hard work!//t.co/dJghinn1Vb//t.co/pbZyGg8q6w,TRUE,FALSE,NA,NA
Bas Burger,1134162243233468416,2019-05-30T18:18:45Z,"This, a World of quantum computing, is a good reason for companies to look at Quantum Key Distribution #QKD now. #CyberSecurity @bt_global//t.co/BdOUiqu90R",TRUE,FALSE,NA,QKD
Bas Burger,1134162243233468416,2019-05-30T18:18:45Z,"This, a World of quantum computing, is a good reason for companies to look at Quantum Key Distribution #QKD now. #CyberSecurity @bt_global//t.co/BdOUiqu90R",TRUE,FALSE,NA,CyberSecurity
Bas Burger,1133960099960168449,2019-05-30T04:55:30Z,"Accountable, collaborative and intuitive a few of the traits required of leaders in the rapidly changing workplace of the future. @forbes sheds light on the necessary skills to successfully adapt to new process and environments in the digital age://t.co/MXfX01stku",FALSE,FALSE,NA,NA
Bas Burger,1133460469421936640,2019-05-28T19:50:09Z,"As data becomes more personalized, It is interesting to see how #artificialintelligence impacts our behavior and relationship with technology. @WSJ looks at the evolution of such systems://t.co/nKMCFJ8qOt",FALSE,FALSE,NA,artificialintelligence
Bas Burger,1132921712515977217,2019-05-27T08:09:19Z,I'm inspired by @BT_Global's commitment to fostering diversity & inclusion. @qz examines a concept called emergence the idea that we can't understand an issue by just looking at its individual parts and what it can teach us about diversity://t.co/0wuBwrVn8U,FALSE,FALSE,NA,NA
Bas Burger,1131967564840615937,2019-05-24T16:57:53Z,Congratulations @anurag17yadav04!! Well deserved //t.co/I4pYGkxw9W,TRUE,FALSE,NA,NA
Bas Burger,1131826639220957186,2019-05-24T07:37:53Z,"This week I unveiled our #5G plans, amazing range of 5G devices and the network that will give our customers a faster, more reliable experience. I'm proud to say on May 30, @EE is switching on the UK's first 5G network. Join us on our #5GEE journey //t.co/jN5zhxBhRh",FALSE,TRUE,NA,5G
Bas Burger,1131650379752648711,2019-05-23T19:57:30Z,@KatumbaBloco @bas_burger @bt_global I would love too! It was so much fun to play with you. Thank you for allowing me to try,FALSE,FALSE,3302766466,NA
Bas Burger,1131649404362997764,2019-05-23T19:53:37Z,I would love too! It was so much fun to play with you. Thank you for allowing me to try //t.co/cy6EMtj9bo,TRUE,FALSE,NA,NA
Bas Burger,1131496735736573952,2019-05-23T09:46:58Z,What a team!//t.co/rAGy9xRjn9,TRUE,FALSE,NA,NA
Bas Burger,1131359411212099584,2019-05-23T00:41:17Z,Just had an excellent few days with 1400 of the best global sales people in the World! @bt_global.//t.co/4kaJdJr28D,FALSE,FALSE,NA,NA
Bas Burger,1129656932908883968,2019-05-18T07:56:15Z,"In the digital age, smart business leaders, including our customers at @BT_Global, leverage technology to deliver cutting-edge solutions to clients. @TechRadarPro shares how organizations can get the most out of #digitaltransformation plans://t.co/ofRemcuMpx",FALSE,FALSE,NA,digitaltransformation
Bas Burger,1128600581566881792,2019-05-15T09:58:41Z,Very proud @BTGroup heritage in #cybersecurity with @bletchleypark yesterday with HRH The Duchess of Cambridge//t.co/BFnenjLslK,TRUE,FALSE,NA,cybersecurity
Bas Burger,1128593530027421698,2019-05-15T09:30:40Z,"At @BT_Global, we've seen firsthand how #ArtificialIntelligence can add value and drive innovation in how we manage networks. In our SNAP platform AI will help us manage Global Networks of the future. #sdwan #nfv @Light_Reading//t.co/tNgFgZN9a2",FALSE,FALSE,NA,ArtificialIntelligence
Bas Burger,1128593530027421698,2019-05-15T09:30:40Z,"At @BT_Global, we've seen firsthand how #ArtificialIntelligence can add value and drive innovation in how we manage networks. In our SNAP platform AI will help us manage Global Networks of the future. #sdwan #nfv @Light_Reading//t.co/tNgFgZN9a2",FALSE,FALSE,NA,sdwan
Bas Burger,1128593530027421698,2019-05-15T09:30:40Z,"At @BT_Global, we've seen firsthand how #ArtificialIntelligence can add value and drive innovation in how we manage networks. In our SNAP platform AI will help us manage Global Networks of the future. #sdwan #nfv @Light_Reading//t.co/tNgFgZN9a2",FALSE,FALSE,NA,nfv
Bas Burger,1126966488160714752,2019-05-10T21:45:23Z,"Very proud of @BT_Global and @BTGroup's continued commitment to giving back, and I look forward to seeing how our efforts help shape the leaders of tomorrow. #tech #digitaltransformation//t.co/mKSMJ1oNrX",TRUE,FALSE,NA,tech
Bas Burger,1126966488160714752,2019-05-10T21:45:23Z,"Very proud of @BT_Global and @BTGroup's continued commitment to giving back, and I look forward to seeing how our efforts help shape the leaders of tomorrow. #tech #digitaltransformation//t.co/mKSMJ1oNrX",TRUE,FALSE,NA,digitaltransformation
Bas Burger,1126484594797285376,2019-05-09T13:50:31Z,It was great to hear from Philip during our full year results and what he's learned so far. I am very proud of the role @bt_global plays for some of the largest companies around the World. Exiting times ahead!//t.co/xrI71Auhg1,TRUE,FALSE,NA,NA
Bas Burger,1123915019668922370,2019-05-02T11:39:56Z,"Delighted to be teaming up with @Cloudreach to offer customers best-in-class hybrid, pure-cloud and networking expertise to enable digital transformation.//t.co/dkry6SdhwB",FALSE,FALSE,NA,NA
Bas Burger,1123247220197941259,2019-04-30T15:26:20Z,Research shows that the #skills gap is going to increase over the next three years for #UK #tech companies. It is time we focus on up-skilling existing workers and training the next generation! //t.co/QHQPRXnSZN,FALSE,FALSE,NA,skills
Bas Burger,1123247220197941259,2019-04-30T15:26:20Z,Research shows that the #skills gap is going to increase over the next three years for #UK #tech companies. It is time we focus on up-skilling existing workers and training the next generation! //t.co/QHQPRXnSZN,FALSE,FALSE,NA,UK
Bas Burger,1123247220197941259,2019-04-30T15:26:20Z,Research shows that the #skills gap is going to increase over the next three years for #UK #tech companies. It is time we focus on up-skilling existing workers and training the next generation! //t.co/QHQPRXnSZN,FALSE,FALSE,NA,tech
Bas Burger,1121084158577729536,2019-04-24T16:11:06Z,Great presentation! @kevinwbrown5 @bt_global//t.co/Qjv2gg1eOn,TRUE,FALSE,NA,NA
Bas Burger,1118270292864978947,2019-04-16T21:49:48Z,@Ch_Revv @AFCAjax Definitely!!,FALSE,FALSE,43507374,NA
Bas Burger,1118260447617126400,2019-04-16T21:10:41Z,"So proud of @AFCAjax. What a game, what a team!!//t.co/GPRDrwn6SC",TRUE,FALSE,NA,NA
Bas Burger,1117079869375090689,2019-04-13T14:59:29Z,"Wonderful week with our teams in China. Impressive talent, helping our customers grow and innovate at the speed needed in this region. @bt_global//t.co/aU8Liv0jYC",FALSE,FALSE,NA,NA
Bas Burger,1116386679164678145,2019-04-11T17:05:00Z,Really proud we are strengthening and extending our relationship with #NATO @NCIAgency with a new network support services contract. @bt_global is well placed to support NATO in an increasingly digital world.//t.co/OxZNLZdghL,FALSE,FALSE,NA,NATO
Bas Burger,1115166600829624320,2019-04-08T08:16:51Z,Decent weekend in #HongKong watching the @OfficialHK7s... brilliant spectacle! Also an honour to visit Hong Kong FC & The Rainbow Foundation to train the next generation. Thanks as always to @BTGroup for your hospitality! #BTAsia #BTHongKong #HongKong7s//t.co/tlkGslR2aP,FALSE,TRUE,NA,HongKong
Bas Burger,1114892298465075200,2019-04-07T14:06:52Z,A huge Thank You to Lawrence @dallaglio8 and Rio @rioferdy5 for spending time with the Kids of the Rainbow Foundation here in Hong Kong this weekend @OfficialHK7s @btsport @bt_global What a class act! The kids had a fantastic practice.//t.co/pO9IZ38X5K,FALSE,FALSE,NA,NA
Bas Burger,1113319067518230529,2019-04-03T05:55:24Z,Watch our #video to find out how we identify what #technology will help you achieve your business outcomes://t.co/99NzEvuqFj//t.co/nY4x2lnm4k,FALSE,TRUE,NA,video
Bas Burger,1113319067518230529,2019-04-03T05:55:24Z,Watch our #video to find out how we identify what #technology will help you achieve your business outcomes://t.co/99NzEvuqFj//t.co/nY4x2lnm4k,FALSE,TRUE,NA,technology
Bas Burger,1110658210900443136,2019-03-26T21:42:07Z,Excelent day in Dubai. Celebrating our 10 year partnership with @emirates. What an impressive company. Laser focus on customer experience which sets them apart. Very proud to be able to contribute via this partnership. @bt_global//t.co/lOgjwyLWDI,FALSE,FALSE,NA,NA
Bas Burger,1109139805483487232,2019-03-22T17:08:31Z,"Super proud of our @BTGroup team hosting the @GSMA #Tech4Girls workshop at our New York Customer Experience Centre today, aimed at reducing the gender gap in the tech industry. Looks like a great day, well done team!//t.co/iyXccFV7Zl",FALSE,FALSE,NA,Tech4Girls
Bas Burger,1108842276699193344,2019-03-21T21:26:14Z,Pleased to see Amazon announce that Prime Video has contracted @BTSport with our strategic football partner Sunset+Vine to support Amazon Prime Video's production of both studio and live action match-day Premier League coverage,FALSE,TRUE,NA,NA
Bas Burger,1108735701292666880,2019-03-21T14:22:45Z,Great day in very sunny Frankfurt today meeting our talented people @bt_global and of course our global customers. Some moving on from London:). Proud to be their partner in the #digitaltransformation journey!//t.co/WRwlpEdMhj,FALSE,FALSE,NA,digitaltransformation
