name,status_id,created_at,text,is_quote,is_retweet,reply_to_user_id,hashtags
Cori Lathan,979538104829722624,2018-03-30T01:57:37Z,This hockey player breastfeeds her baby during game breaks -- like a total mom boss//t.co/bBRuDim6v3//t.co/9GcSvlzSzX,FALSE,TRUE,NA,NA
Cori Lathan,978781651550564353,2018-03-27T23:51:45Z,"Supported by the @UPS_Foundation, @NBCDI's Read to Succeed program promotes early literacy among Black children & families by providing culturally responsive, developmentally appropriate titles to establish at-home libraries throughout our Affiliate communities nationwide.//t.co/CL1ymorVjt",FALSE,TRUE,NA,NA
Cori Lathan,977969943156314112,2018-03-25T18:06:18Z,"Dear young people, never get tired of being instruments of peace and joy among your peers!",FALSE,TRUE,NA,NA
Cori Lathan,977701750714064896,2018-03-25T00:20:36Z,Thank you so much for coming out today. Stay educated. Our entire policy piece is on our website -//t.co/2m7ItdxgIv//t.co/LsoBgp8hP5,FALSE,TRUE,NA,NA
Cori Lathan,977668260580806656,2018-03-24T22:07:32Z,Black students don't misbehave at rates higher than other students but are often faced with 0 tolerance policies resulting in suspensions & expulsions at rates unseen by other student groups. @BetsyDeVosED & @realDonaldTrump should be protecting these students #RethinkDiscipline//t.co/5g1ldYMeb3,FALSE,TRUE,NA,NA
Cori Lathan,976284418204577792,2018-03-21T02:28:38Z,"Find a March for Our Lives event near you, and register to join TODAY! #MarchForOurLives //t.co/Hvctr1jEZk",FALSE,FALSE,NA,MarchForOurLives
Cori Lathan,976248771104395264,2018-03-21T00:06:59Z,The Workplace Is Killing People and Nobody Cares//t.co/wZcgXWTgqL via @stanfordgsb,FALSE,FALSE,NA,NA
Cori Lathan,974968490024153089,2018-03-17T11:19:36Z,Tell @FedEx to #DropTheNRA at//t.co/Q7hXL5hre0!,FALSE,FALSE,NA,DropTheNRA
Cori Lathan,974734735216971776,2018-03-16T19:50:45Z,"On March 24, #iWillMarch for those whose lives have been affected by gun violence across our country. March with me and RSVP here://t.co/QvXAheCSqi #MarchForOurLives",FALSE,FALSE,NA,iWillMarch
Cori Lathan,974734735216971776,2018-03-16T19:50:45Z,"On March 24, #iWillMarch for those whose lives have been affected by gun violence across our country. March with me and RSVP here://t.co/QvXAheCSqi #MarchForOurLives",FALSE,FALSE,NA,MarchForOurLives
Cori Lathan,974351098365476866,2018-03-15T18:26:19Z,Quadrant Biosciences Token Offering: Tokenized Equity in an Innovative Biosciences Startup//t.co/EkLRIrtQjp via @smithandcrown,FALSE,FALSE,NA,NA
Cori Lathan,974311510460772357,2018-03-15T15:49:00Z,Proud that @AnthroTronix is a partner w/ Quadrant Biosciences - HOF Players Foundation and @QuadBioInc Partner to Address Former Football Players' Health Concerns - //t.co/oQkH116F8L,FALSE,FALSE,NA,NA
Cori Lathan,974284895668318208,2018-03-15T14:03:15Z,RIP Dr. Stephen Hawking who inspired so many in #STEM. A giant who spent every second of his incredible life to further our understanding of the most important questions of the Universe. Where do we come from and where are we going?//t.co/aVEitv7HLM,FALSE,TRUE,NA,STEM
Cori Lathan,974073689200357378,2018-03-15T00:03:59Z,Stephen Hawking has died - PI day will now become a day to honor him as well as STEM//t.co/h5NEMCClF4 via @qz,FALSE,FALSE,NA,NA
Cori Lathan,973715536059224065,2018-03-14T00:20:49Z,Brain Awareness Week is a perfect time to share how #Alzheimers has touched your life. What motivates you to #stopalz?//t.co/7q3toQEBHU #brainweek,FALSE,TRUE,NA,Alzheimers
Cori Lathan,973715536059224065,2018-03-14T00:20:49Z,Brain Awareness Week is a perfect time to share how #Alzheimers has touched your life. What motivates you to #stopalz?//t.co/7q3toQEBHU #brainweek,FALSE,TRUE,NA,stopalz
Cori Lathan,973715514248843264,2018-03-14T00:20:44Z,Check out this #brainweek quiz from @UsAgainstAlz it's a fun new way to put your #Alzheimers knowledge to the test.//t.co/dLTpAx9xRs,FALSE,TRUE,NA,brainweek
Cori Lathan,973715514248843264,2018-03-14T00:20:44Z,Check out this #brainweek quiz from @UsAgainstAlz it's a fun new way to put your #Alzheimers knowledge to the test.//t.co/dLTpAx9xRs,FALSE,TRUE,NA,Alzheimers
Cori Lathan,972931539104301058,2018-03-11T20:25:29Z,"Find a March for Our Lives event near you, and register to join TODAY! #MarchForOurLives //t.co/Hvctr1BgnU",FALSE,FALSE,NA,MarchForOurLives
Cori Lathan,972531148969709568,2018-03-10T17:54:29Z,The world's most successful women share their best career advice//t.co/lRAABexJZs #leadership//t.co/FckEAEXOuf,FALSE,TRUE,NA,leadership
Cori Lathan,972530873458454528,2018-03-10T17:53:23Z,15 Remarkable Women We Overlooked in Our Obituaries//t.co/vMOtF6dcL2,FALSE,FALSE,NA,NA
Cori Lathan,972108650515980288,2018-03-09T13:55:37Z,This is one of my favorite quotes. Today and every day. #InternationalWomensDay//t.co/LZ6WZyI4PZ,FALSE,TRUE,NA,InternationalWomensDay
Cori Lathan,970698200427442176,2018-03-05T16:31:00Z,Solve announces next global challenges//t.co/FvGcju5MYO,FALSE,TRUE,NA,NA
Cori Lathan,969541135432605696,2018-03-02T11:53:14Z,Sign up and spread the word! Every name matters. #MarchForOurLives//t.co/j2PTXghy2j//t.co/CiFXKVY1Sz,FALSE,TRUE,NA,MarchForOurLives
Cori Lathan,969313528346763264,2018-03-01T20:48:48Z,"90% of people who engage in self harm begin during their teen or pre-adolescent years. This Self-Injury Awareness Day, let's share resources and provide support to educate and raise awareness. #ThursdayThoughts//t.co/3PR4Gl08uH",FALSE,TRUE,NA,NA
Cori Lathan,969074449394884610,2018-03-01T04:58:47Z,Listen now to ATinc CEO Cori Lathan - The Future of Human Enhancement//t.co/PYgEtUz08k,FALSE,TRUE,NA,NA
Cori Lathan,968982559857238016,2018-02-28T22:53:39Z,@USASFcheer Thx for all your support of my daughter! Gave you a shout out in a recent blog//t.co/TNkaaOTbX2,FALSE,FALSE,24576643,NA
Cori Lathan,968926310675484673,2018-02-28T19:10:08Z,@ACLU Would love to have you retweet! Gave you all a shout out! The for all you do- //t.co/PQBiTuhA05,FALSE,FALSE,13393052,NA
Cori Lathan,968926164130689024,2018-02-28T19:09:33Z,@HRC Would love to have you retweet! Gave you all a shout out! Thx for all you do- //t.co/PQBiTuhA05,FALSE,FALSE,19608297,NA
Cori Lathan,968925781941456896,2018-02-28T19:08:02Z,@SarahEMcBride You've been such an inspiration to our family -can't wait to read your book! Thought I'd share a little of our family's story://t.co/PQBiTuhA05,FALSE,FALSE,272191896,NA
Cori Lathan,968615711441551372,2018-02-27T22:35:56Z,Thank you @BernardJTyson for your leadership both at @KPShare and as a role model for others.//t.co/eVc178sCX9,TRUE,FALSE,NA,NA
Cori Lathan,966376557555126273,2018-02-21T18:18:20Z,@Gender_Cool Just wanted to say great NYTimes article and thanks for all you do! I have a Gender Cool kid and here's part of our story: //t.co/UlcLQLlewq,FALSE,FALSE,830183300845146113,NA
Cori Lathan,966363328674238464,2018-02-21T17:25:46Z,Thank you @YoYo_Ma for leading the discussions @wef (and beyond!) around our need for culture to survive and thrive. You are an inspiration in so many ways!//t.co/aZudXL9CHP,TRUE,FALSE,NA,NA
Cori Lathan,966297577389002754,2018-02-21T13:04:30Z,These Transgender Children Say They're Thriving. They Want to Help Others Do the Same.//t.co/4vVinGJ6ct,FALSE,FALSE,NA,NA
Cori Lathan,966137262835675139,2018-02-21T02:27:28Z,Honored to be part of the NeuronFire podcast!//t.co/BbSY1Q3yIL,TRUE,FALSE,NA,NA
Cori Lathan,965389850110300163,2018-02-19T00:57:30Z,On March 24 we will take the streets of Washington DC and our communities across the country to #MarchForOurLives. Sign up at//t.co/2m7ItdfFjV//t.co/yokyEdj7Jq,FALSE,TRUE,NA,MarchForOurLives
Cori Lathan,965224476181921792,2018-02-18T14:00:22Z,Its vital that we uplift our children and celebrate our rich culture daily...that includes instilling pride in natural beauty. RT@ Anchor invites her 4-year-old 'mini me' on show to celebrate natural hair//t.co/xyNZeAbuet via @blackvoices,FALSE,TRUE,NA,NA
Cori Lathan,965041070924091392,2018-02-18T01:51:35Z,@TransEquality just wanted to make sure you saw the shout out in my blog//t.co/UlcLQLlewq,FALSE,FALSE,37005435,NA
Cori Lathan,965040656111595520,2018-02-18T01:49:56Z,@HRC just wanted to make sure you saw the shout out in my blog post//t.co/UlcLQLlewq,FALSE,FALSE,19608297,NA
Cori Lathan,965039680344510465,2018-02-18T01:46:04Z,We thank the more than 700 parents of #transgender children who signed our @HRC Parents for Transgender Equality National Council letter to @BetsyDeVosED condemning her failure to protect trans students.//t.co/ZeUWf85x8Q,FALSE,TRUE,NA,transgender
Cori Lathan,964891801915219968,2018-02-17T15:58:27Z,Women Surround Crying Mom Whose Toddler Was Having A Meltdown At The Airport//t.co/yZGDg9N5ts,FALSE,FALSE,NA,NA
Cori Lathan,964883626457518080,2018-02-17T15:25:57Z,.@BernardJTyson - Thank you and @KPShare for your support of LGBTQ families!//t.co/UlcLQLlewq,FALSE,FALSE,NA,NA
Cori Lathan,964842878647357440,2018-02-17T12:44:02Z,It's time to bring our planet back from the brink//t.co/IAbFLgHJCL #wef18//t.co/9ZYzorW4Bk,FALSE,TRUE,NA,wef18
Cori Lathan,964724957895905280,2018-02-17T04:55:28Z,How Parkland Students Are Setting and Keeping the Record Straight//t.co/nJzpvkFciP,FALSE,FALSE,NA,NA
Cori Lathan,964723796128206854,2018-02-17T04:50:51Z,"The brave Parkland students are doing something astonishing. They are instantly preempting disinfo & gaslighting by posting testimony, evidence, photos. And they have rallied to specifically to oppose the NRA. This is courageous grieving; they are warriors fighting for all of us.",FALSE,TRUE,NA,NA
Cori Lathan,964686791163904003,2018-02-17T02:23:48Z,@KPShare Thanks for your support of our LGBT kids! //t.co/UsRtmIaSWo,FALSE,FALSE,17372405,NA
Cori Lathan,964608800014643200,2018-02-16T21:13:54Z,"A mom of a transgender daughter has been part of the World Economic Forum in Davos for years, but her best moment happened this year at the GLAAD and Ariadne Getty Foundation panel on LGBTQ acceptance://t.co/IdGsHveipK",FALSE,TRUE,NA,NA
Cori Lathan,964604202541637634,2018-02-16T20:55:38Z,@TheGigiGorgeous Thx Gigi - my daughter can't wait to meet you in person!,FALSE,FALSE,24058779,NA
Cori Lathan,964603988573413376,2018-02-16T20:54:47Z,.@TheGigiGorgeous Thx for your words of inspiration to my daughter! Blog of our Davos mtg went live today! //t.co/J2tD4vgi7G,FALSE,FALSE,NA,NA
Cori Lathan,964523686807162881,2018-02-16T15:35:41Z,Honored to share our story: What Davos taught me about supporting my transgender child//t.co/PQBiTuhA05 via @wef @yglvoices #LGBT,FALSE,FALSE,NA,LGBT
Cori Lathan,964523401363775489,2018-02-16T15:34:33Z,"Thank you @GLAAD @HRC @TransEquality for paving the way for #LGBT families like ours. Still a long way to go, but we are in this together! @YGLvoices #davos2018//t.co/xtSsjt3gIV",TRUE,FALSE,NA,LGBT
Cori Lathan,964523401363775489,2018-02-16T15:34:33Z,"Thank you @GLAAD @HRC @TransEquality for paving the way for #LGBT families like ours. Still a long way to go, but we are in this together! @YGLvoices #davos2018//t.co/xtSsjt3gIV",TRUE,FALSE,NA,davos2018
Cori Lathan,963938070197428224,2018-02-15T00:48:39Z,New and great book by Steven Pinker reminds us that Technology is not destroying our Minds (but there's always more Enlightened ways to harness it)//t.co/Jj2F9VxOiP,FALSE,TRUE,NA,NA
Cori Lathan,963531224068313088,2018-02-13T21:52:00Z,Sandy Hook Mom Makes Video That Every Parent Needs To See//t.co/rfeBZSqTIa,FALSE,FALSE,NA,NA
Cori Lathan,963158507246837771,2018-02-12T21:10:57Z,The 10 Grand Challenges Facing Robotics in the Next Decade//t.co/7DdoKSA31R via @singularityhub,FALSE,FALSE,NA,NA
Cori Lathan,962526489609719808,2018-02-11T03:19:32Z,Too bad the supreme court won't get to back the Oxford Comma! - Maine Dairy Company Settles Lawsuit Over Oxford Comma -//t.co/rnHvsDLa7I,FALSE,FALSE,NA,NA
Cori Lathan,962084025874702342,2018-02-09T22:01:21Z,"Tara Thiagarajan, Founder of Brainnovations Winner Sapien Labs, on building a global platform for brain research that truly captures the diversity of humanity//t.co/kefBbFnP2a",FALSE,TRUE,NA,NA
Cori Lathan,961654302925377536,2018-02-08T17:33:47Z,"Go @NancyLublin! - //t.co/7mD99o5exX, a Crisis Text Line spin-out, raises $2 million to help companies have hard//t.co/AFGa5Jzw8C via @techcrunch",FALSE,FALSE,NA,NA
Cori Lathan,961391531205840898,2018-02-08T00:09:37Z,It's time to pay a living wage in Maryland #FightFor15. Sign the petition://t.co/XuKBJ6SKdY,FALSE,FALSE,NA,FightFor15
Cori Lathan,960196651498508288,2018-02-04T17:01:35Z,"Lego is selling a 'Women of NASA' set featuring 4 female scientists, engineers, and astronauts//t.co/q71E6wBIT0 via @wef",FALSE,FALSE,NA,NA
Cori Lathan,960175333948448769,2018-02-04T15:36:53Z,There's a can in cancer because you can beat it... #WorldCancerDay//t.co/yYkovHxgNf,FALSE,TRUE,NA,WorldCancerDay
Cori Lathan,960172874173644801,2018-02-04T15:27:07Z,@TheGigiGorgeous hoping you got the text w Eliza's thank you for your note - being your authentic self is everything!,FALSE,FALSE,24058779,NA
Cori Lathan,960005511499386880,2018-02-04T04:22:04Z,Finding a cure for #Alzheimers is not the only challenge on the road to #stopalz. We must ensure that #Alz care is accessible in rural and low-income communities.,FALSE,TRUE,NA,Alzheimers
Cori Lathan,960005511499386880,2018-02-04T04:22:04Z,Finding a cure for #Alzheimers is not the only challenge on the road to #stopalz. We must ensure that #Alz care is accessible in rural and low-income communities.,FALSE,TRUE,NA,stopalz
Cori Lathan,960005511499386880,2018-02-04T04:22:04Z,Finding a cure for #Alzheimers is not the only challenge on the road to #stopalz. We must ensure that #Alz care is accessible in rural and low-income communities.,FALSE,TRUE,NA,Alz
Cori Lathan,960003343560200192,2018-02-04T04:13:27Z,"""We need to be authentic and genuine with our work with parents and caregivers, working together as partners and realizing we are a part of this community."" Dr. Dina Devose, Contributor of @NBCDI's ""Being Black Is Not A Risk Factor: Georgia"" Publication//t.co/LFimNXIkPg",FALSE,TRUE,NA,NA
Cori Lathan,959517510243565568,2018-02-02T20:02:56Z,Announcing Yes VC//t.co/4TVTlKEYaa via @caterina,FALSE,FALSE,NA,NA
Cori Lathan,959445106053890049,2018-02-02T15:15:13Z,8 ways Davos inspired social change this year//t.co/krRQ9isOWb via @wef,FALSE,FALSE,NA,NA
Cori Lathan,959396121788502016,2018-02-02T12:00:34Z,"These 9 cities should be disqualified from Amazon's HQ2 selection, LGBT groups say//t.co/ltfKPR4GM5 via @lgbtqnation",FALSE,FALSE,NA,NA
Cori Lathan,959395206029291520,2018-02-02T11:56:56Z,What to Say When You Meet the Angel of Death at a Party//t.co/W7LeBZru7n,FALSE,FALSE,NA,NA
Cori Lathan,959149756936159232,2018-02-01T19:41:36Z,Thx @VarkeyFdn for a great event! Honored to have participated. #YGLVoices @AnthroTronix//t.co/QefrN6dHfJ,TRUE,FALSE,NA,YGLVoices
Cori Lathan,959095898029608960,2018-02-01T16:07:35Z,"A great post by @yoyo_ma - In a fractured world, we need culture to survive and thrive//t.co/oTyEUFMHib via @wef",FALSE,FALSE,NA,NA
Cori Lathan,958744095610032129,2018-01-31T16:49:39Z,"Recy Taylor, whose 1944 rape inspired black women's resistance, dead at 97//t.co/tk0uhH8M4Q via @blackvoices",FALSE,FALSE,NA,NA
Cori Lathan,958743825547177985,2018-01-31T16:48:35Z,Lawmakers wear black to Trump's State of the Union address//t.co/WsLAQMvWO1 via @HuffPostPol,FALSE,FALSE,NA,NA
Cori Lathan,958740578136707072,2018-01-31T16:35:41Z,"Unacceptable! @GLAAD report released at Davos: In three years, LGBT Americans have gone from triumph to backlash//t.co/4TyUTarY33",FALSE,FALSE,NA,NA
Cori Lathan,956841980121796608,2018-01-26T10:51:19Z,"At Davos, President Trump ended up being upstaged by another elderly Manhattan billionaire: George Soros.//t.co/E9yW6j35ky",FALSE,TRUE,NA,NA
Cori Lathan,956679926580641792,2018-01-26T00:07:23Z,Amazing work by wonderful friend and artist @DrueKataoka #davosmirror//t.co/BtRs5Rv6Db,FALSE,FALSE,NA,davosmirror
Cori Lathan,955814460706508800,2018-01-23T14:48:20Z,"Live now: What if the DNA of all life on Earth was entered into a database we could mine for new medicines, fuels and other breakthroughs?//t.co/JlOdqBjGNV #DNAlessons @clathan//t.co/ON5kb2bYqh",FALSE,TRUE,NA,NA
Cori Lathan,955076592845418496,2018-01-21T13:56:18Z,"""Wait, My Snow Boots Are at Coat Check"": The REAL Survival Guide to Davos//t.co/HT5WHrgpFj # via @HuffPostBiz #yglvoices",FALSE,FALSE,NA,yglvoices
Cori Lathan,954889735620587520,2018-01-21T01:33:48Z,"A year ago, they marched. Now a record number of women are running for office//t.co/3AIPpqwTy3",FALSE,FALSE,NA,NA
Cori Lathan,954887409723781120,2018-01-21T01:24:34Z,Best sign of the day. (ht @lawrence)//t.co/aZuhitycr8,FALSE,TRUE,NA,NA
Cori Lathan,954817425370906624,2018-01-20T20:46:28Z,"How America Has Changed During Trump's First Year In Office, By The Numbers - NPR//t.co/eAVi5ZbGnY",FALSE,FALSE,NA,NA
Cori Lathan,954804989221920778,2018-01-20T19:57:03Z,A few good reasons for behavioral science to be part of everyday organizational decision-making.//t.co/En8ZTKueED,FALSE,TRUE,NA,NA
Cori Lathan,954724014051745792,2018-01-20T14:35:17Z,"Human touch can be a powerful healer, and social connection is important for mental and physical wellbeing. Spending time with your loved ones can help them know they are not alone.//t.co/KTPtsfmIe2",FALSE,TRUE,NA,NA
Cori Lathan,954378801722601475,2018-01-19T15:43:32Z,"Full survey results on attitudes toward Human Enhancement (vision, joint mobility, cognitive, gene editing): U.S. Public Opinion and Interest on Human Enhancements Technology //t.co/mZBqaoUJ0j",FALSE,FALSE,NA,NA
Cori Lathan,954350036615356417,2018-01-19T13:49:14Z,Our article on Human Enhancement is live! Thx @aarp and @policydeb for supporting this nationwide survey://t.co/VN6W3knqPd @weforum #GFC #YGLVoices,FALSE,FALSE,NA,GFC
Cori Lathan,954350036615356417,2018-01-19T13:49:14Z,Our article on Human Enhancement is live! Thx @aarp and @policydeb for supporting this nationwide survey://t.co/VN6W3knqPd @weforum #GFC #YGLVoices,FALSE,FALSE,NA,YGLVoices
Cori Lathan,953839926369546240,2018-01-18T04:02:14Z,Gallup 1st Year Approval Rating Kennedy 76% Eisenhower 69% W Bush 68% HW Bush 66% Carter 62% Nixon 61% Obama 57% Reagan 57% Clinton 49% Trump 39% Trump's approval rating in 1st year is 18 points lower than Obama's and the worst in modern American history. #WorstPresidentEver,FALSE,TRUE,NA,NA
Cori Lathan,953384131311931400,2018-01-16T21:51:04Z,Jeff Bezos donates $33 million to scholarship fund for 'dreamers'//t.co/GmvptKpLpJ,FALSE,FALSE,NA,NA
Cori Lathan,953312897706483712,2018-01-16T17:08:01Z,New research finds that kids aged 4-6 perform better during boring tasks when dressed as Batman//t.co/iPDccf6nNS via @wef,FALSE,FALSE,NA,NA
Cori Lathan,953312560647983104,2018-01-16T17:06:40Z,"Give me your tired, your poor, Your huddled masses yearning to breathe free. I'll install Linux on their laptops. #opensource",FALSE,TRUE,NA,NA
Cori Lathan,953013766576377858,2018-01-15T21:19:22Z,"Darkness cannot drive out darkness; only light can do that. Hate cannot drive out hate; only love can do that. - Martin Luther King, Jr.",FALSE,TRUE,NA,NA
Cori Lathan,952983130172018693,2018-01-15T19:17:38Z,"As you honor my father today, please remember and honor my mother, as well. She was the architect of the King Legacy and founder of @TheKingCenter, which she founded two months after Daddy died. Without #CorettaScottKing, there would be no #MLKDay. #MLK50Forward #MLK//t.co/qhwSnX9Qmh",FALSE,TRUE,NA,NA
Cori Lathan,952389561845510144,2018-01-14T03:59:00Z,"14. Happy Korean-American Day and MLK weekend. As Dr. King said, ""Darkness cannot drive out darkness; only light can do that. Hate cannot drive out hate; only love can do that."" -end-",FALSE,TRUE,NA,NA
Cori Lathan,952026163907612673,2018-01-13T03:54:59Z,"I really feel that some people neglect and overlook compassion because they associate it with religion. Of course, everyone is free to choose whether they pay religion any regard, but to neglect compassion is a mistake because it is the source of our own well-being.",FALSE,TRUE,NA,NA
Cori Lathan,951907925185921024,2018-01-12T20:05:09Z,"Two weeks ago a 26-year old soldier raced repeatedly into a burning Bronx apartment building, saving four people before he died in the flames. His name was Pvt. Emmanuel Mensah and he immigrated from Ghana, a country Donald Trump apparently thinks produces very subpar immigrants.",FALSE,TRUE,NA,NA
Cori Lathan,951896084498051072,2018-01-12T19:18:06Z,There is nothing wrong with you! - Improving Ourselves to Death//t.co/ZnK5LtKyqH,FALSE,FALSE,NA,NA
Cori Lathan,951671932923121664,2018-01-12T04:27:24Z,"Shirley Ann Jackson - A cool-headed leader in social justice, nuclear policy, and academia - via @techreview//t.co/lRWk0hqgkQ",FALSE,FALSE,NA,NA
Cori Lathan,951661569334792194,2018-01-12T03:46:13Z,The 8 Greatest Ideas Of CES 2018//t.co/FtysMEuabe,FALSE,FALSE,NA,NA
Cori Lathan,951538518253293568,2018-01-11T19:37:16Z,"Not only is our brain not static, we can grow new neurons every day if we do the right things.//t.co/6dCI279FKd",FALSE,TRUE,NA,NA
Cori Lathan,951538396446576641,2018-01-11T19:36:47Z,CHIP provides health care coverage to 9 million low- and middle-income children across the U.S. The strength of any nation is predicted by the health of its youngest citizens. Call your legislators at (877) 233-9025 and tell them to #SaveCHIP. Our country's future depends on it.//t.co/VhO8atd7os,FALSE,TRUE,NA,NA
Cori Lathan,951509706014646272,2018-01-11T17:42:46Z,"It is time we demand the brands we support, also support us. Tell H&M to hire Black Executives #breakceilingsbreaksilence //t.co/q3SZUPEr1R via @ColorOfChange",FALSE,FALSE,NA,breakceilingsbreaksilence
Cori Lathan,950724738279792640,2018-01-09T13:43:35Z,Scientists find that diabetes drug significantly reversed memory loss in mice with #Alzheimers.//t.co/pXI2hyddTz,FALSE,TRUE,NA,Alzheimers
Cori Lathan,950724073251835904,2018-01-09T13:40:57Z,.@American_Girl Luci is ready for Mars!//t.co/2sqyhSpHmM,FALSE,TRUE,NA,NA
Cori Lathan,950524956068270080,2018-01-09T00:29:44Z,"Today we remember our colleagues, neighbors, and friends who lost their lives and those whose lives were forever changed. Every day I fight in their honor to prevent another community from having to endure a senseless gun violence tragedy.//t.co/beitmmVq5N",FALSE,TRUE,NA,NA
Cori Lathan,950069578108948481,2018-01-07T18:20:13Z,"Incredible article by @Lisadubusc //t.co/LLYskSYthM on The Women In Innovation #WIN @LLSusa #STEM @cheryleinhorn @Arjaneenkema L. Kleinhans, G, Nichols @cabotventures #womenintech #leadership",FALSE,TRUE,NA,WIN
Cori Lathan,950069578108948481,2018-01-07T18:20:13Z,"Incredible article by @Lisadubusc //t.co/LLYskSYthM on The Women In Innovation #WIN @LLSusa #STEM @cheryleinhorn @Arjaneenkema L. Kleinhans, G, Nichols @cabotventures #womenintech #leadership",FALSE,TRUE,NA,STEM
Cori Lathan,949470966824034305,2018-01-06T02:41:33Z,thx @oullier for a great article! #BrainTech//t.co/FNK8O0duDo,TRUE,FALSE,NA,BrainTech
Cori Lathan,949026360051359747,2018-01-04T21:14:50Z,"Thx @think_moco for all you for Montgomery County, MD - Proud to live and work here and be one of the #MoCo365//t.co/xPkGEPWkPe",TRUE,FALSE,NA,MoCo365
Cori Lathan,948768187440680960,2018-01-04T04:08:57Z,Great opportunity for high school students!//t.co/KcsseVOmp9,TRUE,FALSE,NA,NA
Cori Lathan,948746715103932416,2018-01-04T02:43:38Z,Trump uses social media as a weapon to control the news cycle. It works like a charm. His tweets are tactical rather than substantive. They mostly fall into one of these four categories.//t.co/XaK8tCpRy6,FALSE,TRUE,NA,NA
Cori Lathan,948746516818284544,2018-01-04T02:42:51Z,"Right now, ""our government is pale, male and stale,"" write @DewSteele & @SwaneeHunt. However, things are about to change dramatically. #EmergeNow #WhySheRuns//www.cnn. com/2018/01/02/opinions/women- representation-opinion-hu",FALSE,TRUE,NA,NA
Cori Lathan,948746200257351680,2018-01-04T02:41:35Z,Yesterday's #supermoon above the Great Dome. The Moon's color was from the soon-to-rise Sun. Photo: @DanZDill//t.co/meuPsPKa5I,FALSE,TRUE,NA,supermoon
Cori Lathan,948386718717267968,2018-01-03T02:53:08Z,"All across America people chose to get involved, get engaged and stand up. Each of us can make a difference, and all of us ought to try. So go keep changing the world in 2018.",FALSE,TRUE,NA,NA
Cori Lathan,948386497073438720,2018-01-03T02:52:15Z,Thx @hippypastorwife for being such a great role model for parenting #transkids!//t.co/F6FpWZNym5,TRUE,FALSE,NA,transkids
Cori Lathan,948386022940868608,2018-01-03T02:50:22Z,20 female founded startups that grew like crazy in 2017 @entrylevelrebel//t.co/4JwpS7A3BD via @Inc,FALSE,FALSE,NA,NA
Cori Lathan,947555701328560129,2017-12-31T19:50:58Z,"My name keeps showing up in end-of-year lists, so here's my response: Trans people are just as good at public service in schools, the military, hospitals, fire/police/EMS stations, foster care & every branch of government as everyone else when we're supported. Let us do our jobs.",FALSE,TRUE,NA,NA
Cori Lathan,945323393842405376,2017-12-25T16:00:35Z,"Somewhere in America, there's a parent passed by for a raise, promotion or job who's desperately figuring out how to bring their kids Christmas joy when money & dignity are so tight. Your honesty & presence is the greatest gift. Just being there matters so much. Hang in there.",FALSE,TRUE,NA,NA
Cori Lathan,941951960458186752,2017-12-16T08:43:42Z,How to Actually Thank Black Women for Defeating Roy Moore//t.co/rKU8NAHJeb via @thecut,FALSE,FALSE,NA,NA
Cori Lathan,941666813473157121,2017-12-15T13:50:38Z,Every kid a #Maker @KIDMuseumMD!//t.co/LbhwO47uXP,TRUE,FALSE,NA,Maker
Cori Lathan,941042295490695174,2017-12-13T20:29:01Z,There is no #BlackLivesMatter without Net Neutrality - Join me in supporting ColorOfChange via @actblue//t.co/gYDVuJRxll,FALSE,FALSE,NA,BlackLivesMatter
