name,status_id,created_at,text,is_quote,is_retweet,reply_to_user_id,hashtags
Cori Lathan,1181570448162787332,2019-10-08T14:02:02Z,"Clergy and faith leaders have gathered at SCOTUS in support of LGBTQ rights and are singing: This little light of mine, I'm gonna let it shine; this little light of mine, I'm gonna let it shine; let it shine, let it shine, let it shine #RiseUpOct8//t.co/sW0Nb2OIGL",FALSE,TRUE,NA,NA
Cori Lathan,1180962485819469824,2019-10-06T21:46:12Z,"BRAVA Team @Pharrell - Winners of the 2019 #Visioneering Championship Award for the idea of building Charter Communities! ""This represents a new direction for @xprize."" - @PeterDiamandis Excited to be here with a community of innovators! @emilyclarkwhite//t.co/0HfWW9m4LF",FALSE,TRUE,NA,Visioneering
Cori Lathan,1180941067601858562,2019-10-06T20:21:05Z,You know you are at @xprize #visioneering when @Pharrell is part of the team - go charter communities XPRIZE//t.co/jFatnOUlkD,FALSE,TRUE,NA,visioneering
Cori Lathan,1178833159632367617,2019-10-01T00:45:01Z,Amazing documentary by @JehaneNoujaim highlighting the need to protect data rights as civil rights.//t.co/ul4NXX9sjh,TRUE,FALSE,NA,NA
Cori Lathan,1178831759896666112,2019-10-01T00:39:27Z,Mark Kelly is rejecting corporate PAC money in his campaign for Senate. Chip in today.//t.co/yc13NJkZnl,FALSE,FALSE,NA,NA
Cori Lathan,1175234658860244992,2019-09-21T02:25:52Z,.@glaad not a single candidate uttered the word nonbinary tonight. Big disappointment amongst an historic night #LGBTQForum,FALSE,FALSE,NA,LGBTQForum
Cori Lathan,1175231155878146048,2019-09-21T02:11:56Z,Had NO idea!!! This FDA rule is NOT in line w science. #LGBTQForum//t.co/fyLN7rkO0q,TRUE,FALSE,NA,LGBTQForum
Cori Lathan,1175230605237391360,2019-09-21T02:09:45Z,Yes! And Mayor Pete got first standing O of the night just by showing up. #LGBTQforum//t.co/iBSrQnWbha,TRUE,FALSE,NA,LGBTQforum
Cori Lathan,1175229772131180544,2019-09-21T02:06:27Z,One of the most powerful moments of the night. Trans women of color deserve to be named. #LGBTQForum//t.co/FS1W6IoFFm,TRUE,FALSE,NA,LGBTQForum
Cori Lathan,1175212840514392066,2019-09-21T00:59:10Z,Watching @CoryBooker preach! And articulate the fear that our LGBT+ youth feel every day. YES- we need a woke president!//t.co/wjB2Nq8q3G,TRUE,FALSE,NA,NA
Cori Lathan,1175200878657245189,2019-09-21T00:11:38Z,Watching now!//t.co/QCK7dF72WH,TRUE,FALSE,NA,NA
Cori Lathan,1174765899133440000,2019-09-19T19:23:11Z,Honored to be recognized as inspiring the next generation of innovators by @SigmaXiSociety @aaas and Lyda Hill Philanthropies.//t.co/C8NUDFEd5E,TRUE,FALSE,NA,NA
Cori Lathan,1174765027716476928,2019-09-19T19:19:43Z,Danah Boyd (@zephoria) speaking truth re: MIT Media Lab and more @EFF awards - Facing the Great Reckoning Head-On//t.co/ADDuwjJi6V,FALSE,FALSE,NA,NA
Cori Lathan,1174410514446901253,2019-09-18T19:51:00Z,Don't listen to me. Listen to the science. #UniteBehindTheScience//t.co/QTUYnn0hJ8,FALSE,TRUE,NA,UniteBehindTheScience
Cori Lathan,1174410230790115328,2019-09-18T19:49:53Z,The nonbinary pronoun 'they' has been added to the dictionary. //t.co/tadl1VdfB0,FALSE,TRUE,NA,NA
Cori Lathan,1172956287652564992,2019-09-14T19:32:26Z,Come join me tomorrow in downtown Silver Spring for FutureFest!//t.co/4LS0KexbBl,TRUE,FALSE,NA,NA
Cori Lathan,1171968157654888450,2019-09-12T02:05:57Z,"Who knew there were so many ways to be an engineer? These 17 #WomenINSTEM are our @aaas @IfThenSheCan Ambassadors, working in the engineering field! #IfThenSheCan//t.co/B2ULaFsuyy",FALSE,TRUE,NA,WomenINSTEM
Cori Lathan,1171182711127576576,2019-09-09T22:04:52Z,Kids Can Build a Modern City From Scratch at This Festival in Silver Spring//t.co/1ALhrfWYOU,FALSE,FALSE,NA,NA
Cori Lathan,1171152493734191105,2019-09-09T20:04:48Z,Meet the 125 AAAS IF/THEN Ambassadors://t.co/QhQIfQ8Lsx! IF/THEN will support the Ambassadors to tell the world their #STEM journeys and how they are using STEM to solve problems and create new possibilities for the future. #ifthenshecan @MeetAScientist #WomenInSTEM//t.co/JS5OXGmqzp,FALSE,TRUE,NA,NA
Cori Lathan,1171151869902761995,2019-09-09T20:02:19Z,Honored to be named a AAAS IF/THEN Ambassador! Thank you @AAAS and Lyda Hill Philanthropies for your support of STEM! #WomenInStem #IfThenSheCan @IfThenSheCan//t.co/r6vPzCwKiL,TRUE,FALSE,NA,WomenInStem
Cori Lathan,1171151869902761995,2019-09-09T20:02:19Z,Honored to be named a AAAS IF/THEN Ambassador! Thank you @AAAS and Lyda Hill Philanthropies for your support of STEM! #WomenInStem #IfThenSheCan @IfThenSheCan//t.co/r6vPzCwKiL,TRUE,FALSE,NA,IfThenSheCan
Cori Lathan,1169692729560973312,2019-09-05T19:24:13Z,"We know that too many #LGBTQ people die by suicide every year, but because of gaps in the data collection process, we don't actually know how many, and that lack of information limits our ability to prevent future suicides our head of advocacy @sbrinton//t.co/qciLOCk0Cb",FALSE,TRUE,NA,LGBTQ
Cori Lathan,1168863363037900802,2019-09-03T12:28:36Z,Shame on you @Walmart for not doing the right thing. #walmartmustact//t.co/KGFtovbFPP,TRUE,FALSE,NA,walmartmustact
Cori Lathan,1168862507588608002,2019-09-03T12:25:12Z,Thank you @dicks for all you do for our kids including helping to keep them safe!//t.co/MvsJ4f6hyD,TRUE,FALSE,NA,NA
Cori Lathan,1168531591238496256,2019-09-02T14:30:16Z,"In order to change the narrative around #harmreduction, it must be humanized, evidence-based, & include the authentic voice of those in the community. Read @ChaunceyGardners latest post on how we aim to further promote meaningful harm reduction efforts://t.co/SRdgDxq6xu",FALSE,TRUE,NA,harmreduction
Cori Lathan,1168388505963286528,2019-09-02T05:01:42Z,"What's your perspective on technology, work and society? University of Maryland researchers want to know! Please share your views and help compile data for a research project on the future of work. //t.co/XwZpOFd0DL",FALSE,FALSE,NA,NA
Cori Lathan,1166136646468874241,2019-08-26T23:53:36Z,Yes!//t.co/hTUiE5Yw3W,TRUE,FALSE,NA,NA
Cori Lathan,1166134901558730754,2019-08-26T23:46:40Z,Mother and Daughter Pilots for Delta Go Viral After Photo of Them Flying Together Posted Online//t.co/8tyRyOldSY via @epochtimes #WomeninAviation,FALSE,TRUE,NA,NA
Cori Lathan,1166134846202290176,2019-08-26T23:46:27Z,Beautiful and smart! And the artist @DrueKataoka is pretty awesome as well!//t.co/S66DCub0w0,TRUE,FALSE,NA,NA
Cori Lathan,1166113708893978624,2019-08-26T22:22:28Z,"Things to see and do in the area this Septemberfeaturing FutureFest! Don't miss it, Sunday, Sept 15 in @DTSilverSpring. #KIDFutureFest @Bethesda_Mag//t.co/QXT2h3nMXd",FALSE,TRUE,NA,NA
Cori Lathan,1166113633459462145,2019-08-26T22:22:10Z,OMG love @conor_mckenziee//t.co/6cHqtsyMX9,FALSE,FALSE,NA,NA
Cori Lathan,1166109637403217920,2019-08-26T22:06:17Z,Tell Congress: Support the CHANGE Act to fund early & better cognitive screening.//t.co/C5DaJlmYQL,FALSE,FALSE,NA,NA
Cori Lathan,1166069162936020993,2019-08-26T19:25:27Z,Happy #InternationalDogDay! //t.co/H1bnNwL7hV,FALSE,FALSE,NA,InternationalDogDay
Cori Lathan,1165652296904167426,2019-08-25T15:48:59Z,"Love this take on the ""Imposter Syndrome""! Let's call it self-aware and confident! - Jessica Williams Doesn't Have Impostor Syndrome. Do You?//t.co/8M2pnHnmP9",FALSE,FALSE,NA,NA
Cori Lathan,1165601458483585025,2019-08-25T12:26:58Z,Gender bias shows up in students' evaluations of their professors. Can we fix that? - The Washington Post//t.co/Mtr1qlGstm,FALSE,FALSE,NA,NA
Cori Lathan,1165597372463878144,2019-08-25T12:10:44Z,PRESS RELEASE: Nature journal publishes a comment on sex and gender differences in the brain written by the Women's Brain Project//t.co/czZ0vnwKj5,FALSE,TRUE,NA,NA
Cori Lathan,1165597317522690048,2019-08-25T12:10:30Z,Why the Machine Age Still Needs Humans://t.co/JAJjAkH05T via @wef//t.co/po3XOfvM70,FALSE,TRUE,NA,NA
Cori Lathan,1165597059698876416,2019-08-25T12:09:29Z,Thousands of indigenous women in Brazil are protesting the president and the destruction of the Amazon. This badass picture stood out. #AmazonFires//t.co/bXA6lQ3rZm,FALSE,TRUE,NA,NA
Cori Lathan,1165596977889009664,2019-08-25T12:09:09Z,Great list! Still working my way through them.//t.co/thdMPYcay3,TRUE,FALSE,NA,NA
Cori Lathan,1165420910779797504,2019-08-25T00:29:32Z,Supreme Court Justice Ruth Bader Ginsburg recent speech at the Washington Women's Leadership Initiative offered important lessons on collegiality and work-life balance. Susan Paley shares key takeaways for the boardroom here://t.co/6Eo548i8Xo//t.co/6Eo548i8Xo,FALSE,TRUE,NA,NA
Cori Lathan,1165372258182991877,2019-08-24T21:16:12Z,"""One act of kindness can change someone's life, can change the world. That's all it takes."" //t.co/fo9C9yOB3w #KAKEnews",FALSE,TRUE,NA,NA
Cori Lathan,1164927711694983170,2019-08-23T15:49:44Z,"Captain Who Rescued Migrants At Sea Refuses Paris Medal, Calling It Hypocritical//t.co/kk7X5MJQOG",FALSE,FALSE,NA,NA
Cori Lathan,1163567474975158273,2019-08-19T21:44:38Z,We were here and it was one for the ages! - Yo-Yo Ma and James Taylor at Tanglewood//t.co/udGM2GdlAD via @YouTube,FALSE,FALSE,NA,NA
Cori Lathan,1163479452568948736,2019-08-19T15:54:52Z,Self-driving' vehicles may need human help for a while yet//t.co/qJBOJGVepx via @BostonGlobe,FALSE,FALSE,NA,NA
Cori Lathan,1163431796769509378,2019-08-19T12:45:30Z,The best way to find the truth is to stick to the facts. #unitebehindthescience #aracewemustwin #teammalizia #ClimateChange @GretaThunberg//t.co/e065pjDmb0,FALSE,TRUE,NA,unitebehindthescience
Cori Lathan,1163431796769509378,2019-08-19T12:45:30Z,The best way to find the truth is to stick to the facts. #unitebehindthescience #aracewemustwin #teammalizia #ClimateChange @GretaThunberg//t.co/e065pjDmb0,FALSE,TRUE,NA,aracewemustwin
Cori Lathan,1163431796769509378,2019-08-19T12:45:30Z,The best way to find the truth is to stick to the facts. #unitebehindthescience #aracewemustwin #teammalizia #ClimateChange @GretaThunberg//t.co/e065pjDmb0,FALSE,TRUE,NA,teammalizia
Cori Lathan,1163431640569434112,2019-08-19T12:44:53Z,"On Monday, UN negotiations towards a #GlobalOceanTreaty will take place in New York. Protecting our oceans is more urgent than ever. Read why. //t.co/s4SkwNp8nE #ProtectTheOceans",FALSE,TRUE,NA,GlobalOceanTreaty
Cori Lathan,1163431594511781888,2019-08-19T12:44:42Z,"Sunday: getting ready for a nice Sunday meal. Last night we still did 24 knots surfing under the bright moon. Team sleeping well & tuning into this special lifestyle of rollercoaster camping. Teeth brushing, squats & music playing and chat all day with Pierre. @GretaThunberg//t.co/LlD5TrMZYC",FALSE,TRUE,NA,NA
Cori Lathan,1163429788259880960,2019-08-19T12:37:31Z,"This World Humanitarian Day, join me in celebrating the #WomenHumanitarians around the world who are inspirations to us all://t.co/4zbYwMWIL7 @UN//t.co/o1p5H5UpdE",FALSE,TRUE,NA,WomenHumanitarians
Cori Lathan,1163179924531961863,2019-08-18T20:04:39Z,.@smithsonian we hope to inspire a better future//t.co/SfUYBBSfSw,FALSE,TRUE,NA,NA
Cori Lathan,1158745525992267778,2019-08-06T14:23:56Z,"Great advice from the best neurologists I've interacted with, Team Sherzai and Dr. Rudy Tanzi!//t.co/wNsFUyOD23 @TeamSherzai @RudyTanzi",FALSE,TRUE,NA,NA
Cori Lathan,1158417480295026691,2019-08-05T16:40:24Z,"TAKE ACTION: The House of Representatives passed a bill to require background checks on all gun sales. Now, the Senate must act. In honor of El Paso, text CHECKS to 644-33 to be connected with your Senators and tell them to act on background checks. #walmartshooting//t.co/NqdQhVB2da",FALSE,TRUE,NA,NA
Cori Lathan,1158146735291674624,2019-08-04T22:44:33Z,I have no more words. I only have anger. President Donald Trump and Leader Mitch McConnell must call the Senate back from August recess immediately. We cannot afford to wait another day for lawmakers to address this horrific national public safety threat. #daytonshooting//t.co/IX5WS39CFk,FALSE,TRUE,NA,NA
Cori Lathan,1154404255815610370,2019-07-25T14:53:17Z,"Bach's music makes things whole. Being a scientist composer, he used what he knew about human nature. He then made listeners fill in the gaps. That's why to me, people feel like they're being helped when listening. Watch how #CultureConnectsUs://t.co/eIK5sSBGtz",FALSE,TRUE,NA,NA
Cori Lathan,1153702416912736256,2019-07-23T16:24:25Z,"""Up to 80% of the most common carriers of the disease are immune to the most common treatments, researchers find""//t.co/ZAfouGlnr4",FALSE,TRUE,NA,NA
Cori Lathan,1153147542282088448,2019-07-22T03:39:33Z,"A joyful celebration of a giant leap that brought so many to the National Mall, and for a brief moment recreated the wonder and awe of humanity's highest achievement. Thanks to the team @airandspace and to @BoeingSpace @Boeing and @Raytheon who made it possible.//t.co/fQK2UpkQc2",FALSE,TRUE,NA,NA
Cori Lathan,1152201915784208386,2019-07-19T13:01:58Z,"Our #Apollo50 Festival on the National Mall kicks off today through Saturday. More information on the tented displays, and the stage schedule are now available on our website://t.co/plDDjRm0VB Sponsored by @Boeing with additional support from @Raytheon.//t.co/DxNS07euB0",FALSE,TRUE,NA,Apollo50
Cori Lathan,1150251875792384001,2019-07-14T03:53:12Z,"My dad used to tell me: Son, you drink from deep wells you didn't digyou eat from banquet tables you didn't set. Forever grateful for leaders like @repjohnlewis who made #goodtrouble so that our country can move closer to our ideals of liberty and justice for ALL Americans.//t.co/hMqr5XXIIw",FALSE,TRUE,NA,NA
Cori Lathan,1150251456068501504,2019-07-14T03:51:32Z,WOOHOO! House approves amendment to reverse transgender military ban//t.co/koif8XD8Oh,FALSE,TRUE,NA,NA
Cori Lathan,1149391548909572096,2019-07-11T18:54:34Z,The Dominance of the White Male Critic//t.co/cFtwd84QrH,FALSE,FALSE,NA,NA
Cori Lathan,1148076647612125190,2019-07-08T03:49:37Z,This team wins. Everyone wins. Victory is when we all win. It's only crazy until you do it. #justdoit @USWNT//t.co/pBU7UE2IEs,FALSE,TRUE,NA,justdoit
Cori Lathan,1147668098155048960,2019-07-07T00:46:11Z,#IStandWithRavelry//t.co/sQ9lzGK1Ee,TRUE,FALSE,NA,IStandWithRavelry
Cori Lathan,1147362249587085312,2019-07-06T04:30:51Z,These 4 harmless' habits are sapping your brain power//t.co/DwQH18xHbL,FALSE,FALSE,NA,NA
Cori Lathan,1146599668647751680,2019-07-04T02:00:38Z,Duke #Biomedical Engineers Develop Low-cost OCT scanner that promises to save eyesight//t.co/DEQmVmBAYC @DukeEngineering,FALSE,TRUE,NA,Biomedical
Cori Lathan,1146540942452674560,2019-07-03T22:07:17Z,Women Who Tech Launches Health #Innovation Challenge//t.co/s7HVSzIErW #WomenInSTEM,FALSE,TRUE,NA,Innovation
Cori Lathan,1146540942452674560,2019-07-03T22:07:17Z,Women Who Tech Launches Health #Innovation Challenge//t.co/s7HVSzIErW #WomenInSTEM,FALSE,TRUE,NA,WomenInSTEM
Cori Lathan,1146540329991958528,2019-07-03T22:04:51Z,"Themes at the powerful @WomenDeliver #WD2019 included #NCDs, #harmreduction, and improving global health supply chains for women and girls. See highlights from @a_solowoman, our Senior Research Analyst for Ethics and Human Rights.//t.co/GQEvs2iOz1",FALSE,TRUE,NA,WD2019
Cori Lathan,1146540329991958528,2019-07-03T22:04:51Z,"Themes at the powerful @WomenDeliver #WD2019 included #NCDs, #harmreduction, and improving global health supply chains for women and girls. See highlights from @a_solowoman, our Senior Research Analyst for Ethics and Human Rights.//t.co/GQEvs2iOz1",FALSE,TRUE,NA,NCDs
Cori Lathan,1146540329991958528,2019-07-03T22:04:51Z,"Themes at the powerful @WomenDeliver #WD2019 included #NCDs, #harmreduction, and improving global health supply chains for women and girls. See highlights from @a_solowoman, our Senior Research Analyst for Ethics and Human Rights.//t.co/GQEvs2iOz1",FALSE,TRUE,NA,harmreduction
Cori Lathan,1146453774388494336,2019-07-03T16:20:54Z,Why leaders should think like scientists and act like entrepreneurs//t.co/N4ZSxm4ptP via @wef,FALSE,TRUE,NA,NA
Cori Lathan,1146452215244005376,2019-07-03T16:14:42Z,Loved Andrew Maynard's book Films from the Future - working my way through the movies mentioned that I hadn't seen! @2020science//t.co/LTbuGqe6zg,TRUE,FALSE,NA,NA
Cori Lathan,1146448554266726400,2019-07-03T16:00:09Z,"Expect social robots to become more sophisticated and prevalent in the next few years. This is one of our Top 10 Emerging Technologies of 2019, produced in partnership with @wef.//t.co/OmFb1YGYjS",FALSE,TRUE,NA,NA
Cori Lathan,1146448095460225024,2019-07-03T15:58:20Z,Thrilled to have contributed to 2 of this year's top 10 emerging technologies! - Collaborative Telepresence and Social Robots @YGLvoices//t.co/UJrjW45CJj,TRUE,FALSE,NA,NA
Cori Lathan,1146446711579004928,2019-07-03T15:52:50Z,Bach at the Acropolis of Athens - encore with Polyphonic Ensemble of Epirus. @austinmann//t.co/hT9ZqLUFxO,FALSE,TRUE,NA,NA
Cori Lathan,1146418997874679808,2019-07-03T14:02:43Z,Mindset Matters: A Call To Action For Marketing Professionals To Expand The Disability Marketplace via @forbes//t.co/nTWwDL8DqF,FALSE,TRUE,NA,NA
Cori Lathan,1146418686342811648,2019-07-03T14:01:28Z,"A study by City of Hope in Duarte, CA discovered that individuals who have a family history of Alzheimer's may show signs of cognitive decline as early as their 20s. A healthy lifestyle is the key to prolonged brain health. #braingoals//t.co/YWaETNblcJ",FALSE,TRUE,NA,NA
Cori Lathan,1146407296559222784,2019-07-03T13:16:13Z,"More than 200 companies tell Supreme Court to apply job discrimination laws to sexual orientation, gender identity//t.co/5zztgsuwQq via @usatoday",FALSE,TRUE,NA,NA
Cori Lathan,1146222050861862913,2019-07-03T01:00:07Z,"Our Community KIDs bridged the generational divide last week, learned about early-stage memory loss, and ""addressed the need for respect and socialization.""//t.co/Bdq6Buek1x//t.co/TiM8q4XZAn",FALSE,TRUE,NA,NA
Cori Lathan,1145032818529046533,2019-06-29T18:14:32Z,"Honored to contribute to this article by @WEF @YGLvoices - ""These activists are making Pride Month last the whole year round"" #Pride2019//t.co/ycjpj2qU5t",TRUE,FALSE,NA,Pride2019
Cori Lathan,1144349335502692353,2019-06-27T20:58:37Z,"Thank you @questCNN for having me on to discuss #Pride, @taylorswift13, and @glaad's new Accelerating Acceptance data.//t.co/Q7CHkvOaew",FALSE,TRUE,NA,Pride
Cori Lathan,1143857910331650050,2019-06-26T12:25:52Z,"On June 26, 2015, marriage equality became the law of the land in the United States. #Pride//t.co/EjfF5hXWt4",FALSE,TRUE,NA,Pride
Cori Lathan,1142097326821052416,2019-06-21T15:49:56Z,"#SAIC heats up the Lawndale Forge for Palas por Pistoles with Pedro Reyes: shovels from firearms confiscated in Chicago, used to plant trees//t.co/karKYTMCtc",FALSE,TRUE,NA,SAIC
Cori Lathan,1140934153011118080,2019-06-18T10:47:54Z,"As our executive director heads off to the @NationOfMakers to be a part of the national #maker movement, check out this article she wrote for @BuzzFeed on how summer can be a great time for #makerlearning://t.co/MBthnUap6X",FALSE,TRUE,NA,maker
Cori Lathan,1140933933875564544,2019-06-18T10:47:02Z,Congrats @KIDMuseumMD Well-deserved!//t.co/3zQgYsM4fl,TRUE,FALSE,NA,NA
Cori Lathan,1138567101411713025,2019-06-11T22:02:05Z,"""The future is much better than you think. We're headed towards a world where each and every one of is empowered to save the world"" - @PeterHDiamandis #DigitalTransformation #LiveWorx//t.co/1yMss3dBv2",FALSE,TRUE,NA,NA
Cori Lathan,1138461614720606209,2019-06-11T15:02:55Z,Happy #PrideMonth! #DCPride parade was amazing @CapitalPrideDC #Pride2019//t.co/dMql6cR5pS,FALSE,FALSE,NA,PrideMonth
Cori Lathan,1138461614720606209,2019-06-11T15:02:55Z,Happy #PrideMonth! #DCPride parade was amazing @CapitalPrideDC #Pride2019//t.co/dMql6cR5pS,FALSE,FALSE,NA,DCPride
Cori Lathan,1138461614720606209,2019-06-11T15:02:55Z,Happy #PrideMonth! #DCPride parade was amazing @CapitalPrideDC #Pride2019//t.co/dMql6cR5pS,FALSE,FALSE,NA,Pride2019
Cori Lathan,1138441983175925763,2019-06-11T13:44:54Z,.@PTC digital / physical transformation toolbox - CEO @JimHeppelmann knocks it out of the park! #Liveworx//t.co/T3xwIJDLvw,FALSE,FALSE,NA,Liveworx
Cori Lathan,1138435534718722049,2019-06-11T13:19:17Z,CEO @ROKAutomation w/ CEO @PTC - great leadership! great partnership! #liveworx//t.co/0r7dxlJsXq,FALSE,FALSE,NA,liveworx
Cori Lathan,1138433676352643073,2019-06-11T13:11:54Z,.@PTC newest transformative product - Vuforia expert capture - world's first enterprise augmented reality suite - #liveworx//t.co/KkYpJiMj8B,FALSE,FALSE,NA,liveworx
Cori Lathan,1138430968291909633,2019-06-11T13:01:08Z,"When we marry digital with machine which is what #IoT is all about we get vastly more productive machines thanks to the ability of the digital world to monitor, control, and optimize the world of physical machines"" - @JimHeppelmann #DigitalTransformation #LiveWorx//t.co/hFjIXTyV2Z",FALSE,TRUE,NA,IoT
Cori Lathan,1138426032489455619,2019-06-11T12:41:31Z,The digital thread connects the value chain and is core to @ptc's vision @JimHeppelmann #liveworx,FALSE,FALSE,NA,liveworx
Cori Lathan,1138424153671909376,2019-06-11T12:34:03Z,Increasing our potential energy w @JimHeppelmann #liveworx//t.co/bvHWJ3Mqyj,FALSE,FALSE,NA,liveworx
Cori Lathan,1138423695553097730,2019-06-11T12:32:14Z,Opening ceremony selfie @liveworx @ptc w/@marioarmstrong #liveworx//t.co/QEjKy7gL2U,FALSE,FALSE,NA,liveworx
Cori Lathan,1135525561269444608,2019-06-03T12:36:05Z,"(It does work - just differently!) - Your brain works in space. But when President Kennedy said we'd go to the Moon, we didn't know that//t.co/SuB4mYeibA",FALSE,FALSE,NA,NA
Cori Lathan,1135176807903354880,2019-06-02T13:30:16Z,Shame on @Nike!! - Allyson Felix: My Own Nike Pregnancy Story//t.co/Zup4JdFNMz,FALSE,FALSE,NA,NA
Cori Lathan,1134895791720583169,2019-06-01T18:53:36Z,Happy #PrideMonth!//t.co/rIHyVhEuNV,FALSE,TRUE,NA,PrideMonth
Cori Lathan,1134370133680545792,2019-05-31T08:04:50Z,Yes! Way to go @Lyft - Lyft provides inclusive pronoun options for riders & drivers//t.co/IFdMwt47ea,FALSE,FALSE,NA,NA
Cori Lathan,1133832936988528642,2019-05-29T20:30:12Z,"This new @Gillette ad shows a transitioning trans man learning to shave for the first time with his father, and the internet can't get enough //t.co/L2UroRG65Z",FALSE,TRUE,NA,NA
Cori Lathan,1133732756607918080,2019-05-29T13:52:07Z,Very exciting applications of #AI coming to fruition through the IBM Watson @XPrize - this is how innovation happens! #AIforGood//t.co/Kalr1GmPOr,TRUE,FALSE,NA,AI
Cori Lathan,1133732756607918080,2019-05-29T13:52:07Z,Very exciting applications of #AI coming to fruition through the IBM Watson @XPrize - this is how innovation happens! #AIforGood//t.co/Kalr1GmPOr,TRUE,FALSE,NA,AIforGood
Cori Lathan,1133728936880422913,2019-05-29T13:36:56Z,MD's law goes in effect Oct. 1! - Which Box Do You Check? Some States Are Offering a Nonbinary Option//t.co/CYD6U2BkdV,FALSE,FALSE,NA,NA
Cori Lathan,1133726592813940742,2019-05-29T13:27:38Z,#AI can be a multiplier of discriminatory practices when algorithms are made by biased coders. How can we make #AI more inclusive? #AIforGood #GenderEquality @ITU @UN//t.co/oYEsv3GuuF,FALSE,TRUE,NA,AI
Cori Lathan,1133726592813940742,2019-05-29T13:27:38Z,#AI can be a multiplier of discriminatory practices when algorithms are made by biased coders. How can we make #AI more inclusive? #AIforGood #GenderEquality @ITU @UN//t.co/oYEsv3GuuF,FALSE,TRUE,NA,AI
Cori Lathan,1133726433954680833,2019-05-29T13:27:00Z,#AIforgood//t.co/ZOIb7JGYbB,FALSE,TRUE,NA,AIforgood
Cori Lathan,1133723312138412032,2019-05-29T13:14:35Z,Great overview of #AIforGood examples.//t.co/C5JSPY63U8,TRUE,FALSE,NA,AIforGood
Cori Lathan,1133689268554088448,2019-05-29T10:59:19Z,"Virtual reality therapy may improve the lives of people with Alzheimer's. Researchers found that exposing patients to virtual reality helped them recall old memories, reduced aggression & improved their interactions with caregivers.//t.co/XlxisbZtQB",FALSE,TRUE,NA,NA
Cori Lathan,1133152485311418368,2019-05-27T23:26:20Z,"We are getting even closer to our 15,000 comment goal - we are only a few thousand supporters away! Join the movement://t.co/w7BMxjIn3v//t.co/KUHG8frvOt",FALSE,TRUE,NA,NA
Cori Lathan,1133135708372242432,2019-05-27T22:19:40Z,As a proud board member of @SmokeFreeFdn I can't understand why Global Health won't talk to big tobacco when change can happen - Great article on the complexities and potential new face of as least 1 tobacco corporation//t.co/oxGexSVmx3,FALSE,FALSE,NA,NA
Cori Lathan,1133129464961994758,2019-05-27T21:54:51Z,"As I return from the YGL Greenland Expedition, I share my article that went live on the @wef front page today about 5 ways to engage in #climateaction . #greenland19 #ygl #ygl4climate @YGLvoices @threesquaresinc #2202020//t.co/kbwKGdmFbG",FALSE,TRUE,NA,NA
Cori Lathan,1132513271263531008,2019-05-26T05:06:19Z,"""This nation should commit itself to achieving the goal, before this decade is out, of landing a man on the Moon and returning him safely to the Earth."" President John F. Kennedy spoke before a joint session of Congress on this day in 1961.//t.co/2TuwegF6XC #Apollo50//t.co/Yj7PuRnzD0",FALSE,TRUE,NA,NA
Cori Lathan,1132512519149408258,2019-05-26T05:03:20Z,Yup. //t.co/9Z3csZFXum,FALSE,FALSE,NA,NA
Cori Lathan,1132380734721806338,2019-05-25T20:19:40Z,What happens in Greenland is key to all of our futures. Click here to read more. #greenland19 @YGLvoices #ygl4climate//t.co/pDTwBugNb2,FALSE,TRUE,NA,greenland19
Cori Lathan,1132380734721806338,2019-05-25T20:19:40Z,What happens in Greenland is key to all of our futures. Click here to read more. #greenland19 @YGLvoices #ygl4climate//t.co/pDTwBugNb2,FALSE,TRUE,NA,ygl4climate
Cori Lathan,1132378409600978946,2019-05-25T20:10:26Z,I believe we get some of the best results when we mix our tech & education with storytelling. BGC Alumna Kai Morton (@AKaiMorton) #SVFWIT19//t.co/oF1WsHHaTa,FALSE,TRUE,NA,NA
Cori Lathan,1131540104009441280,2019-05-23T12:39:18Z,Amazing @DrueKataoka!//t.co/Riv2ckjK6P,TRUE,FALSE,NA,NA
