name,status_id,created_at,text,is_quote,is_retweet,reply_to_user_id,hashtags
Greg Mulholland 🧪,1181452217775083520,2019-10-08T06:12:13Z,"@jmdagdelen With that said, I agree he is deserving of the chemistry prize this year",FALSE,FALSE,14214459,NA
Greg Mulholland 🧪,1181451809770000384,2019-10-08T06:10:36Z,@jmdagdelen Tomorrow is physics I think,FALSE,FALSE,894317329684676608,NA
Greg Mulholland 🧪,1181445857159204864,2019-10-08T05:46:57Z,"Actually, the ""Future of Work"" is just replying ""sorry for the delay"" back and forth over email with someone until one of you leaves your respective company.",FALSE,TRUE,NA,NA
Greg Mulholland 🧪,1181297157887758337,2019-10-07T19:56:04Z,"@SapanaV I think they are cocktails, not just scotch. I hear you totally, but I think this is not targeted at you. I *do* think this could open up new markets.",FALSE,FALSE,18300195,NA
Greg Mulholland 🧪,1181232059395670017,2019-10-07T15:37:23Z,"And the later stage you get the worse this is. Lots of people just fishing, or worse trying to gather competitive intel//t.co/YUTSbfI3eV",FALSE,FALSE,NA,NA
Greg Mulholland 🧪,1180546864216559616,2019-10-05T18:14:40Z,"@SapanaV It seems like a savvy way to avoid open container laws, which will break open a whole new, if temporary, market",FALSE,FALSE,18300195,NA
Greg Mulholland 🧪,1180122432377507840,2019-10-04T14:08:08Z,"@tagoma_tech It's really hard to automate domain expertise of data, which is a large part of feature engineering (IMO). Knowing how your data is generated, its quirks, and what pieces make sense for any given project isn't something that machines will be capable of for a long time (if ever).",FALSE,TRUE,NA,NA
Greg Mulholland 🧪,1179958651450097664,2019-10-04T03:17:19Z,bcc was a terrible invention and you should never use it. send the email and then forward instead,FALSE,TRUE,NA,NA
Greg Mulholland 🧪,1179506994950164480,2019-10-02T21:22:36Z,"""AI is not about replacing the human with a robot. It is about taking the robot out of the human."" @usamaf (as interviewed w/ @StorybyData at//t.co/cNVLwhAaUY &lt; @IADSSglobal) #AI #ArtificialIntelligence #ML #DataScience #Automation #Augmentation #FoW #DX #BigData #4IR//t.co/Etmy8k2s0R",FALSE,TRUE,NA,NA
Greg Mulholland 🧪,1179501174531252224,2019-10-02T20:59:28Z,"incredibly well adjusted family office continues to have incredibly realistic views on poverty, work, and the job market.//t.co/KVXIdqT6en",FALSE,TRUE,NA,NA
Greg Mulholland 🧪,1179215943957921793,2019-10-02T02:06:04Z,"I am not going to lie, this makes me a little nervous about Facebook's trustworthiness going into this election.",FALSE,TRUE,NA,NA
Greg Mulholland 🧪,1178886253518970880,2019-10-01T04:16:00Z,Also materials and chemistry. Expertise is critical//t.co/aDh0wIiLTE,TRUE,FALSE,NA,NA
Greg Mulholland 🧪,1178401260141023232,2019-09-29T20:08:48Z,"Cool article on new, custom materials in watchmaking. Materials innovation is defining every industry. Harry Winston Project Z13: Material Intent via @watchville//t.co/oKSTHNC3DF",FALSE,FALSE,NA,NA
Greg Mulholland 🧪,1177401595719348224,2019-09-27T01:56:30Z,If I owe you an email pls know I am experiencing constant and crippling guilt over it and I'm sorry,FALSE,TRUE,NA,NA
Greg Mulholland 🧪,1177102188641828864,2019-09-26T06:06:45Z,"There are many parts of my job that I love, but visiting Japan is absolutely one of them. A very quick trip this time but great food, rich culture, and amazing people add up to a wonderful 24 hours",FALSE,FALSE,NA,NA
Greg Mulholland 🧪,1176544025274286080,2019-09-24T17:08:49Z,This would be hilariously similar to an episode of Veep if it weren't so real//t.co/av24JcZEJ9,TRUE,FALSE,NA,NA
Greg Mulholland 🧪,1176542926853115904,2019-09-24T17:04:27Z,This is actually my favorite TikTok//t.co/PWtVOSkO77,FALSE,TRUE,NA,NA
Greg Mulholland 🧪,1176542731604070400,2019-09-24T17:03:40Z,@roybahat It is composed of two things: the mechanism by which we allocate resources/put food on the table and the creation of an identity/my father was a welder. Solving one but not the other is not enough,FALSE,FALSE,2829401,NA
Greg Mulholland 🧪,1176145879553626119,2019-09-23T14:46:44Z,Analysts are starting to realize that the materials industry needs speed in innovative product development to build margin. The best materials companies are adopting dat-driven product development. @Citrine_io is here to drive that. //t.co/uwhDwnHtbR,FALSE,FALSE,NA,NA
Greg Mulholland 🧪,1175408077027176449,2019-09-21T13:54:58Z,"@Robotbeat @ricfulop Right, but creating liquid fuel is tremendously energy intensive afaik. Basically what he is saying is: when all electricity is carbon free, liquid fuel energy will be, too. Not disagreeing, this is just a path with many many steps preceding the end result",FALSE,FALSE,82431632,NA
Greg Mulholland 🧪,1175406899463720963,2019-09-21T13:50:17Z,"@ricfulop @Robotbeat I had the impression that it is using carbon captured from elsewhere to make rocket fuel. Net zero rocket fuel feels like it ignores some important energy balance questions and until we have 100% renewable and nuclear, not clear how it would be possible.",FALSE,FALSE,16061812,NA
Greg Mulholland 🧪,1174356483040956417,2019-09-18T16:16:18Z,@eriktorenberg We are pattern matchers the companies of the future will look the same as the companies of the past,FALSE,FALSE,1475495658,NA
Greg Mulholland 🧪,1174348946136633351,2019-09-18T15:46:21Z,Apple to include parts made of 100% recycled rare earths in new iPhones//t.co/JmaDQ0M6Hy via @CeciliaJamasmie//t.co/s9ERzwnz1V,FALSE,TRUE,NA,NA
Greg Mulholland 🧪,1174088117898231808,2019-09-17T22:29:55Z,"15-year-old or so kid at the neighboring table in the restaurant yesterday: ""America has a weird relationship with science - they're so good at it and yet they hate it"". A 15-year-old totally gets what no member of Congress does.",FALSE,TRUE,NA,NA
Greg Mulholland 🧪,1172531051207393280,2019-09-13T15:22:41Z,"Entrepreneurs, your investors reflect on you. I had an investor act like they wanted to invest to gather intel on us. One of their portfolio companies reached out to partner. I immediately questioned their motivations.",FALSE,FALSE,NA,NA
Greg Mulholland 🧪,1172479686074654722,2019-09-13T11:58:35Z,@iamb Finally,FALSE,FALSE,53970619,NA
Greg Mulholland 🧪,1172470338594189313,2019-09-13T11:21:26Z,"And when the recession/slowdown/whatever comes, GE, BASF, and other big, real companies aren't going anywhere, startups will die by the dozen//t.co/RpUttkvfYL",TRUE,FALSE,NA,NA
Greg Mulholland 🧪,1172462927242309636,2019-09-13T10:51:59Z,@mattocko @atShruti @SABarclay @DCVC @2kstead @kaychen22 I assure you it does,FALSE,FALSE,56640837,NA
Greg Mulholland 🧪,1172408659705352192,2019-09-13T07:16:21Z,"Age is just a number. The litmus test for me is whether a candidate understands both technology and tech policy. If you don't have a computer on your desk and use it as a primary tool (similar for smartphone), it is hard to imagine being able to create good tech policy//t.co/SnnskmQhdE",TRUE,FALSE,NA,NA
Greg Mulholland 🧪,1172349613640171520,2019-09-13T03:21:43Z,oh damn! the new iphone lets two people listen with bluetooth headphones at the same time! i've wanted this feature for so long!!!//t.co/7cS2GM4kHt,FALSE,TRUE,NA,NA
Greg Mulholland 🧪,1171701756797095936,2019-09-11T08:27:22Z,"Materials broadly suffers from a lack of structured, experimental, machine learnable data. Domain knowledge integration is the future. @citrine_io exists to solve this problem and bring AI into the materials and chemicals industry//t.co/FGr59NlJdU",TRUE,FALSE,NA,NA
Greg Mulholland 🧪,1171695388144934913,2019-09-11T08:02:04Z,Wow. Valerie Plame just launched her bid for Congress with the best ad of all time that could also be a trailer for a fun spy movie.//t.co/OGCDDhcXwP,FALSE,TRUE,NA,NA
Greg Mulholland 🧪,1171651226284544001,2019-09-11T05:06:35Z,@curiouswavefn Agree...still buying one,FALSE,FALSE,38474934,NA
Greg Mulholland 🧪,1171324905255833601,2019-09-10T07:29:54Z,"There is some irony to the fact that @JUULvapor is getting into so much trouble with the fed govt and @PAXlabs, whose product is still federally illegal, seems to be doing okay (they started as the same company).//t.co/9qea5QrAZx",FALSE,FALSE,NA,NA
Greg Mulholland 🧪,1171323473853128708,2019-09-10T07:24:12Z,"URGENT: Friends, we're in need of a liver donor for our daughter Nusayba who has Stage 4 cancer. The surgery scheduled for 9/10 was cancelled b/c the surgeon found a last second complication with the donor who made all the arrangements. It's a gut punch, but we're hopeful...1/",FALSE,TRUE,NA,NA
Greg Mulholland 🧪,1171138267942727681,2019-09-09T19:08:16Z,"@jmdagdelen My hope is that it leads to positive consequences: being able to access information faster, greener habits (less travel), interpersonal empathy (being able to put people in each other's shoes), and societal good; not just entertainment.",FALSE,FALSE,894317329684676608,NA
Greg Mulholland 🧪,1171116506882674689,2019-09-09T17:41:48Z,I have a feeling in my bones that tomorrow's Apple event is going to pivot much harder than people think in the direction of AR. - 3 cameras + TrueDepth in the new phone - Rumors of a sensor co-processor (on top of regular DSP/image proc) - 3D displays in Apple store windows,FALSE,FALSE,NA,NA
Greg Mulholland 🧪,1171114617873096705,2019-09-09T17:34:17Z,"This is going to be great. I love their technical skills but @brycemeredig and @jtappan_edu are also really entertaining and interesting. Layer an awesome and engaging John Mauro on top and you're in for a real treat!...and oh yeah, the future of materials science.//t.co/j0ROFMqmBG",TRUE,FALSE,NA,NA
Greg Mulholland 🧪,1171036109314220032,2019-09-09T12:22:19Z,"@bznotes And they create very weird incentives by charging for checked bags, which with today's airplane designs, are really your only good option",FALSE,FALSE,38399009,NA
Greg Mulholland 🧪,1170734657446588417,2019-09-08T16:24:28Z,Wheels are a freaking game changer for turtles.//t.co/lMjlC0bHdi,FALSE,TRUE,NA,NA
Greg Mulholland 🧪,1170673191661912064,2019-09-08T12:20:13Z,Please Retweet! We have a faculty opening! Duke University invites applications for a tenure-track faculty position at the Assistant Professor rank. @Chemjobber//t.co/qgK5JQxgKQ,FALSE,TRUE,NA,NA
Greg Mulholland 🧪,1170668537016246272,2019-09-08T12:01:43Z,"When you aim to explain your research with clarity, you make the person you're talking to feel smart. When you aim to explain your research in a way that makes you sound smart, you make the person you're talking to feel dumb.",FALSE,TRUE,NA,NA
Greg Mulholland 🧪,1169491795413102594,2019-09-05T06:05:46Z,"@bznotes CEOs need to check all cap tables. They also need to fire lawyers they can't trust to do them correctly. When you find a lawyer you can trust to do a great job, hold on as tight as you can",FALSE,FALSE,38399009,NA
Greg Mulholland 🧪,1169264308758470657,2019-09-04T15:01:49Z,Raleigh's Mission Valley Cinemas has closed. It was one of my favorite theaters: old school charm and you could watch first-run movies without breaking the bank. :-(//t.co/msiDGSeEqk,FALSE,TRUE,NA,NA
Greg Mulholland 🧪,1169031276315205637,2019-09-03T23:35:50Z,@mattocko you guys have any *personal* cyber security investments or co's you believe in? Interested in both opsec improvements and systematic ones in my own life//t.co/MuLSwfpn6I,TRUE,FALSE,56640837,NA
Greg Mulholland 🧪,1169030783778152448,2019-09-03T23:33:53Z,Did a little test of three browsers on iPhone. @brave @Google and @Apple. For each I configured the incognito or private browsing features. I used a separate IP and separate SIM from different cellular service providers. FB/Twitter etc. not installed. Here's search terms used.,FALSE,TRUE,NA,NA
Greg Mulholland 🧪,1168200918149619714,2019-09-01T16:36:17Z,"I've had a strange fascination with Chernobyl since I was in high school: At first I was curious about the nuclear physics, but I quickly became more interested in the cultural impact of the disaster. Earlier this summer I finally had a chance to visit",FALSE,TRUE,NA,NA
Greg Mulholland 🧪,1167310368449810433,2019-08-30T05:37:34Z,"Several natural disasters over the last 2.5 years, Trump does little to acknowledge them even when in DC. Hurricane headed for West Palm Beach, he cancels international diplomacy trip. His priorities are obvious. Self/business over country/people",FALSE,FALSE,NA,NA
Greg Mulholland 🧪,1167291797648723969,2019-08-30T04:23:46Z,"please don't text/slack me ""hey/hi"" and wait for me to reply before sending your actual message",FALSE,TRUE,NA,NA
Greg Mulholland 🧪,1166876062090838016,2019-08-29T00:51:47Z,Okay. This is pretty cool//t.co/z8HyCVrSN6,FALSE,FALSE,NA,NA
Greg Mulholland 🧪,1166866534565761025,2019-08-29T00:13:55Z,"@curiouswavefn @Meaningness @Dereklowe Lots of opportunities for curation, adding context, and private dataset creation. I would also love to see more transparent data sharing in the scientific community. Speaking of which, people should come to this to support open communities://t.co/JJmHUtOgri",FALSE,FALSE,38474934,NA
Greg Mulholland 🧪,1166864295642058752,2019-08-29T00:05:02Z,"@Meaningness @Dereklowe @curiouswavefn If your training data is only from published literature, you have lots of challenges: data quality, data correctness, data completeness/context, and ultimately differentiation (lots of people can access that data)",FALSE,FALSE,191666539,NA
Greg Mulholland 🧪,1166857263199318016,2019-08-28T23:37:05Z,Can't wait! See you all on the Open train ride north!//t.co/3OFzyu2mHD,TRUE,FALSE,NA,NA
Greg Mulholland 🧪,1166251598789480449,2019-08-27T07:30:23Z,"I have long believed this. Advanced math (anything past basic algebra and geometry) should be reserved for pupils wanting or needing it. But every kid needs an understanding of statistics, how to decipher numerical trends, and basic finance. And, FYI, I got an A in trigonometry.//t.co/i3NZDJWJoQ",FALSE,TRUE,NA,NA
Greg Mulholland 🧪,1165701688675594240,2019-08-25T19:05:14Z,Said it before and will say it again: great courses taught well. Highly recommend. Sending more people from @Citrine_io this year//t.co/jGYwq1zJPI,TRUE,FALSE,NA,NA
Greg Mulholland 🧪,1165683976641499136,2019-08-25T17:54:52Z,@curiouswavefn And at times those publications are products of overfitting or poor understanding of CV. The best work is great but lots of noise from non-expert practitioners making bold but incorrect claims. (Note: sometimes the work shows promise but overreaches in conclusion),FALSE,FALSE,38474934,NA
Greg Mulholland 🧪,1164668672788451330,2019-08-22T22:40:24Z,"Car companies like @Bugatti are designing cars more and more digitally://t.co/lFAgboXwnV Geometry is just step 1, end-to-end design includes materials design: @Citrine_io is the enabler",FALSE,FALSE,NA,NA
Greg Mulholland 🧪,1162569296821620736,2019-08-17T03:38:14Z,@mims Is WeWork the new MBA case study (a la Webvan) of unit economics matter in business or something similar?,FALSE,FALSE,1769191,NA
Greg Mulholland 🧪,1162216817617584131,2019-08-16T04:17:36Z,@ataussig @guruchahal Diamonds are meaningless in the heat death of the universe didn't pass muster in the marketing dept of DeBeers,FALSE,FALSE,22097962,NA
Greg Mulholland 🧪,1161789632486359040,2019-08-15T00:00:08Z,WeWork: proving that even the IPO market might believe that you can make up negative gross margins with volume.//t.co/SaWCG54zQ5,FALSE,FALSE,NA,NA
Greg Mulholland 🧪,1161730770295119872,2019-08-14T20:06:14Z,Want to be part of the solution: come join us at @Citrine_io! //t.co/9F8zuMKgZs,FALSE,FALSE,14214459,NA
Greg Mulholland 🧪,1161730574031044608,2019-08-14T20:05:27Z,Every plastics (or materials) industry executive should see this and panic for their business and the earth. We need green materials innovation and FAST. Otherwise: destroy our home or dramatically reduce the quality of life of every person on the planet.//t.co/OlSSXxdfpI,FALSE,FALSE,NA,NA
Greg Mulholland 🧪,1158746848007340033,2019-08-06T14:29:11Z,"Super pumped to finalllyyyyy announce that I'm starting my new gig as an Instructional Designer at @Citrine_io next week. @treehouse students, it's been an immense pleasure to teach you the wiles and ways of JavaScript and Python over the last 1.5 years. Keep on coding!!! Xo",FALSE,TRUE,NA,NA
Greg Mulholland 🧪,1157327267271340033,2019-08-02T16:28:17Z,Professors: please watch the pop culture of my generation so you get my inside jokes Every other public presenter: play to your audience//t.co/V4chrgfIXI,TRUE,FALSE,NA,NA
Greg Mulholland 🧪,1155493267271639040,2019-07-28T15:00:37Z,"@A_Aspuru_Guzik @leecronin Agree with Alan here...massive headroom for new innovation, but tons of great work being done by many people already. New materials discovered by AI/ML being published every day, and even more being found by companies that aren't yet published",FALSE,FALSE,1112211,NA
Greg Mulholland 🧪,1154612947047481344,2019-07-26T04:42:32Z,"@a16z Welcome to the age of materialsglad you are joining us in the realization that materials, both raw and value-added, are a define the future. @Citrine_io exists to use raw materials more effectively and to create the next gen of value-added materials faster than ever before.",FALSE,FALSE,64844802,NA
Greg Mulholland 🧪,1154606823845978112,2019-07-26T04:18:13Z,"I know their earnings were great and all, but I have a 100% failure rate with same day delivery from @amazon. 9:00pm rolls around, we will deliver tomorrow except I ordered for delivery today for a reason. Bad customer experience.",FALSE,FALSE,NA,NA
Greg Mulholland 🧪,1153897733658333184,2019-07-24T05:20:32Z,All this talk about adding backdoors to encryption remember when the TSA required all luggage locks to allow their master key access? Now imagine that for all digital data in the US; it doesn't seem like a sound strategy.,FALSE,FALSE,NA,NA
Greg Mulholland 🧪,1153654635279708160,2019-07-23T13:14:33Z,Come work with me!//t.co/cdy6Qy99O2,FALSE,TRUE,NA,NA
Greg Mulholland 🧪,1150237152002756608,2019-07-14T02:54:42Z,@vcstarterkit @andricessen BaaS. Obvious company name is Marrow,FALSE,FALSE,1107043802991063040,NA
Greg Mulholland 🧪,1150185100044206080,2019-07-13T23:27:51Z,We have been able to confirm what other Members of Congress have heard & seen: -no showers for over 40 days. -lights are kept on all night & people are sleeping on concrete floors. -some are complaining they have gone hungry.//t.co/ob6kiwrCoQ,FALSE,TRUE,NA,NA
Greg Mulholland 🧪,1150184791653769216,2019-07-13T23:26:38Z,@heyheygabrielle Olives of any type,FALSE,FALSE,954780176172240896,NA
Greg Mulholland 🧪,1149808352269987840,2019-07-12T22:30:48Z,@saulcarlin I think you mean They're There,FALSE,FALSE,18030939,NA
Greg Mulholland 🧪,1149807501539336192,2019-07-12T22:27:25Z,"Dear Apple/iOS, both their and couldn't are words spelled correctly. PLEASE STOP TRYING TO CORRECT THEM TO OTHER THINGS",FALSE,FALSE,NA,NA
Greg Mulholland 🧪,1149802532832608256,2019-07-12T22:07:40Z,Innovation and speed to market leads to market share and margin check out the DataLab Podcast featuring Dr. Cynthia Arnold//t.co/DW8pIAIaod,FALSE,FALSE,NA,NA
Greg Mulholland 🧪,1149800998757531648,2019-07-12T22:01:35Z,@curiouswavefn @Chemjobber One in eight chemists say they could make a molecule or compound with *that* set of properties,FALSE,FALSE,38474934,NA
Greg Mulholland 🧪,1148725263762481152,2019-07-09T22:46:59Z,"@jshieber Chemistry, physics. Technical innovation broadly.",FALSE,FALSE,30783608,NA
Greg Mulholland 🧪,1147915582957744128,2019-07-07T17:09:36Z,"This equal pay thing is silly. Based on performance, sales, and basically every other dimension, the @USWNT should be paid categorically more than the men. Also, what a great World Cup",FALSE,FALSE,NA,NA
Greg Mulholland 🧪,1147733795644198912,2019-07-07T05:07:15Z,"@curiouswavefn @RuhGEEnah Often. I get to visit some of the best cities and companies on earth, but there are times when I need an alone meal to gather myself or decompress",FALSE,FALSE,38474934,NA
Greg Mulholland 🧪,1147311971714445312,2019-07-06T01:11:04Z,@curiouswavefn Sounds similar to themes in A History of the World in 6 Glasses great book cutting across thousands of years,FALSE,FALSE,38474934,NA
Greg Mulholland 🧪,1146598154176999424,2019-07-04T01:54:37Z,@cesapo @Chemjobber @CaptuREsources Check out @WRFSwitzerland tons of good people,FALSE,FALSE,138061795,NA
Greg Mulholland 🧪,1146597533973712897,2019-07-04T01:52:09Z,"@Indraneeldesh @jmdagdelen @nature Also sign up for the @Citrine_io newsletter. Has a weekly review of lots of related publications, jobs, etc.",FALSE,FALSE,303888750,NA
Greg Mulholland 🧪,1146397882154491905,2019-07-03T12:38:48Z,Very nice talk by Georg Kresse on machine learned potentials! #MQM2019//t.co/GH2yR8qYUR,FALSE,TRUE,NA,MQM2019
Greg Mulholland 🧪,1146151832214892544,2019-07-02T20:21:05Z,"@Airbnb If I were a company that took credit cards online, I would take these calls very seriously. Apparently @airbnb disagrees",FALSE,FALSE,14214459,NA
Greg Mulholland 🧪,1146151507881971712,2019-07-02T20:19:48Z,"Call @AirBnB to report 3 trips booked fraudulently on my account. No way to speak directly to Trust and Safety team. After waiting on hold, told that it will be escalated but I can't speak to anyone who will deal with it. No idea what is happening now",FALSE,FALSE,NA,NA
Greg Mulholland 🧪,1145050811241644032,2019-06-29T19:26:02Z,There is no justification for paying the @USWNT less than the men. I was in a restaurant last week and saw soccer on. Started to watch. Saw it was men. Moved on. The women's team is the soccer pride of the US.//t.co/mLgnb8yiD8,FALSE,FALSE,NA,NA
Greg Mulholland 🧪,1145012281333305349,2019-06-29T16:52:55Z,"@yomnapple Hi Yomna! We are growing our engineering team aggressively. We build the AI platform that helps Materials companies invent new, green, sustainable materials faster. Would love to connect!",FALSE,FALSE,2474960737,NA
Greg Mulholland 🧪,1144497051343831040,2019-06-28T06:45:35Z,"I beg to differ 1) aluminum is incredibly recyclable - plastic is not by a long shot 2) energy can be clean/green 3) Plastic trash stays in the environment for centuries, aluminum doesn't 4) Aluminum cans have an economy, plastic really doesn't//t.co/dCTS6Hklhd",FALSE,TRUE,NA,NA
Greg Mulholland 🧪,1143533292945195009,2019-06-25T14:55:57Z,"@saketvora @monvural But in the NFL, NBA, and NCAA basketball, the stakes for any single scoring event are lower because there are more of them. It leads to fewer ref-decided high stakes events naturally. Still happens, but not as often",FALSE,FALSE,14211517,NA
Greg Mulholland 🧪,1143356892351045633,2019-06-25T03:15:00Z,"@monvural It is fundamental to the sport. Anytime you have games won and lost regularly by 1 score, referee calls can have an enormous impact (as opposed to high scoring games where a single call only makes the game determining difference infrequently)",FALSE,FALSE,14394002,NA
Greg Mulholland 🧪,1143181739801448448,2019-06-24T15:39:00Z,Apparently Gmail reads Lawyer English to actually be Xhosa//t.co/XJRikZIFPf,FALSE,FALSE,NA,NA
Greg Mulholland 🧪,1141933152644075520,2019-06-21T04:57:34Z,@curiouswavefn A lot of us are trying to change that!,FALSE,FALSE,38474934,NA
Greg Mulholland 🧪,1141739266831212545,2019-06-20T16:07:08Z,This is disgusting//t.co/mnQQkPdqMp,TRUE,FALSE,NA,NA
Greg Mulholland 🧪,1141609042806300674,2019-06-20T07:29:40Z,"@mattocko I would argue the opposite. The fact that we have been able to move information, as if by magic, around the country and world for a tiny amount of money has been an engine of economic growth. Needs to be modernized, but it is a powerful dept",FALSE,FALSE,56640837,NA
Greg Mulholland 🧪,1141444220915507201,2019-06-19T20:34:43Z,"@lsl1588 @A_Aspuru_Guzik Hi Laura, our team at @Citrine_io is hiring for both remote and local folks in a ton of engineering and data science roles. We have some exciting things to announce upcoming! Shoot me a DM and happy to chat and connect you with the right people on our team!",FALSE,FALSE,1036105555759308805,NA
Greg Mulholland 🧪,1141375962975821824,2019-06-19T16:03:29Z,@A_Aspuru_Guzik @curiouswavefn It's really hard to beat a good guacamole,FALSE,FALSE,1112211,NA
Greg Mulholland 🧪,1141308607247671296,2019-06-19T11:35:51Z,The CDO of @LANXESS Joerg Hellwig says AI (from @Citrine_io) will power sustainability and product innovation at a pace never before seen #MoralesMachines//t.co/Ss3ToOpW0L,FALSE,FALSE,NA,MoralesMachines
Greg Mulholland 🧪,1141297039457837056,2019-06-19T10:49:53Z,On @elonmusk: he is a visionary and he changed the automotive world...without him we would not be where we are today...he makes me come up with my best #moralsmachines,FALSE,FALSE,14214459,moralsmachines
Greg Mulholland 🧪,1141296636519485440,2019-06-19T10:48:17Z,What we need in Europe is more education of AI experts at our universities...public funding for development and a responsible and more practical data protection approach [than GDPR] -Thomas Sedran of @VWGroup Commercial Vehicles #moralsmachines//t.co/k11NZmJbEN,FALSE,FALSE,NA,moralsmachines
Greg Mulholland 🧪,1141289073870626817,2019-06-19T10:18:13Z,"When designing AI, we should avoid rigid rule following -Peter Singer of @Princeton #moralsmachines//t.co/PGgBS3FhmB",FALSE,FALSE,NA,moralsmachines
Greg Mulholland 🧪,1141284074994262016,2019-06-19T09:58:22Z,"The most striking thing about the first themes in #moralsmachines is the assumption all data is about people and behavior. This is the some of the most dangerous data, but agriculture, chemicals (@Citrine_io), weather, medicine, etc. all have huge opportunities",FALSE,FALSE,NA,moralsmachines
