name,status_id,created_at,text,is_quote,is_retweet,reply_to_user_id,hashtags
Greg Mulholland 🧪,630412915913265152,2015-08-09T16:18:46Z,"@daniellemorrill At early stage, salary pyramid should be roughly inverted or at least flat. Most investors already look for this I think",FALSE,FALSE,7017692,NA
Greg Mulholland 🧪,629820872988045312,2015-08-08T01:06:12Z,"Powerful article today in the @nytimes, My Periodic Table//t.co/A8Kt7Dgbv5",FALSE,FALSE,NA,NA
Greg Mulholland 🧪,629745432252452864,2015-08-07T20:06:25Z,The definition of dissonance: walking between coffee shops in Palo Alto listening to the new @drdre album Compton,FALSE,FALSE,NA,NA
Greg Mulholland 🧪,629529426535976960,2015-08-07T05:48:06Z,@DanielleMorrill when are you going to do a @Mattermark Materials Science Startups Report? It's the next big thing.,FALSE,FALSE,7017692,NA
Greg Mulholland 🧪,629350422545874948,2015-08-06T17:56:48Z,"Data highlight of the week: Semiconductor bandgap, conduction band, and valence band values://t.co/0qBSflp2Pz",FALSE,TRUE,NA,NA
Greg Mulholland 🧪,628954922986287104,2015-08-05T15:45:13Z,It's an art of #materials science the building of a hoverboard. Really freaking cool.//t.co/mqoYCRnZOk @Lexus @Toyota,FALSE,TRUE,NA,materials
Greg Mulholland 🧪,628928234944507905,2015-08-05T13:59:10Z,"Choosing the Right Running Shoes: great, obvious advice//t.co/b1GwsITnyv",FALSE,FALSE,NA,NA
Greg Mulholland 🧪,628741848715018240,2015-08-05T01:38:32Z,"I like @applemusic for radio, but I might go back to @spotify because of embedding/link sharing ease.",FALSE,FALSE,NA,NA
Greg Mulholland 🧪,628657532752433152,2015-08-04T20:03:30Z,Check out @gregmulholland's post about the materials innovation needed to achieve @POTUS @EPA clean power plan//t.co/c0oP9vnRG7,FALSE,TRUE,NA,NA
Greg Mulholland 🧪,628563455562268672,2015-08-04T13:49:40Z,@BillGates explains his $1B investment in clean energy -- We Need Clean Energy Innovation and Lots of It//t.co/rozDt4mmBf,FALSE,TRUE,NA,NA
Greg Mulholland 🧪,628432237768282113,2015-08-04T05:08:15Z,"@hoffmang Always an auction around the corner, or strategic partnerships, or corporate buyouts. Savvy folks in Cupertino.",FALSE,FALSE,14629055,NA
Greg Mulholland 🧪,628431117926842368,2015-08-04T05:03:48Z,"Other things Apple could do with its piles of money: buy BMW outright, and Ford, and GM. Crazy.",FALSE,FALSE,NA,NA
Greg Mulholland 🧪,628430910203957248,2015-08-04T05:02:59Z,"@hoffmang Apple could buy as much spectrum as it wants. I'm not saying that it is trivial, just possible. Rumors not insane.",FALSE,FALSE,14629055,NA
Greg Mulholland 🧪,628430407986360320,2015-08-04T05:00:59Z,"@hoffmang Just rent space on existing towers, its what everyone else does now anyway.",FALSE,FALSE,14629055,NA
Greg Mulholland 🧪,628429942204698625,2015-08-04T04:59:08Z,Verizon has ~15k towers. It costs &lt;$100k for an LTE base station. Apple could deploy more coverage than Verizon with &lt;1% of its cash on hand,FALSE,FALSE,NA,NA
Greg Mulholland 🧪,628300793880285184,2015-08-03T20:25:57Z,Just wrote a blog post about the materials innovation needed to achieve @POTUS @EPA clean power plan://t.co/sd7I1bUPr3,FALSE,FALSE,NA,NA
Greg Mulholland 🧪,627959165290328064,2015-08-02T21:48:26Z,@mrhickle @pmarca something like this?//t.co/Kda0WvAIct,FALSE,FALSE,2435651113,NA
Greg Mulholland 🧪,627899174839652353,2015-08-02T17:50:03Z,If I have one piece of advice for kids in school: learn to write well and to love writing. An incredibly empowering skill,FALSE,FALSE,NA,NA
Greg Mulholland 🧪,627888056222138368,2015-08-02T17:05:52Z,Woah. If I was a non-exec of a (traditional) bank://t.co/ezd2Kh4xnE by @Paradigmshift25 #disruption//t.co/TuECbF7Vl7,FALSE,TRUE,NA,disruption
Greg Mulholland 🧪,626842768246091777,2015-07-30T19:52:16Z,Just got a package from @amazon. Literally a whole box for one piece of paper. #environment//t.co/HoAj8G0dsY,FALSE,FALSE,NA,environment
Greg Mulholland 🧪,626817469458460672,2015-07-30T18:11:45Z,One of my favorite episodes of @allsongs. #tbt//t.co/PhKzHlxtw6 @nprmusic @nprobin,FALSE,FALSE,NA,tbt
Greg Mulholland 🧪,626770551038545922,2015-07-30T15:05:18Z,@jonathantimar @Microsoft irony: this message probably means nothing actually happened,FALSE,FALSE,NA,NA
Greg Mulholland 🧪,626508510033915904,2015-07-29T21:44:03Z,A company can spend 20 years developing & testing new materials before they appear on the market//t.co/t29k0RFdah,FALSE,TRUE,NA,NA
Greg Mulholland 🧪,626050834783014913,2015-07-28T15:25:25Z,"This is why not just any random person, or the majority as a whole, are allowed to determine foreign policy://t.co/1dMWPJOK19",FALSE,FALSE,NA,NA
Greg Mulholland 🧪,625826885302272001,2015-07-28T00:35:31Z,Shaping Tomorrow's Breakthrough Materials @brycemeredig @gregmulholland//t.co/t29k0RFdah//t.co/aVRjH6vybb,FALSE,TRUE,NA,NA
Greg Mulholland 🧪,625170289035378688,2015-07-26T05:06:26Z,"TIL Third Eye Blind is still touring. Yes, I am reliving being 16 by attending their concert.//t.co/DFYcj5o9Cl",FALSE,FALSE,NA,NA
Greg Mulholland 🧪,624755757360111616,2015-07-25T01:39:14Z,"TomKatCenter features a paper contributed to by Citrine, as well as some familiar faces!//t.co/PkbfOVegl7",FALSE,TRUE,NA,NA
Greg Mulholland 🧪,624613639421427713,2015-07-24T16:14:31Z,How I know that the music streaming wars are not yet over: I still cannot stream the Space Jam soundtrack.,FALSE,FALSE,NA,NA
Greg Mulholland 🧪,624581439644786688,2015-07-24T14:06:34Z,"@pmarca plastics are still a huge market, too. And software is going to change them like everything else. It's what we do at @Citrine_io",FALSE,FALSE,5943622,NA
Greg Mulholland 🧪,623893159156658176,2015-07-22T16:31:35Z,@zanelowe love your variety on @beats1. Play some @serynsounds Disappear! They're even in LA for shows this week,FALSE,FALSE,21288052,NA
Greg Mulholland 🧪,623201380883259392,2015-07-20T18:42:42Z,"White House blog covers The Materials Data Challenge, for which Citrine will be providing support://t.co/KlnhzlL9Mr",FALSE,TRUE,NA,NA
Greg Mulholland 🧪,623140937233924096,2015-07-20T14:42:31Z,"@daniellemorrill allegedly, right @saketvora?",FALSE,FALSE,7017692,NA
Greg Mulholland 🧪,623125105887985665,2015-07-20T13:39:37Z,"@SapanaV @saketvora @gurpreetz I agree with Saket. Too many ""it depends"" situations to fact check (esp quickly)",FALSE,FALSE,18300195,NA
Greg Mulholland 🧪,622931193638486016,2015-07-20T00:49:04Z,First terrible experience with Apple support: was told normal failure mode for laptop batteries is to double in size and break my trackpad,FALSE,FALSE,NA,NA
Greg Mulholland 🧪,621429998239526913,2015-07-15T21:23:51Z,What Does a Startup COO Actually Do? by @SparksZilla//t.co/IPPLfmKFQh,FALSE,FALSE,NA,NA
Greg Mulholland 🧪,619177871236399109,2015-07-09T16:14:42Z,"If it adds comment threading, @SlackHQ starts to look a lot like the defunct Google Wave.//t.co/iwvsG4up52",FALSE,FALSE,NA,NA
Greg Mulholland 🧪,619059012831547392,2015-07-09T08:22:24Z,@scifri go to the beam line at @SLAClab. Talk to @markhartney!,FALSE,FALSE,16817883,NA
Greg Mulholland 🧪,618233323383422976,2015-07-07T01:41:25Z,"@DanielleMorrill if a cap is set and no one invests, is it really a cap at all?",FALSE,FALSE,7017692,NA
Greg Mulholland 🧪,615899502944202752,2015-06-30T15:07:39Z,"Adding software to a broken process doesn't make you digital. The biggest challenge is reimagining the process, not writing the software.",FALSE,TRUE,NA,NA
Greg Mulholland 🧪,615503662241050624,2015-06-29T12:54:43Z,"@gregmulholland most ""big data"" is actually two small datas standing on each other shoulders wearing a trenchcoat and sunglasses. @mhoye",FALSE,TRUE,NA,NA
Greg Mulholland 🧪,614586894668541952,2015-06-27T00:11:48Z,Not a bad view for a shakeout ride. Bike feels good.//t.co/f9FVWkECK8,FALSE,FALSE,NA,NA
Greg Mulholland 🧪,614460566921347073,2015-06-26T15:49:49Z,Equal rights. For all!//t.co/u7kZKTIweu,FALSE,TRUE,NA,NA
Greg Mulholland 🧪,614456628687958016,2015-06-26T15:34:10Z,Waiting for someone to photoshop rainbow robes onto SCOTUS.,FALSE,FALSE,NA,NA
Greg Mulholland 🧪,614456372214677504,2015-06-26T15:33:09Z,The people who are crazy enough to think they can change the world are the ones who do.,FALSE,TRUE,NA,NA
Greg Mulholland 🧪,614119879990362112,2015-06-25T17:16:03Z,@Colin2me different industries are different? ;),FALSE,FALSE,1093461126,NA
Greg Mulholland 🧪,614115007886852096,2015-06-25T16:56:42Z,@Colin2me I'm just not convinced med students are what raise hospital quality.,FALSE,FALSE,1093461126,NA
Greg Mulholland 🧪,614111602246201344,2015-06-25T16:43:10Z,@Colin2me it would mean either bad hospitals would get better...or only the worst students would get mentorship from the best doctors :(,FALSE,FALSE,14214459,NA
Greg Mulholland 🧪,614108333570527232,2015-06-25T16:30:10Z,"@Colin2me ""with the 19,946th pick in the residency draft, MGH begrudgingly takes whomever is left""",FALSE,FALSE,1093461126,NA
Greg Mulholland 🧪,613799755945152512,2015-06-24T20:04:00Z,Our team on a tour of SLAC! What an amazing place!//t.co/Y9KWU8PGzE,FALSE,TRUE,NA,NA
Greg Mulholland 🧪,613562867955077120,2015-06-24T04:22:41Z,"""The biggest energy issues facing us today are materials issues."" @gregmulholland (MBA '14)//t.co/t29k0RFdah",FALSE,TRUE,NA,NA
Greg Mulholland 🧪,613550467503689729,2015-06-24T03:33:25Z,Shaping Tomorrow's Breakthrough Materials @brycemeredig @gregmulholland//t.co/t29k0RFdah//t.co/jnsVt1GhWg,FALSE,TRUE,NA,NA
Greg Mulholland 🧪,613312996111024130,2015-06-23T11:49:47Z,"Fascinating: ""So far, there's no relationship between a country's use of robots and its manufacturing job loss.""//t.co/boIAd89RNm",FALSE,TRUE,NA,NA
Greg Mulholland 🧪,612478936849629185,2015-06-21T04:35:32Z,"Good point, Mitt.//t.co/Ryusfp8Xbh",FALSE,TRUE,NA,NA
Greg Mulholland 🧪,612109430855892992,2015-06-20T04:07:15Z,@saketvora yes indeed! Starts @Tradecraft on Monday!,FALSE,FALSE,14211517,NA
Greg Mulholland 🧪,612094463993737216,2015-06-20T03:07:47Z,Really great episode of StartUp S2. Feelings are hard to talk about. Lesson 1 from @StanfordBiz. @Gimletmedia//t.co/oRcjJv3zwb,FALSE,FALSE,NA,NA
Greg Mulholland 🧪,612093310216175616,2015-06-20T03:03:11Z,Dragged my brother to the gym.//t.co/hvFtaQtWO6,FALSE,FALSE,NA,NA
Greg Mulholland 🧪,611620000542105600,2015-06-18T19:42:26Z,Our highlighted data point of the week: Atomic Layer Deposited Materials//t.co/7sBfwXwQrM,FALSE,TRUE,NA,NA
Greg Mulholland 🧪,611608891495948288,2015-06-18T18:58:17Z,@Pat4705 thanks! 10 days!,FALSE,FALSE,196720232,NA
Greg Mulholland 🧪,611600599059054592,2015-06-18T18:25:20Z,Even if you don't believe climate change is human caused or agree with @pontifex. Didn't your parents teach you not to litter?,FALSE,FALSE,NA,NA
Greg Mulholland 🧪,611562701857366016,2015-06-18T15:54:45Z,Thanks @POTUS. Great visit to EEOB as usual.//t.co/WsCegDQK1F,FALSE,FALSE,NA,NA
Greg Mulholland 🧪,611288402902683648,2015-06-17T21:44:47Z,Interesting article on the development of the laptop. Lots of enabling #materials in there://t.co/CqaZ1AhPdp,FALSE,FALSE,NA,materials
Greg Mulholland 🧪,611243555919634432,2015-06-17T18:46:34Z,"OH by someone who is left in yesteryear ""innovation goes like the sun: Europe, North America, Asia."" Very incorrect, innovation everywhere",FALSE,FALSE,NA,NA
Greg Mulholland 🧪,611232535939518465,2015-06-17T18:02:47Z,GE's CEO Jeff Immelt 'Every Company Has to be a Software Company' //t.co/QHdZeSWuNo echoes @pmarca 2011'Software is eating the world',FALSE,TRUE,NA,NA
Greg Mulholland 🧪,611232261158109184,2015-06-17T18:01:41Z,@paulg wow. That is actually very impressive for 6...,FALSE,FALSE,183749519,NA
Greg Mulholland 🧪,610861884141608962,2015-06-16T17:29:57Z,"If you're in DC for TechConnect, visit @gregmulholland at Booth 44 until 6pm.//t.co/m8dDXFkR8T",FALSE,TRUE,NA,NA
Greg Mulholland 🧪,610407762338652160,2015-06-15T11:25:26Z,"When the concierge at a major hotel tells me Uber will be faster and cheaper than her calling a taxi, I know @Uber is winning.",FALSE,FALSE,NA,NA
Greg Mulholland 🧪,609495960486547456,2015-06-12T23:02:15Z,"""Every day is Arbor Day in Codeville""://t.co/znDUyfnurJ",FALSE,FALSE,NA,NA
Greg Mulholland 🧪,609061102215921664,2015-06-11T18:14:17Z,RT Citrine_io We've started a new series highlighting interesting data points in the//t.co/n90B8Wstsa plat//t.co/bUBZqIbkGo,FALSE,FALSE,NA,NA
Greg Mulholland 🧪,607762670595342336,2015-06-08T04:14:47Z,@fmbutt @pmarca anyone who wants to know the future just needs to read that paper. Accurately laid out 100 years of tech development.,FALSE,FALSE,15080332,NA
Greg Mulholland 🧪,607380842231537664,2015-06-07T02:57:32Z,Totally agree://t.co/b1JkdeoJks,FALSE,FALSE,NA,NA
Greg Mulholland 🧪,606478930439061504,2015-06-04T15:13:39Z,"Is Google bringing back the &lt;blink&gt; tag, too?//t.co/svwTwsl6X8 #geocities",FALSE,FALSE,NA,geocities
Greg Mulholland 🧪,606469768300732416,2015-06-04T14:37:15Z,"@noyinkatie His numbers are also wrong. Even with low fuel prices, wind is roughly cost competitive with fossil://t.co/uTrzRGtpZ6",FALSE,FALSE,NA,NA
Greg Mulholland 🧪,606282008700911616,2015-06-04T02:11:09Z,Cool app and product by my friends at @LightUp. Engineering education made easy and fun://t.co/BBDbCrtyrj,FALSE,FALSE,NA,NA
Greg Mulholland 🧪,606221983118860288,2015-06-03T22:12:38Z,It looks like we probably will face a major challenge in scaling up lithium supplies to meet EV demand //t.co/BryRJsaf6D,FALSE,TRUE,NA,NA
Greg Mulholland 🧪,606221838151081984,2015-06-03T22:12:03Z,To the amazing team @iendeavors thank you for delivering on an outstanding #CuriosityCamp2015 - a thoughtful curation of topics and people!,FALSE,TRUE,NA,CuriosityCamp2015
Greg Mulholland 🧪,606137425170022401,2015-06-03T16:36:38Z,@c_hartman1 @MikeIsaac most of the comments on this thread correctly point out that chrome is a bloated mem/proc hog,FALSE,FALSE,372126641,NA
Greg Mulholland 🧪,603933601239998465,2015-05-28T14:39:25Z,@c_hartman1 I'm no doctor. But I'm p sure the last thing my body needs is even more sluuudge.,FALSE,FALSE,372126641,NA
Greg Mulholland 🧪,603774589085319168,2015-05-28T04:07:34Z,"RT Citrine_io RT robsiegel: Huge congrats to Vikrant, NishantDoshi and the CirroSecure team! Palo Alto Networks Ac//t.co/vdzRZlrim6",FALSE,FALSE,NA,NA
Greg Mulholland 🧪,603294831746666496,2015-05-26T20:21:11Z,"RT Citrine_io Data Processing with Ruby, RabbitMQ and Sneakers from our VP of Engineering, jsomara//t.co/Jaey2PFsE3",FALSE,FALSE,NA,NA
Greg Mulholland 🧪,601554085867692032,2015-05-22T01:04:05Z,@monvural @saketvora @johnshen those are code names...those are the actual product names,FALSE,FALSE,14394002,NA
Greg Mulholland 🧪,601553498551922688,2015-05-22T01:01:45Z,"@saketvora @johnshen @monvural what version of droid? Chippy curmudgeon or platitudinous pineapple? Or, since they sell names: skittles?",FALSE,FALSE,14211517,NA
Greg Mulholland 🧪,601433034508914688,2015-05-21T17:03:04Z,"RT Citrine_io We've added some new features to our data platform,//t.co/SYOyRGagE8!//t.co/K1fT9bOjYc",FALSE,FALSE,NA,NA
Greg Mulholland 🧪,601398548916088832,2015-05-21T14:46:02Z,@saketvora unfollow,FALSE,FALSE,14211517,NA
Greg Mulholland 🧪,601146278957965312,2015-05-20T22:03:36Z,"Getting Started with the Jackson JSON Processor, from kylejaymichel ://t.co/WDoTI7pVkJ",FALSE,FALSE,NA,NA
Greg Mulholland 🧪,601094139568984064,2015-05-20T18:36:25Z,"@saulcarlin @support dude, that is just the man trying to confuse you. Allow Allow Allow",FALSE,FALSE,18030939,NA
Greg Mulholland 🧪,601090016140398593,2015-05-20T18:20:02Z,Love this://t.co/S1PaTO4MqI how we learned C and asm at @NCState,FALSE,FALSE,NA,NA
Greg Mulholland 🧪,601063674703319040,2015-05-20T16:35:21Z,@alexia Welcome to the @StanfordBiz family! Excited to have you!,FALSE,FALSE,18327902,NA
Greg Mulholland 🧪,601048766523658241,2015-05-20T15:36:07Z,"@daniellemorrill When I get in before 8 (or earlier if I am feeling ambitious), I get a full day's work done before 10.",FALSE,FALSE,7017692,NA
Greg Mulholland 🧪,600108101845422080,2015-05-18T01:18:15Z,"@bengaddy @saketvora I imagine their internal discussion went like this ""our site is secure, so this is a great marketing play""",FALSE,FALSE,49318490,NA
Greg Mulholland 🧪,600107863587954688,2015-05-18T01:17:18Z,"@saketvora @bengaddy Based on the quality of their website, I am disinclined to believe United's response: ""Dude, we are toootally secure.""",FALSE,FALSE,14211517,NA
Greg Mulholland 🧪,600106891306373120,2015-05-18T01:13:26Z,"@bengaddy details, details...",FALSE,FALSE,49318490,NA
Greg Mulholland 🧪,600098121515868162,2015-05-18T00:38:36Z,"Shouldn't this guy get a 1,000,000 mile bonus from @united? Bug://t.co/UOPnsQw8Pw Bug bounty://t.co/UHykdOZWa5",FALSE,FALSE,NA,NA
Greg Mulholland 🧪,600079731904487424,2015-05-17T23:25:31Z,The myth of the a-ha moment in the New York Times today: a great read and inspiring//t.co/XQKsaxP3vg,FALSE,FALSE,NA,NA
Greg Mulholland 🧪,599966542709661696,2015-05-17T15:55:45Z,The coding world has inverted.//t.co/ZYc9mfCgiO,FALSE,FALSE,NA,NA
Greg Mulholland 🧪,599333119968223232,2015-05-15T21:58:45Z,Peer review and the value of publishing: how can we make it better? Data.//t.co/E1RIzNtx4H,FALSE,TRUE,NA,NA
Greg Mulholland 🧪,598625217829736449,2015-05-13T23:05:48Z,"The best explanation I've seen (for when my kids ask me: ""What Do You Do""?) @bznotes @cdixon @pmarca @mattocko//t.co/xGphwKCS8P",FALSE,TRUE,NA,NA
Greg Mulholland 🧪,597563000774496257,2015-05-11T00:44:56Z,"Wait, flight attendants think that electronics are the reason no one pays attention to seatbelt lessons on flights?//t.co/WjuGCVuaJy",FALSE,FALSE,NA,NA
Greg Mulholland 🧪,597294625326403584,2015-05-10T06:58:30Z,Congrats to my namesake @GregMulholland1 on his reelection. Now I need to take him up on his offer of real ale next time I'm in the UK!,FALSE,FALSE,NA,NA
Greg Mulholland 🧪,596493898408534016,2015-05-08T01:56:42Z,Going to live the dream of the 90s for 24 hours.,FALSE,FALSE,NA,NA
Greg Mulholland 🧪,596352987515125760,2015-05-07T16:36:46Z,"""nature is talking to usthrough experimental results. The worst data are better than the best theory."" -A. Erditato//t.co/we3eP2V9ai",FALSE,FALSE,NA,NA
Greg Mulholland 🧪,595348257506627584,2015-05-04T22:04:20Z,"Preach, brother. ""C is Truth""//t.co/F5DfeUFrPq",FALSE,FALSE,NA,NA
Greg Mulholland 🧪,594984456437440512,2015-05-03T21:58:43Z,First triathlon complete. Not dead. Cool to see a bunch of GSBers there.,FALSE,FALSE,NA,NA
Greg Mulholland 🧪,593205277182169088,2015-04-29T00:08:53Z,Citrine collaborating with Materials Project for Data Analytics://t.co/3xYj9Kplqv,FALSE,TRUE,NA,NA
Greg Mulholland 🧪,592911050065977345,2015-04-28T04:39:44Z,"Interesting case studies from MIT, particularly those about materials and batteries://t.co/Jegl5Zt9y4",FALSE,FALSE,NA,NA
Greg Mulholland 🧪,589522678324690944,2015-04-18T20:15:33Z,"Same Sith, different day",FALSE,TRUE,NA,NA
Greg Mulholland 🧪,588801074741411840,2015-04-16T20:28:10Z,@sam_suarez haha. I wish I would have read the byline.,FALSE,FALSE,95651151,NA
Greg Mulholland 🧪,588794438811418624,2015-04-16T20:01:48Z,This is a terrible idea. Talk about increasing incentives for corruption....//t.co/N5IXWj6AOw,FALSE,FALSE,NA,NA
Greg Mulholland 🧪,588479311872589824,2015-04-15T23:09:36Z,Truly incredible video. So close!//t.co/ULToi7C17G,FALSE,FALSE,NA,NA
Greg Mulholland 🧪,588192169934065664,2015-04-15T04:08:36Z,"If gentrification is when techies move in & force out the artisans, what is it called when the VCs move in & startups can't afford the rent?",FALSE,TRUE,NA,NA
Greg Mulholland 🧪,588191008195772416,2015-04-15T04:03:59Z,Musings about joining as the first woman at a science startup from @c_hartman1://t.co/cdmINGYHHQ,FALSE,TRUE,NA,NA
Greg Mulholland 🧪,587555245040898049,2015-04-13T09:57:41Z,One word: #datageddon @SiliconHBO. Big data becomes a TV storyline.,FALSE,TRUE,NA,datageddon
Greg Mulholland 🧪,585816511052263425,2015-04-08T14:48:34Z,"Given my feedly feed today, I would guess the Apple Watch embargo was just lifted.",FALSE,FALSE,NA,NA
Greg Mulholland 🧪,585182713704947713,2015-04-06T20:50:05Z,@GregMulholland1 @JL_998 absolutely! Haven't lost the taste for real ale since I lived there and was a card carrying CAMRA member.,FALSE,FALSE,28543847,NA
Greg Mulholland 🧪,585180858601967616,2015-04-06T20:42:43Z,"Guys, aluminum batteries//t.co/UIFkf2P9zU",FALSE,TRUE,NA,NA
Greg Mulholland 🧪,585180334095892480,2015-04-06T20:40:38Z,@JL_998 you give me too much credit. It was @GregMulholland1 that saved the pubs! Important cultural institution - and delicious beer.,FALSE,FALSE,1071633122,NA
Greg Mulholland 🧪,584587452515422208,2015-04-05T05:24:44Z,"@saketvora yeah, but Kentucky made terrible decisions down the stretch. Can't blame officiating for airball 3 from 5 ft beyond the arc.",FALSE,FALSE,14211517,NA
Greg Mulholland 🧪,583278963071455234,2015-04-01T14:45:16Z,Is twitter going to be a key app for the Apple Watch? Seems like tweets are perfect length for watch face.,FALSE,FALSE,NA,NA
Greg Mulholland 🧪,582981352980627456,2015-03-31T19:02:40Z,"@fredwilson @pmarca @rkarmani @rabois @joshk never take just 1, risk is being seen as ""owned"" by investor and unable to sell to others",FALSE,FALSE,1000591,NA
Greg Mulholland 🧪,582688778109648896,2015-03-30T23:40:05Z,"Wow, @nprmusic's Austin 100 is excellent. Great tunes of all stripes dancing at my desk all day",FALSE,FALSE,NA,NA
Greg Mulholland 🧪,581960608498593792,2015-03-28T23:26:36Z,"Someone must have moved the @StartupLJackson ai algorithm to a faster cluster because ""he"" has been on fire for the last 48 hours",FALSE,FALSE,NA,NA
Greg Mulholland 🧪,581866110993174529,2015-03-28T17:11:06Z,@ianbremmer @nickkristof Don't forget the first stop for a wave of international water crises,FALSE,FALSE,60783724,NA
Greg Mulholland 🧪,581864954287915008,2015-03-28T17:06:30Z,@gregmulholland1 Hope you do. I can get behind most of the issues you support I see come up on here. Huge fan of real ale and rugby,FALSE,FALSE,28543847,NA
Greg Mulholland 🧪,581621726884188160,2015-03-28T01:00:00Z,@GregMulholland1 no problem! One of these days I am going to find myself back in London and take you up on that pint though!,FALSE,FALSE,28543847,NA
Greg Mulholland 🧪,581091463515250689,2015-03-26T13:52:55Z,"Awesome from the New Yorker. ""These beans are magic my boy, their value comes from growth, not revenue.""//t.co/3rLRgnVGn8",FALSE,TRUE,NA,NA
Greg Mulholland 🧪,581091317393952768,2015-03-26T13:52:20Z,Grandfathered unlimited data plans are better than rent-controlled apartments.,FALSE,TRUE,NA,NA
Greg Mulholland 🧪,580220739883696128,2015-03-24T04:12:59Z,Ran across this online. Materials are awesome!//t.co/bykeLUlCD7,FALSE,FALSE,NA,NA
Greg Mulholland 🧪,579874796906754049,2015-03-23T05:18:19Z,Interesting: Deep Learning vs Machine Learning vs Pattern Recognition//t.co/rz9KZnZ1Uo,FALSE,FALSE,NA,NA
Greg Mulholland 🧪,579660649954856960,2015-03-22T15:07:23Z,"NC State has now beaten Duke, UNC and a 1-seed this season. The last time Wolfpack pulled that off, it won the national title (1983).",FALSE,TRUE,NA,NA
Greg Mulholland 🧪,579455620551593985,2015-03-22T01:32:40Z,Hell yes Pack!!!!,FALSE,FALSE,NA,NA
Greg Mulholland 🧪,579453003977003009,2015-03-22T01:22:16Z,Let's do this pack!!!!//t.co/BrMsPQrcIK,FALSE,FALSE,NA,NA
Greg Mulholland 🧪,578560817924304896,2015-03-19T14:17:02Z,Malcom Gladwell on Entrepreneurs' Surprising Source of Courage//t.co/31R1UPqcAI,FALSE,FALSE,NA,NA
Greg Mulholland 🧪,578222944465215488,2015-03-18T15:54:27Z,Citrine CEO @brycemeredig's second blog post on machine learning for materials scientists://t.co/yN7ClQdlFp,FALSE,TRUE,NA,NA
Greg Mulholland 🧪,577636389048713218,2015-03-17T01:03:41Z,@gregmulholland @triketora: .@WalterIsaacson: vision without execution is hallucination #sxsw,FALSE,TRUE,NA,sxsw
Greg Mulholland 🧪,577294426566836224,2015-03-16T02:24:51Z,Great time at SXSW. Good to get a reprieve from all the tech talk at home though...oh wait.,FALSE,FALSE,NA,NA
Greg Mulholland 🧪,577232341992517634,2015-03-15T22:18:09Z,Alright @ncstate Wolfpack. Let's do this. First up: LSU.,FALSE,FALSE,NA,NA
Greg Mulholland 🧪,576849047295639552,2015-03-14T20:55:04Z,"OH @ sxsw ""you can be the opposite of what you are within yourself"". What the heck?",FALSE,FALSE,NA,NA
Greg Mulholland 🧪,576495244377661441,2015-03-13T21:29:11Z,Tim Cook and Jeff Williams both have MBAs and worked at IBM. Turns out it's not just college dropouts that run big businesses.,FALSE,FALSE,NA,NA
Greg Mulholland 🧪,576414170763001856,2015-03-13T16:07:02Z,Really cool breakdown of the #materials processing in the @apple watch.//t.co/0I0YNNPWpO,FALSE,FALSE,NA,materials
Greg Mulholland 🧪,576115192939036672,2015-03-12T20:19:00Z,cc/@bengaddy MT @StanfordBiz: relationship btwn manufacturing & achievements of Athens//t.co/B4ZxlDvlne//t.co/uTXHNNfCrx,FALSE,FALSE,17813899,NA
Greg Mulholland 🧪,576032332773109760,2015-03-12T14:49:44Z,"Hey @marketplaceAPM, loved the story last night including metallurgy. Want more materials? Reach out to me and my colleagues at @Citrine_io",FALSE,FALSE,NA,NA
Greg Mulholland 🧪,576028848833212416,2015-03-12T14:35:54Z,"Ellen Williams: ""I lived the digital revolution and sawhow it's completely changed what we can do and research.""//t.co/961nsIuNGW",FALSE,FALSE,NA,NA
Greg Mulholland 🧪,575850315573919744,2015-03-12T02:46:28Z,"Tomorrow, we are all NC State fans.",FALSE,TRUE,NA,NA
Greg Mulholland 🧪,575849285083779072,2015-03-12T02:42:22Z,"@StanfordBiz but don't expect answers, only more questions",FALSE,FALSE,17813899,NA
Greg Mulholland 🧪,575815674162987008,2015-03-12T00:28:49Z,One of the best parts of my job: my coworkers regularly surprise me with an elegant implementation of something I thought impossible.,FALSE,FALSE,NA,NA
