name,status_id,created_at,text,is_quote,is_retweet,reply_to_user_id,hashtags
Greg Mulholland 🧪,1012264484629442560,2018-06-28T09:20:34Z,"Idea for #openscience community, let's start with something simple: put a synopsis of results in your abstract, not just a justification of the question. Helps me to decide whether to pursue finding an open version of an article.",FALSE,FALSE,NA,openscience
Greg Mulholland 🧪,1012254345671237637,2018-06-28T08:40:17Z,Many CEOs and Chairpeople from some of the world's largest materials companies together in beautiful Nancy for the World Materials Forum. Honored to be here to see and contribute to the future of materials innovation on behalf of @Citrine_io//t.co/Q1q8rB3BL5,FALSE,FALSE,NA,NA
Greg Mulholland 🧪,1012230337953333250,2018-06-28T07:04:53Z,Jack Dorsey privately met with Trump aides in DC to apologize for the platform's liberal bias while the family separation horror at the border was unfolding. He lacks judgement.//t.co/J4cs96gd75,FALSE,TRUE,NA,NA
Greg Mulholland 🧪,1012230320353992704,2018-06-28T07:04:49Z,"Twitter employees can and should demand better governance, whether through an ombudsperson or user advocate, advisory board, employee union, or all of the above. At the very least, Twitter needs a full-time CEO who can run Nazis off the platform, not a half-time celebrity chaser.",FALSE,TRUE,NA,NA
Greg Mulholland 🧪,1012230013087694848,2018-06-28T07:03:36Z,Congrats to the @DCVC founders & teams recognized named as 2018 @wef Tech Pioneers! @plentyfarms (transformative solutions for global food security) & @primer_ai (massive augmentation of human IQ). //t.co/CxtV43Bq04,FALSE,TRUE,NA,NA
Greg Mulholland 🧪,1011965723592351744,2018-06-27T13:33:24Z,Team @Citrine_io is proud to be honored with a 2018 #ArtificialIntelligence Breakthrough Award #AI #materials #machinelearning //t.co/rUcAYHF66H//t.co/P6qrFe4Zka,FALSE,TRUE,NA,ArtificialIntelligence
Greg Mulholland 🧪,1011965723592351744,2018-06-27T13:33:24Z,Team @Citrine_io is proud to be honored with a 2018 #ArtificialIntelligence Breakthrough Award #AI #materials #machinelearning //t.co/rUcAYHF66H//t.co/P6qrFe4Zka,FALSE,TRUE,NA,AI
Greg Mulholland 🧪,1011965723592351744,2018-06-27T13:33:24Z,Team @Citrine_io is proud to be honored with a 2018 #ArtificialIntelligence Breakthrough Award #AI #materials #machinelearning //t.co/rUcAYHF66H//t.co/P6qrFe4Zka,FALSE,TRUE,NA,materials
Greg Mulholland 🧪,1011912643706159104,2018-06-27T10:02:29Z,"Excited and honored to arrive in Paris, and onward to Nancy, to represent @Citrine_io at the FORAM pilot event and World Materials Forum//t.co/pTOquazFCO",FALSE,FALSE,NA,NA
Greg Mulholland 🧪,1011590381773905921,2018-06-26T12:41:56Z,"@Citrine_io @samcharrington @untone_v @BenedictEvans @twimlai @gjmulholland Haven't seen the existence of God emerge, but we definitely find that integrating physics and chemistry is critical to helping the system understand a world with too many degreees of freedom and too little data",FALSE,FALSE,2616421753,NA
Greg Mulholland 🧪,1011356473274785792,2018-06-25T21:12:27Z,"Our partner @Citrine_io recently announced an exciting collaboration with @BASF. Together, they're using #AI to accelerate development of new environmental catalyst technologies and ensure a #sustainable future for all of us.//t.co/2JZYxUkNmu//t.co/0WuEyxDy2g",FALSE,TRUE,NA,AI
Greg Mulholland 🧪,1010894028290715648,2018-06-24T14:34:52Z,@dwallerstein Informatics and @Citrine_io are going to break open new frontiers here too!,FALSE,FALSE,7886202,NA
Greg Mulholland 🧪,1010787024456962053,2018-06-24T07:29:40Z,"More pressure than ever before growing for new, green materials. Good people like @MJMulvihill trying to solve the problem before it grows worse.//t.co/KDjMu8nZAE",FALSE,FALSE,NA,NA
Greg Mulholland 🧪,1010551690133508096,2018-06-23T15:54:32Z,"At @Citrine_io we celebrate diversity, teamwork and respect for all. Happy #Pride2018//t.co/j7sGD9RdT3",FALSE,TRUE,NA,Pride2018
Greg Mulholland 🧪,1010547476489691137,2018-06-23T15:37:48Z,Congrats @facebook on your exciting new partnership with @FoxNews!//t.co/So6oc7BRyo,FALSE,TRUE,NA,NA
Greg Mulholland 🧪,1010544282493571072,2018-06-23T15:25:06Z,Who made this? ......//t.co/TgTiYBpMMy,FALSE,TRUE,NA,NA
Greg Mulholland 🧪,1010544186808913923,2018-06-23T15:24:43Z,This is outrageous. Essentially this out of control agency is harassing US citizens with a demand of Papers please! . If this happens to me I will resist. I will not cooperate. No US citizen should. This authoritarian agency should be ended and begin anew.//t.co/ibmmXpylk2,FALSE,TRUE,NA,NA
Greg Mulholland 🧪,1010421662557167621,2018-06-23T07:17:51Z,NewswireToday / BASF and Citrine Informatics Collaborate to Use Artificial Intelligence to Develop New Catalyst Technology #BASFCorporation #Citrine_io #ArtificialIntelligence -//t.co/NswXZn4DUf,FALSE,TRUE,NA,NA
Greg Mulholland 🧪,1010262313000026112,2018-06-22T20:44:39Z,I just had a member of @chase Auto Finance customer service tell me they are unable to send emails. We do not have email here. So much about caring about your customers. This is 2018.,FALSE,FALSE,NA,NA
Greg Mulholland 🧪,1010254117225164800,2018-06-22T20:12:05Z,Support a free and open internet. Support Net Neutrality in CA.//t.co/m5iF9XYdRv,FALSE,FALSE,NA,NA
Greg Mulholland 🧪,1010040054222225409,2018-06-22T06:01:29Z,"Materials problems rising more and more to the fore of next gen products. Want an AI system to assist in developing next gen advanced materials (incl better batteries, alloys, plastics, etc.) @elonmusk? Talk to us at @Citrine_io//t.co/2Wiobb2mNJ",FALSE,FALSE,NA,NA
Greg Mulholland 🧪,1010015773828399104,2018-06-22T04:25:00Z,Great job to the @Citrine_io team and their relationship with @BASF - well done!//t.co/3grvRRCuft,FALSE,TRUE,NA,NA
Greg Mulholland 🧪,1009920950467321856,2018-06-21T22:08:12Z,//t.co/rUpD1VXWe0,FALSE,FALSE,NA,NA
Greg Mulholland 🧪,1009795386326769664,2018-06-21T13:49:15Z,#BASF and @Citrine_io are #collaborating to use #artificial #intelligence to speed the development of #environmental #catalyst #technology. Interested in learning more? Click here to read our press release://t.co/0vQxdDr3l5//t.co/eKTID0rT6d,FALSE,TRUE,NA,BASF
Greg Mulholland 🧪,1009795386326769664,2018-06-21T13:49:15Z,#BASF and @Citrine_io are #collaborating to use #artificial #intelligence to speed the development of #environmental #catalyst #technology. Interested in learning more? Click here to read our press release://t.co/0vQxdDr3l5//t.co/eKTID0rT6d,FALSE,TRUE,NA,collaborating
Greg Mulholland 🧪,1009795386326769664,2018-06-21T13:49:15Z,#BASF and @Citrine_io are #collaborating to use #artificial #intelligence to speed the development of #environmental #catalyst #technology. Interested in learning more? Click here to read our press release://t.co/0vQxdDr3l5//t.co/eKTID0rT6d,FALSE,TRUE,NA,artificial
Greg Mulholland 🧪,1009795386326769664,2018-06-21T13:49:15Z,#BASF and @Citrine_io are #collaborating to use #artificial #intelligence to speed the development of #environmental #catalyst #technology. Interested in learning more? Click here to read our press release://t.co/0vQxdDr3l5//t.co/eKTID0rT6d,FALSE,TRUE,NA,intelligence
Greg Mulholland 🧪,1009795386326769664,2018-06-21T13:49:15Z,#BASF and @Citrine_io are #collaborating to use #artificial #intelligence to speed the development of #environmental #catalyst #technology. Interested in learning more? Click here to read our press release://t.co/0vQxdDr3l5//t.co/eKTID0rT6d,FALSE,TRUE,NA,environmental
Greg Mulholland 🧪,1009580688272605184,2018-06-20T23:36:07Z,"In Austin, Texas you can watch JAWS while floating in an inner tube on a lake.//t.co/4YuLxGQnkK//t.co/B6rSXZr4hU",FALSE,TRUE,NA,NA
Greg Mulholland 🧪,1009412361734668288,2018-06-20T12:27:15Z,Lawyers and medical providers who have visited the Rio Grande Valley shelters described play rooms of crying preschool-age children in crisis.//t.co/rKMcUu0Mne,FALSE,TRUE,NA,NA
Greg Mulholland 🧪,1009289885956521985,2018-06-20T04:20:35Z,"Trump is lying, obfuscating and inventing his own version of reality more frequently - a period that began post-Cohen raid but which intensified in recent days, via @AshleyRParker//t.co/dAyKJv9yrY",FALSE,TRUE,NA,NA
Greg Mulholland 🧪,1009288265390645249,2018-06-20T04:14:08Z,"what we're doing yes, we, if you're an American is irreparable harm, first to these children and their families, and secondly to our nation and our souls//t.co/Cb9EirCIkf",FALSE,TRUE,NA,NA
Greg Mulholland 🧪,1009118820160569344,2018-06-19T17:00:49Z,"The lies. The dictator adoration. The bigotry. The lawlessness. The indecency. The corruption. The forced separation of families and the caging of children. This is Trumpism and it is evil. It's destructive to people, to the Republican Party and, most importantly, to our country.",FALSE,TRUE,NA,NA
Greg Mulholland 🧪,1009118750535106560,2018-06-19T17:00:33Z,Shout out to my dear friend @Alfredijohns0n who took his frustration from Trump's election and channeled it into the technology layer that will fight back in November. @LetsMobilizeUS//t.co/OR0OZX72wk,FALSE,TRUE,NA,NA
Greg Mulholland 🧪,1008941361553289217,2018-06-19T05:15:40Z,The act of separating families at the border is inhumane and un-American. We cannot let this continue. We need our government to address immigration in a compassionate and scalable way *now*.,FALSE,TRUE,NA,NA
Greg Mulholland 🧪,1006554185523793921,2018-06-12T15:09:53Z,"Meet Prof Judith MacManus-Driscoll, master of Materials @Cambridge_Uni. Driscoll has heaps of patents for high-temperature superconductors and has won s from @PhysicsNews, @RAEngNews, @iom3 and @IEEEorg. New @Wikipedia page://t.co/pk2BNh17GH #womeninstem//t.co/fsCk347s3L",FALSE,TRUE,NA,NA
Greg Mulholland 🧪,1006554166397825026,2018-06-12T15:09:48Z,"@jesswade @Cambridge_Uni @PhysicsNews @RAEngNews @iom3 @IEEEorg @Wikipedia @WikiWomenInRed @WES1919 @camawise I was extremely lucky to study under Judith. Her scientific accomplishments are amazing, her contibutions to the community are huge, and her mentorship shaped my career and many others.",FALSE,FALSE,20904490,NA
Greg Mulholland 🧪,1006334895478620160,2018-06-12T00:38:30Z,".@gregmulholland, co-founder of @Citrine_io was interviewed on the This Week in Machine Learning (@twimlai ) podcast recently about #MachineLearning for #MaterialsScience//t.co/W09hQfIQ8r The #DoD agencies are also interested in ML & AI for #materials & system integration",FALSE,TRUE,NA,NA
Greg Mulholland 🧪,1006310557438205952,2018-06-11T23:01:47Z,"CEOs of big companies are more focused on digital transformation than ever. To revolutionize materials and chemicals development, come talk to our team at @Citrine_io//t.co/GwTyFcR88z",FALSE,FALSE,NA,NA
Greg Mulholland 🧪,1006266367010430979,2018-06-11T20:06:12Z,"The burgeoning field of materials informatics is transforming how we discover #materials. As @Citrine_io NextGen fellows, these @UWMadison engineering undergrads are developing critical skills that will give them an edge in their careers.//t.co/2f58UsQyC4//t.co/nVOhBLLD26",FALSE,TRUE,NA,materials
Greg Mulholland 🧪,1006266344436686849,2018-06-11T20:06:06Z,Team @Citrine_io is proud to train the next generation of materials informatics professionals. Thanks @SchmidtFutures and @NSF //t.co/5APa0UkrkD,FALSE,TRUE,NA,NA
Greg Mulholland 🧪,1004918275694723072,2018-06-08T02:49:22Z,"@twimlai @gjmulholland Check out our CEO (@gregmulholland, the other account is deprecated) on @twimlai!",FALSE,TRUE,NA,NA
Greg Mulholland 🧪,1004918263426322432,2018-06-08T02:49:19Z,"New Show Alert! Today we're joined by @gjmulholland, Founder and CEO of @Citrine_io, a company melding AI, physics and chemistry to aid in the discovery and development of new materials. Head over to//t.co/vMEsvQ6f3f to listen!//t.co/naXZQYPv4r",FALSE,TRUE,NA,NA
Greg Mulholland 🧪,1004588327608115200,2018-06-07T04:58:16Z,Great talk from Max Hutchinson of @Citrine_io at #MLSE2018//t.co/B4J0YAi89y,FALSE,TRUE,NA,MLSE2018
Greg Mulholland 🧪,1004588293659320321,2018-06-07T04:58:08Z,Max Hutchinson @Citrine_io on extrapolation to new materials discovery. Still tricky! #mlse2018//t.co/Ux1C93wAig,FALSE,TRUE,NA,mlse2018
Greg Mulholland 🧪,1004567446764699648,2018-06-07T03:35:17Z,Very excited to kick off #CitrineNextGen today! Welcome class of 2018! Special thanks to @SLAClab for a great tour and @Stanford for hosting the @Citrine_io NextGen data bootcamp.//t.co/HWhrMcCeMF,FALSE,TRUE,NA,CitrineNextGen
Greg Mulholland 🧪,1004049221727604736,2018-06-05T17:16:03Z,Very excited to see our partner and investor @iendeavors announce a big new fund to accelerate the #SuperEvolution of industry!//t.co/J73WKhi9py,FALSE,FALSE,NA,SuperEvolution
Greg Mulholland 🧪,1003840056908378112,2018-06-05T03:24:54Z,"Silica content is the be all, end all of volcanoes. High silica = more viscous & cooler = traps gas = explosive eruptions & steep conical volcanoes. Low silica = less viscous & hotter = has escapes = effusive eruptions & gentle shield volcanoes.//t.co/wxtkoI3gLf",FALSE,TRUE,NA,NA
Greg Mulholland 🧪,1003382844524118017,2018-06-03T21:08:06Z,"When an ad is targeted to you based on multiple attributes, Facebook's ad explanation shows the attributes that match the most users. That means you get the least useful explanation possible. Paper://t.co/EfsUsz7iS1//t.co/81lZbI1Dkn",FALSE,TRUE,NA,NA
Greg Mulholland 🧪,1002771795894628353,2018-06-02T04:40:01Z,Tomorrow is the 33rd section of General Management at Harrison Metal. Want to join a future section? We've got em through end of the year! //t.co/VNLQE6MAqN,FALSE,TRUE,NA,NA
Greg Mulholland 🧪,1002376674418176000,2018-06-01T02:29:57Z,"@kimbal The World Cup is awesome, but the US missing the cut this year is a huge, ~10 year, hit to the sport in this country.",FALSE,FALSE,4767021,NA
Greg Mulholland 🧪,1002376364652036096,2018-06-01T02:28:43Z,"In 5th grade, I participated in ExploraVision. We proposed powering cars with lasers (& clean centralized energy) and lost. The team that won proposed a pen that could write in any color.//t.co/dBm2WgvxPT Adults are bad at futurism.",FALSE,FALSE,NA,NA
Greg Mulholland 🧪,1002347814548979712,2018-06-01T00:35:16Z,"Mathematician 1: My favourite number is pi, as it explains the circle Mathematician 2: My favourite number is e, as it explains the exponential function Engineer: Yeah my favourite number is also 3",FALSE,TRUE,NA,NA
Greg Mulholland 🧪,1000891051224150016,2018-05-28T00:06:36Z,How many machine learning researchers does it take to screw in a light bulb? 1 and 500 billion well-labelled examples.,FALSE,TRUE,NA,NA
Greg Mulholland 🧪,1000806207358042112,2018-05-27T18:29:28Z,@mims I have to think @fscottmoody would have a perspective on this given his exposure at @K4Connect to elderly populations,FALSE,FALSE,1769191,NA
Greg Mulholland 🧪,1000779014410190848,2018-05-27T16:41:25Z,"The whole scientific community should feel shame for letting these geniuses be robbed of recognition. I still tell people: if you want to feel inadequate, read the Wiki article on Lise Meitner. //t.co/B4KzpeP6dW",FALSE,FALSE,NA,NA
Greg Mulholland 🧪,1000402499004645376,2018-05-26T15:45:16Z,AI and robotics-driven farming from @dcvc company @plentyfarms yields incredible kale and arugula and tasty Board meetings.//t.co/EfX0SZbwFh,FALSE,TRUE,NA,NA
Greg Mulholland 🧪,1000194099306053633,2018-05-26T01:57:10Z,"Two great opportunities in edtech! @EmCollective's ed tech team is hiring two new team members, an Investment Analyst and a Portfolio Operations Associate. Find out more info about these roles here://t.co/sgY8dQcbmr",FALSE,TRUE,NA,NA
Greg Mulholland 🧪,1000137055878299650,2018-05-25T22:10:30Z,#GDPR //t.co/zakcUzToxd//t.co/y4n93cqskQ,FALSE,TRUE,NA,GDPR
Greg Mulholland 🧪,999402054773653504,2018-05-23T21:29:52Z,"About that @elonmusk ""yellow in the factory"" thing: a founder can say something offhand which can easily get converted into a mandate that spreads through the company, while not being so. Silicon Valley's ""The bear is sticky"" bit lampooned this issue well//t.co/W4B3YisSmL.",FALSE,TRUE,NA,NA
Greg Mulholland 🧪,997159678390910976,2018-05-17T16:59:28Z,"On the one-year anniversary of Robert Mueller's appointment, here's how Trump-Russia compares to the length of prior investigations. //t.co/aKnzNMgBOc//t.co/0IogRGc1r6",FALSE,TRUE,NA,NA
Greg Mulholland 🧪,995476813659820033,2018-05-13T01:32:22Z,Read my open letter about female coaches in @PlayersTribune. //t.co/246QFIVh7R,FALSE,TRUE,NA,NA
Greg Mulholland 🧪,994825614669512706,2018-05-11T06:24:44Z,"Love this quote. It's been on my fridge for years, and I see it every time I open the door. #Emerson//t.co/kN8HjM4bOI",FALSE,TRUE,NA,Emerson
Greg Mulholland 🧪,993279771030179840,2018-05-07T00:02:06Z,Me when I realized that gambino's dance moves distracted me from all the craziness happening in the background and that's exactly the point he's trying to make... #ThisIsAmerica//t.co/ZlMxE2VwZV,FALSE,TRUE,NA,NA
Greg Mulholland 🧪,992304046194049025,2018-05-04T07:24:55Z,When you and your colleague both have solutions to the problem and you're both kind of right but both kind of wrong//t.co/vXN5iUkAtF,FALSE,TRUE,NA,NA
Greg Mulholland 🧪,992127347657662464,2018-05-03T19:42:47Z,"@sacca Recently, I was confronted with the following question from a 6-year-old: How did people access the internet before there were computers ...",FALSE,TRUE,NA,NA
Greg Mulholland 🧪,991683060432158722,2018-05-02T14:17:20Z,Hard to overstate how important materials breakthroughs are//t.co/KPIhW4zqVb,FALSE,FALSE,NA,NA
Greg Mulholland 🧪,990613262688337920,2018-04-29T15:26:21Z,On the way to @NCState @NCStateEngr to talk about @NSF sponsored SEAS traineeship for data-driven materials research,FALSE,TRUE,NA,NA
Greg Mulholland 🧪,990424686239498241,2018-04-29T02:57:01Z,"@shivon If you really want your mind blown, read Vannevar Bush's As We May Think and JCR Licklider's Man-Computer Symbiosis",FALSE,FALSE,446719282,NA
Greg Mulholland 🧪,990380328995905536,2018-04-29T00:00:45Z,for less than $40 $75 is too much for a high volume adapter,FALSE,FALSE,14214459,NA
Greg Mulholland 🧪,990379974094798848,2018-04-28T23:59:20Z,"Someone needs to build the mobile presenter USB-C adapter: 1 HDMI, 1 VGA, 1 USB-A. I'd buy them for every one of my sales/BD/support/cust service people. Tired of carrying and losing separate adapters for each or not having the right one",FALSE,FALSE,NA,NA
Greg Mulholland 🧪,990061930055270400,2018-04-28T02:55:33Z,"Gmorning This feeling will pass. This workload will pass. These people will pass. But look at you, with the gift of memory. You can time travel to the good stuff just by closing your eyes & breathing. Then come right back to now, eyes up for the good stuff ahead. You magic thing.",FALSE,TRUE,NA,NA
Greg Mulholland 🧪,989701529673187328,2018-04-27T03:03:27Z,@PaulLomax This is what is known as an abundance economy,FALSE,FALSE,790734,NA
Greg Mulholland 🧪,989687579350941696,2018-04-27T02:08:01Z,@ironmantimholme @JeffDean @samcharrington @twimlai @ironmantimholme ML+Materials is what we do. Happy to share more if of interestfeel free to DM me and we can connect!,FALSE,FALSE,137747957,NA
Greg Mulholland 🧪,989560424700887040,2018-04-26T17:42:45Z,The most unbelievable aspect of the Star Trek universe is that every ship they meet has compatible video conferencing facilities,FALSE,TRUE,NA,NA
Greg Mulholland 🧪,988679553282326528,2018-04-24T07:22:28Z,What five words best describe programming?,FALSE,TRUE,NA,NA
Greg Mulholland 🧪,988638433538015232,2018-04-24T04:39:05Z,A. B. C.//t.co/MhO2OAYt20,FALSE,TRUE,NA,NA
Greg Mulholland 🧪,988349899056992256,2018-04-23T09:32:33Z,"Never have I been so comfortable asking for help or directions than I am with station agents in Japan. Knowledgeable, professional, helpful",FALSE,FALSE,NA,NA
Greg Mulholland 🧪,988326270818598913,2018-04-23T07:58:39Z,"@Reza_Zadeh For things easily verifiable, this might be true. For higher stakes models, I disagree. Right/left hand is one thing, why the system thinks I have cancer or why the robot should shoot the suspect is different. We see often the human failure modes in those today",FALSE,FALSE,92839676,NA
Greg Mulholland 🧪,988174611647873024,2018-04-22T21:56:01Z,An excellent overview of what blockchain is actually good for. tl;dr: It's not literally everything.//t.co/9IZa1vIL7E,FALSE,FALSE,NA,NA
Greg Mulholland 🧪,988011209017384967,2018-04-22T11:06:43Z,A reconstruction of Sri Lanka's descent into violence...found that Facebook's newsfeed played a central role in nearly every step from rumor to killing. //t.co/zY2Zaam3ak,FALSE,TRUE,NA,NA
Greg Mulholland 🧪,987735232999772160,2018-04-21T16:50:05Z,It has long been said that the man or woman who gets to write the front-page heads for the NYC tabloids has the most fun in journalism. But whomsoever has control of the daily Edmonton Journal weather story is third.//t.co/x8CnHo1AUV,FALSE,TRUE,NA,NA
Greg Mulholland 🧪,987711542824140802,2018-04-21T15:15:57Z,"1/ Writing is thinking is my favorite saying in how to work in a company. It is very interesting to dive into this a bit because I often get so much pushback, especially from startups and/or those focused on agility.",FALSE,TRUE,NA,NA
Greg Mulholland 🧪,987241436734279680,2018-04-20T08:07:55Z,Engine producer looks to cut product development time by 25% with metal Additive Manufacturing//t.co/4N78KgMfSm @DesktopMetal #3dprinting,FALSE,TRUE,NA,NA
Greg Mulholland 🧪,987038688344408064,2018-04-19T18:42:16Z,Do you know how a PCB is made? Go inside the fab and see how @CircuitClassics were manufactured://t.co/8se82eEkmA proud of this collaboration with @digikey and @bayareacircuits (fab photos by Noel Von Joo),FALSE,TRUE,NA,NA
Greg Mulholland 🧪,986356490297532418,2018-04-17T21:31:27Z,Thanks @taylordsparks for a great lecture! Happy to have you at the @coschoolofmines! #MIDDMI//t.co/oewV9P9KzC,FALSE,TRUE,NA,MIDDMI
Greg Mulholland 🧪,984978378095714305,2018-04-14T02:15:20Z,Proud to be working with @SLAClab on this project and others!//t.co/S9aFV2sesm,FALSE,TRUE,NA,NA
Greg Mulholland 🧪,984885537713537024,2018-04-13T20:06:25Z,Just published: Scientists Use #MachineLearning to Speed Discovery of Metallic Glass -//t.co/GhAB3yiKZx @usnistgov @NorthwesternU @Citrine_io @Stanford @doescience @SSRLnews (@ScienceAdvances -//t.co/I0al7QCwGr)//t.co/c2Ck7AjYeS,FALSE,TRUE,NA,MachineLearning
Greg Mulholland 🧪,984453413835436034,2018-04-12T15:29:18Z,"ICYMI, I'm the subject of the new season of @podcaststartup, and yesterday the trailer was dropped. They're following me as I raise and manage a venture capital fund from the ground up, as a Black, gay woman with no industry background. Tears? Youbetya://t.co/U86JgnwFPk",FALSE,TRUE,NA,NA
Greg Mulholland 🧪,983899563424497664,2018-04-11T02:48:30Z,"100 percent untrue unless you want to roll out the tired old people can't turn on a computer trope. Otherwise, I find regular people of all ages very savvy about technology and their use of it. These were profoundly useless questions by the senators.//t.co/YveNcEQ3PD",FALSE,TRUE,NA,NA
Greg Mulholland 🧪,983373853987450881,2018-04-09T15:59:31Z,So much innovation historically so much more to come using AI methods in glass. A material that is everywhere but most people look right through it://t.co/8StjucEduP,FALSE,TRUE,NA,NA
Greg Mulholland 🧪,982505071995858944,2018-04-07T06:27:17Z,"Enjoyed the very successful (and first annual!) 2018 Workshop on Machine Learning in Materials Science, organized by @taylordsparks & @BrgochChemistry and hosted by @UUtah",FALSE,TRUE,NA,NA
Greg Mulholland 🧪,982261098840641538,2018-04-06T14:17:50Z,"A tip to VCs who are doing outreach: put how big your fund is and the rounds you target in your email and on your website. I get that spray and pray can create dealflow, but let's not waste each other's time",FALSE,FALSE,NA,NA
Greg Mulholland 🧪,982136172435537924,2018-04-06T06:01:25Z,"We have a conference room at @Citrine_io named after her and I always tell guests when they ask who she was: if you ever think you are talented or accomplished enough, just read the Wikipedia page about Lise Meitner to see true accomplishment...overlooked only bc of her gender//t.co/jvXLEigqB0",TRUE,FALSE,NA,NA
Greg Mulholland 🧪,982135252951875585,2018-04-06T05:57:46Z,"Meitner was nominated for the Nobel Prize at least 48* times without winning. *29x for Physics, 19x for Chemistry in 1925-1965, records incomplete post-1963, eligible until death in 1968://t.co/qvxm9Gxo0U//t.co/e9dzho91MA",FALSE,TRUE,NA,NA
Greg Mulholland 🧪,982040374829969408,2018-04-05T23:40:45Z,Jeez. Electric scooters got really popular all of a sudden.,FALSE,FALSE,NA,NA
Greg Mulholland 🧪,981758307605012480,2018-04-05T04:59:55Z,thread.//t.co/PqUaxfp9Pm,FALSE,TRUE,NA,NA
Greg Mulholland 🧪,981405460321439744,2018-04-04T05:37:50Z,"i asked my boyfriend if he knew the difference between an alligator and a crocodile the other day he said no i was so happy to inform him ""one will see you later and the other will see you in awhile"" i know he's a good dude bc he didn't dump me right then and there",FALSE,TRUE,NA,NA
Greg Mulholland 🧪,981153443195715585,2018-04-03T12:56:24Z,"Step 1: You have a problem Step 2: You introduce a blockchain to solve problem Step 3: You now have an incentives problem, a trust distribution problem, a community management problem, a regulation problem, a speculation problem, an upgrade path problem...",FALSE,TRUE,NA,NA
Greg Mulholland 🧪,980492604667183104,2018-04-01T17:10:28Z,"AI is going to change so much in how we do things. Huge impacts being felt in many areas, including materials and chemicals//t.co/CYu8oJszWf",FALSE,TRUE,NA,NA
Greg Mulholland 🧪,980230718625169408,2018-03-31T23:49:49Z,"With everything Trump has done and said, someone wasted ink on this?//t.co/TOUzg0Gt7O",FALSE,FALSE,NA,NA
