name,status_id,created_at,text,is_quote,is_retweet,reply_to_user_id,hashtags
Kaan Terzioğlu,1181495738678808576,2019-10-08T09:05:09Z,@MatsGranryd Thank you @MatsGranryd and the @GSMA team for a very timely event on the impact of #5G and IoT. Wonderful to be in such a great company of leaders.,FALSE,FALSE,4120332556,5G
Kaan Terzioğlu,1181490748572741632,2019-10-08T08:45:20Z,"5G+AI might mean a new industrial revolution; and we, as mobile operators, should be ready for it with customer-focused digital services, business models, and role in ethical use and sustainable development. Thrilled to share some ideas at #m360 Eurasia, organized by the @GSMA.//t.co/rIfSOw2VxJ",FALSE,FALSE,43998737,m360
Kaan Terzioğlu,1181490739588583429,2019-10-08T08:45:18Z,"5G ve yapay zeka, grlmemi boyutlarda bir bymenin yolunu aabilir. letiim irketleri, buna sadece teknolojiyle deil mteri odakl dijital servislerle, i modelleriyle, etik deerleriyle hazr olmal. @GSMA'in dzenledii #m360 Avrasya'ya katlmaktan mutluluk duydum.//t.co/PNcDMOX6Ha",FALSE,FALSE,NA,m360
Kaan Terzioğlu,1181484079734296576,2019-10-08T08:18:50Z,"Operators throughout the world are embracing #digital initiatives and increasing relevance to customers states @Kaan_Terzioglu, Member of Board of Directors, @VEONGroup & @digicelgroup #Mobile360 #Eurasia//t.co/3j0tDzGFOd",FALSE,TRUE,NA,digital
Kaan Terzioğlu,1178603846207180800,2019-09-30T09:33:48Z,"Look forward to speaking at @GSMA's #Mobile360 Eurasia next week in Moscow. We need to focus on not only the technical capabilities we'll attain with #5G but also on how to make #5G matter for the lives of our customes, our economy and the environment.//t.co/WxKHSVJkxn",FALSE,FALSE,43998737,Mobile360
Kaan Terzioğlu,1178603846207180800,2019-09-30T09:33:48Z,"Look forward to speaking at @GSMA's #Mobile360 Eurasia next week in Moscow. We need to focus on not only the technical capabilities we'll attain with #5G but also on how to make #5G matter for the lives of our customes, our economy and the environment.//t.co/WxKHSVJkxn",FALSE,FALSE,43998737,5G
Kaan Terzioğlu,1178603846207180800,2019-09-30T09:33:48Z,"Look forward to speaking at @GSMA's #Mobile360 Eurasia next week in Moscow. We need to focus on not only the technical capabilities we'll attain with #5G but also on how to make #5G matter for the lives of our customes, our economy and the environment.//t.co/WxKHSVJkxn",FALSE,FALSE,43998737,5G
Kaan Terzioğlu,1178603844613365760,2019-09-30T09:33:48Z,"GSMA'in nmzdeki hafta Moskova'da dzenleyecei Mobile360 Avrasya'da gndem 5G. Telekom sektr olarak odamz, 5G'yi mterilerimizin hayatnda fark yaratacak servislere, ekonomik kalknmaya ve daha srdrlebilir i modellerine nasl dntrebileceimiz olmal.",FALSE,FALSE,NA,NA
Kaan Terzioğlu,1178357649328476163,2019-09-29T17:15:31Z,"80% of women on low-and-middle income now have a #mobile phone, showing that the industry is going in the right direction stated @MatsGranryd during the #Digital Technology and Impact on Women' session at the #SDG Media Zone today. #UNGA//t.co/xsAWlgMmgr",FALSE,TRUE,NA,mobile
Kaan Terzioğlu,1176951064173699074,2019-09-25T20:06:15Z,Why Criticism Is Good for Creativity//t.co/ISj3hxZCK7,FALSE,FALSE,NA,NA
Kaan Terzioğlu,1176950870489088002,2019-09-25T20:05:28Z,What Senior Executives Can Do When the Board Meddles//t.co/89u4NyCbgP,FALSE,FALSE,NA,NA
Kaan Terzioğlu,1176488884542300160,2019-09-24T13:29:42Z,The future of education is digital and VEON's determined to play its part. We've set up initiatives to support the @UN's #SDG4 and help students not only navigate but triumph in an increasingly digital world #UNGA74//t.co/Afee7OVIXm,FALSE,TRUE,NA,NA
Kaan Terzioğlu,1176119507372380160,2019-09-23T13:01:56Z,"Liderler daha srdrlebilir bir gelecek iin New York'ta toplanrken, telekom sektr olarak hem kendimizi hem de dier sektrleri dntrmek adna yapabileceklerimiz umut verici - yeter ki bu potansiyeli hakkn verelim.//t.co/6FJNH0kYHN",FALSE,FALSE,43998737,NA
Kaan Terzioğlu,1176110647400120321,2019-09-23T12:26:44Z,"As leaders gather at #UNGA to discuss how to prevent a climate disaster, tune in to @GSMA to hear how telcos transform themselves and other industries for a more sustainable future. Congrats @srichard and @MatsGranryd for your leadership.//t.co/q4jMTf4N30",FALSE,FALSE,NA,UNGA
Kaan Terzioğlu,1175648117879951360,2019-09-22T05:48:48Z,"With the UN General Assembly week around the corner, a timely reminder of what we can do as top executives to lead our companies in ways that deliver value for the society. Proud to be a part of the ""Leaders on Purpose"" by Christa Gyori and her colleagues://t.co/ib4Sngfhh3",FALSE,FALSE,43998737,NA
Kaan Terzioğlu,1175648115589812224,2019-09-22T05:48:47Z,"irketlerimizin sadece karllkta deil toplumsal fayda yaratmada da lider olmas iin almalyz. eitli sektrlerden 31 kresel irketin tepe yneticileriyle grerek hazrlanan ""Ama Sahibi Liderlik"" aratrmasna katlmaktan gurur duydum://t.co/ib4Sngfhh3",FALSE,FALSE,NA,NA
Kaan Terzioğlu,1173272918777896961,2019-09-15T16:30:36Z,Why Fixing Software Bugs Should Be the CEO's Problem//t.co/lfsTPTy8eA,FALSE,FALSE,NA,NA
Kaan Terzioğlu,1172783564536111104,2019-09-14T08:06:05Z,Russian Alfa Bank BaaS platform using Waves blockchain | Cryptopolitan//t.co/e1Wfitzn18,FALSE,FALSE,NA,NA
Kaan Terzioğlu,1172391267386286080,2019-09-13T06:07:14Z,Trk mucidin bastonu ABD'de umut oldu. //t.co/daHxvkgc8J,FALSE,FALSE,NA,NA
Kaan Terzioğlu,1167308954344361984,2019-08-30T05:31:56Z,"30 Austos, tek yrek olduumuzda yenemeyeceimiz hibir zorluun olmadnn kant. Zafer Bayrammz kutluyor, bamszlmz bize hediye eden Gazi Mustafa Kemal Atatrk ve silah arkadalar bata olmak zere, tm gazi ve ehitlerimizi saygyla anyorum.",FALSE,FALSE,NA,NA
Kaan Terzioğlu,1163354172160446465,2019-08-19T07:37:03Z,Delighted to win this award - recognition of the positive impact that our sustainability programme is having in Pakistan and our nine other operating markets.//t.co/ELhAofOrlm,FALSE,TRUE,NA,NA
Kaan Terzioğlu,1163354104749580288,2019-08-19T07:36:47Z,VEON reported a strong first half of 2019 with continuing good operational performance. Full announcement here://t.co/QYrf4OGgGN//t.co/ZsHCIBpRYn,FALSE,TRUE,NA,NA
Kaan Terzioğlu,1162227741711720451,2019-08-16T05:01:01Z,"Wow. FB reminded of our humble start of DQ World 3 years ago. Pilot discussion with kids and teachers. DQ World is now being used in more than 80 countries. We have grown so much and fast for the last 3 years. Thank you, team. Thank you, partners,...//t.co/81TT4e3QFb",FALSE,TRUE,NA,NA
Kaan Terzioğlu,1160412174034132993,2019-08-11T04:46:36Z,"Kurban Bayram'nn lkemiz, milletimiz ve slam Alemi iin hayrlara vesile olmasn diler, herkesin bayramn kutlarm.",FALSE,FALSE,NA,NA
Kaan Terzioğlu,1159783386568908800,2019-08-09T11:08:01Z,"Kaza annda kazay alglayp, ara ierisi ile otomatik olarak iletiime geilmesini ve ihtiya halinde en yakn acil mdahale ekibine durumun bildirilmesini salayan Drivee Safecall Arkovan'nda kitlesel fonlamada desteini bekliyor! @Drivee_io //t.co/uFq04F1Lpr//t.co/6IRiOPoKpS",FALSE,TRUE,NA,NA
Kaan Terzioğlu,1158793335781376000,2019-08-06T17:33:55Z,"The man from Raithane tole of Kathmandu today achieves the CEO Award 2019. He has not only been a businessman. He has always been the reason of happiness to millions of Nepali.Thank you for introducing Nepal and making Nepali proud everytime,sir. Congratulations @BinodKChaudhary//t.co/VbOEQuE4ri",FALSE,TRUE,NA,NA
Kaan Terzioğlu,1158647631410868224,2019-08-06T07:54:56Z,AI IN TELECOMMUNICATIONS: Why carriers could lose out if they don't adopt AI fast and where they can make the biggest gains//t.co/kAcl9WQjhu,FALSE,FALSE,NA,NA
Kaan Terzioğlu,1158440871110598656,2019-08-05T18:13:21Z,Congratulations to my father for getting the CEO Award 2019 amongst the leaders in South Asia. We are extremely as always proud of him. @BinodKChaudhary//t.co/fkQ8ctM0k9,FALSE,TRUE,NA,NA
Kaan Terzioğlu,1156489002893139969,2019-07-31T08:57:19Z,"Dostum Paul Doany ile, verimli ve Trkiye'yi her zaman ileri gtrmeyi hedefleyen bir rekabet ierisinde altk. Bu lkeyle gnl ban bildiim Paul'e, dostluu ve sektre katklar iin teekkr ederim. Trk Telekom'un yeni Genel Mdr mit nal'a baarlar dilerim.",FALSE,FALSE,NA,NA
Kaan Terzioğlu,1155084015566802944,2019-07-27T11:54:24Z,Is your company looking to go public? Need some tools on how to present to investors? Be prepared for those tough questions with #PresentationCoachJerryWeissman #BeSuasiveBeHeard//t.co/435guZJTxB,FALSE,TRUE,NA,NA
Kaan Terzioğlu,1155083739229298688,2019-07-27T11:53:18Z,Discover how mobile #BigData can be used to mitigate the impact of natural disasters by visiting our online toolkit today://t.co/tyfsT4q0I0//t.co/xYDfIf7ynP,FALSE,TRUE,NA,BigData
Kaan Terzioğlu,1155083331228315648,2019-07-27T11:51:41Z,What happens in 1 internet minute?//t.co/J5oVbVuU6r,FALSE,TRUE,NA,NA
Kaan Terzioğlu,1155083237162659843,2019-07-27T11:51:18Z,"We must do much more to reach most discriminated and excluded: migrants, refugees, persons with disabilities and others still left behind,"" -- @AminaJMohammed, Deputy Secretary-General of the United Nations. #HumanRightsForAll//t.co/VBD42bQ4JV",FALSE,TRUE,NA,NA
Kaan Terzioğlu,1153587877906931712,2019-07-23T08:49:17Z,An inspiring partnership between//t.co/8Db6PbNzlL and Digicel in Panama... Messaging apps can be platforms for many forms of interaction with customers as long as we are creative enough to develop the necessary business models: //t.co/JjOr99twVa,FALSE,FALSE,NA,NA
Kaan Terzioğlu,1150624749250387969,2019-07-15T04:34:52Z,"#15Temmuz halkmzn can pahasna devletine ve demokrasisine sahip kt, yakn tarihimizin en nemli zgrlk snavyd. O hain saldrya direnenleri, o direnite ehitlik mertebesine erienleri bu millet unutmayacak. Demokrasimiz gl, birliimiz daim olsun.//t.co/AEpb1s8OTC",FALSE,FALSE,NA,15Temmuz
Kaan Terzioğlu,1148122711857799168,2019-07-08T06:52:40Z,Briefing: WeChat Pay adds offline mobile account top-ups//t.co/7KlTlcQkDd,FALSE,FALSE,NA,NA
Kaan Terzioğlu,1147043404632793088,2019-07-05T07:23:53Z,"To be a digital sovereign power, we need 5G'//t.co/UOHDI2J3LR",FALSE,FALSE,NA,NA
Kaan Terzioğlu,1146318329080098816,2019-07-03T07:22:41Z,"letiim (Haberleme) sektr yllardr Turkiye ekonomisini srtnda tayor, hem dnyadaki en yksek vergi yk stnde hem de enflayonu aaya ekiyor. Halbuki bu sektrn yatrma ve yatrmcya ihtiyac var.//t.co/GvdyinUmbM",FALSE,FALSE,NA,NA
Kaan Terzioğlu,1145002285686231040,2019-06-29T16:13:12Z,"Bu abiyle bir yemekte yanyana dtk. Msr ekmeini uzatr msn? dedi.ay syledik, Trk kahvesi itik. ""Siz hangi firmada idiniz?"" dedim. ""Bosch'daym"" dedi. ""Yabanc bir CEOnuz vard sizin di mi? "" dedim. Evet dedi. Adnz neydi dedim. ""#StevenYoung, Bosch CEO'suyum"" dedi.//t.co/AzRYw5Qr66",FALSE,TRUE,NA,NA
Kaan Terzioğlu,1141310760821383169,2019-06-19T11:44:24Z,.@VEONGroup taps digital nous of former #Turkcell chief @Kaan_Terzioglu//t.co/oHe0MMZV2v//t.co/63jEdJu0xK,FALSE,TRUE,NA,Turkcell
Kaan Terzioğlu,1140999874823036928,2019-06-18T15:09:03Z,"Thrilled to join the Board of Directors of VEON, one of the handful of companies to understand the value of digitalization early on. Look forward to working with an amazing team of leaders.//t.co/SLrliulwpx",FALSE,FALSE,NA,NA
Kaan Terzioğlu,1140362234037768192,2019-06-16T20:55:18Z,"My personal foundation I named after my parents which aims to support education, orphanages, animal shelter and Nepali Music conservation and development No better day to announce it then on Father's Day!//t.co/hwZIm8Sskd",FALSE,TRUE,NA,NA
Kaan Terzioğlu,1138381399302582272,2019-06-11T09:44:10Z,"Kalplerimiz bugn Euro 2020 yolunda zlanda'yla karlaacak olan Milli Takmmzla. Man sahada kazanldn gstereceimiz gn, bugn! #krmzbeyaz",FALSE,FALSE,NA,kırmızıbeyaz
Kaan Terzioğlu,1137650544762347522,2019-06-09T09:20:01Z,CG Group Chairman Binod Chaudhary on transforming Nepal's communications landscape with digital services//t.co/NIOhsi0082,FALSE,FALSE,NA,NA
Kaan Terzioğlu,1136981228794667008,2019-06-07T13:00:23Z,We are so happy to welcome our son Arhaan Binod Chaudhary to this world. Thank you all for your love and blessings. //t.co/exBVKxfHEs,FALSE,TRUE,NA,NA
Kaan Terzioğlu,1135241887466631169,2019-06-02T17:48:52Z,Amazon is reportedly looking into expanding into the telecom industry//t.co/M8qfKCFg70,FALSE,FALSE,NA,NA
Kaan Terzioğlu,1135124507738423297,2019-06-02T10:02:26Z,#MyTwitterAnniversary//t.co/ugF55vARwR,FALSE,FALSE,NA,MyTwitterAnniversary
Kaan Terzioğlu,1134442490663178241,2019-05-31T12:52:21Z,"I am delighted to join Digicel Board, a very vibrant team, at such an exciting time. //t.co/0lxNmkfW7W",FALSE,FALSE,NA,NA
Kaan Terzioğlu,1134352092901072896,2019-05-31T06:53:08Z,Trkiye daha fazla deerini kaybetmesin diye #YoldaykenBraknOTelefonu. Sevdiklerinizle nice bayramlara...//t.co/mKJHiPtDuG,FALSE,TRUE,NA,YoldaykenBırakınOTelefonu
Kaan Terzioğlu,1134351937497964544,2019-05-31T06:52:31Z,"Kadir geceniz mubarek olsun. Bayram yaklayor. Ltfen yoldayken, ara srerken, telefonunuzu kullanmayn, imdiden hepinize mutlu bayramlar. #YoldaykenBraknOTelefonu//t.co/TNVBUBDNVe",FALSE,FALSE,NA,YoldaykenBırakınOTelefonu
Kaan Terzioğlu,1133671948251275265,2019-05-29T09:50:29Z,"Cybersecurity is part of digital operators' core business, and it's time for us to rise to the challenge as trusted guardians of data. Congrats to @GSMA for a very timely #M360 and to Feridun Aktas of @Turkcell for reminding us of a major use-case for AI.//t.co/VkYNFWWFwn",FALSE,FALSE,NA,M360
Kaan Terzioğlu,1132245367075102720,2019-05-25T11:21:46Z,Olmu & 8. sezondaki birok diyalogdan daha iyi.......//t.co/9eKfawBSI7,FALSE,TRUE,NA,NA
Kaan Terzioğlu,1131882352291065857,2019-05-24T11:19:16Z,Congratulations to Hon. Prime Minister Narendra Modi. I have no doubt Nepal- India relations will strengthen under his leadership. @narendramodi @BJP4India//t.co/vHYhHzU5p0,FALSE,TRUE,NA,NA
Kaan Terzioğlu,1129974385291538433,2019-05-19T04:57:42Z,"Bamszlk yrymzn balangcnn 100. ylnda, bata Gazi Mustafa Kemal Atatrk olmak zere tm kahramanlarmz minnetle anyorum. O gnk heyecanla ve bayramz hep en ykseklerde dalgalandrmak idealiyle, #19Mays Atatrk' Anma, Genlik ve Spor Bayrammz kutlu olsun",FALSE,FALSE,NA,19Mayıs
Kaan Terzioğlu,1127538587547971584,2019-05-12T11:38:42Z,"Sevgi, efkat, fedakarlk ve merhametle gelecek nesilleri yetitiren bata ehit anneleri olmak zere btn annelerimizin Anneler Gn'n en iten dileklerimle kutlarm.",FALSE,FALSE,NA,NA
Kaan Terzioğlu,1126741075094265856,2019-05-10T06:49:40Z,"Yerli dijital servisler, yerli arama motoru ve veri merkezlerinin ardndan imdi de yerli ve milli e-posta sistemini hayata geiriyoruz. E-posta servisimizi ilk olarak bnyesinde balatan, 7000 yesiyle @AFADBaskanlik//t.co/J8lrxZXLnr",FALSE,TRUE,NA,NA
Kaan Terzioğlu,1126414675506278400,2019-05-09T09:12:41Z,//t.co/YQEH1xOpFM,FALSE,FALSE,NA,NA
Kaan Terzioğlu,1125095936156368896,2019-05-05T17:52:29Z,"Mbarek Ramazan aynn birlik, beraberlik ve huzur getirmesi dileiyle tm slam Alemi'nin Ramazan ayn en iten dileklerimle kutlarm.//t.co/1WHnrmwItG",FALSE,FALSE,NA,NA
Kaan Terzioğlu,1124933914773065728,2019-05-05T07:08:40Z,"Hakkari ve Suriye'nin Azez Blgesi'nde ehit den kahraman askerlerimize Allah'tan rahmet, kederli ailelerine sabrlar diliyorum. Milletimizin ba saolsun.",FALSE,FALSE,NA,NA
Kaan Terzioğlu,1121650682434478082,2019-04-26T05:42:16Z,Digicel partners with//t.co/BZZZMoXdri to launch it's social media.//t.co/sCSSoEB8Hm,FALSE,FALSE,NA,NA
Kaan Terzioğlu,1121512394272931842,2019-04-25T20:32:46Z,BBC haberinde ekran sresine dikkat ekiyor. ocuklarmzn dijital dnyann gl vatandalar olmalar iin elele vermeliyiz.//t.co/Wj9C551yr9//t.co/S7C1E3V1CC,TRUE,FALSE,NA,NA
Kaan Terzioğlu,1121335806650724352,2019-04-25T08:51:04Z,"Tebrikler Hakan, Tebrikler Arelik.//t.co/AAuIP6fyY2",TRUE,FALSE,NA,NA
Kaan Terzioğlu,1121300532046512128,2019-04-25T06:30:54Z,"In West Africa, #mobile is the primary platform for accessing the #internet. Find more key insights in the new #MobileEconomy #WestAfrica report here://t.co/j7bZA8jOX5//t.co/W6YCnuS7Jc",FALSE,TRUE,NA,mobile
Kaan Terzioğlu,1121300532046512128,2019-04-25T06:30:54Z,"In West Africa, #mobile is the primary platform for accessing the #internet. Find more key insights in the new #MobileEconomy #WestAfrica report here://t.co/j7bZA8jOX5//t.co/W6YCnuS7Jc",FALSE,TRUE,NA,internet
Kaan Terzioğlu,1121300532046512128,2019-04-25T06:30:54Z,"In West Africa, #mobile is the primary platform for accessing the #internet. Find more key insights in the new #MobileEconomy #WestAfrica report here://t.co/j7bZA8jOX5//t.co/W6YCnuS7Jc",FALSE,TRUE,NA,MobileEconomy
Kaan Terzioğlu,1120764594002321410,2019-04-23T19:01:16Z,"What a happy coincidence that Turkey's national day of Children coincide with World Book Day... and our dear @BanaAlabed, a symbol of hope, joins this important campaign by UN Assistant Secretary General @AminaMohammmed//t.co/o2Q27YbNUI",TRUE,FALSE,NA,NA
Kaan Terzioğlu,1120560825473929222,2019-04-23T05:31:34Z,"Mobile technology can play a pivotal role in the #digital transformation of the #PacificIslands, enabling access to life-enhancing services in areas such as health and education. Find out more in the new #MobileEconomy Pacific Islands report here://t.co/slZix2WZJn//t.co/sCMORCbWTR",FALSE,TRUE,NA,digital
Kaan Terzioğlu,1120560825473929222,2019-04-23T05:31:34Z,"Mobile technology can play a pivotal role in the #digital transformation of the #PacificIslands, enabling access to life-enhancing services in areas such as health and education. Find out more in the new #MobileEconomy Pacific Islands report here://t.co/slZix2WZJn//t.co/sCMORCbWTR",FALSE,TRUE,NA,PacificIslands
Kaan Terzioğlu,1120559734552244224,2019-04-23T05:27:14Z,Mustafa Kemal Atatrk'n dedii gibi: ocuklar geleceimizin gvencesi! 23 Nisan Ulusal Egemenlik ve ocuk Bayrammz kutlu olsun! #23Nisan//t.co/JXQrnzwr1Z,FALSE,TRUE,NA,NA
Kaan Terzioğlu,1117331251306946560,2019-04-14T07:38:23Z,Africa's unicorn Jumia lists Friday; shareholder MTN reveals details//t.co/2osYLr1Ham via @cnbcafrica,FALSE,FALSE,NA,NA
Kaan Terzioğlu,1117331198869684224,2019-04-14T07:38:11Z,"Jumia, an African e-commerce company that is backed by MTN is set to launch its IPO on the New York Stock Exchange later today, this could value the firm at $1.6 billion or more. Joining CNBC Africa for more on the Jumia listing is MTN Group CEO, Rob Shuter",FALSE,FALSE,NA,NA
Kaan Terzioğlu,1116944538172633088,2019-04-13T06:01:44Z,Opinion: Belarus is becoming an artificial intelligence hub in the region//t.co/BCvvkGk3CG,FALSE,FALSE,NA,NA
Kaan Terzioğlu,1115884512855113730,2019-04-10T07:49:34Z,Tebrikler Turkcell. Tebrikler Murat. Harika bir Teknoloji Zirvesi olacandan kukum yok. //t.co/3rvyt9aBoH,FALSE,FALSE,NA,NA
Kaan Terzioğlu,1115511631298072576,2019-04-09T07:07:52Z,Clear leadership on a topic that is central to our industry from @MatsGranryd and @DoreenBogdan://t.co/yWPik5wtbX,FALSE,TRUE,NA,NA
Kaan Terzioğlu,1115174928674893824,2019-04-08T08:49:56Z,"The 2019 DQ Global Standards Report is the world's first attempt to define a global standard for digital literacy, skills and readiness across the education and technology sectors. Check out what our Founder, Dr Yuhyun Park, has to say //t.co/N6uzx4CXXB via @bbrief1",FALSE,TRUE,NA,NA
Kaan Terzioğlu,1114091171075194880,2019-04-05T09:03:28Z,"Cihatlarn, Lefterlerin mirasn sonsuzlua tamak iin, geleceimiz iin #FENEROL //t.co/6nbN4laxlR//t.co/bXiaYBZrLU",FALSE,TRUE,NA,FENEROL
Kaan Terzioğlu,1114084982799179776,2019-04-05T08:38:53Z,"Gbekli Tepe is a special place. Dating back 12,000 years, it's a beautiful reminder of what makes humans human. @TurkishAirlines #TurkishAirlines//t.co/YTeBdUa4pI",FALSE,TRUE,NA,NA
Kaan Terzioğlu,1113360578540654593,2019-04-03T08:40:21Z,"Bir kitlesel fonlama hikayesi imdeki Hazine, bir hayalden yola karak hayata geirilen, otizmli ocuklara zel cretsiz eitim uygulamas. 2 Nisan Otizm Farkndalk Gn'nde gel hikayesini dinle, imdeki Hazine uygulamasyla tan! //t.co/Jv5TpjyKUs//t.co/MrQDVGtind",FALSE,TRUE,NA,NA
Kaan Terzioğlu,1111975542453141505,2019-03-30T12:56:43Z,"Mr. @BinodKChaudhary , Chairman, Chaudhary Group addressing the closing session of @investinnepal19 #investinnepal//t.co/R15vQYkzNP",FALSE,TRUE,NA,investinnepal
Kaan Terzioğlu,1111872357751091200,2019-03-30T06:06:42Z,"Gece gndz sizler iin almamzn tek nedeni var: nce mterimiz anlaymz! Yapay zekayla glendirdiimiz ebeke amzla bu lkeye yakan servisi salyoruz. Yurdun drt bir yannda bizimle mzik dinleyen, okuyan, ders alan, iini byten herkes motivasyon kaynamz.",FALSE,TRUE,NA,NA
Kaan Terzioğlu,1111803720633733120,2019-03-30T01:33:57Z,lifecell Ukraine General Manager smet Yazc describes how lifebox has taken up an important role in the lives of its users in the Ukrainian market.//t.co/rKKmXOhH52,FALSE,TRUE,NA,NA
Kaan Terzioğlu,1111140771145482240,2019-03-28T05:39:38Z,"Notably almost half the companies indicated they have, or were planning to, adopt a social purpose as the reason they exist and to build their social purpose into everything the company does. This is the end of CSR and the beginning of business for good.//t.co/qfwbKs4P0K",FALSE,TRUE,NA,NA
Kaan Terzioğlu,1110880310051233792,2019-03-27T12:24:39Z,Keyifli sohbet icin farkli universitelerden katilan tum ogrenci arkadaslarima tesekkur ederim. #BTK #BTKAkademi #BTKariyer #Turkcell//t.co/SaoDTTsoX5,FALSE,TRUE,NA,BTK
Kaan Terzioğlu,1110880310051233792,2019-03-27T12:24:39Z,Keyifli sohbet icin farkli universitelerden katilan tum ogrenci arkadaslarima tesekkur ederim. #BTK #BTKAkademi #BTKariyer #Turkcell//t.co/SaoDTTsoX5,FALSE,TRUE,NA,BTKAkademi
Kaan Terzioğlu,1110880310051233792,2019-03-27T12:24:39Z,Keyifli sohbet icin farkli universitelerden katilan tum ogrenci arkadaslarima tesekkur ederim. #BTK #BTKAkademi #BTKariyer #Turkcell//t.co/SaoDTTsoX5,FALSE,TRUE,NA,BTKariyer
Kaan Terzioğlu,1110879599070568449,2019-03-27T12:21:50Z,"From the advantages and importance of @BiPMobil in the Moldovian market to the customers' interest in digital tariffs, we listen all the latest news from @_Moldcell General Manager Barkn Seen.//t.co/evIRRaXO15",FALSE,TRUE,NA,NA
Kaan Terzioğlu,1110498569406967809,2019-03-26T11:07:45Z,4 myths about manufacturing in the Fourth Industrial Revolution//t.co/CAmfl3GqrB #business #4ir//t.co/FARKWgiyXh,FALSE,TRUE,NA,business
Kaan Terzioğlu,1110498569406967809,2019-03-26T11:07:45Z,4 myths about manufacturing in the Fourth Industrial Revolution//t.co/CAmfl3GqrB #business #4ir//t.co/FARKWgiyXh,FALSE,TRUE,NA,4ir
Kaan Terzioğlu,1110495785454456832,2019-03-26T10:56:41Z,"ocuunuzun hayal gcn gelitirecek ve ona Robotik Dnme becerisi katacak, iinde 11 adet elektronik modl ve 15 rnek deney bulunduran Twin Bilim Seti, Arkovan Maaza'da. Hemen sipari ver! //t.co/zybBN2YmLW//t.co/38Rs0dL0bX",FALSE,TRUE,NA,NA
Kaan Terzioğlu,1110495638708342784,2019-03-26T10:56:06Z,"Dn Apple'n lansmann tm dnya ile birlikte takip ettik. Her yerden TV ve film izlemeyi salayan uygulama ve cihaz, dergi ve gazete okuma platformu ve deme iin kart sistemi aklamalar biraz tandk geldi. Dijital rn ve servisler, tm teknoloji irketlerinin gelecei.",FALSE,TRUE,NA,NA
Kaan Terzioğlu,1110436349503401984,2019-03-26T07:00:31Z,//t.co/WIjV8kyrHY,FALSE,FALSE,NA,NA
Kaan Terzioğlu,1110406679739412481,2019-03-26T05:02:37Z,"Apple Turkcell'in Dergilik, TV+ ve Paycell rnlerinin benzerlerini kard. Yenilikii Yinelikik teyit eder.//t.co/O6U7LZob5Z",FALSE,FALSE,NA,NA
Kaan Terzioğlu,1109725395580911616,2019-03-24T07:55:26Z,"DQ - World's First Global Standards for Digital Literacy, Skills & Readiness. @citylordmayor @cityoflondon @SingtelNews @TmrwInstitute @IowaStateUNews @GESForum @wef @OECDEduSkills @IEEEorg @YuhyunPark_ @VarkeyFdn #DQforAll #GESF #DQGlobalStandard//t.co/UTbowA3iSh",FALSE,TRUE,NA,NA
Kaan Terzioğlu,1109636869732458498,2019-03-24T02:03:40Z,"&gt; [..] Turkey's Turkcell - whose CEO said of Washington's campaign against Huawei: ""This is an insult to our industry. We do know how to run tests and protect our networks, we always have."" Bravo! I'm happy the nasty non-sense is inching to a close.//t.co/YHsqS9PFbS",FALSE,TRUE,NA,NA
Kaan Terzioğlu,1109591241153343488,2019-03-23T23:02:21Z,"Haydi sen de oku! @Dergilik uygulamasnda ""MAD Magazine"" dergisini okuyorum. //t.co/PrlT4FM6UE//t.co/755x8XzxMR",FALSE,FALSE,NA,NA
Kaan Terzioğlu,1109589781611048965,2019-03-23T22:56:33Z,"Haydi sen de oku! @Dergilik uygulamasnda ""Beam Me Up Scotty"" dergisini okuyorum. //t.co/hvTfp6z5CI//t.co/i7y7dgospf",FALSE,FALSE,NA,NA
Kaan Terzioğlu,1109588010037739520,2019-03-23T22:49:31Z,//t.co/TLGwnKcz4O,FALSE,FALSE,NA,NA
Kaan Terzioğlu,1108548889555001345,2019-03-21T02:00:25Z,"Yreimizi paylatmz mterilerimizle bir aileyiz, mterilerimize yreini aan ekibimizle gururlu. 25 yldr dev bir Turkcell ailesi olduk, bunu baaran takm arkadalarm ve her zaman bizimle olan mterilerimize en derin sevgilerimle.//t.co/8qEs0OM141",FALSE,TRUE,NA,NA
Kaan Terzioğlu,1107540074399449088,2019-03-18T07:11:45Z,"104 yl nce yazlan destan anakkale, bugn hala ykselip byyen lkemizin ve hedeflerimizin ilham kayna. ""Geilmez!"" diyenlerin geit vermedii bir milletin evlatlar olmaktan gururluyuz. Bata Gazi Mustafa Kemal Atatrk olmak zere, tm kahramanlarn ruhu ad olsun!//t.co/8uUkph4Pm6",FALSE,FALSE,NA,NA
Kaan Terzioğlu,1106874672988200960,2019-03-16T11:07:41Z,Turtles woke up. Spring is here.//t.co/lZf38eoil9,FALSE,FALSE,NA,NA
Kaan Terzioğlu,1106834575655952385,2019-03-16T08:28:21Z,//t.co/LqAvcYSb2u urges operators to embrace social media//t.co/9LWe5xW1pk//t.co/X73kuNX8ra,FALSE,TRUE,NA,NA
Kaan Terzioğlu,1106599984189853696,2019-03-15T16:56:10Z,My manifest. Manifestom. Well captured.//t.co/fNf9ncGf87,TRUE,FALSE,NA,NA
Kaan Terzioğlu,1106496264986939398,2019-03-15T10:04:01Z,"Bir Turkcell hissedar olarak irketimizin baarlarn yakndan izlemeye devam edeceim. Beraber alma frsat bulduum tm ekip arkadalarma, mterilerimize ve geni Turkcell ailesine teekkr ederim.",FALSE,FALSE,43998737,NA
