name,status_id,created_at,text,is_quote,is_retweet,reply_to_user_id,hashtags
Kaan Terzioğlu,995327010015711232,2018-05-12T15:37:06Z,"Gymnasiade 2018'de, nefes kesen bir mcadele sonucu altn madalya kazanan Milli sporcularmz gnlden tebrik ediyoruz! //t.co/BqLeEvhZwL",FALSE,TRUE,NA,NA
Kaan Terzioğlu,995269378517151745,2018-05-12T11:48:05Z,Ailemizdeki 'Ezberbozan' alanlarmz mterilerimize yeni nesil bir mteri deneyimi sunarak yzleri glmseten hikayeler brakmaya devam ediyorlar.//t.co/oBk4qV8MDy,FALSE,FALSE,NA,NA
Kaan Terzioğlu,994860462864060416,2018-05-11T08:43:12Z,"Trkiye'nin yerli ve milli retimi ile ekonomik bymesi iin byk deer tayan @Abdiibrahimilac'in biyoteknolojik ila retim tesisini, deerli dostum Nezih Barut nezdinde tebrik ediyorum.//t.co/ytkoLtxt99",FALSE,FALSE,NA,NA
Kaan Terzioğlu,994846263815426048,2018-05-11T07:46:47Z,"BiP Srpriz Noktalar Trkiye'nin drt bir yannda kazandrmaya devam ediyor. @BiPMobil kefet alanndan Srpriz Nokta uygulamasna girin, en yaknzdaki hediyeden balayn. Ama nce BiP'i indirin //t.co/zZMnZ0RkaS//t.co/50sFLhen5T",FALSE,FALSE,NA,NA
Kaan Terzioğlu,994833338505613313,2018-05-11T06:55:25Z,Dear Dr Oz it is great to see your support and leadership for WeWalk. Equally excited to see advanced technologies being used first for the ones who need it the most. Thank you.//t.co/VugmJr6AQb,TRUE,FALSE,NA,NA
Kaan Terzioğlu,994797485532033024,2018-05-11T04:32:57Z,"If we want Industry 4.0 to transform the societies, we cannot leave anyone behind, no matter what today's economic feasibilities suggest. As the digital operator, we are honored to support the Turkish Government in taking 4.5G to rural parts of Turkey//t.co/IZQ74rdem0",FALSE,FALSE,NA,NA
Kaan Terzioğlu,994673911416737792,2018-05-10T20:21:55Z,Final manda Ziraat Trkiye Kupas'n kazanan @Akhisarspor'u tebrik ediyorum.//t.co/XQJr9U3jRN,FALSE,FALSE,43998737,NA
Kaan Terzioğlu,994622603477299200,2018-05-10T16:58:02Z,Trkiye Kupas finalinde kar karya gelecek olan @Fenerbahce ve @Akhisarspor 'a baarlar diliyorum.//t.co/sHeef6Klx3,FALSE,FALSE,NA,NA
Kaan Terzioğlu,994607916551417856,2018-05-10T15:59:40Z,//t.co/DYhPGeviQX,FALSE,TRUE,NA,NA
Kaan Terzioğlu,994598315122724865,2018-05-10T15:21:31Z,"Teknoloji gcmzle hayatlara dokunmak, #EngelTanmayanlar' hayata balamak iin alyoruz. #SesliBetimleme #HayalOrtam #EngellilerHaftas//t.co/8PHgTc4yPO",TRUE,FALSE,NA,EngelTanımayanlar
Kaan Terzioğlu,994598315122724865,2018-05-10T15:21:31Z,"Teknoloji gcmzle hayatlara dokunmak, #EngelTanmayanlar' hayata balamak iin alyoruz. #SesliBetimleme #HayalOrtam #EngellilerHaftas//t.co/8PHgTc4yPO",TRUE,FALSE,NA,SesliBetimleme
Kaan Terzioğlu,994598315122724865,2018-05-10T15:21:31Z,"Teknoloji gcmzle hayatlara dokunmak, #EngelTanmayanlar' hayata balamak iin alyoruz. #SesliBetimleme #HayalOrtam #EngellilerHaftas//t.co/8PHgTc4yPO",TRUE,FALSE,NA,HayalOrtağım
Kaan Terzioğlu,994598315122724865,2018-05-10T15:21:31Z,"Teknoloji gcmzle hayatlara dokunmak, #EngelTanmayanlar' hayata balamak iin alyoruz. #SesliBetimleme #HayalOrtam #EngellilerHaftas//t.co/8PHgTc4yPO",TRUE,FALSE,NA,EngellilerHaftası
Kaan Terzioğlu,994581028609150976,2018-05-10T14:12:50Z,"amzn petrol deerinde olan ham datann lkemizde kalmas ve dijital servisler yoluyla ilenmesi byk nem arz ediyor. Glenen Trkiye'nin 80 milyonluk nfusu ile rettii datann deerini biliyor, yatrmlarmz bu dorultuda yapyoruz.//t.co/fNFf4X7kox",FALSE,FALSE,43998737,NA
Kaan Terzioğlu,994545575667421184,2018-05-10T11:51:57Z,"As the world's first digital operator, we follow hundreds of metrics digitally from supply chain to customer preferences. Happy to see that our practices as the digital company has made it to the pages of @MIT s Sloan Management review.",FALSE,FALSE,43998737,NA
Kaan Terzioğlu,994545573100474368,2018-05-10T11:51:57Z,"Dnyann ilk dijital operatr olarak tedarik zincirimizden mteri tercihlerine kadar, yzlerce metrii dijital olarak takip ediyoruz. Dnyada ilkler arasnda yer alan bu uygulamamzn, bir @MIT yayn Sloan Management Review'da yer almas gurur verici.//t.co/HzE44H44KX",FALSE,FALSE,NA,NA
Kaan Terzioğlu,994499319184199681,2018-05-10T08:48:09Z,".@BTKgovtr Merkez Yerlekesi'nde @PaulDoany, Colman Deegan ve Cenk en ile Celalettin Diner moderatrlnde bilgi gvenlii ve datann deerini konutuk, lkemizin gelecei iin atmamz gereken adm ve dikkat etmemiz gerekenleri paylatk.//t.co/UZazpsghS0",FALSE,FALSE,NA,NA
Kaan Terzioğlu,994225539786444800,2018-05-09T14:40:15Z,Trk Kltr'nn gelecek nesillere aktarlmas ok nemli. Bu amala dzenlenen @Etnospor Kltr Festivali'ni destekliyor ve dzenlenmesinde emei geen herkese teekkr ediyorum. //t.co/6dBmACWy90,TRUE,FALSE,NA,NA
Kaan Terzioğlu,994209851252314113,2018-05-09T13:37:54Z,"Diyarbakr'da iletiim merkezlerimizi ziyaret ederek, onlarn gr ve yorumlarn aldk. Trkiye'nin drt bir kesinde Turkcell'in glen yz olan temsilcilerimizle bir araya gelmeye devam edeceiz.//t.co/Jzghjkd6oL",FALSE,FALSE,NA,NA
Kaan Terzioğlu,994181046735441921,2018-05-09T11:43:27Z,Kaan Terziolu: Diyarbakr'a 450 Milyon TL'lik Katk Yaptk//t.co/GS3XSn1N8c @elif_saygilier @Kaan_terzioglu @turkcell,FALSE,TRUE,NA,NA
Kaan Terzioğlu,994141655681859584,2018-05-09T09:06:55Z,"2008'den bu yana hizmet verdiimiz, Diyarbakr'n en byk ivereni konumunda olan Diyarbakr ar Merkezi'nin 10. yln kutluyoruz. 12.000'den fazla mteri temsilcimizin hizmet verdii bir merkez olan Global Bilgi ile Trkiye'nin istihdamna katkda bulunmaya devam edeceiz.//t.co/mD49KyBaD5",FALSE,FALSE,NA,NA
Kaan Terzioğlu,993864519024857094,2018-05-08T14:45:41Z,Converge! Network Digest: Turkcell deploys nationally-produced ULAK base station://t.co/bFDGB80yf8,FALSE,FALSE,NA,NA
Kaan Terzioğlu,993864515828830209,2018-05-08T14:45:40Z,Turkcell to bring 4.5G to rural Anatolia//t.co/qZ4DOQRe0A,FALSE,FALSE,NA,NA
Kaan Terzioğlu,993844247651594240,2018-05-08T13:25:08Z,"Turkcell Genel Mdr Sn. Kaan TERZOLU ve Beraberindeki Ynetici Heyeti Azim Ticaret A.. Maazasna Ziyarette Bulundu. Ziyarette Azim Ticeret'in stikrarl Baarlarndan Sz Eden Terziolu, Azim Ticaret A.. Yn. Kur. Bk. Sn. Aziz ELK'i ve Ynetimini Tebrik Etti. #Turkcell//t.co/wI90SP3Ksm",FALSE,TRUE,NA,NA
Kaan Terzioğlu,993804218262786049,2018-05-08T10:46:04Z,@azimticaret Nice 40 yllara. Baarlarnzn devamn dilerim.,FALSE,FALSE,574860261,NA
Kaan Terzioğlu,993802874059722753,2018-05-08T10:40:43Z,"letiim merkezlerimiz, mterilerimize en yakn olduumuz zm ve destek noktalarmz. Elaz'da onlar yerinde ziyaret etmek ve geri bildirimlerini paylamak bu nedenle ok deerli.//t.co/ihSJyEhqBW",FALSE,FALSE,NA,NA
Kaan Terzioğlu,993769207975333888,2018-05-08T08:26:57Z,"Turkcell olarak eitime olan desteimizi Trkiye genelinde srdrmeye devam ediyoruz. Kurduumuz teknoloji snf ile Elaz me Ky rencileri, hayallerini daha da byterek geree dntrecek.//t.co/Mp20K9WQd7",FALSE,FALSE,NA,NA
Kaan Terzioğlu,993571790860488706,2018-05-07T19:22:29Z,ampiyonlarmzn yarna kaytsz kalamazdk. Trk sporu sizinle gurur duyuyor! @mizginay1157 @ramil_guliyev //t.co/W6SsUGhuy1,FALSE,TRUE,NA,NA
Kaan Terzioğlu,993477126044225536,2018-05-07T13:06:19Z,.@albarakacomtr Genel Mdr @meliksahutku ile #AlbarakaDijitalKltrSohbetleri kapsamnda dijital dnm ve irketlerin dijitallemesi zerine konutuk. Kendilerine ev sahiplii yaptklar bu gzel etkinlik ve keyifli sohbetleri iin teekkr ederim.//t.co/0Hv5olMFrV,TRUE,FALSE,NA,AlbarakaDijitalKültürSohbetleri
Kaan Terzioğlu,992787012200615936,2018-05-05T15:24:03Z,"Bahar mjdeleyen #Hdrellez 'in salk, bereket ve mutluluk getirmesi dileiyle.",FALSE,FALSE,NA,Hıdırellez
Kaan Terzioğlu,992718612870901761,2018-05-05T10:52:15Z,"Park yeri alanlarnn ihlal edilmesini nlemek zere tasarlanan Freepark, @arikovanicom da fonlamaya ald. Freepark Bireysel uygulamas ile srcler, akll uygulama ve sensrler sayesinde sahip olduklar park yerini koruyabilecek. Desteklemek iin //t.co/SuqPO0rynr//t.co/RHDot4Ew2K",FALSE,FALSE,NA,NA
Kaan Terzioğlu,992481617833799680,2018-05-04T19:10:31Z,"Biliyoruz ki her tabelann altnda bir hikaye, bin bir emek yatyor. ine gnlden balananlarn her zaman yannda olmaya devam edeceiz. #teDestekteTurkcell//t.co/9D6Bt2K8F7",TRUE,FALSE,NA,İşteDestekİşteTurkcell
Kaan Terzioğlu,992373729937281024,2018-05-04T12:01:49Z,"Last year, I was honored to be chosen as one of the #SDGPioneers private sector leaders who help advance human development through responsible business. This year let's help UN @globalcompact find the next group of SDG leaders to achieve #GlobalGoals//t.co/mEbLB2Psr9",FALSE,FALSE,43998737,SDGPioneers
Kaan Terzioğlu,992373729937281024,2018-05-04T12:01:49Z,"Last year, I was honored to be chosen as one of the #SDGPioneers private sector leaders who help advance human development through responsible business. This year let's help UN @globalcompact find the next group of SDG leaders to achieve #GlobalGoals//t.co/mEbLB2Psr9",FALSE,FALSE,43998737,GlobalGoals
Kaan Terzioğlu,992373727651299329,2018-05-04T12:01:48Z,"Geen yl yesi olmaktan mutluluk duyduum insan odakl kalknmaya destek veren zel sektr liderleri grubu #SDGPioneers, BM @globalcompact ile bu yln liderlerini aryor. Bu listede bu yl da bir Trk irketini grmekten mutluluk duyacam.//t.co/mEbLB2Psr9 #GlobalGoals",FALSE,FALSE,NA,SDGPioneers
Kaan Terzioğlu,992373727651299329,2018-05-04T12:01:48Z,"Geen yl yesi olmaktan mutluluk duyduum insan odakl kalknmaya destek veren zel sektr liderleri grubu #SDGPioneers, BM @globalcompact ile bu yln liderlerini aryor. Bu listede bu yl da bir Trk irketini grmekten mutluluk duyacam.//t.co/mEbLB2Psr9 #GlobalGoals",FALSE,FALSE,NA,GlobalGoals
Kaan Terzioğlu,992071719174189057,2018-05-03T16:01:44Z,"Finans hizmetlerimize imdi n demeli Paycell Kart' ve uygulamasn ekledik. Gvenli alveri ve frsatlar iin @Paycell hesaplarn takip edin, Paycell uygulamasn indirin://t.co/u5OejLpC2U//t.co/BPR4uBdu3n",TRUE,FALSE,NA,NA
Kaan Terzioğlu,991984058468065280,2018-05-03T10:13:24Z,WhatsApp yeni zelliini Turkcell BiP'ten mi ald?//t.co/QkkBVVNw7I @shiftdeletenet araclyla,FALSE,FALSE,NA,NA
Kaan Terzioğlu,991687473376976896,2018-05-02T14:34:52Z,#Trkiye. #Bugn. #imdi. dediimiz #TeknolojiZirvesi'nin en nemli anlarn @dergilik'te okuyabileceiniz #TeknolojiZirvesi zel saysyla hatrlyoruz.//t.co/3t959qQ0M5,FALSE,FALSE,NA,Türkiye
Kaan Terzioğlu,991687473376976896,2018-05-02T14:34:52Z,#Trkiye. #Bugn. #imdi. dediimiz #TeknolojiZirvesi'nin en nemli anlarn @dergilik'te okuyabileceiniz #TeknolojiZirvesi zel saysyla hatrlyoruz.//t.co/3t959qQ0M5,FALSE,FALSE,NA,Bugün
Kaan Terzioğlu,991687473376976896,2018-05-02T14:34:52Z,#Trkiye. #Bugn. #imdi. dediimiz #TeknolojiZirvesi'nin en nemli anlarn @dergilik'te okuyabileceiniz #TeknolojiZirvesi zel saysyla hatrlyoruz.//t.co/3t959qQ0M5,FALSE,FALSE,NA,Şimdi
Kaan Terzioğlu,991687473376976896,2018-05-02T14:34:52Z,#Trkiye. #Bugn. #imdi. dediimiz #TeknolojiZirvesi'nin en nemli anlarn @dergilik'te okuyabileceiniz #TeknolojiZirvesi zel saysyla hatrlyoruz.//t.co/3t959qQ0M5,FALSE,FALSE,NA,TeknolojiZirvesi
Kaan Terzioğlu,991687473376976896,2018-05-02T14:34:52Z,#Trkiye. #Bugn. #imdi. dediimiz #TeknolojiZirvesi'nin en nemli anlarn @dergilik'te okuyabileceiniz #TeknolojiZirvesi zel saysyla hatrlyoruz.//t.co/3t959qQ0M5,FALSE,FALSE,NA,TeknolojiZirvesi
Kaan Terzioğlu,991657487337185280,2018-05-02T12:35:43Z,"Yabanc uygulamalar bizi takip etmeye devam ederken, siz onlarn yeni gncellemelerini beklemeyin, BiP indirin. //t.co/zZMnZ0RkaS //t.co/SlUffgT8lo",FALSE,FALSE,NA,NA
Kaan Terzioğlu,991212515882348545,2018-05-01T07:07:34Z,"1 Mays Emek ve Dayanma Gnmzn huzur iinde ve bayram havasnda kutlanmasn umut ediyor, Trkiye'nin bymesine aln terini katan tm ii kardelerimizin bu vesileyle bayramn tebrik ediyorum.",FALSE,FALSE,NA,NA
Kaan Terzioğlu,990858916895522817,2018-04-30T07:42:29Z,"Bu mbarek gecenin lkemize, slam alemi ve tm insanla huzur, mutluluk ve hayrlar getirmesini Yce Rabbimden dilerim. Berat Kandiliniz mbarek olsun.//t.co/GVCVl2W036",FALSE,FALSE,NA,NA
Kaan Terzioğlu,990843724228947968,2018-04-30T06:42:07Z,".@fizy 21. Liseler Aras Mzik Yarmas, keyifli bir finalle sona erdi. Kazananlar ve tm detaylar fizy LMY zel saysnda //t.co/SyhFOA9jbb//t.co/MPrvlsl37G",FALSE,FALSE,NA,NA
Kaan Terzioğlu,990823567741865985,2018-04-30T05:22:01Z,T-Mobile and Sprint confirm US mega deal - Mobile World Live//t.co/JQD8TYfvns,FALSE,FALSE,NA,NA
Kaan Terzioğlu,990615846010654720,2018-04-29T15:36:37Z,Spor Toto 1. Lig'de ampiyon olan aykur Rizespor'u ve 2. olan Ankaragc'n kutluyor bugn oynanacak derbide @GalatasaraySK ve @Besiktas'a baarlar diliyorum.,FALSE,FALSE,NA,NA
Kaan Terzioğlu,990594892027039744,2018-04-29T14:13:21Z,"Bir am aacm var. Tam yirmibe yanda. Ad gibi Lal. Duymaz, Konumaz. Ama grr hereyi. En tepeden.",FALSE,FALSE,43998737,NA
Kaan Terzioğlu,990579598114148353,2018-04-29T13:12:34Z,Trkiye'nin en byk mzik organizasyonlarndan 21. @fizy Liseler Aras Mzik Yarmas sona erdi. cra dal birincisi Karabk Safranbolu Gzel Sanatlar Lisesi oldu! Finalde muhteem performanslar sergileyen btn yetenekli gen mzisyenlerimizi tebrik ederiz. #fizyLMY//t.co/Z5eIKysiAx,FALSE,TRUE,NA,NA
Kaan Terzioğlu,990504240899649536,2018-04-29T08:13:08Z,"Kksz bir am dalyd diktiimde. 25 yl sonra tipik bir ada am olmu. Tutmaz deseler bile, dikin.//t.co/7WO2xRMg4z",FALSE,FALSE,NA,NA
Kaan Terzioğlu,990482364852768769,2018-04-29T06:46:12Z,"Turkcell'in ana sponsoru olduu Turkcell Sesi Grenler Futbol Ligi'nde 2018 sezonu heyecan balyor. 8 takmn mcadele edecei ligde ampiyon, 29 Eyll 2018'de belli olacak.//t.co/3MuopEoFFQ",TRUE,FALSE,NA,NA
Kaan Terzioğlu,990308607483961347,2018-04-28T19:15:45Z,21. @fizy Liseler Aras Mzik Yarmas'nn kazanan Karabk Safranbolu Gzel Sanatlar Lisesi oldu. Finalde harika performanslar sunan btn gen mzisyenleri tebrik ederim. Kalbinizin sesini dinlemeye devam ettike ok gzel yerlere geleceinizden hi phem yok. #fizyLMY//t.co/Sy6CPXflCt,FALSE,FALSE,NA,fizyLMY
Kaan Terzioğlu,990177315517804544,2018-04-28T10:34:03Z,"#imdi kota derdi olmadan internetin tadn karma vakti! Snrsz video, dizi, film izleme keyfi k hznda Turkcell Fiber'le evinizde! Hemen arayn, gelip balayalm.//t.co/qfObGNGKOc//t.co/i54xWWmGCp",FALSE,TRUE,NA,Şimdi
Kaan Terzioğlu,990170047699148802,2018-04-28T10:05:10Z,21. fizy Liseler Aras Mzik Yarmas'nn finali balad. Yetenekli mzisyenlerimize baarlar diliyorum. Harika final performanslarn @fizy uygulamasndan ve @TurkcellTVPlus ta Life+ kanalndan canl olarak izleyebilirsiniz. #fizyLMY//t.co/xDvumKqUjw,FALSE,FALSE,NA,fizyLMY
Kaan Terzioğlu,989800396460838912,2018-04-27T09:36:18Z,Trkiye'nin ilk uan baz istasyonu Dronecell ile Trkiye'de bir ilke daha imza atmann hakl gururunu ve sevincini yayoruz. Dronecell doal afetlerde ve acil durumlarda iletiim destei salarken ayn zamanda 4.5G hizmeti sunacak.//t.co/nx7RuMLBeW,TRUE,FALSE,NA,NA
Kaan Terzioğlu,989792308605353984,2018-04-27T09:04:10Z,Turkcell'den uan baz istasyonu//t.co/TnqNNwiX2a,FALSE,FALSE,NA,NA
Kaan Terzioğlu,989786513406865408,2018-04-27T08:41:08Z,Yaklak 1 ay nce BiP zerinden yaptmz bu grntl konumayla Ukrayna'da 4.5G dnemini balatmtk. Bugn Kiev'de lifecell'i bizzat deneyimleme frsat buldum. Ukrayna'da 4.5G'yi hayata geiren ilk ve tek operatr olan lifecell'i bir kez daha tebrik ediyorum.//t.co/lbsC9sfE0D,FALSE,FALSE,NA,NA
Kaan Terzioğlu,989485878270717953,2018-04-26T12:46:31Z,nceliimiz toplumun her kesiminde frsat eitlii ve eriilebilirlik salamak. Hayal Ortam uygulamamzla sesli betimlemeyi tm TV ve sinemalarda yaygnlatrmak iin @seslibetimleme1 ile birlikte seferberlik balatyoruz.//t.co/ww5qAZmKVY//t.co/fQE2iCk0Y6,FALSE,FALSE,NA,NA
Kaan Terzioğlu,989467975626444801,2018-04-26T11:35:23Z,Yerli arama motoru artk web'de!//t.co/bBNi9QbHty @Haberturk araclyla,FALSE,FALSE,NA,NA
Kaan Terzioğlu,989443748714205184,2018-04-26T09:59:07Z,Yerli ve milli arama motorumuz Yaani artk masastnde. //t.co/OznLlV2TNk//t.co/a8TbgwpBgJ,TRUE,FALSE,NA,NA
Kaan Terzioğlu,989425164881362945,2018-04-26T08:45:16Z,//t.co/SklIlm0VEH,FALSE,FALSE,NA,NA
Kaan Terzioğlu,989411400333316096,2018-04-26T07:50:34Z,"ehir dna kan ev arkadan faturalar demeyi unuttuysa ve sen odalarda ksz kaldysan, sana en yakn fatura deme merkezlerini bulma yntemini adm adm anlatyoruz.//t.co/NriktVZQdH",FALSE,TRUE,NA,NA
Kaan Terzioğlu,989411281668059136,2018-04-26T07:50:06Z,"Radyonun banda istediin ark ksn diye beklediin gnleri arasan bulamazsn, ama arasan en sevdiin arklar alan radyo istasyonlar Yaaniden karna kar.//t.co/NEYmXbxdoA",FALSE,TRUE,NA,NA
Kaan Terzioğlu,989410265883168768,2018-04-26T07:46:04Z,//t.co/OznLlV2TNk Trkiyenin arama motoru artk webde de hizmetinizde.//t.co/oaTVO3YwKJ,FALSE,FALSE,NA,NA
Kaan Terzioğlu,989408104528916480,2018-04-26T07:37:29Z,//t.co/DEjmEKmqzk,FALSE,FALSE,NA,NA
Kaan Terzioğlu,989214970687709185,2018-04-25T18:50:02Z,Jack Ma Says Nations Need Own Tech to Sidestep U.S. Control//t.co/YpWpKw5bJt @YahooFinance araclyla,FALSE,FALSE,NA,NA
Kaan Terzioğlu,989208815399776256,2018-04-25T18:25:34Z,UNESCO calling for feedback on guidelines for digital inclusion and as @Turkcell we are supporting it by heart!//t.co/Y9vHJrXo7V @unesco @rewritinglives,FALSE,TRUE,NA,NA
Kaan Terzioğlu,989073663587741697,2018-04-25T09:28:32Z,Yerli yemek kart geliyor//t.co/SuKk97GwXi,FALSE,FALSE,NA,NA
Kaan Terzioğlu,989072933963423746,2018-04-25T09:25:38Z,Just announced our results for Q1'2018. Our strong performance brought 17.5% YoY increase in revenues and 48% two-year cumulative growth. Our Group EBITDA is up 44.4% YoY with an EBITDA margin of 42.5%. This is the result of our successful digital strategy.//t.co/Csa2gNz3Nz,FALSE,FALSE,NA,NA
Kaan Terzioğlu,989060592123211776,2018-04-25T08:36:35Z,"eyrek sonularmzla 2018'e gzel bir balang yaptk. Gelirlerimizdeki %17.5 yllk art, bize 2 ylda toplam %48'lik kmlatif byme getirdi. FAVK'mz ylda %44.4 artt, FAVK marjmz %42.5'a ulat. Bu; baarl dijital stratejimizin bir sonucu.//t.co/4rEYRoTyXA",FALSE,FALSE,NA,NA
Kaan Terzioğlu,988838273777881093,2018-04-24T17:53:10Z,"Gen mzisyenler, siz yeter ki kendinize inann! 28 Nisan'da harika final performanslarnz dinlemeyi heyecanla bekliyorum. #fizyLMY//t.co/rHQH0JIe6X",TRUE,FALSE,NA,fizyLMY
Kaan Terzioğlu,988434750271574018,2018-04-23T15:09:43Z,"#Mardin, #Midyat #Sivrice Ky rencileri robot yapyor... #23NisanKutluOlsun //t.co/MZTmSy4Tkp",FALSE,TRUE,NA,Mardin
Kaan Terzioğlu,988434750271574018,2018-04-23T15:09:43Z,"#Mardin, #Midyat #Sivrice Ky rencileri robot yapyor... #23NisanKutluOlsun //t.co/MZTmSy4Tkp",FALSE,TRUE,NA,Midyat
Kaan Terzioğlu,988434750271574018,2018-04-23T15:09:43Z,"#Mardin, #Midyat #Sivrice Ky rencileri robot yapyor... #23NisanKutluOlsun //t.co/MZTmSy4Tkp",FALSE,TRUE,NA,Sivrice
Kaan Terzioğlu,988434750271574018,2018-04-23T15:09:43Z,"#Mardin, #Midyat #Sivrice Ky rencileri robot yapyor... #23NisanKutluOlsun //t.co/MZTmSy4Tkp",FALSE,TRUE,NA,23NisanKutluOlsun
Kaan Terzioğlu,988362724395700224,2018-04-23T10:23:31Z,"ocuklarmzn harika resimlerinden, iirlerinden, hikayelerinden oluan @dergilik 23 Nisan zel dergisini hayranlkla okudum. Hayal gcnz ve yaratclnz asla kaybetmeyin ocuklar! Hepinizin #23Nisan Ulusal Egemenlik ve ocuk Bayramn en iten dileklerimle kutlarm.//t.co/HK38tFjkoH",FALSE,FALSE,NA,23Nisan
Kaan Terzioğlu,988274661594148864,2018-04-23T04:33:35Z,"TBMM'nin kuruluunun 98. yl dnmnde Gazi Mustafa Kemal Atatrk' rahmet ve saygyla anyor, tm ocuklarmzn 23 Nisan Ulusal Egemenlik ve ocuk Bayram'n kutluyorum.//t.co/nPY6WsCSBT",FALSE,FALSE,NA,NA
Kaan Terzioğlu,988009080655695872,2018-04-22T10:58:15Z,Gelecek vaat eden giriimcileri yatrmclarla buluturan The Pitcher dlleri'nde @arikovanicom zel dl'n Octovan kazand. Arkovan'nda kitlesel fonlamaya da sunulacak projenin hayata gemesi iin ilk siparii Turkcell olarak verdik.//t.co/VjX9wGFjKJ//t.co/8M6KwUpCvx,FALSE,FALSE,NA,NA
Kaan Terzioğlu,987700830307577856,2018-04-21T14:33:23Z,"nternetin sonsuz dnyasnda dilediin gibi izlemek, dinlemek, elenmek iin Lifecell'lilere katl! //t.co/BSTIU2xx0M//t.co/ZejgdVbLxz",FALSE,TRUE,NA,NA
Kaan Terzioğlu,987666752103505921,2018-04-21T12:17:58Z,".@1920yesilay tarafndan, Sayn Cumhurbakanmz Recep Tayyip Erdoan'n himayesinde dzenlenen 5. #Zmrdanka dlleri'nde, ""Sosyal Sorumluluk"" kategorisinde layk grldmz dl, Turkcell adna Pazarlamadan Sorumlu Genel Mdr Yardmcmz @ismail_butun ald. #EnYeilayc//t.co/43KfihjDXc",FALSE,TRUE,NA,Zümrüdüanka
Kaan Terzioğlu,987617465176862720,2018-04-21T09:02:07Z,"Trkiye'nin dijital operatr olarak kurumlarn dijital dnm srelerini kolaylatrmay hedefliyoruz. e-irket platformumuz sayesinde muhasebe, fatura, ariv, faks gibi evrak yk oluturan ilemlerinizi kolayca dijitalletirebilirsiniz.//t.co/kvHiks0cUh//t.co/Fng8BjgvQL",FALSE,FALSE,NA,NA
Kaan Terzioğlu,987591908942807040,2018-04-21T07:20:34Z,"Hayal Ortam uygulamas ile grme engelliler iin sesli betimlenen ehirlere Alamad: Sabahattin Ali'nin ehirleri sergisi, 27 Nisan'a dek ziyaretileri arlayacak.//t.co/GHNNY6DfQu",TRUE,FALSE,NA,NA
Kaan Terzioğlu,987573692153679878,2018-04-21T06:08:11Z,Forgot about this interview done a bit while ago. Good to see it is now published. Thanks to the Impact journal. #DQEveryChild//t.co/17CpHYoGxl,FALSE,TRUE,NA,NA
Kaan Terzioğlu,987329707405344769,2018-04-20T13:58:40Z,Just had the opportunity to join @EricssonMEA Leaders Summit. Glad to see the enthusiasm that digital transformation generates in the technology ecosystem & look forward to taking our digital model global with our partners.//t.co/x39Tgz3rLI,FALSE,FALSE,NA,NA
Kaan Terzioğlu,987306889158545410,2018-04-20T12:28:00Z,"@Kaan_Terzioglu @YouTube Kaan Bey, Trkiye'de tm irketlerin dijitallemesine imkan verecek byle bir projedeki vizyonunuz ve liderliiniz iin teekkr ederim.",FALSE,TRUE,NA,NA
Kaan Terzioğlu,987191017018359808,2018-04-20T04:47:34Z,Turkcell E-irket'i Hayata Geirdi //t.co/sURz9Pqfi3 //t.co/T5TWKvrTtG @YouTube araclyla,FALSE,FALSE,NA,NA
Kaan Terzioğlu,987035720736038912,2018-04-19T18:30:28Z,"Bosch Trkiye'nin dzenledii Digital Transformation Summit'te dijital operatr hikayemizi paylatk ve bu srete gelitirerek dnyaya atmz, byk beeni toplayan rn ve servislerimizin bir gsterimini sunduk.//t.co/3IuDVt0fU0",FALSE,FALSE,NA,NA
Kaan Terzioğlu,987027120885989378,2018-04-19T17:56:18Z,//t.co/F26TEgIMG0,FALSE,FALSE,NA,NA
Kaan Terzioğlu,987001075923345408,2018-04-19T16:12:48Z,"Yln Akll ehir Mobilyas dl @Turkcell - @Verisun ibirliinde Akll Direk : Endirek'in oldu Desteinden dolay Turkcell'e, zverili almalar iin de ekibime teekkr ediyorum @Kaan_Terzioglu @aertopuz @Oturan1982 @erenmustafa #WorldCities2018//t.co/SCI8nPJudE",FALSE,TRUE,NA,NA
Kaan Terzioğlu,986999069116633088,2018-04-19T16:04:50Z,Bu akamki Trkiye Kupas yar final manda @Fenerbahce ve @Besiktas 'a baarlar diliyorum. Her zaman dediimiz gibi dostluk kazansn.//t.co/QfROucSJRM,FALSE,FALSE,NA,NA
Kaan Terzioğlu,986908283230478336,2018-04-19T10:04:05Z,"Turkcell rn ve servisleri, in'in Shenzhen ehrindeki Huawei Genel Merkezi'nde tantlyor. Dnyann ilk dijital operatr olarak @Turkcell teknolojisini dnyaya ayoruz.//t.co/00tQG48Z2J",FALSE,FALSE,NA,NA
Kaan Terzioğlu,986867673677090816,2018-04-19T07:22:43Z,"Teknoloji gcmzle, ""Siz yapamazsnz denileni yapp ryalarn geree, First Lego League yarmasnda byk dle dntren Sivrice Dream'in her zaman yanndayz. Artk Zeka Kp laboratuvarmz ile daha byk hayaller kurup gelecee daha da umutla bakabilecekler.//t.co/AYeRsI85dd",TRUE,FALSE,NA,NA
Kaan Terzioğlu,986836721382903809,2018-04-19T05:19:43Z,France will move gov officials off Telegram and WhatsApp over spying fears//t.co/G4S9PvIGYW,FALSE,FALSE,NA,NA
Kaan Terzioğlu,986639809639845888,2018-04-18T16:17:16Z,"Bu akam oynanacak olan Fenerbahe Dou - Baskonia Euroleague play-off ilk manda, @FBBasketbol 'a baarlar diliyorum. #NeverEnough//t.co/6Tw0IDtq3F",FALSE,FALSE,NA,NeverEnough
Kaan Terzioğlu,986596024964861952,2018-04-18T13:23:17Z,Bip artk heryerde. Bip WEB yaynda. //t.co/jACM9e2Ix3,FALSE,FALSE,NA,NA
Kaan Terzioğlu,986529549373583360,2018-04-18T08:59:08Z,"Ulatrma, Denizcilik ve Haberleme Bakanmz Sayn Ahmet Arslan'n yeeni Burcu Arslan'n vefatn derin bir zntyle renmi bulunmaktaym. Merhume Burcu Arslan'a Allah'tan rahmet, Sayn Bakan @AhmetArslan36 ile ailesine basal ve sabr dilerim.",FALSE,FALSE,NA,NA
Kaan Terzioğlu,986505758551441409,2018-04-18T07:24:35Z,"Nefesler tutuldu! @Tarkan, son klibi ""ok Aladm"" ile 19 Nisan'da yalnzca fizy'de! #Tarkanfizyde//t.co/aI7LIGzaeR//t.co/37TLrZSlnf",FALSE,TRUE,NA,Tarkanfizyde
Kaan Terzioğlu,986174362444357632,2018-04-17T09:27:44Z,Sermaye Piyasas Kurulu Bakanl grevine atanan Ali Fuat Takesenliolu'nu tebrik ediyor ve yeni grevinde baarlar diliyorum.,FALSE,FALSE,NA,NA
Kaan Terzioğlu,986137103812702208,2018-04-17T06:59:41Z,Record Breaking Fiber Transmission Speed Reported//t.co/EN2JteurBt,FALSE,FALSE,NA,NA
Kaan Terzioğlu,985939907318337538,2018-04-16T17:56:06Z,Sir Martin's sudden resignation reminds me Steve Jobs getting fired. He was a legend.,FALSE,FALSE,NA,NA
Kaan Terzioğlu,985936848559198208,2018-04-16T17:43:57Z,"Now, with Turkcell and @BiPMobil partnership, Surprise Point is live! Go into Explore section on BiP and visit the Surprise Point; earn incredible gifts from GB to fizy, from Lifebox to Paycell! #imdi//t.co/2vDCe63u5Y",FALSE,TRUE,NA,NA
Kaan Terzioğlu,985523394018979841,2018-04-15T14:21:01Z,The Multi-Billion Dollar Industry That Makes Its Living From Your Data//t.co/9L9iHbLV0x @VisualCap araclyla,FALSE,FALSE,NA,NA
Kaan Terzioğlu,985432734402318336,2018-04-15T08:20:46Z,@BiPMobil Srpriz Nokta ok elenceli. Ulus'taki hediyeyi almaya gidiyorum u an. Bakalm ne kacak @Turkcell @fizy @TurkcellTVPlus @dergilik @YaaniTR #lifebox @lifecell @Kaan_Terzioglu @ismail_butun @Murat__Erkan @gsezgin @banusezen//t.co/stE0Gi9c1p,FALSE,TRUE,NA,NA
Kaan Terzioğlu,985432499894484992,2018-04-15T08:19:51Z,"stanbul Ticaret Odas ynetim kurulu bakanlna seilen ekib Avdagi ile zmir Ticaret Odas ynetim kurulu bakanlna seilen Mahmut zgener ve Ynetim Kurulu yelerini tebrik eder, grevlerinde baarlar dilerim.",FALSE,FALSE,NA,NA
Kaan Terzioğlu,985426639327760384,2018-04-15T07:56:33Z,WeWalk akll baston ile Edison dln alan Vestel ve YGA y gnlden kutluyorum. En iyi teknolojiler en ok ihtiyac olanlar iin kullanlmal.//t.co/YCyghegfzb,FALSE,FALSE,NA,NA
