name,status_id,created_at,text,is_quote,is_retweet,reply_to_user_id,hashtags
Kaan Terzioğlu,910561391152697344,2017-09-20T17:48:47Z,Honoured to join @richardbranson @JochenZeitz & the rest of the B Team to work to achieve the 2030 agenda//t.co/x8IyLM3iLm//t.co/zZeDmnvi8h,FALSE,TRUE,NA,NA
Kaan Terzioğlu,910522613147062273,2017-09-20T15:14:42Z,"Facebook'un alanlarna datt kitabn sayfalarndan: ""Eer Facebook'u yok edecek olan eyi biz yaratmazsak, baka birileri yaratacak.""//t.co/oxqntFN5Of",FALSE,TRUE,NA,NA
Kaan Terzioğlu,910505054364405760,2017-09-20T14:04:55Z,Trk Telekom ve Turkcell dnya devlerini arlyor//t.co/HBG7cGdiIz,FALSE,FALSE,NA,NA
Kaan Terzioğlu,910278792563879936,2017-09-19T23:05:50Z,".@Turkcell created app that gives Syrian #refugees voice-to-voice translation, helps them access services: CEO @Kaan_Terzioglu #ConnectBiz",FALSE,TRUE,NA,refugees
Kaan Terzioğlu,910168613239361536,2017-09-19T15:48:02Z,How do we bridge the digital divide? Tune in for the Internet for All panel at the #WEF Impact Summit in New York.//t.co/LxYmJbLyfe//t.co/3KQ6mOeZYw,FALSE,TRUE,NA,WEF
Kaan Terzioğlu,910103775389667330,2017-09-19T11:30:23Z,Find the latest insights on #mobile's impact against the 17 #SDGs in the 2017 Mobile Industry Impact Report://t.co/XIw9vIH6Iy//t.co/7HgIPf8eXU,FALSE,TRUE,NA,mobile
Kaan Terzioğlu,910103775389667330,2017-09-19T11:30:23Z,Find the latest insights on #mobile's impact against the 17 #SDGs in the 2017 Mobile Industry Impact Report://t.co/XIw9vIH6Iy//t.co/7HgIPf8eXU,FALSE,TRUE,NA,SDGs
Kaan Terzioğlu,909913283813048320,2017-09-18T22:53:26Z,#GSMA DG @MatsGranryd onstage at this evening's @wef Sustainable Development Summit this evening at #UNGA//t.co/n2kmuNXq8V,FALSE,TRUE,NA,GSMA
Kaan Terzioğlu,909913283813048320,2017-09-18T22:53:26Z,#GSMA DG @MatsGranryd onstage at this evening's @wef Sustainable Development Summit this evening at #UNGA//t.co/n2kmuNXq8V,FALSE,TRUE,NA,UNGA
Kaan Terzioğlu,909911119124418560,2017-09-18T22:44:50Z,.@Kaan_Terzioglu opens the Business in SDGs session at #UNGA today and announces the second GSMA Mobile Industry Impact Report//t.co/ArwMIKY6Q0,FALSE,TRUE,NA,UNGA
Kaan Terzioğlu,909838292450988032,2017-09-18T17:55:27Z,The inaugural CEO Roundtable brought responsible CEOs together with UN leadership to discuss opportunities to advance the #GlobalGoals #UNGA//t.co/J6gDLO357P,FALSE,TRUE,NA,NA
Kaan Terzioğlu,909777521633366016,2017-09-18T13:53:58Z,Kicking off the UN Week at the @UN New York Headquarters. Look forward to speaking on how we use technology for humanitarian purposes. #UNGA,FALSE,FALSE,43998737,UNGA
Kaan Terzioğlu,909777355383754752,2017-09-18T13:53:19Z,"Birlemi Milletler Genel Kurul dneminde, teknolojimizi insanln yararna nasl kullandmz anlatmak iin New York'tayz. @UN #UNGA//t.co/ISW3SOjoAx",FALSE,FALSE,NA,UNGA
Kaan Terzioğlu,909663928929660928,2017-09-18T06:22:36Z,"Tm retmenlere, rencilere ve eitim camiasna baarlarla dolu bir eitim-retim yl diliyorum. Teknolojimizle her zaman yannzdayz.",FALSE,FALSE,NA,NA
Kaan Terzioğlu,909499796431482882,2017-09-17T19:30:23Z,"Trk sporu adna yine bir gurur gecesi Alklar, Dnya ampiyonu U23 Voleybol Milli Takmmza! @TVForgtr//t.co/uPBsL7EGrs",TRUE,FALSE,NA,NA
Kaan Terzioğlu,909485502029590529,2017-09-17T18:33:35Z,#AR Artrlm gerekliin oyunlar harici efektif kullanmna rnek: IKEA'dan mobilya almadan nce evinizde deneyin.//t.co/XSi2a5uiyy,FALSE,TRUE,NA,AR
Kaan Terzioğlu,909155419112841216,2017-09-16T20:41:57Z,NYSE : Turkcell leverages technology for education//t.co/4sTjKVSFih,FALSE,FALSE,NA,NA
Kaan Terzioğlu,908695032974241793,2017-09-15T14:12:33Z,Turkcell ve TDMA-OveO''dan ok gzel giriim:Turkcell ve DMA-OveO'dan 'kesintisiz enerji' zm - Ekonomi Haberleri//t.co/eQxmsc0Q6e,FALSE,TRUE,NA,NA
Kaan Terzioğlu,908682967333179393,2017-09-15T13:24:36Z,Londra'da yaanan terr saldrsn knyoruz. Blgedeki mterilerimize acil ihtiyalar iin cretsiz konuma ve internet yklenecektir.,FALSE,TRUE,NA,NA
Kaan Terzioğlu,908492456236404738,2017-09-15T00:47:35Z,Explore the many events relevant to the private sector during the 72nd #UNGA! Your business guide //t.co/Tr6HHGqYm8//t.co/5hXWfPpUMJ,FALSE,TRUE,NA,UNGA
Kaan Terzioğlu,908490489195847681,2017-09-15T00:39:46Z,@globalcompact Srdrlebilir Kalknma ncs seilerek Trkiye'yi temsil eden @Kaan_Terzioglu ve @Turkcell i tebrik ederiz #SDGPioneers//t.co/13a6vtAOWz,FALSE,TRUE,NA,NA
Kaan Terzioğlu,908077982434160641,2017-09-13T21:20:36Z,Porto'yu Portekiz'de deviren Beikta' alklyorum. #TURKSPORU,FALSE,FALSE,NA,TURKSPORU
Kaan Terzioğlu,907861394690899968,2017-09-13T06:59:58Z,"Mobil iletiimin hayat iyiletirmeye katksn, yaayanlar anlatyor. Biz de ""Merhaba Umut"" ile bu hikayeye ortak oluyoruz. #CaseForChange//t.co/st4mf83Akf",FALSE,TRUE,NA,NA
Kaan Terzioğlu,907680872832389120,2017-09-12T19:02:38Z,"Apple'n tantt iPhone 8 ve iPhone X, Turkcell ayrcalklar ve Turkcell 4.5G hzyla ok yaknda Tarihi netleir netlemez duyuracaz.//t.co/ePlQ8GRT92",FALSE,FALSE,NA,NA
Kaan Terzioğlu,907668391661633536,2017-09-12T18:13:02Z,Mobil iletiimin hayatlar iyiletirmeye katksn yaayanlar anlatacak... Biz de bunun bir paras olmaktan gurur duyuyoruz. #CaseForChange,FALSE,FALSE,43998737,CaseForChange
Kaan Terzioğlu,907668163021733888,2017-09-12T18:12:08Z,We are honored to be part of an industry that makes lives better and empowers people. #CaseForChange #SDGs,FALSE,FALSE,NA,CaseForChange
Kaan Terzioğlu,907668163021733888,2017-09-12T18:12:08Z,We are honored to be part of an industry that makes lives better and empowers people. #CaseForChange #SDGs,FALSE,FALSE,NA,SDGs
Kaan Terzioğlu,907666828591280128,2017-09-12T18:06:50Z,GSMA Launches The Case For Change//t.co/tahru5PVig//t.co/dyuuueeX5L,FALSE,TRUE,NA,NA
Kaan Terzioğlu,907651774181453825,2017-09-12T17:07:00Z,Great to listen to chairman Ajit Pai of the FCC. Talking about hurricane Harvey and Irma. Mobile operators are playing a critical role//t.co/m6QeQfafIu,FALSE,TRUE,NA,NA
Kaan Terzioğlu,907651084725911552,2017-09-12T17:04:16Z,FCC Chairman Ajit Pai says wireless networks is lifeline of a nation.//t.co/NJQnban3GT,FALSE,FALSE,NA,NA
Kaan Terzioğlu,907638076947738626,2017-09-12T16:12:35Z,Mats delivering his opening speech at the inaugural Mobile World Congress Americas.//t.co/6ZEmSGa1Fp,FALSE,FALSE,NA,NA
Kaan Terzioğlu,907231369209802752,2017-09-11T13:16:28Z,"En popler 333 dergi ve 6 gnlk gazete, Dergilik uygulamasyla okumak istediiniz her an cebinizde, tabletinizde//t.co/kbpVQb4Ink//t.co/KmlTh7B9dP",FALSE,TRUE,NA,NA
Kaan Terzioğlu,906955474595086337,2017-09-10T19:00:10Z,"Formamzla 61 gol atan @YilmazBurak17 ismine zel numarasn ald. Sen de 61CELL'e gel, 561'li numaran hemen al.//t.co/R4jIhkh1W7//t.co/6h8aVEpLmf",FALSE,TRUE,NA,NA
Kaan Terzioğlu,906953676526321666,2017-09-10T18:53:01Z,Silikon Vadisinde Argela \ Netsia Arge ekibini ziyaret ettik. Baarl almalar iin kendilerini tebrik ediyorum.//t.co/Hl0rKrIV0f,FALSE,FALSE,NA,NA
Kaan Terzioğlu,906936318445461504,2017-09-10T17:44:03Z,"#EuroBasket boyunca her mata, son dde kadar mcadele eden Basketbol Milli Takmmz ayakta alklyoruz! #TrkiyeSizinleGururDuyuyor//t.co/RB5A9A9ZCC",FALSE,TRUE,NA,EuroBasket
Kaan Terzioğlu,906708441133207554,2017-09-10T02:38:32Z,China studying when to ban sales of traditional fuel cars: Xinhua//t.co/U2hS1UGoaI//t.co/dB1NmJ2DYo,FALSE,TRUE,NA,NA
Kaan Terzioğlu,906160451335151616,2017-09-08T14:21:01Z,Have a closer look at the exciting speakers at our high-level panel at #UNGA72 ! Agenda available here//t.co/y0BNRpVhGs//t.co/tWwfynsgHU,FALSE,TRUE,NA,UNGA72
Kaan Terzioğlu,906111056564674561,2017-09-08T11:04:45Z,rma Kasrgas'ndan etkilenen lkelerdeki mterilerimize acil iletiim ihtiyalar iin cretsiz konuma ve internet tanmlanacaktr.,FALSE,TRUE,NA,NA
Kaan Terzioğlu,906111034028675073,2017-09-08T11:04:39Z,Meksika deprem blgesinde bulunan mterilerimize acil iletiim ihtiyalar iin cretsiz konuma ve internet tanmlanacaktr. Gemi olsun.,FALSE,TRUE,NA,NA
Kaan Terzioğlu,905878281496485891,2017-09-07T19:39:47Z,"#EuroBasket2017'de grubumuzu 4. srada tamamlayp st tura ykseldik. Tebrikler #12DevAdam! Son 16'da rakip spanya, hedef eyrek final! //t.co/NKPRJbsIpf",FALSE,TRUE,NA,EuroBasket2017
Kaan Terzioğlu,905878281496485891,2017-09-07T19:39:47Z,"#EuroBasket2017'de grubumuzu 4. srada tamamlayp st tura ykseldik. Tebrikler #12DevAdam! Son 16'da rakip spanya, hedef eyrek final! //t.co/NKPRJbsIpf",FALSE,TRUE,NA,12DevAdam
Kaan Terzioğlu,905634038655979521,2017-09-07T03:29:15Z,Atina'da dzenlenen Yldzlar Grekoromen Gre ampiyonas'nda Dnya ampiyonu olan Muhammet Furkan Dursun'la gurur duyuyoruz! //t.co/eRmDLui0CL,FALSE,TRUE,NA,NA
Kaan Terzioğlu,905323785926168576,2017-09-06T06:56:25Z,Ekonominin damarlar glendirilmeli//t.co/hwagUd0lcJ,FALSE,FALSE,NA,NA
Kaan Terzioğlu,905168467636125696,2017-09-05T20:39:14Z,te Trk sporu... @TurkSporu//t.co/1fZKLSwNfb,TRUE,FALSE,NA,NA
Kaan Terzioğlu,905109116233940992,2017-09-05T16:43:24Z,Bu gece kalbimiz stanbul ve Eskiehir'de atacak! Milli Takmlarmza #EuroBasket ve Dnya Kupas Eleme Grubu malarnda baarlar! //t.co/342v8BbFom,FALSE,TRUE,NA,EuroBasket
Kaan Terzioğlu,905021929509330944,2017-09-05T10:56:57Z,Poltical powerbase moves to Silicon Valley from Wall Street ://t.co/wF8PHcprZn,FALSE,FALSE,NA,NA
Kaan Terzioğlu,904796717039718400,2017-09-04T20:02:02Z,"Son topa, son saniyeye kadar byle mcadeleye devam Kalan 2 mamzda gereken sonular alp gruptan kacaz! Teekkrler #12DevAdam! //t.co/8tIaSCVMYq",FALSE,TRUE,NA,NA
Kaan Terzioğlu,904095585803829248,2017-09-02T21:35:59Z,"B. Britanya karsnda 24 say, 6 asistlik performansyla man yldz Milli Takmmzdan @melihmahmutoglu! #EuroBasket2017//t.co/kvQr3UzbhX",FALSE,TRUE,NA,NA
Kaan Terzioğlu,904093925467717633,2017-09-02T21:29:23Z,"Bayram hediyemiz geldi Geen yl bizi Rio'da temsil eden, gururumuz Bra n teklerde ve iftlerde ampiyon! Tebrikler @BusraUn //t.co/4BxVeTDBK1",FALSE,TRUE,NA,NA
Kaan Terzioğlu,904070707050631171,2017-09-02T19:57:08Z,"Basketbol Milli Takmmz, #EuroBasket2017'de ilk galibiyetini ald. Hedef grupta ilk 4, size gveniyoruz! //t.co/5nf6DXgAYN",FALSE,TRUE,NA,EuroBasket2017
Kaan Terzioğlu,904067192790147072,2017-09-02T19:43:10Z,"Rzgar gibi balad rzgar gibi bitirdi 28 say, 7 ribaund, 4 asist galibiyete yetmese de nmzdeki malarda aynen byle devam @CediOsman!//t.co/yrZXqGZo2l",FALSE,TRUE,NA,NA
Kaan Terzioğlu,904025085773832194,2017-09-02T16:55:51Z,Haydi bu gece Trk sporu iin ifte zafer gecesi olsun! Basketbol ve Futbol Milli Takmlarmza sonsuz baarlar! //t.co/3Z5FamYu4y,FALSE,TRUE,NA,NA
Kaan Terzioğlu,903558540622794752,2017-09-01T10:01:58Z,Bence mthi huzurevlerinden bir bymzle konuup bayramlarn kutlamak iin//t.co/VojVrghwYp bravo @Turkcell,FALSE,TRUE,NA,NA
Kaan Terzioğlu,903558400251973632,2017-09-01T10:01:24Z,"@Turkcell Ben aradm, bayramlatm. nanlmaz mutlu oldu Nedim amca. Ben de ok mutlu hissettim. ok gzel faydal bir organizasyon olmu, tebrikler.",FALSE,TRUE,NA,NA
Kaan Terzioğlu,903557468319617025,2017-09-01T09:57:42Z,@Turkcell Onlar mutlu etmek beni daha da cok Mutlu etti teekkr ederim Turkcellok gzel bir proje olmu sayenizde Bursal Nedim Dedem oldu,FALSE,TRUE,NA,NA
Kaan Terzioğlu,903556882102722561,2017-09-01T09:55:22Z,"O kadar mutlu oluyorlar ki, o ses tonlarn duymak her eye deer. Siz de huzur evindeki byklerimizi mutlu etmek iin arayn #BayramOlsun//t.co/aTUwsfO6iN",FALSE,TRUE,NA,NA
Kaan Terzioğlu,903556306564472834,2017-09-01T09:53:05Z,Turkcell'den anlaml bayram projesi//t.co/l7bSL22FRf//t.co/UFe8dLWX7h,FALSE,TRUE,NA,NA
Kaan Terzioğlu,903514395807973376,2017-09-01T07:06:33Z,"Sizlerin, ailelerinizin ve tm sevdiklerinizin Kurban Bayramn kutluyorum. Byklerimizi hatrlamay unutmayalm//t.co/ZGf4MlwRuP",TRUE,FALSE,NA,NA
Kaan Terzioğlu,903512849410125824,2017-09-01T07:00:24Z,"Mutlu bayramlar! Bayrama zel #SallaKazan'da bir deil iki hediyeniz var Hemen Hesabm'a gelin, sallayn kazann! //t.co/uPqVwZzfg3//t.co/PVUZCiGJKa",FALSE,TRUE,NA,SallaKazan
Kaan Terzioğlu,903511765144752128,2017-09-01T06:56:05Z,Gidemeseniz de bayram kutlamasn Bip grntl grme ile deneyin.//t.co/M05zLbrKYL,FALSE,FALSE,NA,NA
Kaan Terzioğlu,903316223265431552,2017-08-31T17:59:05Z,"Trk sporunu destekle, Milli Takmlarmzn kazanaca ilk mata sen de 1 GB internet kazan! #DestekleKazan//t.co/wNaQjcOegf",FALSE,TRUE,NA,DestekleKazan
Kaan Terzioğlu,903282581931782145,2017-08-31T15:45:24Z,yi Bayramlar Trkiye...//t.co/EFAq8qXkjC,FALSE,TRUE,NA,NA
Kaan Terzioğlu,903189766795137025,2017-08-31T09:36:35Z,Digital Operator Turkcell agrees.,FALSE,FALSE,43998737,NA
Kaan Terzioğlu,903189452159373312,2017-08-31T09:35:20Z,The un-carrier T-mobile chief : //t.co/ZZCSBBDqcu,FALSE,FALSE,NA,NA
Kaan Terzioğlu,902767624563687427,2017-08-30T05:39:08Z,"30 Austos Zafer Bayrammz kutlu olsun! Bugne zel internet, konuma, fizy, TV+ hediyelerinizi gle gle kullann.//t.co/iBeKCYuMXV//t.co/NkPASZCYCV",FALSE,FALSE,NA,NA
Kaan Terzioğlu,902651112611831808,2017-08-29T21:56:10Z,Mustafa Kemal Atatrk' ve vatan uruna can veren tm ehitlerimizi saygyla anyoruz. Zafer Bayrammz kutlu olsun!//t.co/5eiqJzUixu//t.co/SKKsF3Bfj8,FALSE,TRUE,NA,NA
Kaan Terzioğlu,902537003555749897,2017-08-29T14:22:44Z,"Trkiye Cumhuriyeti, birbirimize destek vererek neleri baarabileceimizin en ihtiaml rnei olarak yaamaya devam edecek! #30Austos //t.co/QU9q31AMPS",FALSE,TRUE,NA,NA
Kaan Terzioğlu,902489563049975808,2017-08-29T11:14:13Z,Arkadalar merhaba. Kanalma ho geldiniz. Bugn size kanalma nasl abone olacanz gstereceim.//t.co/4cH7rnKMqR,FALSE,TRUE,NA,NA
Kaan Terzioğlu,902216870677368832,2017-08-28T17:10:39Z,Trkiye'nin Turkcell'i olarak Trkiye'deki sporlar ilk gnden beri ayn cokuyla destekliyoruz. nk her eyimiz Trk sporu iin //t.co/Dvdbt4kuct,FALSE,TRUE,NA,NA
Kaan Terzioğlu,901342718823157760,2017-08-26T07:17:04Z,Anadolu'nun anavatanmz oluunun balangc #MalazgirtZaferi kutlu olsun! Etkinliklerde Wi-Fi ve mobil istasyon desteiyle yer alacaz.//t.co/m7SJGPA9MQ,FALSE,FALSE,NA,MalazgirtZaferi
Kaan Terzioğlu,901135117887959043,2017-08-25T17:32:09Z,"Turkcell ailesinden istediimi tm vatandalarmzdan da istiyorum. Bayram yolunda emniyet kemerlerimizi takalm, trafik kurallarna uyalm.//t.co/GGJUn61xe8",FALSE,FALSE,NA,NA
Kaan Terzioğlu,900738478543130626,2017-08-24T15:16:02Z,"Bugn Bamszlk Gn'n kutlayan Ukrayna'nn bakenti Kiev'de yaanan patlama, umarm en az kayp ve hasarla atlatlr. Gemi olsun",FALSE,FALSE,NA,NA
Kaan Terzioğlu,900092203707584512,2017-08-22T20:27:58Z,"TURKSPORU adna bir gurur daha... Rza Kayaalp, Dnya Gre ampiyonas'nda 3. kez altn madalyay kazanarak Dnya ampiyonu oldu! //t.co/t8FA5tcaXy",FALSE,FALSE,NA,NA
Kaan Terzioğlu,898940519799304192,2017-08-19T16:11:36Z,nanp alnca her eyin baarlabileceini kantlayan Grme Engelli Milli Takmmz gururla destekliyoruz! //t.co/7fBWPRJ1fI,TRUE,FALSE,NA,NA
Kaan Terzioğlu,898878210989060097,2017-08-19T12:04:00Z,@orhandinc @Gungorenbld @Kaan_Terzioglu Gngren blgesinde hizmet veren tm operatrleri etkileyen bu sorunun en hzl ekilde zlmesi iin yasal giriimlerde bulunulmutur.,FALSE,TRUE,NA,NA
Kaan Terzioğlu,898878172183150592,2017-08-19T12:03:51Z,"@AbrekAdigej @Turkcell @Kaan_Terzioglu stanbul Gngren'deki baz istasyonlarnda, ilgili belediyenin mdahalesi nedeniyle Turkcell kaynakl olmayan kesintiler yaanabilmektedir.",FALSE,TRUE,NA,NA
Kaan Terzioğlu,898219043513085952,2017-08-17T16:24:42Z,Barselona'da yaanan terr saldrsn knyoruz. Blgedeki mterilerimize acil ihtiyalar iin cretsiz konuma/internet yklenecektir.,FALSE,TRUE,NA,NA
Kaan Terzioğlu,897413806984450048,2017-08-15T11:04:59Z,".@Kaan_Terzioglu: ""Milli teknolojilerin gelitirilmesi adna zerimize denin en iyisini yapmak iin alyoruz.""//t.co/1AGriSLy1p",FALSE,TRUE,NA,NA
Kaan Terzioğlu,897368625799208960,2017-08-15T08:05:27Z,Bilgi Teknolojileri ve Iletiim Kurumu 17 yanda. Bu vesileyle 5G Test Vadisi hayata geiyor. Tebrikler.//t.co/fGgxR5wCcf,FALSE,FALSE,NA,NA
Kaan Terzioğlu,896466915958300672,2017-08-12T20:22:22Z,Bodrum Mzik Festivali Dou ocuk Senfoni Orkestrasnn harika performansyla balad. Tebrikler.,FALSE,FALSE,NA,NA
Kaan Terzioğlu,896376555148017664,2017-08-12T14:23:19Z,"Bizi blmeye alan hainler bilmiyorlar ki bir Eren'den milyonlarca Eren doacak, bu millet asla terre boyun emeyecek. #iyikivarsnEren//t.co/uLJPHpFeuk",FALSE,FALSE,NA,iyikivarsınEren
Kaan Terzioğlu,896250409404293120,2017-08-12T06:02:03Z,"Ege Denizi, birbirinden hzl yelkenlileri bekliyor. Heyecana hazr msnz? Turkcell Platinum Bodrum Challenge 12-13 Austos'ta! #YelkenA//t.co/TTk5I0HnEC",FALSE,TRUE,NA,NA
Kaan Terzioğlu,896250257436282880,2017-08-12T06:01:27Z,Trkiye Yelken Sporu iin bir cennet. Turkcell Platinum Bodrum Challenge Balyor//t.co/iHUGZkYaGh,FALSE,FALSE,NA,NA
Kaan Terzioğlu,896012673762177025,2017-08-11T14:17:23Z,#bipspor//t.co/XzCxf6Omc9,FALSE,FALSE,NA,bipspor
Kaan Terzioğlu,895887853338710016,2017-08-11T06:01:23Z,"Ana Sponsor olarak destek vermekten gurur duyduumuz Ramil Guliyev, Trk Sporu adna tarih yazd. Tebrikler! //t.co/pPKAnEKdg4",TRUE,FALSE,NA,NA
Kaan Terzioğlu,895491860038389760,2017-08-10T03:47:51Z,Yerli ve milli ULAK Ekimde hizmete hazr//t.co/XCttM1G25Y via @haberturk,FALSE,FALSE,NA,NA
Kaan Terzioğlu,895487783875358720,2017-08-10T03:31:39Z,Londara'da Dnya Atletizm ampiyonas'nda 400 metre engelli yarnda lkemize gm madalya kazandran Yasmani Copello'yu tebrik ediyorum.,FALSE,FALSE,NA,NA
Kaan Terzioğlu,894283693870788609,2017-08-06T19:47:02Z,"#TurkcellSperKupa 2017 ampiyonu Atiker Konyaspor'u ve finalisti Beikta' tebrik ediyorum. Yeni sezon, Trk futboluna hayrl olsun.",FALSE,FALSE,NA,TurkcellSüperKupa
Kaan Terzioğlu,894250311271018497,2017-08-06T17:34:23Z,15 bin kiiden fazla katlm olan ankete baklrsa #TurkcellSperKupa'da futbolseverleri ekimeli bir ma bekliyor.//t.co/cNOQxJvzYC,TRUE,FALSE,NA,TurkcellSüperKupa
Kaan Terzioğlu,894179083965390848,2017-08-06T12:51:21Z,"#TurkcellSperKupa'y nerede olursanz olun karmayn diye, TV+ kullanmna zel 2 GB tm Turkcell'lilere hediye!//t.co/wm2YeCGnLd//t.co/KwjhKGaSbd",FALSE,TRUE,NA,TurkcellSüperKupa
Kaan Terzioğlu,894178646692376586,2017-08-06T12:49:37Z,Bu akam 20.45'te Samsun'da oynanacak Beikta - Atiker Konyaspor #TurkcellSperKupa mcadelesinde iki takmmza da baarlar diliyorum.,FALSE,FALSE,43998737,TurkcellSüperKupa
Kaan Terzioğlu,894178389338329088,2017-08-06T12:48:35Z,smimizi vermekten onur duyduumuz #TurkcellSperKupa da ilk gz armz olan futbola verdiimiz destein en nemli admlarndan birisi.,FALSE,FALSE,43998737,TurkcellSüperKupa
Kaan Terzioğlu,894178223176790016,2017-08-06T12:47:56Z,"Turkcell olarak, yllardr Trk sporunun gelimesi ve Milli Takmlarmzn daha byk baarlara ulamas iin var gcmzle alyoruz.",FALSE,FALSE,NA,NA
Kaan Terzioğlu,893752073426173952,2017-08-05T08:34:34Z,"Kupalarn Kupas heyecanna hazr msnz? #TurkcellSperKupa, 6 Austos Saat 20.45'te Samsun Yeni 19 Mays Stad'nda sahibini buluyor! //t.co/zrvqmFfBFU",FALSE,TRUE,NA,TurkcellSüperKupa
Kaan Terzioğlu,893396764941840385,2017-08-04T09:02:41Z,Londra'da milli atletlerimiz madalya peinde. Baarlar diliyorum.//t.co/IB7vC83Obk,FALSE,FALSE,NA,NA
Kaan Terzioğlu,893196385801076742,2017-08-03T19:46:27Z,Ve tebrikler Fenerbahce. Iste TURKSPORU.//t.co/cz922exJ96,TRUE,FALSE,NA,NA
Kaan Terzioğlu,892859653343899648,2017-08-02T21:28:24Z,Tebrikler Baakehir.//t.co/KOkEbdDM6J,TRUE,FALSE,NA,NA
Kaan Terzioğlu,892462874844647424,2017-08-01T19:11:45Z,"Kablosuz fiber Turkcell Superbox.... eski adsl lerinizi atn, superbox geldi :)//t.co/wUojwwyV5h",FALSE,FALSE,NA,NA
Kaan Terzioğlu,891980901831380992,2017-07-31T11:16:33Z,"Great article. Scary stat that ""twice as many girls as boys will never start school"". Let's aim towards zero and leave no one behind!!//t.co/frAvwtYZAG",FALSE,TRUE,NA,NA
Kaan Terzioğlu,891754664500367361,2017-07-30T20:17:34Z,"Ana Sponsoru olduumuz Futbol Milli Takmmz, itme Engelliler Olimpiyatlar'nda altn madalya kazand!Tebrikler, gururumuzsunuz! //t.co/pH7eQMWsW8",FALSE,TRUE,NA,NA
Kaan Terzioğlu,891196681089409024,2017-07-29T07:20:21Z,"Trkiye'nin Turkcell'i olarak, lkemizi 17 yldr New York Borsas'nda temsil eden ilk ve tek Trk irketi olmann gururunu yayoruz. //t.co/RRgdGV61wt",FALSE,TRUE,NA,NA
Kaan Terzioğlu,891196606841802752,2017-07-29T07:20:03Z,"Bu baarlara ve lkemize yatrm rakamlarmza ulamamz salayan mterilerimize, i ortaklarmza, tedarikilerimize sonsuz teekkrler!//t.co/A5dcYzVXBV",FALSE,FALSE,43998737,NA
Kaan Terzioğlu,891196239613763584,2017-07-29T07:18:35Z,"Fiber mteri saymz 2017'nin ikinci eyreinde 32 bin artla 1,1 milyona ularken toplam sabit genibant mteri says 2 milyonu at.",FALSE,FALSE,43998737,NA
Kaan Terzioğlu,891196130058547200,2017-07-29T07:18:09Z,"Son 6 yln en yksek mteri kazanm oranna ulatk; eyrek baznda 850 bin, yllk bazda 2,1 milyon yeni aboneyi mterilerimize ekledik.",FALSE,FALSE,43998737,NA
Kaan Terzioğlu,891196024722776064,2017-07-29T07:17:44Z,Bugn dnya apnda 52 lkede bireysel ve kurumsal yatrmclar Turkcell'e inanyorlar. Biz de global giriimlerimizi hzlandryoruz.,FALSE,FALSE,43998737,NA
Kaan Terzioğlu,891195806245638145,2017-07-29T07:16:52Z,"4,9 milyon defa indirilen Lifebox'a anlarn ve nemli belgelerini emanet eden mterilerimiz, geen ay 110 milyon dosyay gvenle saklad.",FALSE,FALSE,43998737,NA
Kaan Terzioğlu,891195637819215872,2017-07-29T07:16:12Z,"Televizyon platformumuz TV+ kullanc saysnda 1,5 milyona ularken gnlk ortalama mobil izleme sresi 4.5G ncesine gre 7,5 kat artt.",FALSE,FALSE,43998737,NA
Kaan Terzioğlu,891195509360250880,2017-07-29T07:15:41Z,"Geen ay 2,1 milyon derginin okunduu bir mecra haline gelen Dergilik, kullanclarna gnlk gazeteleri okuma imkan da sunmaya balad.",FALSE,FALSE,43998737,NA
Kaan Terzioğlu,891195265776054272,2017-07-29T07:14:43Z,"Tarkan'n yeni albmn ilk kez fizy'deydi. App Store'da indirilen uygulamalarda ilk sraya ykselen fizy'de, gnde 6 milyon ark dinlendi.",FALSE,FALSE,43998737,NA
Kaan Terzioğlu,891195150831058944,2017-07-29T07:14:16Z,"Dijital dnm yolculuumuzun ilk kresel rn BiP, dnyada 14,7 milyon indirme, gnde ortalama 1 milyon dakika arama rakamlarna ulat.",FALSE,FALSE,43998737,NA
Kaan Terzioğlu,891194981989441536,2017-07-29T07:13:35Z,"Mterilerimiz seyretme, dinleme, okuma, elenme, haber alma, i yapma ve an biriktirme iin servislerimizi her gn daha ok tercih ediyor.",FALSE,FALSE,NA,NA
Kaan Terzioğlu,891078183415672832,2017-07-28T23:29:29Z,Ekonomiye 3 ylda 30 milyarlk katk//t.co/ml9E2NDy66,FALSE,FALSE,NA,NA
Kaan Terzioğlu,890690363777855489,2017-07-27T21:48:25Z,@questCNN @richardquest Thanks @richardquest .//t.co/xPRzdJV3M6,FALSE,FALSE,705091592,NA
Kaan Terzioğlu,890688067455123456,2017-07-27T21:39:18Z,@richardquest speaks to the CEO of #turkcell @Kaan_Terzioglu about how they're competing with big tech companies//t.co/LZXFXtiPdk,FALSE,TRUE,NA,turkcell
Kaan Terzioğlu,890629273190416386,2017-07-27T17:45:40Z,@Kaan_Terzioglu Trkiye'nin en itibarl markas bizde bu markann Bayisi Ve Bir Paras olmaktan gurur duyuyoruz Kaan Bey,FALSE,TRUE,NA,NA
Kaan Terzioğlu,890625576913993729,2017-07-27T17:30:59Z,17 yldr Turkiye'yi gururla temsil ettigimiz New York Borsas bugn Turkcell'i arlyor.//t.co/eXJ4iVvYyQ,FALSE,FALSE,NA,NA
Kaan Terzioğlu,890606531405688834,2017-07-27T16:15:18Z,Giriim TV'de bu gece @arikovanicom projesi @DeplikeApp @mavixce @c_saydam Gitar tutkunlar @Kaan_Terzioglu 23:00//t.co/TkQJ72lIkb,FALSE,TRUE,NA,NA
Kaan Terzioğlu,890293071153332225,2017-07-26T19:29:43Z,BThaber'i artk Dergilik'ten de okuyabilirsiniz. @bthaber//t.co/6EdfSI1Gyd,FALSE,TRUE,NA,NA
Kaan Terzioğlu,890258273852682241,2017-07-26T17:11:27Z,"En ok okunan yzlerce dergiye ek olarak, imdi gnlk gazeteler de Dergilik'te! Hemen indirin, okumaya balayn //t.co/kbpVQb4Ink//t.co/3nwn6aMBS9",FALSE,TRUE,NA,NA
Kaan Terzioğlu,890065382203170817,2017-07-26T04:24:58Z,Turkcell mobil servislerinin ykselii Dergilik ile devam ediyor//t.co/1ZmZzoUOyC//t.co/tME9DkTJyI,FALSE,TRUE,NA,NA
Kaan Terzioğlu,889934759018852353,2017-07-25T19:45:55Z,Citi cited Turkcell's growth strategy through digitalization as an exemplar in the telecom sector in its recent report Bye old Telco.//t.co/AuFt4PSbi5,FALSE,FALSE,43998737,NA
Kaan Terzioğlu,889934059996147712,2017-07-25T19:43:08Z,"Citi, ""Eski Tip Telekom Gemite Kald"" balyla yaynlad raporda Turkcell'in dijitalleerek byme stratejisini dnyaya rnek gsterdi//t.co/caDdqkFiPr",FALSE,FALSE,NA,NA
Kaan Terzioğlu,889826656516538368,2017-07-25T12:36:21Z,Dergilik Android uygulamas da yenilendi.//t.co/0tkgon250b//t.co/Dz1qQJAQUE,TRUE,FALSE,NA,NA
Kaan Terzioğlu,889824696950194176,2017-07-25T12:28:34Z,"Artk gnlk gazeteler de Dergilik'te. Her gazete iin, her telefon veya tablet iin ayr abonelie gerek kalmad. //t.co/fKyVfrgpWb",FALSE,FALSE,NA,NA
Kaan Terzioğlu,889807745410637825,2017-07-25T11:21:12Z,Zihin okuyan adamin srr. Seyretmenizi tavsiye ederim. //t.co/6lSGXOJSRy,FALSE,FALSE,NA,NA
Kaan Terzioğlu,889526353963495424,2017-07-24T16:43:04Z,24 Temmuz Basn ve Gazetecilik Bayram kutlu olsun. #BasnBayram,FALSE,FALSE,NA,BasınBayramı
Kaan Terzioğlu,888396278484303873,2017-07-21T13:52:33Z,"Ulatrma, Denizcilik, Haberleme Bakanmz Sn.Ahmet Arslan'n kardei Okan Arslan'a Allah'tan rahmet, ailesine sabr ve basal dilerim.",FALSE,FALSE,NA,NA
Kaan Terzioğlu,888270865535717380,2017-07-21T05:34:12Z,Mula deprem blgesinde bulunan mterilerimize acil iletiim ihtiyalar iin cretsiz konuma ve internet tanmlanacaktr. Gemi olsun.,FALSE,TRUE,NA,NA
Kaan Terzioğlu,887682018590511108,2017-07-19T14:34:20Z,Arkovan'n ve kitlesel fonlama kampanyalarn anlk takip etmek iin #BiP kanalmza bekliyoruz! //t.co/SKsy3WmJjv,FALSE,TRUE,NA,BiP
Kaan Terzioğlu,887563426289078273,2017-07-19T06:43:05Z,"Giriim TV'de BTK Bakan @ofatihsayan ve tm operatrler olarak ""Giriimcilik ve Genibant Ekonomisi"" konuuyoruz.//t.co/l0Re6tAaqi",FALSE,FALSE,NA,NA
Kaan Terzioğlu,887402484246994948,2017-07-18T20:03:34Z,Turkcell mhendisleri tarafndan gelitirilen yerli teknolojilerle lkemize ve insanmza hizmet etmeye devam //t.co/udPH7Xa9si,TRUE,FALSE,NA,NA
Kaan Terzioğlu,886172149534396417,2017-07-15T10:34:39Z,Ykselen Trkiye.//t.co/7ZoCxndsMx,FALSE,FALSE,NA,NA
Kaan Terzioğlu,886103614636396544,2017-07-15T06:02:19Z,Beraberlii ve vatann cokuyla kucaklayan milletimizin 15 Temmuz Demokrasi ve Milli Birlik Gn'n gnlden kutluyorum.#Birliktecokguzeliz//t.co/nyfqnUQIY5,FALSE,TRUE,NA,NA
