name,status_id,created_at,text,is_quote,is_retweet,reply_to_user_id,hashtags
Kaan Terzioğlu,1061527181917085696,2018-11-11T07:52:57Z,"Sanat halkmzla buluturmak adna nemli etkinliklerin sponsorluunu gururla stleniyoruz. TV+ ile ana iletiim sponsorluunu stlendiimiz 8. Malatya Uluslararas Film Festivali'nin ksa filmleri, ilk kez ve sadece @TurkcellTVPlus 'ta yer alacak.//t.co/o64B6NPMVK",TRUE,FALSE,NA,NA
Kaan Terzioğlu,1061301475647864837,2018-11-10T16:56:04Z,"AliBaba turned its 11.11 into a 25 billion USD event in sales volume in 2017 from a mere 7 mn USD in 2008. The secret is the digital power of the Group - a power which I had the pleasure of witnessing in the event hosted by the legendary Jack Ma, the founder of AliBaba.",FALSE,FALSE,43998737,NA
Kaan Terzioğlu,1061301471130673152,2018-11-10T16:56:03Z,"AliBaba in'in online alveri festivali 11.11'i, 2008'de 7 milyon dolarlk hacimden 2017'de 25 milyar dolara kard. Festivalin 10. ylnda, AliBaba'nn kurucusu Jack Ma'nn evsahipliindeki etkinlikte, alveriin dijital dnmne birinci elden ahit olduk.//t.co/FSuXB6mchy",FALSE,FALSE,NA,NA
Kaan Terzioğlu,1061270447193513986,2018-11-10T14:52:46Z,"Hakkari'de ehit olan kahraman askerlerimize Allah'tan rahmet, yaknlarna ve milletimize basal diliyoruz.//t.co/ry0myxJVGB",FALSE,TRUE,NA,NA
Kaan Terzioğlu,1061210706488582145,2018-11-10T10:55:23Z,"Adding Turkey to the ranks of countries with their own search engine, @YaaniTR has reached 7 million downloads in its one year-long lifespan. Proud to have contributed to our country with such a project. //t.co/4wM0nViNFT",FALSE,FALSE,NA,NA
Kaan Terzioğlu,1061137405221224448,2018-11-10T06:04:07Z,"Cumhuriyetimizin kurucusu Mustafa Kemal Atatrk'e olan sevgi ve zlemimizi gstermenin en gzel yolu, O'nun hedefledii gibi lkemizin geliimi ve gelecei iin ok almak. Sayg, sevgi ve zlemle anyorum.//t.co/8pp2n0KGuv",TRUE,FALSE,NA,NA
Kaan Terzioğlu,1061044317375135744,2018-11-09T23:54:13Z,Alipay ve UEFA dan mobil deme ibirlii.//t.co/uN5r2qE2mv,FALSE,FALSE,NA,NA
Kaan Terzioğlu,1060682590364024833,2018-11-08T23:56:50Z,"Aracnz her zaman gznzn nnde olmayabilir ama Turkcell Kopilot ile gznz arkada kalmaz. Siz park ettikten sonra aracnzda konum deiimi, sarsnt ya da motor almas olursa annda bilginiz olur! //t.co/mvayjbfeZx//t.co/7DyG7HIu7a",FALSE,TRUE,NA,NA
Kaan Terzioğlu,1060545957295783936,2018-11-08T14:53:54Z,"Enflasyonla topyekun mcadele kapsamnda Trkiye'nin uygulamalarn, halkmzn btesine uygun alveri yapabilmesi iin gelitiriyor ve gncelliyoruz. Yaani'nin alveri sekmesinde aradnz rnlerin en uygun fiyatlarn karlatrarak bulabilirsiniz.//t.co/2Wxx7wdaQ3",TRUE,FALSE,NA,NA
Kaan Terzioğlu,1060504435330297856,2018-11-08T12:08:55Z,Trkiye'de 5G vadisi al ve getiimiz gnlerde yaptmz ilk 5G canl deneyimi ile byk admlar atyoruz. Kbrs iin de atlmas gereken admlar olduunu bir kez daha hatrlatmakta fayda gryorum.,FALSE,FALSE,43998737,NA
Kaan Terzioğlu,1060473803917221889,2018-11-08T10:07:12Z,Gntay imek yine ok doru bir konuya deinmi. Kuzey Kbrs Biliim adasi olacak ise fiber ve 5G iin daha da ge kalnmamal. Kalnyor malesef. //t.co/YB0OyMkyfv @Haberturk araclyla,FALSE,FALSE,NA,NA
Kaan Terzioğlu,1060460035799728128,2018-11-08T09:12:29Z,"Bugn@Dergilik'te, Teknoblog dergisinin Supercam rnmzle ilgili yazsn okudum. Detayl incelemelerinin sonucunda piyasadaki global rakiplerine kyasla ok gzel bir puanla deerlendirmiler. Teekkrler@Teknoblog//t.co/9nDZxAN3lF @esats @Murat__Erkan",FALSE,TRUE,NA,NA
Kaan Terzioğlu,1060459563697221633,2018-11-08T09:10:37Z,"Trkiye'nin 5G'de nc lkelerden olmas adna emin admlar atmaya devam ediyoruz. @BTKgovtr nderliinde Ankara'da kurulan 5G Vadisi'nde, ilk 5G sinyalini verdik. Trkiye'nin 5G Ar-Ge almalarnn yrtlecei bu alanda bir ilke imza attk, gururluyuz.//t.co/YFJ5jCdsGp",FALSE,FALSE,NA,NA
Kaan Terzioğlu,1060160444294402048,2018-11-07T13:22:01Z,"Chauhary Group Chairman on New Economy, Trade Tensions, Nepal //t.co/EplkTAoQy2",FALSE,FALSE,NA,NA
Kaan Terzioğlu,1060048840038989824,2018-11-07T05:58:32Z,lkemizi baaryla temsil ederek Dnya 2. si olan Ampute Futbol Milli Takmmz yrekten tebrik ederim. Trk sporunun ve sporcusunun her zaman yannda olmaya byk bir gururla devam edeceiz. //t.co/E41smOH3Rm,FALSE,FALSE,NA,NA
Kaan Terzioğlu,1060007014439501824,2018-11-07T03:12:20Z,Ho geldiniz Ampute Futbol Milli Takmmz! Bize bu gururu yaattnz iin teekkr ederiz. Turksporuna desteimiz her zaman devam edecek. //t.co/XR1nwOh0CZ,FALSE,TRUE,NA,NA
Kaan Terzioğlu,1059788813172727808,2018-11-06T12:45:17Z,"Eksim Yatrm Holding Ynetim Kurulu Bakan Abdullah Tivnikli'nin ac haberini, zntyle alm bulunuyoruz. Allah'tan rahmet, ailesine ve sevenlerine basal dilerim.",FALSE,FALSE,NA,NA
Kaan Terzioğlu,1059548411563835395,2018-11-05T20:50:01Z,"Dnya Kupas'nda ikinci olarak, Trkiye'nin ismini gururla tayan Ampute Milli Takmmz tebrik ediyorum. Bize yaatt byk heyecan ve gurur iin teekkrler! //t.co/4Boj9aPe6v",TRUE,FALSE,NA,NA
Kaan Terzioğlu,1059419896583503872,2018-11-05T12:19:21Z,"Meksika milli takmn 4-0 yendii man ardndan, Meksika taraftarnnn Ampute milli takmmza gstermi olduu sevgi. #SporDostluktur//t.co/cjcb37gRtH",FALSE,TRUE,NA,NA
Kaan Terzioğlu,1059410488541495296,2018-11-05T11:41:58Z,Sizinle gurur duyuyoruz. Ampute Futbol Milli Takmmz Dnya ikincisi.//t.co/MenJTQg0xK,FALSE,FALSE,NA,NA
Kaan Terzioğlu,1059409778643005441,2018-11-05T11:39:08Z,Aslanlar gibi oynadilar. Videoyu seyredince daha iyi anlalyor ne kadar byk bir baar olduu. Hepsi birer ampiyon.//t.co/XusxITa1at,TRUE,FALSE,NA,NA
Kaan Terzioğlu,1059407234118139912,2018-11-05T11:29:02Z,"Dnyann ilk dijital operatr olarak, Turkcell Teknoloji Binas'nda @SamsungTurkiye i birlii ile ilk canl 5G deneyimini gerekletirdik! //t.co/Uhb8xnnUeM//t.co/gQiuomkdz7",FALSE,TRUE,NA,NA
Kaan Terzioğlu,1059401972766425088,2018-11-05T11:08:07Z,Trkiye'nin ilk 5G deneyimini @SamsungTurkiye ve @ITU1773'nn katk ve katlmlar ile gerekletirdik. #5GDeneyimi hayatmza yeni bir standart getirecek. Trkiye'nin bu deneyimi yaayan ilk lkelerden biri olmas iin almalarmza devam ediyoruz.//t.co/W4Z0lHRstl//t.co/TqZBdDYIHS,FALSE,FALSE,NA,5GDeneyimi
Kaan Terzioğlu,1059092899328077825,2018-11-04T14:39:58Z,"Bugn @hadioyna 'daki 30.000 TL'lik byk dl FullTrip'ten. Sorular bil, 30.000 TL ile istediin tatile k.//t.co/wKcGZfDQMf",FALSE,TRUE,NA,NA
Kaan Terzioğlu,1059086738331721728,2018-11-04T14:15:29Z,Milli sporcumuz @sahikaercumen'in bir doa harikas olan Salda Gl'nde krd dnya rekorunun hikayesi ok yaknda @TurkcellTVPlus ile Life+ kanalnda...//t.co/y10svvj9D2,FALSE,TRUE,NA,NA
Kaan Terzioğlu,1059084537228115968,2018-11-04T14:06:45Z,New post: Eitim 2023 hedeflerine Turkcell'den tam destek//t.co/yRW3LNSCSD,FALSE,TRUE,NA,NA
Kaan Terzioğlu,1058994319212847104,2018-11-04T08:08:15Z,Ampute Milli Takmmz Meksika'y 4-0 yenerek adn finale yazdrd. Yarn Angola ile final karlamasn gerekletirecek olan Millilerimize baarlar dileriz. Tm Trkiye heyecanla son manz bekliyoruz! Gnlmz sizinle... //t.co/KdNOLDoadA,FALSE,FALSE,NA,NA
Kaan Terzioğlu,1058993753061507073,2018-11-04T08:06:00Z,2018 Ampute Futbol Dnya Kupas yar finalinde ev sahibi Meksika'y yenerek adn finale yazdran Ampute Futbol Milli Takmmz yrekten tebrik ediyorum. Bu gzel takma ampiyonluk yakr.//t.co/oUqYkdF7EB,FALSE,TRUE,NA,NA
Kaan Terzioğlu,1058949658825895936,2018-11-04T05:10:47Z,"IQ ve EQ dan sonra Turkcell DQ Dijital Zeka, one cikacagini ortaya atiyor. Dijital vatandaslik, ekran zaman yonetimi, siber zorbalik, siber guvenlik, kisisel guvenlik, elestirel dusunce, dijital ayakizi ve dijital empati cok cok onemli konular. Tebrikler @Kaan_Terzioglu @FatihEtz//t.co/nIJMBqAoq2",FALSE,TRUE,NA,NA
Kaan Terzioğlu,1058695971939500032,2018-11-03T12:22:43Z,"Teknolojinin getirecei frsat eitliine inanyor ve gveniyoruz. @Arikovanicom'da fonlanan Sense Watch, iitme engelliler iin ses dalgalarn titreime dntryor, yn ve ses ayrt edebiliyor. Bu projeye destek vermek iin //t.co/brgMQvTJAA",FALSE,FALSE,NA,NA
Kaan Terzioğlu,1058659664886411264,2018-11-03T09:58:27Z,"Bugn Fatih Projesi Eitim Teknolojileri Zirvesi'ne konuk olduk. Endstri 4.0'n ekillendirdii dnyada, eitimin dijitallemesini konutuk, Turkcell'in eitime yapt yaptrmlar paylatk.//t.co/reNVc0ox73",FALSE,FALSE,NA,NA
Kaan Terzioğlu,1058549056320999424,2018-11-03T02:38:56Z,"Turk Telekom Ynetim Kurulu yesi olarak atanan Blent Aksu, Nureddin Nebati, Faisal Mohammed Aldughaither'i tebrik ediyor, lkemize ve sektrmze hayrl olsun diyorum.",FALSE,FALSE,NA,NA
Kaan Terzioğlu,1058438206859939840,2018-11-02T19:18:28Z,Nick Reed Balk Doktoru Kahraman ile Oskar dln paylat.//t.co/zn4I1Jf2M8,FALSE,FALSE,NA,NA
Kaan Terzioğlu,1058393192180187137,2018-11-02T16:19:35Z,"Derbi heyecann yarma heyecan ile buluturduk: Bu akam devre arasnda Hadi, BiP Spor sponsorluunda sizlerle. Bu akam derbide karlaacak olan takmlarmza bu vesileyle baarlar diliyorum.//t.co/CpgujH47E3",TRUE,FALSE,NA,NA
Kaan Terzioğlu,1058291583320317952,2018-11-02T09:35:50Z,"Dijital operatr olarak insanlarn online ihtiyalarn mmkn olduunca minimum srede yapmalarn salamak bizim en nemli hedeflerimizden. Turkcell'li olan, olmayan herkes, Hesabm uygulamasna girerek ihtiyac olan ilemleri kolayca yapabilir, bilgilere kolayca ulaabilir.//t.co/i39grCZPG7",TRUE,FALSE,NA,NA
Kaan Terzioğlu,1057988836301651968,2018-11-01T13:32:49Z,We are thrilled to host the top management of Turkcell Group companies in Istanbul to review our strategies for 2019! Ready to serve our customers all over the world with the full power of our digital services and strategy.,FALSE,FALSE,43998737,NA
Kaan Terzioğlu,1057988831780184064,2018-11-01T13:32:48Z,2019 stratejilerimizi konumak zere Turkcell Grup irketleri ile stanbul'da bir araya gelmenin heyecann yayoruz! Dijital rn ve stratejimizin tm gcyle dnyann drt bir yannda mterilerimize 2019'da da stn dijital deneyim salamaya hazrz.//t.co/AlvnxU3uNw,FALSE,FALSE,NA,NA
Kaan Terzioğlu,1057986762671357953,2018-11-01T13:24:35Z,"Tech giants may have to be broken up, says Tim Berners-Lee//t.co/W2BRkj6s22",FALSE,FALSE,NA,NA
Kaan Terzioğlu,1057956779538165760,2018-11-01T11:25:26Z,Canl Bilgi Yarmas Hadi'nin Perde Arkas @Milliyet//t.co/Mj4PVBZWTM,FALSE,FALSE,NA,NA
Kaan Terzioğlu,1057885119539802114,2018-11-01T06:40:41Z,"Trkiye'de ve dnyada yardma muhta olan kim varsa, afanda kzl bir hilal olup doan @Kizilay alan ve gnlllerinin #kzlayhaftas'n itenlikle kutlarm. Milletimize en ok yakan sfatlardan biri olan yardmseverlii dnyaya tamanz gururla takip ediyoruz.//t.co/qGFUU3858y",FALSE,FALSE,NA,kızılayhaftası
Kaan Terzioğlu,1057658416183816192,2018-10-31T15:39:51Z,Always a pleasure hearing @Turkcell. They are doing a lot of innovations and taking the fight to OTT players. They have successfully managed to increase ARPU and reduce churn. #TTCongress//t.co/HaIZtvbeIc,FALSE,TRUE,NA,NA
Kaan Terzioğlu,1057588045036380160,2018-10-31T11:00:13Z,We've embedded video replays in all our news stories from yesterday's #M360RCIS event in Moscow. Check out @TurkcellNews' @Kaan_Terzioglu's keynote as an example://t.co/AmfGemPGpy//t.co/da6Voc4bJo,FALSE,TRUE,NA,M360RCIS
Kaan Terzioğlu,1057541768399466497,2018-10-31T07:56:20Z,"Dijital ehirlerle birlikte dnyada yeni akmlardan biri de dijital belediyecilik. Ankara Bykehir Belediyesi kanal sayesinde @BiPMobil zerinden, otobslerin durumunu sorgulamaktan ehir kameralarn izlemeye kadar pek ok bilgiye eriebilirsiniz.//t.co/MNZwyg5kew//t.co/yWdsFusV9G",FALSE,FALSE,NA,NA
Kaan Terzioğlu,1057304502020255744,2018-10-30T16:13:31Z,"Altyapsn hazrladmz Yozgat ehir Hastanesi alanlarmz, Cumhuriyet Bayram'nda stiklal Marmz iaret diliyle okudular. Hayatn her alann paylatmz engelli vatandalarmzn bu vatann nemli bireyleri olduunu her alanda hatrlamak ok nemli. Tebrikler.//t.co/idytkpHxEd",FALSE,FALSE,NA,NA
Kaan Terzioğlu,1057190573730340864,2018-10-30T08:40:49Z,At #M360RCIS in Moscow. @Kaan_Terzioglu the CEO of Turkcell. Talking about digital indentity and @mobileconnect . Growing your business through mobile identity is a given! A full house as always when Mr Kaan speaks//t.co/i2N2FxXZmM,FALSE,TRUE,NA,M360RCIS
Kaan Terzioğlu,1057190525084844032,2018-10-30T08:40:37Z,@Kaan_Terzioglu CEO of @Turkcell opens second #M360RCIS session: Modernising Policy for Digital Era. Watch the conference live from Moscow //t.co/UTBMYMSiDe//t.co/Ewl0Woxyi3,FALSE,TRUE,NA,M360RCIS
Kaan Terzioğlu,1057180619837530113,2018-10-30T08:01:15Z,"Bugn @GSMA'in Moskova'da dzenledii M360 zirvesinde, kamu-zel sektr ibirlikleriyle dijital ekonomiyi bytmeyi konuuyoruz. Dnyadaki nemli baar hikayelerinden olan Turkcell Trkiye modelini anlatacam konferans takip etmek iin //t.co/OAALWqd3xL",FALSE,FALSE,43998737,NA
Kaan Terzioğlu,1057180617413193729,2018-10-30T08:01:15Z,"Today at @GSMA M360 Series event in Moscow, we will be talking about ""Modernising Policy for the Digital Era,"" an assessment of the demands on regulators going forward, and policies States should adopt to support innovation. #M360RCIS Watch it live://t.co/OAALWqd3xL",FALSE,FALSE,NA,M360RCIS
Kaan Terzioğlu,1057028220288147457,2018-10-29T21:55:41Z,"Vatandalarmzn iletiim ihtiyalarn kesintisiz karlamak iin @TurkTelekom, @Turkcell ve @VodafoneTR stanbul Havaliman'nda hizmet vermeye balad. Bu balamda operatrlerimizi yerinde ziyaret ederek incelemelerde bulunduk.//t.co/xwlB4I57tt",FALSE,TRUE,NA,NA
Kaan Terzioğlu,1056935266164858881,2018-10-29T15:46:19Z,"Dnyann en byk havaliman, Trkiye'nin byyen gcne, byk yatrm ve ihracatlara vesile olsun... stanbul'un yeni Havaliman, stanbul Havaliman, lkemiz iin hayrl olsun. #HayallerDnerGeree//t.co/epSnhqtxQs",FALSE,FALSE,NA,HayallerDönerGerçeğe
Kaan Terzioğlu,1056923240969523200,2018-10-29T14:58:31Z,"Cumhuriyetimizin 95. ylna zel, yarn katklarmzla yaplacak @hadioyna'da toplam 95 bin TL dll iki yarma sizi bekliyor. Yarmalar yarn saat 12:30 ve 20:30'da Hadi'de canl yaynda, sakn karmayn! //t.co/MoYboiRFTj",FALSE,TRUE,NA,NA
Kaan Terzioğlu,1056884906155036677,2018-10-29T12:26:12Z,"Cumhuriyetimizin 95. yln, Cumhuriyeti anlatan en gzel arklarla kutluyoruz! Dinlemek iin fizy'e gel.//t.co/2f6cTsLlpC//t.co/FbQJgZ4lMZ",FALSE,TRUE,NA,NA
Kaan Terzioğlu,1056880875298791424,2018-10-29T12:10:11Z,"Turkcell, dijital servislerine yerli e-posta platformunu eklemeye hazrlanyor. @Kaan_Terzioglu, yerli e-posta iin almalarn baladn aklad. Yerli navigasyon iin ise geri saym balad.//t.co/CfuXphj0uK",FALSE,TRUE,NA,NA
Kaan Terzioğlu,1056868822089637888,2018-10-29T11:22:17Z,"Istanbul Yeni Havaalan hazr, Turkiye hazr. Biz de hazrz.//t.co/mKQWY8lF0S",FALSE,FALSE,NA,NA
Kaan Terzioğlu,1056836996688236545,2018-10-29T09:15:49Z,"Bu lkenin 95 sene nce byk zaferle kazand bamszln, bugn dijital dnyada da srdrmek adna yazlm teknolojilerinin da bamsz olmas iin alyoruz. Bugn mjdeyi @AhmetCan ile verdik: yerli e-posta, ok yaknda.//t.co/pRTmbQ9GHB//t.co/qBxvAhBiNr",FALSE,FALSE,NA,NA
Kaan Terzioğlu,1056834088894640129,2018-10-29T09:04:16Z,Cumhuriyetimiz 95 Yanda. Bizim cumhuriyetimiz. Bizim bayrammz. Kutlu olsun. //t.co/xgUovbB0np,FALSE,TRUE,NA,NA
Kaan Terzioğlu,1056786660380368897,2018-10-29T05:55:48Z,Cumhuriyet Bayrammza zel UpCall'u olan Turkcell'lilere yarn 0532 29 10 1923 numarasndan bir ar gelecek! Siz de hemen UpCall indirin ve yarn bekleyin!//t.co/njjdYpSRJ9//t.co/vtJVF2uWrw,FALSE,TRUE,NA,NA
Kaan Terzioğlu,1056604027868377088,2018-10-28T17:50:05Z,Yeni Havalimanmzn sertifikasn Bakanmz @mcahidturhan @Ksamsunlu ya takdim etti. Ardndan konuk bakanlarmzla ikili grmeler yapyoruz. 29.10.2018 PAZARTES SAAT 15:30'DA Bakanmz @RT_Erdogan n terifleriyle gerekleecek alta bulumak zere.//t.co/Vxz4LzgTNv,FALSE,TRUE,NA,NA
Kaan Terzioğlu,1056603985329733633,2018-10-28T17:49:55Z,"Federer 99. ampiyonluk kupasn svire'de TV+ ile Life+ ekranlarnda kaldrd! imdi TV+ indir, hem seremoniyi hem final karlamasn geri alp izle. ndirmek iin://t.co/pcn33NCedQ//t.co/CHyPuYwS6W",FALSE,TRUE,NA,NA
Kaan Terzioğlu,1056485795052339201,2018-10-28T10:00:16Z,"Milli sporcumuz @sahikaercumen, Salda Gl'nde dnya serbest dal rekorunu krd! Tebrikler @sahikaercumen! Baarnn hikayesi ise yaknda @TurkcellTVPlus'ta!//t.co/FbMbyYsjMq",FALSE,TRUE,NA,NA
Kaan Terzioğlu,1056476542367346689,2018-10-28T09:23:30Z,"Turkcell #PlatinumGolfChallenge 2018 Cumhuriyet Kupas'nda 29 Ekim heyecann, golf severlerle birlikte yayoruz. Herkese baarlar dilerim.//t.co/23L7EFeP0K",FALSE,FALSE,NA,PlatinumGolfChallenge
Kaan Terzioğlu,1056475596912517120,2018-10-28T09:19:45Z,"Milli greimiz Metehan Baar, Macaristan'daki Bykler Dnya Gre ampiyonas'nda grekoromen stil 87 kilo final manda galip gelerek altn madalyay kazand. Sporcumuzu gnlden tebrik ederiz! //t.co/72Gept2B2U",FALSE,TRUE,NA,NA
Kaan Terzioğlu,1056242335934283777,2018-10-27T17:52:51Z,"Aya rini'nin muhteem atmosferinde gerekleen stanbul Night Flight Konserleri'nde bu akam, 4 yetenekli mzisyenden oluan Salut Salon var. Keyifli ve heyecan verici bir akam olacak.//t.co/KzQ3n1962J",FALSE,FALSE,NA,NA
Kaan Terzioğlu,1056117804850733056,2018-10-27T09:38:01Z,"Tunceli'nin Nazmiye krsalnda terr unsurlarna kar yrtlen operasyonda askerlerimizin ehit olduunu derin bir znt ile renmi bulunuyoruz. ehitlerimize Allah'tan rahmet; aileleri, Trk Silahl Kuvvetlerimiz ve milletimize basal diliyor, terr lanetliyoruz.//t.co/420CFoE3mC",FALSE,TRUE,NA,NA
Kaan Terzioğlu,1056098653335707648,2018-10-27T08:21:54Z,Bir zafer ant olan stanbul 3. Havaalan zveri dolu bir almann ardndan ala hazr. Bu gurur kayna atlmn dnya apnda imza att ilklere ve baarlara katkda bulunmak byk gurur.//t.co/CMAD5A71vC,FALSE,FALSE,NA,NA
Kaan Terzioğlu,1055855894955728896,2018-10-26T16:17:16Z,"95 yldr her zorluu hep birlikte atk, lkemizi daha ileriye gtrmek iin beraber mcadele ettik. Biz de teknolojimizle Trkiye'yi #TamYolleri tamak iin canla bala almaya devam edeceiz. Cumhuriyet Bayrammz kutlu olsun. //t.co/ZLQVCdfbli",TRUE,FALSE,NA,TamYolİleri
Kaan Terzioğlu,1055752357894602757,2018-10-26T09:25:51Z,"Trkiye'yi mobil teknolojilerde bir st lige tamaya devam ediyoruz: stanbul Yeni Havaliman'nn teknoloji altyapsn, @TurkTelekom ve @VodafoneTR ile birlikte hazrladk. Dnyann en byk Havaliman'na, dnyann en hzl 4.5G deneyimi yarar.//t.co/pgzY02CiOU",FALSE,FALSE,NA,NA
Kaan Terzioğlu,1055700799194648577,2018-10-26T06:00:59Z,"Operatrnz ile bir gnde 32 dakika geiriyorsanz, Turkcell'li deilsiniz demektir. Abonelerimiz bizimle 48 dakika mzik dinliyor, 60 dakika televizyon izliyor, 21 dakika dergi ve gazete okuyor. Hzla bymemizin srlarndan biri de bu!//t.co/aA5XSh6Khh",FALSE,FALSE,NA,NA
Kaan Terzioğlu,1055440290235011075,2018-10-25T12:45:48Z,"1 yl nce Trkiye'nin verisi Trkiye'de kalmal dedik, Trkiye'nin arama motoru Yaani'yi hayata geirdik. Bugn milyonlarca kullancya ulaan Yaani'nin bir ylda geldii nokta gurur ve mutluluk verici. Yaani'de ok ey arattk, elalemin arama motorlarn aratmadk.//t.co/85REU9vVJs",TRUE,FALSE,NA,NA
Kaan Terzioğlu,1055357818210058241,2018-10-25T07:18:06Z,"Bu gurur verici tabloda emei geen ekip arkadalarmz kutluyor, desteklerini eksik etmeyen yatrmc ve i ortaklarmza teekkrlerimi sunuyorum. nc eyrek ve ilk 9 ay sonularmzn tamam iin: //t.co/G19A8zCD74 #TrkiyeKazanacak",FALSE,FALSE,43998737,TürkiyeKazanacak
Kaan Terzioğlu,1055357811817881601,2018-10-25T07:18:04Z,"Turkcell Grubu olarak son 3,5 ylda oluturduumuz i modeli, 2018 ylnn nc eyreinde, makroekonomik dengelerin zorlu testinden baaryla geti. Turkcell'in ilk 9 aydaki stn performans aslnda Trkiye'nin bu gnlerdeki potansiyelini gstermesi asndan da ok nemli.//t.co/nCFJbEuFy5",FALSE,FALSE,NA,NA
Kaan Terzioğlu,1055355257486745600,2018-10-25T07:07:55Z,"Bu gurur verici tabloda emei geen ekip arkadalarmz kutluyor, desteklerini eksik etmeyen yatrmc ve i ortaklarmza teekkrlerimi sunuyorum. nc eyrek ve ilk 9 ay sonularmzn tamam iin: //t.co/G19A8zCD74 #TrkiyeKazanacak",FALSE,FALSE,43998737,TürkiyeKazanacak
Kaan Terzioğlu,1055306635978117120,2018-10-25T03:54:43Z,"Gzel bir gn olsun Trkiye. Antartika'da Bip'li says 6 dan 7 ye kt, Grnland'da da artk 1 Bip'li var :)//t.co/6GHxP1ldir",FALSE,FALSE,NA,NA
Kaan Terzioğlu,1055134861323837441,2018-10-24T16:32:09Z,"Yln nc eyreinde gelirlerimizi %26,1 artrarak 5,8 milyar TL ile bugne kadar bir eyrekte elde edilen en yksek gelire ulatk. Bu sonularla Turkcell Grup'un yln ilk dokuz ayndaki byme oran %20,8 olurken, toplam gelirleri ise 15,7 milyar TL'ye ulat.",FALSE,FALSE,43998737,NA
Kaan Terzioğlu,1055134858891137025,2018-10-24T16:32:08Z,"We registered all time high quarterly revenues of TRY 5.8 billion on 26.1% growth in the third quarter of the year. With these results, Turkcell Group's revenues in the first nine months reached TRY 15.7 billion on 20.8% growth.//t.co/cpHuia37FY",FALSE,FALSE,NA,NA
Kaan Terzioğlu,1055121063682686977,2018-10-24T15:37:19Z,"Kadnlarmzn istihdama katks, ekonomik zgrlkleri ve lkemizin kalknmasn hzlandrmak iin ok nemli bir deer. Gelecei Yazan Kadnlar projemiz ile test uzmanlarmz istihdam ettik, onlar Trkiye'nin uygulamalarn deneyen ve gelitiren bireyler haline getirdik.//t.co/Qz3dyUhG3r",TRUE,FALSE,NA,NA
Kaan Terzioğlu,1055112405989101568,2018-10-24T15:02:55Z,"Big companies often end up creating big bureaucracies. This saps creativity, risk-taking, and productivity. @profhamel @MicheleZanini //t.co/qEVDjrvNQB",FALSE,TRUE,NA,NA
Kaan Terzioğlu,1055111478796341248,2018-10-24T14:59:14Z,24 Ekim - 5 Kasm tarihleri arasnda Meksika'da oynanacak Ampute Futbol Dnya Kupas'nda Milli Takmmza olan inancmz tam. Avrupa'dan sonra imdi sra Dnya Kupas'nda! //t.co/aleJMUrHgV,FALSE,TRUE,NA,NA
Kaan Terzioğlu,1055053111394484225,2018-10-24T11:07:18Z,"Happy United Nations Day! Today, let's remember once again UN Sustainable Development Goals and their importance. We should continue to work all together for a better world in 2030! #UNday #UnitedNations #GlobalGoals//t.co/XJexZKEhGw",FALSE,FALSE,43998737,UNday
Kaan Terzioğlu,1055053111394484225,2018-10-24T11:07:18Z,"Happy United Nations Day! Today, let's remember once again UN Sustainable Development Goals and their importance. We should continue to work all together for a better world in 2030! #UNday #UnitedNations #GlobalGoals//t.co/XJexZKEhGw",FALSE,FALSE,43998737,UnitedNations
Kaan Terzioğlu,1055053111394484225,2018-10-24T11:07:18Z,"Happy United Nations Day! Today, let's remember once again UN Sustainable Development Goals and their importance. We should continue to work all together for a better world in 2030! #UNday #UnitedNations #GlobalGoals//t.co/XJexZKEhGw",FALSE,FALSE,43998737,GlobalGoals
Kaan Terzioğlu,1055053098308255746,2018-10-24T11:07:15Z,Birlemi Milletler Gn kutlu olsun! Bugn bir kez daha BM Kresel Srdrlebilir Kalknma Hedeflerinin nemini hatrlayalm. Dnyamzn 2030'da herkes iin daha yaanlabilir olmas iin hep birlikte almaya devam edelim #UNday #UnitedNations #GlobalGoals//t.co/ZGNkYSs9PU,FALSE,FALSE,NA,UNday
Kaan Terzioğlu,1055053098308255746,2018-10-24T11:07:15Z,Birlemi Milletler Gn kutlu olsun! Bugn bir kez daha BM Kresel Srdrlebilir Kalknma Hedeflerinin nemini hatrlayalm. Dnyamzn 2030'da herkes iin daha yaanlabilir olmas iin hep birlikte almaya devam edelim #UNday #UnitedNations #GlobalGoals//t.co/ZGNkYSs9PU,FALSE,FALSE,NA,UnitedNations
Kaan Terzioğlu,1055053098308255746,2018-10-24T11:07:15Z,Birlemi Milletler Gn kutlu olsun! Bugn bir kez daha BM Kresel Srdrlebilir Kalknma Hedeflerinin nemini hatrlayalm. Dnyamzn 2030'da herkes iin daha yaanlabilir olmas iin hep birlikte almaya devam edelim #UNday #UnitedNations #GlobalGoals//t.co/ZGNkYSs9PU,FALSE,FALSE,NA,GlobalGoals
Kaan Terzioğlu,1054930871906648064,2018-10-24T03:01:34Z,Samsun'da 'Akll kavak' projesi balyor Samsun Haber | Samsun Gazetesi//t.co/aJhymA6UMb,FALSE,FALSE,NA,NA
Kaan Terzioğlu,1054431302554959872,2018-10-22T17:56:27Z,"Turkcell #PlatinumGolfChallenge 2018 Turnuvas, golf severleri Kemer Country Golf Kulb'nde bir araya getirdi. dl treniyle son bulan turnuvay deerli klan katlmclarmza teekkr ederiz! //t.co/WdCflq2Iyn",FALSE,TRUE,NA,PlatinumGolfChallenge
Kaan Terzioğlu,1054394587387695105,2018-10-22T15:30:33Z,"25 ylda 1 milyon engelli bireyin hayatna dokunduk. 45 ilde 30 bindenfazla renciye ulatmz Engelsiz Eitim Programmz ile bugn de3 bini akn renciye ehirlerini dokunarak, hissederek, duyarak gezmelerini, yaamalarn salamak byk mutluluk.//t.co/ogvWwJjJp2//t.co/NCwsl8tB1T",FALSE,FALSE,NA,NA
Kaan Terzioğlu,1054359157741154304,2018-10-22T13:09:46Z,"Trkiye'nin uygulamalarn retmek kadar, gerek fayda salamak da byk nem tayor. Milyonlara ulaan uygulamalarmz bunun en gzel kant. Bugn Upcall 5 milyonun zerinde indirme says ile ikinci yan kutluyor, bizi gururlandryor.//t.co/U1BBoQz7P5",FALSE,FALSE,NA,NA
Kaan Terzioğlu,1054071437139566604,2018-10-21T18:06:28Z,"Gen bir adam ektii fotoraflardan bahsedince, byk stad Ara Gler muzipe ""ftihar et o zaman"" demiti. Topra bol olsun.//t.co/kNEJT6hdbq",FALSE,FALSE,NA,NA
Kaan Terzioğlu,1054014434950213633,2018-10-21T14:19:58Z,"21 Ekim Pazar gn Paycell sponsorluunda yaplacak olan 60.000 TL rekor dll @hadioyna yarmasnda jokerin kankandan. Hemen Paycell Kart al, HAD (boluk) kart numarann son 4 hanesini yazp 2255'e SMS at, annda joker kazan. #hadioynalive//t.co/jVTuupz2aA",FALSE,TRUE,NA,NA
Kaan Terzioğlu,1054014188614488064,2018-10-21T14:18:59Z,What to ask when your child wants to own a phone and use social media? Have your child take the DQ Test at//t.co/JG69TNqktl first and find out their DQ first! #DQEverychild//t.co/IMa08BqUXN,FALSE,TRUE,NA,NA
Kaan Terzioğlu,1053985265361043463,2018-10-21T12:24:04Z,Yeni zam alm enitenize BiP indirtin. nk genel kltrnle hem internet hem para kazanabilecei uygulamalar var. Eniteniz bunlar duyunca kesin indirir.//t.co/1a9OYlRptB,FALSE,TRUE,NA,NA
Kaan Terzioğlu,1053952781718093824,2018-10-21T10:14:59Z,"nternetin sonsuz dnyasn 2'ye katladk! Enflasyonla mcadelede biz de varz. @BiPMobil'den kefete gir, Enflasyonla Mcadele kanaln takip et! Hem internetini hem de paketindeki uygulamalar 2'ye katla! #TrkiyeKazanacak //t.co/URsBxDygv6//t.co/luexGpGxsz",FALSE,TRUE,NA,NA
