name,status_id,created_at,text,is_quote,is_retweet,reply_to_user_id,hashtags
Keith Block,1180128255715577857,2019-10-04T14:31:16Z,An honor to open @Salesforce to @NancyatHeart and an incredible group of CEOs & healthcare experts. Thanks for sharing ideas & experiences!//t.co/j2FqJTbXlg,TRUE,FALSE,NA,NA
Keith Block,1179845162060566530,2019-10-03T19:46:21Z,"Great to catch up with one of my home-state lawmakers. @RepJoeKennedy, thanks for visiting @Salesforce!//t.co/uQFUeGnTuZ",FALSE,FALSE,NA,NA
Keith Block,1177394006310834176,2019-09-27T01:26:20Z,"""Our generation inherited a healthy ocean from our forebearers. But we are passing on a more broken and fragile ocean to the next generation. @Benioff and @RichardBranson on the role of business in the fight against climate change #UNGA19 #ClimateWeekNYC//t.co/pdukRJVYOC",FALSE,FALSE,NA,UNGA19
Keith Block,1177394006310834176,2019-09-27T01:26:20Z,"""Our generation inherited a healthy ocean from our forebearers. But we are passing on a more broken and fragile ocean to the next generation. @Benioff and @RichardBranson on the role of business in the fight against climate change #UNGA19 #ClimateWeekNYC//t.co/pdukRJVYOC",FALSE,FALSE,NA,ClimateWeekNYC
Keith Block,1177393817466466304,2019-09-27T01:25:35Z,Thank you for joining us on the path to #EqualityForAll and tuning into #RepresentationMatters today Sponsored by @Deloitte//t.co/dW2Ofnod95,FALSE,TRUE,NA,EqualityForAll
Keith Block,1177393817466466304,2019-09-27T01:25:35Z,Thank you for joining us on the path to #EqualityForAll and tuning into #RepresentationMatters today Sponsored by @Deloitte//t.co/dW2Ofnod95,FALSE,TRUE,NA,RepresentationMatters
Keith Block,1177393754442846209,2019-09-27T01:25:20Z,"The Future of AI is the power to make a positive change. In the latest #MakeChangeSeries, 14 executives including @IBM CMO @michelleapeluso share how they are harnessing the power of artificial intelligence to change their businesses://t.co/VMNrpYba5G//t.co/ioW5888LZe",FALSE,TRUE,NA,MakeChangeSeries
Keith Block,1176680572476784640,2019-09-25T02:11:24Z,Congratulations to @Salesforce's @NikiChristoffrecognized by @FortuneMagazine as one of the 25 Most Powerful Women in Politics!//t.co/F4BVdfBvCI,FALSE,FALSE,NA,NA
Keith Block,1175146305036771328,2019-09-20T20:34:46Z,Hear our CEO Mike Corbat discuss how AI is enabling us to serve our customers in new and different ways. We're excited to participate in @Salesforce's #MakeChangeSeries on the Future of AI. Learn more here://t.co/uCjvuiL5M6//t.co/VmgI7eO6IK,FALSE,TRUE,NA,NA
Keith Block,1175146233532338176,2019-09-20T20:34:29Z,"We need federal #privacy regulations - not by state or Zip code. Thank you, @KeithBlock of @salesforce, for being clear and vocal about this issue at @ShopFloorNAM board meeting. We are on collision course and need leaders to step up.//t.co/gV6vPwro7U",FALSE,TRUE,NA,privacy
Keith Block,1175146205111676928,2019-09-20T20:34:23Z,Thank you @JayTimmonsNAM for welcoming me at @ShopfloorNAM's Board Meeting and for a great discussion on the incredible innovation happening in manufacturing and the opportunity ahead.//t.co/73S0VK882e,TRUE,FALSE,NA,NA
Keith Block,1174824578964525057,2019-09-19T23:16:21Z,Tech giant Salesforce unveils new pollution tracking tool called Sustainability Cloud //t.co/VldksWVJWX//t.co/he3EOsaen7,FALSE,TRUE,NA,NA
Keith Block,1174824537831067648,2019-09-19T23:16:11Z,Our Ohana just got a little biggersay hello to Consumer Goods Cloud and Manufacturing Cloud. @TechCrunch shares the scoop on these new specialized solutions://t.co/2SIbD5VhUU,FALSE,TRUE,NA,NA
Keith Block,1172216922500263938,2019-09-12T18:34:27Z,"At @Salesforce, we believe that business must be part of our communities. Today, we're donating another $17.2M to SF and Oakland public schools on track to reach our goal of $100M.//t.co/CEvcuOojTG",FALSE,FALSE,NA,NA
Keith Block,1171516104901939201,2019-09-10T20:09:39Z,"Proud to join fellow @BizRoundtable CEOs in urging Congress to act on privacywe must ensure that consumers are protected by a national privacy law, and not a patchwork of state laws.//t.co/8Vo7VBwTQ9",FALSE,FALSE,NA,NA
Keith Block,1170099965420421120,2019-09-06T22:22:25Z,"By no longer using single-use shampoo bottles across its brands, @Marriott will eliminate 1.7M pounds of plastic each year. That's how a #Trailblazer shapes a sustainable future.//t.co/epfbT0Tg8n",FALSE,FALSE,NA,Trailblazer
Keith Block,1165659157720117250,2019-08-25T16:16:14Z,@nowthisnews @DropkickMurphys How great is this!,FALSE,FALSE,701725963,NA
Keith Block,1164691986072256512,2019-08-23T00:13:03Z,Thank you @JimCramer for having me to discuss @Salesforce's Q2 results and the incredible opportunity ahead as more companies invest in digital transformation://t.co/bVs2od60Ut,FALSE,FALSE,NA,NA
Keith Block,1164691354217095168,2019-08-23T00:10:32Z,"@Benioff ""An enormous wave of digital transformation is sweeping across every industry."" -- Co-CEO @KeithBlock on Salesforce's Q2 earnings report://t.co/QaQ0rwQ5g6//t.co/EgLAFACuUx",FALSE,TRUE,NA,NA
Keith Block,1163560335371956225,2019-08-19T21:16:16Z,"As CEOs we must focus on bringing value to all stakeholders customers, employees, partners, communities and shareholders. Proud to join fellow @BizRoundtable CEOs in redefining the purpose of a corporation.//t.co/rjYGcD2cNM",FALSE,FALSE,NA,NA
Keith Block,1162438631715291137,2019-08-16T18:59:01Z,Salesforce Blockchain certifies the first ever artwork-painted Lamborghini://t.co/D17mwfr6rz,FALSE,FALSE,NA,NA
Keith Block,1162438217607499781,2019-08-16T18:57:22Z,Today marks the first of many milestones to come of making our dream come true of a fully accredited degree for free on @trailhead. People should not have to be crippled with student debt to learn the in demand skills that companies are hiring for//t.co/pPqOtm3KQI,FALSE,TRUE,NA,NA
Keith Block,1159553744775700480,2019-08-08T19:55:30Z,Make America Safe Again.//t.co/EiqQsrahng,FALSE,TRUE,NA,NA
Keith Block,1159544152175988737,2019-08-08T19:17:23Z,This says it all. ENOUGH!!! How about some action?//t.co/EGhtKyO5tL,TRUE,FALSE,NA,NA
Keith Block,1158842436002566144,2019-08-06T20:49:01Z,"Welcome to @Salesforce, @gadhiaj! We're thrilled to have you join us as CEO of Salesforce UK and Ireland. With your leadership, we are well positioned to move into the next stage of growth and success for Salesforce, our customers, partners and communities.//t.co/k21Gv13odm",TRUE,FALSE,NA,NA
Keith Block,1157821668707852288,2019-08-04T01:12:51Z,Tragedy strikes again. When will we take action? Time for our leaders to step up and do something. Is this the best we can do as a nation? Thoughts and prayers to the families and loved ones. @salesforce//t.co/czRFZ9vxSk,TRUE,FALSE,NA,NA
Keith Block,1154546556835491840,2019-07-26T00:18:44Z,"It's #NationalInternDay, and we are excited to announce @salesforce's $1.8M investment in four #workforcedevelopment organizations, including Year Up. ""At Salesforce, we believe that talent is equally distributed, but opportunity is not,"" says @EbonyBeckwith. ""Some young adults..",FALSE,TRUE,NA,NationalInternDay
Keith Block,1154546556835491840,2019-07-26T00:18:44Z,"It's #NationalInternDay, and we are excited to announce @salesforce's $1.8M investment in four #workforcedevelopment organizations, including Year Up. ""At Salesforce, we believe that talent is equally distributed, but opportunity is not,"" says @EbonyBeckwith. ""Some young adults..",FALSE,TRUE,NA,workforcedevelopment
Keith Block,1154546465336774656,2019-07-26T00:18:22Z,"We're proud to announce we ranked #1 on the #50CompaniesThatCare list by @People and @GPTW_US for the third year in a row! Our commitment to giving back, celebrating diversity, and championing equality remains at the forefront of all that we do.//t.co/2Zz7TuX4Ai//t.co/ZSmDnioozF",FALSE,TRUE,NA,50CompaniesThatCare
Keith Block,1146205275298205696,2019-07-02T23:53:27Z,"Our brand NEW website, built 100% on @CommunityCloud, is LIVE. Discover how our program works, hear from Veterans and Military Spouses who have found success with #Vetforce, and learn how employers tap into this trained and diverse talent pool.//t.co/Xr8CFk88FF//t.co/6VlGsgHal6",FALSE,TRUE,NA,NA
Keith Block,1146202026214211584,2019-07-02T23:40:33Z,We invited students from local middle schools to come and pitch their solutions to some of the world's biggest problems. What we saw blew us away. #FutureReady #FutureTraiblazers #STEM//t.co/089AGi96WR,FALSE,TRUE,NA,NA
Keith Block,1146201990399057920,2019-07-02T23:40:24Z,"""For soldiers leaving the army, the hardest bit is figuring out your next step and how to go about it. What skills do I have to get a job on Civvy Street? But there is light at the end of the tunnel."" Shane Whittingham @Vetforce member in @diginomica //t.co/tp3eAo18i1",FALSE,TRUE,NA,NA
Keith Block,1144710632719048704,2019-06-28T20:54:17Z,Salesforce open sources research to advance state of the art in AI for common sense reasoning//t.co/Gy7lCw7KUv via @ZDNet,FALSE,FALSE,NA,NA
Keith Block,1144710492163698689,2019-06-28T20:53:43Z,"Today we celebrate an incredible milestone for our Trailblazer Communitywe now have 1,000 Trailblazer Community Groups where Trailblazers can learn with their peers, build their networks, and find mentors. Join us in saying #ThanksTrailblazers!//t.co/bhG6utoTU0//t.co/gh5L56a3md",FALSE,TRUE,NA,NA
Keith Block,1143254210101727232,2019-06-24T20:26:58Z,"Amazing story about a real hero, our own Dave Rey. This past weekend Dave was dockside at a restaurant with his family in Annapolis. Hearing a splash, a 3 year old girl had fallen into the river. Dave jumped in and saved her!!! Way to go Dave!!! @salesforce",FALSE,FALSE,NA,NA
Keith Block,1142079085251710977,2019-06-21T14:37:27Z,"CDP CRM Customer 360 Now you can unify disparate customer data throughout your entire organization, then personalize every engagement based on a single view of the customer. That's what we call Customer 360://t.co/Hmu2rlln95//t.co/FVxrva0MW7",FALSE,TRUE,NA,NA
Keith Block,1142079042331402240,2019-06-21T14:37:17Z,"Back in the 90s, making back-end servers talk to each other was an expensive and cumbersome business. With #APIs, this process has become fast and painless. @BBCBusiness shares how @AirMalta turned its business around://t.co/9fMdvzPuIt",FALSE,TRUE,NA,APIs
Keith Block,1139681772755513344,2019-06-14T23:51:23Z,"//t.co/eXgqCiKiiV to scale up its operations in Japan, which its co-CEO calls an incubator.//t.co/ctDrTTeMF4",FALSE,TRUE,NA,NA
Keith Block,1139681682003378176,2019-06-14T23:51:01Z,@BenioffSalesforce@KeithBlock #Keith #Salesforce//t.co/UNAn6gVxGi,FALSE,TRUE,NA,Keith
Keith Block,1138080495411945472,2019-06-10T13:48:29Z,"Data is the foundation of every digital transformation. With @Tableau, @Salesforce will be able to provide companies with a truly unified and powerful view across all of their data//t.co/NqBZZEGVwF Important://t.co/xg94tV3ipP",FALSE,FALSE,NA,NA
Keith Block,1136081858301587456,2019-06-05T01:26:37Z,Watch @Benioff and @jimcramer discuss what's driving @Salesforce's growth and the two common themes we're hearing from CEOs worldwide the importance of digital transformation & re-skilling the workforce @CNBC//t.co/D4qIgB1NQq,FALSE,FALSE,NA,NA
Keith Block,1136080939103088640,2019-06-05T01:22:57Z,Salesforce raised its full-year earnings outlook after the company said it delivered record revenue in the latest quarter//t.co/8ruvsNDs5W,FALSE,TRUE,NA,NA
Keith Block,1134454321410482179,2019-05-31T13:39:22Z,Very excited about the value @Salesforce Blockchain will create for our customers and to finally have a product named after me #TDX19//t.co/fZ20MIQk7C//t.co/9EMSykyld7,TRUE,FALSE,NA,TDX19
Keith Block,1134453488639889408,2019-05-31T13:36:03Z,Salesforce's first blockchain plunge will involve development tools//t.co/u0KoIXA3gJ by @ron_miller//t.co/c9gWuxAi0I,FALSE,TRUE,NA,NA
Keith Block,1132988976959115264,2019-05-27T12:36:36Z,Thinking of all of those who made the ultimate sacrifice while serving their country. Thank you to all of the men and women who serve and protect us everyday. America's finest!! @Salesforce @Vetforce,FALSE,FALSE,NA,NA
Keith Block,1132068940375416832,2019-05-24T23:40:42Z,The future is bright with new features for both customers and partners. Introducing Consultants on AppExchange and Partner Intelligence://t.co/dTeAlfyaa4//t.co/gdUyLzmm8M,FALSE,TRUE,NA,NA
Keith Block,1132068875703468032,2019-05-24T23:40:27Z,Very excited about the launch of our second fund focused on European startups that are providing innovative technologies for our customers. We are seeing tremendous opportunities and meeting impressive entrepreneurs throughout Europe.//t.co/tWLHyL05o8,FALSE,TRUE,NA,NA
Keith Block,1128481436971851777,2019-05-15T02:05:15Z,.@Vetforce #Trailblazer @JennRudiger sharing her @Trailhead story with @LisaMEdwards was a great highlight from #SalesforceTour D.C. today amazing combination of personal determination and drive//t.co/lpu4kFWikh,FALSE,FALSE,NA,Trailblazer
Keith Block,1128481436971851777,2019-05-15T02:05:15Z,.@Vetforce #Trailblazer @JennRudiger sharing her @Trailhead story with @LisaMEdwards was a great highlight from #SalesforceTour D.C. today amazing combination of personal determination and drive//t.co/lpu4kFWikh,FALSE,FALSE,NA,SalesforceTour
Keith Block,1128467508569108480,2019-05-15T01:09:54Z,"Awesome to see @LisaMEdwards spotlight the @Vetforce Alliance and Pathfinder initiatives at the #SalesforceTour in D.C. Thanks to @Salesforce, @Prudential, @Accenture, & @Deloitte, we're going to make a big difference in people's lives. #Ohana #Veterans//t.co/i7lMYTFJx5",FALSE,TRUE,NA,SalesforceTour
Keith Block,1128065530772934657,2019-05-13T22:32:35Z,Last week I was inspired by the stories & histories of our exceptional @YearUp interns who are halfway through their 6 month @Salesforce internships. Very proud of the many talented young people I've had the pleasure of meeting excited to see what they'll accomplish.,FALSE,FALSE,NA,NA
Keith Block,1128064308485615617,2019-05-13T22:27:44Z,Salesforce is committed to increasing the hiring of military veterans & spouses in the ecosystem. We are proud to announce Vetforce Alliance in partnership with @Accenture & @Prudential to prioritize & accelerate interviewing & hiring military talent.//t.co/p5L2wCjzrI//t.co/uBySxpsS6l,FALSE,TRUE,NA,NA
Keith Block,1128064249815650305,2019-05-13T22:27:30Z,"Salesforce is committed to investing in the workforce of the future. Read more about @Salesforce's new workforce development initiatives through @Trailhead, @Vetforce and the Pathfinder Program here://t.co/ZORJechMQi//t.co/Cy7Bix6y1t",FALSE,TRUE,NA,NA
Keith Block,1126692899633025031,2019-05-10T03:38:14Z,Imagine losing your job and not knowing what to do next. Now imagine someone telling you about @salesforce and this cool thing called @trailhead and imagine you using it to break into a new career. I don't have to imagine anymore because it all came true!!//t.co/SWBCAmeyUK,FALSE,TRUE,NA,NA
Keith Block,1126692872193839104,2019-05-10T03:38:08Z,Salesforce brings more Einstein AI tools to Financial Services Cloud//t.co/zAhFOcQdyD by @natalienoell,FALSE,TRUE,NA,NA
Keith Block,1126692825632915456,2019-05-10T03:37:57Z,Another wonderful Saturday @pi_tap #trailblazercommunity @JeffTelijeune @makedawk @bdeloryn @LeahBMH @mbaizman @JhonaikelS//t.co/rJVTuT61g0,FALSE,TRUE,NA,trailblazercommunity
Keith Block,1123277423003328514,2019-04-30T17:26:21Z,Congrats @cristinam_jones! Well deserved. @Salesforce is lucky to have your vision and leadership.//t.co/cMATNx5vpI,TRUE,FALSE,NA,NA
Keith Block,1123277186880774144,2019-04-30T17:25:25Z,Congratulations on the incredible achievement @Tyler_SFDC!//t.co/BMFFckNstp,TRUE,FALSE,NA,NA
Keith Block,1121789564320772097,2019-04-26T14:54:08Z,MuleSoft is the only company named a Leader by @Gartner_inc in *both* Magic Quadrants for Enterprise #iPaaS and Full Life Cycle #API Management!//t.co/as5DEw7d0h #integration #EnterpriseIT,FALSE,TRUE,NA,iPaaS
Keith Block,1121789489729290241,2019-04-26T14:53:50Z,"We're now 55% of the way toward our 100% Renewable Energy Goal. Every year, we make our annual Stakeholder Impact Report public to keep us accountable creating meaningful impact around the world://t.co/b3wbyTnk2R//t.co/X5vJdta0gg",FALSE,TRUE,NA,NA
Keith Block,1118012702092185601,2019-04-16T04:46:14Z,"Thanks, @gamoid. Enjoyed our conversation about @Salesforce's commitment to our values and our customers. Looking forward to what's next.//t.co/1SNC9sLqSO",FALSE,FALSE,NA,NA
Keith Block,1117179825460875264,2019-04-13T21:36:41Z,"So proud of our Mark Hawkins. Well deserved, great leadership, awesome GBO team. Way to go Mark!!! @salesforce//t.co/hBd6cmCXM1",TRUE,FALSE,NA,NA
Keith Block,1116443353652948992,2019-04-11T20:50:12Z,"Congratulations, @ksehines1! Well deserved. Thank you for creating opportunity for your students and community through your incredible work with @TeamTimilty, @pi_tap and @Trailhead #BAMSummitSF//t.co/7p2QNw7LMd",TRUE,FALSE,NA,BAMSummitSF
Keith Block,1116442657209761792,2019-04-11T20:47:26Z,Congrats @ksehines1 for winning the first ever BAMMY award! #BAMSummitSF //t.co/tx4oyj45Pn,FALSE,TRUE,NA,BAMSummitSF
Keith Block,1116438837922656256,2019-04-11T20:32:16Z,"A big was going to come and read to my classroom @KeithBlock came in and he fell in love with my kids and they fell in love with him, & he stayed. I said, What is this company and these values? This is what my kids need. @ksehines1 #BAMSummitSF//t.co/r52M2WTrQv",FALSE,TRUE,NA,NA
Keith Block,1116438226837786625,2019-04-11T20:29:50Z,"Our new Tokyo Salesforce Tower will add 2,000 new jobs over the next five years! We'll also empower the community by opening our doors to local non-profits://t.co/O3JyCBITPa//t.co/W4NnzNwEpB",FALSE,TRUE,NA,NA
Keith Block,1116438146441330688,2019-04-11T20:29:31Z,Salesforce and Google want to build a smarter customer service experience #GoogleNext19//t.co/UEbnqazlKC,FALSE,TRUE,NA,GoogleNext19
Keith Block,1116438049942949888,2019-04-11T20:29:08Z,"@IndustryWeek STEM event great meeting Alexa Hansen @CarnegieMellon. We spoke about the Block Center for Technology and it's focus on how emerging technologies will alter the future of work, how AI and analytics can be harnessed for social good. @KeithBlock #Manufacturing//t.co/luJngEhVrD",FALSE,TRUE,NA,NA
Keith Block,1114217918839943168,2019-04-05T17:27:07Z,Thank you to @LockheedMartin's Marillyn Hewson for nominating @Salesforce for @BizRoundtable's #EmbracingSustainability Challenge. Protecting our planet for future generations is a critical part of our commitment to equality. Now over to @MedtronicCEO.//t.co/BknDvI9RZC,FALSE,FALSE,NA,EmbracingSustainability
Keith Block,1114216268930768897,2019-04-05T17:20:34Z,"Thank you @CaterpillarInc Jim Umpleby for challenging us in the @BizRoundtable #EmbracingSustainability Challenge. Our CEO, Marillyn Hewson, shares how sustainability is at the center of our business. We now challenge @KeithBlock to share @salesforce's story. //t.co/xQ3fQPdAE1",FALSE,TRUE,NA,EmbracingSustainability
Keith Block,1113267202788958208,2019-04-03T02:29:19Z,".@Salesforce believes in #EqualityforAll. Four years ago, we committed to equal pay for equal work & we've spent $10.3M to address pay inequality. We are proud of our progress, but know there's still more work to be done. #EqualPayDay//t.co/BGEimhM0Ie//t.co/goVFkIsJSq",FALSE,FALSE,NA,EqualityforAll
Keith Block,1113267202788958208,2019-04-03T02:29:19Z,".@Salesforce believes in #EqualityforAll. Four years ago, we committed to equal pay for equal work & we've spent $10.3M to address pay inequality. We are proud of our progress, but know there's still more work to be done. #EqualPayDay//t.co/BGEimhM0Ie//t.co/goVFkIsJSq",FALSE,FALSE,NA,EqualPayDay
Keith Block,1112417972058886144,2019-03-31T18:14:46Z,This young @pi_tap participant has earned 30 #TrailHead badges in just 3weeks! @t_eshun is helping him craft a 7-Second Resume to share his technical knowledge. @LeahBMH @bdeloryn @mbaizman @Sotojhonaikel//t.co/7ztqrtqWMv,FALSE,TRUE,NA,TrailHead
Keith Block,1112417242359054336,2019-03-31T18:11:52Z,@pi_tap founder @ksehines1 being a @trailhead #multiplier on a Monday night @JeffTelijeune @antonela_lula @mbaizman//t.co/PLUigTOCgz,FALSE,TRUE,NA,multiplier
Keith Block,1108535543447445504,2019-03-21T01:07:23Z,"With @Vetforce and @Trailhead, veterans are positioned to receive a homecoming that merits their service and America's thanks. @DivInAction on @Salesforce's Vetforce training program for military veterans and spouses.//t.co/Iqpuw88Zmq",FALSE,TRUE,NA,NA
Keith Block,1108535400627200000,2019-03-21T01:06:49Z,Happy #InternationalWomensDay Join us in celebrating the #TrailblazingWomen in our lives. Tag a #TrailblazingWomen who's inspired you and share their story! Dont forget to join us for #TrailblazingWomen Summit You can sign up for the live stream here://t.co/EgViXAcYEA//t.co/6pgEUOvE7s,FALSE,TRUE,NA,InternationalWomensDay
Keith Block,1108535400627200000,2019-03-21T01:06:49Z,Happy #InternationalWomensDay Join us in celebrating the #TrailblazingWomen in our lives. Tag a #TrailblazingWomen who's inspired you and share their story! Dont forget to join us for #TrailblazingWomen Summit You can sign up for the live stream here://t.co/EgViXAcYEA//t.co/6pgEUOvE7s,FALSE,TRUE,NA,TrailblazingWomen
Keith Block,1108535400627200000,2019-03-21T01:06:49Z,Happy #InternationalWomensDay Join us in celebrating the #TrailblazingWomen in our lives. Tag a #TrailblazingWomen who's inspired you and share their story! Dont forget to join us for #TrailblazingWomen Summit You can sign up for the live stream here://t.co/EgViXAcYEA//t.co/6pgEUOvE7s,FALSE,TRUE,NA,TrailblazingWomen
Keith Block,1108535317626126336,2019-03-21T01:06:29Z,"Salesforce's Service Cloud adds automated case routing, reply recommendations, and more//t.co/3M8MvJWFQR by @Kyle_L_Wiggers",FALSE,TRUE,NA,NA
Keith Block,1105914760074129408,2019-03-13T19:33:20Z,"Thank you @RepCicilline @SenJeffMerkley & co-sponsors for reintroducing the #EqualityAct today. @Salesforce has a long history of standing against discrimination, and it's critical we have clear protections for the LGBTQ community. #EqualityforAll",FALSE,FALSE,NA,EqualityAct
Keith Block,1105914760074129408,2019-03-13T19:33:20Z,"Thank you @RepCicilline @SenJeffMerkley & co-sponsors for reintroducing the #EqualityAct today. @Salesforce has a long history of standing against discrimination, and it's critical we have clear protections for the LGBTQ community. #EqualityforAll",FALSE,FALSE,NA,EqualityforAll
Keith Block,1105914332049629185,2019-03-13T19:31:38Z,"At @salesforce, Equality is our North Star. We're proud to support the #EqualityAct because we believe all Americans should be protected from discrimination under the law. #EqualityForAll//t.co/nSvjo8cfbr",FALSE,TRUE,NA,EqualityAct
Keith Block,1104080383358906368,2019-03-08T18:04:10Z,"Happy 20th birthday @Salesforce and congrats @Benioff & @parkerharris! Being part of Salesforce the last 6 years has been the highlight of my career. I'm grateful for you & all of our 35k employees, and looking forward to our incredible future!//t.co/2BrAF0OqSG",FALSE,FALSE,NA,NA
Keith Block,1102792174058369031,2019-03-05T04:45:17Z,"""@Salesforce said it expects revenue to nearly double in four years, benefiting from companies shifting more of their spending to technology innovation."" via @WSJ//t.co/GO8wYu1AQJ",FALSE,FALSE,NA,NA
Keith Block,1102790791490002944,2019-03-05T04:39:48Z,"There's today, and there's the future. ""Every B2B company and every B2C company is becoming a B2B2C company, Co-CEO Marc @Benioff told @jimcramer today on @MadMoneyOnCNBC. ""I've never been more excited about Salesforce than I am right now.""//t.co/BDsnZaOQgi//t.co/JZgEszL6PF",FALSE,TRUE,NA,NA
Keith Block,1102790726830645249,2019-03-05T04:39:32Z,We now do business with nearly every financial institution in the Fortune 500. $CRM #CRMQ419,FALSE,TRUE,NA,CRMQ419
Keith Block,1101630835659169792,2019-03-01T23:50:33Z,"Proud to work at @Salesforce, named one of the #WorldsMostEthicalCompanies by @Ethisphere! Congratulations to the Salesforce Global Ethics & Integrity Team.//t.co/BoYErp9HlT",FALSE,TRUE,NA,WorldsMostEthicalCompanies
Keith Block,1099048980262965248,2019-02-22T20:51:10Z,A big congratulations to @Salesforce's @lisamedwards on being elected to Colgate-Palmolive's Board of Directors an incredible achievement via @CP_News//t.co/GhAUOUEeE4//t.co/oB0mPuck0F,FALSE,FALSE,NA,NA
Keith Block,1098317984613818368,2019-02-20T20:26:27Z,What sets the Block Center apart? According to @HeinzCollege prof Lee Branstetter: Using the same technology that has exacerbated inequality to narrow it. Particularly when it comes to education and closing the achievement gap. #techandsociety #tech4good//t.co/jz1YL9XoIu,FALSE,TRUE,NA,NA
Keith Block,1098317867760574465,2019-02-20T20:26:00Z,"According to @tommmitchell, Interim Dean of @SCSatCMU, #AI has the potential to disrupt: 1. jobs 2. education 3. business models 4. the wealth gap ""We're not helpless in this evolution. There are things we can do...to have the glass half full."" #futureofwork #techandsociety//t.co/y13i6HKIwB",FALSE,TRUE,NA,AI
Keith Block,1098317773078331392,2019-02-20T20:25:37Z,Read more about what @KeithBlock and Suzanne Kelley's gift will do to ensure advanced technology has positive benefits for all members of the global community.//t.co/dCtAbSQXzC//t.co/Q0nENLjGxa,FALSE,TRUE,NA,NA
Keith Block,1096602870508482561,2019-02-16T02:51:12Z,"Celebrating! Thank you @FortuneMagazine for recognizing our commitment to creating a culture of trust by naming @Salesforce #2 on the ""100 Best Companies to Work For"" List! Thank you to our employees - this one belongs to you. Join us://t.co/2NcKDW08Gp #100BestCos//t.co/Y6Tg0OwKNt",FALSE,TRUE,NA,NA
Keith Block,1096602818163531776,2019-02-16T02:51:00Z,$CRM Salesforce rolls out tools for providers and insurers to take aim at social determinants of health. #SDOH //t.co/f0Jkn8lB3X,FALSE,TRUE,NA,SDOH
