name,status_id,created_at,text,is_quote,is_retweet,reply_to_user_id,hashtags
Keith Weed,770531762950639616,2016-08-30T08:01:02Z,The use of emojis in mobile and email marketing messages has increased 775% year-over-year - What a figure! //t.co/cTnHstY613,FALSE,FALSE,NA,NA
Keith Weed,770363648673853440,2016-08-29T20:53:01Z,I'll be making it one of my life missions to work through this list.//t.co/zvESuBLsAw,FALSE,FALSE,NA,NA
Keith Weed,769198478681477120,2016-08-26T15:43:02Z,When it comes to #CSR we do things a little differently at Unilever.//t.co/ijSlT4ItZm,FALSE,FALSE,NA,CSR
Keith Weed,769183383268110336,2016-08-26T14:43:03Z,Incase you missed it...//t.co/2L7OQk4lVf,FALSE,FALSE,NA,NA
Keith Weed,769181729001267200,2016-08-26T14:36:29Z,Look out for these in your next Knorr tomato soup... Just kidding. These are for me!//t.co/nSqDw9gWZO,FALSE,FALSE,NA,NA
Keith Weed,769159276812181508,2016-08-26T13:07:16Z,9 Rules on How to Build Great Campaigns by David Ogilvy #tbt//t.co/47TCDIPU1t,FALSE,TRUE,NA,tbt
Keith Weed,768829502625546241,2016-08-25T15:16:52Z,These chaps have done the impossible... they've made beer healthy!//t.co/G9O0PHeCgp,TRUE,FALSE,NA,NA
Keith Weed,768819233769742336,2016-08-25T14:36:03Z,"""Why creative teams need to make 'sweet love' with data."" This one's definitely worth a read!//t.co/NrQMRLkGSA",FALSE,FALSE,NA,NA
Keith Weed,768811476605894660,2016-08-25T14:05:14Z,"Can companies make us better citizens? asks @Daniel_ThomasG, featuring @lottie_west | BBC News//t.co/lSOCocCluE #purposedrivenbrands",FALSE,TRUE,NA,NA
Keith Weed,768792359337242624,2016-08-25T12:49:16Z,"Why I disbanded @Unilever's CSR department, in a nutshell. #Sustainability #ResponsibleBusiness//t.co/VnmSxZ217o",FALSE,FALSE,NA,Sustainability
Keith Weed,768792359337242624,2016-08-25T12:49:16Z,"Why I disbanded @Unilever's CSR department, in a nutshell. #Sustainability #ResponsibleBusiness//t.co/VnmSxZ217o",FALSE,FALSE,NA,ResponsibleBusiness
Keith Weed,768482162844766209,2016-08-24T16:16:39Z,Find out what happened when @ChefChuckHughes showed some urban kids around a @HellmannsCanada canola farm//t.co/eOLFKc5Uxt,FALSE,TRUE,NA,NA
Keith Weed,768468672209821696,2016-08-24T15:23:03Z,.@KFC's latest #marketing campaign proves the media are hungry for content... and chicken!//t.co/lKOeuwsalM,FALSE,FALSE,NA,marketing
Keith Weed,768406368256614400,2016-08-24T11:15:29Z,Today's #WednesdayWisdom: 15 inspirational quotes to get your creative juices flowing.//t.co/raXzOHJNFj,FALSE,FALSE,NA,WednesdayWisdom
Keith Weed,768372844715577344,2016-08-24T09:02:16Z,"To become a truly #ResponsibleBusiness, the whole company needs to understand the wider context of its impact.//t.co/umL1wKm0Y8",FALSE,FALSE,NA,ResponsibleBusiness
Keith Weed,768132910192988161,2016-08-23T17:08:51Z,"""The 'me' generation has become the 'we' generation.""//t.co/Ox45pbBANg",TRUE,FALSE,NA,NA
Keith Weed,768073395112185861,2016-08-23T13:12:22Z,Rolling out today we're bringing night mode to iOS! //t.co/XxNZHQdth9//t.co/WLwKi4H0Oe,FALSE,TRUE,NA,NA
Keith Weed,768048652098994176,2016-08-23T11:34:02Z,Next on the menu? Edible food packaging!//t.co/Z90dY7Q8OV,FALSE,FALSE,NA,NA
Keith Weed,767998586894163968,2016-08-23T08:15:06Z,Brands need to move as quickly as the world around them does. #marketing//t.co/hYPZ4ctUh8,FALSE,FALSE,NA,marketing
Keith Weed,767752631968231424,2016-08-22T15:57:46Z,Did 360 video win Gold at the #Rio2016 #Olympics? - DigitalNext by @fsinton @beachfrontmedia//t.co/EeEMBuxxLq//t.co/DUTtvWiZMF,FALSE,TRUE,NA,Rio2016
Keith Weed,767752631968231424,2016-08-22T15:57:46Z,Did 360 video win Gold at the #Rio2016 #Olympics? - DigitalNext by @fsinton @beachfrontmedia//t.co/EeEMBuxxLq//t.co/DUTtvWiZMF,FALSE,TRUE,NA,Olympics
Keith Weed,767730264801959936,2016-08-22T14:28:53Z,The fashion label employing homeless people and other stories everyone's talking about: //t.co/tRL9WDAnEG,FALSE,TRUE,NA,NA
Keith Weed,767704032467050496,2016-08-22T12:44:39Z,"Now you can review, test and create ads on Facebook. And best of all - preview on mobiles.//t.co/PquxKnUKta",FALSE,FALSE,NA,NA
Keith Weed,767630908748763136,2016-08-22T07:54:05Z,.@UnileverFoundry & @weseethrough are collaborating to understand consumers better and change the insights industry.//t.co/uMmO8pqNUA,FALSE,FALSE,NA,NA
Keith Weed,767444081509330945,2016-08-21T19:31:42Z,Seaside postcards being sold next to waterproof jacket & trousers..A typical summer weekend in the UK. It's August!!//t.co/PjG5f9eydm,FALSE,FALSE,NA,NA
Keith Weed,766665922329317377,2016-08-19T15:59:34Z,"On #WorldHumanitarianDay, choose the world in which you want to live://t.co/cJS4pgNcTR #ShareHumanity//t.co/9v6XBCBILj",FALSE,TRUE,NA,WorldHumanitarianDay
Keith Weed,766665922329317377,2016-08-19T15:59:34Z,"On #WorldHumanitarianDay, choose the world in which you want to live://t.co/cJS4pgNcTR #ShareHumanity//t.co/9v6XBCBILj",FALSE,TRUE,NA,ShareHumanity
Keith Weed,766604018646814720,2016-08-19T11:53:35Z,"#AI shouldn't scare marketers, it should excite them!//t.co/AVEVgm806j",FALSE,FALSE,NA,AI
Keith Weed,766547535880032256,2016-08-19T08:09:08Z,Strong testimony to the power of a #sustainable business model.//t.co/j6UvtLzIXW//t.co/SZDVyWz2v4,FALSE,FALSE,NA,sustainable
Keith Weed,766326485284220928,2016-08-18T17:30:46Z,Unilever's @Keithweed will be our keynote speaker at our one-day conference in Oxford on 2 Sep//t.co/QvrL9TRVMg,FALSE,TRUE,NA,NA
Keith Weed,766296233400995841,2016-08-18T15:30:33Z,"Employee engagement efforts need to be proactive, not reactive.//t.co/8lfI9SS0um",TRUE,FALSE,NA,NA
Keith Weed,766289888304041984,2016-08-18T15:05:21Z,"The alphabet runs from A-to-Z, not A-to-C there are many routes to success//t.co/WtShqLhkob #alevelresults//t.co/Ldzuo1lI6j",FALSE,TRUE,NA,alevelresults
Keith Weed,766283352408141824,2016-08-18T14:39:22Z,Storytelling reinvented! Not for the faint-hearted...//t.co/rHIxSGSNXs,FALSE,FALSE,NA,NA
Keith Weed,766271327753887745,2016-08-18T13:51:35Z,"@gordonmacmillan Hi Gordon, sounds interesting! Could you please send me a DM with a little more info?",FALSE,FALSE,9245782,NA
Keith Weed,766264475787808770,2016-08-18T13:24:22Z,London is looking pretty good today //t.co/r9Uqp4sFvd,FALSE,FALSE,NA,NA
Keith Weed,766167612162277376,2016-08-18T06:59:28Z,"'L_ve' me or 'h_te' me, I'm supporting @GiveBloodNHS #MissingType//t.co/EZNkWGz9Cl",FALSE,TRUE,NA,MissingType
Keith Weed,765901753246101505,2016-08-17T13:23:02Z,Driverless cars? The future is here! #innovation//t.co/jaFFMx5zrY,FALSE,FALSE,NA,innovation
Keith Weed,765871968792915968,2016-08-17T11:24:41Z,"This robot lawyer (yes, really) is helping fight homelessness. What a great use of #ChatBots!//t.co/mNwEB5rDck",FALSE,FALSE,NA,ChatBots
Keith Weed,765853437837717504,2016-08-17T10:11:03Z,This @TED talk was a proud moment for me - I love the organisation. The topic feels more relevant today than ever.//t.co/u1gQBl08ri,FALSE,FALSE,NA,NA
Keith Weed,765555500004020224,2016-08-16T14:27:09Z,"#marketing101 - sharing the right message in the right place, at the right time.//t.co/bPYQtQUje2",TRUE,FALSE,NA,marketing101
Keith Weed,765531663426347008,2016-08-16T12:52:26Z,The three goals that make up the @Unilever Sustainable Living Plan. Always good to keep them front-of-mind!//t.co/xwExgPRQDu,FALSE,FALSE,NA,NA
Keith Weed,765514206426730496,2016-08-16T11:43:04Z,"If you read the @HarvardBiz piece this week, take a look at my follow-up blog on LinkedIn.//t.co/mi6g4xa0e1",FALSE,FALSE,NA,NA
Keith Weed,765494352282091520,2016-08-16T10:24:10Z,Look out for the print edition today! Hot off the press @HarvardBiz.//t.co/sxBPVRMboY,TRUE,FALSE,NA,NA
Keith Weed,765210105885458434,2016-08-15T15:34:40Z,@SpiritedDebate He set out to achieve the impossible and did it- hard not to be inspired by that!,FALSE,FALSE,1710709308,NA
Keith Weed,765186340082241538,2016-08-15T14:00:14Z,"""To connect, modern brands have to pivot and recenter themselves around a core belief."" @zquirk @thedrum//t.co/E3sucshsPy",FALSE,FALSE,NA,NA
Keith Weed,765174793058525184,2016-08-15T13:14:21Z,"@KeithBlock @HarvardBiz Thanks for reading, glad you enjoyed it!",FALSE,FALSE,2441768893,NA
Keith Weed,765173129954136068,2016-08-15T13:07:45Z,.@instagram launches a contact' button linking consumers with brands//t.co/i7O6mqhcNw//t.co/iInNBTyXwS,FALSE,TRUE,NA,NA
Keith Weed,765154070218674177,2016-08-15T11:52:00Z,A bit mad that these are deemed necessary - 'smombie' (smartphone-zombie) eye-level traffic lights!//t.co/Htm9znxcm1,FALSE,FALSE,NA,NA
Keith Weed,765070815402479617,2016-08-15T06:21:11Z,Keeping me entertained on the commute this week! #bookworm//t.co/kjKRGqnvsJ,FALSE,FALSE,NA,bookworm
Keith Weed,764472712903417856,2016-08-13T14:44:32Z,@AlbertoMacciani - that made me laugh! Keith,FALSE,FALSE,621269962,NA
Keith Weed,764120535903064064,2016-08-12T15:25:07Z,Done! What now...?//t.co/bnggviLtlJ,FALSE,FALSE,NA,NA
Keith Weed,764087830029017089,2016-08-12T13:15:09Z,My holiday project for the day. I must be missing the commute!//t.co/49nu7bX4lW,FALSE,FALSE,NA,NA
Keith Weed,764050806324629504,2016-08-12T10:48:02Z,It's fascinating how gaming so often leads the curve when it comes to new technology - love this from @ihetherington//t.co/lzhQHE4IjI,FALSE,FALSE,NA,NA
Keith Weed,764013588553936898,2016-08-12T08:20:08Z,"At @Unilever, we're often asked what the secret is to changing the mindset of such a big business.//t.co/cbmv5rOReo",FALSE,FALSE,NA,NA
Keith Weed,763738500353003520,2016-08-11T14:07:02Z,I hope this takes off - It's good for businesses and good for the world! @toogoodtogo_uk//t.co/2uigbtXrhI,FALSE,FALSE,NA,NA
Keith Weed,763723145601613824,2016-08-11T13:06:01Z,"""Not innovating and not taking risks is arguably the biggest risk of all"" - my colleague @alinecsantos//t.co/7RX7xIRUoe",FALSE,FALSE,NA,NA
Keith Weed,763693781703012352,2016-08-11T11:09:20Z,Go #TeamGB! It was around this time that the medals came rolling in in 2012. (Infographic from @TheTimes)//t.co/vRmlDfiS81,FALSE,FALSE,NA,TeamGB
Keith Weed,763662490588762112,2016-08-11T09:05:00Z,Up to 30% of food in the US still goes to waste. @RobJGreenfield is proving just how unnecessary that is!//t.co/nDSp9nAnY0,FALSE,FALSE,NA,NA
Keith Weed,763381153940189186,2016-08-10T14:27:04Z,"Expectations around what makes a leader are changing for the better, thanks to a more diverse workforce. @WEF//t.co/vFYZu8wxL8",FALSE,FALSE,NA,NA
Keith Weed,763332251690164224,2016-08-10T11:12:45Z,"What distinguishes high-performing, customer-centric companies from everyone else.//t.co/7YOLpJYrF7 @ssthanunathan @keithweed",FALSE,TRUE,NA,NA
Keith Weed,763312644224712705,2016-08-10T09:54:50Z,@laclaux Savoury - served with a Sunday roast dinner! Recipe here://t.co/IH9gjY6rL9 Happy cooking!,FALSE,FALSE,16445221,NA
Keith Weed,763311453554126848,2016-08-10T09:50:06Z,I'm always reminded of my own #graduation when I meet our graduate hires. Me on the big day!//t.co/X4Q9cSXsi6,FALSE,FALSE,NA,graduation
Keith Weed,763282491813662720,2016-08-10T07:55:01Z,The best solutions are so often the most straightforward... Even when it comes to the planet's biggest problems!//t.co/Gtlu5HTezf,FALSE,FALSE,NA,NA
Keith Weed,763031013291274241,2016-08-09T15:15:44Z,Three key ares in which we're collaborating to create significant change (not just incremental improvements).//t.co/mriA8wfTgX,FALSE,FALSE,NA,NA
Keith Weed,763018007685705729,2016-08-09T14:24:03Z,For anyone thinking of a mini-tech-detox!//t.co/9YolNHXtk0,FALSE,FALSE,NA,NA
Keith Weed,762978258736394240,2016-08-09T11:46:06Z,Great to meet the guys at Italian ice cream brand @grom_gelato - welcome to the @Unilever family!//t.co/9HqmX0DLiG,FALSE,FALSE,NA,NA
Keith Weed,762968789411504129,2016-08-09T11:08:29Z,In @HarvardBiz today: Building an Insights Engine - co-authored with @ssthanunathan and Frank van den Driest//t.co/IA47Ic1Zgf,FALSE,FALSE,NA,NA
Keith Weed,762964665735352320,2016-08-09T10:52:06Z,@nextcontext Indeed! As modelled by Fred Flintstone,FALSE,FALSE,3841649355,NA
Keith Weed,762964528480956416,2016-08-09T10:51:33Z,@laclaux The secret is to get the oil really hot before you add the batter!,FALSE,FALSE,16445221,NA
Keith Weed,762664874430398464,2016-08-08T15:00:50Z,Discover how @Unilever are working to reverse the trend of #Overshoot @keithweed//t.co/5iy51MrNQc//t.co/7InrsgkEw1,FALSE,TRUE,NA,Overshoot
Keith Weed,762657434796118017,2016-08-08T14:31:16Z,I was pretty proud of my giant Yorkshire pudding yesterday. Plenty left over for supper tonight!//t.co/orwamKYzqx,FALSE,FALSE,NA,NA
Keith Weed,762645797003366401,2016-08-08T13:45:01Z,Thanks to @WilliamLewis for sharing this amazing video of @LukeAikins' 25k ft skydive... WITHOUT a parachute.//t.co/FatwAQcVvJ,FALSE,FALSE,NA,NA
Keith Weed,762622757519491072,2016-08-08T12:13:28Z,"With #graduate recruitment season in full swing, I wanted to share my thoughts on making those all-important hires.//t.co/DiLWUtC9mx",FALSE,FALSE,NA,graduate
Keith Weed,762619563603169280,2016-08-08T12:00:47Z,"On #EarthOvershootDay, Sustainable Living feels so important. @BITC #pledgefortheplanet//t.co/jQUZfkoUQI//t.co/p4eyFehube",FALSE,FALSE,NA,EarthOvershootDay
Keith Weed,762619563603169280,2016-08-08T12:00:47Z,"On #EarthOvershootDay, Sustainable Living feels so important. @BITC #pledgefortheplanet//t.co/jQUZfkoUQI//t.co/p4eyFehube",FALSE,FALSE,NA,pledgefortheplanet
Keith Weed,762245187259162624,2016-08-07T11:13:09Z,Anyone for garlic?//t.co/BLc1fVbHS0,FALSE,FALSE,NA,NA
Keith Weed,761921588404981760,2016-08-06T13:47:17Z,Market day!//t.co/GXT6Uhdu3R,FALSE,FALSE,NA,NA
Keith Weed,761863899733856256,2016-08-06T09:58:03Z,Facebook have found a way to crack down on 'clickbait'... You won't BELIEVE what happens next! (Badum-tsch)//t.co/CA3IjPeYTM,FALSE,FALSE,NA,NA
Keith Weed,761593127169773568,2016-08-05T16:02:05Z,I love the @Hellmanns Blue Ribbon and what it stands for - bringing out the best in produce!//t.co/QWVnpEAU2K,FALSE,FALSE,NA,NA
Keith Weed,761563676994183169,2016-08-05T14:05:04Z,360-degree livestream from the #OpeningCeremony - can't wait to try this out! #Rio2016//t.co/15MC22VPoU,FALSE,FALSE,NA,OpeningCeremony
Keith Weed,761563676994183169,2016-08-05T14:05:04Z,360-degree livestream from the #OpeningCeremony - can't wait to try this out! #Rio2016//t.co/15MC22VPoU,FALSE,FALSE,NA,Rio2016
Keith Weed,761539756811427840,2016-08-05T12:30:01Z,"A great step towards reducing food waste, and helping to feed the hungry.//t.co/6Todo8ldZz",FALSE,FALSE,NA,NA
Keith Weed,761515615756570624,2016-08-05T10:54:05Z,I've yet to come across a viable alternative to #SustainableBusiness. Here's our plan://t.co/jQUZfkoUQI//t.co/55InLubvoh,FALSE,FALSE,NA,SustainableBusiness
Keith Weed,761500542702981120,2016-08-05T09:54:12Z,"Our first step towards becoming more sustainable was changing our internal mindset around so-called ""CSR"".//t.co/PYXRn28Kuw",FALSE,FALSE,NA,NA
Keith Weed,760853262396301312,2016-08-03T15:02:08Z,Investors starting to embrace low-carbon future - we must celebrate action but accelerate efforts #ParisAgreement//t.co/45eueOi1bE,FALSE,TRUE,NA,ParisAgreement
Keith Weed,760838394633007105,2016-08-03T14:03:03Z,One of @Unilever's HR directors on how Enterprise Tech can act as a tool for breaking down gender stereotypes.//t.co/PHJMRvOsvx,FALSE,FALSE,NA,NA
Keith Weed,760784599517581312,2016-08-03T10:29:17Z,Instagram Stories - the new feature being dubbed 'Snapchat for grown-ups'//t.co/aiaMnkoobP,FALSE,FALSE,NA,NA
Keith Weed,760757855054024704,2016-08-03T08:43:01Z,I love a good #staycation! I have a real soft spot for Norfolk in particular.//t.co/6nH3cgQVBJ,FALSE,FALSE,NA,staycation
Keith Weed,760752026619817984,2016-08-03T08:19:51Z,I'm a firm believer in the power of business to do good. Here's why. #ResponsibleBusiness @WEF//t.co/XUj5bXrf9q,FALSE,FALSE,NA,ResponsibleBusiness
Keith Weed,760579523603795970,2016-08-02T20:54:23Z,Trojan Horse Marketing - new cartoon and post on content marketing that's too salesy//t.co/G9IUVaVpwb//t.co/AHQfKyh9Z9,FALSE,TRUE,NA,NA
Keith Weed,760578570645303296,2016-08-02T20:50:36Z,Most influential Influence 100 members? @fxshaw @coastw @keithweed @lindaboff @Mukund_Rajan via @KCOPR//t.co/WhCi8ayeFs,FALSE,TRUE,NA,NA
Keith Weed,760570002563039232,2016-08-02T20:16:33Z,Why doing good should be a core part of your business model @keithweed//t.co/Evr0zzngWI @Unilever//t.co/i0ey3y9Jol,FALSE,TRUE,NA,NA
Keith Weed,760491205109092352,2016-08-02T15:03:27Z,"Apple brings more diversity to iOS 10 emoji, and a squirtgun instead of a handgun//t.co/mnQAHbAPaj//t.co/4r2uO1Qa1a",FALSE,TRUE,NA,NA
Keith Weed,760432718932881408,2016-08-02T11:11:03Z,This artist's interpretation of #Instagram for Windows '95 is tech-nostalgia at its very best.//t.co/TFLvaLmalt,FALSE,FALSE,NA,Instagram
Keith Weed,760415357303595008,2016-08-02T10:02:03Z,"As of 2015, 60% of @Unilever's agricultural raw materials are sustainably sourced. More on #SustainableLiving://t.co/jQUZfkoUQI",FALSE,FALSE,NA,SustainableLiving
Keith Weed,760114373620666368,2016-08-01T14:06:03Z,"Tricky! Even I struggled with a few of these, and I like to consider myself a superfan. How did you do?//t.co/qzptfIaTFn",FALSE,FALSE,NA,NA
Keith Weed,760097781159632896,2016-08-01T13:00:07Z,"""If you don't design your life, someone else will design it for you"" - Nigel Marsh's fantastic @TED talk.//t.co/igYWYrt8rn",FALSE,FALSE,NA,NA
Keith Weed,760071306343620608,2016-08-01T11:14:55Z,A smart strategy for encouraging meaningful brand-influencer collaboration from @tumblr//t.co/is1s0JqvJw,FALSE,FALSE,NA,NA
Keith Weed,760036374607048704,2016-08-01T08:56:07Z,Great to see a 360 degree camera in action! Fantastic #technology. Thanks to @hellobrandwidth//t.co/7ZyaFe2fAD,FALSE,FALSE,NA,technology
Keith Weed,759322680008990721,2016-07-30T09:40:09Z,"I've made fantastic friends in my time at @Unilever, as did these 1934 employees at holiday camp! #FriendshipDay//t.co/UFZlw1l4Su",FALSE,FALSE,NA,FriendshipDay
Keith Weed,759048991958892544,2016-07-29T15:32:36Z,"@davidcoethica Hi thanks for getting in touch, @UnileverFoundry please connect.",FALSE,FALSE,15061067,NA
Keith Weed,759011604054708225,2016-07-29T13:04:02Z,A bit mad (aren't all the best ideas?!) but what a way to get the most out of your commuting time!//t.co/hu8l5QP6O7,FALSE,FALSE,NA,NA
Keith Weed,758988192670375939,2016-07-29T11:31:01Z,"It really was only a matter of time before someone did this. Still brilliant, though. #PokemonGo//t.co/FAHTahqL13",FALSE,FALSE,NA,PokemonGo
Keith Weed,758974514629713920,2016-07-29T10:36:40Z,"We need to be more global and local. Technology doesn't see boundaries across countries"" @keithweed @UnileverFoundry//t.co/S3zuHwMIYE",FALSE,TRUE,NA,NA
Keith Weed,758700812428189702,2016-07-28T16:29:04Z,"As @Yoram points out in this piece, managers can help stimulate creative thinking by keeping teams motivated.//t.co/t68T3uF6jA",FALSE,FALSE,NA,NA
Keith Weed,758663806708961280,2016-07-28T14:02:01Z,The astronomical power of Twitter (Pun alert!).//t.co/zOVriQeH6H,FALSE,FALSE,NA,NA
Keith Weed,758622742312693760,2016-07-28T11:18:50Z,@AlbertoMacciani It certainly was!,FALSE,FALSE,621269962,NA
Keith Weed,758616651201847296,2016-07-28T10:54:38Z,"Happy birthday to the late, great Sir Kenneth Durham, former @Unilever Chairman. He spent 36 years with the company!//t.co/Gl0CgVQvCf",FALSE,FALSE,NA,NA
Keith Weed,758606700865650689,2016-07-28T10:15:06Z,Fragmentation through siloed working restricts brands' ability to have any real impact.//t.co/M7xyji6dJX,FALSE,FALSE,NA,NA
Keith Weed,758330989592674305,2016-07-27T15:59:31Z,How @benandjerrys keeps #purpose alive | via @adage//t.co/RwoJwq4f9m @jaycurley @keithweed @wfamarketers//t.co/MqNeuSsBk6,FALSE,TRUE,NA,purpose
Keith Weed,758303188889931777,2016-07-27T14:09:03Z,"Another great piece of work from @Dove, calling out sexism in sport.//t.co/A0FiC3OxA2",FALSE,FALSE,NA,NA
Keith Weed,758302335919534080,2016-07-27T14:05:40Z,Following in Facebook's footsteps! Video fast becoming king of content on #social.//t.co/MjomEh0T1W,FALSE,FALSE,NA,social
Keith Weed,758231261278187521,2016-07-27T09:23:14Z,Calling all #graduates! We're always on the lookout for bright young minds. Browse jobs://t.co/9sldMAXe4Z//t.co/GkCiLLboVE,FALSE,FALSE,NA,graduates
Keith Weed,757996662488829952,2016-07-26T17:51:01Z,"Applying for #internships can be really tough. If you're in need of some advice, give this a read!//t.co/vgJpn7EcHK",FALSE,FALSE,NA,internships
Keith Weed,757969491368087553,2016-07-26T16:03:03Z,"'Storytelling' is a buzzword that's thrown around a lot. Here, @davetrott explains it in really actionable terms.//t.co/X4W2Mqit8l",FALSE,FALSE,NA,NA
Keith Weed,757960331759149056,2016-07-26T15:26:39Z,Checking out the Amazon Echo...impressive stuff! Evidence of how fast power of voice activated tech is evolving.//t.co/WUtu8XhxmA,FALSE,FALSE,NA,NA
Keith Weed,757951943641673728,2016-07-26T14:53:20Z,Some brands steer clear of social issues for fear of a backlash. I believe the key is to practice what you preach.//t.co/OUkNiLfKil,FALSE,FALSE,NA,NA
Keith Weed,757862052882894848,2016-07-26T08:56:08Z,Creative blocks: We all have them. I find these tricks help to get the cogs turning again!//t.co/UYBUu6luKh,FALSE,FALSE,NA,NA
Keith Weed,757855569671630850,2016-07-26T08:30:22Z,Spending a 'Connected World' day training with the @Unilever team...sharpening our digital axes to chop wood better!//t.co/H66X5eTiYR,FALSE,FALSE,NA,NA
Keith Weed,757608714996224000,2016-07-25T16:09:28Z,Huge congratulations to Chris Froome! What a race! #TDF2016//t.co/KV1SiPCVaE,TRUE,FALSE,NA,TDF2016
Keith Weed,757576372684455936,2016-07-25T14:00:56Z,Our research on holiday #foodwaste featured in the @MailOnline this weekend - read it here://t.co/5PZ80zBOPk @hubbubUK,FALSE,TRUE,NA,foodwaste
Keith Weed,757546696335241217,2016-07-25T12:03:01Z,A smart piece from our Customer Development Director on why there is no 'one-size-fits-all' approach to leadership.//t.co/4NhuyJKaoZ,FALSE,FALSE,NA,NA
Keith Weed,757450841016061952,2016-07-25T05:42:07Z,The most important part of the most important meal of the day. #breakfast #caffeinemonster//t.co/G2F8EYX2H5,FALSE,FALSE,NA,breakfast
Keith Weed,757450841016061952,2016-07-25T05:42:07Z,The most important part of the most important meal of the day. #breakfast #caffeinemonster//t.co/G2F8EYX2H5,FALSE,FALSE,NA,caffeinemonster
Keith Weed,756769805332520960,2016-07-23T08:35:56Z,@LouPas Thanks Lou! Good seeing you briefly at Wimbledon. Do tell me next time you are across in the UK. Keith,FALSE,FALSE,19475858,NA
Keith Weed,756565247431806976,2016-07-22T19:03:05Z,Best. Quote. Ever. #TheItalianJob//t.co/7AsrhGTGrv,FALSE,FALSE,NA,TheItalianJob
Keith Weed,756443301545476096,2016-07-22T10:58:31Z,Facebook's solar-powered internet drone Aquila takes flight//t.co/OzRuHZlOMH//t.co/MqtJPQCBAk,FALSE,TRUE,NA,NA
Keith Weed,756433456134033408,2016-07-22T10:19:24Z,A very engaging way to get across a very serious message (best viewed on mobile)://t.co/M0xJ13ji7k,FALSE,FALSE,NA,NA
Keith Weed,755779358304763905,2016-07-20T15:00:15Z,Looking for some #WednesdayWisdom? Look no further!//t.co/WS9MGSFmXw,FALSE,FALSE,NA,WednesdayWisdom
Keith Weed,755750265672859648,2016-07-20T13:04:39Z,Blink and you'll miss it!//t.co/aaLAcLO4Mz,TRUE,FALSE,NA,NA
Keith Weed,755736649460551680,2016-07-20T12:10:32Z,"Follow our food waste mantra ahead of your holidays: Freeze it, Gift it, Cook it! #TravellersCheck //t.co/e18NJE3dKI",FALSE,TRUE,NA,TravellersCheck
Keith Weed,755689212150554624,2016-07-20T09:02:02Z,I love this case study from @walls. A super example of a brand using their influence to do good.//t.co/PtsliNqA7m,FALSE,FALSE,NA,NA
Keith Weed,755441371260022784,2016-07-19T16:37:12Z,These are snazzy!//t.co/XRtlNA7IoU,FALSE,FALSE,NA,NA
Keith Weed,755439755068833794,2016-07-19T16:30:47Z,How brands used #WorldEmojiDay to promote their messages//t.co/wgPEGWh1Q0 via @CampaignLiveUS//t.co/AVSTqK3UH1,FALSE,TRUE,NA,WorldEmojiDay
Keith Weed,755423549536530432,2016-07-19T15:26:23Z,Glorious day up at Lever House in Port Sunlight today. Plus... caught me some Pokemon in the board room! :-)//t.co/9DB1QTbtBH,FALSE,FALSE,NA,NA
Keith Weed,755355428217823234,2016-07-19T10:55:42Z,"Whether you're applying for your first job or trying to launch a start-up, make sure you sell yourself.//t.co/N2UyG2Wx4y",FALSE,FALSE,NA,NA
Keith Weed,755069698698387456,2016-07-18T16:00:19Z,"It's no longer digital marketing, but marketing in a #digital world.//t.co/nDm9nNZ7pm",FALSE,FALSE,NA,digital
Keith Weed,755044007512829952,2016-07-18T14:18:14Z,.@keithweed talks to #CannesLions TV//t.co/RSQat74Bxc,FALSE,TRUE,NA,CannesLions
Keith Weed,755018447474397184,2016-07-18T12:36:40Z,Love these vintage ads... Could do with a sundae today!//t.co/nuJn0usKE5,FALSE,FALSE,NA,NA
Keith Weed,754966480693829632,2016-07-18T09:10:10Z,Good morning #London! #LifeAtUnilever//t.co/9O2E5KGhwi,FALSE,FALSE,NA,London
Keith Weed,754966480693829632,2016-07-18T09:10:10Z,Good morning #London! #LifeAtUnilever//t.co/9O2E5KGhwi,FALSE,FALSE,NA,LifeAtUnilever
Keith Weed,754949868821417984,2016-07-18T08:04:09Z,"One of my favourite books, which I find myself revisiting again and again.//t.co/8LuddDOhTw",FALSE,FALSE,NA,NA
Keith Weed,754612193316970496,2016-07-17T09:42:21Z,"Perfect summer wedding for Charlie & Beth.. Perfect mix of English, Scottish &French..Love weddings. Great speeches!//t.co/9mtODhh03f",FALSE,FALSE,NA,NA
Keith Weed,753576699200090113,2016-07-14T13:07:40Z,"I myself joined Unilever as a grad, and I can't recommend it enough!//t.co/HeIrXzWVUr",FALSE,FALSE,NA,NA
Keith Weed,753576405485576193,2016-07-14T13:06:30Z,@jreanz I'm afraid they only stay live from Cannes for a couple of weeks! Sorry you missed it,FALSE,FALSE,94760247,NA
Keith Weed,753564734419456000,2016-07-14T12:20:07Z,Stocking up on essentials from our staff shop. #LifeAtUnilever//t.co/dyfo52g3Ff,FALSE,FALSE,NA,LifeAtUnilever
Keith Weed,753213399224291328,2016-07-13T13:04:03Z,What is it about this game?! Bonkers. #PokemonGO//t.co/ltOJsIQrT7,FALSE,FALSE,NA,PokemonGO
