name,status_id,created_at,text,is_quote,is_retweet,reply_to_user_id,hashtags
Keith Weed,1017076575274242048,2018-07-11T16:02:06Z,Pleased to see @twitter taking a big stand against the fake followers polluting the digital ecosystem. Great step forward which strengthens the industry - I hope to see more following.//t.co/EdQIoaI7n7,FALSE,FALSE,NA,NA
Keith Weed,1016718862958649351,2018-07-10T16:20:41Z,Proud to be part of a company that is driving the diversity agenda forward #Pride//t.co/wZpqHRoFYR,TRUE,FALSE,NA,Pride
Keith Weed,1016701488343724035,2018-07-10T15:11:38Z,Very James Bond....I hope it will be there this Saturday.. look forward to it #festivalofspeed @fosgoodwood//t.co/C4CD6TXMfa,TRUE,FALSE,NA,festivalofspeed
Keith Weed,1016673857808330752,2018-07-10T13:21:51Z,Happy 100 Year Birthday RAF. Love this Red Arrow video taken from the roof of @Unilever House. #RAFflypast #100RAF//t.co/z62qsx5qIx,FALSE,FALSE,NA,RAFflypast
Keith Weed,1016673857808330752,2018-07-10T13:21:51Z,Happy 100 Year Birthday RAF. Love this Red Arrow video taken from the roof of @Unilever House. #RAFflypast #100RAF//t.co/z62qsx5qIx,FALSE,FALSE,NA,100RAF
Keith Weed,1016667917818257408,2018-07-10T12:58:15Z,Great to see #RAF100 with my @Unilever colleagues from the roof of Unilever House. Happy 100 year Birthday RAF!//t.co/my21nf0h3U,FALSE,FALSE,NA,RAF100
Keith Weed,1016427493463678976,2018-07-09T21:02:53Z,What a pleasure to spend some time with the marvellous @MattBrittin @Google @HenleyRegatta. Great to hear insights from him as a rower and also enjoying the coverage on @youtube ..with Matt adding the commentary! Thank you Matt//t.co/udMPqmj3km,FALSE,FALSE,NA,NA
Keith Weed,1016397721291444224,2018-07-09T19:04:35Z,@LouPas @Porsche Ha ha! Very observant. The point was the temperature not the car but I can rely on you Lou to see all the angles :-),FALSE,FALSE,19475858,NA
Keith Weed,1016346230614609921,2018-07-09T15:39:58Z,Turn your arm into a touch screen with just this little watch //t.co/jAzmrovRi9,FALSE,TRUE,NA,NA
Keith Weed,1016254414510751746,2018-07-09T09:35:08Z,This could be a game-changer for voice powered search!//t.co/GXKt0LVK5b,TRUE,FALSE,NA,NA
Keith Weed,1016069273897357312,2018-07-08T21:19:27Z,3 Unilever commitments: 1.Transparency from Influencers: We will not work with influencers who buy followers 2.Transparency from Brands: Our brands will never buy followers. 3.Transparency from Platforms: We will prioritise partners who help eradicate fraud & increase visibility.,FALSE,FALSE,102450246,NA
Keith Weed,1016068738163118080,2018-07-08T21:17:19Z,"& I could not agree more with @richeisen too. We must motivate and encourage all steps the Digital and Social companies take to improve their platforms. This is no longer an industry issue it's a societal issue and undermining trust. The more proactive action taken, the better.//t.co/RaBPkpHWZq",TRUE,FALSE,NA,NA
Keith Weed,1016066555438948353,2018-07-08T21:08:39Z,3 Unilever commitments: 1.Transparency from Influencers: We will not work with influencers who buy followers 2.Transparency from Brands: Our brands will never buy followers. 3.Transparency from Platforms: We will prioritise partners who help eradicate fraud & increase visibility.,FALSE,FALSE,102450246,NA
Keith Weed,1016064859346210816,2018-07-08T21:01:54Z,"I could not agree with you more @kevinroose. We must motivate and encourage all steps the Digital and Social companies take to improve their platforms. This is no longer an industry issue it's a societal issue and undermining trust. The more proactive action taken, the better.//t.co/lw3yCCGmpv",FALSE,FALSE,NA,NA
Keith Weed,1015980730139242497,2018-07-08T15:27:36Z,It's a scorcher..... 30.5 recorded on my car. And this is England not the south of France! #hot//t.co/m2whdVJ4iE,FALSE,FALSE,NA,hot
Keith Weed,1014968312411906048,2018-07-05T20:24:37Z,Thanks everyone for the appreciation of fruits of my labour tweet part one...here is fruits of my labour part two! Who says weeds are bad for gardens..//t.co/WLCm5h62Je,FALSE,FALSE,NA,NA
Keith Weed,1014817185028608001,2018-07-05T10:24:05Z,The #TimeIsNow for gender equality.//t.co/RA4NdWohKU,FALSE,TRUE,NA,TimeIsNow
Keith Weed,1014570294063886337,2018-07-04T18:03:02Z,These are very much the fruits of my labour! With all this wonderful sunshine in the UK over recent weeks I'm enjoying a bumper crop...yum!//t.co/FUq1zWynMI,FALSE,FALSE,NA,NA
Keith Weed,1013823633465270272,2018-07-02T16:36:04Z,The real intersection between brands and consumers is purpose. It is this purpose that allows us to build meaningful connection with our consumers! @WFAMarketers//t.co/HCaOEKji3s,FALSE,FALSE,NA,NA
Keith Weed,1013711943075614720,2018-07-02T09:12:15Z,This robot chef concept cooks and cleans up for you//t.co/TgXpOex4n7,FALSE,TRUE,NA,NA
Keith Weed,1012649623704559621,2018-06-29T10:50:59Z,"Instagram have just announced that you can now add music to your stories! This will have a significant impact on the way users create especially if this extends to IGTV Additionally, you can now choose a song BEFORE capturing a video... a direct attack on Musically's USP?!//t.co/iYRoWsZpjj",FALSE,TRUE,NA,NA
Keith Weed,1011641771355406336,2018-06-26T16:06:08Z,#CannesLions by @keithweed //t.co/t0YPphGUDD,FALSE,FALSE,NA,CannesLions
Keith Weed,1010231519254929410,2018-06-22T18:42:18Z,Congratulations @PaulPolman @Unilever @Cannes_Lions for winning the LionHeart award!//t.co/GBRjXfG2zS,FALSE,FALSE,NA,NA
Keith Weed,1010225575938740224,2018-06-22T18:18:41Z,Congratulations @LorraineTwohill @google for your award at @Cannes_Lions . Super creative work//t.co/1C6iboGgsj,FALSE,FALSE,NA,NA
Keith Weed,1010185907822039040,2018-06-22T15:41:03Z,"Innovation, intrigue, #technology and #creativity. A great piece of work, and worth a listen #CannesLions//t.co/CbYKCXUTGe",FALSE,FALSE,NA,technology
Keith Weed,1010185907822039040,2018-06-22T15:41:03Z,"Innovation, intrigue, #technology and #creativity. A great piece of work, and worth a listen #CannesLions//t.co/CbYKCXUTGe",FALSE,FALSE,NA,creativity
Keith Weed,1010185907822039040,2018-06-22T15:41:03Z,"Innovation, intrigue, #technology and #creativity. A great piece of work, and worth a listen #CannesLions//t.co/CbYKCXUTGe",FALSE,FALSE,NA,CannesLions
Keith Weed,1010180223382540288,2018-06-22T15:18:28Z,Great that #SeeHer is so well represented. Brilliant initiative doing important work #CannesLions//t.co/HHKx2a6R6H,TRUE,FALSE,NA,SeeHer
Keith Weed,1010180223382540288,2018-06-22T15:18:28Z,Great that #SeeHer is so well represented. Brilliant initiative doing important work #CannesLions//t.co/HHKx2a6R6H,TRUE,FALSE,NA,CannesLions
Keith Weed,1010169609528446983,2018-06-22T14:36:17Z,"Really proud of the #unstereotype achievements over the last year, and looking forward to continuing our work into wider creative industries. #CannesLions//t.co/bRYbWoRaj1",FALSE,FALSE,NA,unstereotype
Keith Weed,1010169609528446983,2018-06-22T14:36:17Z,"Really proud of the #unstereotype achievements over the last year, and looking forward to continuing our work into wider creative industries. #CannesLions//t.co/bRYbWoRaj1",FALSE,FALSE,NA,CannesLions
Keith Weed,1010162714096947201,2018-06-22T14:08:53Z,Our collective voice is stronger - what better time for the industry to be unified in re-establishing brand credibility & trust? Truly exciting! #CannesLions//t.co/tEUFRjtS2H,FALSE,FALSE,NA,CannesLions
Keith Weed,1010133933416239104,2018-06-22T12:14:31Z,Great to see @JimStengel and the next gen of CMOs at this year's CMO accelerator programme in Cannes. You can never stop learning!!//t.co/p8XB5tUQgF,FALSE,FALSE,NA,NA
Keith Weed,1010088664972648449,2018-06-22T09:14:38Z,The power of partnerships will drive change! Marking the first anniversary of the #UnstereotypeAlliance and advancing our mission to eradicate stereotypes for good @un_stereotype @UN_Women @alinesantos//t.co/aEwEkDmgyS,FALSE,FALSE,NA,UnstereotypeAlliance
Keith Weed,1009818162219638785,2018-06-21T15:19:46Z,"Good to see so many great moves being made at #CannesLions to shake things up for #WomeninMarketing. These visible, collaborative and meaningful initiatives will deliver meaningful change//t.co/aTAFcdVzO3",FALSE,FALSE,NA,CannesLions
Keith Weed,1009818162219638785,2018-06-21T15:19:46Z,"Good to see so many great moves being made at #CannesLions to shake things up for #WomeninMarketing. These visible, collaborative and meaningful initiatives will deliver meaningful change//t.co/aTAFcdVzO3",FALSE,FALSE,NA,WomeninMarketing
Keith Weed,1009801888248877057,2018-06-21T14:15:06Z,@Sprinklr @Forbes @Unilever @ForbesCMO Thanks! Love the pic :),FALSE,FALSE,75263523,NA
Keith Weed,1009796269575983104,2018-06-21T13:52:46Z,Absolutely thrilled and humbled to be awarded @Forbes World's Most Influential CMO again! Proud to represent @Unilever on this prestigious list. Thank you!//t.co/b7B7fnw5sD,FALSE,FALSE,NA,NA
Keith Weed,1009750539574407175,2018-06-21T10:51:03Z,"If we as an industry want to keep the consumer trust, we need to overhaul the standards of behaviour on digital channels #CannesLions @Unilever//t.co/BKzlzdI0iq",TRUE,FALSE,NA,CannesLions
Keith Weed,1009741636270772225,2018-06-21T10:15:40Z,"""The problem is not seeing the problem."" Proud to be a member of the #UnstereotypeAlliance @un_stereotype as we advance our mission to banish stereotypical portrayals of people in advertising. Together we can eradicate stereotypes!//t.co/jL56tsrTLY",FALSE,FALSE,NA,UnstereotypeAlliance
Keith Weed,1009732852722913280,2018-06-21T09:40:46Z,"#DYK That in 2050 there will be more plastic than fish in the world's oceans?Thought-provoking discussion w/ Jeremy Darroch, @cgorellbarnes, @SimonJCLeBON & Patricia Oliva on how creativity can save our oceans #CannesLions//t.co/LiYQNeF1ev",FALSE,FALSE,NA,DYK
Keith Weed,1009732852722913280,2018-06-21T09:40:46Z,"#DYK That in 2050 there will be more plastic than fish in the world's oceans?Thought-provoking discussion w/ Jeremy Darroch, @cgorellbarnes, @SimonJCLeBON & Patricia Oliva on how creativity can save our oceans #CannesLions//t.co/LiYQNeF1ev",FALSE,FALSE,NA,CannesLions
Keith Weed,1009474000223985664,2018-06-20T16:32:11Z,"The Economist BIG debate definitely lived up to its name! Great discussion w/ @Zannymbon, @Ceverson, @evgenymorozov and Kasha Cacy on whether or not the big tech platforms are doing enough to regain consumer trust #CannesLions//t.co/DC2QJG10Qi",FALSE,FALSE,NA,CannesLions
Keith Weed,1009457638919299072,2018-06-20T15:27:10Z,"#DYK progressive ads are 25% more effective than those featuring more traditional portrayals of #gender? A provocative discussion yesterday, proud of @UN_Stereotype progress so far//t.co/hJqDht33cA",TRUE,FALSE,NA,DYK
Keith Weed,1009457638919299072,2018-06-20T15:27:10Z,"#DYK progressive ads are 25% more effective than those featuring more traditional portrayals of #gender? A provocative discussion yesterday, proud of @UN_Stereotype progress so far//t.co/hJqDht33cA",TRUE,FALSE,NA,gender
Keith Weed,1009444174834339842,2018-06-20T14:33:40Z,"There's an opportunity to make marketing noble again, to serve consumers & rebuild trust collectively. Let's make marketing address real social challenges #CannesLions//t.co/iocvQn2Acp",FALSE,FALSE,NA,CannesLions
Keith Weed,1009412129118670848,2018-06-20T12:26:20Z,"#Marketing to serve consumers & not just to sell is indeed the correct approach. Influencer marketing must be based on genuine relationships, glad to see fellow marketers engage in this conversation #CannesLions//t.co/VluR8EvSom",FALSE,FALSE,NA,Marketing
Keith Weed,1009412129118670848,2018-06-20T12:26:20Z,"#Marketing to serve consumers & not just to sell is indeed the correct approach. Influencer marketing must be based on genuine relationships, glad to see fellow marketers engage in this conversation #CannesLions//t.co/VluR8EvSom",FALSE,FALSE,NA,CannesLions
Keith Weed,1009397857449848833,2018-06-20T11:29:37Z,Do you think the major #tech platforms restrict or enhance brand #creativity? I'd love to hear your thoughts & views ahead of @TheEconomist BIG debate this evening #CannesLions,FALSE,FALSE,NA,tech
Keith Weed,1009397857449848833,2018-06-20T11:29:37Z,Do you think the major #tech platforms restrict or enhance brand #creativity? I'd love to hear your thoughts & views ahead of @TheEconomist BIG debate this evening #CannesLions,FALSE,FALSE,NA,creativity
Keith Weed,1009397857449848833,2018-06-20T11:29:37Z,Do you think the major #tech platforms restrict or enhance brand #creativity? I'd love to hear your thoughts & views ahead of @TheEconomist BIG debate this evening #CannesLions,FALSE,FALSE,NA,CannesLions
Keith Weed,1009373784804069376,2018-06-20T09:53:58Z,"What a brilliant discussion! Thrilled to have shared the floor with @DermalogicaJane, @GuidoMartinetti and Richelieu Dennis at #CannesLions. Thank you :)//t.co/sJLfily3at",FALSE,FALSE,NA,CannesLions
Keith Weed,1009363839677329408,2018-06-20T09:14:27Z,"""If you can achieve purposeful growth, you can impact the whole of your business."" #CannesLions",FALSE,FALSE,NA,CannesLions
Keith Weed,1009361629639839744,2018-06-20T09:05:40Z,"""The best way to have healthy business, is to have a healthy society"" #CannesLions",FALSE,FALSE,NA,CannesLions
Keith Weed,1009358713268899841,2018-06-20T08:54:04Z,And we're ready! Final moments in the green room with the Founders before we go live at #CannesLions//t.co/cIPQqbaE60//t.co/3nezjXGujK,FALSE,FALSE,NA,CannesLions
Keith Weed,1009357084197117952,2018-06-20T08:47:36Z,"Live in 15 minutes, our first #LionsLive session of the day, powered by @Mindshare and @YouTube @Unilever, Founders' Formula: Pioneering for Purposeful Growth 11am //t.co/6RVCRFdSTh//t.co/AexJjN6z9M",FALSE,TRUE,NA,LionsLive
Keith Weed,1009330042894209024,2018-06-20T07:00:09Z,"Getting ready for the '@Unilever Founders' Formula: Pioneering for Purposeful Growth' panel at 10am BST, where we'll be discussing #purpose in biz. Join @Dermalogicajane, @GuidoMartinetti, Richelieu Dennis, & myself at #CannesLions//t.co/fLBYwVEXS0//t.co/NpBlZD87Xt",FALSE,FALSE,NA,purpose
Keith Weed,1009330042894209024,2018-06-20T07:00:09Z,"Getting ready for the '@Unilever Founders' Formula: Pioneering for Purposeful Growth' panel at 10am BST, where we'll be discussing #purpose in biz. Join @Dermalogicajane, @GuidoMartinetti, Richelieu Dennis, & myself at #CannesLions//t.co/fLBYwVEXS0//t.co/NpBlZD87Xt",FALSE,FALSE,NA,CannesLions
Keith Weed,1009137907846836226,2018-06-19T18:16:40Z,It's hard to disagree with Nick Emery @mindshare !! ;-)//t.co/IMQYYxYNR5,FALSE,FALSE,NA,NA
Keith Weed,1009132978058952706,2018-06-19T17:57:05Z,"How do marketers and content creators #unstereotype? That's what we are here to discuss today with @stormreid, Simon Fuller and @cartoonnetwork president Christina Miller #CannesLions//t.co/VQpdD6GqON",FALSE,TRUE,NA,unstereotype
Keith Weed,1009124554822864897,2018-06-19T17:23:37Z,"A friend received today here in Cannes - exactly why we need to take urgent action to remove misleading engagement, improve transparency and rebuild trust! #CannesLions//t.co/BXnN3ALtxa",FALSE,FALSE,NA,CannesLions
Keith Weed,1009118830822641664,2018-06-19T17:00:52Z,Great to see so many passionate supporters of #SEEHER at the Girls Lounge @weareTFQ. So sorry had to dash at the end ..loved to hear all the actions that have been taken! @ShelleyZalis @carter_fiona Alison Lewis @J&J @marcpritchard1//t.co/dOhHh6JrtI,FALSE,FALSE,NA,SEEHER
Keith Weed,1009090466728628225,2018-06-19T15:08:09Z,Great words @PrincessSarahZR We need to redefine what's responsible business in the technical age. #CollectiveAction #CannesLions//t.co/dSCJ8f4dDe,TRUE,FALSE,NA,CollectiveAction
Keith Weed,1009090466728628225,2018-06-19T15:08:09Z,Great words @PrincessSarahZR We need to redefine what's responsible business in the technical age. #CollectiveAction #CannesLions//t.co/dSCJ8f4dDe,TRUE,FALSE,NA,CannesLions
Keith Weed,1009075248308867075,2018-06-19T14:07:41Z,We as marketers have a duty to promote #responsiblemarketing online. Key to rebuilding trust and strengthening consumer relationships #CannesLions//t.co/3i09mU5FxG//t.co/4myiuRloWu,FALSE,FALSE,NA,responsiblemarketing
Keith Weed,1009075248308867075,2018-06-19T14:07:41Z,We as marketers have a duty to promote #responsiblemarketing online. Key to rebuilding trust and strengthening consumer relationships #CannesLions//t.co/3i09mU5FxG//t.co/4myiuRloWu,FALSE,FALSE,NA,CannesLions
Keith Weed,1009043679712088064,2018-06-19T12:02:15Z,Fantastic discussion today on whether AdLand can save the internet. It's time all of us involved take responsibility and greater ownership for the erosion of trust and impact on society. #CannesLions//t.co/pHOyhdlxsy,FALSE,FALSE,NA,CannesLions
Keith Weed,1009021928781250561,2018-06-19T10:35:49Z,"With the marketing mix only getting broader, attribution is more important than ever. Interesting development from @Adobe, good to see brand-side #transparency as well//t.co/BpZatuqzO1",FALSE,FALSE,NA,transparency
Keith Weed,1009002793263394817,2018-06-19T09:19:46Z,"I'ts been a fairly busy few years, and I'm sure lots more innovation to come!//t.co/GVDzSf84ow",TRUE,FALSE,NA,NA
Keith Weed,1008988485146030080,2018-06-19T08:22:55Z,"Consumers know what they like & know what they don't - how can brands adapt to online challenges to deliver their audiences quality experiences? 9.15am BST I'll be discussing w/ @lbdesmond, @waynegattinella, John Montgomery & Lea Stendahl. We have the power to save the internet!//t.co/kEvZGVkEl1",FALSE,FALSE,NA,NA
Keith Weed,1008757492057366528,2018-06-18T17:05:02Z,"Lots to look out for this week at #CannesLions, from media fragmentation and industry disruption to equality, inclusion, and digital trust. A busy week ahead! @fastcompany//t.co/47DVQu8qOY",FALSE,FALSE,NA,CannesLions
Keith Weed,1008720627358986240,2018-06-18T14:38:33Z,Really interesting snapshot of the digital state of play in 2018. Expect this to be at the heart of conversations this week. #CannesLions//t.co/neSgJJu3hQ,TRUE,FALSE,NA,CannesLions
Keith Weed,1008684656508751872,2018-06-18T12:15:37Z,Looking forward to discussing how we as an industry can rebuild trust in our #digital ecosystems - the current trust deficit has damaged relationships between brands and consumers #CannesLions//t.co/KNuVh2Qb4A//t.co/YdlkNC1oMJ,FALSE,FALSE,NA,digital
Keith Weed,1008684656508751872,2018-06-18T12:15:37Z,Looking forward to discussing how we as an industry can rebuild trust in our #digital ecosystems - the current trust deficit has damaged relationships between brands and consumers #CannesLions//t.co/KNuVh2Qb4A//t.co/YdlkNC1oMJ,FALSE,FALSE,NA,CannesLions
Keith Weed,1008669188272148485,2018-06-18T11:14:09Z,It will take #CollectiveAction for us marketers to create a better digital ecosystem to rebuild consumer trust in an era of fake news. #CannesLions #TrustBarometer//t.co/nsgx4pBpuQ,FALSE,FALSE,NA,CollectiveAction
Keith Weed,1008669188272148485,2018-06-18T11:14:09Z,It will take #CollectiveAction for us marketers to create a better digital ecosystem to rebuild consumer trust in an era of fake news. #CannesLions #TrustBarometer//t.co/nsgx4pBpuQ,FALSE,FALSE,NA,CannesLions
Keith Weed,1008669188272148485,2018-06-18T11:14:09Z,It will take #CollectiveAction for us marketers to create a better digital ecosystem to rebuild consumer trust in an era of fake news. #CannesLions #TrustBarometer//t.co/nsgx4pBpuQ,FALSE,FALSE,NA,TrustBarometer
Keith Weed,1008657782973878273,2018-06-18T10:28:50Z,"Next up, discussing trust in social media with @WSJ and @EdelmanPR //t.co/4urzAyMzjO",FALSE,FALSE,NA,NA
Keith Weed,1008628563510218752,2018-06-18T08:32:43Z,"Today, @Unilever is announcing clear commitments to support authenticity and trust of influencer marketing. Collectively, we have the power to improve consumer trust, before it's too late. #CannesLions//t.co/KNuVh2Qb4A//t.co/ivcVbNqhBL",FALSE,FALSE,NA,CannesLions
Keith Weed,1008320662656770048,2018-06-17T12:09:14Z,I saw this @Dove offer yesterday... I hope some lucky Dads were a recipient of a #FathersDay gift. Happy Father's Day to all the Dads//t.co/0UpDnXAsjv,FALSE,FALSE,NA,FathersDay
Keith Weed,1008283388917288964,2018-06-17T09:41:07Z,Love this.... What fun!//t.co/XCfhbDwEKy,TRUE,FALSE,NA,NA
Keith Weed,1007567041220567040,2018-06-15T10:14:36Z,The #oceans need our help. How we can bring advertising's best minds to develop the world's most important content strategy? Find out at #CannesLions @cgorellbarnes @SimonJCLeBON @keithweed @evianwater @Bluemarinef @TheGlobalGoals//t.co/TYU1h32ASw//t.co/3wFXENj1JC,FALSE,TRUE,NA,oceans
Keith Weed,1007337513785221121,2018-06-14T19:02:33Z,"I'm excited to be in Europe and join Unilever CMO @KeithWeed with Richelieu Dennis, @GuidoMartinetti, next Wednesday LIVE as we discuss how brands can differentiate themselves through purpose at the @Unilever Founders' Formula panel #CannesLions//t.co/z2cFxEq56r Watch it!",FALSE,TRUE,NA,NA
Keith Weed,1007010125612306433,2018-06-13T21:21:37Z,Thank you @ceverson @facebook there is so much that can and should be done ...//t.co/6WzzPTmWn7,TRUE,FALSE,NA,NA
Keith Weed,1006920833628016642,2018-06-13T15:26:49Z,"This time next week, watch Richelieu Dennis, @GuidoMartinetti, @Dermalogicajane & myself LIVE as we discuss how brands can differentiate themselves through purpose at the @Unilever Founders' Formula panel #CannesLions//t.co/BMfmlTHodE//t.co/zu06qpf2gt",FALSE,FALSE,NA,CannesLions
Keith Weed,1006830626056568832,2018-06-13T09:28:21Z,Update: the raccoon made it to the roof!! #mprracoon//t.co/ki2XKGK7Av,TRUE,FALSE,NA,mprracoon
Keith Weed,1006567314337214464,2018-06-12T16:02:03Z,"Just one week to go until the 2018 #CannesLions Festival, where I'll be posting regular updateslooking forward to seeing some familiar faces!//t.co/bHy9j71vwy",FALSE,FALSE,NA,CannesLions
Keith Weed,1006552933704654849,2018-06-12T15:04:54Z,Break out the ros - #CannesLions is happening! this Tweet to get a daily recap of this year's most creative campaigns on Twitter during the week of Cannes.//t.co/xEfvGjt6Lt,FALSE,TRUE,NA,CannesLions
Keith Weed,1004646998467907585,2018-06-07T08:51:24Z,"Welcoming our first discussion of the day @keithweed CMCO, Unilever & @RadioCrimson Richard Eyre CBE, Chairman, IAB UK #iabengage//t.co/o7LQGEETSZ",FALSE,TRUE,NA,NA
Keith Weed,1004641528583741441,2018-06-07T08:29:40Z,About to go on stage to be interviewed by Richard Eyre @RadioCrimson @iabuk #iabengage ...//t.co/jGbbxGuuTi,FALSE,FALSE,NA,iabengage
Keith Weed,1004066633965502464,2018-06-05T18:25:14Z,We reveal the eight types of marketing mind://t.co/jjmgFWvD8L//t.co/0sdECnSb2O,FALSE,TRUE,NA,NA
Keith Weed,1004023884780326912,2018-06-05T15:35:22Z,"As the experience economy becomes increasingly important, #VR must continue to innovate!//t.co/hrN1FK0qli",TRUE,FALSE,NA,VR
Keith Weed,1004022670026072065,2018-06-05T15:30:33Z,Marketing Week's recommended reading... Behavioural science experiments and how to work smarter://t.co/3O6VC7oxUA//t.co/qEAQ9n0KpT,FALSE,TRUE,NA,NA
Keith Weed,1003602994636738560,2018-06-04T11:42:54Z,"""...the core of modern marketing is mindset. Specifically, instilling a customer centric mindset is what makes marketing modern."" @StephanieSAM explains why modern marketing is as much about mindset as technical skills What do you think?//t.co/hCgjtf7N0n//t.co/wtUbGlbvJE",FALSE,TRUE,NA,NA
Keith Weed,1002641393830055937,2018-06-01T20:01:51Z,Great to have @PaulPolman visiting @Unilever Glassmill in partnership with SapientRazorfish @SR_ Thanks to the team and @vaznigel @aaronrajan @RahulWelde to name a few for all the super work....and much more to do!//t.co/pFNVHKcC5k,FALSE,FALSE,NA,NA
Keith Weed,1002638468286177280,2018-06-01T19:50:13Z,Join us on the 9th & 10th of June for an inspiring 2 days where young girls from Liverpool will &lt;DECODE&gt; the @UN Sustainable Development Goals for the first time with @Unilever @2030hub @idea_award @TheWorldsLesson @mjamme cc @PaulPolman @keithweed #SDGs @LFC @SDG2030 @YGLvoices//t.co/91kHNTd6J7,FALSE,TRUE,NA,NA
Keith Weed,1002501781253967878,2018-06-01T10:47:04Z,"Great to catch up with the remarkable @tim_armstrong @oath , great leader making a big impact. Thanks for hosting the @EffieAwards in your equally remarkable offices!!//t.co/cFdKYYerIK",TRUE,FALSE,NA,NA
Keith Weed,1002499011499130880,2018-06-01T10:36:04Z,"A winner has been selected... thank you to the 2018 NA Grand Effie Jury, chaired by @nicklaw01 & @ceverson, for the rich & thoughtful dialogue. This year's Grand Effie winner will be revealed tonight! #Effies//t.co/9B0gtyJuUS",FALSE,TRUE,NA,NA
Keith Weed,1002480230760579072,2018-06-01T09:21:26Z,"The end of an era... As the digital eco-sphere changes, it's imperative to react and respond quickly!//t.co/qwV2zZUcEx",FALSE,FALSE,NA,NA
Keith Weed,1002243172393799680,2018-05-31T17:39:27Z,There's only one way to celebrate #NationalSmileDay... //t.co/68upOt1TCu,FALSE,TRUE,NA,NationalSmileDay
Keith Weed,1002205145583759361,2018-05-31T15:08:21Z,Eat ice-cream and save the world!//t.co/yXSfaedHMx,FALSE,FALSE,NA,NA
Keith Weed,1002152232018743302,2018-05-31T11:38:05Z,The @Unilever Young Entrepreneurs Awards are looking for people that are striving to improve global income through women's equality. Do you have a solution? Enter here://t.co/EMwijpFpSo//t.co/LvrhNbzzCz,FALSE,FALSE,NA,NA
Keith Weed,1002147569835872256,2018-05-31T11:19:34Z,The downfall of many brands is often due to not devising a clear digital strategy!//t.co/3aMSiCuJYq,TRUE,FALSE,NA,NA
Keith Weed,1002146405224460288,2018-05-31T11:14:56Z,How to pick an AI vendor when everyone claims to be one//t.co/DXgC7lRccA,FALSE,TRUE,NA,NA
Keith Weed,1002142108617199616,2018-05-31T10:57:52Z,Struggling to achieve a 'balanced digital diet'? There's an app that could just be the solution to getting some well-needed downtime from your phone...//t.co/1EtHBOMdnn,TRUE,FALSE,NA,NA
