name,status_id,created_at,text,is_quote,is_retweet,reply_to_user_id,hashtags
Keith Weed,1181318621076832261,2019-10-07T21:21:21Z,@alanjope @Unilever//t.co/VlfR648CJM,TRUE,FALSE,NA,NA
Keith Weed,1179640697839915008,2019-10-03T06:13:53Z,"I look forward to seeing you there, for an engaging time together.//t.co/4twphafDNy",TRUE,FALSE,NA,NA
Keith Weed,1177315793840889856,2019-09-26T20:15:33Z,Great presentation from @keithweed on behalf of @ad_association and its members on our programme to improve public trust in advertising at #AWNewYork Thanks to @advertisingweek and @lordscheckner for his warm words!//t.co/mGsTaFuvO3,FALSE,TRUE,NA,NA
Keith Weed,1177285712057700363,2019-09-26T18:16:01Z,I am talking soon in New York at Adweek//t.co/8visaPnqIh via @campaignmag,FALSE,FALSE,NA,NA
Keith Weed,1177283097445982209,2019-09-26T18:05:37Z,Delighted to be joining the @WPP Board at such a dynamic and important time in the industry. Such a great company with a great future. #Advertising //t.co/ThSQdaHeUi,FALSE,TRUE,NA,NA
Keith Weed,1177282857804468229,2019-09-26T18:04:40Z,"Our Chief Sustainability Officer, Rebecca Marmot, is at #UNGA @UN_EWEC sharing our commitment to supporting women in our tea supply chain by strengthening safety programmes and improving access to basic healthcare.//t.co/nM60jlKtAu",FALSE,TRUE,NA,UNGA
Keith Weed,1177282603969388546,2019-09-26T18:03:40Z,.@keithweed's call to arms to the US: Help us tackle the issue of public trust in advertising'.//t.co/K45Jupvj48,FALSE,TRUE,NA,NA
Keith Weed,1177282535992246274,2019-09-26T18:03:24Z,"""Keith Weed calls on US adland to join UK in tackling 'Achilles' heel' of trust"" Read more on our President @keithweed's appearance at @AWNewYork_ via @Campaignmag here://t.co/qWXpdldXVT//t.co/FVG23j5vRO",FALSE,TRUE,NA,NA
Keith Weed,1176557300070440960,2019-09-24T18:01:34Z,Opening ceremony of #ClimateWeekNYC discussing @Unilever's achievement of 100% renewable grid electricity across 5 continents - and this @MagnumIceCream is made from exactly that! #RenewableIsDoable #UNGA//t.co/6QyIYt3vYk,FALSE,TRUE,NA,ClimateWeekNYC
Keith Weed,1175005758855024642,2019-09-20T11:16:18Z,delivered by a drone? @benandjerrys is piloting it. Watch this space!//t.co/sehKbMLyXo,FALSE,TRUE,NA,NA
Keith Weed,1174995872003870720,2019-09-20T10:37:00Z,"As we head into the weekend, here's your hit of marketing news featuring @keithweed @goustocooking @wagamama_uk @MoonpigUK @kpf1970 //t.co/Yg9KYlzXQL//t.co/hYh9Zinndy",FALSE,TRUE,NA,NA
Keith Weed,1174932021107277824,2019-09-20T06:23:17Z,WPP appoints former Unilever marketing chief to its board//t.co/lFJ0sNcV8y,FALSE,TRUE,NA,NA
Keith Weed,1174689853482708992,2019-09-19T14:21:00Z,"The move that every #advertising industry player is watching today...the appointment of @keithweed to @WPP board. Weed has been the ""World's Most Influential CMO"" according to @Forbes for the past three years in a row. #markets #investing #CMO",FALSE,TRUE,NA,advertising
Keith Weed,1174689524586295297,2019-09-19T14:19:41Z,Delighted to be joining the @WPP Board at such a dynamic and important time in the industry. Such a great company with a great future. #Advertising //t.co/ThSQdaHeUi,FALSE,FALSE,NA,Advertising
Keith Weed,1174345733618700288,2019-09-18T15:33:35Z,".@keithweed, @nightingaleitv, @steverichards14, @philippabrown2, @karenfraser_MBE & @stephenwoodford are already confirmed to speak at #LEAD2020 in January! Keep your eyes peeled for more announcements and find further details here://t.co/YLFhMo9paF #LEAD2020//t.co/KDp4YyBHDe",FALSE,TRUE,NA,NA
Keith Weed,1174345567297818624,2019-09-18T15:32:56Z,Excellent achievement and well done to the whole @Unilever team. It shows that big business can achieve this objective around the world. Where there is a will there is a way! Congratulations @alanjope !//t.co/PAQHz8PwXO,TRUE,FALSE,NA,NA
Keith Weed,1174345015604273153,2019-09-18T15:30:44Z,"Are you a brand side marketeer? Want to join us for a morning of insight and discussion with FMCG's top marketer, @keithweed and our guest panelists from @Dyson, Johnson&Johnson, @ClubMedUK, @PepsiCo, @ISBAsays and more...!? Reserve your place now!//t.co/L4EOSCsf3W//t.co/5npqFS2rcv",FALSE,TRUE,NA,NA
Keith Weed,1174344937435029505,2019-09-18T15:30:26Z,"New week on Thursday 26th Sept, our President @keithweed will be talking 'Trust or Bust' at @AWNewYork_ on the Tech Stars Stage. It won't be one to miss! Find out more here://t.co/jEazUblsoC #AWNewYork//t.co/DyOZ74Z6MH",FALSE,TRUE,NA,NA
Keith Weed,1173921829586702337,2019-09-17T11:29:09Z,A busy summer of campaigns for @Twitter culminating in #TwitterIs. Nice idea to base the campaign around showcasing real tweets to remind us why we love the platform. //t.co/n1PEyMkot2//t.co/rhutz7LthB,FALSE,FALSE,NA,TwitterIs
Keith Weed,1172943769546764288,2019-09-14T18:42:41Z,@PGtips @goodwoodrevival I am @goodwoodrevival and enjoyed a cuppa or two with @PGtips . Loved seeing the old chimpanzee adverts too. #goodwoodrevival,FALSE,FALSE,1154307793,goodwoodrevival
Keith Weed,1171405879348011008,2019-09-10T12:51:39Z,interesting stat from @econsultancy - #voicetech is no longer a western trend. Time for brands around the world to find their voice - fascinating opportunity to reach consumers in new effective ways.//t.co/GDeD8v7xgT,FALSE,FALSE,NA,voicetech
Keith Weed,1171172544143155201,2019-09-09T21:24:28Z,"We're pleased to announce, 'The Worlds Most Influential CMO', @keithweed will join us as our keynote speaker for our third thought leadership event for 2019! Speaker info and the full event summary://t.co/L4EOSCsf3W *By invitation only//t.co/DMjZtGbYSY",FALSE,TRUE,NA,NA
Keith Weed,1169142626525876224,2019-09-04T06:58:18Z,Summer is not over! If you want to keep that feeling alive do visit @RHSWisley Flower Show this week!!!//t.co/hlqNZ6aicq,TRUE,FALSE,NA,NA
Keith Weed,1169139091746766848,2019-09-04T06:44:15Z,@MarketingWeekEd @daryl_fielding @dwheld @RBS .@keithweed will also be joining us at #Fom19 to judge the student pitch morning. Make your way to the Realising Your Potential Stage on 11 October to discover more!//t.co/5WM4hmr008,FALSE,TRUE,NA,Fom19
Keith Weed,1168488785249734659,2019-09-02T11:40:10Z,Clever AND impactful. A good move by @Facebook in its commitment to improving #DataPrivacy and building trust with its users #FacebookCafe//t.co/MEqbiCB7uO,FALSE,FALSE,NA,DataPrivacy
Keith Weed,1168488785249734659,2019-09-02T11:40:10Z,Clever AND impactful. A good move by @Facebook in its commitment to improving #DataPrivacy and building trust with its users #FacebookCafe//t.co/MEqbiCB7uO,FALSE,FALSE,NA,FacebookCafe
Keith Weed,1166718814106673152,2019-08-28T14:26:56Z,Anyone remember Sandpapergate? Watch the #marmyarmy hand out branded sandpaper at #ENGvsAUS! #LoveItOrHateIt//t.co/qUpkgtKrlg,FALSE,FALSE,NA,marmyarmy
Keith Weed,1166718814106673152,2019-08-28T14:26:56Z,Anyone remember Sandpapergate? Watch the #marmyarmy hand out branded sandpaper at #ENGvsAUS! #LoveItOrHateIt//t.co/qUpkgtKrlg,FALSE,FALSE,NA,ENGvsAUS
Keith Weed,1166718814106673152,2019-08-28T14:26:56Z,Anyone remember Sandpapergate? Watch the #marmyarmy hand out branded sandpaper at #ENGvsAUS! #LoveItOrHateIt//t.co/qUpkgtKrlg,FALSE,FALSE,NA,LoveItOrHateIt
Keith Weed,1165174765629464576,2019-08-24T08:11:26Z,"Hey, can you check the camera in Tahoe I think a dog or a cat walked by...//t.co/Drob77vwii",FALSE,TRUE,NA,NA
Keith Weed,1165174410292158469,2019-08-24T08:10:01Z,@adambain Wow! Unimaginable in little old England...It puts a whole new perspective on whose turn is it to put out the garbage ... it could be a life or death decision!!,FALSE,FALSE,14253109,NA
Keith Weed,1164452370010574848,2019-08-22T08:20:54Z,"Sometimes the best way to respond to criticism is saying #ComplaintsWelcome! Loving this cheeky, creative thinking Bravo, @Channel4!//t.co/docJuPhBQC",FALSE,FALSE,NA,ComplaintsWelcome
Keith Weed,1161575224485261313,2019-08-14T09:48:09Z,Every year a third of all food produced in the world - around 1.3 billion tonnes - is wasted. Here are eight ways we're working with others to reduce that waste.//t.co/b8YFauss5R//t.co/qRApuSBHOK,FALSE,TRUE,NA,NA
Keith Weed,1161195295562227712,2019-08-13T08:38:27Z,Love to see this iconic campaign back! #IamKlondike #partofteamklondike//t.co/5t9erYamXi,FALSE,TRUE,NA,IamKlondike
Keith Weed,1161195295562227712,2019-08-13T08:38:27Z,Love to see this iconic campaign back! #IamKlondike #partofteamklondike//t.co/5t9erYamXi,FALSE,TRUE,NA,partofteamklondike
Keith Weed,1160458338850750466,2019-08-11T07:50:02Z,"Well done Adam, I am just starting...//t.co/lySL1PKHVJ//t.co/L3TWgEMMR2",TRUE,FALSE,NA,NA
Keith Weed,1160089750797193216,2019-08-10T07:25:24Z,"An iconic moment in music history. #OnThisDay 50 years ago, Iain MacMillan climbed a stepladder & took 6 pictures of The Beatles crossing Abbey Road. The VW Beetle was a coincidence; its owner unknowingly parking it in the most recognisable album cover of all time. #MusicIsGREAT//t.co/T2MI3O8BLy",FALSE,TRUE,NA,OnThisDay
Keith Weed,1159069816470278145,2019-08-07T11:52:33Z,Equality can't wait... and according to @wef it could take up to 208 years. Lighthearted approach to a very serious issue. //t.co/EUfkaSglSm//t.co/OPuqRkl07O,FALSE,FALSE,NA,NA
Keith Weed,1159043188356767744,2019-08-07T10:06:44Z,"One small step for that robot, one giant leap for automated deliveries//t.co/UIbqfkf6JV",FALSE,TRUE,NA,NA
Keith Weed,1156854658444537858,2019-08-01T09:10:18Z,A cultural icon! #TBT looking at the most-loved and most-hated food in the UK... @marmite! #LoveItOrHateIt you can't ignore great #marketing//t.co/Td85nowCeK//t.co/cvYppUpsdQ,FALSE,FALSE,NA,TBT
Keith Weed,1156854658444537858,2019-08-01T09:10:18Z,A cultural icon! #TBT looking at the most-loved and most-hated food in the UK... @marmite! #LoveItOrHateIt you can't ignore great #marketing//t.co/Td85nowCeK//t.co/cvYppUpsdQ,FALSE,FALSE,NA,LoveItOrHateIt
Keith Weed,1156854658444537858,2019-08-01T09:10:18Z,A cultural icon! #TBT looking at the most-loved and most-hated food in the UK... @marmite! #LoveItOrHateIt you can't ignore great #marketing//t.co/Td85nowCeK//t.co/cvYppUpsdQ,FALSE,FALSE,NA,marketing
Keith Weed,1154693743301332993,2019-07-26T10:03:36Z,Internet searches contribute towards your carbon footprint too. Great trips from @mozilla about staying green online//t.co/ghDUu617wm,FALSE,TRUE,NA,NA
Keith Weed,1153651809560514560,2019-07-23T13:03:19Z,At our President's Reception @keithweed launched our new #CreativityIsGREAT highlights film from @Cannes_Lions. Have you watched it yet? Check it out here!//t.co/s9NV3RJaIM,FALSE,TRUE,NA,CreativityIsGREAT
Keith Weed,1153011273367478274,2019-07-21T18:38:04Z,It was great to be with you @OgilvyConsult . Thank you for all the insights and thoughts. Really made me think about the true added value of creative agencies and #Advertising in engaging people and building #Brands . @Ogilvy//t.co/D0HdoXAdoy,TRUE,FALSE,NA,Advertising
Keith Weed,1153011273367478274,2019-07-21T18:38:04Z,It was great to be with you @OgilvyConsult . Thank you for all the insights and thoughts. Really made me think about the true added value of creative agencies and #Advertising in engaging people and building #Brands . @Ogilvy//t.co/D0HdoXAdoy,TRUE,FALSE,NA,Brands
Keith Weed,1151950366411579394,2019-07-18T20:22:24Z,Yes! Let's do this! How hard can 100k retweets be? Now... for 150k retweets how about a Triple Pop!?!?! #BringBackTheDouble #LetsLaunchTheTriple//t.co/R9RggzVgMN,TRUE,FALSE,NA,BringBackTheDouble
Keith Weed,1151950366411579394,2019-07-18T20:22:24Z,Yes! Let's do this! How hard can 100k retweets be? Now... for 150k retweets how about a Triple Pop!?!?! #BringBackTheDouble #LetsLaunchTheTriple//t.co/R9RggzVgMN,TRUE,FALSE,NA,LetsLaunchTheTriple
Keith Weed,1150998204030357505,2019-07-16T05:18:51Z,Lovely photos by @BronacMcNeill from our President's Reception last Thursday where @keithweed & special guest speaker @conbird2 talked about #advertising #trust and the #CreativityIsGREAT campaign -//t.co/Hqi91i46sL @ad_association,FALSE,TRUE,NA,NA
Keith Weed,1149447653299802112,2019-07-11T22:37:30Z,"Great that @Unilever hosted this important @ad_association event, bringing the industry together//t.co/iflOedu6r9",TRUE,FALSE,NA,NA
Keith Weed,1149446970534244354,2019-07-11T22:34:48Z,"Our President @keithweed welcomes guests to tonight's reception at Unilever House stating that advertising is an engine for our economy and an engine for growth. He also reiterates the crucial issue of public trust in advertising, that it's trust or bust' for our industry.//t.co/zq6qBK2TRO",FALSE,TRUE,NA,NA
Keith Weed,1145552385093308416,2019-07-01T04:39:06Z,"& thank you @RpsRally for finding a replacement Pontiac engine at zero notice & organising for it to be trucked 3 days across Europe from UK & flying out Gary & Ben, your great mechanics, to fit it in just 15 hours over night. Now in Latvia with a few new problems! #PekingtoParis//t.co/Nx2GUpkIdP",TRUE,FALSE,NA,PekingtoParis
Keith Weed,1145257043219111936,2019-06-30T09:05:31Z,Update on #PekingtoParis Rally: Up all night with mechanics fitting a new engine replacing a cracked engine block. Work started at 4pm through the night till 7:20am. I restarted the rally at our official start time of 7:52am with a new engine only 15 hours later!! @EnduroRallyERA//t.co/KPNnAdPhkC,FALSE,FALSE,NA,PekingtoParis
Keith Weed,1144818106520547328,2019-06-29T04:01:20Z,Congratulations Leena! Very well deserved. What a great opportunity for @BTGroup and you. //t.co/ISh7FAA5xc,TRUE,FALSE,NA,NA
Keith Weed,1144137791162519552,2019-06-27T06:58:01Z,"@Itallium Thanks, unfortunately we are staying at a hotel outside St Petersburg : the Baltic star hotel. All the cars are there. #peking2paris",FALSE,FALSE,85284777,peking2paris
Keith Weed,1143709391478284288,2019-06-26T02:35:42Z,Great to hear @Unilever #CEO @alanjope s clear and engaging thoughts on #diversity and #inclusion. The world needs more leaders like this!//t.co/sCkQ3BR85O,TRUE,FALSE,NA,CEO
Keith Weed,1143709391478284288,2019-06-26T02:35:42Z,Great to hear @Unilever #CEO @alanjope s clear and engaging thoughts on #diversity and #inclusion. The world needs more leaders like this!//t.co/sCkQ3BR85O,TRUE,FALSE,NA,diversity
Keith Weed,1143709391478284288,2019-06-26T02:35:42Z,Great to hear @Unilever #CEO @alanjope s clear and engaging thoughts on #diversity and #inclusion. The world needs more leaders like this!//t.co/sCkQ3BR85O,TRUE,FALSE,NA,inclusion
Keith Weed,1142445381223141376,2019-06-22T14:52:59Z,@Unilever Super! Well done @Unilever team. I have been welding up the chassis of the #pontiac today in Ufa #pekingtoparis,FALSE,FALSE,109224937,pontiac
Keith Weed,1142445381223141376,2019-06-22T14:52:59Z,@Unilever Super! Well done @Unilever team. I have been welding up the chassis of the #pontiac today in Ufa #pekingtoparis,FALSE,FALSE,109224937,pekingtoparis
Keith Weed,1142278111419084805,2019-06-22T03:48:18Z,Now halfway on the Peking to Paris Endurance Rally... Just crossed from the Asian continent to Europe in Russia. My 1940 #Pontiac keeps hanging in there... @EnduroRallyERA #peking2paris #pekingtoparis//t.co/hcpDelKNxD,TRUE,FALSE,NA,Pontiac
Keith Weed,1142278111419084805,2019-06-22T03:48:18Z,Now halfway on the Peking to Paris Endurance Rally... Just crossed from the Asian continent to Europe in Russia. My 1940 #Pontiac keeps hanging in there... @EnduroRallyERA #peking2paris #pekingtoparis//t.co/hcpDelKNxD,TRUE,FALSE,NA,peking2paris
Keith Weed,1142278111419084805,2019-06-22T03:48:18Z,Now halfway on the Peking to Paris Endurance Rally... Just crossed from the Asian continent to Europe in Russia. My 1940 #Pontiac keeps hanging in there... @EnduroRallyERA #peking2paris #pekingtoparis//t.co/hcpDelKNxD,TRUE,FALSE,NA,pekingtoparis
Keith Weed,1142276484935168001,2019-06-22T03:41:51Z,@Cannes_Lions @phumzileunwomen @un_stereotype @UN_Women Congratulations @phumzileunwomen ! Richly deserved. #Unstereotype #Canneslion2019,FALSE,FALSE,20139902,Unstereotype
Keith Weed,1142276484935168001,2019-06-22T03:41:51Z,@Cannes_Lions @phumzileunwomen @un_stereotype @UN_Women Congratulations @phumzileunwomen ! Richly deserved. #Unstereotype #Canneslion2019,FALSE,FALSE,20139902,Canneslion2019
Keith Weed,1141981074593107969,2019-06-21T08:07:59Z,"Wow - completely humbled to awarded @Forbes World's Most Influential CMO. Third time running, but first time that I've received the good news when on the Russia Kazakhstan border. Thanks all.. now back to the Rally!//t.co/EtUGCdOLrY",FALSE,FALSE,NA,NA
Keith Weed,1141902493481361408,2019-06-21T02:55:44Z,"Thanks Sprinklr, sending greetings from the Russian Kazakhstan border. Feels strange not being @Cannes_Lions this year. But loving the @EnduroRallyERA Peking to Paris Endurance Rally in my 1940 Pontiac//t.co/7U4pMGHIsn//t.co/oiP8dZiKr7",TRUE,FALSE,NA,NA
Keith Weed,1141327899271843841,2019-06-19T12:52:30Z,"@keithweed Investing more than 2 years prep is a real commitment! With your enthusiasm though I would say it was already worth it? We wish you, No. 21, best of luck, hope other participants will be as helpful as you in case you need it. Enjoy the journey from #PekingtoParis2019 - Theresa//t.co/aHUM1gmM4p",FALSE,TRUE,NA,NA
Keith Weed,1139355504579362817,2019-06-14T02:14:55Z,@tj_salisbury @alanjope @PaulPolman Here is an idea you could LOVE or HATE! I personally LOVE it,FALSE,FALSE,339732687,NA
Keith Weed,1135475966300643329,2019-06-03T09:19:01Z,"As requested here is a #PekingtoParis2019 update. Photos of the overall route, map and globe view...the Pontiac under repair last night and helping a breakdown in the middle of nowhere..the north of China is amazing. @EnduroRallyERA//t.co/JuB9J0mQiV",FALSE,FALSE,NA,PekingtoParis2019
Keith Weed,1135458131453108224,2019-06-03T08:08:08Z,@jpmaheu @EnduroRallyERA Between five and six weeks ...,FALSE,FALSE,14534657,NA
Keith Weed,1134811043149090817,2019-06-01T13:16:51Z,"After over 2.5 years of preparation especially on my car, the Peking to Paris 2019 Endurance Rally starts tomorrow ! @EnduroRallyERA My 1940 #Pontiac , car 21, is here in Beijing and all is working... so far! Have my Chinese Driving License #PekingtoParis2019 #P2P2019//t.co/Xe7k27w1xj",FALSE,FALSE,NA,Pontiac
Keith Weed,1134811043149090817,2019-06-01T13:16:51Z,"After over 2.5 years of preparation especially on my car, the Peking to Paris 2019 Endurance Rally starts tomorrow ! @EnduroRallyERA My 1940 #Pontiac , car 21, is here in Beijing and all is working... so far! Have my Chinese Driving License #PekingtoParis2019 #P2P2019//t.co/Xe7k27w1xj",FALSE,FALSE,NA,PekingtoParis2019
Keith Weed,1134811043149090817,2019-06-01T13:16:51Z,"After over 2.5 years of preparation especially on my car, the Peking to Paris 2019 Endurance Rally starts tomorrow ! @EnduroRallyERA My 1940 #Pontiac , car 21, is here in Beijing and all is working... so far! Have my Chinese Driving License #PekingtoParis2019 #P2P2019//t.co/Xe7k27w1xj",FALSE,FALSE,NA,P2P2019
Keith Weed,1134241350281506816,2019-05-30T23:33:05Z,"Super to see. Congrats Aline, the recognition is very well deserved! Good choice @adage !//t.co/X1pVLOzQgb",TRUE,FALSE,NA,NA
Keith Weed,1132912803390603264,2019-05-27T07:33:55Z,"@KLemkau Happy Birthday Kristin, stretch it out to a Birthday Week!",FALSE,FALSE,516003004,NA
Keith Weed,1131146715069857792,2019-05-22T10:36:07Z,Thank you to all at History of Advertising @HatAds for your thoughtful and fun presents! I will think of you all on my journey :-) I have not used @SwarfegaUK for years. It will be much needed!//t.co/AbK6AJYCMe,TRUE,FALSE,NA,NA
Keith Weed,1129451730947792898,2019-05-17T18:20:51Z,Thank you @VivaTech for capturing this. If want some fun and bring some #Magic to your #logic have a look at this very short video of me and @MichaelKassan @MediaLink . Data can predict the future! Have fun... Miserable people deliver miserable results...//t.co/OWFgLAOA4B,TRUE,FALSE,NA,Magic
Keith Weed,1129451730947792898,2019-05-17T18:20:51Z,Thank you @VivaTech for capturing this. If want some fun and bring some #Magic to your #logic have a look at this very short video of me and @MichaelKassan @MediaLink . Data can predict the future! Have fun... Miserable people deliver miserable results...//t.co/OWFgLAOA4B,TRUE,FALSE,NA,logic
Keith Weed,1129333625261121536,2019-05-17T10:31:32Z,"If you want to know why you are hearing more about the #Biodiversity Crisis that could be bigger than #climatechange - read this. We are burning the library of life and heading for the sixth mass extinction. This explains, but don't read before bedtime!//t.co/1Fn3VKgkkp",FALSE,FALSE,NA,Biodiversity
Keith Weed,1129333625261121536,2019-05-17T10:31:32Z,"If you want to know why you are hearing more about the #Biodiversity Crisis that could be bigger than #climatechange - read this. We are burning the library of life and heading for the sixth mass extinction. This explains, but don't read before bedtime!//t.co/1Fn3VKgkkp",FALSE,FALSE,NA,climatechange
Keith Weed,1128328876273303553,2019-05-14T15:59:02Z,"If you are a #marketer or #agency interested in building your brand with #influencer marketing, look no further and read this article about @tribe . Quality, low cost, speedy #content is now possible no matter how big or small you brand or brand budget is!//t.co/btm9zdqdZl",FALSE,FALSE,NA,marketer
Keith Weed,1128328876273303553,2019-05-14T15:59:02Z,"If you are a #marketer or #agency interested in building your brand with #influencer marketing, look no further and read this article about @tribe . Quality, low cost, speedy #content is now possible no matter how big or small you brand or brand budget is!//t.co/btm9zdqdZl",FALSE,FALSE,NA,agency
Keith Weed,1128328876273303553,2019-05-14T15:59:02Z,"If you are a #marketer or #agency interested in building your brand with #influencer marketing, look no further and read this article about @tribe . Quality, low cost, speedy #content is now possible no matter how big or small you brand or brand budget is!//t.co/btm9zdqdZl",FALSE,FALSE,NA,influencer
Keith Weed,1128328876273303553,2019-05-14T15:59:02Z,"If you are a #marketer or #agency interested in building your brand with #influencer marketing, look no further and read this article about @tribe . Quality, low cost, speedy #content is now possible no matter how big or small you brand or brand budget is!//t.co/btm9zdqdZl",FALSE,FALSE,NA,content
Keith Weed,1126902989938135041,2019-05-10T17:33:04Z,"Thank you Carolyn so much for coming to join me on this special evening. You are great!!! Loved seeing you there along with the rest of the Facebook team, Nicola Mendleson @nicolamen and Steve Hatch.//t.co/opTUwVi2q7",TRUE,FALSE,NA,NA
Keith Weed,1124927973210173440,2019-05-05T06:45:03Z,"@thebicu I stand corrected. Yes, Simon Clift @thebicu CMO Unilever also! Well done Jon, a CEO and 2 CMOs....so far..",FALSE,FALSE,908857939,NA
Keith Weed,1124927004854431744,2019-05-05T06:41:12Z,@profgalloway Just love this! I watched it and was amazed!!,FALSE,FALSE,9273802,NA
Keith Weed,1124269643621912576,2019-05-03T11:09:05Z,What a blast from the past! I would have loved to have seen Jon. Picking a future CEO and a CMO over 30 years ago is not a bad strike rate!//t.co/rqwxXrqZgn,TRUE,FALSE,NA,NA
Keith Weed,1123897069549305857,2019-05-02T10:28:37Z,@alinecsantos @Creativepool and very well-deserved!,FALSE,FALSE,41606386,NA
Keith Weed,1123688995890790400,2019-05-01T20:41:48Z,"Thanks Alan, I will miss you and Unilever too.. but will keep close! Love the photos. On the left a few weeks ago in Unilever's Training Centre in Singapore, on the right over 30 years ago in the Brecon Beacons, UK... seems like yesterday..//t.co/0sRfvvNFh4",TRUE,FALSE,NA,NA
Keith Weed,1123670555834626049,2019-05-01T19:28:31Z,Thank you Mark it has been great working with you and the WPP team over the years.//t.co/B3dZZ0qRTi,TRUE,FALSE,NA,NA
Keith Weed,1123482672913944576,2019-05-01T07:01:57Z,From soap boxes to packing up 35 years of life in boxes. Thanks @Unilever it's been a blast!//t.co/oHpX9xoRzM,FALSE,FALSE,NA,NA
Keith Weed,1123480935427653632,2019-05-01T06:55:02Z,Thanks @RahulWelde .Very much enjoyed working with you. And I love the personalised presents!! M&M's @mmschocolate with your face on are a fun gift!!! Thanks again..//t.co/i2DSpx7c1q,TRUE,FALSE,NA,NA
Keith Weed,1123171882918973441,2019-04-30T10:26:59Z,"Always encouraging to see #socialmedia platforms acting when consumers and #brands are being misled. We all have a responsibility to work together to promote transparency, or risk losing hard-earned trust.//t.co/2oABCjwQB8",FALSE,FALSE,NA,socialmedia
Keith Weed,1123171882918973441,2019-04-30T10:26:59Z,"Always encouraging to see #socialmedia platforms acting when consumers and #brands are being misled. We all have a responsibility to work together to promote transparency, or risk losing hard-earned trust.//t.co/2oABCjwQB8",FALSE,FALSE,NA,brands
Keith Weed,1122911892496879616,2019-04-29T17:13:52Z,@stedavies Great point!,FALSE,FALSE,622873,NA
Keith Weed,1122867799968370688,2019-04-29T14:18:40Z,"New car smell, in the pages of your newspaper: instantly recognisable, and a positive association for brand and product. Clever, innovative stuff from @LibertyMutual.//t.co/LXymG8n1Pk",FALSE,FALSE,NA,NA
Keith Weed,1122790369509478400,2019-04-29T09:10:59Z,"It'll sound like a broken record by now, but marketers need to be mobile-first or nothing. Quite the milestone announced last week. //t.co/Pv9J7qsSSp",FALSE,FALSE,NA,NA
Keith Weed,1121772762568241152,2019-04-26T13:47:22Z,Excellent lessons from some of the most inspiring innovators and entrepreneurs - taking brave ideas and turning them into boundary pushing solutions @TEDTalks//t.co/smTxtyBTB0,FALSE,FALSE,NA,NA
Keith Weed,1121398359707848704,2019-04-25T12:59:38Z,An end to tea-time tantrums? Creative and smart use of #gamification for @AldiUK following data showing UK children refuse to sit down at the dinner table. Gaming giving back from where it had taken #TeatimeTakedowns//t.co/SgHKpZLVIA,FALSE,FALSE,NA,gamification
