name,status_id,created_at,text,is_quote,is_retweet,reply_to_user_id,hashtags
Keith Weed,875388932992770052,2017-06-15T16:26:00Z,"zoubin ghahramani @Uber on #AI ""We are lucky primates our views of intelligence are very human centric. There are many types of intelligence//t.co/CxSe5s4Duu",FALSE,FALSE,NA,AI
Keith Weed,875381427008925701,2017-06-15T15:56:10Z,Excellent to spend some time with @biz stone co-founder of @Twitter and hearing about his recent return to this great company.//t.co/TrfmxKb8v0,FALSE,FALSE,NA,NA
Keith Weed,875366681715105793,2017-06-15T14:57:35Z,The need for transparency is more important to consumers than ever before.//t.co/NCWfUbkUmM,FALSE,FALSE,NA,NA
Keith Weed,875353550255263744,2017-06-15T14:05:24Z,Big companies need to 'Watch out for the murky middle' management says Jeffrey Rayport CEO @SAP. They hold back change & slow companies down//t.co/jM3tg09SNr,FALSE,FALSE,NA,NA
Keith Weed,875343413692039168,2017-06-15T13:25:07Z,HRH The Duke of Cambridge about to join the stage @Founders_Forum to talk on Tech for Good & addressing CyberBullying//t.co/Ye9y8amTEz,FALSE,FALSE,NA,NA
Keith Weed,875337266893393920,2017-06-15T13:00:42Z,Very proud!//t.co/RjEeybzUG3,TRUE,FALSE,NA,NA
Keith Weed,875268621446131712,2017-06-15T08:27:55Z,JanaEggers @NaraLogics compares impact of Artificial Light and the future impact of Artificial Intelligence in discussion with @bethcomstock//t.co/WrWPIkpbSq,FALSE,FALSE,NA,NA
Keith Weed,875263291702079488,2017-06-15T08:06:45Z,"Kicking it off: @brenthoberman @Founders_Forum talking through a very techy, Start up, VC line up. AI, AR, VR and many other acronyms..//t.co/ZydwIghVY8",FALSE,FALSE,NA,NA
Keith Weed,874955599582294016,2017-06-14T11:44:05Z,Opps ..I gave in again... this time with the Italian ice cream gelato brand GROM and a recent addition to @Unilever family...//t.co/kNXcQcWBsb,FALSE,FALSE,NA,NA
Keith Weed,874625929426993152,2017-06-13T13:54:05Z,I gave in.. these new @MagnumIceCream tubs with thick chocolate coating are incredible! What an #indulgence. You will not regret trying one!//t.co/EXB2RmcSuB,FALSE,FALSE,NA,indulgence
Keith Weed,874620949672452096,2017-06-13T13:34:18Z,A shared social experience can help brands connect better with consumers.//t.co/BRe8m670q0,FALSE,FALSE,NA,NA
Keith Weed,874525605211103233,2017-06-13T07:15:26Z,A marvellous #chocolate welcome @Unilever Weena Rotterdam courtesy of the new @MagnumIceCream tub. Is 9.00am too early for an ice cream???//t.co/ZtdC0uwmpz,FALSE,FALSE,NA,chocolate
Keith Weed,872853583968055296,2017-06-08T16:31:25Z,"Our next #CrowdForum is on the ""Value of Purpose"" July 10//t.co/2iBibOnEgD @keithweed @justinbasini @willgardnr @GreenSolitaire @DSM//t.co/4tUD5pE85q",FALSE,TRUE,NA,CrowdForum
Keith Weed,872163476365553669,2017-06-06T18:49:11Z,Edward Speed kicking of the Directors Forum Alumni evening @SpencerStuart @LordsTaverners #NED//t.co/uctOGMJCG9,FALSE,FALSE,NA,NED
Keith Weed,872137641516552193,2017-06-06T17:06:31Z,"To win online, you need to entertain your audience not advertise to them. //t.co/9iz6U6lEqL",FALSE,FALSE,NA,NA
Keith Weed,871735878598754309,2017-06-05T14:30:04Z,"The global food system is broken, but there are reasons to be hopeful. #WorldEnvironmentDay//t.co/ZGFgFZCM1u//t.co/SpeaxUwsxS",FALSE,TRUE,NA,WorldEnvironmentDay
Keith Weed,870684658379366402,2017-06-02T16:52:53Z,"It now falls on the rest of us to work together, harder than ever, to make #ParisAgreement a reality. #Unstoppable//t.co/KuHkuZ9VbX//t.co/BjGCwCsKks",FALSE,TRUE,NA,ParisAgreement
Keith Weed,870684658379366402,2017-06-02T16:52:53Z,"It now falls on the rest of us to work together, harder than ever, to make #ParisAgreement a reality. #Unstoppable//t.co/KuHkuZ9VbX//t.co/BjGCwCsKks",FALSE,TRUE,NA,Unstoppable
Keith Weed,870218766340194305,2017-06-01T10:01:36Z,"Do bots need to be an extension of customer service, not the replacement?//t.co/Qv9iT2IDpP",FALSE,FALSE,NA,NA
Keith Weed,869941916678447104,2017-05-31T15:41:30Z,Do you have a project that tackles a sustainability challenge? Enter our Young Entrepreneurs Awards://t.co/RQowkBadrg #biz4good//t.co/YhXw4qXadq,FALSE,FALSE,NA,biz4good
Keith Weed,868461922554974210,2017-05-27T13:40:32Z,The flights say please wait....we are! We are! WE ARE! Argh!!! @bbc @itvnews #Heathrow//t.co/76nuDs9emy,FALSE,FALSE,NA,Heathrow
Keith Weed,868420033403396097,2017-05-27T10:54:05Z,@brenthoberman @nokia Yes at gate A 18 waiting to go to Nice and hopefully Monaco! Though doesn't look hopeful. Where are you?,FALSE,FALSE,17238110,NA
Keith Weed,868419221520252928,2017-05-27T10:50:51Z,Argh! Heathrow airport. Still a mess! Computers still down. Further to @nokia phone.. now resorting to flipcharts!//t.co/Op5kgdYH0d,FALSE,FALSE,NA,NA
Keith Weed,868405792302657536,2017-05-27T09:57:29Z,Heathrow airport. Computers down. long queues Even phones not working! Reassured that a trusty @nokia is the solution//t.co/odNjdippZs,FALSE,FALSE,NA,NA
Keith Weed,867781391576072192,2017-05-25T16:36:21Z,Authentic engagement with brands plays a powerful role in effective campaigns.//t.co/qxzcTHo3Ji,FALSE,FALSE,NA,NA
Keith Weed,867382312362803201,2017-05-24T14:10:33Z,Consumers want brands with purpose. 9 of our Sustainable Living brands are in the @K_Worldpanel #MostChosenBrands//t.co/yRrSoEC4zE//t.co/FkbBAlWlLX,FALSE,FALSE,NA,MostChosenBrands
Keith Weed,867044808451346433,2017-05-23T15:49:25Z,This year @Cannes_Lions I'll be joined on stage by @lpolgreen of the @HuffPost. Vote to watch the seminar live at //t.co/NIco3k49LP//t.co/fgrQ5G8ef5,FALSE,FALSE,NA,NA
Keith Weed,865525740351004672,2017-05-19T11:13:11Z,Talking this morning @TheMarketingSoc to the next generation of marketing leaders - always such a pleasure; great questions today!//t.co/ldKZ0dpcvL,FALSE,FALSE,NA,NA
Keith Weed,865218692593979392,2017-05-18T14:53:05Z,This floating food garden in NYC has 200 vegetables you can eat for free//t.co/xZe9mzv0Xl,FALSE,TRUE,NA,NA
Keith Weed,865216847960055808,2017-05-18T14:45:46Z,We've achieved or are on track w/ 80% of our sustainability goals. Read how this is driving our growth//t.co/7ZhlCzhVES #sustliving//t.co/Ogr7GJgsmV,FALSE,FALSE,NA,sustliving
Keith Weed,865197376469946370,2017-05-18T13:28:23Z,Inside the IAB's drive to push criminals out of the programmatic supply chain//t.co/gP3siEtudZ//t.co/v5iKrN0ZW8,FALSE,TRUE,NA,NA
Keith Weed,865163611232186368,2017-05-18T11:14:13Z,We've achieved or are on track w/ 80% of our sustainability goals. Read how this is driving our growth//t.co/14IBtjXW3V #sustliving//t.co/EiMD0sH2d5,FALSE,TRUE,NA,NA
Keith Weed,865161444496728064,2017-05-18T11:05:36Z,Our Sustainable Living brands delivered 60% of our growth & are growing 50% faster than the rest of the business @keithweed #sustliving//t.co/WJ0npm93hs,FALSE,TRUE,NA,NA
Keith Weed,865145033070174209,2017-05-18T10:00:24Z,Talking this morning about the progress and learnings of our @Unilever Sustainable Living Plan so far - info at//t.co/RHrS12ooH0//t.co/yxuHRAxNOr,FALSE,FALSE,NA,NA
Keith Weed,865126957285072897,2017-05-18T08:48:34Z,The POWER of long term compounding growth. Building sustainable growth @Unilever has delivered from 1 in the 80's 68 vs 17 in the FTSE//t.co/GBawOmwIcS,FALSE,FALSE,NA,NA
Keith Weed,865124136347193344,2017-05-18T08:37:21Z,Kicking off @Unilever annual review of Unilever's Sustainable Living Plan @PaulPolman talks about delivering Value & Values. Both not either//t.co/JNblVtVdMB,FALSE,FALSE,NA,NA
Keith Weed,865100728913866752,2017-05-18T07:04:21Z,When your morning commute is a bit surprising! #multitasking//t.co/zktlWyQGgW,FALSE,FALSE,NA,multitasking
Keith Weed,864876804292718600,2017-05-17T16:14:33Z,"Does great advertising come from individual talent, or is it a team sport?//t.co/t36sji13l3 #AdviceForYoungCreatives//t.co/jmaF0swAI3",FALSE,TRUE,NA,AdviceForYoungCreatives
Keith Weed,864867898531172352,2017-05-17T15:39:10Z,"Small and medium-sized businesses: If you're not using Instagram, you're already behind//t.co/uOrPJbUTbK//t.co/uPghDwQnXR",FALSE,TRUE,NA,NA
Keith Weed,864828625278959616,2017-05-17T13:03:06Z,How WAH Nails is using VR to enhance the salon experience//t.co/uezPkHYXki//t.co/3ommKtJMPO,FALSE,TRUE,NA,NA
Keith Weed,864819630027788289,2017-05-17T12:27:22Z,Is this what our homes could look like in 2020?//t.co/Djmism97gO,FALSE,FALSE,NA,NA
Keith Weed,864568191850250241,2017-05-16T19:48:14Z,Great to see so many of our suppliers at our 5th Partner to Win Summit. Partnerships key to green innovation and long term growth @Unilever//t.co/RCXYx6BwMO,FALSE,TRUE,NA,NA
Keith Weed,864522104565370880,2017-05-16T16:45:06Z,Cost of #shipping is the most commonly cited reason that #digital shoppers abandon their carts://t.co/Y6AoxDRffj//t.co/H83CSRzCTO,FALSE,TRUE,NA,shipping
Keith Weed,864522104565370880,2017-05-16T16:45:06Z,Cost of #shipping is the most commonly cited reason that #digital shoppers abandon their carts://t.co/Y6AoxDRffj//t.co/H83CSRzCTO,FALSE,TRUE,NA,digital
Keith Weed,864520084622106625,2017-05-16T16:37:04Z,Snatch is using AR to demonstrate its different capabilities for brands.//t.co/hj12Gzb262,FALSE,FALSE,NA,NA
Keith Weed,864512943832039425,2017-05-16T16:08:42Z,Important lessons from creative people.//t.co/NMzkVZjNdV,FALSE,TRUE,NA,NA
Keith Weed,864500222059302913,2017-05-16T15:18:09Z,Could a one-star review really jeopardise your access to digital services?//t.co/xRvM7yUv4P,FALSE,FALSE,NA,NA
Keith Weed,863076105540030464,2017-05-12T16:59:13Z,Our new CreaSolv technology will help tackle the global issue of #plastic sachet #waste. @Independent #sustliving//t.co/NNX3vB81Dk,FALSE,TRUE,NA,plastic
Keith Weed,863076105540030464,2017-05-12T16:59:13Z,Our new CreaSolv technology will help tackle the global issue of #plastic sachet #waste. @Independent #sustliving//t.co/NNX3vB81Dk,FALSE,TRUE,NA,waste
Keith Weed,863076105540030464,2017-05-12T16:59:13Z,Our new CreaSolv technology will help tackle the global issue of #plastic sachet #waste. @Independent #sustliving//t.co/NNX3vB81Dk,FALSE,TRUE,NA,sustliving
Keith Weed,863049152900608005,2017-05-12T15:12:07Z,How brands can fly the flag for the LGBT community//t.co/RTFR5yLNZk//t.co/qfx8MBiGCc,FALSE,TRUE,NA,NA
Keith Weed,863023440953004034,2017-05-12T13:29:57Z,Brands have to change their tactics in this new age of consumption.//t.co/w35JIjcCs5,FALSE,FALSE,NA,NA
Keith Weed,862982583348604928,2017-05-12T10:47:35Z,Looking for international business opportunities?! The #UIIP could be the dream internship for you! Apply now://t.co/boVLpGbA9Q//t.co/NNvgahGHBn,FALSE,TRUE,NA,UIIP
Keith Weed,862975264334249984,2017-05-12T10:18:30Z,AR has the potential to reinvent our understanding of 3D experiences.//t.co/x4hcV19o6G,FALSE,FALSE,NA,NA
Keith Weed,862958594823778304,2017-05-12T09:12:16Z,"Oh monkey, you do make me chuckle. #jokes @PGtips//t.co/rAicILoyah",FALSE,FALSE,NA,jokes
Keith Weed,862623391270023170,2017-05-11T11:00:17Z,This smartwatch has been a long time coming//t.co/zxlUpyshrF,FALSE,TRUE,NA,NA
Keith Weed,862404482868674561,2017-05-10T20:30:26Z,"Super evening at @Unilever charity art auction, raising 20k+ for @Oxfam! supported by our brand @Surfy_UKI. Thanks to everyone who bid!//t.co/5RTmCzpIhC",FALSE,FALSE,NA,NA
Keith Weed,862264862365425664,2017-05-10T11:15:37Z,"Yes, we know influencer marketing is extremely effective, but here are the 6 Big benefits (by @2TALLINmania)//t.co/gREHIcfR0X #smm//t.co/6F2AOOsesy",FALSE,TRUE,NA,NA
Keith Weed,862256695283789824,2017-05-10T10:43:10Z,AR could bring the bespoke car to consumers sooner than expected.//t.co/pW5ippIrEx,FALSE,FALSE,NA,NA
Keith Weed,861968206096990208,2017-05-09T15:36:49Z,Will smartphone AR stunt virtual reality's growth?//t.co/nCpUK6zGhN,FALSE,TRUE,NA,NA
Keith Weed,861951663933992962,2017-05-09T14:31:05Z,"If every business is a software business, might AI be the next frontier? It's time to at least experiment.//t.co/0uHwTJ0awX",FALSE,TRUE,NA,NA
Keith Weed,861929199661178880,2017-05-09T13:01:49Z,Snapchat is going a 3D-step further to change the world around us.//t.co/6l0SrtJM2m,FALSE,FALSE,NA,NA
Keith Weed,861565125937029120,2017-05-08T12:55:07Z,Great initiative tracking progress on 17 #SDGs in 200 countries. Opps to drive growth in emerging markets//t.co/2fiblPI4Tq #SDGAtlas//t.co/zdq1UUQfiG,FALSE,TRUE,NA,SDGs
Keith Weed,860526283104628737,2017-05-05T16:07:08Z,Which brands are going to lead the way with AR?//t.co/HRiGDFjswn,FALSE,FALSE,NA,NA
Keith Weed,860522574559809536,2017-05-05T15:52:24Z,"The JV will create growth opportunities for Myanmar through R&D, manufacturing investment & market development//t.co/uy5ewHZ6tU",FALSE,TRUE,NA,NA
Keith Weed,860500113554386944,2017-05-05T14:23:09Z,Digital out of home: reinventing signs from billboards to jukeboxes -- DigitalNext by @rubiconproject//t.co/RPZVFDppg1//t.co/6MOY567L15,FALSE,TRUE,NA,NA
Keith Weed,860449960952823809,2017-05-05T11:03:51Z,One of my favourite books is now on the shelves at @WHSmith! A really rewarding read.//t.co/eoDVECigno,TRUE,FALSE,NA,NA
Keith Weed,860164048989691905,2017-05-04T16:07:45Z,Insightful #longread on how brands are competing against distraction.//t.co/pjwd6ytN75,FALSE,FALSE,NA,longread
Keith Weed,860123654214037505,2017-05-04T13:27:14Z,How to build relationships (and trust) with your customers through video @hopehorner//t.co/SCfzydUV13,FALSE,TRUE,NA,NA
Keith Weed,860116050029015040,2017-05-04T12:57:01Z,#Mobile is now the go-to' destination for most video viewers://t.co/6wwOBnWlUN//t.co/OE2ThpQNyk,FALSE,TRUE,NA,Mobile
Keith Weed,860100340238225410,2017-05-04T11:54:35Z,We need less talk and more action to increase viewability.//t.co/fcfObm8yv7,FALSE,FALSE,NA,NA
Keith Weed,859752721565536258,2017-05-03T12:53:16Z,... @voicesofyouth//t.co/TzaqFRr7i6,FALSE,TRUE,NA,NA
Keith Weed,859722910633689088,2017-05-03T10:54:49Z,Could influencers be a key part of your next campaign?//t.co/ShOGGLNYgW via @BrilliantNoise,FALSE,TRUE,NA,NA
Keith Weed,859722755515834368,2017-05-03T10:54:12Z,Here's how AR can bridge the online/offline gap for beauty brands.//t.co/ZYCrEUv7Y6,FALSE,FALSE,NA,NA
Keith Weed,859695888851243008,2017-05-03T09:07:26Z,Consumers know what lazy marketing looks like: brands have to do better.//t.co/ZNgshoFsW0,FALSE,FALSE,NA,NA
Keith Weed,859563584204021760,2017-05-03T00:21:43Z,Surely this is the quote of the day... thanks @Instacart for this @MuhammadAli #inspiration//t.co/euzBkiWFF4,FALSE,FALSE,NA,inspiration
Keith Weed,859558548308709381,2017-05-03T00:01:42Z,Thanks David Yeom @HOLLAR for an exciting introduction to Hollar. Too much fun...when are you coming to the UK?//t.co/06oRz58Rlx,FALSE,FALSE,NA,NA
Keith Weed,859400732482691072,2017-05-02T13:34:36Z,The new escapism: Why brands must be bolder in entertaining consumers//t.co/peQXqFDWSE//t.co/YuWNOGwegx,FALSE,TRUE,NA,NA
Keith Weed,859399647969804288,2017-05-02T13:30:17Z,Mobile accounted for 99% of new online ad money entering the UK market last year //t.co/GzVXnzXVOB//t.co/CcBBmDx3Yt,FALSE,TRUE,NA,NA
Keith Weed,859218980841680897,2017-05-02T01:32:23Z,Learning about the social impact of the digital revolution @brucedaisley @RonanHarris @elizabethfagan @Nigelvaz @amandamack6 @bitc #RBWeek//t.co/6161TSMUft,FALSE,FALSE,NA,RBWeek
Keith Weed,857913663411322880,2017-04-28T11:05:31Z,.@bitc day on inclusive digital. #RBWeek #DigitalRB @elizabethfagan @brucedaisley @RonanHarris @DecodedCo @Nigelvaz//t.co/RBpbUKY4bv,FALSE,FALSE,NA,RBWeek
Keith Weed,857913663411322880,2017-04-28T11:05:31Z,.@bitc day on inclusive digital. #RBWeek #DigitalRB @elizabethfagan @brucedaisley @RonanHarris @DecodedCo @Nigelvaz//t.co/RBpbUKY4bv,FALSE,FALSE,NA,DigitalRB
Keith Weed,857873455307526144,2017-04-28T08:25:44Z,"Halving carbon emissions by 2040 possible, but only if governments, business and investors act now. #BetterEnergy //t.co/zvRoxd3iIb",FALSE,TRUE,NA,BetterEnergy
Keith Weed,857857835128033281,2017-04-28T07:23:40Z,Leading @bitc visit today asking what are business priorities for an inclusive digital revolution #RBWeek #DigitalRB//t.co/b9uOs113sX,FALSE,FALSE,NA,RBWeek
Keith Weed,857857835128033281,2017-04-28T07:23:40Z,Leading @bitc visit today asking what are business priorities for an inclusive digital revolution #RBWeek #DigitalRB//t.co/b9uOs113sX,FALSE,FALSE,NA,DigitalRB
Keith Weed,857621668142960640,2017-04-27T15:45:14Z,Digital drives record UK adspend in 2016//t.co/3shufSaCMw//t.co/8t9Cajfpq2,FALSE,TRUE,NA,NA
Keith Weed,857255502102835200,2017-04-26T15:30:13Z,Make a deliberate effort to change these norms. #HeForShe//t.co/67rvRxKANF,FALSE,TRUE,NA,HeForShe
Keith Weed,857229820324978689,2017-04-26T13:48:10Z,How your brand can retain its character in a robotic world.//t.co/jjuwNiiRYL,FALSE,FALSE,NA,NA
Keith Weed,857224710656065536,2017-04-26T13:27:52Z,"@natalienoeller hi Natalie, I don't but if you contact she can help you out. Regards Keith",FALSE,FALSE,19535599,NA
Keith Weed,857211221292060672,2017-04-26T12:34:16Z,Thanks for having me #Mumstock17! Pleasure to speak about how marketing to mums has evolved in @Unilever brands over the years.//t.co/vT4v9GPyhf,FALSE,FALSE,NA,Mumstock17
Keith Weed,857188242030034944,2017-04-26T11:02:57Z,"Great to catch Carolyn McCall @easyJet CEO on stage at #Mumstock17 before I head on myself,talking about the evolution of marketing to mums//t.co/viQwj15F9K",FALSE,FALSE,NA,Mumstock17
Keith Weed,857139447489605632,2017-04-26T07:49:03Z,"Like all technology, AI will take on the biases of its creators. Why we need more women in the AI revolution://t.co/fOYNWs3HOL//t.co/U2X91Z0XFn",FALSE,TRUE,NA,NA
Keith Weed,856493034766290946,2017-04-24T13:00:27Z,How marketeers can become truly innovative.//t.co/cR80iDFcod,FALSE,FALSE,NA,NA
Keith Weed,856492813151817728,2017-04-24T12:59:34Z,A call for employers: 'Flexibility is the definition of being a parent. Catch up!'//t.co/iti5iVhvvR #mumstock17,FALSE,FALSE,NA,mumstock17
Keith Weed,855452896493793281,2017-04-21T16:07:18Z,A huge congratulations to @AmandaSourry on making @AdAge's Women to Watch Europe 2017!//t.co/NyQfyseOXP,FALSE,FALSE,NA,NA
Keith Weed,855364213371490304,2017-04-21T10:14:55Z,.@bhorowitz shares the four ways to change company culture.//t.co/6xKIznM5Nz,FALSE,FALSE,NA,NA
Keith Weed,855348590369275904,2017-04-21T09:12:50Z,UK adults will spend almost 1 hour a day watching digital videos this year according to eMarketer//t.co/elRqstIRLK//t.co/XNVU7s8iTl,FALSE,TRUE,NA,NA
Keith Weed,855338291750514689,2017-04-21T08:31:54Z,An unapologetic approach to make the pay rise conversation less awkward for women.//t.co/RSteM01E7I,FALSE,FALSE,NA,NA
Keith Weed,855092116078440448,2017-04-20T16:13:41Z,77% of marketers believe consistency across social channels has a significant impact on higher conversions.//t.co/rUJS7ZOrT2,FALSE,FALSE,NA,NA
Keith Weed,854703823809654784,2017-04-19T14:30:45Z,What if brands lacked creative bravery?//t.co/Ae5ZDeeLy4,FALSE,FALSE,NA,NA
Keith Weed,854695510279684097,2017-04-19T13:57:43Z,More than half of the value of the #GlobalGoals business opportunities are in developing countries.//t.co/h0M8NS972L #betterbiz//t.co/2twlFd31wz,FALSE,TRUE,NA,GlobalGoals
Keith Weed,854684129719459841,2017-04-19T13:12:30Z,Lynx shifts focus to multi-dimensional modern men//t.co/MPg1zpoyEx by @Be__On//t.co/wui5GjxRTN,FALSE,TRUE,NA,NA
Keith Weed,854683869102190592,2017-04-19T13:11:28Z,45% of consumers expect AI will have a positive societal impact.//t.co/tiC6pwS0ag,FALSE,FALSE,NA,NA
Keith Weed,854662038781558784,2017-04-19T11:44:43Z,A smart take on how AI gives us an entirely new kind of vision - letting us understand and imagine far more//t.co/JtoF0MXrOz,FALSE,TRUE,NA,NA
Keith Weed,854657400279896065,2017-04-19T11:26:17Z,Brilliant project shedding light on diversity and gender equality in advertising.//t.co/F4zqrEVnIY,FALSE,FALSE,NA,NA
Keith Weed,854337446670209024,2017-04-18T14:14:54Z,Why committing to LGBT equality and embracing a diverse workplace is so good for brands://t.co/pfX66y9rU4//t.co/9wKzXfY5wp,FALSE,TRUE,NA,NA
Keith Weed,854303033961979905,2017-04-18T11:58:10Z,Brands Have Learned the Value of Purpose. Now They Must Actually Become Purpose-Led//t.co/69v838zlzV//t.co/PgWIfulENn,FALSE,TRUE,NA,NA
Keith Weed,854296928095481856,2017-04-18T11:33:54Z,"By 2025 100% of our plastic packaging will be #reusable, #recyclable or #compostable #circulareconomy #SDG12//t.co/pqAau4EMNw//t.co/ZS40oLOTzo",FALSE,TRUE,NA,reusable
Keith Weed,854296928095481856,2017-04-18T11:33:54Z,"By 2025 100% of our plastic packaging will be #reusable, #recyclable or #compostable #circulareconomy #SDG12//t.co/pqAau4EMNw//t.co/ZS40oLOTzo",FALSE,TRUE,NA,recyclable
Keith Weed,854296928095481856,2017-04-18T11:33:54Z,"By 2025 100% of our plastic packaging will be #reusable, #recyclable or #compostable #circulareconomy #SDG12//t.co/pqAau4EMNw//t.co/ZS40oLOTzo",FALSE,TRUE,NA,compostable
Keith Weed,854296928095481856,2017-04-18T11:33:54Z,"By 2025 100% of our plastic packaging will be #reusable, #recyclable or #compostable #circulareconomy #SDG12//t.co/pqAau4EMNw//t.co/ZS40oLOTzo",FALSE,TRUE,NA,circulareconomy
Keith Weed,854296928095481856,2017-04-18T11:33:54Z,"By 2025 100% of our plastic packaging will be #reusable, #recyclable or #compostable #circulareconomy #SDG12//t.co/pqAau4EMNw//t.co/ZS40oLOTzo",FALSE,TRUE,NA,SDG12
Keith Weed,854293691174969344,2017-04-18T11:21:02Z,There have been calls for chatbots to be more human and now that's exactly what they are. Say hello to Nadia.//t.co/oO5nYRwk9L,FALSE,FALSE,NA,NA
Keith Weed,852629381101047809,2017-04-13T21:07:40Z,"'To me, it's about living life. Whatever we can do to help people be at their best more of the time, we should.' @keithweed #mentalhealth",FALSE,TRUE,NA,NA
Keith Weed,852104547422154752,2017-04-12T10:22:10Z,Consumers love to text. Chatbots are tapping into that behaviour.//t.co/wFo2VsFW0O,FALSE,FALSE,NA,NA
Keith Weed,852089919682097153,2017-04-12T09:24:02Z,"Technology's there to make humans better. If you don't engage, you're playing with your future @IBM Stefan Hirsch.//t.co/fTLxtK2IWk",FALSE,FALSE,NA,NA
Keith Weed,852065877872783361,2017-04-12T07:48:30Z,Mission 2020 is aiming to put emissions on a downward path over the next three years.//t.co/vbp5k9uXYu #2020DontBeLate,FALSE,FALSE,NA,2020DontBeLate
Keith Weed,852064781620178944,2017-04-12T07:44:09Z,Long read: Is digital an effective mass market medium?//t.co/vSXw0vCXcS//t.co/eX6ZecR48t,FALSE,TRUE,NA,NA
Keith Weed,852064671880359936,2017-04-12T07:43:43Z,Twitter is expanding its video measurement partnerships to help marketers gauge ad performance://t.co/b5kyw62ytg//t.co/4SDTuxf19Y,FALSE,TRUE,NA,NA
Keith Weed,851703754042769408,2017-04-11T07:49:33Z,Thanks @VaselineUK @VaselineBrand ....love the tin!//t.co/1M7pptNeri,FALSE,FALSE,NA,NA
Keith Weed,851703425515520001,2017-04-11T07:48:15Z,Love this! Love my 'Keith' tin.... @VaselineBrand @VaselineUK #personalisation//t.co/pnDyXVqen8,TRUE,FALSE,NA,personalisation
Keith Weed,851396453205495813,2017-04-10T11:28:27Z,.@TinaBrownLM on the future of feminism//t.co/DIuGRld5bD//t.co/lv2XeumwcG,FALSE,TRUE,NA,NA
Keith Weed,851391303728410625,2017-04-10T11:07:59Z,"According to 86% of millennials, brands should use chatbots to promote deals, products, and services.//t.co/JUjLGpxIOe",FALSE,FALSE,NA,NA
Keith Weed,851078349975953411,2017-04-09T14:24:25Z,"Hot & sunny Milan with some amazing #easter #eggs to be seen, admired ...and in a few days eaten! Cova montenapoleone & Pasticceria Marcheri//t.co/tPghUliGN5",FALSE,FALSE,NA,easter
Keith Weed,851078349975953411,2017-04-09T14:24:25Z,"Hot & sunny Milan with some amazing #easter #eggs to be seen, admired ...and in a few days eaten! Cova montenapoleone & Pasticceria Marcheri//t.co/tPghUliGN5",FALSE,FALSE,NA,eggs
Keith Weed,850377866705547264,2017-04-07T16:00:57Z,Doing business well to get development right will be a mark of future business success - Amy Jadesimi of @ladol_freezone #OECDgfd//t.co/lOnVxupvj8,FALSE,TRUE,NA,NA
Keith Weed,850371773505953792,2017-04-07T15:36:44Z,It often takes only one bad experience to turn off consumers from using a #travel brand://t.co/yn84n2oSMV//t.co/853CcjYCmg,FALSE,TRUE,NA,travel
Keith Weed,850354494449864709,2017-04-07T14:28:04Z,Flexible working for women at the same pay rate as men could boost the economy by 23.7bn.//t.co/TdoO6cVVty,FALSE,FALSE,NA,NA
Keith Weed,850340733273899010,2017-04-07T13:33:24Z,Find out about @Knorr's initiative to provide flavourful and nutritious meals to those in need://t.co/jpB7xycsIe//t.co/oO7tHky4vk,FALSE,TRUE,NA,NA
Keith Weed,850340234688692224,2017-04-07T13:31:25Z,It's the beginning of the end for coal according to @CANEurope. We're heading towards a cleaner climate.//t.co/P4mogLY52s,FALSE,FALSE,NA,NA
Keith Weed,850313344917676032,2017-04-07T11:44:34Z,$1 invested in nutrition gives $14 return strong investment for food companies.Consumers increasingly demanding it too. @IFPRI//t.co/E8VgZ8SS0i,FALSE,TRUE,NA,NA
Keith Weed,850305252872122368,2017-04-07T11:12:24Z,54% of gay and bisexual men said they might have come out sooner if they'd seen LGBT+ advertising while growing up.//t.co/DT6ZPFqv0X,FALSE,FALSE,NA,NA
Keith Weed,849665727971962880,2017-04-05T16:51:10Z,Airbnb expands 'belong' positioning with campaign to support marriage equality in Australia//t.co/6k8THTGRLg//t.co/xh2zqAlSmN,FALSE,TRUE,NA,NA
Keith Weed,849665515987628032,2017-04-05T16:50:19Z,If we do not tackle this issue we simply cannot guarantee a safe future for our children.//t.co/15T1nWzQpO,FALSE,FALSE,NA,NA
Keith Weed,849649014974939137,2017-04-05T15:44:45Z,".@nhhill: It is critical for advertisers to get out and speak to consumers, data alone isn't enough.//t.co/iBdts9FMpj",FALSE,FALSE,NA,NA
Keith Weed,849629279424061442,2017-04-05T14:26:20Z,Mistrust and competition: The psychology of inequality//t.co/jpUqlOjtuS//t.co/qOGhOh7tii,FALSE,TRUE,NA,NA
Keith Weed,849617525625192452,2017-04-05T13:39:37Z,Understanding the consumer's emotional state is a vital part of the consumer journey.//t.co/Hw2CFzp2Lk,FALSE,FALSE,NA,NA
