name,status_id,created_at,text,is_quote,is_retweet,reply_to_user_id,hashtags
Lynne Doughtie,1177192590778798081,2019-09-26T12:05:59Z,Today we are proud to join with @TheCAQ to share why we are #AuditorProud. Here's some advice for auditors who are beginning their careers in the profession. #KPMGProud//t.co/kAs16MhpaB,FALSE,FALSE,NA,AuditorProud
Lynne Doughtie,1177192590778798081,2019-09-26T12:05:59Z,Today we are proud to join with @TheCAQ to share why we are #AuditorProud. Here's some advice for auditors who are beginning their careers in the profession. #KPMGProud//t.co/kAs16MhpaB,FALSE,FALSE,NA,KPMGProud
Lynne Doughtie,1176257486397091841,2019-09-23T22:10:13Z,@ConcordiaSummit Thank you for the honor! I was humbled to receive it and share your commitment to creating positive social and economic change.,FALSE,FALSE,329888286,NA
Lynne Doughtie,1170739437698985985,2019-09-08T16:43:27Z,"At KPMG, we're passionate about giving back to the communities where we live and work. Our focus on lifelong learning supports literacy, the first critical step for children to thrive and confidently lead us into the future. #LiteracyDay #KFFL//t.co/6Wp2TpPK9Z",TRUE,FALSE,NA,LiteracyDay
Lynne Doughtie,1170739437698985985,2019-09-08T16:43:27Z,"At KPMG, we're passionate about giving back to the communities where we live and work. Our focus on lifelong learning supports literacy, the first critical step for children to thrive and confidently lead us into the future. #LiteracyDay #KFFL//t.co/6Wp2TpPK9Z",TRUE,FALSE,NA,KFFL
Lynne Doughtie,1168167095655391233,2019-09-01T14:21:53Z,Thinking of all those in Midland and Odessa and everyone impacted by yesterday's terrible events.,FALSE,FALSE,NA,NA
Lynne Doughtie,1163559733464141824,2019-08-19T21:13:53Z,Check out our latest video series #FactorFiction which aims to dispel misconceptions about #digitaltransformation and other related topics like #AI and #blockchain. Stay tuned for more episodes coming soon!//t.co/ywkf1ZIgaN,TRUE,FALSE,NA,FactorFiction
Lynne Doughtie,1163559733464141824,2019-08-19T21:13:53Z,Check out our latest video series #FactorFiction which aims to dispel misconceptions about #digitaltransformation and other related topics like #AI and #blockchain. Stay tuned for more episodes coming soon!//t.co/ywkf1ZIgaN,TRUE,FALSE,NA,digitaltransformation
Lynne Doughtie,1163559733464141824,2019-08-19T21:13:53Z,Check out our latest video series #FactorFiction which aims to dispel misconceptions about #digitaltransformation and other related topics like #AI and #blockchain. Stay tuned for more episodes coming soon!//t.co/ywkf1ZIgaN,TRUE,FALSE,NA,AI
Lynne Doughtie,1163559733464141824,2019-08-19T21:13:53Z,Check out our latest video series #FactorFiction which aims to dispel misconceptions about #digitaltransformation and other related topics like #AI and #blockchain. Stay tuned for more episodes coming soon!//t.co/ywkf1ZIgaN,TRUE,FALSE,NA,blockchain
Lynne Doughtie,1163464654951260160,2019-08-19T14:56:04Z,"I'm proud to join 181 CEOs who signed @BizRoundtable's new Statement on the Purpose of a Corporation. @KPMG_US is committed to ensuring the work we do continues to benefit all stakeholders clients, communities, employees, suppliers, and others.//t.co/BRRFE5M8BS",TRUE,FALSE,NA,NA
Lynne Doughtie,1161762053142523905,2019-08-14T22:10:32Z,Congratulations @MavMcNealy! You continue to make a positive impact on and off the golf course. We look forward to watching you on the PGA Tour! #TeamKPMG//t.co/ksHowJIIm8,TRUE,FALSE,NA,TeamKPMG
Lynne Doughtie,1161375663997280256,2019-08-13T20:35:10Z,Always a fun time with the @NAFCareerAcads #FutureReady Lab interns when they visit our NYC office. These future leaders are making an impact today and developing the skills they'll need for tomorrow.//t.co/llIB1mlWj8,FALSE,FALSE,NA,FutureReady
Lynne Doughtie,1160968168598380545,2019-08-12T17:35:55Z,Fostering the next generation of leaders is critical to KPMG's culture and future. Many thanks to all of the @KPMG_US interns & professionals who helped us earn a spot on the @wayup Top 100 #Internship Programs list again this year!//t.co/pkYEAKJWeM,TRUE,FALSE,NA,Internship
Lynne Doughtie,1159570745313374209,2019-08-08T21:03:04Z,"Our culture of lifelong learning, #innovation, and ongoing professional development is brought to life at KPMG Lakehouse. Here's a first look at our new facility in Lake Nona, Florida, which will open in January.//t.co/jrADtNlr9Z",FALSE,FALSE,NA,innovation
Lynne Doughtie,1158020867160498178,2019-08-04T14:24:24Z,"Sadly, more tragic news this weekend. Thinking of the victims and families impacted by the Dayton shooting.",FALSE,FALSE,NA,NA
Lynne Doughtie,1157811119874072578,2019-08-04T00:30:56Z,My thoughts are with all of those affected by the senseless shooting in El Paso.,FALSE,FALSE,NA,NA
Lynne Doughtie,1154414268550459392,2019-07-25T15:33:04Z,Many thanks to our current and former interns for helping KPMG make a difference for our clients and communities! Happy #NationalInternDay!//t.co/Blmk0azNwV,FALSE,FALSE,NA,NationalInternDay
Lynne Doughtie,1154128295463665666,2019-07-24T20:36:42Z,One of the things that makes me most proud of KPMG is our collective commitment to our communities. Take a look at our latest #Citizenship Report to see how my colleagues across the country are making a difference.//t.co/5AiBA0dYMz #CitizenshipInAction,FALSE,FALSE,NA,Citizenship
Lynne Doughtie,1154128295463665666,2019-07-24T20:36:42Z,One of the things that makes me most proud of KPMG is our collective commitment to our communities. Take a look at our latest #Citizenship Report to see how my colleagues across the country are making a difference.//t.co/5AiBA0dYMz #CitizenshipInAction,FALSE,FALSE,NA,CitizenshipInAction
Lynne Doughtie,1153731555577217026,2019-07-23T18:20:12Z,"As they confront an array of risks that threaten the growth of their companies, U.S. CEOs are actively engaged in efforts to make their organizations more resilient. Read how in my latest #NewsandPerspectives piece://t.co/0g6TTLrKxd. #CEOoutlook//t.co/FaDmZJSXwT",FALSE,FALSE,NA,NewsandPerspectives
Lynne Doughtie,1153731555577217026,2019-07-23T18:20:12Z,"As they confront an array of risks that threaten the growth of their companies, U.S. CEOs are actively engaged in efforts to make their organizations more resilient. Read how in my latest #NewsandPerspectives piece://t.co/0g6TTLrKxd. #CEOoutlook//t.co/FaDmZJSXwT",FALSE,FALSE,NA,CEOoutlook
Lynne Doughtie,1142948660369645570,2019-06-24T00:12:50Z,"Wire-to-wire! Congratulations to our 2019 @KPMGWomensPGA Champion, @hannahgreengolf ! You #InspireGreatness @LPGA @PGA//t.co/poioM4rn1y",FALSE,FALSE,NA,InspireGreatness
Lynne Doughtie,1141805421126139912,2019-06-20T20:30:00Z,What an honor to present @MiaHamm with the 2019 #InspireGreatness Award at the @KPMGInspire Women's Leadership Summit! Mia is a role model who opened new opportunities for women in soccer and continues to inspire on and off the field.//t.co/oVWBn8NnJP,FALSE,FALSE,NA,InspireGreatness
Lynne Doughtie,1135944412788383745,2019-06-04T16:20:27Z,U.S. CEOs are very confident about economic growth prospects over the next three years and focused on making their organizations more resilient in the face of various risks. Take a look at what's top-of-mind for them in the latest KPMG #CEOoutlook://t.co/rbf0AMCPRg.//t.co/Wl3Oapfhm6,FALSE,FALSE,NA,CEOoutlook
Lynne Doughtie,1134796188287426560,2019-06-01T12:17:49Z,My heart is with those who lost loved ones in the senseless Virginia Beach shooting.,FALSE,FALSE,NA,NA
Lynne Doughtie,1134119102900002817,2019-05-30T15:27:19Z,"So proud of @KPMG_US Audit Partner Dana Foote, who has come a long way since her initial MS diagnosis and is now an @mssociety board member and co-founder of a KPMG employee resource group that supports employees with special needs!//t.co/q6QBPf8gwz. #WorldMSDay//t.co/z7eJwWhR82",FALSE,FALSE,NA,WorldMSDay
Lynne Doughtie,1126966308225073152,2019-05-10T21:44:40Z,We kicked off the @KPMGWomensPGA with media day! @PhilMickelson and @Stacy_Lewis showcased their skills to pay homage to some of the @Twins greats. We are ready for @Hazeltine in June! #TeamKPMG//t.co/E542OlGMaB,FALSE,TRUE,NA,NA
Lynne Doughtie,1126121482495627265,2019-05-08T13:47:38Z,"At KPMG, our #inclusive culture is an intrinsic and vital part of who we are. Proud to see our organization recognized in the top 10 on @DiversityInc Top Companies for #Diversity list. #DITop50//t.co/XmUrzUb2y9",FALSE,FALSE,NA,inclusive
Lynne Doughtie,1126121482495627265,2019-05-08T13:47:38Z,"At KPMG, our #inclusive culture is an intrinsic and vital part of who we are. Proud to see our organization recognized in the top 10 on @DiversityInc Top Companies for #Diversity list. #DITop50//t.co/XmUrzUb2y9",FALSE,FALSE,NA,Diversity
Lynne Doughtie,1126121482495627265,2019-05-08T13:47:38Z,"At KPMG, our #inclusive culture is an intrinsic and vital part of who we are. Proud to see our organization recognized in the top 10 on @DiversityInc Top Companies for #Diversity list. #DITop50//t.co/XmUrzUb2y9",FALSE,FALSE,NA,DITop50
Lynne Doughtie,1125498871545831429,2019-05-06T20:33:36Z,"Had an amazing time on stage with @suzywhaley, @bowman_roberta, @PhilMickelson and @Stacy_Lewis announcing the details of the 2019 @KPMGWomensPGA and the @KPMGInspire Women's Leadership Summit! #InspireGreatness//t.co/1uQIHrmqHp",FALSE,FALSE,NA,InspireGreatness
Lynne Doughtie,1125486597036761088,2019-05-06T19:44:49Z,"We're thrilled to once again have a roster of powerful individuals join this year's @KPMGInspire Women's Leadership Summit to help us advance, develop, and empower #womenleaders! #InspireGreatness//t.co/iVYSQ4gTkm",FALSE,FALSE,NA,womenleaders
Lynne Doughtie,1125486597036761088,2019-05-06T19:44:49Z,"We're thrilled to once again have a roster of powerful individuals join this year's @KPMGInspire Women's Leadership Summit to help us advance, develop, and empower #womenleaders! #InspireGreatness//t.co/iVYSQ4gTkm",FALSE,FALSE,NA,InspireGreatness
Lynne Doughtie,1122531934725443585,2019-04-28T16:04:03Z,"Saddened by another senseless act of violence and hate. Thinking of all those from Congregation Chabad in Poway. We must come together and ensure that everyone, everywhere can worship in peace.",FALSE,FALSE,NA,NA
Lynne Doughtie,1120382526571282434,2019-04-22T17:43:04Z,"So proud that together with @GRID, KPMG volunteers are helping install solar panels across the U.S. producing 2.2 megawatts of green energy. All of our volunteers and the work that they do better our communities and planet. #EarthDay//t.co/kssjA0RKrU",FALSE,FALSE,NA,EarthDay
Lynne Doughtie,1116326476859760640,2019-04-11T13:05:47Z,"Really excited about the opening of our newest #KPMGIgnition Center this one in Chicago! Like our other Ignition Centers, this will be a place where we can spark #innovation, unlock value, and turn disruption into opportunity for our clients. More here://t.co/bAbhX4xnCj.//t.co/3aTvF4q4nF",FALSE,FALSE,NA,KPMGIgnition
Lynne Doughtie,1116326476859760640,2019-04-11T13:05:47Z,"Really excited about the opening of our newest #KPMGIgnition Center this one in Chicago! Like our other Ignition Centers, this will be a place where we can spark #innovation, unlock value, and turn disruption into opportunity for our clients. More here://t.co/bAbhX4xnCj.//t.co/3aTvF4q4nF",FALSE,FALSE,NA,innovation
Lynne Doughtie,1114165863773548549,2019-04-05T14:00:16Z,Great speaking with @VTPamplin alumni and students last night alongside Tracy Castle-Newman and Omar Asali about the future of the Financial Services industry. Thank you @Sumichrast for moderating the engaging discussion. Go Hokies!,FALSE,FALSE,NA,NA
Lynne Doughtie,1110891999027232768,2019-03-27T13:11:06Z,"Thrilled to introduce #KPMGLakehouse - a place for our people to continuously learn and grow, reinforce our strong #culture and heritage, and enhance our ability to deliver innovative, high-quality services to our clients. Learn more://t.co/pKlzpZfTuY//t.co/1MfA14Owh9",FALSE,FALSE,NA,KPMGLakehouse
Lynne Doughtie,1110891999027232768,2019-03-27T13:11:06Z,"Thrilled to introduce #KPMGLakehouse - a place for our people to continuously learn and grow, reinforce our strong #culture and heritage, and enhance our ability to deliver innovative, high-quality services to our clients. Learn more://t.co/pKlzpZfTuY//t.co/1MfA14Owh9",FALSE,FALSE,NA,culture
Lynne Doughtie,1108477788577808385,2019-03-20T21:17:53Z,"As we celebrate #WomensHistoryMonth we honor women who came before us, blazing trails that made it easier for us to follow in their footsteps. Read about two women who paved the way for me and others in the accounting profession://t.co/rE7StrwknN. #Inclusion #Diversity//t.co/AzwpLeWFeJ",FALSE,FALSE,NA,WomensHistoryMonth
Lynne Doughtie,1108477788577808385,2019-03-20T21:17:53Z,"As we celebrate #WomensHistoryMonth we honor women who came before us, blazing trails that made it easier for us to follow in their footsteps. Read about two women who paved the way for me and others in the accounting profession://t.co/rE7StrwknN. #Inclusion #Diversity//t.co/AzwpLeWFeJ",FALSE,FALSE,NA,Inclusion
Lynne Doughtie,1108477788577808385,2019-03-20T21:17:53Z,"As we celebrate #WomensHistoryMonth we honor women who came before us, blazing trails that made it easier for us to follow in their footsteps. Read about two women who paved the way for me and others in the accounting profession://t.co/rE7StrwknN. #Inclusion #Diversity//t.co/AzwpLeWFeJ",FALSE,FALSE,NA,Diversity
Lynne Doughtie,1104026611907813377,2019-03-08T14:30:30Z,As I reflect upon the theme of this year's #IWD2019 I think about lessons learned from my career and how important it is to continue to inspire confidence in the next generation of female leaders. #FutureIsInclusive://t.co/z4b6qA5P6y. #BalanceForBetter//t.co/0kNP2luWTT,FALSE,FALSE,NA,IWD2019
Lynne Doughtie,1104026611907813377,2019-03-08T14:30:30Z,As I reflect upon the theme of this year's #IWD2019 I think about lessons learned from my career and how important it is to continue to inspire confidence in the next generation of female leaders. #FutureIsInclusive://t.co/z4b6qA5P6y. #BalanceForBetter//t.co/0kNP2luWTT,FALSE,FALSE,NA,FutureIsInclusive
Lynne Doughtie,1104026611907813377,2019-03-08T14:30:30Z,As I reflect upon the theme of this year's #IWD2019 I think about lessons learned from my career and how important it is to continue to inspire confidence in the next generation of female leaders. #FutureIsInclusive://t.co/z4b6qA5P6y. #BalanceForBetter//t.co/0kNP2luWTT,FALSE,FALSE,NA,BalanceForBetter
Lynne Doughtie,1104000645911232519,2019-03-08T12:47:19Z,Words are powerful. Addressing unconscious gender bias makes organizations truly inclusive. Visit//t.co/nw5jDq97oS for tools to #BiasCorrect the workplace and make your own photo. #IWD19 #FutureIsInclusive//t.co/ih7FkuvKJQ,FALSE,FALSE,NA,BiasCorrect
Lynne Doughtie,1104000645911232519,2019-03-08T12:47:19Z,Words are powerful. Addressing unconscious gender bias makes organizations truly inclusive. Visit//t.co/nw5jDq97oS for tools to #BiasCorrect the workplace and make your own photo. #IWD19 #FutureIsInclusive//t.co/ih7FkuvKJQ,FALSE,FALSE,NA,IWD19
Lynne Doughtie,1104000645911232519,2019-03-08T12:47:19Z,Words are powerful. Addressing unconscious gender bias makes organizations truly inclusive. Visit//t.co/nw5jDq97oS for tools to #BiasCorrect the workplace and make your own photo. #IWD19 #FutureIsInclusive//t.co/ih7FkuvKJQ,FALSE,FALSE,NA,FutureIsInclusive
Lynne Doughtie,1103737975714840577,2019-03-07T19:23:34Z,Let's continue to take bold steps to advance #inclusion and #diversity! Our organizations and society will be better for it.//t.co/z4b6qA5P6y. #FutureIsInclusive #IWD2019 #BalanceForBetter//t.co/3RcG8BNFwQ,FALSE,FALSE,NA,inclusion
Lynne Doughtie,1103737975714840577,2019-03-07T19:23:34Z,Let's continue to take bold steps to advance #inclusion and #diversity! Our organizations and society will be better for it.//t.co/z4b6qA5P6y. #FutureIsInclusive #IWD2019 #BalanceForBetter//t.co/3RcG8BNFwQ,FALSE,FALSE,NA,diversity
Lynne Doughtie,1103737975714840577,2019-03-07T19:23:34Z,Let's continue to take bold steps to advance #inclusion and #diversity! Our organizations and society will be better for it.//t.co/z4b6qA5P6y. #FutureIsInclusive #IWD2019 #BalanceForBetter//t.co/3RcG8BNFwQ,FALSE,FALSE,NA,FutureIsInclusive
Lynne Doughtie,1103737975714840577,2019-03-07T19:23:34Z,Let's continue to take bold steps to advance #inclusion and #diversity! Our organizations and society will be better for it.//t.co/z4b6qA5P6y. #FutureIsInclusive #IWD2019 #BalanceForBetter//t.co/3RcG8BNFwQ,FALSE,FALSE,NA,IWD2019
Lynne Doughtie,1103737975714840577,2019-03-07T19:23:34Z,Let's continue to take bold steps to advance #inclusion and #diversity! Our organizations and society will be better for it.//t.co/z4b6qA5P6y. #FutureIsInclusive #IWD2019 #BalanceForBetter//t.co/3RcG8BNFwQ,FALSE,FALSE,NA,BalanceForBetter
Lynne Doughtie,1103004041993441281,2019-03-05T18:47:11Z,Proud that @KPMG_US has for the ninth consecutive year been recognized by @_NAFE_ as one of the Top Companies for Executive Women! Read more about KPMG's efforts to advance women in the workplace://t.co/lsIEbxGDoj. #NAFETop #Inclusion #Diversity//t.co/bvwxAkrx5g,FALSE,FALSE,NA,NAFETop
Lynne Doughtie,1103004041993441281,2019-03-05T18:47:11Z,Proud that @KPMG_US has for the ninth consecutive year been recognized by @_NAFE_ as one of the Top Companies for Executive Women! Read more about KPMG's efforts to advance women in the workplace://t.co/lsIEbxGDoj. #NAFETop #Inclusion #Diversity//t.co/bvwxAkrx5g,FALSE,FALSE,NA,Inclusion
Lynne Doughtie,1103004041993441281,2019-03-05T18:47:11Z,Proud that @KPMG_US has for the ninth consecutive year been recognized by @_NAFE_ as one of the Top Companies for Executive Women! Read more about KPMG's efforts to advance women in the workplace://t.co/lsIEbxGDoj. #NAFETop #Inclusion #Diversity//t.co/bvwxAkrx5g,FALSE,FALSE,NA,Diversity
Lynne Doughtie,1101128943774646273,2019-02-28T14:36:12Z,Enjoyed speaking with @bethkowitt at the @GPTW_US #GPTW4ALL Summit about the importance of building a culture of innovation!//t.co/dw539OXKGn,FALSE,FALSE,NA,GPTW4ALL
Lynne Doughtie,1100078545471225857,2019-02-25T17:02:18Z,Truly inspired by this story of a @KPMG_US professional who turned a personal tragedy into a passion to make a #TangibleDifference and give back through @American_Heart. #HeartMonth//t.co/viYYsQHOAo,FALSE,FALSE,NA,TangibleDifference
Lynne Doughtie,1100078545471225857,2019-02-25T17:02:18Z,Truly inspired by this story of a @KPMG_US professional who turned a personal tragedy into a passion to make a #TangibleDifference and give back through @American_Heart. #HeartMonth//t.co/viYYsQHOAo,FALSE,FALSE,NA,HeartMonth
Lynne Doughtie,1098697958688731136,2019-02-21T21:36:20Z,"Looking forward to our discussion around building a culture of innovation at next week's @GPTW_US #GPTW4ALL Summit, @bethkowitt!//t.co/zXVw9xZrpE",TRUE,FALSE,NA,GPTW4ALL
Lynne Doughtie,1096033682006200320,2019-02-14T13:09:27Z,"Excited that @KPMG_US was again named to the @FortuneMagazine @GPTW_US #100BestCos list! We are proud to have built an environment that not only places a high importance on integrity and professionalism, but is a great place to work and build a career.//t.co/4nZx4OaS2z",FALSE,FALSE,NA,100BestCos
Lynne Doughtie,1095016834758332417,2019-02-11T17:48:52Z,Congratulations @PhilMickelson on another exciting championship win at Pebble Beach!//t.co/gLTHc022kt,TRUE,FALSE,NA,NA
Lynne Doughtie,1093890423175737345,2019-02-08T15:12:55Z,You are right @MMeyershipp. Knowledge does create understanding. Thank you for this valuable perspective on #BlackHistoryMonth! //t.co/csNMprSyUi.,FALSE,FALSE,NA,BlackHistoryMonth
Lynne Doughtie,1093564924985528320,2019-02-07T17:39:30Z,"In honor of #BlackHistoryMonth, as we reflect on a legacy of significant accomplishments and contributions to society, let us also continue to focus on building a diverse and inclusive culture and future, and strive to make every day a #DayOfUnderstanding. #diversity #inclusion",FALSE,FALSE,NA,BlackHistoryMonth
Lynne Doughtie,1093564924985528320,2019-02-07T17:39:30Z,"In honor of #BlackHistoryMonth, as we reflect on a legacy of significant accomplishments and contributions to society, let us also continue to focus on building a diverse and inclusive culture and future, and strive to make every day a #DayOfUnderstanding. #diversity #inclusion",FALSE,FALSE,NA,DayOfUnderstanding
Lynne Doughtie,1093564924985528320,2019-02-07T17:39:30Z,"In honor of #BlackHistoryMonth, as we reflect on a legacy of significant accomplishments and contributions to society, let us also continue to focus on building a diverse and inclusive culture and future, and strive to make every day a #DayOfUnderstanding. #diversity #inclusion",FALSE,FALSE,NA,diversity
Lynne Doughtie,1093564924985528320,2019-02-07T17:39:30Z,"In honor of #BlackHistoryMonth, as we reflect on a legacy of significant accomplishments and contributions to society, let us also continue to focus on building a diverse and inclusive culture and future, and strive to make every day a #DayOfUnderstanding. #diversity #inclusion",FALSE,FALSE,NA,inclusion
Lynne Doughtie,1092901853845745665,2019-02-05T21:44:41Z,Take a look at the latest installment of #FutureReady which explores how KPMG helps clients navigate change and transform into digital-era leaders. Read more here://t.co/l37mibpTYV.//t.co/09KKyaiNuT,FALSE,FALSE,NA,FutureReady
Lynne Doughtie,1091071627775877120,2019-01-31T20:32:01Z,"Having the right mentors and sponsors is key to professional development. I've had several throughout my career, and each has helped me shape and navigate my path forward. #ThankYourMentor//t.co/lz12s4AlMU",FALSE,FALSE,NA,ThankYourMentor
Lynne Doughtie,1088692911141732352,2019-01-25T06:59:51Z,"As we look at the #futureofwork, we need to find the sweet spot where #digital labor and top talent are integrated in a way that improves the bottom line while providing opportunities for people to grow, be more productive and satisfied. #AI #EmergingTech #WEF19 #WEFLIVE",FALSE,FALSE,NA,futureofwork
Lynne Doughtie,1088692911141732352,2019-01-25T06:59:51Z,"As we look at the #futureofwork, we need to find the sweet spot where #digital labor and top talent are integrated in a way that improves the bottom line while providing opportunities for people to grow, be more productive and satisfied. #AI #EmergingTech #WEF19 #WEFLIVE",FALSE,FALSE,NA,digital
Lynne Doughtie,1088692911141732352,2019-01-25T06:59:51Z,"As we look at the #futureofwork, we need to find the sweet spot where #digital labor and top talent are integrated in a way that improves the bottom line while providing opportunities for people to grow, be more productive and satisfied. #AI #EmergingTech #WEF19 #WEFLIVE",FALSE,FALSE,NA,AI
Lynne Doughtie,1088692911141732352,2019-01-25T06:59:51Z,"As we look at the #futureofwork, we need to find the sweet spot where #digital labor and top talent are integrated in a way that improves the bottom line while providing opportunities for people to grow, be more productive and satisfied. #AI #EmergingTech #WEF19 #WEFLIVE",FALSE,FALSE,NA,EmergingTech
Lynne Doughtie,1088692911141732352,2019-01-25T06:59:51Z,"As we look at the #futureofwork, we need to find the sweet spot where #digital labor and top talent are integrated in a way that improves the bottom line while providing opportunities for people to grow, be more productive and satisfied. #AI #EmergingTech #WEF19 #WEFLIVE",FALSE,FALSE,NA,WEF19
Lynne Doughtie,1088692911141732352,2019-01-25T06:59:51Z,"As we look at the #futureofwork, we need to find the sweet spot where #digital labor and top talent are integrated in a way that improves the bottom line while providing opportunities for people to grow, be more productive and satisfied. #AI #EmergingTech #WEF19 #WEFLIVE",FALSE,FALSE,NA,WEFLIVE
Lynne Doughtie,1088480987791745026,2019-01-24T16:57:45Z,My advice for women in Davos and everywhere: You belong. Your point of view is important. Share what you know. Be a sponge and learn for your personal growth and the benefit of your organization. #WEF19 #WEFLIVE #Inclusion #Diversity,FALSE,FALSE,NA,WEF19
Lynne Doughtie,1088480987791745026,2019-01-24T16:57:45Z,My advice for women in Davos and everywhere: You belong. Your point of view is important. Share what you know. Be a sponge and learn for your personal growth and the benefit of your organization. #WEF19 #WEFLIVE #Inclusion #Diversity,FALSE,FALSE,NA,WEFLIVE
Lynne Doughtie,1088480987791745026,2019-01-24T16:57:45Z,My advice for women in Davos and everywhere: You belong. Your point of view is important. Share what you know. Be a sponge and learn for your personal growth and the benefit of your organization. #WEF19 #WEFLIVE #Inclusion #Diversity,FALSE,FALSE,NA,Inclusion
Lynne Doughtie,1088480987791745026,2019-01-24T16:57:45Z,My advice for women in Davos and everywhere: You belong. Your point of view is important. Share what you know. Be a sponge and learn for your personal growth and the benefit of your organization. #WEF19 #WEFLIVE #Inclusion #Diversity,FALSE,FALSE,NA,Diversity
Lynne Doughtie,1088136132444020736,2019-01-23T18:07:25Z,@BofA_News #BofAOkay,FALSE,FALSE,207507805,BofAOkay
Lynne Doughtie,1088035331981692928,2019-01-23T11:26:52Z,We can't underestimate the importance of organizational cultures as we integrate #digital and human labor. #WEF19 #WEFLIVE,FALSE,FALSE,NA,digital
Lynne Doughtie,1088035331981692928,2019-01-23T11:26:52Z,We can't underestimate the importance of organizational cultures as we integrate #digital and human labor. #WEF19 #WEFLIVE,FALSE,FALSE,NA,WEF19
Lynne Doughtie,1088035331981692928,2019-01-23T11:26:52Z,We can't underestimate the importance of organizational cultures as we integrate #digital and human labor. #WEF19 #WEFLIVE,FALSE,FALSE,NA,WEFLIVE
