name,status_id,created_at,text,is_quote,is_retweet,reply_to_user_id,hashtags
Omar Ishrak,493875299285991424,2014-07-28T21:47:01Z,"Significant milestone, will expand access to #pacemakers in #China, likely largest medtech market one day.//t.co/ZFtagUNA7H",FALSE,FALSE,NA,China
Omar Ishrak,493852505454178305,2014-07-28T20:16:27Z,Thanks for recognition. Our field teams love the apps & iPad is certainly essential business tool for me.//t.co/MLUaNRCJ6Q,FALSE,FALSE,NA,NA
Omar Ishrak,493804261722296320,2014-07-28T17:04:45Z,Exciting news; our mkt development expertise will accelerate adoption & enable us to fulfill #Mission to more people//t.co/tGbnSos4H2,FALSE,FALSE,NA,Mission
Omar Ishrak,491654525380734976,2014-07-22T18:42:28Z,@sstorck Thanks for your note. Please reach out to our Patient Services team directly 1-800-551-5544 so they can help answer your question.,FALSE,FALSE,20605276,NA
Omar Ishrak,488348393622626305,2014-07-13T15:45:04Z,With daughter Zuleika after an early morning run! (Supermoon in the sky)//t.co/e5A96B9uLd,FALSE,FALSE,NA,NA
Omar Ishrak,485491552127815681,2014-07-05T18:33:00Z,Important steps towards #value based healthcare. Medtronic working on bundled payment programs with partners.//t.co/9W4Pqptj1P,FALSE,FALSE,NA,value
Omar Ishrak,485482353272176640,2014-07-05T17:56:27Z,"Another article explaining why sugar & carbohydrates should be avoided, not fat!//t.co/ZAVgxUWTup",FALSE,FALSE,NA,NA
Omar Ishrak,485244676501700608,2014-07-05T02:12:00Z,Hope everyone is enjoying July 4th & doing something special with families & friends.,FALSE,FALSE,NA,NA
Omar Ishrak,482539100265000960,2014-06-27T15:01:01Z,Proud of #Bakken Invitation program honoring Earl's legacy. What will you do with your extra life?//t.co/QS5laSII8v,FALSE,FALSE,NA,Bakken
Omar Ishrak,481860629561487360,2014-06-25T18:05:01Z,Congratulations to Neil Fraser on being appointed to the Canadian Advisory Panel on Healthcare #Innovation//t.co/2VYgYrtoxz,FALSE,FALSE,NA,Innovation
Omar Ishrak,481806531546345472,2014-06-25T14:30:03Z,"Corventis patch was initially launched in India, our first example of reverse #innovation//t.co/q83ubwsnHD)",FALSE,FALSE,NA,innovation
Omar Ishrak,481786387688329216,2014-06-25T13:10:00Z,"Excited about Corventis: together with Reveal LINQ & CardioCom, expands offerings across care #continuum",FALSE,FALSE,NA,continuum
Omar Ishrak,478508790967721985,2014-06-16T12:06:00Z,"@Bill_George Thanks for the words, Bill... we continue to build on our Mission.",FALSE,FALSE,62522718,NA
Omar Ishrak,478357040952512512,2014-06-16T02:03:00Z,"Impressed by the Covidien team, the company they've built & product pipeline they've developed - Important info @//t.co/XPVuAPd6nM",FALSE,FALSE,NA,NA
Omar Ishrak,478338670836326401,2014-06-16T00:50:00Z,$MDT commits to $10 billion in add'l US technology investments over 10 years//t.co/dZuFu20MCs; Important info @//t.co/XPVuAPd6nM,FALSE,FALSE,NA,NA
Omar Ishrak,478335261752193024,2014-06-16T00:36:28Z,"Merging world-class h/c companies under MDT #Mission: alleviate pain, restore health & extend life - Important info @//t.co/XPVuAPd6nM",FALSE,FALSE,NA,Mission
Omar Ishrak,477835362728165376,2014-06-14T15:30:02Z,"MDT & @Sanofi alliance - therapy alone not enough; using technology to provide feedback, make therapy easier & help people cope w/ diabetes",FALSE,FALSE,NA,NA
Omar Ishrak,477820259593121792,2014-06-14T14:30:02Z,Exciting alliance: MDT & @Sanofi working to 1) realize shared vision 2) improve clinical #outcomes for people w/ diabetes 3) addressing cost,FALSE,FALSE,NA,outcomes
Omar Ishrak,477533375616786432,2014-06-13T19:30:03Z,Our core strategies are consistent with our #Mission; need to find a way to ensure access to our therapies,FALSE,FALSE,NA,Mission
Omar Ishrak,477521925548568576,2014-06-13T18:44:33Z,"Reinforced at global #employee Town Hall: our strategies, econ value, globalization & new therapies, are focused on meeting univ h/c needs",FALSE,FALSE,NA,employee
Omar Ishrak,477474477182173186,2014-06-13T15:36:01Z,"Exciting progress w/ Shruti; 27,400 patients screened, 875 received some treatment & #access to specialist, & 129 surgeries performed.",FALSE,FALSE,NA,access
Omar Ishrak,477233006763966464,2014-06-12T23:36:30Z,Excited about expanding to Bangladesh w/ Shruti hearing prog for #underserved; J Paul MDT w/ Dr Sultan Grameen Health//t.co/5j2Cowi9XK,FALSE,FALSE,NA,underserved
Omar Ishrak,476016076070076416,2014-06-09T15:00:51Z,MDT team highlighted potential through strategic partnerships & progress building an integrated health solutions business #MDTInvestorConf,FALSE,FALSE,NA,MDTInvestorConf
Omar Ishrak,475979324848623616,2014-06-09T12:34:48Z,Highlighted progress against long-term strategies at #MDTInvestorConf last week; excited about opps to create long-term value in healthcare,FALSE,FALSE,NA,MDTInvestorConf
Omar Ishrak,475976779237453825,2014-06-09T12:24:42Z,"RT @Medtronic $MDT addressing univ h/c needs w/ new ther, expand access in emerg mkts, & solutions for hospital efficiency #MDTInvestorConf",FALSE,FALSE,NA,MDTInvestorConf
Omar Ishrak,475974252945211392,2014-06-09T12:14:39Z,"RT @Medtronic $MDT uniquely positioned to execute, lead & grow creating long-term value in h/c and for shareholders #MDTInvestorConf",FALSE,FALSE,NA,MDTInvestorConf
Omar Ishrak,475275135902310400,2014-06-07T13:56:37Z,Enjoyed visit to @NYSEEuronext for the closing bell on Thursday//t.co/Hwb6DAmkzh,FALSE,FALSE,NA,NA
Omar Ishrak,475273618210189312,2014-06-07T13:50:35Z,#RING! @Medtronic closes the markets for investor day & #health://t.co/0GM12afoPy @MedtronicCEO//t.co/0BMkmC3XTw,FALSE,TRUE,NA,RING
Omar Ishrak,475273618210189312,2014-06-07T13:50:35Z,#RING! @Medtronic closes the markets for investor day & #health://t.co/0GM12afoPy @MedtronicCEO//t.co/0BMkmC3XTw,FALSE,TRUE,NA,health
Omar Ishrak,473858366486609920,2014-06-03T16:06:53Z,"Pleased to have two new leaders at our meeting last wk Hooman Hakami, leading our Diabetes Group & Brad Lerman, our new General Counsel",FALSE,FALSE,NA,NA
Omar Ishrak,473827677204660225,2014-06-03T14:04:56Z,"Thanks to #leadership team for sharing successes; highlighted opps in therapy innovation, global access, delivering & articulating #value",FALSE,FALSE,NA,leadership
Omar Ishrak,473827677204660225,2014-06-03T14:04:56Z,"Thanks to #leadership team for sharing successes; highlighted opps in therapy innovation, global access, delivering & articulating #value",FALSE,FALSE,NA,value
Omar Ishrak,473802474554687488,2014-06-03T12:24:47Z,Enjoyed #leadership team meetings last week; challenged the team to seize opportunities in front of us.,FALSE,FALSE,NA,leadership
Omar Ishrak,473685779332345856,2014-06-03T04:41:05Z,"Tonight, the Global Officers Meeting volunteer event kicks off #Project6 @Medtronic's global month of #volunteering//t.co/mxIFIWUO0X",FALSE,TRUE,NA,Project6
Omar Ishrak,473685779332345856,2014-06-03T04:41:05Z,"Tonight, the Global Officers Meeting volunteer event kicks off #Project6 @Medtronic's global month of #volunteering//t.co/mxIFIWUO0X",FALSE,TRUE,NA,volunteering
Omar Ishrak,469509387850371072,2014-05-22T16:05:35Z,@EJSMD Thanks for your outreach; the team will be following up with you directly.,FALSE,FALSE,285622842,NA
Omar Ishrak,469160944976035843,2014-05-21T17:01:00Z,Leveraging services & solutions to drive successful transformation in response to changes in h/c payment & delivery systems #MDTEarnings,FALSE,FALSE,NA,MDTEarnings
Omar Ishrak,469122256191651840,2014-05-21T14:27:16Z,Progress in building future growth platform in new therapies; significant clinical data; economic value is becoming tangible #MDTEarnings,FALSE,FALSE,NA,MDTEarnings
Omar Ishrak,468877578183655424,2014-05-20T22:15:00Z,Thank you to MDT employees around the world; I appreciate your efforts & commitments that contributed to our FY14 #MDTEarnings,FALSE,FALSE,NA,MDTEarnings
Omar Ishrak,468873812990492672,2014-05-20T22:00:02Z,Pleased to move past uncertainty w/ Edwards settlement; excited about therapy & ability to focus on making it available to patients,FALSE,FALSE,NA,NA
Omar Ishrak,468861478679097346,2014-05-20T21:11:02Z,Our FY14 results represent another year of delivering consistent results; made solid progress in a number of areas #MDTEarnings,FALSE,FALSE,NA,MDTEarnings
Omar Ishrak,467667101420113920,2014-05-17T14:05:00Z,Interesting article. I have to admit that my wife Helen has been saying this for years!//t.co/yN0S6CYJLj,FALSE,FALSE,NA,NA
Omar Ishrak,467297164474204164,2014-05-16T13:35:00Z,Medtronic is committed to participating in & leading the shift to #value-based healthcare//t.co/WN2gy1qFP3 #FTUSHC,FALSE,FALSE,NA,value
Omar Ishrak,467297164474204164,2014-05-16T13:35:00Z,Medtronic is committed to participating in & leading the shift to #value-based healthcare//t.co/WN2gy1qFP3 #FTUSHC,FALSE,FALSE,NA,FTUSHC
Omar Ishrak,467280553541369858,2014-05-16T12:29:00Z,"Enjoyed my conversation w/ @andrew_ward1 focused on challenges, opportunities & importance of partnerships in h/c #FTUSHC.",FALSE,FALSE,NA,FTUSHC
Omar Ishrak,465884355207110656,2014-05-12T16:01:00Z,Congrats to 5 outstanding Medtronic #employees recognized with our internal Momentum Award for their community volunteer service globally.,FALSE,FALSE,NA,employees
Omar Ishrak,465837546103382016,2014-05-12T12:55:00Z,Proud of our company's commitment to #diversity; thanks @DiversityInc for recognition//t.co/6PzetLJiUp #DITop50,FALSE,FALSE,NA,diversity
Omar Ishrak,465837546103382016,2014-05-12T12:55:00Z,Proud of our company's commitment to #diversity; thanks @DiversityInc for recognition//t.co/6PzetLJiUp #DITop50,FALSE,FALSE,NA,DITop50
Omar Ishrak,462002526335008768,2014-05-01T22:56:00Z,@KatyParrish Thanks for your note. Our @mdtneurosurgery team can help; you can find contact info on//t.co/VRkvxUQDj5,FALSE,FALSE,15474529,NA
Omar Ishrak,459716443643600896,2014-04-25T15:31:55Z,Congratulations @Bill_George on your well-deserved recognition. We are grateful for your inspired leadership at Medtronic. #BillGeorgeTFI,FALSE,FALSE,NA,BillGeorgeTFI
Omar Ishrak,459312802411585536,2014-04-24T12:48:00Z,Sad to hear of the passing of Reuters reporter @DLSherman. I enjoyed talking w/ her when she covered our industry. May she rest in peace.,FALSE,FALSE,NA,NA
Omar Ishrak,451022385270243329,2014-04-01T15:44:50Z,With the #Diabetes team in Washington DC last week. Enjoyed interaction with team & customers.//t.co/e0jqOKh8TV,FALSE,FALSE,NA,Diabetes
Omar Ishrak,450706788405768192,2014-03-31T18:50:46Z,RDN results disappointing but thanks to team for executing a rigorous clinical trial; remain committed to renal denervation therapy. #ACC14,FALSE,FALSE,NA,ACC14
Omar Ishrak,450699743036190722,2014-03-31T18:22:46Z,Congratulations to the Corevalve team; historic weekend for TAVI therapy. #ACC14,FALSE,FALSE,NA,ACC14
Omar Ishrak,450692192534028288,2014-03-31T17:52:46Z,Attended #ACC14 opening session this weekend; Great to see RDN & Corevalve as the late breaking presentations.,FALSE,FALSE,NA,ACC14
Omar Ishrak,450654580280688640,2014-03-31T15:23:19Z,@redheadedoner Our team is happy to help; contact or see labeling for more info://t.co/lqZbPpsEof,FALSE,FALSE,24473917,NA
Omar Ishrak,450653809023680513,2014-03-31T15:20:15Z,@DrOliverSegal Excited to see the tremendous interest in LINQ; thanks for sharing your experience! @MDT_Cardiac,FALSE,FALSE,2343528798,NA
Omar Ishrak,449188459119640576,2014-03-27T14:17:28Z,"@aparmarbb Thanks for the comments, enjoyed reading about different twitter styles.",FALSE,FALSE,15678891,NA
Omar Ishrak,448528994754129920,2014-03-25T18:37:00Z,@Sebelius suggested using Innovation Center to test and quickly scale new #value-based models. We will follow up together with partners.,FALSE,FALSE,1023020557,value
Omar Ishrak,448516663324205057,2014-03-25T17:48:00Z,Pleasure to meet HHS Secretary Kathleen @Sebelius at Business Roundtable. Encouraged about commitment to #valuebased healthcare.,FALSE,FALSE,NA,valuebased
Omar Ishrak,448504216068562944,2014-03-25T16:58:32Z,"@KlaasvdTempel Honor to host Ambassador Bekink-Artwork on wall from Maastricht Univ, our Hosp Solutions partners.",FALSE,FALSE,1150604779,NA
Omar Ishrak,446737421859033088,2014-03-20T19:57:56Z,Great example of frugal #innovation addressing a pressing healthcare need in emerging markets//t.co/NqrNgHUShw,FALSE,TRUE,NA,innovation
Omar Ishrak,446717201635368961,2014-03-20T18:37:35Z,Great hearing experiences from our current #GIF skilled service efforts in Ghana//t.co/9N9TlN1tFz,FALSE,FALSE,NA,GIF
Omar Ishrak,446678050605109249,2014-03-20T16:02:00Z,@restaurantmktg I spoke to the team and our Neuromodulation Patient Services is reaching out to you today to address your questions.,FALSE,FALSE,18610580,NA
Omar Ishrak,446657042942803968,2014-03-20T14:38:32Z,Proud of the work of our employees in our Global Innovation Fellows #GIF skilled service program//t.co/Jsnvc9tKpe,FALSE,FALSE,NA,GIF
Omar Ishrak,441592790687170561,2014-03-06T15:15:00Z,"Mission of Health City Cayman: to provide access to high quality, affordable care to all; Medtronic hopes to partner in the journey #travel",FALSE,FALSE,NA,travel
Omar Ishrak,441585244668706816,2014-03-06T14:45:01Z,"Pleasure to attend Health City opening in Cayman Islands last week; unique #hospital modeled on NH Hospitals, India, led by Dr. Devi Shetty",FALSE,FALSE,NA,hospital
Omar Ishrak,440841595257356288,2014-03-04T13:30:01Z,Congrats to Victor Dzau on his appointment to President of the IOM; we have appreciated his valued contributions as a member of our Board.,FALSE,FALSE,NA,NA
Omar Ishrak,440636602025775104,2014-03-03T23:55:27Z,Welcome to Twitter @GeoffMartha Looking forward to your thoughts on #GlobalHealth,FALSE,FALSE,NA,GlobalHealth
Omar Ishrak,440515947900960768,2014-03-03T15:56:01Z,Pleased to announce today our first formal collaboration w/ Aetna focusing on clinical & economic outcomes in type 2 diabetes @mtbert,FALSE,FALSE,NA,NA
Omar Ishrak,440493798653976576,2014-03-03T14:28:00Z,"Congrats to our team on global launch of our new miniaturized insertable cardiac monitoring system, Reveal #LINQ",FALSE,FALSE,NA,LINQ
Omar Ishrak,440146384197808128,2014-03-02T15:27:30Z,"Congratulations to Becky Bergman, she will be missed at Medtronic; we wish her the very best in her new role -//t.co/HquEIGsTM3",FALSE,FALSE,NA,NA
Omar Ishrak,435912864650764288,2014-02-18T23:05:00Z,Globalization & econ value strategies built upon leadership in core therapies unlocks medtech potential to serve more patients #MDTEarnings,FALSE,FALSE,NA,MDTEarnings
Omar Ishrak,435904065063903232,2014-02-18T22:30:02Z,Excited about strong product launch cadence fueled by therapy innovation strategy; represents our core strength #MDTEarnings,FALSE,FALSE,NA,MDTEarnings
Omar Ishrak,435892732129984512,2014-02-18T21:45:00Z,Emerging markets now represent 13% of total company sales (vs. 9% in FY11); remain confident in our outlook for these markets #MDTEarnings,FALSE,FALSE,NA,MDTEarnings
Omar Ishrak,435883421970485248,2014-02-18T21:08:00Z,"Strat priorities (therapy innovation, globalization, econ value) increase our competitive adv & offer solutions to h/c systems #MDTEarnings",FALSE,FALSE,NA,MDTEarnings
Omar Ishrak,435571872865193984,2014-02-18T00:30:01Z,Gained valuable insights from Dan Mendelson (Avalere Health) & Mark Miller (MedPAC). Discussed transition to value based h/c system in US.,FALSE,FALSE,NA,NA
Omar Ishrak,435556958054395904,2014-02-17T23:30:45Z,Hosted Medtronic Board of Directors mtg in DC. Thanks to Senators Wyden & Burr for sharing their views. Both support value based healthcare.,FALSE,FALSE,NA,NA
Omar Ishrak,431205102930911232,2014-02-05T23:18:02Z,"Visited team in Dubai last week, new site for our regional operations. Excited about future for MEA team. #travel//t.co/Bl070sWGIF",FALSE,FALSE,NA,travel
Omar Ishrak,431197292490932224,2014-02-05T22:47:00Z,@SeufertNancy I am sorry for your experience. Someone from our diabetes team will be reaching out to you.,FALSE,FALSE,16005313,NA
Omar Ishrak,430709855658442752,2014-02-04T14:30:06Z,Honored to participate in 2014 Premier Healthcare governance meeting; excited about focus on value-based healthcare//t.co/icBQBIgOCE,FALSE,FALSE,NA,NA
Omar Ishrak,430483344644915200,2014-02-03T23:30:02Z,Best wishes to all for the Chinese (lunar) New Year.,FALSE,FALSE,NA,NA
Omar Ishrak,430396516311007232,2014-02-03T17:45:00Z,"Pleasure to co-lead #WEF14 discussion ""Health Systems Leapfrogging in Emerging Economies"" w/ Sania Nishtar, Heartfile//t.co/guu3Ccjrhx",FALSE,FALSE,NA,WEF14
Omar Ishrak,430362550728138753,2014-02-03T15:30:02Z,"Enjoyed global health sessions at Davos; impressed w/ progress IPIHD has made, under Victor Dzau's leadership -//t.co/rXqyCXRPch",FALSE,FALSE,NA,NA
Omar Ishrak,430333600710819840,2014-02-03T13:35:00Z,@OvickAlam Feel privileged and humbled to be on this list. Thanks for the recognition.,FALSE,FALSE,73423924,NA
Omar Ishrak,430205870392500224,2014-02-03T05:07:27Z,"Embracing the Minneapolis winter... with Zuleika, my daughter on the ice.//t.co/uZEjfGhstA",FALSE,FALSE,NA,NA
Omar Ishrak,428392519958003712,2014-01-29T05:01:50Z,@todavidmyers Thanks for your feedback; the team is working on our hold times. I heard our team reached out to help...,FALSE,FALSE,2315965249,NA
Omar Ishrak,426039761493827584,2014-01-22T17:12:49Z,"@TheoBovens Enjoyed the visit, looking forward to a great partnership with Maastricht University Hospital.",FALSE,FALSE,33236134,NA
Omar Ishrak,425302199812780032,2014-01-20T16:22:00Z,"Worth reading: mgmt of patients at home increasingly important; partnerships btw providers, payers & medtech needed//t.co/iN4BJ1302M",FALSE,FALSE,NA,NA
Omar Ishrak,424298837990449152,2014-01-17T21:55:00Z,Congrats to the CoreValve team on receiving FDA approval; represents a significant advance for patients.,FALSE,FALSE,NA,NA
Omar Ishrak,422890921282506752,2014-01-14T00:40:27Z,Move to value-based healthcare is critical for medtech industry to grow & foster innovation #JPM14,FALSE,FALSE,NA,JPM14
Omar Ishrak,422887842420121600,2014-01-14T00:28:13Z,"Globalization opportunity includes traditional market creation, as well as major partnerships w/ government and providers #JPM14",FALSE,FALSE,NA,JPM14
Omar Ishrak,422884717726564352,2014-01-14T00:15:48Z,"Focused on transforming our strategic initiatives into 3 growth vectors: new therapies, globalization & value-based healthcare #JPM14",FALSE,FALSE,NA,JPM14
Omar Ishrak,422879869098532864,2014-01-13T23:56:32Z,Enjoyed presenting @JPMorgan Healthcare conference today; excited about MDT's future growth opportunities #JPM14,FALSE,FALSE,NA,JPM14
Omar Ishrak,421689075926851584,2014-01-10T17:04:44Z,"As we celebrate Earl's birthday today, the Bakken Invitation Honorees are a great reminder of his inspiring legacy.//t.co/gGmgw2JIfe",FALSE,FALSE,NA,NA
Omar Ishrak,421656288939216896,2014-01-10T14:54:27Z,Wishing Earl Bakken a happy birthday! We honor your legacy every day as we work to fulfill the MDT #Mission for patients around the world.,FALSE,FALSE,NA,Mission
Omar Ishrak,421038618711695363,2014-01-08T22:00:03Z,TYRX... valuable addition to our portfolio of solutions delivering clinical & economic #value.,FALSE,FALSE,NA,value
Omar Ishrak,421031305368076288,2014-01-08T21:31:00Z,Excited about TYRX... infection prevention reduces cost & improves quality of care.,FALSE,FALSE,NA,NA
Omar Ishrak,418094215495966720,2013-12-31T19:00:03Z,"Wishing employees, colleagues & friends around the world: peace & happiness to you & your families in 2014!",FALSE,FALSE,NA,NA
Omar Ishrak,418045136183259136,2013-12-31T15:45:02Z,Delivered continued innovation from Medtronic in 2013 w/ new tech & business models in geographies. Excited about 2014!,FALSE,FALSE,NA,NA
Omar Ishrak,418037590982664192,2013-12-31T15:15:03Z,My passion continues for extending our Mission to underserved populations; looking forward to our progress in 2014.,FALSE,FALSE,NA,NA
Omar Ishrak,417669408715444224,2013-12-30T14:52:01Z,"Reflecting on 2013; after 60+ years innovating & pioneering therapies, proud to see we continue to bring products to those who need them.",FALSE,FALSE,NA,NA
Omar Ishrak,417334345381072896,2013-12-29T16:40:36Z,".@MDTPhilanthropy Watching & meeting the #GlobalHeroes: highlight of year for me, still running w/ help of med tech//t.co/ecobqdkWeO",FALSE,FALSE,322129559,GlobalHeroes
Omar Ishrak,416588032733880320,2013-12-27T15:15:01Z,Medtech 2030... movement to more global harmonization of regulatory policies; transparency while ensuring patient safety is common principle,FALSE,FALSE,NA,NA
Omar Ishrak,416582997681655808,2013-12-27T14:55:01Z,"Medtech 2030 key conclusion: use innovation to advance #value, better outcomes in h/c system; necessary to improve quality of coverage.",FALSE,FALSE,NA,value
Omar Ishrak,416581274443464704,2013-12-27T14:48:10Z,"Thanks to all who joined us for Medtech 2030, Beijing last wk; sharing global practices to address China's h/c needs//t.co/xsM7deMRQc",FALSE,FALSE,NA,NA
Omar Ishrak,415568818724147200,2013-12-24T19:45:01Z,In London over Christmas ... Always great to be here. View from Richmond Park.//t.co/g8f31EeIri,FALSE,FALSE,NA,NA
Omar Ishrak,415527543866142721,2013-12-24T17:01:01Z,Thanks to all our employees around the world for your efforts in 2013; enjoy the holiday with family & friends!,FALSE,FALSE,NA,NA
Omar Ishrak,415241320861794304,2013-12-23T22:03:40Z,"@keremoktay 2nd largest medtech market overall in few years; w/ investments in country's health system, opportunities are great for medtech.",FALSE,FALSE,66099834,NA
Omar Ishrak,415150054341894144,2013-12-23T16:01:00Z,Congrats MDT Beijing employees on new office opening; China on track to become 2nd largest medtech mkt in few years.//t.co/CfDcpu4AXx,FALSE,FALSE,NA,NA
Omar Ishrak,414170002670235649,2013-12-20T23:06:38Z,@vicmangla Thanks; we are excited too about this technology.,FALSE,FALSE,303506034,NA
Omar Ishrak,414163152704909313,2013-12-20T22:39:25Z,Excited to work w/ United Family Hospitals; finding new ways to bring medical tech to more patients in China. #travel//t.co/rOWjGgMUXq,FALSE,FALSE,NA,travel
Omar Ishrak,414066577097908224,2013-12-20T16:15:39Z,"@PavilionRx Thanks, I'm glad the team got in touch with you.",FALSE,FALSE,1598723318,NA
Omar Ishrak,414064976782184448,2013-12-20T16:09:18Z,With the Chicago Diabetes team ...in Minneapolis last week for Patient Day.//t.co/L1VtI2qMux,FALSE,FALSE,NA,NA
Omar Ishrak,411614014628962304,2013-12-13T21:50:03Z,Appreciate inspiration shared by patients at Employee Holiday Prog today; reminds us why we work to fulfill our Mission around the world.,FALSE,FALSE,NA,NA
Omar Ishrak,411548834435956736,2013-12-13T17:31:02Z,Looking forward to Employee Holiday Program today celebrating year & opportunity to hear from patients & physicians #MDTHolidayProgram,FALSE,FALSE,NA,MDTHolidayProgram
Omar Ishrak,411200032227213313,2013-12-12T18:25:02Z,Spent a great day w/ Diabetes team & customers in Chicago last week. Excellent feedback on MiniMed 530G.,FALSE,FALSE,NA,NA
Omar Ishrak,411134346889031680,2013-12-12T14:04:01Z,Congratulations to Medtronic Micra team on clinical trial & first in human implant of world's smallest pacemaker! Excited about potential.,FALSE,FALSE,NA,NA
Omar Ishrak,408697505157615616,2013-12-05T20:40:53Z,@EricTopol Informative article; MDT using smartphone w/ otoscope for otitis media diagnosis for underserved in India//t.co/W8rIvBNkDw,FALSE,FALSE,86626845,NA
Omar Ishrak,407920417245265920,2013-12-03T17:13:00Z,Great analysis 'today's revenue will be tomorrow's cost' describing shift to population health from fee for service.//t.co/5I4OLY62oJ,FALSE,FALSE,NA,NA
Omar Ishrak,407902223977689088,2013-12-03T16:00:43Z,@MedtronicENT Congrats- ST on your new facility. You have delivered consistent growth since 2011. Hope to visit and see the center soon.,FALSE,FALSE,546209862,NA
Omar Ishrak,406092633405403136,2013-11-28T16:10:03Z,Wishing everyone a wonderful Thanksgiving holiday with family & friends.,FALSE,FALSE,NA,NA
Omar Ishrak,406090362626007042,2013-11-28T16:01:01Z,Much to reflect on this time of year; I'm thankful for our #employees around the world who contribute to our Mission every day.,FALSE,FALSE,NA,employees
Omar Ishrak,405900299703181312,2013-11-28T03:25:47Z,Spending Thanksgiving in California. The sunsets couldn't be more spectacular!//t.co/BnjRVnZtp4,FALSE,FALSE,NA,NA
Omar Ishrak,403296962629599233,2013-11-20T23:01:03Z,"Continued progress in services & solutions to offer benefits to broader stakeholders, including gov't, payers & hospitals #MDTEarnings",FALSE,FALSE,NA,MDTEarnings
Omar Ishrak,403284514715496448,2013-11-20T22:11:35Z,Collaborating w/ broader stakeholders & new business models; moving from accountable for product to an outcome #MDTEarnings,FALSE,FALSE,NA,MDTEarnings
Omar Ishrak,403275460857327616,2013-11-20T21:35:37Z,"New therapies, globalization & econ value will steadily improve position, strengthen & geog diversify bus. for reliable growth #MDTEarnings",FALSE,FALSE,NA,MDTEarnings
Omar Ishrak,402882720587862016,2013-11-19T19:35:00Z,"Execution is offsetting pressure in dynamic envir; focus on areas we control: launching prods, managing cost & growing mkts #MDTEarnings",FALSE,FALSE,NA,MDTEarnings
Omar Ishrak,402871145328017408,2013-11-19T18:49:00Z,Our cadence of new products most exciting since I've been at Medtronic; building on platform of execution #MDTEarnings,FALSE,FALSE,NA,MDTEarnings
Omar Ishrak,402857323376672768,2013-11-19T17:54:05Z,Pleased to share FY14 Q2 earnings this morning; we're performing at or better than the market in almost every business #MDTEarnings,FALSE,FALSE,NA,MDTEarnings
Omar Ishrak,402849452450648064,2013-11-19T17:22:48Z,Thanks to Medtronic employees around the world who contribute to our Mission every day; proud of our results #MDTEarnings,FALSE,FALSE,NA,MDTEarnings
Omar Ishrak,399890507050254336,2013-11-11T13:25:01Z,Saddened by the tremendous loss in life and property caused typhoons in SE Asia. Thankful that our employees are safe.,FALSE,FALSE,NA,NA
