name,status_id,created_at,text,is_quote,is_retweet,reply_to_user_id,hashtags
Naser Haghamed,956163439759642624,2018-01-24T13:55:03Z,"Angela Merkel: We need to learn from past mistakes take advantage of the benefits that technology offers, deal with protectionism, cooperate with Africa in order for a stronger Europe #WEF18 #Davos2018//t.co/I8BXjbd4dH",FALSE,FALSE,NA,Davos2018
Naser Haghamed,956149332318867456,2018-01-24T12:58:59Z,"At #Davos #WEF18 @Winnie_Byanyima shares story of her friend from childhood, Maymuna. Fought her whole life to get out of poverty - ""there is no job this woman has not done!"" But despite all her hard work & enterprise Maymuna remains trapped in poverty. #sharedfutures//t.co/m83AR8CtYc",FALSE,TRUE,NA,Davos
Naser Haghamed,956149332318867456,2018-01-24T12:58:59Z,"At #Davos #WEF18 @Winnie_Byanyima shares story of her friend from childhood, Maymuna. Fought her whole life to get out of poverty - ""there is no job this woman has not done!"" But despite all her hard work & enterprise Maymuna remains trapped in poverty. #sharedfutures//t.co/m83AR8CtYc",FALSE,TRUE,NA,WEF18
Naser Haghamed,956147746821505025,2018-01-24T12:52:41Z,A session on Stablizing the Mediterranean @PaoloGentiloni and @tsipras_eu agree that there is lack of coherence on European strategy to deal with migration issues from Africa. VP of Nigeria wants more long term investment as aid has not solved African problems #WEF18 #Davos//t.co/HIt7UcCpHX,FALSE,FALSE,NA,WEF18
Naser Haghamed,956147746821505025,2018-01-24T12:52:41Z,A session on Stablizing the Mediterranean @PaoloGentiloni and @tsipras_eu agree that there is lack of coherence on European strategy to deal with migration issues from Africa. VP of Nigeria wants more long term investment as aid has not solved African problems #WEF18 #Davos//t.co/HIt7UcCpHX,FALSE,FALSE,NA,Davos
Naser Haghamed,956110223755894786,2018-01-24T10:23:35Z,I want to ask humanitarian workers is what problem do you want you solve using technology and why? #davos #WEF18,FALSE,FALSE,722034294659682304,davos
Naser Haghamed,956110223755894786,2018-01-24T10:23:35Z,I want to ask humanitarian workers is what problem do you want you solve using technology and why? #davos #WEF18,FALSE,FALSE,722034294659682304,WEF18
Naser Haghamed,956110221960712193,2018-01-24T10:23:35Z,Just left Digital Transformation of the Humanitarian System. Very pleased to learn that much has been accomplished to use technology to improve the humanitarian system however the gap between the third and private sectors needs plugging through investment and collaboration #WEF18,FALSE,FALSE,NA,WEF18
Naser Haghamed,956104203105161218,2018-01-24T09:59:40Z,"We are shocked and saddened to hear about the events in Jalalabad this morning. Our thoughts, prayers and solidarity are with all affected by the attack on the @save_children offices in Afghanistan.",FALSE,TRUE,NA,NA
Naser Haghamed,955853266734239744,2018-01-23T17:22:32Z,Creating a Shared Future in a Fractured World//t.co/hMlecUy8FG,FALSE,TRUE,NA,NA
Naser Haghamed,955850780233404416,2018-01-23T17:12:39Z,Listening to @JustinTrudeau at @wef on Canada's approach to women in the workplace - new policy on equal pay for the same jobs at federal level. Sexual harassment is systemic and is not acceptable and needs to have system and policies to prevent this happening to women #WEF18//t.co/aFxEvZcjHC,FALSE,FALSE,NA,WEF18
Naser Haghamed,955848649384316928,2018-01-23T17:04:11Z,So happy to finally meet @NaserHaghamed CEO of @IRWorldwide. Much to do together 4 people trapped in conflict. @Oxfam #WEF18//t.co/7kXLfGhSo1,FALSE,TRUE,NA,NA
Naser Haghamed,955838686733598720,2018-01-23T16:24:36Z,Delighted to bump into @Winnie_Byanyima from @Oxfam at #Davos - great to see the global humanitarian family at #WEF18//t.co/4UgdN8cnRQ,FALSE,FALSE,NA,Davos
Naser Haghamed,955838686733598720,2018-01-23T16:24:36Z,Delighted to bump into @Winnie_Byanyima from @Oxfam at #Davos - great to see the global humanitarian family at #WEF18//t.co/4UgdN8cnRQ,FALSE,FALSE,NA,WEF18
Naser Haghamed,955829142355890176,2018-01-23T15:46:40Z,Press Conference: The Humanitarian Crises that will Shape 2018 - A fascinating discussion on what could happen over the next year #Davos #WEF18//t.co/GzdxqP9eqL via @wef,FALSE,FALSE,NA,Davos
Naser Haghamed,955829142355890176,2018-01-23T15:46:40Z,Press Conference: The Humanitarian Crises that will Shape 2018 - A fascinating discussion on what could happen over the next year #Davos #WEF18//t.co/GzdxqP9eqL via @wef,FALSE,FALSE,NA,WEF18
Naser Haghamed,955786678500823048,2018-01-23T12:57:56Z,"Klaus Schwab has officially opened the annual meeting at #Davos and expressed that ""together we analyse the multiple challenges and find solutions in a fractured world which is driven by increase inequality and lack of social inclusion."" #WEF18//t.co/ZXZrawzltU",FALSE,TRUE,NA,Davos
Naser Haghamed,955784367363805185,2018-01-23T12:48:45Z,He outlined India's vision and mission to be inclusion at all levels and supporting globalisation and removing red tapes in regulatory bodies that are issuing licences #WEF18 #Modi,FALSE,FALSE,722034294659682304,WEF18
Naser Haghamed,955784367363805185,2018-01-23T12:48:45Z,He outlined India's vision and mission to be inclusion at all levels and supporting globalisation and removing red tapes in regulatory bodies that are issuing licences #WEF18 #Modi,FALSE,FALSE,722034294659682304,Modi
Naser Haghamed,955784365224624128,2018-01-23T12:48:44Z,"#Modi opened his speech reflecting what happened in the last 21 years since an Indian Prime Minister came to #Davos A main challenge is nationalism, which he sees as no less dangerous than climate change or terrorism. #WEF18",FALSE,FALSE,NA,Modi
Naser Haghamed,955784365224624128,2018-01-23T12:48:44Z,"#Modi opened his speech reflecting what happened in the last 21 years since an Indian Prime Minister came to #Davos A main challenge is nationalism, which he sees as no less dangerous than climate change or terrorism. #WEF18",FALSE,FALSE,NA,Davos
Naser Haghamed,955784365224624128,2018-01-23T12:48:44Z,"#Modi opened his speech reflecting what happened in the last 21 years since an Indian Prime Minister came to #Davos A main challenge is nationalism, which he sees as no less dangerous than climate change or terrorism. #WEF18",FALSE,FALSE,NA,WEF18
Naser Haghamed,955748222454116352,2018-01-23T10:25:07Z,Interesting that BRICS countries are becoming more influential with China's President adressing #Davos last year and India's PM giving the keynote this year #WEF18,FALSE,FALSE,722034294659682304,Davos
Naser Haghamed,955748222454116352,2018-01-23T10:25:07Z,Interesting that BRICS countries are becoming more influential with China's President adressing #Davos last year and India's PM giving the keynote this year #WEF18,FALSE,FALSE,722034294659682304,WEF18
Naser Haghamed,955748219463618560,2018-01-23T10:25:07Z,"Klaus Schwab has officially opened the annual meeting at #Davos and expressed that ""together we analyse the multiple challenges and find solutions in a fractured world which is driven by increase inequality and lack of social inclusion."" #WEF18//t.co/ZXZrawzltU",FALSE,FALSE,NA,Davos
Naser Haghamed,955748219463618560,2018-01-23T10:25:07Z,"Klaus Schwab has officially opened the annual meeting at #Davos and expressed that ""together we analyse the multiple challenges and find solutions in a fractured world which is driven by increase inequality and lack of social inclusion."" #WEF18//t.co/ZXZrawzltU",FALSE,FALSE,NA,WEF18
Naser Haghamed,955473214083420160,2018-01-22T16:12:20Z,"Currently missing a multilateral meeting with Klaus Schwab, founder of the #WEF due to the snow. It would have been a great opportunity to discuss with him the challenges our sector faces and how we can embrace latest technology and be prepared for 4th industrial revolution//t.co/FXG3F5GwK8",FALSE,FALSE,NA,WEF
Naser Haghamed,955445249538699265,2018-01-22T14:21:13Z,"Tune in from tomorrow for #SDGLive in Davos at #WEF18. Join discussions with global leaders and innovators on how we can achieve a more stable, just, and unified future //t.co/XLH9ZR0YQa #GlobalGoals//t.co/KHuL5j7CRk",FALSE,TRUE,NA,SDGLive
Naser Haghamed,955445249538699265,2018-01-22T14:21:13Z,"Tune in from tomorrow for #SDGLive in Davos at #WEF18. Join discussions with global leaders and innovators on how we can achieve a more stable, just, and unified future //t.co/XLH9ZR0YQa #GlobalGoals//t.co/KHuL5j7CRk",FALSE,TRUE,NA,WEF18
Naser Haghamed,955444401274277888,2018-01-22T14:17:51Z,@andrewfunkspain @Davos Hi. Something along the lines of @EthisCrowd//t.co/dQnjmmbmve - housing for low income families or even P2P investments via CSR where profits are reinvested.,FALSE,FALSE,61011524,NA
Naser Haghamed,955433243045715968,2018-01-22T13:33:30Z,"On my way to @davos for #wef18. Read my piece on how fintech is providing opportunities to people in the developing world,//t.co/XKM7stDPkb//t.co/r3Y8e4gLtV",FALSE,FALSE,NA,wef18
Naser Haghamed,955387112626548736,2018-01-22T10:30:12Z,"25 years of Custodianship 25 years of Compassion 25 years of Social Justice 25 years Sincerity 25 years of Excellence Most importantly, #25YearsTogether with you.//t.co/qoK0rJG8BE",FALSE,TRUE,NA,NA
Naser Haghamed,954319946112294913,2018-01-19T11:49:40Z,Project Davos: what's the single best way to close the world's wealth gap?//t.co/bvnr3unyAV #wef,FALSE,FALSE,NA,wef
Naser Haghamed,954304011825565696,2018-01-19T10:46:21Z,Great to see this partnership between leading #Muslim and #Jewish NGOs @IslamicRelief and @HIASrefugees to provide Syrian refugees in #Greece with legal support #WithRefugees #MoreInCommon @IRWorldwide @AnwarKhan_IRUSA//t.co/6fj94nsGX4,FALSE,TRUE,NA,Muslim
Naser Haghamed,954304011825565696,2018-01-19T10:46:21Z,Great to see this partnership between leading #Muslim and #Jewish NGOs @IslamicRelief and @HIASrefugees to provide Syrian refugees in #Greece with legal support #WithRefugees #MoreInCommon @IRWorldwide @AnwarKhan_IRUSA//t.co/6fj94nsGX4,FALSE,TRUE,NA,Jewish
Naser Haghamed,953963220359892992,2018-01-18T12:12:10Z,"@IslamicRelief USA and Jewish NGO @HIASrefugees join in partnership to provide Syrian refugees with legal support & advice. This powerful alliance between Jews & Muslims demonstrates our shared commitment to refugees,- Sandra Spinner, HIAS Board member.//t.co/FuTVj4U9Dj",FALSE,TRUE,NA,NA
Naser Haghamed,953963144241610752,2018-01-18T12:11:52Z,"Today we celebrate our 34th anniversary. Despite the overwhelming humanitarian needs, we will continue #SavingLives with your support//t.co/B3OXPj5mFe",FALSE,TRUE,NA,SavingLives
Naser Haghamed,953962993498361856,2018-01-18T12:11:16Z,"Today, we mark 34 years of serving humanity. From receiving our first donation of 20p in 1984, thanks to your support, we have helped millions of the worlds poorest and most vulnerable people. Visit our website to find out about our latest activities,//t.co/LP3Qkde6GR//t.co/F5UtjO1Yek",FALSE,TRUE,NA,NA
Naser Haghamed,953944528079216640,2018-01-18T10:57:53Z,My latest piece in the run up to the World Economic Forum How fintech is saving Muslim businesswomen//t.co/Egv71kHFU5 via @wef #wef #fintech,FALSE,FALSE,NA,wef
Naser Haghamed,953944528079216640,2018-01-18T10:57:53Z,My latest piece in the run up to the World Economic Forum How fintech is saving Muslim businesswomen//t.co/Egv71kHFU5 via @wef #wef #fintech,FALSE,FALSE,NA,fintech
Naser Haghamed,951535499759570945,2018-01-11T19:25:16Z,"IRW CEO @NaserHaghamed visited a project in #Iraq which is raising awareness of sexual & #genderbasedviolence. We are helping local communities rebuild & recover by encouraging a community spirit, mutual reliance & creating sustainability. Read more here,//t.co/J4wOzlcFFz//t.co/lVq62qpJ9G",FALSE,TRUE,NA,Iraq
Naser Haghamed,951535499759570945,2018-01-11T19:25:16Z,"IRW CEO @NaserHaghamed visited a project in #Iraq which is raising awareness of sexual & #genderbasedviolence. We are helping local communities rebuild & recover by encouraging a community spirit, mutual reliance & creating sustainability. Read more here,//t.co/J4wOzlcFFz//t.co/lVq62qpJ9G",FALSE,TRUE,NA,genderbasedviolence
Naser Haghamed,951513939707334656,2018-01-11T17:59:36Z,"During IRW CEO's recent visit to Khazir Camp in Mosul, Iraq food packs and bedding which included blankets, pillows and mattresses were distributed as part of our winter appeal, read more about @NaserHaghamed trip here,//t.co/J4wOzlcFFz//t.co/IVbPQ0disy",FALSE,TRUE,NA,NA
Naser Haghamed,950787040647569413,2018-01-09T17:51:09Z,"@NaserHaghamed With your help, we have been able to support schools in #Iraq by distributing school bags and providing psychosocial support to students as well as building the capacity of teachers.//t.co/NYvmZYXQ0R",FALSE,TRUE,NA,Iraq
Naser Haghamed,950787026273611776,2018-01-09T17:51:06Z,IRW CEO @NaserHaghamed visited our offices in #Iraq to see two schools in Fallujah which are being rehabilitated by Islamic Relief. As part of our project 6 schools are currently being rehabilitated to allow children to return to a safe & comfortable learning environment.//t.co/6lYFhYMVJ3,FALSE,TRUE,NA,Iraq
Naser Haghamed,950303000941268992,2018-01-08T09:47:45Z,We pray you have a great week ahead where you tackle those seemingly impossible goals #MondayMotivation,FALSE,TRUE,NA,MondayMotivation
Naser Haghamed,949006516299935744,2018-01-04T19:55:59Z,"2/2 Islamic Relief is supporting the community within this camp recover from crisis to rebuild their #communities through encouraging a communal spirit, to rely on each other to rebuild and create sustainability in #Iraq. #GBV//t.co/0o7HI9cxrL",FALSE,FALSE,722034294659682304,communities
Naser Haghamed,949006516299935744,2018-01-04T19:55:59Z,"2/2 Islamic Relief is supporting the community within this camp recover from crisis to rebuild their #communities through encouraging a communal spirit, to rely on each other to rebuild and create sustainability in #Iraq. #GBV//t.co/0o7HI9cxrL",FALSE,FALSE,722034294659682304,Iraq
Naser Haghamed,949006516299935744,2018-01-04T19:55:59Z,"2/2 Islamic Relief is supporting the community within this camp recover from crisis to rebuild their #communities through encouraging a communal spirit, to rely on each other to rebuild and create sustainability in #Iraq. #GBV//t.co/0o7HI9cxrL",FALSE,FALSE,722034294659682304,GBV
Naser Haghamed,949006496507056132,2018-01-04T19:55:55Z,"1/2 I'm in Baghdad, #Iraq, where I am speaking to women who are taking part in an awareness session on sexual and gender based violence run by Ola Nasayf. The project helps to build awareness and the capacity of men, women and children to deal with and address #GBV",FALSE,FALSE,NA,Iraq
Naser Haghamed,949006496507056132,2018-01-04T19:55:55Z,"1/2 I'm in Baghdad, #Iraq, where I am speaking to women who are taking part in an awareness session on sexual and gender based violence run by Ola Nasayf. The project helps to build awareness and the capacity of men, women and children to deal with and address #GBV",FALSE,FALSE,NA,GBV
Naser Haghamed,947832975013634048,2018-01-01T14:12:45Z,"Thanks to your generosity and support we have managed to change the lives of thousands of children in 2017! The challenges are great, but together we can bring a smile to their faces again InshaAllah :)//t.co/SvsVaA68yC",FALSE,TRUE,NA,NA
Naser Haghamed,947415058606428160,2017-12-31T10:32:06Z,"As we begin 2018, I am issuing a red alert for our world. I call for unity our future depends on it.//t.co/fWtTa1irM3",FALSE,TRUE,NA,NA
Naser Haghamed,946884031542693890,2017-12-29T23:22:00Z,"""I'm angry that we can accept that just 8 men own as much as the poorest half of the world's population"" #EvenItUp #inequality//t.co/PGBnuQI31f",FALSE,TRUE,NA,EvenItUp
Naser Haghamed,946884031542693890,2017-12-29T23:22:00Z,"""I'm angry that we can accept that just 8 men own as much as the poorest half of the world's population"" #EvenItUp #inequality//t.co/PGBnuQI31f",FALSE,TRUE,NA,inequality
Naser Haghamed,946143472070922241,2017-12-27T22:19:16Z,"Statelessness can lead to marginalization, discrimination, poverty and instability. Minority and nationality rights are human rights. #Ibelong//t.co/Xzfta4l4Hb",FALSE,TRUE,NA,NA
Naser Haghamed,946140332940582912,2017-12-27T22:06:48Z,"The UN fights extreme poverty and provides life-saving aid to millions around the world. Investing in a strong, modernized and reformed UN is investing in global peace.",FALSE,TRUE,NA,NA
Naser Haghamed,945601711414104064,2017-12-26T10:26:31Z,"As we enjoy some quality time with our families during the festive break, please do not forget about the countless families that have been forced to flee their homes in #Myanmar due to intense conflict. Donate Now://t.co/Ow6xsD5ZVx//t.co/D8dgI3BAlc",FALSE,TRUE,NA,NA
Naser Haghamed,944322306381352960,2017-12-22T21:42:37Z,"""In all my life, I've never known it so bad."" DEC CEO @salehsaeed shares the stories of people he met in #Yemen earlier this year //t.co/OmmAI5FSZo//t.co/PmwgtguTUg",FALSE,TRUE,NA,Yemen
Naser Haghamed,943421331126792192,2017-12-20T10:02:27Z,"EXCLUSIVE-Congo's hidden ""mega-crisis"" is most neglected of 2017 - poll//t.co/IulclHZhkq @WorldVisionUK @ACF_UK @IMC_UK @IRWorldwide @PlanGlobal @mercycorps//t.co/gzZ3QHTRAJ",FALSE,TRUE,NA,NA
Naser Haghamed,941745197502918656,2017-12-15T19:02:06Z,"If you have missed @imranmadden on @VictoriaLIVE this morning, here is a chance to see his reflections on our with with the #Grenfell community #GrenfellMemorial//t.co/9ni6Cne6JT",FALSE,TRUE,NA,NA
Naser Haghamed,941048712125665282,2017-12-13T20:54:31Z,@Sudant33Hamid Email me to,FALSE,FALSE,3340632099,NA
Naser Haghamed,940705986393853952,2017-12-12T22:12:39Z,"We have been working in Palestine since 1994 , here is what we've been up to since://t.co/m3xRlowfsS//t.co/Mi9mB5wluD",FALSE,TRUE,NA,NA
Naser Haghamed,940252719096500227,2017-12-11T16:11:31Z,#UN allocates $13.4 million to support 1 million people with life-saving aid in North-East #Nigeria - @UNOCHA @OCHANigeria //t.co/bpRrREeMqE,FALSE,TRUE,NA,UN
Naser Haghamed,940252719096500227,2017-12-11T16:11:31Z,#UN allocates $13.4 million to support 1 million people with life-saving aid in North-East #Nigeria - @UNOCHA @OCHANigeria //t.co/bpRrREeMqE,FALSE,TRUE,NA,Nigeria
Naser Haghamed,940252556726603776,2017-12-11T16:10:53Z,"Your actions matter. As we end off #16days, here are some helpful tips to support survivors and help #EndGBV. Thank you all for participating, and special thanks to @NisaHomes and @CCMWCanada for collaborating! #FaithAgainstGBV//t.co/1FbejwW254",FALSE,TRUE,NA,16days
Naser Haghamed,940252556726603776,2017-12-11T16:10:53Z,"Your actions matter. As we end off #16days, here are some helpful tips to support survivors and help #EndGBV. Thank you all for participating, and special thanks to @NisaHomes and @CCMWCanada for collaborating! #FaithAgainstGBV//t.co/1FbejwW254",FALSE,TRUE,NA,EndGBV
Naser Haghamed,940233207114584065,2017-12-11T14:53:59Z,"Wow, just listened to this powerful thought for the day by @Zia_Salik, reflecting on the Grenfell Tragedy.//t.co/s7oG90gvQC",FALSE,FALSE,NA,NA
Naser Haghamed,940150220855365632,2017-12-11T09:24:14Z,"As temperatures drop across the UK, warm winter clothing items are desperately needed to help save lives. Donate winter items at your nearest clothing bank or Islamic Relief shop. Find out more://t.co/DCgXtrJi44 #SavingLives//t.co/8AOUFkiz2D",FALSE,TRUE,NA,NA
Naser Haghamed,940149260909207552,2017-12-11T09:20:25Z,"In #Yemen, 17 million women, children & men go to bed hungry every night. This is their story & our plea for peace. #ShareIt//t.co/gXgY1y8wrL",FALSE,TRUE,NA,Yemen
Naser Haghamed,940149260909207552,2017-12-11T09:20:25Z,"In #Yemen, 17 million women, children & men go to bed hungry every night. This is their story & our plea for peace. #ShareIt//t.co/gXgY1y8wrL",FALSE,TRUE,NA,ShareIt
Naser Haghamed,940148816627585024,2017-12-11T09:18:39Z,Tomorrow is the last day of the #16days against gender-based violence - but our fight to end violence against women will continue every day of the year. Women&girls are #NotATarget. #orangetheworld @UN @UN_Women//t.co/07cwoorejE,FALSE,TRUE,NA,16days
Naser Haghamed,939603789291708416,2017-12-09T21:12:55Z,"At Islamic Relief we aim to ensure that where religion is used to justify #femalegenitalmutilation, local scholars and religious bodies are adequately engaged to de-link the practice from faith. For #16DaysofActivism we are standing up against #genderbasedviolence//t.co/BHAy4Na7s9",FALSE,TRUE,NA,femalegenitalmutilation
Naser Haghamed,939603559695421440,2017-12-09T21:12:00Z,Thanks to the @ACEVO Chief Exec for standing up for the crucial role of advocacy in #charities #tampontax//t.co/KpnA8JQrK6,FALSE,TRUE,NA,charities
Naser Haghamed,939603559695421440,2017-12-09T21:12:00Z,Thanks to the @ACEVO Chief Exec for standing up for the crucial role of advocacy in #charities #tampontax//t.co/KpnA8JQrK6,FALSE,TRUE,NA,tampontax
Naser Haghamed,939602796369924098,2017-12-09T21:08:58Z,Alhamdulillah 4 workshops were held across the UK for volunteers by our programmes expert on how we save lives. A huge thanks to all those who joined us. If you want to find out more about volunteering at Islamic Relief? Visit//t.co/O1JPA1d4Lc//t.co/3J83jzzjE2,FALSE,TRUE,NA,NA
Naser Haghamed,939593145918132225,2017-12-09T20:30:37Z,Nuestros #voluntarios prepararon con mucha ilusin la #NDEIR17 en Barcelona.//t.co/iFIg1AxmFj,FALSE,TRUE,NA,voluntarios
Naser Haghamed,939593145918132225,2017-12-09T20:30:37Z,Nuestros #voluntarios prepararon con mucha ilusin la #NDEIR17 en Barcelona.//t.co/iFIg1AxmFj,FALSE,TRUE,NA,NDEIR17
Naser Haghamed,939591507392294912,2017-12-09T20:24:06Z,Corruption is killing our elephants and rhinos. We're leading global action to #endwildlifecrime and the corruption that fuels it #UnitedAgainstCorruption//t.co/MIcjZn2sWs,FALSE,TRUE,NA,endwildlifecrime
Naser Haghamed,939577816273874944,2017-12-09T19:29:42Z,"Our amazing Volunteers collected 32 crates of food for Farshare's Christmas local food drive When people saw how much food was being donated, it inspired people to take part //t.co/YqW93kDmup//t.co/UMf3NFM7wB",FALSE,TRUE,NA,NA
Naser Haghamed,939489462156972033,2017-12-09T13:38:37Z,Estimated $2.6 trillion are stolen annually through corruption. Let's stand #UnitedAgainstCorruption to end poverty and achieve SDGs. @UNODC @UNDP//t.co/1ZapgOgUBJ,FALSE,TRUE,NA,UnitedAgainstCorruption
Naser Haghamed,939076528339550208,2017-12-08T10:17:46Z,Visiting @islamicreliefsa children welfare projects ( around #Johannesburg) with @IRWorldwide CEO @NaserHaghamed - fantastic work! Welldone IR Family//t.co/t67vHkOzMt,FALSE,TRUE,NA,Johannesburg
Naser Haghamed,938359069420736512,2017-12-06T10:46:50Z,In #Iraq we marked #16DaysofActivism on #genderbasedviolence by raising awareness on early child marriages. Women and girls of different ages were encouraged and motivated to set goals and work towards fulfilling them #FaithAgainstViolence//t.co/aQk3HfpQyH,FALSE,TRUE,NA,Iraq
Naser Haghamed,938359069420736512,2017-12-06T10:46:50Z,In #Iraq we marked #16DaysofActivism on #genderbasedviolence by raising awareness on early child marriages. Women and girls of different ages were encouraged and motivated to set goals and work towards fulfilling them #FaithAgainstViolence//t.co/aQk3HfpQyH,FALSE,TRUE,NA,16DaysofActivism
Naser Haghamed,938359069420736512,2017-12-06T10:46:50Z,In #Iraq we marked #16DaysofActivism on #genderbasedviolence by raising awareness on early child marriages. Women and girls of different ages were encouraged and motivated to set goals and work towards fulfilling them #FaithAgainstViolence//t.co/aQk3HfpQyH,FALSE,TRUE,NA,genderbasedviolence
Naser Haghamed,937647226733694976,2017-12-04T11:38:14Z,Today is International Day of Persons with Disabilities. We believe that people with disabilities should be able to live a full and dignified life. Our projects have included supporting blind children in Chechnya and people who have lost limbs in Jordan #16Days #LeaveNoOneBehind//t.co/lUT0avUOm7,FALSE,TRUE,NA,NA
Naser Haghamed,936978788491161600,2017-12-02T15:22:06Z,It would be a mistake to believe there is a migration tipping point at which East African states will suddenly unite or work collaboratively to address the conflict.//t.co/01UMKQwZqU,FALSE,TRUE,NA,NA
Naser Haghamed,936978552964157442,2017-12-02T15:21:09Z,We cannot give up on refugee and migrant children. RT to stand with #ChildrenUprooted. #AChildIsAChild//t.co/BLALik6CkO,FALSE,TRUE,NA,ChildrenUprooted
Naser Haghamed,936978552964157442,2017-12-02T15:21:09Z,We cannot give up on refugee and migrant children. RT to stand with #ChildrenUprooted. #AChildIsAChild//t.co/BLALik6CkO,FALSE,TRUE,NA,AChildIsAChild
Naser Haghamed,936617032426119168,2017-12-01T15:24:36Z,"Jhumaa mubarake para tod@s! ""Y Allah es suficiente como Protector y Socorredor."" - Corn (4:45) #FridayReminder #FelizFinde//t.co/MbYiLhvchC",FALSE,TRUE,NA,FridayReminder
Naser Haghamed,936616760765272064,2017-12-01T15:23:31Z,South Sudan risks losing another generation to displacement and exile as their East African neighbours watch//t.co/01UMKQwZqU//t.co/V0fk6vU55H,FALSE,TRUE,NA,NA
Naser Haghamed,936616251044098048,2017-12-01T15:21:30Z,"The next generation can be HIV free says @MSF nurse Slidile, fighting HIV in an area where 1 in 4 people is infected://t.co/TOUY5rY0Wp #WorldAIDSday//t.co/7P5xgUPlZA",FALSE,TRUE,NA,NA
Naser Haghamed,935900187641364480,2017-11-29T15:56:07Z,"Islamic Relief Worldwide today, signed a Memorandum of Understanding with the Iraqi Red Crescent Society to collaborate on programmes & share resources for the next 3 years. Read more here,//t.co/L3X6fPxe6V//t.co/2pX4zaDwA5",FALSE,TRUE,NA,NA
