name,status_id,created_at,text,is_quote,is_retweet,reply_to_user_id,hashtags
Naser Haghamed,999624772798566401,2018-05-24T12:14:52Z,Want to learn how the development sector works? Start your journey in developing a career as a #humanitarian with an #internship @IRWorldwide & @IslamicReliefUK #MondayMotivation - Closing date 17 June//t.co/cW8yEfsowR//t.co/IPzTOWwg8C,FALSE,TRUE,NA,humanitarian
Naser Haghamed,999624696395194368,2018-05-24T12:14:34Z,"If you have what it takes to be a first responder and to help someone in need at their most vulnerable, then this is the programme for you! For more information and to register, visit://t.co/yvAJ5Ix79H #SavingLives//t.co/N2CKk5F4xz",FALSE,TRUE,NA,NA
Naser Haghamed,999570562413408257,2018-05-24T08:39:27Z,"@IRSomalia Relief Worldwide CEO brother, Naser Haghamed, and the Regional Director, brother Yusuf Ahmed visited in Mogadishu, Somalia today. The brothers visited the IDPs and Ramadan food distribution site in Km 13 outside Mogadishu//t.co/3dbvXbYaxn",FALSE,TRUE,NA,NA
Naser Haghamed,998643330752839680,2018-05-21T19:14:58Z,"#RamadanReminder Reminder 5: ""How strange! You seek guidance, yet you do not tread its path, surely a boat does not sail on land."" - Imam Ash-Shaafi'ee #Ramadan//t.co/w52v4EEbiX",FALSE,TRUE,NA,RamadanReminder
Naser Haghamed,998132792222502913,2018-05-20T09:26:16Z,"As @sheikhshatri heads to Preston to led Taraweeh there tonight, @IslamicReliefUK teams across the UK will be joining congregation to pray Salah, make duA and raise funds for #Gaza If we're not in your local mosque, you can still support the cause...//t.co/utEHPDqPkH",FALSE,TRUE,NA,NA
Naser Haghamed,997874413390520320,2018-05-19T16:19:34Z,Why Muslims donate so much to charity. An article by @imranmadden @IslamicReliefUK Director. @IRWorldwide @irinnews @BBCNews @BBCWorld #SaveLives//t.co/IYM4wawWwt,FALSE,TRUE,NA,NA
Naser Haghamed,997772853998227456,2018-05-19T09:36:00Z,"We have started delivering food packs in Harare, #Zimbabwe to vulnerable families for this #Ramadan. You can support our Ramadan campaign at://t.co/THDOd1HAAN #Ramadan #PowerOfZakat//t.co/Gw7lpFgFQj",FALSE,TRUE,NA,Zimbabwe
Naser Haghamed,997772853998227456,2018-05-19T09:36:00Z,"We have started delivering food packs in Harare, #Zimbabwe to vulnerable families for this #Ramadan. You can support our Ramadan campaign at://t.co/THDOd1HAAN #Ramadan #PowerOfZakat//t.co/Gw7lpFgFQj",FALSE,TRUE,NA,Ramadan
Naser Haghamed,997772621617000448,2018-05-19T09:35:05Z,Why Muslims donate so much to charity. An article by @imranmadden @IslamicReliefUK Director. @IRWorldwide @irinnews @BBCNews @BBCWorld #SaveLives//t.co/IYM4wawWwt,FALSE,FALSE,NA,SaveLives
Naser Haghamed,997397196172558336,2018-05-18T08:43:16Z,"We are in the final of this Twitter competition by @therightethos against Scope. On this beautiful Friday, please take a moment out to vote for @IRWorldwide #wcoctwf//t.co/SbkVewoWSK",TRUE,FALSE,NA,wcoctwf
Naser Haghamed,997374227086020608,2018-05-18T07:12:00Z,""" ."" . . #_ ://t.co/Flz6ybC01d #_ #_//t.co/mrsVpnzRbV",FALSE,TRUE,NA,NA
Naser Haghamed,997199785500332034,2018-05-17T19:38:50Z,"Our CEO, @NaserHaghamed wasn't able to record a #Ramadan message this year, but a very special girl was able to step in. Ramadan Mubarak from our family to yours! //t.co/0ONaMDSueL",FALSE,TRUE,NA,Ramadan
Naser Haghamed,996476727240151041,2018-05-15T19:45:40Z,# . . . #_.//t.co/hDiuKMR3NH,FALSE,TRUE,NA,
Naser Haghamed,996283018049441792,2018-05-15T06:55:56Z,"Written on the walls of this destroyed building in #Palestine are the powerful words from the Qur'an. In #Gaza and the #WestBank, children are suffering from poverty & conflict. By the will of Allah SWT, & with your donations, we can together save lives //t.co/kQmXbhLDt3//t.co/KSLRf6zgFW",FALSE,TRUE,NA,Palestine
Naser Haghamed,996283018049441792,2018-05-15T06:55:56Z,"Written on the walls of this destroyed building in #Palestine are the powerful words from the Qur'an. In #Gaza and the #WestBank, children are suffering from poverty & conflict. By the will of Allah SWT, & with your donations, we can together save lives //t.co/kQmXbhLDt3//t.co/KSLRf6zgFW",FALSE,TRUE,NA,Gaza
Naser Haghamed,995276924485361664,2018-05-12T12:18:04Z,"Three years after the devastating earthquakes that rocked Nepal, meet the women who are behind the rebuilding of the country, with the help of #UKaid. @DFIDNepal @Helvetas//t.co/oxvv6ZZG7E",FALSE,TRUE,NA,NA
Naser Haghamed,995276759229718528,2018-05-12T12:17:25Z,Raise your voice Support one another Share the workload Get involved Educate the next generation Know your rights Join the conversation Give to the cause 8 ways you can be a women's rights advocate every day: //t.co/BcAStAGW5q//t.co/qV7s2xIemI,FALSE,TRUE,NA,NA
Naser Haghamed,995006998965051392,2018-05-11T18:25:29Z,"I've just ordered my #cakes4syria - it was delicious last year, and lovely @IslamicReliefUK volunteers will even bring it to your home. Get yours at @TheCakeCampaign//t.co/H5SXk7pih9",FALSE,TRUE,NA,cakes4syria
Naser Haghamed,994682464877637632,2018-05-10T20:55:54Z,Great privilege to join A Night of #SavingLives' the launch for the @IslamicReliefUK Ramadan Appeal & to pay tribute to the incredible generosity of British Muslims who will raise over 100 million for charity in the month of Ramadan alone. #AidWorks @DFID_UK//t.co/lvL6v3ZXhR,FALSE,TRUE,NA,SavingLives
Naser Haghamed,994682235939893248,2018-05-10T20:55:00Z,"Really happy to support @IslamicReliefUK night for #savinglives - an organisation that's helped 117million lives in 40 of the poorest and most marginalised countries over 34 years - ministers,mps, media and many others represented here//t.co/sjmQSR5Dop",FALSE,TRUE,NA,savinglives
Naser Haghamed,994576784296415232,2018-05-10T13:55:58Z,Huge thanks to all those that attended 'A Night of #SavingLives' - great to celebrate our life-saving legacy with our incredible supporters and generous donors.//t.co/txcYUnCvFB,FALSE,TRUE,NA,SavingLives
Naser Haghamed,994320578730516483,2018-05-09T20:57:54Z,@DrRosena NO for Tooting @IslamicReliefUK Ramadan launch tells a sad and horrific story of Myanmar refugees' suffering that she heard first hand when she visited Cox Bazaar where @IRWorldwide is working with local partners. #SavingLives since 1984.//t.co/5OZgNOLA09,FALSE,FALSE,2382227424,SavingLives
Naser Haghamed,994312782505041922,2018-05-09T20:26:55Z,Ooh #WowOwoW! WhauUuut an incredible honour inDEED! with #TheFatherOfHumanity @drhanyelbanna and @NaserHaghamed @TufailH @FfP_Global #MAOUK #SavingLives//t.co/Xj9mR3z87c,FALSE,TRUE,NA,WowOwoW
Naser Haghamed,994312782505041922,2018-05-09T20:26:55Z,Ooh #WowOwoW! WhauUuut an incredible honour inDEED! with #TheFatherOfHumanity @drhanyelbanna and @NaserHaghamed @TufailH @FfP_Global #MAOUK #SavingLives//t.co/Xj9mR3z87c,FALSE,TRUE,NA,TheFatherOfHumanity
Naser Haghamed,994300686929219585,2018-05-09T19:38:51Z,@ragehomaar reminds us that @IslamicReliefUK is unique as it has a confident foot in areas that others are shy to tread #savinglives #ForTheLoveOfAllah,FALSE,TRUE,NA,NA
Naser Haghamed,994300579454373888,2018-05-09T19:38:26Z,@ragehomaar @IslamicReliefUK Ramadan launch IR is unique by having confident foot in over 40 countries and as a result it has received support from many institutions such as @DFID_UK . #SavingLives since 1984//t.co/7Eix0TlNdt,FALSE,FALSE,20763821,SavingLives
Naser Haghamed,994299505922240513,2018-05-09T19:34:10Z,"We are currently LIVE on Facebook with @salehsaeed (CEO, @decappeal) and @judithescribano (Head of Comms, Islamic Relief UK) who are telling us all about the amazing life-saving work Islamic Relief have been able to do with the DEC! #SavingLives//t.co/tRygNqc53q",FALSE,TRUE,NA,NA
Naser Haghamed,994299465724059649,2018-05-09T19:34:00Z,On my way and really looking forward to it @IslamicReliefUK @MariahIdrissi @salehsaeed//t.co/l1hfVxvIn9,FALSE,TRUE,NA,NA
Naser Haghamed,994299401265995776,2018-05-09T19:33:45Z,Ooh #WowOwoW! #SavingLives//t.co/7nXTTx8xtW,FALSE,TRUE,NA,WowOwoW
Naser Haghamed,994299401265995776,2018-05-09T19:33:45Z,Ooh #WowOwoW! #SavingLives//t.co/7nXTTx8xtW,FALSE,TRUE,NA,SavingLives
Naser Haghamed,994299373117952000,2018-05-09T19:33:38Z,"So proud of our Ramadan Campaign and of this wonderful event - A night of Saving lives, all of for the love of Allah. #savinglives @IslamicReliefUK #ForTheLoveOfAllah//t.co/3ivfFC3csC",FALSE,TRUE,NA,NA
Naser Haghamed,994299308571807744,2018-05-09T19:33:23Z,Our Deputy Director @TufailH welcomes @salehsaeed and @SarahHatstand of @ChtyCommission to our annual gala dinner #SavingLives//t.co/SiWO0hFoM9,FALSE,TRUE,NA,NA
Naser Haghamed,994297441582239745,2018-05-09T19:25:57Z,@BatesLord @DFID_UK @IslamicReliefUK Ramadan launch Muslims in the UK give 100m during Ramadan. Faith predates the conventional NGO work in helping the poor. #SavingLives since 1984//t.co/7jhDA74bPi,FALSE,FALSE,866230718,SavingLives
Naser Haghamed,994296303290126338,2018-05-09T19:21:26Z,Many congrats to @IslamicReliefUK on #RamadanLaunch #SavingLives. Special mention to the legendary founder @drhanyelbanna #london #ForTheLoveOfAllah//t.co/knUHIJtwIn,FALSE,TRUE,NA,RamadanLaunch
Naser Haghamed,994296303290126338,2018-05-09T19:21:26Z,Many congrats to @IslamicReliefUK on #RamadanLaunch #SavingLives. Special mention to the legendary founder @drhanyelbanna #london #ForTheLoveOfAllah//t.co/knUHIJtwIn,FALSE,TRUE,NA,SavingLives
Naser Haghamed,994295882458812418,2018-05-09T19:19:46Z,@imranmadden it is 25 years since we received our first grant from @DFID_UK and thank you for everyone attending the event #SavingLives since 1984,FALSE,FALSE,902464705,SavingLives
Naser Haghamed,994294595419860992,2018-05-09T19:14:39Z,@imranmadden @IRWorldwide saved the lives of 117 million since 1984 #SavingLives @IslamicReliefUK,FALSE,FALSE,902464705,SavingLives
Naser Haghamed,994292897628467200,2018-05-09T19:07:54Z,At the @IslamicReliefUK Ramadan launch #SavingLives for the love of Allah.,FALSE,FALSE,NA,SavingLives
Naser Haghamed,994292681810546688,2018-05-09T19:07:03Z,At @IslamicReliefUK launch of a night of #savinglives with @BatesLord of #DFID as guest speaker.,FALSE,TRUE,NA,savinglives
Naser Haghamed,994292681810546688,2018-05-09T19:07:03Z,At @IslamicReliefUK launch of a night of #savinglives with @BatesLord of #DFID as guest speaker.,FALSE,TRUE,NA,DFID
Naser Haghamed,993493114252865537,2018-05-07T14:09:51Z,"#CARcrisis | 2 million people are food insecure, nearly a quarter of whom are severely food insecure. Get the facts //t.co/h6ZyyE3r6h",FALSE,TRUE,NA,CARcrisis
Naser Haghamed,993221880030081029,2018-05-06T20:12:04Z,Huge thanks to @captainmisbahpk for joining us in #Bradford tonight. An incredibly insightful interview discussing the highs and lows of his remarkable career whilst also enabling us to raise vital funds to support families in #Pakistan.//t.co/IsXUzH81Gv,FALSE,TRUE,NA,Bradford
Naser Haghamed,993131829963186176,2018-05-06T14:14:14Z,Great to have British boxer @Qais_Ashfaq at our 'I Am Misbah' event in #Bradford. Thanks for supporting our life-saving work.//t.co/zVNinwYbJC,FALSE,TRUE,NA,Bradford
Naser Haghamed,992980049631633408,2018-05-06T04:11:07Z,"Tonight we're fundraising for sustainable projects in #Pakistan ""Islamic Relief has been saving lives in Pakistan since 1992, supporting people in some of the most remote and hard to reach areas."" - @ateeqsalik #SavingLives//t.co/BIoNbOt7tx",FALSE,TRUE,NA,Pakistan
Naser Haghamed,992703138946867200,2018-05-05T09:50:46Z,Closing fast - political space for civil society. Do read this important blog from @savechildrenuk//t.co/uRfJqhmsRd,FALSE,TRUE,NA,NA
Naser Haghamed,992702486023671808,2018-05-05T09:48:10Z,"In a region of the world where rain has been sparse, recent precipitation caused severe flash floods in Somalia, Kenya and Ethiopia which has displaced thousands of people. Islamic Relief is on the ground providing life saving aid. Support today!//t.co/Lc2UfW7Wdh",FALSE,TRUE,NA,NA
Naser Haghamed,992702179197751296,2018-05-05T09:46:57Z,Our Global Advocacy Advisor @shahinuashraf welcoming everyone to today's workshop on the Islamic Gender Justice Declaration with experts and specialists from across the sector #genderjustice//t.co/qZqstiEXV3,FALSE,TRUE,NA,NA
Naser Haghamed,992149545948762113,2018-05-03T21:10:59Z,"Since our very beginnings, volunteers have been at the heart of what we do. Whilst we've made great progress in helping to halve extreme poverty, we still need your help to end it. Volunteer with Islamic Relief and become a lifesaver now://t.co/O1JPA1d4Lc #SavingLives//t.co/q0mfcLzmLY",FALSE,TRUE,NA,NA
Naser Haghamed,992149375102144513,2018-05-03T21:10:18Z,Andrew Mitchell MP pays tribute to @IslamicReliefUK @IRWorldwide and the #British #Muslim community for their 'awesome' contribution to internatiomal aid #Birmingham #SavingLives//t.co/nAPxhWlqp3,FALSE,TRUE,NA,British
Naser Haghamed,992149375102144513,2018-05-03T21:10:18Z,Andrew Mitchell MP pays tribute to @IslamicReliefUK @IRWorldwide and the #British #Muslim community for their 'awesome' contribution to internatiomal aid #Birmingham #SavingLives//t.co/nAPxhWlqp3,FALSE,TRUE,NA,Muslim
Naser Haghamed,992149315731820547,2018-05-03T21:10:04Z,"Please thank @IslamicReliefUK for this money. Going through everything, being devalued.. you feel like you don't deserve it.. this makes me feel like I'm worth something. I am worthy of being helped. A quote from one of the women we helped with @bswaid #SavingLives//t.co/2olytsktbp",FALSE,TRUE,NA,NA
Naser Haghamed,992068759279095810,2018-05-03T15:49:58Z,"If you have a moment, after voting in you local election, vote for @IRWorldwide in the World Cup of Charities to Work For. #wcoctwf//t.co/g9DCoL6K7A",TRUE,FALSE,NA,wcoctwf
Naser Haghamed,992050611934912513,2018-05-03T14:37:51Z,"Heavy rains in #Kenya caused floods that have displaced over 200,000 people according to the UN Office for the Coordination of Humanitarian Affairs. Floods are disrupting livelihoods with over 6,000 livestock killed, farmlands submerged and crops swept away #Floods #Displacement//t.co/F3St2dexTY",FALSE,TRUE,NA,Kenya
Naser Haghamed,991696005614702592,2018-05-02T15:08:47Z,"Saving lives isn't easy, Yusuf found out the hard way...//t.co/qApDpDXOrV",FALSE,TRUE,NA,NA
Naser Haghamed,991415726727745544,2018-05-01T20:35:03Z,"""We need greater unity & courage to ease the fears of the people we serve; to set the world on track to a better future; and to lay the foundations of sustainable peace & development."" -- @antonioguterres at #UNGA #Peace72 meeting://t.co/XY9CIfQ4Ub//t.co/Funn7bYsGC",FALSE,TRUE,NA,NA
Naser Haghamed,990852492991791104,2018-04-30T07:16:58Z,"The news you've all been waiting for! After a wait of almost 12 months, we're excited to announce that #Cakes4Syria is BACK! //t.co/dmchO3JwK9",FALSE,TRUE,NA,Cakes4Syria
Naser Haghamed,990555216427782145,2018-04-29T11:35:41Z,An honour to attend @Utrujj retreat this afternoon where Shaykh @TamimHaytham talked about #Ramadan being the month of transformation and I had the opportunity to talk about @IslamicReliefUK work in #Myanmar. Thank you all for #SavingLives #ForTheLoveOfAllah//t.co/eOigZC2TwP,FALSE,TRUE,NA,Ramadan
Naser Haghamed,990463063475347456,2018-04-29T05:29:30Z,"We want to give people a chance to stand on their own feet so we are supporting them to start their own business. We have supported over 14,000 families across Pakistan by building their capacities to sustain themselves through Islamic #Microfinance//t.co/okSSNupm0O",FALSE,TRUE,NA,NA
Naser Haghamed,990283688532377605,2018-04-28T17:36:44Z,Lets use this blessed day to gain the love of Allah SWT through our good deeds. #JummahMubarak #Friday//t.co/cqdGBgZKVI,FALSE,TRUE,NA,JummahMubarak
Naser Haghamed,990283688532377605,2018-04-28T17:36:44Z,Lets use this blessed day to gain the love of Allah SWT through our good deeds. #JummahMubarak #Friday//t.co/cqdGBgZKVI,FALSE,TRUE,NA,Friday
Naser Haghamed,990283548581122049,2018-04-28T17:36:11Z,"When we educate a child we give her more than books. We give her the tools, skills and imagination she needs to be the change she wants. For peace and the future of our world there is no better investment than in education.//t.co/L9UwGl3HKR",FALSE,TRUE,NA,NA
Naser Haghamed,990140341620789248,2018-04-28T08:07:08Z,#_ . . //t.co/uwApgttuKQ//t.co/02PwcTTMa6,FALSE,TRUE,NA,_
Naser Haghamed,990139642786742272,2018-04-28T08:04:21Z,Today and today only Walthamstow Charity Shop (E17 4QH) 10.00am 5:30pm Pop in and bag yourself a bargain!//t.co/yKGzY0xhEo,FALSE,TRUE,NA,NA
Naser Haghamed,989986949569105920,2018-04-27T21:57:36Z,"The Team of Islamic Relief Iraq visited Ms Mahdya Al-Lami, the Chairperson of the Committee of Civil Society Organisations of the Baghdad Governor's Council. We discussed future plans for implementation of the project focused on reducing the #GenderBasedViolence #GBV//t.co/7BdV0mj9PD",FALSE,TRUE,NA,NA
Naser Haghamed,989524940062969856,2018-04-26T15:21:44Z,Reputations take years to build and can be lost within 24 hours on social media.... #TrusteeExchange,FALSE,TRUE,NA,TrusteeExchange
Naser Haghamed,989524910732206081,2018-04-26T15:21:37Z,.@SarahHatstand closes #TrusteeExchange with a look at the next phase for the regulator//t.co/yFAd1peHcz,FALSE,TRUE,NA,TrusteeExchange
Naser Haghamed,989522447123828736,2018-04-26T15:11:50Z,At the plenary session for the day @SarahHatstand - Policy and Communications Director at @ChtyCommission - International aid agencies are not uniquely vulnerable to safeguarding issues but they are uniquely scrutinised #trusteeexchange @CSgovernance//t.co/USUQpHt7LC,FALSE,FALSE,NA,trusteeexchange
Naser Haghamed,989510160539406336,2018-04-26T14:23:01Z,Session underway at #trusteeexchange with @CSgovernance presenting the challenges facing an organisation like @IRWorldwide with the media//t.co/jRF60KO2J2,FALSE,FALSE,NA,trusteeexchange
Naser Haghamed,989507171904876544,2018-04-26T14:11:08Z,Getting ready for session 4d on the challenges facing an organisation like @IRWorldwide at the @CSgovernance #TrusteeExchange//t.co/fBLsnBnuql,FALSE,FALSE,NA,TrusteeExchange
Naser Haghamed,989506188139220993,2018-04-26T14:07:14Z,Our office in Iraq holds a two-day workshop to conduct a quarter review meeting for all projects #Evaluation #Iraq//t.co/hMQss1AuaD,FALSE,TRUE,NA,Evaluation
Naser Haghamed,989506188139220993,2018-04-26T14:07:14Z,Our office in Iraq holds a two-day workshop to conduct a quarter review meeting for all projects #Evaluation #Iraq//t.co/hMQss1AuaD,FALSE,TRUE,NA,Iraq
Naser Haghamed,989506106035720192,2018-04-26T14:06:54Z,. . . ://t.co/Flz6ybC01d//t.co/SqWWWJhI6n,FALSE,TRUE,NA,NA
Naser Haghamed,989463946552889350,2018-04-26T11:19:22Z,"Powerful, inspiring and compelling. These visuals demonstrate the resilience of displaced Yemeni children who, despite the tragic circumstances they have been dealt, continue to dream. We have a responsibility to make these dreams a reality.//t.co/cOlAarBF31",FALSE,TRUE,NA,NA
Naser Haghamed,989463188218540034,2018-04-26T11:16:22Z,An eye opening session on financial literacy for trustees at #trusteesexchange by @SV_JudithMiller from @sayervincent//t.co/GMBI1N6YRu,FALSE,FALSE,NA,trusteesexchange
Naser Haghamed,989448077248532480,2018-04-26T10:16:19Z,"@dawes_melanie, Civil Service Gender Champion: Organisations should pay more attention to diversity issues and they are missing opportunities by not doing so #trusteeexchange//t.co/5ngrTH5Ngp",FALSE,FALSE,3355640050,trusteeexchange
Naser Haghamed,989439660907749376,2018-04-26T09:42:52Z,"The latest @UN Climate Change Conference starts 30 April in Bonn!//t.co/WKCSuokQHR Learn how to participate virtually in the meeting, with the key hashtags #SB48Bonn and #Talanoa4ambition//t.co/RKqcaZxwAv",FALSE,TRUE,NA,NA
Naser Haghamed,989423911145230338,2018-04-26T08:40:17Z,Looking forward to speaking at the #trusteeexchange this afternoon on leading a charity in a face of negative headlines.,FALSE,FALSE,NA,trusteeexchange
Naser Haghamed,989202613496315904,2018-04-25T18:00:56Z,"""There were 216 million cases of #malaria in 2016, 5 million more than in 2015! Islamic Relief focuses on malaria prevention work in African countries including Ethiopia, Mali and Sudan #ReadyToBeatMalaria #WorldMalariaDay ""//t.co/MrlwMNOlxu",FALSE,TRUE,NA,malaria
Naser Haghamed,989040245965455360,2018-04-25T07:15:44Z,2000 #_ .//t.co/7rDQG5TrbM,FALSE,TRUE,NA,_
Naser Haghamed,989040054910816257,2018-04-25T07:14:59Z,"It's World Malaria Day! Two-year-old Kwagala smiles in front of a new mosquito net in Namalemba, Uganda. #ReadyToBeatMalaria//t.co/lgifAmNGvz",FALSE,TRUE,NA,ReadyToBeatMalaria
Naser Haghamed,989039436078907392,2018-04-25T07:12:31Z,News: UK aid will provide emergency medical support and help protect medical facilities and brave humanitarian workers being deliberately targeted in Syria//t.co/PH7ZrBvueI #SyriaConf2018//t.co/22wRIhraxJ,FALSE,TRUE,NA,NA
Naser Haghamed,988872529942106112,2018-04-24T20:09:18Z,//t.co/LXj9Lgaxc2,FALSE,FALSE,NA,NA
Naser Haghamed,988852989644468228,2018-04-24T18:51:39Z,"Well done @TufailH! Despite injuring his knee in preperation for the #LondonMarathon , Tufail managed to finish with a great time! He's already raised 10,000+ for our Syria Emergency Appeal, you can still sponsor him and help save lives - visit://t.co/JWR5RWnBik//t.co/cttxvZh6oq",FALSE,TRUE,NA,LondonMarathon
Naser Haghamed,988852762950717447,2018-04-24T18:50:45Z,African Women Leaders Network convenes today as a platform for women leaders in Africa to create opportunities for gender equality & women's empowerment. cc: @unwomenafrica //t.co/lZcAEGIMtd,FALSE,TRUE,NA,NA
Naser Haghamed,988676624118935552,2018-04-24T07:10:50Z,//t.co/7fQ6oQs2aU,FALSE,FALSE,NA,NA
Naser Haghamed,988154100318687232,2018-04-22T20:34:31Z,//t.co/UcDVT8uraN,FALSE,FALSE,NA,NA
Naser Haghamed,988119762499751936,2018-04-22T18:18:04Z,//t.co/6qDrlk8MLa,FALSE,FALSE,NA,NA
Naser Haghamed,988118747419422722,2018-04-22T18:14:02Z,@TufailH mashallah well done May Allah bless you,FALSE,FALSE,310564334,NA
Naser Haghamed,988118514048421890,2018-04-22T18:13:06Z,"25 Days Left. Tip: Learning and understanding the Fiqh rulings related to fasting in Ramadan. Allah (swt) Says (what means): ""So ask the people of the message if you do not know"". [Quran 21:7]. #RamadanCountdown #CW2018//t.co/pmlMlbkEKX",FALSE,TRUE,NA,NA
Naser Haghamed,988118443957411840,2018-04-22T18:12:50Z,Calling all humanitarians: take our survey before it closes in two days. Help us communicate in ways and on #humanitarian topics that are useful for you. Let us know how we're doing in a quick survey://t.co/9y9Yxvn8o9,FALSE,TRUE,NA,humanitarian
Naser Haghamed,988013328248266752,2018-04-22T11:15:08Z,9 entrepreneurs who participated in the Community Development project in #Malaysia have received entrepreneurial awards for their work #Entrepreneurship @IRMalaysia//t.co/7x5DkrcLYc,FALSE,TRUE,NA,Malaysia
Naser Haghamed,988013107229413376,2018-04-22T11:14:15Z,Defending civic space in times of digitalization - thoughtful panel @WiltonPark including @civicusSG @DelphineMoralis @NaserHaghamed @Greenpeace @SalilShetty @ICS_Centre//t.co/4NVaVUlWus,FALSE,TRUE,NA,NA
Naser Haghamed,988012984625704961,2018-04-22T11:13:46Z,Thank you @jeremycorbyn for your continued support of our life-saving work.//t.co/85Hf38Nk8v,FALSE,TRUE,NA,NA
Naser Haghamed,988012921803419648,2018-04-22T11:13:31Z,"International Development Secretary, @PennyMordaunt, meets @JimYongKim and @BillGates to discuss the importance of investing in people; to make them healthier, better educated and therefore able to compete for better jobs and be more successful #InvestinPeople//t.co/TxG3YhUvYE",FALSE,TRUE,NA,NA
Naser Haghamed,987335433636937728,2018-04-20T14:21:25Z,WORLD CUP OF CHARITIES TO WORK FOR! ROUND 1 - GROUP G (of 8 groups) Top 2 qualify for round 2. Voting starts now! Please RT #wcoctwf,FALSE,TRUE,NA,NA
Naser Haghamed,986867760448901120,2018-04-19T07:23:03Z,//t.co/l3kF6txTvu,FALSE,FALSE,NA,NA
Naser Haghamed,986615354129571845,2018-04-18T14:40:05Z,//t.co/nOQMo3M2WL,FALSE,FALSE,NA,NA
Naser Haghamed,986604998015451136,2018-04-18T13:58:56Z,"I sat with @mollyanders_dev from @devex to talk about @IRWorldwide, it's history and my 25 years with the organisation and the future #development #humanitarianism//t.co/r3TXF9Xftl",FALSE,TRUE,NA,NA
Naser Haghamed,986284016985890816,2018-04-17T16:43:28Z,to Global CEOs and Chairs of civil society orgs at the annual event of #visionworks,FALSE,FALSE,NA,visionworks
Naser Haghamed,986283841785606145,2018-04-17T16:42:46Z,Our sector under scrutiny A powerful and transparent presentation made by @Winnie_Byanyima ED of Oxfam International,FALSE,FALSE,NA,NA
Naser Haghamed,986199121601187840,2018-04-17T11:06:07Z,"Huge thanks to the incredible Imam @KLatif for joining us as our guest speaker in #Birmingham #Bradford #Glasgow & #Manchester The incredible 'Love, Mercy and Compassion' tour has been the perfect way to start preparing for the month of #Ramadan which is now just 30 days away!//t.co/XGHYwuD3Fe",FALSE,TRUE,NA,Birmingham
Naser Haghamed,986199121601187840,2018-04-17T11:06:07Z,"Huge thanks to the incredible Imam @KLatif for joining us as our guest speaker in #Birmingham #Bradford #Glasgow & #Manchester The incredible 'Love, Mercy and Compassion' tour has been the perfect way to start preparing for the month of #Ramadan which is now just 30 days away!//t.co/XGHYwuD3Fe",FALSE,TRUE,NA,Bradford
Naser Haghamed,986199121601187840,2018-04-17T11:06:07Z,"Huge thanks to the incredible Imam @KLatif for joining us as our guest speaker in #Birmingham #Bradford #Glasgow & #Manchester The incredible 'Love, Mercy and Compassion' tour has been the perfect way to start preparing for the month of #Ramadan which is now just 30 days away!//t.co/XGHYwuD3Fe",FALSE,TRUE,NA,Glasgow
