name,status_id,created_at,text,is_quote,is_retweet,reply_to_user_id,hashtags
Paul Polman,994583773030252545,2018-05-10T14:23:44Z,"Proud of @Unilever #sustliving progress, our aim is to help 1bn+ people improve their health & well-being by 2020. Global sanitation is KEY to achieving #SDGs #SDG4 #USLP//t.co/v5FT03w6PD//t.co/Ma7i7MK2Wo",FALSE,FALSE,NA,SDG4
Paul Polman,994583773030252545,2018-05-10T14:23:44Z,"Proud of @Unilever #sustliving progress, our aim is to help 1bn+ people improve their health & well-being by 2020. Global sanitation is KEY to achieving #SDGs #SDG4 #USLP//t.co/v5FT03w6PD//t.co/Ma7i7MK2Wo",FALSE,FALSE,NA,USLP
Paul Polman,994568143027699713,2018-05-10T13:21:38Z,.@PaulPolman: Trust is the most valuable business asset we have; it is vital for both sustainable business models and achieving #SDGs #Sustainability//t.co/aqRHdf8Rab,FALSE,TRUE,NA,NA
Paul Polman,994550715447169024,2018-05-10T12:12:23Z,"We need to get rid of corporate social responsibility' and instead have responsible, social, corporations @PaulPolman #USLP update//t.co/BZZMvMv1Cd",FALSE,TRUE,NA,NA
Paul Polman,994539015901794304,2018-05-10T11:25:53Z,Placing #sustainability & trust at the heart of biz is key to growth. Proud of @Unilever's #sustliving brands - proving biz can be a force for good. #USLP//t.co/pScGK4W4JD//t.co/cXJtUyIPUh,FALSE,FALSE,NA,sustainability
Paul Polman,994539015901794304,2018-05-10T11:25:53Z,Placing #sustainability & trust at the heart of biz is key to growth. Proud of @Unilever's #sustliving brands - proving biz can be a force for good. #USLP//t.co/pScGK4W4JD//t.co/cXJtUyIPUh,FALSE,FALSE,NA,sustliving
Paul Polman,994539015901794304,2018-05-10T11:25:53Z,Placing #sustainability & trust at the heart of biz is key to growth. Proud of @Unilever's #sustliving brands - proving biz can be a force for good. #USLP//t.co/pScGK4W4JD//t.co/cXJtUyIPUh,FALSE,FALSE,NA,USLP
Paul Polman,994502251917070336,2018-05-10T08:59:48Z,"Our #sustliving plan has inspired innovation, new thinking and purposeful brands. Read about the highlights of our journey://t.co/eGuZ1IJUdZ//t.co/Tl3mRgq35i",FALSE,TRUE,NA,sustliving
Paul Polman,994280376888692736,2018-05-09T18:18:09Z,Looking forward to @Unilever #sustliving event tomorrow where we will explore findings on the future of #sustbiz #USLP,FALSE,FALSE,NA,sustliving
Paul Polman,994280376888692736,2018-05-09T18:18:09Z,Looking forward to @Unilever #sustliving event tomorrow where we will explore findings on the future of #sustbiz #USLP,FALSE,FALSE,NA,sustbiz
Paul Polman,994280376888692736,2018-05-09T18:18:09Z,Looking forward to @Unilever #sustliving event tomorrow where we will explore findings on the future of #sustbiz #USLP,FALSE,FALSE,NA,USLP
Paul Polman,994230722859864064,2018-05-09T15:00:50Z,Great principles for #WednesdayWisdom: companies have responsibility to stand for something and shape progress//t.co/a88RPqIzap,FALSE,FALSE,NA,WednesdayWisdom
Paul Polman,994229375955595264,2018-05-09T14:55:29Z,#PurposeDrivenBrands #PurposeDrivenPeople #HULPeopleSpeak @RedLabelChai//t.co/XooMvfJlmR,FALSE,TRUE,NA,PurposeDrivenBrands
Paul Polman,994229375955595264,2018-05-09T14:55:29Z,#PurposeDrivenBrands #PurposeDrivenPeople #HULPeopleSpeak @RedLabelChai//t.co/XooMvfJlmR,FALSE,TRUE,NA,PurposeDrivenPeople
Paul Polman,994229375955595264,2018-05-09T14:55:29Z,#PurposeDrivenBrands #PurposeDrivenPeople #HULPeopleSpeak @RedLabelChai//t.co/XooMvfJlmR,FALSE,TRUE,NA,HULPeopleSpeak
Paul Polman,994202199755493376,2018-05-09T13:07:30Z,We need more leaders able to work across sectors to drive towards implementation of the SDG's. Now more important then ever. Trust will always be key component of success. New forms of partnership needed. @SDG2030 @UN @enactus @WMBtweets @YGLvoices //t.co/RyR6g6spPm,FALSE,FALSE,NA,NA
Paul Polman,993901607023726592,2018-05-08T17:13:03Z,"In 2010, @Unilever created our Sustainable Living Plan to make #sustliving commonplace. If biz does not make a positive contribution to society, why should it exist?//t.co/v5FT03w6PD//t.co/M3tEAQE4vX",FALSE,FALSE,NA,sustliving
Paul Polman,993505910902411265,2018-05-07T15:00:42Z,Great introduction to the #SDGs working to solve biggest challenges of our time//t.co/1KqlZdbOVF,TRUE,FALSE,NA,SDGs
Paul Polman,993075978275405824,2018-05-06T10:32:18Z,Low carbon transition is only economic growth story for the future. We need to work together to move to climate-safe and sustainable future @ThomasLingard @Unilever #RE100 #Talanoa4Ambition//t.co/DzttVmtBb0,FALSE,FALSE,NA,RE100
Paul Polman,993075978275405824,2018-05-06T10:32:18Z,Low carbon transition is only economic growth story for the future. We need to work together to move to climate-safe and sustainable future @ThomasLingard @Unilever #RE100 #Talanoa4Ambition//t.co/DzttVmtBb0,FALSE,FALSE,NA,Talanoa4Ambition
Paul Polman,992770858610552832,2018-05-05T14:19:52Z,"Climate change aid is vital, poorest countries will be hit hardest by #climatechange. Important they have help and resource to combat. @OxfamGB//t.co/J3Ywvcxi31",TRUE,FALSE,NA,climatechange
Paul Polman,992742313729449985,2018-05-05T12:26:26Z,"Connect with theoutdoors, connect with @TheGlobalGoals! In less than a month, take your #worldslargestlesson outside on @OutdoorClassDay and join 1000's of schools playing to LEARN! May 17th - sign up here://t.co/JKGJoh9iPi #OutdoorClassroomDay//t.co/qZmAicshpC",FALSE,TRUE,NA,worldslargestlesson
Paul Polman,992713046098432002,2018-05-05T10:30:08Z,Great way to communicate #SDGs using the power of art. Honoured to contribute essay on #SDG12 #Awakening #Eveil @lglizdowdeswell//t.co/CEVzNxzMKg,FALSE,FALSE,NA,SDGs
Paul Polman,992713046098432002,2018-05-05T10:30:08Z,Great way to communicate #SDGs using the power of art. Honoured to contribute essay on #SDG12 #Awakening #Eveil @lglizdowdeswell//t.co/CEVzNxzMKg,FALSE,FALSE,NA,SDG12
Paul Polman,992713046098432002,2018-05-05T10:30:08Z,Great way to communicate #SDGs using the power of art. Honoured to contribute essay on #SDG12 #Awakening #Eveil @lglizdowdeswell//t.co/CEVzNxzMKg,FALSE,FALSE,NA,Awakening
Paul Polman,992713046098432002,2018-05-05T10:30:08Z,Great way to communicate #SDGs using the power of art. Honoured to contribute essay on #SDG12 #Awakening #Eveil @lglizdowdeswell//t.co/CEVzNxzMKg,FALSE,FALSE,NA,Eveil
Paul Polman,992445602675019776,2018-05-04T16:47:25Z,#ParisAgreement: All 197 signatories now taking national #climate action @Madeleine_BG @BusinessGreen//t.co/2xcJdlBYpH,FALSE,TRUE,NA,ParisAgreement
Paul Polman,992445602675019776,2018-05-04T16:47:25Z,#ParisAgreement: All 197 signatories now taking national #climate action @Madeleine_BG @BusinessGreen//t.co/2xcJdlBYpH,FALSE,TRUE,NA,climate
Paul Polman,992387220068880389,2018-05-04T12:55:25Z,Great architectural innovation no idea is too ambitious in journey towards a #lowcarbon economy. #SDGs//t.co/MhKlvXcnQa,TRUE,FALSE,NA,lowcarbon
Paul Polman,992387220068880389,2018-05-04T12:55:25Z,Great architectural innovation no idea is too ambitious in journey towards a #lowcarbon economy. #SDGs//t.co/MhKlvXcnQa,TRUE,FALSE,NA,SDGs
Paul Polman,992380549338685441,2018-05-04T12:28:55Z,Worth a read. We have to move the boundaries and provide space for more purpose driven models than just making money. Good to make financial world sub servant to real economy again. American Capitalism's great crisis//t.co/h6DbhUXj0j,FALSE,FALSE,NA,NA
Paul Polman,991796153145544704,2018-05-02T21:46:44Z,"Over the last 2 years, we traveled in over 100 countries to meet some amazing young girls living the most deprived communities. People took their time to support us, work with us, recommend us & introduce us. Thanks, @vikaspota @davidhertz @YGLvoices @heatherbarnabe @PaulPolman//t.co/0RDoknSQIn",FALSE,TRUE,NA,NA
Paul Polman,991336593351946240,2018-05-01T15:20:36Z,When thought is transferred into action progress is made. Do not think too little of the contributions you can make to building a better tomorrow//t.co/VXBocutOpa,FALSE,FALSE,NA,NA
Paul Polman,991297330778386432,2018-05-01T12:44:35Z,"Mastercard & @Unilever are teaming up to help micro-merchants stock what they know they can sell, rather than what they can buy today #SmallBusinessWeek //t.co/eyyK5ghrUW",FALSE,TRUE,NA,NA
Paul Polman,991293256024707074,2018-05-01T12:28:24Z,"Targeting millennials, startup Affirm developed a revolutionary online-only credit card to help reduce our daily use of plastic. The company's on a mission to serve a growing need and stand out from the crowd! Read more://t.co/csqy4ZdgBD #PlasticFree #Sustainability",FALSE,TRUE,NA,NA
Paul Polman,991268569097887744,2018-05-01T10:50:18Z,"Nice to see @RENSkincare pledge to be #zerowaste by 2021 included on this @EmeraldStreet list. Good work from others mentioned too, issue needs to be addressed from multiple angles @PlasticOceans @Sundried @givemetap & Tide Studio//t.co/eKrzTeS0Jt",TRUE,FALSE,NA,zerowaste
Paul Polman,991199861566566400,2018-05-01T06:17:17Z,Proud to be once more for third year in a row number one on Fit for Purpose index @Unilever .Now even more important than ever to drive purpose driven business models putting citizens at the center and prove business as a force for good. @WeMeanBusiness_ //t.co/gQe96MBtFA,FALSE,FALSE,NA,NA
Paul Polman,990977913666396160,2018-04-30T15:35:20Z,Interesting #datavis which shows the prominence of the #MeToo campaign globally never underestimate the power in speaking out//t.co/Mzq3W9Xoyp,FALSE,FALSE,NA,datavis
Paul Polman,990977913666396160,2018-04-30T15:35:20Z,Interesting #datavis which shows the prominence of the #MeToo campaign globally never underestimate the power in speaking out//t.co/Mzq3W9Xoyp,FALSE,FALSE,NA,MeToo
Paul Polman,990970023874310145,2018-04-30T15:03:59Z,Al Gore: We're in the early stages of a #sustainability revolution' @algore @OsvaldBjelland @PaulPolman @Lise_Kingo //t.co/AroVlo3ol9,FALSE,TRUE,NA,sustainability
Paul Polman,990638958160826368,2018-04-29T17:08:27Z,We need to close the #DigitalGap for women and girls around the world. Are you with us?//t.co/OZJ6DisKL4,FALSE,TRUE,NA,DigitalGap
Paul Polman,990613597326921728,2018-04-29T15:27:40Z,Great use of innovative #sustag methods to help small farmers thrive despite poor conditions. #Climatechange mitigation imperative to sustain the livelihoods of many//t.co/MrqhE7U19W,FALSE,FALSE,NA,sustag
Paul Polman,990613597326921728,2018-04-29T15:27:40Z,Great use of innovative #sustag methods to help small farmers thrive despite poor conditions. #Climatechange mitigation imperative to sustain the livelihoods of many//t.co/MrqhE7U19W,FALSE,FALSE,NA,Climatechange
Paul Polman,990302881386586112,2018-04-28T18:53:00Z,99% of the world's electric buses are in China. Learn more://t.co/qvWBEtoMae//t.co/Uc2njAxCgN,FALSE,TRUE,NA,NA
Paul Polman,990290645158973440,2018-04-28T18:04:23Z,A big congratulations to @i_amthecode for the amazing work to teach young girls coding. High impact especially in emerging countries. Go for the 1 million goal. We support you @Unilever//t.co/mky1A7ES7F,TRUE,FALSE,NA,NA
Paul Polman,990239154360512512,2018-04-28T14:39:46Z,"Delighted to annouce that we've now produced over 100 MILLION FULLY BIODEGRADABLE tea bags! That's a LOT of tea - enough for the entire population of Britain, including dogs, cats, and Chimpanzees #NationalTeaDay//t.co/0bNoMtHDuo",FALSE,TRUE,NA,NA
Paul Polman,990236099162206208,2018-04-28T14:27:38Z,"Glad to see @Virgin , @benandjerrys , IRC and Tent Foundation, @thebteamhq launch Business and Refugee Action Network (BRAN), bringing together businesses across Europe to exchange information and explore ways to support migrants and refugees.@Unilever //t.co/DmWyvCOaGD",FALSE,FALSE,NA,NA
Paul Polman,990209626841997312,2018-04-28T12:42:26Z,Wonderful news #OYW2019 will be heading back to London the city where it all began 10 years ago #changemakers #london//t.co/KdWSULdesG,TRUE,FALSE,NA,OYW2019
Paul Polman,990209626841997312,2018-04-28T12:42:26Z,Wonderful news #OYW2019 will be heading back to London the city where it all began 10 years ago #changemakers #london//t.co/KdWSULdesG,TRUE,FALSE,NA,changemakers
Paul Polman,990209626841997312,2018-04-28T12:42:26Z,Wonderful news #OYW2019 will be heading back to London the city where it all began 10 years ago #changemakers #london//t.co/KdWSULdesG,TRUE,FALSE,NA,london
Paul Polman,990208454387265536,2018-04-28T12:37:47Z,"We're proud to be a founding member of @WRAP_UK's #UKPlasticsPact. Together we can transition to a circular economy, find alternative solutions and keep plastics out of the ocean.//t.co/VBiKcgc2sr",FALSE,TRUE,NA,UKPlasticsPact
Paul Polman,990208282743771136,2018-04-28T12:37:06Z,"Earlier this week, we announced that @PaulPolman is being awarded the LionHeart award at #CannesLions this year! Here's what he had to say //t.co/bObVXTcdZp",FALSE,TRUE,NA,CannesLions
Paul Polman,989890855166271489,2018-04-27T15:35:45Z,More and more biz are recognising that #sustainablebusiness is good for the environment and for driving growth & bigger returns.//t.co/qXF8OCzjzF,FALSE,FALSE,NA,sustainablebusiness
Paul Polman,989865937917575173,2018-04-27T13:56:45Z,Delighted one of @Unilever s latest acquisitions Quala launched into Mexico in just 45 days. Great example of #agility and #speed. Well done to teams involved.//t.co/SbGc7Ypljx,FALSE,FALSE,NA,agility
Paul Polman,989865937917575173,2018-04-27T13:56:45Z,Delighted one of @Unilever s latest acquisitions Quala launched into Mexico in just 45 days. Great example of #agility and #speed. Well done to teams involved.//t.co/SbGc7Ypljx,FALSE,FALSE,NA,speed
Paul Polman,989773394357858305,2018-04-27T07:49:00Z,Congratulations to the @IAA_Global on their 80th Anniversary. And thank you to my fellow Golden Compass recipients for your leadership in our industry @thepaulrossi #ShellyLazarus #IAAGoldenCompassAward//t.co/koWuJlUeTo,TRUE,FALSE,NA,ShellyLazarus
Paul Polman,989773394357858305,2018-04-27T07:49:00Z,Congratulations to the @IAA_Global on their 80th Anniversary. And thank you to my fellow Golden Compass recipients for your leadership in our industry @thepaulrossi #ShellyLazarus #IAAGoldenCompassAward//t.co/koWuJlUeTo,TRUE,FALSE,NA,IAAGoldenCompassAward
Paul Polman,989762978521104387,2018-04-27T07:07:37Z,It's happening faster than many realise. Half US coal plants (268 ) closed last few years. Economics speak loudest and financial markets starting to move. Yet not enough yet to stay below 2degrees. @WMBtweets @wbcsd @globalcompact @Unilever //t.co/zHHYYUvWQ9,FALSE,FALSE,NA,NA
Paul Polman,989568653959016449,2018-04-26T18:15:27Z,"It's great that @JustinTrudeau agrees #PovertyIsSexist - now we need action! Tell him to back this plan & enable 100m women in the poorest countries to learn, work & increase their independence //t.co/Kr1P8CxrDN",FALSE,FALSE,NA,PovertyIsSexist
Paul Polman,989567298909417473,2018-04-26T18:10:03Z,An honour for all the men and women in Unilever and our partners who work hard day in day out to create a better world for all. @Unilever @SDG2030 @globalcompact //t.co/6hQcqflrYQ,FALSE,FALSE,NA,NA
Paul Polman,989533928456208390,2018-04-26T15:57:27Z,"55% of #millenials say a company's support for social causes is significant in accepting a job offer - work with #value benefits individuals, society & planet//t.co/mDIIXEKW8T",FALSE,FALSE,NA,millenials
Paul Polman,989533928456208390,2018-04-26T15:57:27Z,"55% of #millenials say a company's support for social causes is significant in accepting a job offer - work with #value benefits individuals, society & planet//t.co/mDIIXEKW8T",FALSE,FALSE,NA,value
Paul Polman,989502387005087745,2018-04-26T13:52:07Z,Inspiring work by these Brazilian communities where people are taking action against #plasticpollution. Every act helps and contributes to unlocking #SDGs //t.co/lfBjiP6jle,FALSE,FALSE,NA,plasticpollution
Paul Polman,989502387005087745,2018-04-26T13:52:07Z,Inspiring work by these Brazilian communities where people are taking action against #plasticpollution. Every act helps and contributes to unlocking #SDGs //t.co/lfBjiP6jle,FALSE,FALSE,NA,SDGs
Paul Polman,989501732370698240,2018-04-26T13:49:31Z,Proud to be inducted to the @AAFNational Advertising Hall of Fame with colleagues who have contributed so much to the industry. Thank you and congratulations to all #AHOF18//t.co/ZTF2D7lCQL,TRUE,FALSE,NA,AHOF18
Paul Polman,989410835331272704,2018-04-26T07:48:20Z,Great to see new state of art research center @Unilever Wageningen taking shape. Over 500 jobs created and key to solving many global food issues @SDG2030 @WFP @wbcsd @ICC @globalcompact//t.co/mRbD1ijlEh,FALSE,FALSE,NA,NA
Paul Polman,989388904796213248,2018-04-26T06:21:11Z,"With the great people @thebteamhq in New York full of passion and energy to work climate change , human rights and eradicate corruption to create a better world for all @sdg2030 @wbcsd @enactus//t.co/TPnforiDLG",FALSE,FALSE,NA,NA
Paul Polman,989202093754941445,2018-04-25T17:58:52Z,Big change starts with small acts great partnership to make it easier for families to recycle in the US @beautyandplanet//t.co/CPzO9qRyKP,FALSE,FALSE,NA,NA
Paul Polman,989098143923961856,2018-04-25T11:05:48Z,Consumers increasingly want to buy products from socially responsible brands. A clear case for building and maintaining a responsible biz #sustainability//t.co/eKnDE2Lc5Z,FALSE,FALSE,NA,sustainability
Paul Polman,988865120804790273,2018-04-24T19:39:51Z,Great to see @UnileverUKI joining on-pack recycling label scheme. Consumers want to do their bit to protect the planet - up to us to make the sustainable choice the easy choice @OPRL @WRAP_UK//t.co/63NSWe6BNQ,FALSE,FALSE,NA,NA
Paul Polman,988815435247312897,2018-04-24T16:22:25Z,Great experience @nexxushair in Tribeca New York. Professionals at work. Highly recommended. @unileverusa//t.co/O4VdJAHgZU,FALSE,FALSE,NA,NA
Paul Polman,988790253090582528,2018-04-24T14:42:21Z,"If global warming was a hoax, then someone would need to be: - falsifying millions of temperature measurements - artificially melting glaciers & sea ice - reducing the volume of the ocean to make sea level appear to rise And, all this must have started over a century ago.",FALSE,TRUE,NA,NA
Paul Polman,988534024976072704,2018-04-23T21:44:12Z,Happy earthday or do we have enough reasons to be happy ? We all need to contribute to a better world for all.//t.co/GvNpcOsY8i,FALSE,FALSE,NA,NA
Paul Polman,988532459196338177,2018-04-23T21:37:58Z,Moving towards a circular economy means that plastic is kept as a valuable material in the economy and out of the ocean. Here are 4 things business can do now to solve the challenge//t.co/Rw6AF93WNd #EarthDay #NewPlasticsEconomy//t.co/maAzO8j0VD,FALSE,TRUE,NA,NA
Paul Polman,988532342737301504,2018-04-23T21:37:31Z,"The past year has seen leaders from cities, states, and businesses across the U.S. commit to reducing emissions in support of #AmericasPledge. Together, we will continue to work towards our #ParisAgreement goals to ensure a clean, safe environment for all.//t.co/ZhLwKOpvro",FALSE,TRUE,NA,NA
Paul Polman,988330316283764736,2018-04-23T08:14:44Z,Good to see latest #innovation from @Domestos launched in South Africa. Flush Less Toilet Spray will still keep your toilet clean but reduces flushing. Saves 9 litres of water a flush #capetownwatercrisis//t.co/iUZuwfNbUk,FALSE,FALSE,NA,innovation
Paul Polman,988330316283764736,2018-04-23T08:14:44Z,Good to see latest #innovation from @Domestos launched in South Africa. Flush Less Toilet Spray will still keep your toilet clean but reduces flushing. Saves 9 litres of water a flush #capetownwatercrisis//t.co/iUZuwfNbUk,FALSE,FALSE,NA,capetownwatercrisis
Paul Polman,988050014147670016,2018-04-22T13:40:55Z,More than 100mn extra people could be pushed into poverty by 2030 due to #climatechange putting #SDGs further out of reach. Let's accelerate climate action for all SDGs #2020dontbelate @TheGlobalGoals//t.co/uTZ6Cc4lnH,FALSE,FALSE,NA,climatechange
Paul Polman,988050014147670016,2018-04-22T13:40:55Z,More than 100mn extra people could be pushed into poverty by 2030 due to #climatechange putting #SDGs further out of reach. Let's accelerate climate action for all SDGs #2020dontbelate @TheGlobalGoals//t.co/uTZ6Cc4lnH,FALSE,FALSE,NA,SDGs
Paul Polman,988050014147670016,2018-04-22T13:40:55Z,More than 100mn extra people could be pushed into poverty by 2030 due to #climatechange putting #SDGs further out of reach. Let's accelerate climate action for all SDGs #2020dontbelate @TheGlobalGoals//t.co/uTZ6Cc4lnH,FALSE,FALSE,NA,2020dontbelate
Paul Polman,988029678609985536,2018-04-22T12:20:06Z,Credit to @Starbucks . A great example of always putting people first. @Unilever//t.co/rVpt7Dp4Vl,FALSE,FALSE,NA,NA
Paul Polman,987960166200086528,2018-04-22T07:43:53Z,"Addressing #plasticpollution is a shared responsibility. We need to go much further, much faster to lead the transition towards a #circulareconomy #EarthDay2018//t.co/H7sIalPYNo",FALSE,FALSE,NA,plasticpollution
Paul Polman,987960166200086528,2018-04-22T07:43:53Z,"Addressing #plasticpollution is a shared responsibility. We need to go much further, much faster to lead the transition towards a #circulareconomy #EarthDay2018//t.co/H7sIalPYNo",FALSE,FALSE,NA,circulareconomy
Paul Polman,987960166200086528,2018-04-22T07:43:53Z,"Addressing #plasticpollution is a shared responsibility. We need to go much further, much faster to lead the transition towards a #circulareconomy #EarthDay2018//t.co/H7sIalPYNo",FALSE,FALSE,NA,EarthDay2018
Paul Polman,987761054460579840,2018-04-21T18:32:41Z,Agree with @sirkensingtons founder Scott crucial that values of business align if it is to work. Great to be working closely together to achieve shared goals #sustainablebusiness #HappyAnniversary @Unilever//t.co/Kx403rx0OT,TRUE,FALSE,NA,sustainablebusiness
Paul Polman,987761054460579840,2018-04-21T18:32:41Z,Agree with @sirkensingtons founder Scott crucial that values of business align if it is to work. Great to be working closely together to achieve shared goals #sustainablebusiness #HappyAnniversary @Unilever//t.co/Kx403rx0OT,TRUE,FALSE,NA,HappyAnniversary
Paul Polman,987741230967808000,2018-04-21T17:13:55Z,It is clear that the economic case drive fast conversion away from coal. Half of coal plants closed in last few years in US. Despite sad policy reversal. Business has chosen. Direction clear . @WMBtweets @EnvDefenseFund @wbcsd @globalcompact //t.co/g8I4RV0XHZ,FALSE,FALSE,NA,NA
Paul Polman,987722587705872384,2018-04-21T15:59:50Z,More good news this week from the UK @CostaCoffee latest to address issue of single-use cups. Good momentum building across industries. #Collectiveaction is way forward//t.co/6BgHHLdNyy,TRUE,FALSE,NA,Collectiveaction
Paul Polman,987721801215172608,2018-04-21T15:56:43Z,Honoured to be appointed by @UN Secretary-General @antonioguterres & looking forward to working with Bola Adesola to continue Sir Mark Moody-Stuart's work. Never been a more important time to accelerate action by business to achieve #SDGs//t.co/MbDU3uCXMr,TRUE,FALSE,NA,SDGs
Paul Polman,987662410600337413,2018-04-21T12:00:43Z,"We need to enable all people to have healthy & sustainable diets, produced responsibly, within the planetary boundaries - delighted to participate in FReSH session at the Lead Delegates' meeting of the World Business Council on #SustainableDevelopment in #Montreux. #SDGs//t.co/zLl5J5jh4y",FALSE,TRUE,NA,NA
Paul Polman,987450570628837376,2018-04-20T21:58:56Z,Certainly look forward to it @OneYoungWorld The Hague. Proud to meet in my native country. Young key part of success @SDG2030//t.co/kiWhlk41Wr,TRUE,FALSE,NA,NA
Paul Polman,987284410864230400,2018-04-20T10:58:41Z,Great to see @DanoneNA become the largest certified @BCorporation in the world. Good that a growing number of companies are engaging with the movement - proving #sustainable business is the way forward//t.co/ObhF913DoQ,FALSE,FALSE,NA,sustainable
Paul Polman,987279194882232320,2018-04-20T10:37:57Z,Great to see missing industries moving as well. Companies will reward green transport also at sea. Commitments right direction but not yet bold enough. Transparency hopefully will lead to race to too. Time we all contribute. @WMBtweets @TheGlobalGoals //t.co/qFyd84XHeF,FALSE,FALSE,NA,NA
Paul Polman,987104010221096964,2018-04-19T23:01:50Z,With the amazing #NCESummit2018 team working with passion and energy to create a better world for all. Thanks for all you are doing. The world needs you @NewClimateEcon @WeMeanBusiness_ @globalcompact @wef @wbcsd @thebteamhq @Unilever//t.co/dqFWJB5OWa,FALSE,FALSE,NA,NCESummit2018
Paul Polman,986693932233916416,2018-04-18T19:52:19Z,Pleased @Unilever is aligning with the #ParisAgreement through @sciencetargets. Showing the world that #climate action is achievable and makes business sense too//t.co/pCYgPToERB #ScienceBasedTargets//t.co/jNA9qGuVgp,TRUE,FALSE,NA,ParisAgreement
Paul Polman,986693932233916416,2018-04-18T19:52:19Z,Pleased @Unilever is aligning with the #ParisAgreement through @sciencetargets. Showing the world that #climate action is achievable and makes business sense too//t.co/pCYgPToERB #ScienceBasedTargets//t.co/jNA9qGuVgp,TRUE,FALSE,NA,climate
Paul Polman,986693932233916416,2018-04-18T19:52:19Z,Pleased @Unilever is aligning with the #ParisAgreement through @sciencetargets. Showing the world that #climate action is achievable and makes business sense too//t.co/pCYgPToERB #ScienceBasedTargets//t.co/jNA9qGuVgp,TRUE,FALSE,NA,ScienceBasedTargets
Paul Polman,986692482552553478,2018-04-18T19:46:34Z,Great opportunity to join series of free webinars hosted by @DowChemical and @erbinstitute providing insight on how to make a #sustainable difference #DowSustSeries #Earthday//t.co/Uts5nPYoAv//t.co/M7Wo4LNU3k,FALSE,FALSE,NA,sustainable
Paul Polman,986692482552553478,2018-04-18T19:46:34Z,Great opportunity to join series of free webinars hosted by @DowChemical and @erbinstitute providing insight on how to make a #sustainable difference #DowSustSeries #Earthday//t.co/Uts5nPYoAv//t.co/M7Wo4LNU3k,FALSE,FALSE,NA,DowSustSeries
