name,status_id,created_at,text,is_quote,is_retweet,reply_to_user_id,hashtags
Paul Polman,1069542569695240193,2018-12-03T10:43:14Z,"Biz needs 3 things from the political community: clarity, confidence & courage. The more of these that the global biz community can see, the greater & more transformational will be the biz response #AmbitionLoop @WeMeanBusiness @WorldResources//t.co/L7OSkY1PrB",TRUE,FALSE,NA,AmbitionLoop
Paul Polman,1069343657952714752,2018-12-02T21:32:50Z,"G20 Brown to Green Report 2018 , the world's most comprehensive review of G20 climate action. It provides concise and comparable information on G20 country mitigation action, finance and vulnerability. @ClimateT_G20//t.co/2isa8GRzqF",FALSE,FALSE,NA,NA
Paul Polman,1069285890294456321,2018-12-02T17:43:17Z,"Encouraging news for us all as @EU_Commission adopts ambitious new strategy we need a #ClimateNeutralEU by 2050 to ensure the future of our planet. Urgent, transformational action required, thanks to @theBteamHQ, @WMBTweets, @ClimateCLG for support//t.co/rFYJqfkmO5",TRUE,FALSE,NA,ClimateNeutralEU
Paul Polman,1069285603911614465,2018-12-02T17:42:08Z,Great to see @HourglassMakeup #CrueltyFree #Vegan//t.co/puKYTGaB4e,TRUE,FALSE,NA,CrueltyFree
Paul Polman,1069285603911614465,2018-12-02T17:42:08Z,Great to see @HourglassMakeup #CrueltyFree #Vegan//t.co/puKYTGaB4e,TRUE,FALSE,NA,Vegan
Paul Polman,1068867592222375936,2018-12-01T14:01:07Z,Indeed a long way to go still with the press. Not surprising they are low on the Edelman trust scale. Wish they would be more of a part of the solution. But then they need to sell next days edition.//t.co/oyxf0D4GcQ,TRUE,FALSE,NA,NA
Paul Polman,1068550084361625601,2018-11-30T16:59:27Z,Wonderful Q&A session with youth entrepreneurs and innovators #GPDF18 @PaulPolman//t.co/McuE12vbA8,FALSE,TRUE,NA,GPDF18
Paul Polman,1068048547294138368,2018-11-29T07:46:31Z,"It has been a true privilege to be @Unilever's CEO, I will always remain a passionate advocate for all the company stands for, immensely proud of what we have achieved over the past 10 year, & will continue to work towards making sustainability commonplace//t.co/t56TJ7N0tA//t.co/1lIvcK5z97",FALSE,FALSE,NA,NA
Paul Polman,1068046669688827904,2018-11-29T07:39:04Z,"I have no doubts that I will be leaving the company in excellent hands. Under Alan's leadership @Unilever is well-placed to prosper long into the future, staying true to the values which make it so special, and continue to do well by doing good//t.co/uXL1ay8mPk//t.co/vIF3237Oxp",FALSE,FALSE,NA,NA
Paul Polman,1068045060023955456,2018-11-29T07:32:40Z,"As I prepare to step down as CEO, I reflect & am humbled by the incredible passion & dedication of our people, & their unwavering commitment to creating a thriving, purpose-driven business. Thank you to all for being such wonderful colleagues & friends//t.co/t56TJ7N0tA//t.co/jaEUqJ59IC",FALSE,FALSE,NA,NA
Paul Polman,1068042467872841728,2018-11-29T07:22:22Z,Today @Unilever has announced my decision to step down from my role as CEO. It's been a great honour to lead this team for the past 10 years and together build a #sustbiz that has made a difference to millions of lives//t.co/uXL1ay8mPk//t.co/ihApr0KhlM,FALSE,FALSE,NA,sustbiz
Paul Polman,1067968213001080833,2018-11-29T02:27:18Z,"""...Climate Change now poses a greater threat to our way of life than many of the military threats of the 20th century..."" In this op-ed, @Unilever CEO @PaulPolman explains why the fight against climate change is a fight for our way of life//t.co/HWqyVxaIPE",FALSE,TRUE,NA,NA
Paul Polman,1067769337015087104,2018-11-28T13:17:02Z,"If you won the life lottery and were born somewhere safe, with enough to eat, with access to education, and choice about your life, isn't it your duty to put yourself to the service of those who were not? #WednesdayWisdom//t.co/RbECanQD9g",FALSE,FALSE,NA,WednesdayWisdom
Paul Polman,1067474195070750721,2018-11-27T17:44:15Z,"Coca-Cola, Unilever and Danone call for net zero emissions by 2025 Absoluteky key if we want to get to sustainable and equitable growth. @Unilever//t.co/c88us8Mjbg",FALSE,FALSE,NA,NA
Paul Polman,1067352464196816896,2018-11-27T09:40:32Z,"Pleased @Unilever is partnering with @Ioniqa, who are building a factory capable of continuously upcycling 10,000 tonnes of PET plastic one of the most commonly used. Currently only 10-20% reused globally//t.co/9zW406BPZk//t.co/oi4Ih0bGHL",FALSE,FALSE,NA,NA
Paul Polman,1067023390559674373,2018-11-26T11:52:55Z,How often do we show respect to nature? Human consumption is the force behind planetary change; #SDGs give us the tools to prevent this from progressing//t.co/jIgWl5rhrU,FALSE,FALSE,NA,SDGs
Paul Polman,1066638928244035584,2018-11-25T10:25:12Z,"Dutch Famine killed over 22,000 people betwn 1944-45. THIS TINY COUNTRY FEEDS THE WORLD. Netherlands has become an agricultural giant by showing what the future of farming could look like. Kenya can learn important lessons from them. @KvanOosterom//t.co/QBWm4RL9Ge//t.co/kf9dpJVsW3",FALSE,TRUE,NA,NA
Paul Polman,1066622707599585280,2018-11-25T09:20:45Z,Unilever global boss backs State effort to cut plastic waste//t.co/p3ZhCxvccW via @StandardKenya,FALSE,FALSE,NA,NA
Paul Polman,1066602411148623872,2018-11-25T08:00:05Z,Great leadership from Sanjiv Mehta @HUL_News @Unilever Setting once more standards of responsible corporate behavior.//t.co/xUOnzpd3Xb,FALSE,FALSE,NA,NA
Paul Polman,1066443306165387264,2018-11-24T21:27:52Z,"We can #EndGunViolenceTogether. Start by visiting//t.co/pP11UeXzL3 today to send a postcard to your Representatives,demanding that they take action on something more than 90% of Americans agree on:universal background checks. @TOMS @WMBtweets @enactus @OneYoungWorld",FALSE,FALSE,NA,EndGunViolenceTogether
Paul Polman,1065869781490909184,2018-11-23T07:28:53Z,Kevin Carey talking at the launch of the new Orbit machine in Kenya with #KBT #myvision Now technology will be available for all @kiliblindtrust .Please help more children get access to education by donating to//t.co/Y39jsjy21V//t.co/opCpSpmrFD,FALSE,FALSE,NA,KBT
Paul Polman,1065869781490909184,2018-11-23T07:28:53Z,Kevin Carey talking at the launch of the new Orbit machine in Kenya with #KBT #myvision Now technology will be available for all @kiliblindtrust .Please help more children get access to education by donating to//t.co/Y39jsjy21V//t.co/opCpSpmrFD,FALSE,FALSE,NA,myvision
Paul Polman,1065867431292428288,2018-11-23T07:19:33Z,Starting a wonderful day in Nairobi for #KBTA #myvision unlocking literacy for life. Launch of Orbit Braille at Kilimani primary school @kiliblindtrust @Unilever @SafaricomPLC//t.co/Ww9Z3eFr7t,FALSE,FALSE,NA,KBTA
Paul Polman,1065867431292428288,2018-11-23T07:19:33Z,Starting a wonderful day in Nairobi for #KBTA #myvision unlocking literacy for life. Launch of Orbit Braille at Kilimani primary school @kiliblindtrust @Unilever @SafaricomPLC//t.co/Ww9Z3eFr7t,FALSE,FALSE,NA,myvision
Paul Polman,1065643682299293696,2018-11-22T16:30:27Z,"We the people have the ability to solve all these problems facing us, if we just get about it. If you want to be a change maker do it. Start. @hlovins. #climatechange #naturalcapitalism//t.co/vdXylXWBYD",FALSE,FALSE,NA,climatechange
Paul Polman,1065643682299293696,2018-11-22T16:30:27Z,"We the people have the ability to solve all these problems facing us, if we just get about it. If you want to be a change maker do it. Start. @hlovins. #climatechange #naturalcapitalism//t.co/vdXylXWBYD",FALSE,FALSE,NA,naturalcapitalism
Paul Polman,1065316421356404739,2018-11-21T18:50:02Z,"Society, environment, personal development. While we're all capable of doing great things alone, together we can do so much more #CollectiveAction #WednesdayWisdom//t.co/bp2St30FUK",FALSE,FALSE,NA,CollectiveAction
Paul Polman,1065316421356404739,2018-11-21T18:50:02Z,"Society, environment, personal development. While we're all capable of doing great things alone, together we can do so much more #CollectiveAction #WednesdayWisdom//t.co/bp2St30FUK",FALSE,FALSE,NA,WednesdayWisdom
Paul Polman,1064979755211124737,2018-11-20T20:32:14Z,"When we're fulfilled at work, we bring positive energy and happiness into our personal lives. Completely agree, congratulations @DanSchawbel on your new book launch #BacktoHuman",FALSE,FALSE,NA,BacktoHuman
Paul Polman,1064975417688424450,2018-11-20T20:15:00Z,Great to see socially responsible companies doing well. No sugar certainly helps. @wonderchup//t.co/KzVl2Ltveg,TRUE,FALSE,NA,NA
Paul Polman,1064974118183976965,2018-11-20T20:09:50Z,"Mitigating climate change is, by far, the greatest challenge of our time. Great news that EK joins the CLC climate initiative: Climate policy ambition must be raised to correspond to the 1.5 C target @Unilever @WMBtweets @globalcompact @ICCSecGen @wbcsd//t.co/zWDFRT2Gt8",FALSE,FALSE,NA,NA
Paul Polman,1064545226415644678,2018-11-19T15:45:34Z,More than half the world's population do not have access to safe sanitation. Pleased the @gatesfoundation is seeing this enormous challenge as an enormous opportunity//t.co/fyYytasbTS #ReinventedToilet #WorldToiletDay//t.co/S3DWd6M6G3,FALSE,FALSE,NA,ReinventedToilet
Paul Polman,1064545226415644678,2018-11-19T15:45:34Z,More than half the world's population do not have access to safe sanitation. Pleased the @gatesfoundation is seeing this enormous challenge as an enormous opportunity//t.co/fyYytasbTS #ReinventedToilet #WorldToiletDay//t.co/S3DWd6M6G3,FALSE,FALSE,NA,WorldToiletDay
Paul Polman,1064474238416052224,2018-11-19T11:03:30Z,"A toilet should not be a privilege. @Unilever, @DomestosUK & @UNICEF partnership has given 10m+ people a safe & clean toilet - great progress and even greater to come #WorldToiletDay//t.co/oPRe9sLhPl",FALSE,FALSE,NA,WorldToiletDay
Paul Polman,1064254879324082177,2018-11-18T20:31:50Z,Great article and thanks for leadership. The disruptors: How Jeremy Oppenheim is leading the charge for systems change @SYSTEMIQ_Ltd//t.co/vXVZyF41YW,FALSE,FALSE,NA,NA
Paul Polman,1064250285554581506,2018-11-18T20:13:35Z,#SDGs are as much a challenge as they are an opportunity and companies are already benefiting from tackling them. @Trucost//t.co/IaFON1g8V7,FALSE,FALSE,NA,SDGs
Paul Polman,1064198492061687809,2018-11-18T16:47:47Z,ET Awards 2018 for Corporate Citizen goes to Hindustan Unilever - Well deserved and powerful speech @Unilever //t.co/PIHp14zIWI via @economictimes,FALSE,FALSE,NA,NA
Paul Polman,1064173239327432706,2018-11-18T15:07:26Z,It's indeed time for more companies to speak up. Thank you @apple @mars for leading US companies. Time consumers vote with their wallets. //t.co/JKq5WJNnmK,FALSE,FALSE,NA,NA
Paul Polman,1064165635763200000,2018-11-18T14:37:13Z,"Young people are choosing to engage with the brands that share their values and beliefs. In fact, 64 percent of consumers around the world now buy on belief. @unilever @OneYoungWorld @globalcompact @enactus @iccwbo @KianBakhtiari//t.co/OFAKzKF43W",FALSE,FALSE,NA,NA
Paul Polman,1063562444407283713,2018-11-16T22:40:21Z,"Authenticity is a straightforward idea but hard to practice. I define authentic leadership as: understanding your purpose, leading with heart, establishing connected relationships, & demonstrating self-discipline. Learn more in my free eBook Lead True.//t.co/Q6Yr7nZFgR//t.co/2JbaRLHlm2",FALSE,TRUE,NA,NA
Paul Polman,1063373249051013122,2018-11-16T10:08:33Z,.@WEMovement and Lipton are committed to providing tea farmers with tools and training that extend beyond the field.//t.co/NcgGGPmkRT,FALSE,TRUE,NA,NA
Paul Polman,1063371819309301765,2018-11-16T10:02:52Z,"Pleased EU Parliament is following the call from @EDFofficiel @Unilever @ENGIEgroup and more, to map clear path to #netzero by 2050. Biz needs clear, long-term signals from govts to give them the certainty they need to go further, faster//t.co/P9Ew185DDf",FALSE,FALSE,NA,netzero
Paul Polman,1063123525093994498,2018-11-15T17:36:14Z,Renewable energy is good for the planet and good for business. That's why we're one of 155 companies driving the global shift to a clean economy through #RE100. Read the new report://t.co/H1IR10QgUE @ClimateGroup @CDP #SustBiz//t.co/R6AN7bnb39,FALSE,TRUE,NA,NA
Paul Polman,1063058316203646976,2018-11-15T13:17:07Z,A big honour yet so much more to do. We can not stop until we fully eradicate . @Unilever//t.co/jn3T7CorRE,TRUE,FALSE,NA,NA
Paul Polman,1063025882003107840,2018-11-15T11:08:14Z,"More than ever we need new types of collaboration, innovation & partnerships to drive #collectiveaction for a more #sustainable future. Achieving #SDGs is your duty as much as it's mine//t.co/wPpXTG658Y",FALSE,FALSE,NA,collectiveaction
Paul Polman,1063025882003107840,2018-11-15T11:08:14Z,"More than ever we need new types of collaboration, innovation & partnerships to drive #collectiveaction for a more #sustainable future. Achieving #SDGs is your duty as much as it's mine//t.co/wPpXTG658Y",FALSE,FALSE,NA,sustainable
Paul Polman,1063025882003107840,2018-11-15T11:08:14Z,"More than ever we need new types of collaboration, innovation & partnerships to drive #collectiveaction for a more #sustainable future. Achieving #SDGs is your duty as much as it's mine//t.co/wPpXTG658Y",FALSE,FALSE,NA,SDGs
Paul Polman,1063021757290999809,2018-11-15T10:51:51Z,More than a household stapleVaseline Jelly is helping to improve skin health worldwide. Watch and see how.//t.co/3JSytI0uNK,FALSE,TRUE,NA,NA
Paul Polman,1062643559709503489,2018-11-14T09:49:02Z,We are so proud to make the list of Best Companies for Dads @Unilever//t.co/XGfuj9Q30d,FALSE,FALSE,NA,NA
Paul Polman,1062614461998096384,2018-11-14T07:53:24Z,"It's an exciting time to be part of a fast changing world of business, and instilling your own purpose in what you do is becoming more and more important #WednesdayWisdom//t.co/oeniNfF5CW",FALSE,FALSE,NA,WednesdayWisdom
Paul Polman,1062406945661952006,2018-11-13T18:08:49Z,"Humbled to be included in the @womenoffuture's #50LeadingLights Kindness in Leadership list alongside such impressive peers. Congratulations to all, keep up positive work, kindness sorely lacking in our world.//t.co/yKPFJDEsxU",FALSE,FALSE,NA,50LeadingLights
Paul Polman,1062250198133542917,2018-11-13T07:45:57Z,"It's so simple, kindness does not cost anywhere near as much as it accomplishes. A better world relies on the actions of us all #WorldKindnessDay//t.co/0S7b9960lw",FALSE,FALSE,NA,WorldKindnessDay
Paul Polman,1062244114517934080,2018-11-13T07:21:47Z,"Great to see staff from the UN @globalcompact office in New York meeting with our #LocalNetworks around the world to further increase collaboration and knowledge-sharing. This week, we meet with #LatAm Networks to push our mission forward.//t.co/ElcNpkC7Vx",FALSE,TRUE,NA,LocalNetworks
Paul Polman,1062032581632421888,2018-11-12T17:21:13Z,"Honoured to be #PrixVoltaire Award recipient, thank you for this accolade. We all need to keep fighting to create change in the world. To quote #Voltaire: One day everything will be well, that is our hope. Everything is fine today, that is our illusion//t.co/iyXwZG0IIL",FALSE,FALSE,NA,PrixVoltaire
Paul Polman,1062032581632421888,2018-11-12T17:21:13Z,"Honoured to be #PrixVoltaire Award recipient, thank you for this accolade. We all need to keep fighting to create change in the world. To quote #Voltaire: One day everything will be well, that is our hope. Everything is fine today, that is our illusion//t.co/iyXwZG0IIL",FALSE,FALSE,NA,Voltaire
Paul Polman,1061950632578428929,2018-11-12T11:55:35Z,"Great to see the #EmbarkMentorship programme, which connects young Syrian Refugees with Turkish Business Leaders in @UnileverTurkey, being showcased at the @ParisPeaceForum//t.co/2N81OJ9rs7",FALSE,FALSE,NA,EmbarkMentorship
Paul Polman,1061717657383305219,2018-11-11T20:29:49Z,"The urgency for biz to mitigate its #carbonfootprint can't be ignored. If you cannot explain as a company what you are doing to protect our planet, you have no reason for being//t.co/zKEv8pwkup",FALSE,FALSE,NA,carbonfootprint
Paul Polman,1061574729503571973,2018-11-11T11:01:53Z,Great to see @healrworld .SDG's in action. New Jersey Asserts Leadership in Innovation with Launch of Sustainable Business Accelerator by @5ccollective//t.co/TNsUk0nODy,FALSE,FALSE,NA,NA
Paul Polman,1061537274582708225,2018-11-11T08:33:03Z,Congratulations @Benioff and others for fighting for homeless.Time that business strengthens its social contract and not just fights any tax.Clear if you go there and many other cities that there is a problem.We all own it.//t.co/S9HO1Bjexu @Unilever @thebteamhq @iccwbo,FALSE,FALSE,NA,NA
Paul Polman,1061307744375005184,2018-11-10T17:20:59Z,"In Washington State,oil companies led by BP America, Phillips 66, and Andeavor spent $30 mio + to defeat Initiative 1631, country's first-ever carbon fee. Proceeds from worst polluters was meant for clean-energy infrastructure and investments to adapt to effects of climate change",FALSE,FALSE,NA,NA
Paul Polman,1061284843005337600,2018-11-10T15:49:58Z,Great to see the great work done with refugees in Turkey. Simply showing respect and bringing humanity back. Credit to all . @Unilever @Xynteo @RefugePt About Embark video//t.co/gh5666CRau via @YouTube.,FALSE,FALSE,NA,NA
Paul Polman,1061027943533686784,2018-11-09T22:49:09Z,"""No child should suffer from illnesses we know how to prevent. Gavi's passion & commitment are at the heart of what's needed to create a world where every child can grow up healthy & happy & have the opportunity to become successful adults."" ~@PaulPolman, CEO @Unilever #GotLife//t.co/4RYbGX8Jz8",FALSE,TRUE,NA,NA
Paul Polman,1061027264878518272,2018-11-09T22:46:27Z,We need to reimagine the future of work and employment. Here's how I believe we can do it.//t.co/6jd5PpyRHe @wef @Unilever @paulpolman #futureofwork #Hr #hrtribe//t.co/Hb5hpGQSjT,FALSE,TRUE,NA,NA
Paul Polman,1060597785555288065,2018-11-08T18:19:51Z,Delighted @Unilever has launched our first #WomenInTech network to enhance skills and build a community of colleagues and mentors. Congratulations on launch and thank you to all involved //t.co/mZ8ruOaHWK//t.co/2NftD9zwah,FALSE,FALSE,NA,WomenInTech
Paul Polman,1060489454392090624,2018-11-08T11:09:23Z,A woman dies in childbirth in Nigeria every 10 mins. @pjlalah is working to change that & make birth safer for women. Congrats again to our winner of the Prince of Wales Prize at @Unilever's Young Entrepreneur Awards 2018 @brownbutton_org #maternalhealth//t.co/bVjn8cgeVC,FALSE,FALSE,NA,maternalhealth
Paul Polman,1060466708132126720,2018-11-08T09:39:00Z,Love it :). Thanks to all. Gender balance key for any successful business. @Unilever//t.co/6EZLrLC3I9,TRUE,FALSE,NA,NA
Paul Polman,1060423487070838784,2018-11-08T06:47:15Z,".@PaulPolman on the Brown to Green Report, which ""sends a strong signal that financial markets and #economic development are dependent on ambitious #ClimateAction"". Join the online launch of the #B2Greport on 14 November 2018 (16:00-17:00 CET)://t.co/0iwKzfv2sP #G20//t.co/nMRbOGmdcb",FALSE,TRUE,NA,economic
Paul Polman,1060118863952707584,2018-11-07T10:36:47Z,You are not fighting a cause alone or dreaming alone. @OneYoungWorld is a place where a generation can express their creativity and work together to create positive change for our world. #OYW2018 //t.co/Ww9E5rG3nt,FALSE,FALSE,NA,OYW2018
Paul Polman,1059404687085105152,2018-11-05T11:18:54Z,Conserving what we currently have will not solve the problem we need powerful innovations and radical societal change to protect ourselves and our planet//t.co/9XNN4XigEO,FALSE,FALSE,NA,NA
Paul Polman,1059161515687886850,2018-11-04T19:12:38Z,"""These are exceptional young leaders, finding solutions to some of the biggest challenges facing humanity and helping to make this a better world for all. Together they are an unstoppable force for good."" - @PaulPolman, CEO, @Unilever #biz4good #SDGs//t.co/JDVy02fAsy",FALSE,TRUE,NA,NA
Paul Polman,1059161413619539969,2018-11-04T19:12:13Z,"We need to tackle unconscious bias, it continues to hold us back as a society and stops us realising true equality #SDG5 #HeforShe//t.co/OZghr09MVg",FALSE,FALSE,NA,SDG5
Paul Polman,1059161413619539969,2018-11-04T19:12:13Z,"We need to tackle unconscious bias, it continues to hold us back as a society and stops us realising true equality #SDG5 #HeforShe//t.co/OZghr09MVg",FALSE,FALSE,NA,HeforShe
Paul Polman,1058726565155094530,2018-11-03T14:24:17Z,"Given half a chance, young people will change the world -//t.co/JC6GDT3fSi #GoogleAlerts",FALSE,FALSE,NA,GoogleAlerts
Paul Polman,1058723640605315072,2018-11-03T14:12:40Z,We need to step up focus on Food and Landuse is we want to tackle Climate change and eradicate poverty / achieve SDGs @Unilever @iccwbo @globalcompact//t.co/1ntvOthf7c,FALSE,FALSE,NA,NA
Paul Polman,1058722103787175936,2018-11-03T14:06:34Z,Probably one of the biggest intergenerational crimes we are committing if we don't reverse the trend on climate change and stay below 1.5 degrees. Can still be done. @WMBtweets @NewClimateEcon @UNFCCC @Unilever//t.co/nyMDYIcYia,FALSE,FALSE,NA,NA
Paul Polman,1058671402176385024,2018-11-03T10:45:06Z,"What we do to the forests of this world is a mere reflection of what we do to ourselves and one another. Gandhi Stop biodiversity loss or we could face our own extinction, warns UN//t.co/9lzZkIP8XA",FALSE,FALSE,NA,NA
Paul Polman,1058640742053232640,2018-11-03T08:43:16Z,Why is the EU Failing to Champion the SDGs? - CIRSD//t.co/sAZkJnAoEZ,FALSE,FALSE,NA,NA
Paul Polman,1058407163272593408,2018-11-02T17:15:06Z,"When you buy a bottle of Domestos, you don't just get germ kill for your home. You also support UNICEF's sanitation programmes to help people access cleaner and safer toilets. BUY A BOTTLE, SUPPORT UNICEF.//t.co/UmJX50P4Gy",FALSE,TRUE,NA,NA
Paul Polman,1058388625770102784,2018-11-02T16:01:26Z,"Why we act is just important as how we act. From our jobs and our families, to our planet act with purpose and with conviction.//t.co/kEfKfXBul8",FALSE,FALSE,NA,NA
Paul Polman,1058019151757873154,2018-11-01T15:33:17Z,Better data = better investment decisions. New @Acumen and @Unilever toolkit measures important impact of investment on women and girls @womeneffect #gendersmart//t.co/RHBKXAP9yp//t.co/xjW1eSp0gA,FALSE,FALSE,NA,gendersmart
Paul Polman,1057921360138289153,2018-11-01T09:04:42Z,Today marks the start of #globalmonthofplay with @OutdoorClassDay. Time to recognise the importance of play for us all #realplaycoalition @ikea @natgeo @legofoundation @persiluk//t.co/AiBengVN7A//t.co/0m2VU7siuF,FALSE,FALSE,NA,globalmonthofplay
Paul Polman,1057921360138289153,2018-11-01T09:04:42Z,Today marks the start of #globalmonthofplay with @OutdoorClassDay. Time to recognise the importance of play for us all #realplaycoalition @ikea @natgeo @legofoundation @persiluk//t.co/AiBengVN7A//t.co/0m2VU7siuF,FALSE,FALSE,NA,realplaycoalition
Paul Polman,1057775624985763845,2018-10-31T23:25:36Z,"Life is about purpose, not money. We need +want to leave the world in a better shape than we came into it. Young people get that. They get #biz4good. They need not only a seat at the table, but the whole table.' @PaulPolman at Young Entrepreneurs Award @YouthDeliver @Unilever//t.co/qhZPcNqXu6",FALSE,TRUE,NA,NA
Paul Polman,1057578033626918912,2018-10-31T10:20:26Z,The evidence of climate change is all around us. Anything to help tackle the #SDGs is welcome. Worth revisiting @sustainia report on how solving global problems are business opportunities.//t.co/qkwS6cflC6,FALSE,FALSE,NA,SDGs
Paul Polman,1057577403030126592,2018-10-31T10:17:56Z,"Super excited to win His Royal Highness, the 2018 Prince of Wales Young Sustainability Entrepreneur Award this evening in London. Thank you @PaulPolman of @Unilever and @cisl_cambridge for believing in me and the work that we do! Incredible win for mothers and babies everywhere!//t.co/dZmwcbSXCC",FALSE,TRUE,NA,NA
Paul Polman,1057369119635505152,2018-10-30T20:30:17Z,"Congrats to our HRH The Prince of Wales Young Sustainability Entrepreneur Winner @brownbutton_org! Making birth safer in Nigeria through sterilised kits &education. You make a difference to people's lives, Adepeju, I look forward to seeing your biz expand//t.co/NZd1rgURUx//t.co/NohP8necP8",FALSE,FALSE,NA,NA
Paul Polman,1057228290283487232,2018-10-30T11:10:41Z,More Than 20 Global Business and Civil Society Leaders Urge European Union to Step Up Its Ambition on Climate @WMBtweets @thebteamhq @Unilever @iccwbo @globalcompact//t.co/d8ubigLh8E,FALSE,FALSE,NA,NA
Paul Polman,1057212776194682880,2018-10-30T10:09:02Z,Congratulations to our @Unilever Young Entrepreneurs 2018 finalists. Extraordinary young people who are making a positive difference to the world #biz4good//t.co/zu6qfLZLSI//t.co/adzhjAzRLd,FALSE,FALSE,NA,biz4good
Paul Polman,1057166479987228672,2018-10-30T07:05:04Z,"Great to see #OYW2018 Counsellors @AngeDarlington, @PaulPolman and @antozappulla included in the @FT & @OUTstandingiB #LGBT Leaders & Allies list. And congratulations to #OYW Ambassador Sayid Abdullaev for being recognised as a Future Leader! //t.co/zXUxB5C76A",FALSE,TRUE,NA,OYW2018
Paul Polman,1057033309522399232,2018-10-29T22:15:54Z,"Pleased @Unilever has signed the @NewPlasticsEcon Global Commitment to tackle plastic pollution, alongside other biz and government. Collective action is key. #lineinthesand //t.co/SV1WutbTce//t.co/60Py0vJFJN",FALSE,FALSE,NA,lineinthesand
Paul Polman,1056900360248401920,2018-10-29T13:27:36Z,Wonderful to see 60 girls from around London gathered together over the weekend at our @Unilever Kingston office to decode the @UN @TheGlobalGoals for the @i_amthecode #Hackathon #SDGs//t.co/PWlWr9dEZ8,FALSE,FALSE,NA,Hackathon
Paul Polman,1056900360248401920,2018-10-29T13:27:36Z,Wonderful to see 60 girls from around London gathered together over the weekend at our @Unilever Kingston office to decode the @UN @TheGlobalGoals for the @i_amthecode #Hackathon #SDGs//t.co/PWlWr9dEZ8,FALSE,FALSE,NA,SDGs
