name,status_id,created_at,text,is_quote,is_retweet,reply_to_user_id,hashtags
Paul Polman,923600155709976576,2017-10-26T17:20:11Z,Companies must create both positive societal impact AND business benefits. We call this TSI: Total Societal Impact.//t.co/cWBYWUITa8//t.co/NTKoJazp11,FALSE,TRUE,NA,NA
Paul Polman,923516096971526145,2017-10-26T11:46:10Z,Proud to see many of our partners in supplychain included.Need more companies onboard and put planet first @Unilever//t.co/0mcKd6Ohe2,FALSE,FALSE,NA,NA
Paul Polman,923488006002094080,2017-10-26T09:54:32Z,Honour to be included @OUTstandingiB Ally Exec @FT. More to do. Equality & inclusion key for biz & SDGs//t.co/EdVTA4DUqO #OUTleaders//t.co/oFIXYuHsgl,FALSE,FALSE,NA,OUTleaders
Paul Polman,923221658445414400,2017-10-25T16:16:10Z,"Proud to pledge @Unilever support for #CerradoManifesto to halt deforestation in Cerrado, Brazil. Need more on board//t.co/11J7jarHK7",FALSE,FALSE,NA,CerradoManifesto
Paul Polman,923177527446614023,2017-10-25T13:20:49Z,Population growth huge challenge & biz opportunity to move to sust agriculture & renewables. $12 trillion minimum to be unlocked in #SDGs//t.co/rA8ehPh50i,FALSE,FALSE,NA,SDGs
Paul Polman,923155469467815936,2017-10-25T11:53:09Z,.@Unilever & @Danone among 13 #food & #drink companies commended for their #environmental commitment//t.co/TmLhCLnVu1 #CSR//t.co/nWx5OdZr9O,FALSE,TRUE,NA,food
Paul Polman,923155469467815936,2017-10-25T11:53:09Z,.@Unilever & @Danone among 13 #food & #drink companies commended for their #environmental commitment//t.co/TmLhCLnVu1 #CSR//t.co/nWx5OdZr9O,FALSE,TRUE,NA,drink
Paul Polman,923155469467815936,2017-10-25T11:53:09Z,.@Unilever & @Danone among 13 #food & #drink companies commended for their #environmental commitment//t.co/TmLhCLnVu1 #CSR//t.co/nWx5OdZr9O,FALSE,TRUE,NA,environmental
Paul Polman,922774932022550528,2017-10-24T10:41:02Z,"Proud to lead @CDP #AList of pioneers taking action in key sustainability areas. Drives growth, saves costs, reduces risk & fuels innovation//t.co/FtPKAULWy5",TRUE,FALSE,NA,AList
Paul Polman,922720112725159936,2017-10-24T07:03:12Z,We need to ensure that business applies same standards everywhere and basic human rights per Ruggie framework @BHRRC//t.co/BNPsQWamaq,FALSE,FALSE,NA,NA
Paul Polman,922717576366645250,2017-10-24T06:53:08Z,"Thanks @gibbulloch for speaking up on mental health ,reminding us of need to pursue passion but equally with purpose//t.co/Jh4AEHIY3r",FALSE,FALSE,NA,NA
Paul Polman,922712381171564544,2017-10-24T06:32:29Z,What a great initiative and example of circular economy in action. Exciting to see @ellenmacarthur @Unilever @Xynteo//t.co/Z0vklbNcCV,TRUE,FALSE,NA,NA
Paul Polman,922710671917281281,2017-10-24T06:25:41Z,A System where too many people feel excluded /not fully participating will ultimately rebel against itself @WMBtweets//t.co/NR3GDDPUAq,FALSE,FALSE,NA,NA
Paul Polman,922512597009817605,2017-10-23T17:18:37Z,48 million people victim of forced labour more than at height transatlantic slave trade.We can act now @UKAntiSlavery//t.co/Jvx1evcXnS,FALSE,FALSE,NA,NA
Paul Polman,922502719667146752,2017-10-23T16:39:22Z,"Slavery=human rights issue.Goal 8.7 SDG's eradicating forced labor,modern slavery,human trafficking. @UKAntiSlavery//t.co/WdXKEtv55I",FALSE,FALSE,NA,NA
Paul Polman,922426748960231424,2017-10-23T11:37:29Z,Great achievements by Domestos Toilet Academies- reached 619K people in India & Vietnam with 16K toilets. A basic human right & good for biz//t.co/pIXzv5Xi6q,FALSE,FALSE,NA,NA
Paul Polman,922204843539943424,2017-10-22T20:55:43Z,More investors also demanding climate risk reporting. Key to biz growth but also future of humanity//t.co/rU1qS9qAdw//t.co/Zh2rqJfX2P,TRUE,FALSE,NA,NA
Paul Polman,922125713842503682,2017-10-22T15:41:17Z,21 mio people in slavery.$150bn illegal industry.Only 9000 convictions!!!Not acting is crime itself Work supplychain//t.co/2OIgzxVtka,FALSE,FALSE,NA,NA
Paul Polman,921859370224443392,2017-10-21T22:02:55Z,"Purpose business first and foremost to serve society, not shareholders Is Capitalism Killing America? | Stanford Graduate School of Business",FALSE,FALSE,NA,NA
Paul Polman,921853062276317184,2017-10-21T21:37:51Z,It's indeed question of what type of world we want to live in.Prefer one with shared value for all Vote with wallet//t.co/pTS0qskn6A,FALSE,FALSE,NA,NA
Paul Polman,921847505352118278,2017-10-21T21:15:47Z,We should allbe @SDG2030 advocate striving for better world forall.More equitable/sustainable possible if less greed//t.co/0buexZo4uw,FALSE,FALSE,NA,NA
Paul Polman,921670356326338560,2017-10-21T09:31:51Z,Lots to be said for operating under the Golden Rule. World would be a better place. Permeates religions. @WMBtweets @enactus @OneYoungWorld//t.co/V6yYcfl27y,TRUE,FALSE,NA,NA
Paul Polman,921669260606365697,2017-10-21T09:27:30Z,"Calling everyone in C suite. All companies, all industries! Make clear you have an open door & open ears to hear about harassment #opendoor",FALSE,TRUE,NA,NA
Paul Polman,921668196331122688,2017-10-21T09:23:16Z,Can't think of better successor to lead @wbcsd than Sunny Verghese @Olam who is showing way to sustainable future in many ways @WMBtweets//t.co/NwK3vT684y,TRUE,FALSE,NA,NA
Paul Polman,921388313952612352,2017-10-20T14:51:07Z,Climate change destabilising food security.Action needed now more than ever.//t.co/egeScDcmqb,FALSE,FALSE,NA,NA
Paul Polman,921339160933347328,2017-10-20T11:35:48Z,It's the era of purpose-driven work. Profit and purpose not mutually exclusive//t.co/qcUbQu3Xt4//t.co/FhYgc2vqA0,FALSE,FALSE,NA,NA
Paul Polman,920864062401105920,2017-10-19T04:07:55Z,A great leader @DSM Feike Sijbesma passionate advocate for a better world. True leadership in action @AndrewSteerWRI//t.co/e7IW28vTMq,FALSE,FALSE,NA,NA
Paul Polman,920834047974297600,2017-10-19T02:08:39Z,Important that companies step up fight against modern day slavery in supply chain. @Unilever @enactus @OneYoungWorld//t.co/972MrgVlVK,FALSE,FALSE,NA,NA
Paul Polman,920660734522118145,2017-10-18T14:39:58Z,88% of execs say a long term approach improved biz performance. Clear case for adopting longer-term strategy//t.co/AgyuQIy4aU//t.co/qogBWDswMy,FALSE,FALSE,NA,NA
Paul Polman,920645489485336576,2017-10-18T13:39:24Z,Our Chief R&D Officer tells @bbcworldservice about our commitment to make all plastic packaging recyclable by 2025 -//t.co/xzM44Wc5L6,FALSE,TRUE,NA,NA
Paul Polman,920623176903790593,2017-10-18T12:10:44Z,Long Term Stock Exchange relevant today more than ever. Will help shift markets to guarantee long-term growth//t.co/qZ6Uek6gCl,FALSE,FALSE,NA,NA
Paul Polman,920515107746189313,2017-10-18T05:01:18Z,Strong and inspiring message from former President @FelipeCalderon on the importance of business sector to drive sustainability #CMmexico17//t.co/7JdoK3elAt,FALSE,TRUE,NA,NA
Paul Polman,920473491375304709,2017-10-18T02:15:56Z,With participants @wbcsd leadership program #CMmexico17 Great discussions and passionate leaders @Unilever @enactus//t.co/N9D4ZeCStt,FALSE,FALSE,NA,CMmexico17
Paul Polman,920411094937669634,2017-10-17T22:08:00Z,mental health is an issue that can effect us all.We need to take stigma out and put care for each other in on Vimeo //t.co/fOz4fF5UPQ,FALSE,FALSE,NA,NA
Paul Polman,920388388875853824,2017-10-17T20:37:46Z,Huge business opportunity to reshape #foodandlanduse system at threat//t.co/y6fhqiBmyS,TRUE,FALSE,NA,foodandlanduse
Paul Polman,920388068850520064,2017-10-17T20:36:30Z,"This isn't about ""feel good"" - it's about opportunities. Success depends on how well we serve society. #CMmexico17//t.co/sQR8WnXIRT",FALSE,TRUE,NA,CMmexico17
Paul Polman,920358143514890240,2017-10-17T18:37:35Z,Great talk @wbcsd by Ana Botin @santander on role business in society.Thanks for leading by example @WMBtweets//t.co/YgHOyCdf9E,FALSE,FALSE,NA,NA
Paul Polman,920315822551326721,2017-10-17T15:49:25Z,Many companies #CMmexico17 using SDG's to guide strategies.Minimum $12 trillion opportunity. @BizCommission @wbcsd//t.co/C7MrpQc3wu,FALSE,FALSE,NA,CMmexico17
Paul Polman,920313129233502210,2017-10-17T15:38:43Z,Great initiative @Rabobank launch $1bn fund driving sustainable farming #CMmexico17 @UNEP @wbcsd partnership inaction//t.co/FncLDAi1qC,FALSE,FALSE,NA,CMmexico17
Paul Polman,919912260256043008,2017-10-16T13:05:48Z,1.7M children die before age of 5 from preventable diseases. Need more programmes like Lifebuoy #high5forhandwashing #GlobalHandwashingDay//t.co/VXUmVQOX1G,FALSE,FALSE,NA,high5forhandwashing
Paul Polman,919912260256043008,2017-10-16T13:05:48Z,1.7M children die before age of 5 from preventable diseases. Need more programmes like Lifebuoy #high5forhandwashing #GlobalHandwashingDay//t.co/VXUmVQOX1G,FALSE,FALSE,NA,GlobalHandwashingDay
Paul Polman,919894251307225088,2017-10-16T11:54:14Z,Proud to support @Knorr's campaign with @WFP this World Food Day. RT the below to donate a meal and help combat hunger #ShareTheMeal #WFD17//t.co/rC690Vq13D,FALSE,TRUE,NA,NA
Paul Polman,919863904733458432,2017-10-16T09:53:39Z,"Reshaping #foodandlanduse system will benefit biz, economy & food security. All central to #SDGs//t.co/1IBSTAs8Rt #WorldFoodDay//t.co/kntlLZTIsQ",FALSE,FALSE,NA,foodandlanduse
Paul Polman,919863904733458432,2017-10-16T09:53:39Z,"Reshaping #foodandlanduse system will benefit biz, economy & food security. All central to #SDGs//t.co/1IBSTAs8Rt #WorldFoodDay//t.co/kntlLZTIsQ",FALSE,FALSE,NA,SDGs
Paul Polman,919863904733458432,2017-10-16T09:53:39Z,"Reshaping #foodandlanduse system will benefit biz, economy & food security. All central to #SDGs//t.co/1IBSTAs8Rt #WorldFoodDay//t.co/kntlLZTIsQ",FALSE,FALSE,NA,WorldFoodDay
Paul Polman,919629060564832257,2017-10-15T18:20:28Z,Great initiative once more @Walmart Transparency drives trust and trust is basis for prosperity @Unilever @wbcsd//t.co/BZ3vbIWGaG,FALSE,FALSE,NA,NA
Paul Polman,919591689957855237,2017-10-15T15:51:58Z,"Circular economy more more within reach @mike_earthshine Creates jobs,lowers cost,protects earth @circulareconomy//t.co/3wYIcUjRH0",FALSE,FALSE,NA,NA
Paul Polman,919572486634786817,2017-10-15T14:35:40Z,One remarkable features of Brexit negotiations is fact that 27 EU member states have shown more unity than 29 people around UK Cabinet table,FALSE,FALSE,NA,NA
Paul Polman,919542589153529857,2017-10-15T12:36:52Z,"Businesses have to be part of solution, not part of the problem, to be around for long term @Unilever @oneyoungworld//t.co/UlQIxouVi7",FALSE,FALSE,NA,NA
Paul Polman,919281915215171586,2017-10-14T19:21:02Z,Great interview @SashaChanoff Thanks for sharing and for what you do.Putting interest others first @OneYoungWorld //t.co/Lv5PhixRMI,FALSE,FALSE,NA,NA
Paul Polman,919254628046340097,2017-10-14T17:32:36Z,All we see is possibilities.A great initiative to restore sight for many.People do make a difference @OneYoungWorld //t.co/SDk7bFn4O7,FALSE,FALSE,NA,NA
Paul Polman,919216327310659591,2017-10-14T15:00:25Z,As long as more are obsessed with next quarter instead of next generation we are in trouble @RogerLMartin @Unilever//t.co/I07Bl4r8j4?,FALSE,FALSE,NA,NA
Paul Polman,919211151422033921,2017-10-14T14:39:51Z,Well done @Unilever Ghana for leading in country. Reaching now nearly 500 million people globally. Saving lives//t.co/iP5og3DU6Z,FALSE,FALSE,NA,NA
Paul Polman,919209422412541952,2017-10-14T14:32:59Z,Despite being one of biggest donors to @WFP we need to set goal to obsolete by fully eradicating hunger @Unilever//t.co/j401TTlbNH,FALSE,FALSE,NA,NA
Paul Polman,919128962063888384,2017-10-14T09:13:15Z,Honour to be recognised. Credit to all at @Unilever//t.co/yX6c1db9GZ @thebteamhq @wemeanbusiness @ConsciousCap,FALSE,FALSE,NA,NA
Paul Polman,918847612127731712,2017-10-13T14:35:16Z,Transparency builds trust and trust is basis for prosperity.Also good for politicians to walk the talk//t.co/gnTqjPX7mX,FALSE,FALSE,NA,NA
Paul Polman,918838316232990720,2017-10-13T13:58:20Z,Thanks to great discussion @Cornell .All helping build mission driven companies and a better world for all @Unilever//t.co/FEx6uMDKnS,FALSE,FALSE,NA,NA
Paul Polman,918823358355197952,2017-10-13T12:58:54Z,#FreedomForGirls means prioritising them in all #SDGs.Watch new #Goalkeepers17 film by @theGlobalGoals & take action//t.co/op0B4pikE6,FALSE,FALSE,NA,FreedomForGirls
Paul Polman,918823358355197952,2017-10-13T12:58:54Z,#FreedomForGirls means prioritising them in all #SDGs.Watch new #Goalkeepers17 film by @theGlobalGoals & take action//t.co/op0B4pikE6,FALSE,FALSE,NA,SDGs
Paul Polman,918823358355197952,2017-10-13T12:58:54Z,#FreedomForGirls means prioritising them in all #SDGs.Watch new #Goalkeepers17 film by @theGlobalGoals & take action//t.co/op0B4pikE6,FALSE,FALSE,NA,Goalkeepers17
Paul Polman,918780032436326400,2017-10-13T10:06:44Z,Research shows purpose-driven companies see stronger revenue growth. Strong biz case for driving shared value in the workplace.//t.co/R5zTAq7bto,FALSE,FALSE,NA,NA
Paul Polman,918494884268576768,2017-10-12T15:13:39Z,"Good to see climate change rising up investors' agendas, increasing demand for disclosure of climate-related risks//t.co/aKvdsz2SHC",FALSE,FALSE,NA,NA
Paul Polman,918493635460632576,2017-10-12T15:08:42Z,Indeed key to give young a bigger place at the table. Kenyan democracy in the hands of the young | openDemocracy//t.co/DZ16pjKGS4,FALSE,FALSE,NA,NA
Paul Polman,918283372186800128,2017-10-12T01:13:11Z,Highly appreciated and indeed we would not tolerate other values than respect and dignity for all. Its the glue that binds us.@Unilever//t.co/T7u5FMjU1e,TRUE,FALSE,NA,NA
Paul Polman,918227923731189760,2017-10-11T21:32:51Z,"Great see Ateam @Unilever Peru living purpose in action.Sustainable business,healthy business for generations to come//t.co/FIhcIt8vlX",FALSE,FALSE,NA,NA
Paul Polman,918185393719308288,2017-10-11T18:43:51Z,Only thing worse than being blind is having sight but no vision. Amazing talk @isaaclidsky Thanks @kiliblindtrust//t.co/7o44Dn4Vxr,FALSE,TRUE,NA,NA
Paul Polman,918184759716696065,2017-10-11T18:41:20Z,130m girls are not in school: sign the petition for leaders to #FundEducation &gt;&gt;//t.co/jsvnqHs6JR #GirlsCount//t.co/EZAy2f7Mdh,FALSE,FALSE,NA,FundEducation
Paul Polman,918184759716696065,2017-10-11T18:41:20Z,130m girls are not in school: sign the petition for leaders to #FundEducation &gt;&gt;//t.co/jsvnqHs6JR #GirlsCount//t.co/EZAy2f7Mdh,FALSE,FALSE,NA,GirlsCount
Paul Polman,918133039473025024,2017-10-11T15:15:49Z,Proud to be part. Not only key for future of business but more importantly future of humanity.//t.co/zndhEgL14e,FALSE,FALSE,NA,NA
Paul Polman,918132427943489536,2017-10-11T15:13:23Z,"Today is #dayofthegirl! EmPOWER girls to learn, to be what they want, to dream big. Read how #GirlsCrackTheCode//t.co/acVcobU3wg//t.co/hVDxAN7UQQ",FALSE,TRUE,NA,dayofthegirl
Paul Polman,918132427943489536,2017-10-11T15:13:23Z,"Today is #dayofthegirl! EmPOWER girls to learn, to be what they want, to dream big. Read how #GirlsCrackTheCode//t.co/acVcobU3wg//t.co/hVDxAN7UQQ",FALSE,TRUE,NA,GirlsCrackTheCode
Paul Polman,918132373069467648,2017-10-11T15:13:10Z,The growing momentum for #science-based targets via @GreenBiz. #ActOnClimate @sciencetargets //t.co/PbPZrmyByS//t.co/9uFEcKgPV7,FALSE,TRUE,NA,science
Paul Polman,918132373069467648,2017-10-11T15:13:10Z,The growing momentum for #science-based targets via @GreenBiz. #ActOnClimate @sciencetargets //t.co/PbPZrmyByS//t.co/9uFEcKgPV7,FALSE,TRUE,NA,ActOnClimate
Paul Polman,917723877953949696,2017-10-10T12:09:57Z,Broader perspective and unwavering commitment to work for inclusive world for all.The basis for humanity to function//t.co/DvgAeF5DJo,FALSE,FALSE,NA,NA
Paul Polman,917463221384175616,2017-10-09T18:54:12Z,In most cases better to generate race to top than run away. We need best energy companies to lead conversion.//t.co/jFFSk9l1Zl,FALSE,FALSE,NA,NA
Paul Polman,917455191456219137,2017-10-09T18:22:17Z,Despite trying don't always get it right.Especially on human values dignity and respect for all we can't compromise.//t.co/dKK6l4dAdL,FALSE,FALSE,NA,NA
Paul Polman,917399030287749121,2017-10-09T14:39:07Z,"Great vision #colombiasostenible Marcela Huertas.No development without peace,no peace without development @SDG2030//t.co/TdHjmQ6xnB",FALSE,FALSE,NA,colombiasostenible
Paul Polman,917396241767653378,2017-10-09T14:28:03Z,Vice minister environment @Colombia discusses comprehensive plan to create sustainable economy.makes economic sense//t.co/PEyILR7Tc2,FALSE,FALSE,NA,NA
Paul Polman,917163298176618497,2017-10-08T23:02:25Z,Discussed with @PaulPolman CEO @Unilever on collaboration with #SDGsAmbassadors & #corporatementorship to propel achievement of the #SDGs//t.co/i11tV3XI5p,FALSE,TRUE,NA,SDGsAmbassadors
Paul Polman,917163298176618497,2017-10-08T23:02:25Z,Discussed with @PaulPolman CEO @Unilever on collaboration with #SDGsAmbassadors & #corporatementorship to propel achievement of the #SDGs//t.co/i11tV3XI5p,FALSE,TRUE,NA,corporatementorship
Paul Polman,917163040654680064,2017-10-08T23:01:23Z,Unilever out of microbeats already long time whilst others have made future commitments! No compromise.Also see latest plastic commitment.//t.co/yG4xRcrc0a,TRUE,FALSE,NA,NA
Paul Polman,917024278918389761,2017-10-08T13:50:00Z,Today's youth have a stake in a better future and are playing an active role in achieving it. They are the #SDG generation #OYW//t.co/UR5RnQQuhN,TRUE,FALSE,NA,SDG
Paul Polman,917024278918389761,2017-10-08T13:50:00Z,Today's youth have a stake in a better future and are playing an active role in achieving it. They are the #SDG generation #OYW//t.co/UR5RnQQuhN,TRUE,FALSE,NA,OYW
Paul Polman,916986908701585408,2017-10-08T11:21:30Z,Achieving #SDGs will depend on citizens holding biz & government to account. This is where youth has a critical role to play. #OYW//t.co/gewNVXpuUR,TRUE,FALSE,NA,SDGs
Paul Polman,916986908701585408,2017-10-08T11:21:30Z,Achieving #SDGs will depend on citizens holding biz & government to account. This is where youth has a critical role to play. #OYW//t.co/gewNVXpuUR,TRUE,FALSE,NA,OYW
Paul Polman,916986245531742210,2017-10-08T11:18:52Z,"First page of a copie of Astronaut Ron GARAN book ""the orbital perspective"" that Ron dedicated to @PaulPolman #inspiration #oyw//t.co/78iWNKo3De",FALSE,TRUE,NA,inspiration
Paul Polman,916850123451314177,2017-10-08T02:17:58Z,@OneYoungWorld closing ceremony feeling the energy of all here working hard for a better world for all @SDG2030//t.co/Pab3kGKz7T,FALSE,FALSE,19087563,NA
Paul Polman,916603390863474688,2017-10-07T09:57:32Z,Fantastic team @unileverusa brining #WULF to #USA thanks @unilever for commitment to @_WomEng #WomEngUnilever @PaulPolman #gender #STEM//t.co/Iq9OrQMNLi,FALSE,TRUE,NA,WULF
Paul Polman,916603390863474688,2017-10-07T09:57:32Z,Fantastic team @unileverusa brining #WULF to #USA thanks @unilever for commitment to @_WomEng #WomEngUnilever @PaulPolman #gender #STEM//t.co/Iq9OrQMNLi,FALSE,TRUE,NA,USA
Paul Polman,916603390863474688,2017-10-07T09:57:32Z,Fantastic team @unileverusa brining #WULF to #USA thanks @unilever for commitment to @_WomEng #WomEngUnilever @PaulPolman #gender #STEM//t.co/Iq9OrQMNLi,FALSE,TRUE,NA,WomEngUnilever
Paul Polman,916601522791895040,2017-10-07T09:50:07Z,"""Law controls the lesser man, right conduct controls the greater man"". Confucius @OneYoungWorld @Unilever",FALSE,FALSE,NA,NA
Paul Polman,916547039340695552,2017-10-07T06:13:37Z,Great to connect with like-minded young leaders from across the world at @OneYoungWorld #OYW//t.co/pFjoysF57l,FALSE,FALSE,NA,OYW
Paul Polman,916256382848061441,2017-10-06T10:58:39Z,"Investment increasingly moving towards long-term growth, positive social impact. Now at $21tn in a global economy of $100tn//t.co/6qzqSoIoZp",FALSE,FALSE,NA,NA
Paul Polman,916020572110442496,2017-10-05T19:21:37Z,Outsourcing supply chain does not mean outsourcing responsibility.Forced labour in the increase globally. @Unilever //t.co/3CNvfhQm1k,FALSE,FALSE,NA,NA
Paul Polman,915984410536808448,2017-10-05T16:57:56Z,Celebrating Dove Day today. Reached 20 million young people with improved self-esteem. Empowering women & girls key to more inclusive world.//t.co/PHlDX8YcxV,FALSE,FALSE,NA,NA
Paul Polman,915865672634249221,2017-10-05T09:06:06Z,"Celebrate your individuality and the diversity of the people you know. Aim to be the best you can be, you are one of a kind! @OneYoungWorld",FALSE,FALSE,NA,NA
Paul Polman,915860937688657920,2017-10-05T08:47:18Z,@dove selfesteem 2017 global girls beauty and confidence report. Goal 5 SDG Gender Equality more important than ever//t.co/JeehASADC4,FALSE,FALSE,92294003,NA
Paul Polman,915553343036108800,2017-10-04T12:25:01Z,Looking forward to @oneyoungworld this week & meeting young leaders with innovative solutions to global challenges. Always inspiring!//t.co/IcAFpz2Wwo,FALSE,FALSE,NA,NA
Paul Polman,915516125554855936,2017-10-04T09:57:08Z,Honored to be associated with such a strong mission driven company @BCorporation @Unilever M%26atilde%3Be Terra//t.co/s1sbTH8Dn0,FALSE,FALSE,NA,NA
Paul Polman,915222300852617217,2017-10-03T14:29:35Z,Makes moral & economic sense to transform #foodandlanduse. We already know how. Food security linked to all #SDGs//t.co/jwhwZumB7E,FALSE,FALSE,NA,foodandlanduse
Paul Polman,915222300852617217,2017-10-03T14:29:35Z,Makes moral & economic sense to transform #foodandlanduse. We already know how. Food security linked to all #SDGs//t.co/jwhwZumB7E,FALSE,FALSE,NA,SDGs
Paul Polman,915143100435189760,2017-10-03T09:14:52Z,Biz with long-term strategies outperforming peers. Drives job creation & sustainable growth #betterbiz//t.co/eSimygUuzM,FALSE,FALSE,NA,betterbiz
Paul Polman,915142616177610752,2017-10-03T09:12:56Z,Published in @HuffPost: @PaulPolman's #OGP essay on how how progressive partnerships can #RenewTrust//t.co/LSUOV25Y1w,FALSE,TRUE,NA,OGP
Paul Polman,915142616177610752,2017-10-03T09:12:56Z,Published in @HuffPost: @PaulPolman's #OGP essay on how how progressive partnerships can #RenewTrust//t.co/LSUOV25Y1w,FALSE,TRUE,NA,RenewTrust
Paul Polman,915109186907901954,2017-10-03T07:00:06Z,"Today's Intl Non-Violence Day reaffirms our desire for a culture of peace, understanding & tolerance more than ever://t.co/Z7Ggtxj6pT//t.co/MPFEOjpNF9",FALSE,TRUE,NA,NA
Paul Polman,914911721734762497,2017-10-02T17:55:27Z,My heart goes out to the victims of the tragedy in #LasVegas. May we all live in peace one day. We are more united now once more I hope.,FALSE,FALSE,NA,LasVegas
Paul Polman,914805204050210817,2017-10-02T10:52:11Z,Investors commit to encourage biz to disclose climate risk & maximise opps of climate action #ClimateAction100//t.co/ojdDVwVHAa,FALSE,FALSE,NA,ClimateAction100
Paul Polman,914804617761959938,2017-10-02T10:49:51Z,What are the benefits of plant-based diets for people & planet? Read my @HuffPostUK blog//t.co/UbYZuEyt9z #WorldVegetarianDay//t.co/iBS10xSBB1,FALSE,TRUE,NA,NA
Paul Polman,914557470571450373,2017-10-01T18:27:47Z,"Life flourishes only through right relationships built on justice, solidarity and,most importantly, love.Respect and dignity for all at root",FALSE,FALSE,NA,NA
Paul Polman,914504270959005696,2017-10-01T14:56:23Z,@sach_mohit @keithweed Please send info to so I can have someone look into this. Warm regards. Paul,FALSE,FALSE,795873723656077312,NA
Paul Polman,914413421629714437,2017-10-01T08:55:23Z,Proud to see @Unilever win @PwC FTSE 350 #BuildingPublicTrust award for excellence in reporting. Congrats team!//t.co/kwTRt2MnTn,FALSE,FALSE,NA,BuildingPublicTrust
Paul Polman,914167568340045825,2017-09-30T16:38:27Z,Every 30sec a child under 5 dies from preventable illnesses.Simple act of handwashing makes difference @lifebuoysoap//t.co/d0bJ8cPAyg,FALSE,FALSE,NA,NA
Paul Polman,914154205660753920,2017-09-30T15:45:21Z,Some food for thought. With size comes responsibility. Big Tech's Perfect Storm//t.co/52bgKLwdXk,FALSE,FALSE,NA,NA
Paul Polman,914143491185430529,2017-09-30T15:02:46Z,SDG Goal 16 Peace and Justice requires human rights standards are upheld.A minimum to ensure responsible investment//t.co/5gnLd8qDYe,FALSE,FALSE,NA,NA
Paul Polman,914142417703620610,2017-09-30T14:58:30Z,Working hard but impossible to get all companies.Need government enforcement and policies for public procurement//t.co/SqLMUVHN0i,FALSE,FALSE,NA,NA
Paul Polman,914132905563185152,2017-09-30T14:20:43Z,"Great to see @walls create 80.000 new jobs by 2020.Inspiring to meet some,social inclusion biggest future challenge.//t.co/MSAFmY22aB",FALSE,FALSE,NA,NA
Paul Polman,914129672509812736,2017-09-30T14:07:52Z,@sach_mohit @keithweed What is issue?,FALSE,FALSE,795873723656077312,NA
Paul Polman,914129563495563264,2017-09-30T14:07:26Z,@ValueCreationJ No issue. See if I can fit in. Email to. Thanks. Paul,FALSE,FALSE,79207878,NA
Paul Polman,914129336520896512,2017-09-30T14:06:32Z,Proud to see @TRESemme bottle as example responsible packaging. @Unilever 100% commitment packaging recycling. Using oceans/landfill is over//t.co/rXDY0HLazw,FALSE,FALSE,NA,NA
Paul Polman,914077253008535552,2017-09-30T10:39:34Z,Congrats @UnileverUSA. Inclusive workforce provides benefits for all. Empowering women at heart of #SDGs.//t.co/bgLaGO2TN8,TRUE,FALSE,NA,SDGs
Paul Polman,914059981724495872,2017-09-30T09:30:56Z,"No better way to address crisis in trust than through purpose. Partnerships between govt, biz & civil society key//t.co/iu25Qh7eJv",FALSE,FALSE,NA,NA
Paul Polman,913727582989950978,2017-09-29T11:30:06Z,Clear trend emerging. Sustainable biz models attracting and retaining talent. Value with values.//t.co/Xnih6ADGTb,FALSE,FALSE,NA,NA
Paul Polman,913722152817487873,2017-09-29T11:08:32Z,"We believe in 'better business, better world'...sustainable development for humanity. @PaulPolman @malloch_brown//t.co/HqKsthBCqc//t.co/CyEKH3VI84",FALSE,TRUE,NA,NA
Paul Polman,913686431884873729,2017-09-29T08:46:35Z,Thanks @britac_news for insightful discussions on the future of business and rise of more responsible models//t.co/k9Zv4AjBP3,TRUE,FALSE,NA,NA
