name,status_id,created_at,text,is_quote,is_retweet,reply_to_user_id,hashtags
Scott McDonald,651391283324395520,2015-10-06T13:39:18Z,Press Release: Oliver Wyman Named to List of Top Employers for Working Families//t.co/0skFs9H2qB @workingfamuk//t.co/YTtM7Ft3uR,FALSE,TRUE,NA,NA
Scott McDonald,651389642231709697,2015-10-06T13:32:47Z,Happy German-American Day! More Americans trace their roots to Germany than any other country//t.co/qrlj8Y03YP//t.co/EFKiT9Qi1O,FALSE,TRUE,NA,NA
Scott McDonald,651388775826878464,2015-10-06T13:29:21Z,Good to see a Canadian McDonald win the Nobel Prize//t.co/BhJrRujhrh,FALSE,FALSE,NA,NA
Scott McDonald,651330270075990016,2015-10-06T09:36:52Z,Oliver Wyman Health Innovation Center mission//t.co/lCpMIuQMjI,TRUE,FALSE,NA,NA
Scott McDonald,651075744551071744,2015-10-05T16:45:28Z,"Good report, even if written by a competitor, on the problem of plastic waste in oceans//t.co/pWRcxzcKhc",FALSE,FALSE,NA,NA
Scott McDonald,651038988824875008,2015-10-05T14:19:25Z,Giant Starbucks cup arrives in our lobby courtesy of the @lippincottbrand team//t.co/1CKSgZ96pY,FALSE,FALSE,NA,NA
Scott McDonald,651037281558622208,2015-10-05T14:12:38Z,10.9 million primary-school teachers will need to be recruited by 2020 to provide primary education for all//t.co/zb1H7Y11lm,FALSE,FALSE,NA,NA
Scott McDonald,651034687721312256,2015-10-05T14:02:19Z,"#Values everywhere, but little link to behaviors at many places. If no link, better to do without.//t.co/aFBDSPwpz3",FALSE,FALSE,NA,Values
Scott McDonald,649240905728270336,2015-09-30T15:14:28Z,Our @lippincottbrand creative consultancy is so cool. See them at the London Design Museum this week//t.co/MTEypl5cT7,FALSE,FALSE,NA,NA
Scott McDonald,649144234793156608,2015-09-30T08:50:20Z,.@tylercowen on the positives and negatives from our increased ability to measure employee productivity//t.co/aafFEqfbsV,FALSE,FALSE,NA,NA
Scott McDonald,648940346848751616,2015-09-29T19:20:10Z,At Arsenal with Ines. Bad guys just scored.//t.co/388irZe2rZ,FALSE,FALSE,NA,NA
Scott McDonald,648790994494861312,2015-09-29T09:26:41Z,New Zealand creates South Pacific ocean sanctuary//t.co/pU7yCevqq7,FALSE,FALSE,NA,NA
Scott McDonald,648787311761694720,2015-09-29T09:12:03Z,#NNN15 now realising that Gen Z are the generation after millennials. Are generations now speeding up?,FALSE,TRUE,NA,NNN15
Scott McDonald,648786908210950144,2015-09-29T09:10:27Z,"It really puts me off when someone starts a conversation with an earnest look and the words ""to be honest"". Were they not before?",FALSE,FALSE,NA,NA
Scott McDonald,648497768558952449,2015-09-28T14:01:31Z,From our #retail team: US grocers can learn from Europe how to defend against hard discounters //t.co/1RyFkgx3cp #grocery,FALSE,FALSE,NA,retail
Scott McDonald,648497768558952449,2015-09-28T14:01:31Z,From our #retail team: US grocers can learn from Europe how to defend against hard discounters //t.co/1RyFkgx3cp #grocery,FALSE,FALSE,NA,grocery
Scott McDonald,648452294523113472,2015-09-28T11:00:49Z,Interesting piece in @brinknewsnow on risks to Indian Ocean region's blue economy.//t.co/WZt7f8Fxj4 #sustainability,FALSE,FALSE,NA,sustainability
Scott McDonald,648411808831787008,2015-09-28T08:19:56Z,Highly recommend Digital Gold by @nathanielpopper - good read and education in the mysteries of Bitcoin//t.co/VWzdBl8T30,FALSE,FALSE,NA,NA
Scott McDonald,648410431871164416,2015-09-28T08:14:28Z,"The Syrian refugee crisis, explained in one map //t.co/DUXY5uLssS #Syria #maps #migration//t.co/AnDTZX0zSr",FALSE,TRUE,NA,Syria
Scott McDonald,648410431871164416,2015-09-28T08:14:28Z,"The Syrian refugee crisis, explained in one map //t.co/DUXY5uLssS #Syria #maps #migration//t.co/AnDTZX0zSr",FALSE,TRUE,NA,maps
Scott McDonald,648410431871164416,2015-09-28T08:14:28Z,"The Syrian refugee crisis, explained in one map //t.co/DUXY5uLssS #Syria #maps #migration//t.co/AnDTZX0zSr",FALSE,TRUE,NA,migration
Scott McDonald,648408194595835904,2015-09-28T08:05:35Z,Some examples of our Nonprofit Fellows in action://t.co/UU7riXegnI,FALSE,FALSE,NA,NA
Scott McDonald,648130208889982977,2015-09-27T13:40:58Z,Rugby after my travels. Almost saw a Canada victory - but not quite.,FALSE,FALSE,NA,NA
Scott McDonald,647743049523699712,2015-09-26T12:02:32Z,Good luck to the @OliverWyman and @MMC_Global teams participating in @RoadHockey tourney to conquer cancer,FALSE,FALSE,NA,NA
Scott McDonald,647434086454292480,2015-09-25T15:34:49Z,Our Automation Impact Matrix: how new medical devices will reduce need for patient contact//t.co/GX7smqFEzB//t.co/PCRsoZH3mU,FALSE,FALSE,NA,NA
Scott McDonald,647018683009732608,2015-09-24T12:04:09Z,"Threat to oceans from climate change must be key to Paris talks, say scientists//t.co/g6aZspW8jR",FALSE,FALSE,NA,NA
Scott McDonald,647001559994396672,2015-09-24T10:56:07Z,Beats me. High-IQ people should give humble thanks every morning for their completely unearned gift. //t.co/xLwtCjXyAO,FALSE,TRUE,NA,NA
Scott McDonald,646671348752904193,2015-09-23T13:03:58Z,Track the evolution of a retailer in our interactive graphic within the Retail Journal app. Download here://t.co/2Mwy7OMggt,FALSE,FALSE,NA,NA
Scott McDonald,646308905556049920,2015-09-22T13:03:45Z,Interesting piece by @mercer colleague @KarenLockridge Climate Change Scenarios and the Goal of Transformation//t.co/1m7Ky1ExXS,FALSE,FALSE,NA,NA
Scott McDonald,646302704181100544,2015-09-22T12:39:07Z,Congratulations @OliverWyman #TopEmployersForWorkingFamilies 2015//t.co/0sqW7OsqcO #TEWF,FALSE,TRUE,NA,TopEmployersForWorkingFamilies
Scott McDonald,646302704181100544,2015-09-22T12:39:07Z,Congratulations @OliverWyman #TopEmployersForWorkingFamilies 2015//t.co/0sqW7OsqcO #TEWF,FALSE,TRUE,NA,TEWF
Scott McDonald,646252058190970880,2015-09-22T09:17:52Z,I believe this malfunctioning drone found some bonefish//t.co/4D8xVxXYrM,FALSE,FALSE,NA,NA
Scott McDonald,645946569116790785,2015-09-21T13:03:57Z,".@OliverWyman Sustainability Blog: insights on #sustainability and risk, drones, & sustainable aviation//t.co/3yJr9DCNG2",FALSE,FALSE,NA,sustainability
Scott McDonald,645937222265532416,2015-09-21T12:26:49Z,Good article on the human era of branding from our @lippincottbrand team//t.co/dwIj4QbBaD,TRUE,FALSE,NA,NA
Scott McDonald,645931175027019776,2015-09-21T12:02:47Z,"Good read in @Forbes by @OliverWyman experts. By 2035, the US will have more #drones than manned aircraft.//t.co/LmQo8YLNOf",FALSE,FALSE,NA,drones
Scott McDonald,645910233437589504,2015-09-21T10:39:34Z,.@OliverWyman now part of the 30% club cross-company mentoring scheme focused on balancing the pyramid @30percentclub,FALSE,FALSE,NA,NA
Scott McDonald,645855431722708992,2015-09-21T07:01:48Z,"Congratulations to Finja Carolin Ktz, new head of @OliverWyman in Germany and Austria//t.co/bqE9CJ9RAE",FALSE,FALSE,NA,NA
Scott McDonald,645708897349578758,2015-09-20T21:19:32Z,With Michael Wagner and Christ in the clouds above Rio.//t.co/lbman6ioL9,FALSE,FALSE,NA,NA
Scott McDonald,645206117723865088,2015-09-19T12:01:40Z,Good luck to our Toronto team running in @RBCRun4theKids in support of Family Navigation Project at Sunnybrook,FALSE,FALSE,NA,NA
Scott McDonald,644937838832820224,2015-09-18T18:15:37Z,Magnificent oceans - a seal riding a whale at//t.co/dyHK9t7Sac #Cowabunga,FALSE,FALSE,NA,Cowabunga
Scott McDonald,644896230179479552,2015-09-18T15:30:17Z,Idea creation with one of our Mexico teams//t.co/NvW7Awtn2q,FALSE,FALSE,NA,NA
Scott McDonald,644859468799442944,2015-09-18T13:04:12Z,New report identifies the main challenges facing European #aerospace suppliers//t.co/1Bnf9idRnz,FALSE,FALSE,NA,aerospace
Scott McDonald,644843972452569089,2015-09-18T12:02:38Z,"In Mexico City for the first time today. I feel part of humanity being so close to 22 million other people, all going about their business.",FALSE,FALSE,NA,NA
Scott McDonald,644496870090391552,2015-09-17T13:03:22Z,Impressive initiative by @OliverWyman Zurich alum Jasser Kassab who helps traumatized child #refugees from Syria//t.co/2yZn61ptGy,FALSE,FALSE,NA,refugees
Scott McDonald,644153953396068352,2015-09-16T14:20:44Z,.@OliverWyman alum helping improve education in the UK one teacher at a time with @TeachFirst//t.co/zB4Yp0mQk7 via @FT,FALSE,FALSE,NA,NA
Scott McDonald,644106120869584896,2015-09-16T11:10:40Z,"""Here Jew, Muslim + Christian trade as if of the same faith, giving the name infidel to none but bankrupts"" Voltaire//t.co/P7k1CzVvy6",FALSE,TRUE,NA,NA
Scott McDonald,644105907274711040,2015-09-16T11:09:49Z,Amusing description of Julia at the Edinburgh book festival//t.co/XgBu67KqG1,FALSE,FALSE,NA,NA
Scott McDonald,644104882853650433,2015-09-16T11:05:45Z,Why some EU countries do more than others to help refugees//t.co/6NEUGoDI2D,FALSE,FALSE,NA,NA
Scott McDonald,643846355614593024,2015-09-15T17:58:27Z,"A good read in @FT on Women in Business, looks at how EU ranks in terms of women in leadership roles//t.co/dUAwga3Ivx",FALSE,FALSE,NA,NA
Scott McDonald,643784374312431616,2015-09-15T13:52:10Z,Gardeners 67% likely to be put out of business by robots//t.co/O95JXhFNau,FALSE,FALSE,NA,NA
Scott McDonald,643334042931302400,2015-09-14T08:02:43Z,Our aviation team will be in Toulouse today//t.co/Lur22rI4bt,FALSE,FALSE,NA,NA
Scott McDonald,642297854078418948,2015-09-11T11:25:16Z,To add to the confusion: Southern Ocean showing 'remarkable' revival in carbon absorption ability//t.co/0gW3bI1f0i,FALSE,FALSE,NA,NA
Scott McDonald,642228787518808064,2015-09-11T06:50:49Z,@MESandbu Your recent article gave me the final kick I needed to get our refugee initiative over the line-thank you//t.co/M1N0IGanyR,FALSE,FALSE,1179383574,NA
Scott McDonald,642221357229572096,2015-09-11T06:21:18Z,We asked @OliverWyman to review the types of financing instruments used by development finance institutions//t.co/gF4BW78nbG,FALSE,TRUE,NA,NA
Scott McDonald,642220037911248896,2015-09-11T06:16:03Z,Today is the day we remember and honour the 358 @MMC_Global colleagues and consultants who lost their lives in the attacks on the WTC,FALSE,FALSE,NA,NA
Scott McDonald,641871622341795840,2015-09-10T07:11:34Z,Today @OliverWyman announced we will do what we can to support refugees by creating a targeted recruiting initiative//t.co/M1N0IGanyR,FALSE,FALSE,NA,NA
Scott McDonald,641219322816425985,2015-09-08T11:59:34Z,New automated diagnostic tools are poised to disrupt the physician-patient relationship//t.co/Ycshl1Lngz,FALSE,FALSE,NA,NA
Scott McDonald,641140602214723584,2015-09-08T06:46:46Z,"Excellent new report, jointly researched with the @bankmandiri Institute, on Financial Deepening in Indonesia//t.co/w8ph6nrtCC",FALSE,FALSE,NA,NA
Scott McDonald,640880849311932416,2015-09-07T13:34:36Z,Peter Zaffino named North America Insurance Broking CEO of the Year//t.co/GHZPzJlI5n,FALSE,FALSE,NA,NA
Scott McDonald,640873358243053569,2015-09-07T13:04:50Z,Interested in #Retail? Visit//t.co/O5xO2gA49h for a collection of ideas and experiences from Oliver Wyman'sRetail Practice,FALSE,FALSE,NA,Retail
Scott McDonald,640852028307185664,2015-09-07T11:40:04Z,Is Big Brother' the future of financial regulation?//t.co/H9BBefrVXa,FALSE,FALSE,NA,NA
Scott McDonald,639820541663293440,2015-09-04T15:21:19Z,Is 70 the new 50? @mercer's CEO @JAPortalatin in Fortune.,FALSE,FALSE,NA,NA
Scott McDonald,639801193385082880,2015-09-04T14:04:26Z,Recent @WSJ roundup featured @OliverWyman report Risk ID: What Have Banks Been Missing?//t.co/2SjkOMilfe,FALSE,FALSE,NA,NA
Scott McDonald,639786045261901824,2015-09-04T13:04:14Z,.@OliverWyman Partner @TerryStone92 on how smaller health plans can respond to the consolidation wave//t.co/FKth1h3j61,FALSE,FALSE,NA,NA
Scott McDonald,639466823445016580,2015-09-03T15:55:46Z,"Threat of plastic pollution to seabirds is global, pervasive, and increasing//t.co/GivB43BfYT",FALSE,FALSE,NA,NA
Scott McDonald,639438802059198464,2015-09-03T14:04:25Z,Encouraging consumers to make healthy choices can yield savings and better outcomes//t.co/7ofGpAHXBm//t.co/QajBdzJ9Ql,FALSE,FALSE,NA,NA
Scott McDonald,639423721980231680,2015-09-03T13:04:29Z,".@OliverWyman was founded by entrepreneurs, and we're proud to keep that spirit alive//t.co/wYMVlTOYjl",FALSE,FALSE,NA,NA
Scott McDonald,639338012640477185,2015-09-03T07:23:55Z,New sign up in much expanded Shanghai office//t.co/GY3FVAlCRZ,FALSE,FALSE,NA,NA
Scott McDonald,639104471663017984,2015-09-02T15:55:54Z,The development cost of an aircraft from preliminary design to final delivery can jump by 48%//t.co/yfwXP9l5Kx//t.co/D2ZvzxzUSe,FALSE,FALSE,NA,NA
Scott McDonald,639075541560246272,2015-09-02T14:00:57Z,#Micro-insurance can offer families in poorer countries protection from destitution//t.co/x316v5CkPo,FALSE,FALSE,NA,Micro
Scott McDonald,639061247028264960,2015-09-02T13:04:09Z,1.3b tonnes of food waste/year costs everyone.//t.co/9ehsmPiEVH @micnews has it right.//t.co/RiyUM1lsIW,FALSE,FALSE,NA,NA
Scott McDonald,638995359805632512,2015-09-02T08:42:20Z,#Risk culture: is Lehman Sisters vs. Lehman Brothers the answer?//t.co/EiyhgeGXzG,FALSE,FALSE,NA,Risk
Scott McDonald,638700149729067008,2015-09-01T13:09:16Z,.@OliverWyman's @JonathanKeane on DIY luggage check-in at airports//t.co/MBfg7J7LAj,FALSE,FALSE,NA,NA
Scott McDonald,638698760927899648,2015-09-01T13:03:45Z,A new academic year means recruiting for us. Learn about careers at @OliverWyman//t.co/WmcpTf0wYQ,FALSE,FALSE,NA,NA
Scott McDonald,638640748339068928,2015-09-01T09:13:14Z,Profound FT article: The refugee crisis reveals what we have become//t.co/aPAcZxra79 @MESandbu,FALSE,FALSE,NA,NA
Scott McDonald,637173292089110528,2015-08-28T08:02:05Z,#Autonomousdriving is becoming a reality. Who stands to benefit? //t.co/78nV99YiQ6//t.co/mQSkhpcMdp,FALSE,FALSE,NA,Autonomousdriving
Scott McDonald,636810968941641728,2015-08-27T08:02:21Z,Will #drones soon deliver our #parcels? @OliverWyman Partner @MichaelLierow comments in TV interview (in German)//t.co/UBM4Ch3Hdw,FALSE,FALSE,NA,drones
Scott McDonald,636810968941641728,2015-08-27T08:02:21Z,Will #drones soon deliver our #parcels? @OliverWyman Partner @MichaelLierow comments in TV interview (in German)//t.co/UBM4Ch3Hdw,FALSE,FALSE,NA,parcels
Scott McDonald,636567768201039872,2015-08-26T15:55:57Z,An interesting look at how airlines are adding capacity without adding planes//t.co/jDFlM6waL3,FALSE,FALSE,NA,NA
Scott McDonald,636205352804057088,2015-08-25T15:55:50Z,Another sea fact - record year for UK jellyfish//t.co/CVZlqUqTjA,FALSE,FALSE,NA,NA
Scott McDonald,635829708098260993,2015-08-24T15:03:10Z,.@OliverWyman's health team offers ideas for how to make a difference in managed Medicaid services//t.co/iERkNicwRV,FALSE,FALSE,NA,NA
Scott McDonald,635799643717267456,2015-08-24T13:03:42Z,"I visited our Paris office recently and was told we now only have ""softphones"". Is it the end of the office phone? //t.co/g40nomWN1g",FALSE,FALSE,NA,NA
Scott McDonald,634704181924876288,2015-08-21T12:30:43Z,Congratulations to Matthew Cunningham on his 25th anniversary at @OliverWyman//t.co/nwCSkaCvwU,FALSE,FALSE,NA,NA
Scott McDonald,634689029439684608,2015-08-21T11:30:31Z,.@OliverWyman invites German-speaking students to apply for a workshop on Women Reinventing Banking London Oct 8-9//t.co/Dy5XyOpVJD,FALSE,FALSE,NA,NA
Scott McDonald,634646802332053504,2015-08-21T08:42:43Z,.@Mercer CEO @JAPortalatin talks about APAC wage growth on CNBC Asia's Squawk Box//t.co/Eviz0pkxPW,FALSE,FALSE,NA,NA
Scott McDonald,634641130760634368,2015-08-21T08:20:11Z,Forget the Ashes - this is where the real action is//t.co/nhyUi3Q7eq,FALSE,FALSE,NA,NA
Scott McDonald,633908429325774848,2015-08-19T07:48:41Z,Amusement for August//t.co/BZf1gznJe9,TRUE,FALSE,NA,NA
Scott McDonald,633907111395782656,2015-08-19T07:43:27Z,Group of Thirty calls for fully comprehensive cultural and conduct reforms at major global banks//t.co/7kRBcglHTe,FALSE,FALSE,NA,NA
Scott McDonald,633906777327841280,2015-08-19T07:42:07Z,Our people and our impact make Oliver Wyman a great place to work. Read some of our stories and enter Our World at//t.co/hojZlZ4U0x,FALSE,FALSE,NA,NA
Scott McDonald,633906409499951104,2015-08-19T07:40:40Z,One of the most powerful ideas in healthcare today is the partnered product//t.co/qpL1qitE6T,FALSE,FALSE,NA,NA
Scott McDonald,633905779393863681,2015-08-19T07:38:09Z,Julia Rochester talks about The House at the Edge of the World at the Edinburgh book festival today at 5pm//t.co/jVGXJ2ex6O,FALSE,FALSE,NA,NA
Scott McDonald,633232221747441664,2015-08-17T11:01:41Z,Great perspective on an essential challenge//t.co/XLWP8ZMvEI,TRUE,FALSE,NA,NA
Scott McDonald,632227927413932032,2015-08-14T16:30:58Z,Incredible voyage of underwater discovery from @qz //t.co/wLVn7q5tTL,FALSE,FALSE,NA,NA
Scott McDonald,631917053390245889,2015-08-13T19:55:40Z,.@paulmromer: We consistently fail to grasp how many ideas remain to be discovered...possibilities do not merely add up; they multiply,FALSE,FALSE,NA,NA
Scott McDonald,631733434226995200,2015-08-13T07:46:02Z,#NationalWorkLifeWeek is 21-25 Sept. Employers - tell us how YOU plan to mark the week.//t.co/y2GI4exZGZ #worklife #flexibleworking,FALSE,TRUE,NA,NationalWorkLifeWeek
Scott McDonald,631733434226995200,2015-08-13T07:46:02Z,#NationalWorkLifeWeek is 21-25 Sept. Employers - tell us how YOU plan to mark the week.//t.co/y2GI4exZGZ #worklife #flexibleworking,FALSE,TRUE,NA,worklife
Scott McDonald,631365795382214656,2015-08-12T07:25:10Z,This guy has mad skills @AbramsChronicle #FantasticCities//t.co/lBJ6huffZz,FALSE,TRUE,NA,FantasticCities
Scott McDonald,631359704858521600,2015-08-12T07:00:58Z,.@oliverwyman alums in Zurich? We hope you can join the alumni event there August 27,FALSE,FALSE,NA,NA
Scott McDonald,631095480244641792,2015-08-11T13:31:02Z,Jackpot - found two giant puffballs today.//t.co/CFLdMz3LSg,FALSE,FALSE,NA,NA
Scott McDonald,631093569428824064,2015-08-11T13:23:26Z,Startups Vie to Build an Uber for Health Care//t.co/YGPrCMzm6m via @WSJ,FALSE,TRUE,NA,NA
Scott McDonald,631088180368965632,2015-08-11T13:02:01Z,How to close the door to cyber attacks//t.co/eck7F4Ug8q,FALSE,FALSE,NA,NA
Scott McDonald,630801275286888448,2015-08-10T18:01:58Z,Inspiring @OliverWyman folks discuss threshold moments that shaped their careers//t.co/kNgYVzZ6oH,FALSE,FALSE,NA,NA
Scott McDonald,630710717226815488,2015-08-10T12:02:07Z,The work of our MMC Provider Transformation team draws on expertise of all 4 MMC OpCos//t.co/h3u6wOskSs,FALSE,FALSE,NA,NA
Scott McDonald,629691189579673600,2015-08-07T16:30:53Z,In Oct our #OWHIC Summit will convene a diverse group of leaders committed to health innovation & transformation//t.co/mUUuidjEuw,FALSE,FALSE,NA,OWHIC
Scott McDonald,629328802104143873,2015-08-06T16:30:53Z,Nano-Sized Synthetic Coral Could Suck Up Ocean's Pollutants//t.co/X8gOZtPewn @PopSci,FALSE,FALSE,NA,NA
Scott McDonald,629276251241455616,2015-08-06T13:02:04Z,"A handy guide to finding a giant squid, courtesy of @TEDTalks//t.co/erpKqdvAyZ",FALSE,FALSE,NA,NA
Scott McDonald,628966398946070528,2015-08-05T16:30:49Z,How payers and providers can partner successfully on insurance products //t.co/66M1FIUHVY,FALSE,FALSE,NA,NA
Scott McDonald,628913869893828608,2015-08-05T13:02:05Z,August marks 10 years since Hurricane Katrina. John Drzik's thoughts on environmental risk @marshglobal//t.co/UPruY495ET,FALSE,FALSE,NA,NA
Scott McDonald,628524098822537216,2015-08-04T11:13:17Z,Capitalism - raising money for the Donkey Sanctuary//t.co/s62bgGUs42,FALSE,FALSE,NA,NA
Scott McDonald,628430412763791360,2015-08-04T05:01:00Z,Thanks to employees of @OliverWyman's Singapore office for donating funds and hair to support @HairforHope2012,FALSE,FALSE,NA,NA
Scott McDonald,628173919137230848,2015-08-03T12:01:47Z,Spoiled for summer reading @OliverWyman marketing//t.co/X0v2gDUmfh,FALSE,FALSE,NA,NA
Scott McDonald,628153715766263808,2015-08-03T10:41:31Z,"...the forces of prejudice strike first and win a few battles, and then the forces of pluralism go into action and win the war. @EbooPatel",FALSE,FALSE,NA,NA
Scott McDonald,628098142433636352,2015-08-03T07:00:41Z,Rising stars in consulting - good luck to Dawn Kelly and Rosie Battie from @OliverWyman//t.co/ej9JSntz4d,FALSE,FALSE,NA,NA
Scott McDonald,627552535079976960,2015-08-01T18:52:38Z,Cooking with @OliverWyman - Houston office July social event!//t.co/u9CBRsXMHU,FALSE,TRUE,NA,NA
Scott McDonald,627545719050735616,2015-08-01T18:25:33Z,"Antonia Romeo, Oliver Wyman alumnus, on life in government, project delivery, and working motherhood://t.co/VyHe77AW71 @CSWnews",FALSE,TRUE,NA,NA
Scott McDonald,627139197518917633,2015-07-31T15:30:11Z,Good performance from @OliverWyman at the 2015 Try Tag Rugby Tournament//t.co/jQmxLeGhqD,FALSE,FALSE,NA,NA
Scott McDonald,627086634429902848,2015-07-31T12:01:19Z,OW Healthbuzz new trends in health & life sciences from our @OliverWyman health blog //t.co/k8i6Rik7Dd,FALSE,FALSE,NA,NA
Scott McDonald,626838834890821633,2015-07-30T19:36:38Z,Two Scotts - the other a partner in our Insurance practice. See our INS spotlight at//t.co/bDaYaWeRge//t.co/wmwj10zaDo,FALSE,FALSE,NA,NA
Scott McDonald,626835932835024896,2015-07-30T19:25:07Z,Fine lunch and discussion with the New York office of @oliverwyman today//t.co/p0xmqUkZuF,FALSE,FALSE,NA,NA
Scott McDonald,626749536476729344,2015-07-30T13:41:48Z,Group of Thirty calls for fully comprehensive cultural and conduct reforms at major global banks//t.co/7kRBcglHTe,FALSE,FALSE,NA,NA
Scott McDonald,626748185025904640,2015-07-30T13:36:26Z,High-tech Ghost Ships' on horizon for shipping industry//t.co/YkGYgI5Gbe,FALSE,FALSE,NA,NA
Scott McDonald,626724467260190720,2015-07-30T12:02:11Z,Looks to be a great line-up of speakers at the 2nd annual @OliverWyman Health Innovation Summit in Oct//t.co/ezhSpXM5RL,FALSE,FALSE,NA,NA
Scott McDonald,626366725290872832,2015-07-29T12:20:39Z,"Am in NY, watching some window cleaners on a neighboring building at about the 40th floor. What a crazy job.",FALSE,FALSE,NA,NA
Scott McDonald,626361938595971072,2015-07-29T12:01:38Z,How Tesla Motors' new energy storage battery could disrupt the utilities industry//t.co/uByOD8jv7V,FALSE,FALSE,NA,NA
Scott McDonald,626286345456078848,2015-07-29T07:01:15Z,Some great work in our London office photo competition//t.co/15yCt3Nnv4,FALSE,FALSE,NA,NA
Scott McDonald,626070387252666368,2015-07-28T16:43:06Z,.@NYTimes series highlights global challenges to managing world's oceans//t.co/msjH4YqiU7,FALSE,FALSE,NA,NA
Scott McDonald,626069572391669760,2015-07-28T16:39:52Z,Hot work//t.co/KWLjFywLCu,TRUE,FALSE,NA,NA
Scott McDonald,626069450161299456,2015-07-28T16:39:23Z,Very innovative work supporting music in both US and Europe//t.co/lFYRWCtSKo,TRUE,FALSE,NA,NA
Scott McDonald,626068398779297793,2015-07-28T16:35:12Z,It was a big weekend for @OliverWyman NA soccer. Congrats to all the teams & especially NY for bringing home the cup,FALSE,FALSE,NA,NA
Scott McDonald,626068129643425792,2015-07-28T16:34:08Z,"New piece from our FS team, on how asset managers need a rethink of their business models//t.co/vl8QzOCGkD",FALSE,FALSE,NA,NA
Scott McDonald,625774575536746496,2015-07-27T21:07:39Z,"In New York today, enjoying the heat, but not the smell, and pondering how to simplify everything",FALSE,FALSE,NA,NA
Scott McDonald,625637499336040448,2015-07-27T12:02:58Z,Summer reading//t.co/k2tF1RjkoK,TRUE,FALSE,NA,NA
Scott McDonald,625629108026933248,2015-07-27T11:29:37Z,New @OliverWyman report on the automotive industry covering the value of autonomous driving and other trends//t.co/2pWFYLSDyh,FALSE,FALSE,NA,NA
Scott McDonald,624609180553342976,2015-07-24T15:56:47Z,Sunday Times predicted today that Julia's book has a shot at the Man Booker long list. Now that would be exciting.//t.co/x1pbUfIhym,FALSE,FALSE,NA,NA
Scott McDonald,624491103916556288,2015-07-24T08:07:36Z,"Jeremy Lim, our head of health in Asia, writing in the Straights Times on the need for foreign patients in Singapore//t.co/2Zxwibe0ot",FALSE,FALSE,NA,NA
Scott McDonald,624195036633243648,2015-07-23T12:31:08Z,Impressive line-up for our Health Innovation Summit #OWHIC//t.co/9ZHEGh2zUF,FALSE,FALSE,NA,OWHIC
Scott McDonald,624187451624562688,2015-07-23T12:00:59Z,People are on the move - worldwide airport passengers up 6% in April//t.co/vzgSxdwoN4//t.co/qoiWjICpD6,FALSE,FALSE,NA,NA
Scott McDonald,624122906805673984,2015-07-23T07:44:31Z,How to better serve populations affected by pandemics//t.co/w8mgLEX2B2,FALSE,FALSE,NA,NA
Scott McDonald,624120933545025536,2015-07-23T07:36:40Z,"Angelina, a partner in our Singapore office, is shaving her head if we raise $25K for a children's cancer foundation - that's commitment",FALSE,FALSE,NA,NA
Scott McDonald,623811718821605376,2015-07-22T11:07:58Z,"Very interesting and insightful book on the future, edited by Morton Shapiro @NorthwesternU//t.co/l65GTef83G",FALSE,FALSE,NA,NA
Scott McDonald,623496247064821760,2015-07-21T14:14:23Z,Christian Edelmann on CNBC today promoting our new Corporate Banking report //t.co/VGUIJUvbHH,FALSE,FALSE,NA,NA
Scott McDonald,623164919173808128,2015-07-20T16:17:49Z,How to develop a Blue Economy//t.co/Q8SNRnoKdw,FALSE,FALSE,NA,NA
Scott McDonald,623153018016538624,2015-07-20T15:30:31Z,Another year of meaningful impact - MMC's Corporate Citizenship Report //t.co/LQnYauOivK,FALSE,FALSE,NA,NA
Scott McDonald,623152757739003904,2015-07-20T15:29:29Z,"Francois Austin, our head of Energy, doing something odd//t.co/rAatLcZmr4",FALSE,FALSE,NA,NA
Scott McDonald,623152577228746756,2015-07-20T15:28:46Z,The oceans are warming faster than climate models predicted//t.co/K9ZpDOgX2W,FALSE,FALSE,NA,NA
Scott McDonald,623152483171454976,2015-07-20T15:28:24Z,"Warming of oceans due to climate change is unstoppable, say US scientists//t.co/dEuuqqBnyp",FALSE,FALSE,NA,NA
Scott McDonald,623081685257715712,2015-07-20T10:47:04Z,"I love this Austrian painter and architect - Hundertwasser - ""The straight line is ungodly and immoral"" //t.co/GvfX6n69F5",FALSE,FALSE,NA,NA
Scott McDonald,621179115840737280,2015-07-15T04:46:56Z,Close up viewing of a V22 Osprey today - fast and versatile//t.co/vABhfGSjBN,FALSE,FALSE,NA,NA
