name,status_id,created_at,text,is_quote,is_retweet,reply_to_user_id,hashtags
Scott McDonald,1173981975922782209,2019-09-17T15:28:09Z,"Very fun to be interviewed by @profkjmoore. ""Fascinating"" is over the top, but there are some interesting tidbits on OW and me in there.//t.co/BxS9FzJ3hX",TRUE,FALSE,NA,NA
Scott McDonald,1173981754950070276,2019-09-17T15:27:16Z,"CEO @scottmcdonaldOW was recently interviewed by @profkjmoore @CJAD800. In a fascinating conversation, he discusses his experience living in the Middle East, his short-lived time as a journalist, how he finds work-life balance & more. Listen &gt;//t.co/g00B1cpjH6 #OWInsights//t.co/b51PNkbStb",FALSE,TRUE,NA,NA
Scott McDonald,1057296718960701445,2018-10-30T15:42:36Z,@smcdonaldart Great new set of prints. I want them all.,FALSE,FALSE,NA,NA
Scott McDonald,1052461296116015104,2018-10-17T07:28:21Z,Main themes coming out of this year's InsurTech conference @OliverWyman//t.co/x2v4emKT3s,FALSE,FALSE,NA,NA
Scott McDonald,1042755916200898561,2018-09-20T12:42:38Z,Congratulations to @oliverwyman alumnus Arron Sarfatti on his appointment as CRO of Axa Equitable Life//t.co/jVVROEczKR,FALSE,FALSE,NA,NA
Scott McDonald,1042084865074753536,2018-09-18T16:16:07Z,"NEWS: MMC announced today that it will acquire Jardine Lloyd Thompson Group Plc (@JLTGroup), creating a platform to deliver exceptional service to clients and opportunities for our colleagues. Learn more//t.co/1Ybf9SzCnm//t.co/ru9v16PN49",FALSE,TRUE,NA,NA
Scott McDonald,1031643725309661184,2018-08-20T20:46:45Z,"I: The great @SimonMcBurney reminds that Arthur Miller said ""When asked to write in a time when diplomacy and politics have such terribly short and feeble arms, the delicate but sometimes lengthy reach of art must bear the burden of holding together the human community.""",FALSE,FALSE,NA,NA
Scott McDonald,1031633203432513536,2018-08-20T20:04:57Z,"II. ""One fiction in particular surrounds us continually. From the truth. And from one another. That we are separate. People from people. Women from men. Human beings from nature. @SimonMcBurney",FALSE,FALSE,NA,NA
Scott McDonald,1025286256710836226,2018-08-03T07:44:27Z,"Congratulations to @OliverWyman alumnus Richard Fearon, the new CEO of Leeds Building Society @LeedsBS",FALSE,FALSE,NA,NA
Scott McDonald,1023822660126605312,2018-07-30T06:48:38Z,1916 Winter in the Woods #tt1916//t.co/WSnVK50NW2,FALSE,TRUE,NA,tt1916
Scott McDonald,1022553194583482369,2018-07-26T18:44:14Z,This led to a great deal of thought on my part - a worthwhile read//t.co/3JvTxO3HxM,FALSE,FALSE,NA,NA
Scott McDonald,1022531905818951680,2018-07-26T17:19:38Z,Congratulations to @OliverWyman alumna Cecile Nagel on her appointment as EuroCCP CEO//t.co/USsikUBZ1i,FALSE,FALSE,NA,NA
Scott McDonald,1022496460158509061,2018-07-26T14:58:47Z,My critique of Owen Jones's claim that capitalism caused slavery//t.co/BSZLcs2oR2,FALSE,TRUE,NA,NA
Scott McDonald,1022199375710363648,2018-07-25T19:18:17Z,Stories from the Alumni Network: Geoff Donaker &gt;//t.co/TqLNfm5rQs #OWAlum//t.co/VP5k3J3gQO,FALSE,TRUE,NA,OWAlum
Scott McDonald,1021856497138057218,2018-07-24T20:35:48Z,Women are more engaged in their health decisions than men. Here's why #healthcare companies must give female consumers the kind of health system they're seeking.//t.co/GLCXYalKsZ #OWHealth//t.co/aLMvVSzLbS,FALSE,TRUE,NA,healthcare
Scott McDonald,1021806412953997314,2018-07-24T17:16:47Z,Can creativity save the planet? Lippincott and the leading agencies behind Potential Energy think so.//t.co/xJTTjDBc1H,FALSE,TRUE,NA,NA
Scott McDonald,1021134454499225600,2018-07-22T20:46:40Z,1914 Cat-Tails at Canoe Lake #tt1914//t.co/iXJRf2223L,FALSE,TRUE,NA,tt1914
Scott McDonald,1020238403336572928,2018-07-20T09:26:05Z,I love the idea of promoting randomly.//t.co/F4DNzaexzH,FALSE,FALSE,NA,NA
Scott McDonald,1020237927979409411,2018-07-20T09:24:11Z,New report examining older workers' susceptibility to automation in 15 major markets. #FutureOfWork #workforce//t.co/NRhYLq66jK,FALSE,TRUE,NA,FutureOfWork
Scott McDonald,1020237927979409411,2018-07-20T09:24:11Z,New report examining older workers' susceptibility to automation in 15 major markets. #FutureOfWork #workforce//t.co/NRhYLq66jK,FALSE,TRUE,NA,workforce
Scott McDonald,1020237862867013633,2018-07-20T09:23:56Z,"This is the most profound article I have read in a long time. It ripped layers and layers of scales from my eyes. Read it. Re-read it. It doesn't ""explain everything""--but it comes damn close.//t.co/zVhnG0aUUt",FALSE,TRUE,NA,NA
Scott McDonald,1019159953859334149,2018-07-17T10:00:42Z,Congratulations to the London Ladies (1) team who won the @OliverWyman Warsaw football and volleyball tournament.//t.co/SZR84Kk5P5,FALSE,FALSE,NA,NA
Scott McDonald,1018845308858654720,2018-07-16T13:10:25Z,Economics vs. Humanism. Great insights from (MMC's and Northwestern's) Morty Shapiro's book: Cents and Sensibility.//t.co/E43Qa59CIF,FALSE,FALSE,NA,NA
Scott McDonald,1016327222548975620,2018-07-09T14:24:26Z,Sobering afternoon at Dachau. More words from me can't do it justice.//t.co/kab622sPsS,FALSE,FALSE,NA,NA
Scott McDonald,1015569419492347904,2018-07-07T12:13:12Z,Made it//t.co/gOmcA4umjL,FALSE,FALSE,NA,NA
Scott McDonald,1015563886148366342,2018-07-07T11:51:13Z,Setting off with MMC on the Pride march//t.co/9PjmYyiJeq,FALSE,FALSE,NA,NA
Scott McDonald,1014420044577755136,2018-07-04T08:06:00Z,Watching England play in the World Cup is far more stressful than running a global company,FALSE,FALSE,NA,NA
Scott McDonald,1009321744916799488,2018-06-20T06:27:10Z,@RealKiefer I want to come to the London show and introduce you to the family! Can we say hello?,FALSE,FALSE,259392555,NA
Scott McDonald,1008360926381268999,2018-06-17T14:49:13Z,The garbage patch in the Pacific Ocean is now three times the size of France. What do you do to cut down on plastic waste? #plasticpollution//t.co/zJYYerZQhP,FALSE,TRUE,NA,NA
Scott McDonald,1007028319282515968,2018-06-13T22:33:55Z,Uncommon but straight view from @tylercowen//t.co/vlVhjYxCGF,FALSE,TRUE,NA,NA
Scott McDonald,1004286336130584576,2018-06-06T08:58:15Z,#PrideMonth Oliver Wyman was among 100 companies represented @Sticks_StonesHQ - Europe's largest #LGBT Career Fair in Berlin. We hear our coffee thermo flasks freebie was a hit! Learn more about our LGBT+ and Allies employee network #GLOW://t.co/8hI83IMjRv #OWCulture//t.co/1ocRSwvxMp,FALSE,TRUE,NA,PrideMonth
Scott McDonald,1004286336130584576,2018-06-06T08:58:15Z,#PrideMonth Oliver Wyman was among 100 companies represented @Sticks_StonesHQ - Europe's largest #LGBT Career Fair in Berlin. We hear our coffee thermo flasks freebie was a hit! Learn more about our LGBT+ and Allies employee network #GLOW://t.co/8hI83IMjRv #OWCulture//t.co/1ocRSwvxMp,FALSE,TRUE,NA,LGBT
Scott McDonald,1004286192039448576,2018-06-06T08:57:41Z,"In honor of @UN #WorldEnvironmentDay, Oliver Wyman has created a library of our insights and research on how businesses can manage #climaterisk and thrive in a low-carbon, no-carbon future. Visit #OWClimateRisk Content Hub &gt;//t.co/sjr1f2RBeh//t.co/VB4mF7kboZ",FALSE,TRUE,NA,WorldEnvironmentDay
Scott McDonald,1003630743841595393,2018-06-04T13:33:10Z,Congratulations to OW alum Tim Spence//t.co/2nDKDtXm85,FALSE,FALSE,NA,NA
Scott McDonald,1002095444577701888,2018-05-31T07:52:26Z,"Just watched this video again and reminded why teaching is the most important, exciting and brilliant profession - vital to future success of UK @TeachFirst @CBI_ES//t.co/hybbUJ6Brc via @YouTube",FALSE,TRUE,NA,NA
Scott McDonald,1002094766752976902,2018-05-31T07:49:45Z,Congratulations all and particularly to Rupal and Martin//t.co/TYiMB6soGB @EMpoweriB @OliverWyman @RupalKantaria @martinpong,FALSE,FALSE,NA,NA
Scott McDonald,1001748362310365184,2018-05-30T08:53:15Z,"InsureTech Connect 2018: Join 6000 attendees, 250 speakers & over 50 sessions at the intersection of #technology & #risk. Learn more://t.co/Y3WsiwdWMz #OWInsurTech #ITC2018 #insurtech #fintech #digital @insuretechnow//t.co/cyoHB73lEH",FALSE,TRUE,NA,technology
Scott McDonald,1001748362310365184,2018-05-30T08:53:15Z,"InsureTech Connect 2018: Join 6000 attendees, 250 speakers & over 50 sessions at the intersection of #technology & #risk. Learn more://t.co/Y3WsiwdWMz #OWInsurTech #ITC2018 #insurtech #fintech #digital @insuretechnow//t.co/cyoHB73lEH",FALSE,TRUE,NA,risk
Scott McDonald,1001731563103584256,2018-05-30T07:46:30Z,The Strange Failure of the Educated Elite//t.co/tQGwOrk53X,FALSE,FALSE,NA,NA
Scott McDonald,996536615567790081,2018-05-15T23:43:38Z,John Romeo receiving annual award from Safe Horizon in New York//t.co/GAK3VQi8Qo,FALSE,FALSE,NA,NA
Scott McDonald,994141624153362432,2018-05-09T09:06:48Z,Interesting piece on US vs. China//t.co/fg5Pw3At1X,FALSE,FALSE,NA,NA
Scott McDonald,993745410928857089,2018-05-08T06:52:23Z,Simple lessons for all of us//t.co/RxqvRNbh90,FALSE,FALSE,NA,NA
Scott McDonald,991323881926426628,2018-05-01T14:30:06Z,"#AuthoredByOW @mitsmr ""As promising as #machinelearning technology is, it can also be susceptible to unintended biases that require careful planning to avoid"" @ChrisDeBrusk #OWDigital//t.co/8t3oSPRIYu//t.co/6NnVi4WZsG",FALSE,TRUE,NA,AuthoredByOW
Scott McDonald,991323881926426628,2018-05-01T14:30:06Z,"#AuthoredByOW @mitsmr ""As promising as #machinelearning technology is, it can also be susceptible to unintended biases that require careful planning to avoid"" @ChrisDeBrusk #OWDigital//t.co/8t3oSPRIYu//t.co/6NnVi4WZsG",FALSE,TRUE,NA,machinelearning
Scott McDonald,991298933610766336,2018-05-01T12:50:57Z,We have set forth an innovative methodology that will serve to underpin enhanced climate-risk aware decision making and resource allocation.//t.co/B45Ww8fuh4 #OWFinancialServices #OWClimateRisk #TCFDRecs//t.co/rlz7TCg3AA,FALSE,TRUE,NA,NA
Scott McDonald,991226771403083776,2018-05-01T08:04:13Z,Congratulations to Matthew @matthew_sebag @OliverWyman//t.co/JvyMAjVJTE,FALSE,FALSE,NA,NA
Scott McDonald,989618038629597184,2018-04-26T21:31:41Z,Lanamos hj em So Paulo a srie #PanoramaBrasil - Time da @OliverWyman de parabns! a #OWBrasil contribuindo para o debate e para um Brasil melhor//t.co/X8a6O3l58X,FALSE,TRUE,NA,PanoramaBrasil
Scott McDonald,989618038629597184,2018-04-26T21:31:41Z,Lanamos hj em So Paulo a srie #PanoramaBrasil - Time da @OliverWyman de parabns! a #OWBrasil contribuindo para o debate e para um Brasil melhor//t.co/X8a6O3l58X,FALSE,TRUE,NA,OWBrasil
Scott McDonald,988390768367849473,2018-04-23T12:14:57Z,"Great profile of MMC general counsel, Peter Beshar//t.co/mRzCz0YuxG",FALSE,FALSE,NA,NA
Scott McDonald,984187417921032192,2018-04-11T21:52:20Z,Book recommendation: The Orientalist by @tomreiss - gripping account of an extraordinary life and a wonderful sweep of early 20th century history,FALSE,FALSE,NA,NA
Scott McDonald,984148845725659137,2018-04-11T19:19:04Z,Great @OliverWyman report on the future of retail//t.co/uJQAyF1vkH,FALSE,FALSE,NA,NA
Scott McDonald,982622459403882497,2018-04-07T14:13:45Z,Starting 8:45amEST Sat 4/7: Partner @anacarla_abrao interviews Central Bank of #Brazil President @brazil_conf @Harvard @MIT. What are possible paths for Brazilian economy in upcoming years? Livestream://t.co/WwEaKWj9wZ #OWBrazil #OWFinancialServices #AcaoQueTransforma//t.co/OJMfaLkySZ,FALSE,TRUE,NA,Brazil
Scott McDonald,982203909056880641,2018-04-06T10:30:35Z,"Me, in LesEchos (in French) on the state of the world//t.co/0x7yWnCzQu",FALSE,FALSE,NA,NA
Scott McDonald,976761881854607361,2018-03-22T10:05:54Z,"It's a great example of a relatively benign intervention, says Partner Duncan Brewer about the new sugar tax, set to launch in April. Read more://t.co/kwAGTrWxKe #OliverWymanUK #OWRetail//t.co/hCiQoXGibH",FALSE,TRUE,NA,NA
Scott McDonald,976355813907402753,2018-03-21T07:12:20Z,The annual @OliverWyman Social Impact report - it makes us all proud.//t.co/i8nFJJOEij,FALSE,FALSE,NA,NA
Scott McDonald,973134589794365440,2018-03-12T09:52:20Z,New #Brexit cost estimates: WTO tariffs & non-tariff barriers could cost UK firms around 27BN annually (equivalent to 1.5% GVA) & EU27 firms around 31BN annually (equivalent to 0.4% GVA). Read more://t.co/cuAJpE1qJ6 @CC_UK_PR #OliverWymanUK//t.co/yqGqVizowQ,FALSE,TRUE,NA,Brexit
Scott McDonald,968842265300004865,2018-02-28T13:36:10Z,I just watched the steam rise over the Mississippi. A boat worked its way through the thick fog and looked like a century-old battleship.,FALSE,FALSE,NA,NA
Scott McDonald,968429308820836352,2018-02-27T10:15:14Z,"My brother-in-law, the artist and soldier @Rochester222//t.co/LQElXzF0ZR",FALSE,FALSE,NA,NA
Scott McDonald,967326230168129538,2018-02-24T09:11:59Z,"Three cheers for mischievous, subversive and perverse authors//t.co/A8R6c0npO1",FALSE,FALSE,NA,NA
Scott McDonald,966957979550482433,2018-02-23T08:48:42Z,Olympic (ice) hockey finals are upon us. Brings out the Canadian patriot in me.,FALSE,FALSE,NA,NA
Scott McDonald,966955262870515712,2018-02-23T08:37:54Z,"I am not watching any more movies that have serial killers, abuse of woman or children or car chases in them. Any recommendations for me?",FALSE,FALSE,NA,NA
Scott McDonald,965885133432614913,2018-02-20T09:45:35Z,"#Economists will find the recently-released #budget in #Singapore interesting in many ways, including in the manner in which it seeks to help citizens position well for a #tech influenced/disrupted future as well as how future #tax changes are signaled. #economy #disruption",FALSE,TRUE,NA,Economists
Scott McDonald,965885133432614913,2018-02-20T09:45:35Z,"#Economists will find the recently-released #budget in #Singapore interesting in many ways, including in the manner in which it seeks to help citizens position well for a #tech influenced/disrupted future as well as how future #tax changes are signaled. #economy #disruption",FALSE,TRUE,NA,budget
Scott McDonald,965885133432614913,2018-02-20T09:45:35Z,"#Economists will find the recently-released #budget in #Singapore interesting in many ways, including in the manner in which it seeks to help citizens position well for a #tech influenced/disrupted future as well as how future #tax changes are signaled. #economy #disruption",FALSE,TRUE,NA,Singapore
Scott McDonald,961323572680691712,2018-02-07T19:39:34Z,"Book rec: Machine, Platform, Crowd. How much can you learn from one book?",FALSE,FALSE,NA,NA
Scott McDonald,961322334127878144,2018-02-07T19:34:39Z,.@elonmusk rocks. Bring on the BFR,FALSE,FALSE,NA,NA
Scott McDonald,958016627588714496,2018-01-29T16:38:57Z,Great @mercer report on retirement challenges//t.co/2QycF2yL0L,FALSE,FALSE,NA,NA
Scott McDonald,956192304750104579,2018-01-24T15:49:45Z,The Customer Value Gap: Oliver Wyman is launching its annual State of the Financial Services Industry report today @WEF. The 2018 edition offers perspectives on how #BigTech can help the industry understand the #valuegap://t.co/7kvTgQ935q #SOFS #OWFinancialServices #WEF18//t.co/uc9fJWyzE3,FALSE,TRUE,NA,NA
Scott McDonald,955428264830488576,2018-01-22T13:13:43Z,Oliver Wyman and @Mercer have been selected by @UNEP_FI to serve as expert advisors on #UnitedNations project examining climate-related risks and opportunities for financial institutions//t.co/mQ32V3oObb @FSB_TCFD #climateresilience #WEF18//t.co/V0y3c4yUMM,FALSE,TRUE,NA,UnitedNations
Scott McDonald,954336660745080832,2018-01-19T12:56:05Z,WOW indeed.//t.co/VJHHLgzeQe,TRUE,FALSE,NA,NA
Scott McDonald,953740513827606528,2018-01-17T21:27:12Z,"Book recommendation: @tomfriedman new book ""Thank You For Being Late"" is educational, fascinating and important.",FALSE,FALSE,NA,NA
Scott McDonald,953738712256598025,2018-01-17T21:20:03Z,LIVE now: The Global Risks Report 2018. Are you prepared for the risks and opportunities ahead? #Risks18 #WEF18 Read the report here://t.co/isuOgUGCDO//t.co/yQhwoGpzSF,FALSE,TRUE,NA,Risks18
Scott McDonald,953738712256598025,2018-01-17T21:20:03Z,LIVE now: The Global Risks Report 2018. Are you prepared for the risks and opportunities ahead? #Risks18 #WEF18 Read the report here://t.co/isuOgUGCDO//t.co/yQhwoGpzSF,FALSE,TRUE,NA,WEF18
Scott McDonald,953737919944110086,2018-01-17T21:16:54Z,"Times may be different from WWII, but it doesn't mean that the humanity towards refugees should be different. Good to be on @NPR @TEDRadioHour - listen in full here://t.co/uQYE9tEPax",FALSE,TRUE,NA,NA
Scott McDonald,953736618615164929,2018-01-17T21:11:44Z,@Rochester222 Love it,FALSE,FALSE,700683912,NA
Scott McDonald,943374878039736321,2017-12-20T06:57:52Z,A few days of rest. Ines and I breaking the skyline on a Cornish walk.//t.co/rkXIVTpdnV,FALSE,FALSE,NA,NA
Scott McDonald,939912717405704192,2017-12-10T17:40:29Z,Heathrow response to a little snow//t.co/rRML7xYPn2,FALSE,FALSE,NA,NA
Scott McDonald,939091354772234240,2017-12-08T11:16:41Z,Congratulations to our new Partners! We are pleased to announce 33 consulting professionals from 13 countries have been named Partners of the firm://t.co/bNou4gZ6Xq #OliverWymanCareers//t.co/ehGw3q1JGC,FALSE,TRUE,NA,NA
Scott McDonald,938378670825181184,2017-12-06T12:04:44Z,View in the car today. Hard to say we are not cost conscious @OliverWyman//t.co/kby8HIELZm,FALSE,FALSE,NA,NA
Scott McDonald,932997772273422336,2017-11-21T15:42:57Z,@AndrewRear Made my day,FALSE,FALSE,3055078738,NA
Scott McDonald,930741776020885505,2017-11-15T10:18:26Z,"this is what true sponsorship, mentorship, coaching, support, encouragement, friendship and OW family looks like in @NikkiDa67710958 . Thank you#OWCulture #missioninclude//t.co/DSVzaYr9xS",FALSE,TRUE,NA,NA
Scott McDonald,930105971640295425,2017-11-13T16:11:58Z,We're thrilled to be launching #MissionINCLUDE tomorrow with @OliverWyman - a progressive D&I scheme that works across traditional diversity 'labels' to include thinking style and personality for true inclusion!//t.co/OsPDFBP4u4//t.co/3e57JItNvy,FALSE,TRUE,NA,MissionINCLUDE
Scott McDonald,929347204841639937,2017-11-11T13:56:54Z,Watch @ScottMcDonaldOW & @AIGInsurance CEO on plans to address rapidly transforming industry://t.co/5SQUzlYzLv #OWInsuranceInsights//t.co/ZS93lyhSM7,FALSE,TRUE,NA,NA
Scott McDonald,928267755102412801,2017-11-08T14:27:33Z,I saw the Red Hot Chili Peppers at the @stand4heros event last night in New York and realized and I missed something really great and funky in the last 20 years,FALSE,FALSE,NA,NA
Scott McDonald,927637032578449409,2017-11-06T20:41:17Z,@AlanMcIntyre13 Scottish tenacity,FALSE,FALSE,574709887,NA
Scott McDonald,925694427850526720,2017-11-01T12:02:04Z,"NY attack: I run on that bike path most days I am in New York. Will be back on it on Monday, thinking of the victims and their families.",FALSE,FALSE,NA,NA
Scott McDonald,924920049227436032,2017-10-30T08:44:58Z,6 mos since Art. 50 triggered and the UK opinion polls have barely shifted. We are all just talking to ourselves more angrily and loudly,FALSE,FALSE,NA,NA
Scott McDonald,923798273235865601,2017-10-27T06:27:26Z,More from me on AI and workforce evolution//t.co/sOcxLtcBhU,TRUE,FALSE,NA,NA
Scott McDonald,922534046000873474,2017-10-23T18:43:51Z,@SamOnHealth @DHA_Dubai @OliverWyman You are everywhere. Are there multiple Sams out there?,FALSE,FALSE,807311847468638208,NA
Scott McDonald,920641078386089985,2017-10-18T13:21:52Z,Extraordinary interview//t.co/eKrWlgPalM,TRUE,FALSE,NA,NA
Scott McDonald,920635392944230400,2017-10-18T12:59:16Z,Am speaking today at the Fletcher School @IBGC_Fletcher on business and politics - a few hours on a university campus is always invigorating,FALSE,FALSE,NA,NA
Scott McDonald,920249477675520000,2017-10-17T11:25:47Z,"Our new leader in Asia, relaxing.//t.co/FEG9bTUKbQ",FALSE,FALSE,NA,NA
Scott McDonald,920084350837907457,2017-10-17T00:29:38Z,The plastics crisis isn't creeping up on us - it's caught us. We're only just beginning to realise how grave & far-reaching it is.//t.co/xSUAUut7el,FALSE,TRUE,NA,NA
Scott McDonald,919881920493826048,2017-10-16T11:05:15Z,@IBGC_Fletcher @FletcherSchool And I am delighted to be speaking,FALSE,FALSE,631465410,NA
Scott McDonald,917347903965945856,2017-10-09T11:15:58Z,"Some initial thoughts on Richard Thaler, Nobel Laureate, a post undergoing revision throughout the morning,//t.co/9zokXKyYIw",FALSE,TRUE,NA,NA
Scott McDonald,917330322257215488,2017-10-09T10:06:06Z,Oliver Wyman has been named one of the UK's Top 30 Employers by Working Families//t.co/LvmCzTzs7Y,FALSE,TRUE,NA,NA
Scott McDonald,917329402194792448,2017-10-09T10:02:27Z,"Book recommendation: @nfergus new tome, The Square and the Tower, is fascinating, important and timely #networks #hierarchy",FALSE,FALSE,NA,networks
Scott McDonald,917329402194792448,2017-10-09T10:02:27Z,"Book recommendation: @nfergus new tome, The Square and the Tower, is fascinating, important and timely #networks #hierarchy",FALSE,FALSE,NA,hierarchy
Scott McDonald,915482939256958976,2017-10-04T07:45:16Z,.@OliverWyman team on fire at Insure Tech conference #itc2017//t.co/Sv6E4XPHdF,TRUE,FALSE,NA,itc2017
Scott McDonald,915247956944674816,2017-10-03T16:11:32Z,Finally insurance is almost as cool as Matt Leonard's hair @OliverWyman #insurtech #ITC2017//t.co/i1IyhmoxDW,FALSE,TRUE,NA,insurtech
Scott McDonald,915247956944674816,2017-10-03T16:11:32Z,Finally insurance is almost as cool as Matt Leonard's hair @OliverWyman #insurtech #ITC2017//t.co/i1IyhmoxDW,FALSE,TRUE,NA,ITC2017
Scott McDonald,913028648738934785,2017-09-27T13:12:47Z,More climate-themed novels published these days. Here's good info on what climate experts make of this literature://t.co/LrHjNkTWER,FALSE,TRUE,NA,NA
Scott McDonald,913026327036534785,2017-09-27T13:03:34Z,"While understanding the concepts around #disruption is essential, I'm beginning to find the language - e.g. co-creation, agile - nauseating.",FALSE,FALSE,NA,disruption
Scott McDonald,912830439026515968,2017-09-27T00:05:10Z,"Am in Georgia (the US state) today and there are many vast swaps. Reminds me, fondly, of cottage country in Canada.",FALSE,FALSE,NA,NA
Scott McDonald,910950912918740992,2017-09-21T19:36:36Z,"Thanks to generations of curious, daring, intrepid explorers, we may know enough, soon enough, to chart safe passage into the future.//t.co/poS40xXOn9",FALSE,TRUE,NA,NA
Scott McDonald,910479896522215424,2017-09-20T12:24:57Z,The world can be cruel. One of our @MMC_Global colleagues lost her son in the Mexico City earthquake. Our thoughts are all with her.,FALSE,FALSE,NA,NA
Scott McDonald,910233985204310016,2017-09-19T20:07:48Z,A bird's eye view - the party's still going and the night is still young! #OWAlum Night @WallaceEvents London//t.co/Rc9n659113,FALSE,TRUE,NA,OWAlum
Scott McDonald,910229974635950080,2017-09-19T19:51:51Z,CEO @ScottMcDonaldOW joins expert panel to examine state of #refugeeworkrights 9/20. Learn more://t.co/Dxwdsena4H #OliverWymanCareers//t.co/gKoxiyHrRp,FALSE,TRUE,NA,refugeeworkrights
Scott McDonald,909907615798513664,2017-09-18T22:30:55Z,Winner! @deborahlabsow from our London office takes home the Corporate Leader trophy @forwardladies #flnationalawards//t.co/fVFLUNSFDG,FALSE,TRUE,NA,flnationalawards
Scott McDonald,908066105029267456,2017-09-13T20:33:25Z,Oldest building in Munich with the gang//t.co/LYUGXOxulQ,FALSE,FALSE,NA,NA
Scott McDonald,907947421770162176,2017-09-13T12:41:48Z,"Instead of buying the new IPhone, I am going to power up my old Nokia which had about 1 week of battery life and no time-wasting apps.",FALSE,FALSE,NA,NA
Scott McDonald,905708238267531264,2017-09-07T08:24:05Z,How do you explain the concept of vertical and horizontal businesses to a group?//t.co/Vb2AdvPEIA,FALSE,FALSE,NA,NA
Scott McDonald,905693646443356162,2017-09-07T07:26:06Z,@hernehillandy Everyone has a secret skill,FALSE,FALSE,56379528,NA
Scott McDonald,905690513499578368,2017-09-07T07:13:39Z,The full cast for our version of Alice in Wonderland//t.co/jPE5WagBcf,FALSE,FALSE,NA,NA
Scott McDonald,905608549010690048,2017-09-07T01:47:58Z,My Asian debut as the Mad Hatter//t.co/FXsbtKNqnM,FALSE,FALSE,NA,NA
Scott McDonald,905559721586954241,2017-09-06T22:33:56Z,Sunrise in Bali at our APR offsite.//t.co/iPAV6NyeBX,FALSE,FALSE,NA,NA
Scott McDonald,904831733635284992,2017-09-04T22:21:10Z,The Tiger Balm stands in the Singapore airport always delight me for some unknown reason//t.co/SWbAlDITqt,FALSE,FALSE,NA,NA
Scott McDonald,903213930755104774,2017-08-31T11:12:36Z,"Excellent piece on balancing stability, innovation and growth - as a bonus, an interview with Ted Moynihan on same//t.co/L2kFTYea1t",FALSE,FALSE,NA,NA
Scott McDonald,900972713745010688,2017-08-25T06:46:48Z,End of an era: I lost to Ines in table football today//t.co/6hyX1IA5vl,FALSE,FALSE,NA,NA
Scott McDonald,898439718957752320,2017-08-18T07:01:35Z,We have people @oliverwyman in all the places evil strikes. The defiant and generous responses show me why kindness will defeat evil.,FALSE,FALSE,NA,NA
Scott McDonald,898297157916254208,2017-08-17T21:35:06Z,"""Holloways are just tracks,"" she interrupted impatiently. ""Very old tracks, though...tracks between different worlds"" (Holdstock, Lavondyss)//t.co/LUf4HyF1HM",FALSE,TRUE,NA,NA
Scott McDonald,893557191944359936,2017-08-04T19:40:10Z,Co-Director of @OliverWyman #PracticingWisely on curbing the opioid crisis with analytics.//t.co/QLC23gNrSN,FALSE,TRUE,NA,PracticingWisely
Scott McDonald,892998668617383936,2017-08-03T06:40:48Z,Chart a course to improve #digital capabilities by learning from major cities - Partner Paul Beswick #AuthoredByOW @HarvardBiz//t.co/509lVnTOSR,FALSE,TRUE,NA,digital
Scott McDonald,892998668617383936,2017-08-03T06:40:48Z,Chart a course to improve #digital capabilities by learning from major cities - Partner Paul Beswick #AuthoredByOW @HarvardBiz//t.co/509lVnTOSR,FALSE,TRUE,NA,AuthoredByOW
Scott McDonald,884115731218132993,2017-07-09T18:23:11Z,Towards the peak with Davide//t.co/osR7gcnZN7,FALSE,FALSE,NA,NA
Scott McDonald,878495270287417344,2017-06-24T06:09:28Z,.@OliverWyman team at work in New York//t.co/64j6agqU1U,FALSE,FALSE,NA,NA
