name,status_id,created_at,text,is_quote,is_retweet,reply_to_user_id,hashtags
Scott McDonald,773204718948585472,2016-09-06T17:02:25Z,You could fit a country (the Vatican) inside the main Boeing factory in Washington.//t.co/zWTTAapIkf,FALSE,FALSE,NA,NA
Scott McDonald,772967807961198593,2016-09-06T01:21:01Z,"OK, I admit it. Vancouver may be the world's most beautiful city. Ran along the sea wall yesterday in awe.",FALSE,FALSE,NA,NA
Scott McDonald,772967518348640256,2016-09-06T01:19:52Z,Majestic fishing photo (art) from Roger Lehman//t.co/6ikqYGtWHP,FALSE,FALSE,NA,NA
Scott McDonald,769468351571693568,2016-08-27T09:35:25Z,Cool idea. 30-hour week for 75% of the pay (+ benefits) //t.co/i7WIYvaQ6I,FALSE,TRUE,NA,NA
Scott McDonald,769466771057307651,2016-08-27T09:29:08Z,This fantastic book by my friend #stevemcdonald is simply... Fantastic! @ChronicleBooks//t.co/rh77LNmY5C,FALSE,TRUE,NA,stevemcdonald
Scott McDonald,769256773035421697,2016-08-26T19:34:41Z,Red Arrows over Salcombe Regis tonight - amazing.//t.co/UBQCDu7fbe,FALSE,FALSE,NA,NA
Scott McDonald,769139512379342848,2016-08-26T11:48:44Z,Love. Betrayal. Madness. Dr Laura Fish @NorthumbriaUni & Julia Rochester on #WideSargassoSea at 50 #MrsRochester//t.co/NblzIBeUr6,FALSE,TRUE,NA,WideSargassoSea
Scott McDonald,769139512379342848,2016-08-26T11:48:44Z,Love. Betrayal. Madness. Dr Laura Fish @NorthumbriaUni & Julia Rochester on #WideSargassoSea at 50 #MrsRochester//t.co/NblzIBeUr6,FALSE,TRUE,NA,MrsRochester
Scott McDonald,769052309871554560,2016-08-26T06:02:13Z,"In cooperation with the Singapore Economic Development Board, we launch the Asia Pacific Risk Centre in Singapore//t.co/mriKrOsCjt",FALSE,FALSE,NA,NA
Scott McDonald,763980853152129024,2016-08-12T06:10:04Z,"Europe, for me, meant family.' Julia Rochester on being not-quite-British part of our BREXIT series.//t.co/Bl1PKoFQXH",FALSE,TRUE,NA,NA
Scott McDonald,755760053181964288,2016-07-20T13:43:32Z,Running Faster to Stand Still: Interesting report on the challenges ahead in the Asset Management industry//t.co/cOFXiA8952,FALSE,FALSE,NA,NA
Scott McDonald,754975087451840513,2016-07-18T09:44:22Z,More on blockchain from the Oliver Wyman team//t.co/4WDLrQ66Mt,FALSE,FALSE,NA,NA
Scott McDonald,754974379876950016,2016-07-18T09:41:33Z,"Nice article on one of our early alumni, @DebbieWossk, and her business: Love Home Swap//t.co/n6jPAgM1GS",FALSE,FALSE,NA,NA
Scott McDonald,754713707624665088,2016-07-17T16:25:44Z,On water by 6am this morning. Rewarded with lunch.//t.co/JRYqeHnThp,FALSE,FALSE,NA,NA
Scott McDonald,740109569305804800,2016-06-07T09:14:06Z,Huge congratulations to @rupalkantaria who won the We Are The City Diversity Rising Star award//t.co/8inXPDTb2g,FALSE,TRUE,NA,NA
Scott McDonald,738762708032557056,2016-06-03T16:02:09Z,Ines didn't like her present from Indonesia//t.co/AgArob3QpH,FALSE,FALSE,NA,NA
Scott McDonald,737747370679664641,2016-05-31T20:47:34Z,Special OW contributors dinner at the Cutty Sark//t.co/FygY8WsIR5,FALSE,FALSE,NA,NA
Scott McDonald,737196778064384000,2016-05-30T08:19:43Z,Proud that @OliverWyman named @GPTW_US @FortuneMagazine #BestWorkplaces for recent Grads//t.co/3OsV0OWATL//t.co/p6wSHT2aYZ,FALSE,FALSE,NA,BestWorkplaces
Scott McDonald,735066289190916096,2016-05-24T11:13:54Z,Julia Rochester: 'My fiction is preoccupied with belonging and exile'//t.co/rPLWzbfRpT,FALSE,TRUE,NA,NA
Scott McDonald,727819304184512512,2016-05-04T11:16:59Z,Excellent article by @oliverwyman partner Sam Glick on the future of healthcare//t.co/73G1jfZdGq,FALSE,FALSE,NA,NA
Scott McDonald,722808953780895745,2016-04-20T15:27:38Z,Oliver Wyman alumnus Antonia Romeo appointed first female British consul general in New York//t.co/RWqVqv0tqt,FALSE,FALSE,NA,NA
Scott McDonald,720929400838037506,2016-04-15T10:58:58Z,New McGill management faculty building - Dec 2017!//t.co/KgxKac8GBZ,FALSE,FALSE,NA,NA
Scott McDonald,720235561949245441,2016-04-13T13:01:53Z,.@OliverWyman's #energy team explains what deepwater oil & gas co's can learn from the shale revolution//t.co/ok1mJXbaNY,FALSE,FALSE,NA,energy
Scott McDonald,719919424468316160,2016-04-12T16:05:40Z,Good MMC piece on ransomware//t.co/N7WQxH1wdh,TRUE,FALSE,NA,NA
Scott McDonald,719919141759643648,2016-04-12T16:04:33Z,Growth of alternative health sites...//t.co/fb2sMizidg,TRUE,FALSE,NA,NA
Scott McDonald,719918951787012096,2016-04-12T16:03:48Z,We now have a Korean website://t.co/8Z9QpLS5cC//t.co/SUTgLpOmdU,FALSE,FALSE,NA,NA
Scott McDonald,719918631728111620,2016-04-12T16:02:31Z,"My colleague, Peter Beshar, supporting refugees in Jordan//t.co/K2IVhmxQn4",TRUE,FALSE,NA,NA
Scott McDonald,719918377800753155,2016-04-12T16:01:31Z,How to survive in the #retail wilderness - a new report from @OliverWyman //t.co/BmFek4FWXx,FALSE,FALSE,NA,retail
Scott McDonald,718415864106770433,2016-04-08T12:31:04Z,Big Data in aviation is here with a roar or a whimper? @OliverWyman's MRO Survey 2016 explains #MROAM//t.co/pg61yaYjyC,FALSE,FALSE,NA,MROAM
Scott McDonald,718347922400788480,2016-04-08T08:01:05Z,Seaweed is the new Kale in UK//ow.ly/10o4Ct,FALSE,FALSE,NA,NA
Scott McDonald,718340273634439168,2016-04-08T07:30:42Z,The toll of #Congo's civil war on all primates//t.co/jt57FhuGAS,FALSE,FALSE,NA,Congo
Scott McDonald,718076173318799360,2016-04-07T14:01:15Z,How can the seas save us? A blue-green economy//t.co/rNGeubD6F5,FALSE,FALSE,NA,NA
Scott McDonald,718068477433667584,2016-04-07T13:30:40Z,"According to the longest study of #happiness, the good life comes from good relationships via @YouTube @TEDTalks//t.co/Namfh39TSU",FALSE,FALSE,NA,happiness
Scott McDonald,718061024587489281,2016-04-07T13:01:03Z,Can Handwriting Make You Smarter? - Students who take notes by hand outperform students who type//t.co/ifZCD2b2Kq,FALSE,FALSE,NA,NA
Scott McDonald,718053356648923136,2016-04-07T12:30:35Z,.@OliverWyman's 2016 MRO Survey identifies and analyzes the airline industry's latest trends #MROAM//t.co/p4bhbmJ1ky,FALSE,FALSE,NA,MROAM
Scott McDonald,718028797082206208,2016-04-07T10:53:00Z,@dhaselkorn Ha! No. She wouldn't buy that.,FALSE,FALSE,37783881,NA
Scott McDonald,717982564015874049,2016-04-07T07:49:17Z,"Judging from my recent trip to #Rwanda, this #drone for #medicine is much-needed via @nkulw//t.co/xAVvblCm3u",FALSE,FALSE,NA,Rwanda
Scott McDonald,717982564015874049,2016-04-07T07:49:17Z,"Judging from my recent trip to #Rwanda, this #drone for #medicine is much-needed via @nkulw//t.co/xAVvblCm3u",FALSE,FALSE,NA,drone
Scott McDonald,717982564015874049,2016-04-07T07:49:17Z,"Judging from my recent trip to #Rwanda, this #drone for #medicine is much-needed via @nkulw//t.co/xAVvblCm3u",FALSE,FALSE,NA,medicine
Scott McDonald,717981503968428032,2016-04-07T07:45:04Z,"I'm always telling Ines she needs more grit, as well as talent.//t.co/0Z6BgUHS31",TRUE,FALSE,NA,NA
Scott McDonald,717981117282979840,2016-04-07T07:43:32Z,And congratulations from me.//t.co/Y8yUzD7L4b,TRUE,FALSE,NA,NA
Scott McDonald,717980963339444224,2016-04-07T07:42:55Z,And congratulations from me.//t.co/wBqV9aCvaw,TRUE,FALSE,NA,NA
Scott McDonald,717960857234382852,2016-04-07T06:23:02Z,"Canada no1 exporter of Scots traditional music; theirs is more upbeat. When Scots migrated there, they cheered up.//t.co/mzxDxN6h5a",FALSE,TRUE,NA,NA
Scott McDonald,717803514265731072,2016-04-06T19:57:48Z,Deep #sea mining is definitely coming. So is there a way to do it sustainably?//t.co/FBITVfE7UV//t.co/XX9vcMC1gQ,FALSE,TRUE,NA,sea
Scott McDonald,717693563312685056,2016-04-06T12:40:54Z,Good perspective on the importance of jobs for refugees from @shikhadalmia aligned with my recent FT opinion piece//t.co/aCTT9yovPr,FALSE,FALSE,NA,NA
Scott McDonald,717669215621218308,2016-04-06T11:04:09Z,Some thoughts on customer experience-based approaches in #telecoms from the @OliverWyman team//t.co/iQpLi9Z6FS,FALSE,FALSE,NA,telecoms
Scott McDonald,717249651150360577,2016-04-05T07:16:57Z,Views from @oliverwyman offices around the world//t.co/d8fauzSENT,FALSE,FALSE,NA,NA
Scott McDonald,717249042930135040,2016-04-05T07:14:32Z,New @oliverwyman perspectives on #Manufacturing//t.co/8iKJQEzWOU,FALSE,FALSE,NA,Manufacturing
Scott McDonald,717248053338578945,2016-04-05T07:10:36Z,Reducing food waste - how can retailers help? From our @oliverwyman retail team//t.co/kn1NZUx5QN,FALSE,FALSE,NA,NA
Scott McDonald,717243506159431681,2016-04-05T06:52:32Z,Julia spills the beans on what we do at Easter in the McDonald house//t.co/TdTxBPOiiK,FALSE,FALSE,NA,NA
Scott McDonald,715882636389064705,2016-04-01T12:44:55Z,Listened to Toots & the Maytals last night for first time in a while - very fine. I fear all this serious business has cost me my rhythm.,FALSE,FALSE,NA,NA
Scott McDonald,715658030134722560,2016-03-31T21:52:25Z,The House at the Edge of the World JuliaRochester//t.co/sQujkDbaBf,FALSE,TRUE,NA,NA
Scott McDonald,715474211582574592,2016-03-31T09:41:59Z,"UK Parental Leave policies evolve, but society moving a bit slower//t.co/QhOquNXTau",FALSE,FALSE,NA,NA
Scott McDonald,715472848295301121,2016-03-31T09:36:34Z,"Dolphin interrupts pro surfing competition, wins honorable mention//t.co/6Zr8UzkUJK",FALSE,FALSE,NA,NA
Scott McDonald,715472511136190464,2016-03-31T09:35:14Z,.@OliverWyman's Tom Main in The Commonwealth Fund's report on #health system improvement//t.co/EIg5mAG6oo,FALSE,FALSE,NA,health
Scott McDonald,715215787124981760,2016-03-30T16:35:06Z,"Expect half as many large grocers in Europe by 2025, read our Retail expert Bernard Demeure @BDvZvdB @leJDD//t.co/J7rzZpfXgm",FALSE,TRUE,NA,NA
Scott McDonald,715215729965056000,2016-03-30T16:34:52Z,Exceptional panel of speakers from @accentureukjobs @CapitaGraduates @LBS @Atos &@OliverWyman - thank you. #WomeninLeadership. #BrightWomen,FALSE,TRUE,NA,NA
Scott McDonald,715215636239106052,2016-03-30T16:34:30Z,Great article from @OliverWyman: New Front Door to Healthcare: Retailers Take Starting-Point Advantage//t.co/RxE6CrFHSJ,FALSE,TRUE,NA,NA
Scott McDonald,715215579871887361,2016-03-30T16:34:16Z,"Download The Energy Journal Vol. 2, now available in our Oliver Wyman Ideas app. #energy//t.co/wNuAw8OJJa",FALSE,TRUE,NA,energy
Scott McDonald,715215279958175746,2016-03-30T16:33:05Z,"Our Partner Sam Glick is quoted in today's @WSJ article ""Affordable Care Act Enrollee Spending Is Increasing""://t.co/7p4dUr8AJg",FALSE,TRUE,NA,NA
Scott McDonald,715214488870461440,2016-03-30T16:29:56Z,.@oliverwyman's Roland Rechtsteiner featured in the FT on commodity trading performance//t.co/z4h5WwH6Ll,FALSE,FALSE,NA,NA
Scott McDonald,715211914830356481,2016-03-30T16:19:43Z,.@OliverWyman's Bernhard Hartmann & Saji Sam on what low oil prices really mean//t.co/nHPXemteFk,FALSE,FALSE,NA,NA
Scott McDonald,715210711610302465,2016-03-30T16:14:56Z,Proud day @OliverWyman shatters a Guinness World Record in Dallas with @TangoTab #TangoTabBreaksIt #GWR2016//t.co/oZBiTzP3da,FALSE,FALSE,NA,TangoTabBreaksIt
Scott McDonald,715210711610302465,2016-03-30T16:14:56Z,Proud day @OliverWyman shatters a Guinness World Record in Dallas with @TangoTab #TangoTabBreaksIt #GWR2016//t.co/oZBiTzP3da,FALSE,FALSE,NA,GWR2016
Scott McDonald,714868713422499841,2016-03-29T17:35:57Z,#BooksOf2016. 23. The House at the Edge of the World by @juliarochester1. Utterly brilliant. I hugged it afterwards.//t.co/ZFp92uodnQ,FALSE,TRUE,NA,BooksOf2016
Scott McDonald,713620447150080000,2016-03-26T06:55:47Z,"Going for a walk in the fog and wind and rain on Dartmoor today. If I don't return, please close Twitter account.",FALSE,FALSE,NA,NA
Scott McDonald,712987814787465216,2016-03-24T13:01:56Z,"Plastic bottle litter on beaches up 43%, conservationists say//t.co/fLLY4iuPnt",FALSE,FALSE,NA,NA
Scott McDonald,712972616802418689,2016-03-24T12:01:32Z,Does working fewer hours make you more productive? #leadership #productivity//t.co/eArGaMBqJp,FALSE,FALSE,NA,leadership
Scott McDonald,712972616802418689,2016-03-24T12:01:32Z,Does working fewer hours make you more productive? #leadership #productivity//t.co/eArGaMBqJp,FALSE,FALSE,NA,productivity
Scott McDonald,712632607427719168,2016-03-23T13:30:28Z,Businesses are embracing the idea of working in teamsbut managing them is hard//t.co/3XaTJqqzn6,FALSE,FALSE,NA,NA
Scott McDonald,712625101515186176,2016-03-23T13:00:38Z,Why leaders should embrace being bad at new things #work #leadership//t.co/6J2xiYcRXi,FALSE,FALSE,NA,work
Scott McDonald,712625101515186176,2016-03-23T13:00:38Z,Why leaders should embrace being bad at new things #work #leadership//t.co/6J2xiYcRXi,FALSE,FALSE,NA,leadership
Scott McDonald,712612205414510592,2016-03-23T12:09:24Z,Last night I folded and taped 23 paper boxes for Ines to fill with chocolates for her classmates for Easter - kids are nicer than I remember,FALSE,FALSE,NA,NA
Scott McDonald,712607655479615488,2016-03-23T11:51:19Z,Shining a spotlight on the female talent pipeline//t.co/IU8ihIcPv8,FALSE,FALSE,NA,NA
Scott McDonald,712575095684915200,2016-03-23T09:41:56Z,How to distinguish which #insurance policies cover you for #terrorist attacks #Brussels//t.co/hG9efbnoCt//t.co/UwWfreISto,FALSE,TRUE,NA,insurance
Scott McDonald,712575095684915200,2016-03-23T09:41:56Z,How to distinguish which #insurance policies cover you for #terrorist attacks #Brussels//t.co/hG9efbnoCt//t.co/UwWfreISto,FALSE,TRUE,NA,terrorist
Scott McDonald,712575095684915200,2016-03-23T09:41:56Z,How to distinguish which #insurance policies cover you for #terrorist attacks #Brussels//t.co/hG9efbnoCt//t.co/UwWfreISto,FALSE,TRUE,NA,Brussels
Scott McDonald,712574926906109952,2016-03-23T09:41:16Z,.@MMC_Global places #26 in @MilitaryTimes Best for Vets Employers 2016 rankings. See full list://t.co/kr7J0A9i4m #veterans,FALSE,TRUE,NA,NA
Scott McDonald,712573827713273856,2016-03-23T09:36:54Z,.@OliverWyman's new Energy Journal is out//t.co/cVw8ZzX5Gk,FALSE,FALSE,NA,NA
Scott McDonald,712287679178735616,2016-03-22T14:39:51Z,Read my interview with @Wigdortz (a former high school mathlete) about his views on maths teaching//t.co/DEHgscwVuJ,FALSE,TRUE,NA,NA
Scott McDonald,712247940606246912,2016-03-22T12:01:56Z,Seaworld ending Orca program//t.co/Tc6EZTsTRh,FALSE,FALSE,NA,NA
Scott McDonald,712232763735330816,2016-03-22T11:01:38Z,More Insiders Are Becoming CEOs//t.co/guJ9MbNr4g via @harvardbiz,FALSE,FALSE,NA,NA
Scott McDonald,711900383984140288,2016-03-21T13:00:52Z,How the technology behind bitcoin is going to change the lives of the bottom billion//t.co/7Zf4SX1k3l via @fastcompany,FALSE,FALSE,NA,NA
Scott McDonald,711885232975319040,2016-03-21T12:00:40Z,Good infographic from @MarshGlobal on who's accountable for managing #cyber risk//t.co/a6kUiEvNbn,FALSE,FALSE,NA,cyber
Scott McDonald,711870080137699328,2016-03-21T11:00:27Z,.@OliverWyman imagines how highways could evolve in response to #driverless vehicles//t.co/K8b7kEujTC//t.co/XJwG3Vc7uU,FALSE,FALSE,NA,driverless
Scott McDonald,711850483808407552,2016-03-21T09:42:35Z,"Gorgeous photos of underwater sculptures, teeming with life://t.co/vaJaKrUDCJ//t.co/JAe2GdRC3U",FALSE,TRUE,NA,NA
Scott McDonald,711849263710543872,2016-03-21T09:37:44Z,UK to implement #sugartax in response to rising obesity rates. Some insight on cross-sector approaches attached//t.co/2xHE7iiBA1,FALSE,FALSE,NA,sugartax
Scott McDonald,711848369681989633,2016-03-21T09:34:11Z,"Nomis and Oliver Wyman to Spotlight Growth at Upcoming Banking Growth Forum, May 18th20th//t.co/IuIrBf09vb//t.co/mou72eegpC",FALSE,TRUE,NA,NA
Scott McDonald,711661415615111169,2016-03-20T21:11:18Z,"How To Make Sure Your Kids Have Grit, 6 Secrets Backed By Research//t.co/nyTtZQ8E5U (via @bakadesuyo)",FALSE,TRUE,NA,NA
Scott McDonald,710479153468936194,2016-03-17T14:53:24Z,Does knowing genetic risk actually motivate people to make healthier choices?//t.co/Yo6K5gFs6c//t.co/iORItlOJSu,FALSE,TRUE,NA,NA
Scott McDonald,710477694866161664,2016-03-17T14:47:37Z,Customers like Retail Health Clinics - they will grow and the #health industry will have to adapt to them. //t.co/80tWEyuCfE,FALSE,FALSE,NA,health
Scott McDonald,710160536571420674,2016-03-16T17:47:20Z,New @OliverWyman report on risk management for non-profits. Imagine that.//t.co/KFdBkeXBp6,FALSE,FALSE,NA,NA
Scott McDonald,710031037405990912,2016-03-16T09:12:45Z,A mysterious death & George Orwell... My thoughts on @BaileysPrize longlisted The House at the Edge of the World://t.co/NcpngHKoBt,FALSE,TRUE,NA,NA
Scott McDonald,709708448905240577,2016-03-15T11:50:54Z,The high-horse brigade can get stuffed. Joan Bakewell had a point//t.co/6d8qidVu4G//t.co/d4eQloRJfF,FALSE,TRUE,NA,NA
Scott McDonald,709477027557023745,2016-03-14T20:31:19Z,The @OliverWyman annual report with @MorganStanley on wholesale banking and asset management - always a good read.//t.co/WozhBvMYbi,FALSE,FALSE,NA,NA
Scott McDonald,709076038547021825,2016-03-13T17:57:56Z,Two walks by the sea this weekend - good for the soul.,FALSE,FALSE,NA,NA
Scott McDonald,708299101495021570,2016-03-11T14:30:40Z,Are you a #digital laggard or leader? Try our interactive assessment tool find out//t.co/8G48wWWrdU,FALSE,FALSE,NA,digital
Scott McDonald,708291648468480000,2016-03-11T14:01:03Z,Putting the headlines into perspective - what recent moves mean for the #healthcare industry from @OliverWyman//t.co/Eo3L1iYPYw,FALSE,FALSE,NA,healthcare
Scott McDonald,708283979196194816,2016-03-11T13:30:34Z,Is winning in #healthcare only about being the best of the worst? Some thoughts from @OliverWyman's @Helen_Leis//t.co/Edwsh1u26w,FALSE,FALSE,NA,healthcare
Scott McDonald,708209832294293504,2016-03-11T08:35:56Z,It's British Science Week! Do you have what it takes to teach science or maths? Apply to join our programme://t.co/xDO9V3uhue #BSW16,FALSE,TRUE,NA,NA
Scott McDonald,708209242549911552,2016-03-11T08:33:35Z,On 25 April we look at the longest-running study of human development in the world://t.co/gmWllOa21I//t.co/5ydQjSuBU5,FALSE,TRUE,NA,NA
Scott McDonald,708207772320538625,2016-03-11T08:27:45Z,Best thing I've seen for ages: The Encounter at @BarbicanCentre @SimonMcBurney @Complicite - Now I'm going to burn everything I own.,FALSE,FALSE,NA,NA
Scott McDonald,707566955734163456,2016-03-09T14:01:22Z,Interesting @nytimes video shows how to turn oil rigs into reefs teeming with marine life.//t.co/tZDFTCBFwX,FALSE,FALSE,NA,NA
Scott McDonald,707476073987100672,2016-03-09T08:00:14Z,A bankless future? @OliverWyman's Barrie Wilkinson talks about bracing for the unbundling of banks//t.co/vH8Mz4eKR8,FALSE,FALSE,NA,NA
Scott McDonald,707473546801520640,2016-03-09T07:50:12Z,"New spawning ground for bluefin tuna identified off NE US ""Slope Sea"" //t.co/NtsJH21y4l//t.co/zOf1z5LJmj",FALSE,TRUE,NA,NA
Scott McDonald,707473154269122560,2016-03-09T07:48:38Z,"China stock-market value. June, 2015: $10 trillion Feb, 2016: $5.7 trillion",FALSE,TRUE,NA,NA
Scott McDonald,707473057326227456,2016-03-09T07:48:15Z,A total solar eclipse will unfold over parts of Indonesia and the Indian and Pacific Oceans today//t.co/IavnmbOyWf,FALSE,FALSE,NA,NA
Scott McDonald,707466907268608000,2016-03-09T07:23:49Z,Big Sis @juliarochester1 on @BaileysPrize longlist! Congrats @KarolinaSutton @PenguinUKBooks//t.co/AlsGLyU563//t.co/cVfqKumTXP,FALSE,TRUE,NA,NA
Scott McDonald,707466530859175936,2016-03-09T07:22:19Z,#FunFacts 55% of hotels rooms have had someone die in them,FALSE,TRUE,NA,FunFacts
Scott McDonald,707260182422802433,2016-03-08T17:42:22Z,"We're designing happiness, guilty pleasures included, at #SXSW //t.co/y2vdppAjBy #findyourhappy @sxsw//t.co/xV5yRPJt1c",FALSE,TRUE,NA,SXSW
Scott McDonald,707260182422802433,2016-03-08T17:42:22Z,"We're designing happiness, guilty pleasures included, at #SXSW //t.co/y2vdppAjBy #findyourhappy @sxsw//t.co/xV5yRPJt1c",FALSE,TRUE,NA,findyourhappy
Scott McDonald,707259919624486912,2016-03-08T17:41:19Z,"Road signs simplify, but you'll never love a stop sign. Brands must both simplify and seduce//t.co/JJyGXgPhg3//t.co/YZRtqhHHxM",FALSE,TRUE,NA,NA
Scott McDonald,707258171065241600,2016-03-08T17:34:22Z,Creepy deepwater fish surprises Nova Scotia fisherman//t.co/UWUzG4nLvB//t.co/ygcXLnRu5T,FALSE,TRUE,NA,NA
Scott McDonald,707234841801170944,2016-03-08T16:01:40Z,Is the Meaning of Work About to Change?//t.co/k3tekEWjjt via @WEF,FALSE,FALSE,NA,NA
Scott McDonald,707219642763366400,2016-03-08T15:01:16Z,How the #reinsurance industry is preparing for changing types of losses caused by #terrorism://t.co/UQbc27DXBi via @GuyCarpenter,FALSE,FALSE,NA,reinsurance
Scott McDonald,707219642763366400,2016-03-08T15:01:16Z,How the #reinsurance industry is preparing for changing types of losses caused by #terrorism://t.co/UQbc27DXBi via @GuyCarpenter,FALSE,FALSE,NA,terrorism
Scott McDonald,707204502429028352,2016-03-08T14:01:07Z,.@oliverwyman partners Michael Duane and Til Schuermann discuss the bright side #CCAR in this #video series//t.co/kxWFudNJNK,FALSE,FALSE,NA,CCAR
Scott McDonald,707204502429028352,2016-03-08T14:01:07Z,.@oliverwyman partners Michael Duane and Til Schuermann discuss the bright side #CCAR in this #video series//t.co/kxWFudNJNK,FALSE,FALSE,NA,video
Scott McDonald,707180211713011712,2016-03-08T12:24:35Z,"Congrats to Penguin General authors Julia Rochester and Elizabeth Strout, both nominated for the @BaileysPrize!//t.co/pPLpwIgnlO",FALSE,TRUE,NA,NA
Scott McDonald,707174175191003136,2016-03-08T12:00:36Z,"440M year old fossil oldest land dwelling organism ever found, beating previous record set by Keith Richards//t.co/Sj6D8KwuLr",FALSE,FALSE,NA,NA
Scott McDonald,707170286970527745,2016-03-08T11:45:09Z,"Scientists @NOAA discover it's loud 36,000 feet below sea level//t.co/bUNkLZczkU",FALSE,FALSE,NA,NA
Scott McDonald,707166532829368320,2016-03-08T11:30:14Z,South Africa expands national parks in the sea' by creating 70000 km2 network of marine protected areas//t.co/ZVTkh6ACvI,FALSE,FALSE,NA,NA
Scott McDonald,707159958933135360,2016-03-08T11:04:07Z,How to reach the millions out-of-school children in Asia? Take risks.//t.co/S8ix24eZO7 @UNESCO_AsiaPac @UNICEFROSA via @thenation,FALSE,FALSE,NA,NA
Scott McDonald,707158834222120960,2016-03-08T10:59:39Z,"44% of #manufacturing companies have fallen victim to #datatheft, espionage or sabotage. How to counter?//t.co/KYaB0z0hsq",FALSE,TRUE,NA,manufacturing
Scott McDonald,707158834222120960,2016-03-08T10:59:39Z,"44% of #manufacturing companies have fallen victim to #datatheft, espionage or sabotage. How to counter?//t.co/KYaB0z0hsq",FALSE,TRUE,NA,datatheft
Scott McDonald,705745515422588928,2016-03-04T13:23:37Z,"Syria, as the world watches.//t.co/jJEivure8i",FALSE,TRUE,NA,NA
Scott McDonald,705733921854595072,2016-03-04T12:37:33Z,Why airport security lines have grown longer//t.co/tpMBL7cfRl via @WSJ,FALSE,TRUE,NA,NA
Scott McDonald,705733892171538434,2016-03-04T12:37:26Z,How French elite schools are disrupting themselves //t.co/v2uvwiXhFb via @WSJ,FALSE,TRUE,NA,NA
Scott McDonald,705733273251672064,2016-03-04T12:34:58Z,Interesting opportunity for those focused on or interested in the area//t.co/ifNxzzI2aU,TRUE,FALSE,NA,NA
Scott McDonald,705309708970758144,2016-03-03T08:31:53Z,Can health be the new wealth for Singapore//t.co/F5hWpv3T3B from @OliverWyman partner Jeremy Lim,FALSE,FALSE,NA,NA
Scott McDonald,704957055996665856,2016-03-02T09:10:34Z,The irresponsible stoaking of bigotry by many and the evident rage at traditional leaders of all types is changing the course of history.,FALSE,FALSE,NA,NA
Scott McDonald,704639369689350144,2016-03-01T12:08:11Z,More @pat_milligan1 on Where Women Thrive //t.co/iBbmKOGc2y,FALSE,FALSE,NA,NA
Scott McDonald,704615495140515840,2016-03-01T10:33:19Z,"Orgs need honest employee feedback, but it can be hard to get. Messaging from the top can help: @HRExecMag //t.co/w4pstav8dr",FALSE,TRUE,NA,NA
Scott McDonald,704615246107951105,2016-03-01T10:32:20Z,Greece cannot manage situation alone. Crucial that relocation efforts agreed to by Europe in 2015 be prioritized and implemented.,FALSE,TRUE,NA,NA
Scott McDonald,704615130009640961,2016-03-01T10:31:52Z,How many RTs can this #Hero get. One of the special people who look after the innocents of poaching! @RickyGervais//t.co/JeJzi6ms4H,FALSE,TRUE,NA,Hero
Scott McDonald,704316003514187776,2016-02-29T14:43:15Z,Can publishing keep its soul in an increasingly data-driven future?//t.co/wQ7kH80TxT,FALSE,TRUE,NA,NA
Scott McDonald,704305526604173312,2016-02-29T14:01:37Z,Female coders are rated more highly than menexcept when people know they're women via @qz//t.co/lCNaAq9H6W,FALSE,FALSE,NA,NA
Scott McDonald,704219604013486080,2016-02-29T08:20:12Z,New report from @WEF and @oliverwyman on #socialinnovation. How companies can do well and do good.//t.co/kewvsL4MHE,FALSE,FALSE,NA,socialinnovation
Scott McDonald,704219445615583232,2016-02-29T08:19:34Z,Not your father's logistics. Amazon wants to fundamentally change the way we shop. @MichaelLierow @Forbes//t.co/szWuBY8ZBs,FALSE,FALSE,NA,NA
Scott McDonald,703287715211698177,2016-02-26T18:37:12Z,Quick swim before heading back to London and Brexit and all that.//t.co/OjqTmsQXvt,FALSE,FALSE,NA,NA
Scott McDonald,702824789824708610,2016-02-25T11:57:42Z,Our latest research with @BigSocietyCap highlights direct & indirect vehicles for corporate #socialinvestment//t.co/EXlpBQF73g,FALSE,TRUE,NA,socialinvestment
Scott McDonald,702808434165604354,2016-02-25T10:52:42Z,What's with the decline in teen reading?//t.co/OEk3286Zl2//t.co/vKi0ri4nvG,FALSE,TRUE,NA,NA
Scott McDonald,702489465332301824,2016-02-24T13:45:14Z,Now that I am a gorilla expert...//t.co/yqFCCgsecN,TRUE,FALSE,NA,NA
Scott McDonald,702488725524258816,2016-02-24T13:42:18Z,Fine advice//t.co/bQiNRtGQbI,TRUE,FALSE,NA,NA
Scott McDonald,702488319628857345,2016-02-24T13:40:41Z,"165M plastic particles are floating in New York City waters, more than 256,000 particles per square kilometer.//t.co/S8uxoLaIyP",FALSE,FALSE,NA,NA
Scott McDonald,702482942380150784,2016-02-24T13:19:19Z,Robot abuse//t.co/KAdYIAjPPl,FALSE,FALSE,NA,NA
Scott McDonald,702467577629507584,2016-02-24T12:18:16Z,Modern slavery from @BrinkNewsNow //t.co/plcx2hpldA,FALSE,FALSE,NA,NA
